Cites,Authors,Title,Year,Source,Publisher,ArticleURL,CitesURL,GSRank,QueryDate,Type,DOI,ISSN,CitationURL,Volume,Issue,StartPage,EndPage,ECC,CitesPerYear,CitesPerAuthor,AuthorCount,Age,Abstract,FullTextURL,RelatedURL
4,"A Aloui, F Delbecq, C De Bellefon, P Sautet","Understanding the influence of hydrogen pressure on the enantioselectivity of hydrogenation: A combined theory-experiment approach",2017,"… of Organometallic Chemistry","Elsevier","https://www.sciencedirect.com/science/article/pii/S0022328X17301183","https://scholar.google.com/scholar?cites=15093793624933462593&as_sdt=2005&sciodt=0,5&hl=en",155,"2025-05-06 22:11:12","","","","",,,,,4,0.50,1,4,8,"… This question was answered by a combination of experiments and DFT calculations. The … The importance of combining DFT calculations with kinetic simulations in unraveling the …","https://escholarship.org/content/qt3wm6m1gn/qt3wm6m1gn_noSplash_15e321114c6d09357cfe87e0d7eb9671.pdf","https://scholar.google.com/scholar?q=related:QfI231Ttd9EJ:scholar.google.com/&scioq=source:%22journal+of+organometallic+chemistry%22+reductive+elimination+dft&hl=en&as_sdt=0,5&as_vis=1"
8,"H Kuniyasu, A Sanagawa, T Nakajima, T Iwasaki…","Halogen exchange by reaction of CpRu (Cl)(PPh3) 2 with MeC (O) X (X= Br, I) and its mechanistic study",2014,"… of Organometallic …","Elsevier","https://www.sciencedirect.com/science/article/pii/S0022328X14003143","https://scholar.google.com/scholar?cites=11752987849590837454&as_sdt=2005&sciodt=0,5&hl=en",156,"2025-05-06 22:11:12","","","","",,,,,8,0.73,2,5,11,"… = 2PPh 3 or CH 2 double bond CH 2 ), consistent with density functional theory (DFT) … TS3 followed by the Cl–C bond-forming reductive elimination to afford 11 via TS4 (Mechanism 3). …","","https://scholar.google.com/scholar?q=related:zhBY4C0AG6MJ:scholar.google.com/&scioq=source:%22journal+of+organometallic+chemistry%22+reductive+elimination+dft&hl=en&as_sdt=0,5&as_vis=1"
1,"Z Han, J Yan, Y Zhu, G Yi, C Liu, D Zhang","Theoretical elucidation of the potential possibility of synthesizing arylboronic acids via Rh-catalytic borylations of aryl acetylene and aryl ethylene",2017,"… of Organometallic Chemistry","Elsevier","https://www.sciencedirect.com/science/article/pii/S0022328X17300013","https://scholar.google.com/scholar?cites=5038514502656108376&as_sdt=2005&sciodt=0,5&hl=en",157,"2025-05-06 22:11:12","","","","",,,,,1,0.13,0,6,8,"… It is found that aryl ethylene prefers to the borylation product via the β-H elimination … DFT calculation results showed diborylation of aryl acetylene and borylation of aryl ethylene …","","https://scholar.google.com/scholar?q=related:WKd4tj5m7EUJ:scholar.google.com/&scioq=source:%22journal+of+organometallic+chemistry%22+reductive+elimination+dft&hl=en&as_sdt=0,5&as_vis=1"
66,"S Bhaduri, S Mukhopadhyay, SA Kulkarni","Density functional studies on chromium catalyzed ethylene trimerization",2009,"… of Organometallic Chemistry","Elsevier","https://www.sciencedirect.com/science/article/pii/S0022328X08008279","https://scholar.google.com/scholar?cites=16361300041995421561&as_sdt=2005&sciodt=0,5&hl=en",158,"2025-05-06 22:11:12","","","","",,,,,66,4.13,22,3,16,"… The reductive 1-hexene elimination process of Scheme 2a, … by using computational (DFT) methodologies. Thus taking … cationic system are reductive elimination reactions where the …","","https://scholar.google.com/scholar?q=related:eYe4yrMDD-MJ:scholar.google.com/&scioq=source:%22journal+of+organometallic+chemistry%22+reductive+elimination+dft&hl=en&as_sdt=0,5&as_vis=1"
3,"RD Adams, Z Luo, M Chen, V Rassolov","Multicenter transformations of the methyl ligand in CH3Os3Au carbonyl cluster complexes: Synthesis, characterization and DFT analyses",2016,"… of Organometallic Chemistry","Elsevier","https://www.sciencedirect.com/science/article/pii/S0022328X15301030","https://scholar.google.com/scholar?cites=4853576987491867359&as_sdt=2005&sciodt=0,5&hl=en",159,"2025-05-06 22:11:12","","","","",,,,,3,0.33,1,4,9,"… The CO dissociation mechanisms related to the CH bond transformation processes were studied by DFT computational analyses. It has been demonstrated that the Os 3 Au(CH 3 ) …","https://www.sciencedirect.com/science/article/am/pii/S0022328X15301030","https://scholar.google.com/scholar?q=related:35p2BY5eW0MJ:scholar.google.com/&scioq=source:%22journal+of+organometallic+chemistry%22+reductive+elimination+dft&hl=en&as_sdt=0,5&as_vis=1"
2,"H Wang, C Liu, D Zhang","Mechanistic study on the Rh (III)-catalyzed synthesis of indolines via selective O-atom transfer of arylnitrones: Origins of the regioselectivity and the improved yield with …",2018,"Journal of Organometallic Chemistry","Elsevier","https://www.sciencedirect.com/science/article/pii/S0022328X17306332","https://scholar.google.com/scholar?cites=1723779407965971313&as_sdt=2005&sciodt=0,5&hl=en",160,"2025-05-06 22:11:12","","","","",,,,,2,0.29,1,3,7,"… Here density functional theory calculations were performed on the mechanism of a representative model system: [Cp*Rh] 2+ -catalyzed reaction of phenylnitrone with 1-phenylpropyne. …","","https://scholar.google.com/scholar?q=related:cePxEj0Y7BcJ:scholar.google.com/&scioq=source:%22journal+of+organometallic+chemistry%22+reductive+elimination+dft&hl=en&as_sdt=0,5&as_vis=1"
9,"Z Zhang, T Yang, P Qin, L Dang","Nickel bis (dithiolene) complexes for electrocatalytic hydrogen evolution: A computational study",2018,"Journal of Organometallic Chemistry","Elsevier","https://www.sciencedirect.com/science/article/pii/S0022328X18301657","https://scholar.google.com/scholar?cites=15374589610778590034&as_sdt=2005&sciodt=0,5&hl=en",161,"2025-05-06 22:11:12","","","","",,,,,9,1.29,2,4,7,"… the kinetics and thermodynamics, we applied DFT computations to explore the substituent … finally releases a hydrogen molecule via reductive elimination. The complexity in possible …","https://zishengz.github.io/assets/pdf/papers/2018jomc.pdf","https://scholar.google.com/scholar?q=related:Unve_cqDXdUJ:scholar.google.com/&scioq=source:%22journal+of+organometallic+chemistry%22+reductive+elimination+dft&hl=en&as_sdt=0,5&as_vis=1"
33,"AV Polukeev, OF Wendt","Iridium complexes with aliphatic, non-innocent pincer ligands",2018,"Journal of Organometallic Chemistry","Elsevier","https://www.sciencedirect.com/science/article/pii/S0022328X17306940","https://scholar.google.com/scholar?cites=10558051941003973549&as_sdt=2005&sciodt=0,5&hl=en",162,"2025-05-06 22:11:12","","","","",,,,,33,4.71,17,2,7,"Pincer complexes attract considerable attention both as interesting objects for fundamental studies and efficient catalysts. This review describes a relatively new offshoot of the field – …","","https://scholar.google.com/scholar?q=related:rVOqJ028hZIJ:scholar.google.com/&scioq=source:%22journal+of+organometallic+chemistry%22+reductive+elimination+dft&hl=en&as_sdt=0,5&as_vis=1"
25,"M Safa, RJ Puddephatt","Organoplatinum complexes with an ester substituted bipyridine ligand: Oxidative addition and supramolecular chemistry",2013,"Journal of Organometallic Chemistry","Elsevier","https://www.sciencedirect.com/science/article/pii/S0022328X12006262","https://scholar.google.com/scholar?cites=1950139371806453108&as_sdt=2005&sciodt=0,5&hl=en",163,"2025-05-06 22:11:12","","","","",,,,,25,2.08,13,2,12,"… We have carried out DFT calculations for all of the possible conformers for each molecule, … The reductive elimination of acetyl iodide or acetic anhydride is a key step in the Monsanto …","","https://scholar.google.com/scholar?q=related:dO0GJ21JEBsJ:scholar.google.com/&scioq=source:%22journal+of+organometallic+chemistry%22+reductive+elimination+dft&hl=en&as_sdt=0,5&as_vis=1"
0,"XW Zheng, Y Zhao, H Liu","Reaction mechanisms of the Rh-catalyzed dehydrogenative aryl–aryl bond formation reaction of tertiary benzamide with bromobenzene: A theoretical study",2016,"Journal of Organometallic Chemistry","Elsevier","https://www.sciencedirect.com/science/article/pii/S0022328X15302229","",164,"2025-05-06 22:11:12","","","","",,,,,0,0.00,0,3,9,"… Density functional theory calculations were performed to understand the detailed … –H bond activations followed by the final reductive elimination. Our theoretical study indicates that PivO …","","https://scholar.google.com/scholar?q=related:CziYaBp8uLQJ:scholar.google.com/&scioq=source:%22journal+of+organometallic+chemistry%22+reductive+elimination+dft&hl=en&as_sdt=0,5&as_vis=1"
13,"DN Neogi, AN Biswas, P Das, R Bhawmick…","Regiospecific C (naphthyl)–H bond activation by platinum (II): Isolation, characterization, reactivity and TD-DFT study of the platinum (II) and platinum (IV) …",2013,"… of Organometallic …","Elsevier","https://www.sciencedirect.com/science/article/pii/S0022328X12006067","https://scholar.google.com/scholar?cites=16080547423444758317&as_sdt=2005&sciodt=0,5&hl=en",165,"2025-05-06 22:11:12","","","","",,,,,13,1.08,3,5,12,"… of detailed study on C–C and C–X reductive elimination reactions from platinum(IV) complexes. Recently, concerted reductive coupling of iodobenzene dichloride at a cis-platinum(IV) …","","https://scholar.google.com/scholar?q=related:LW8_6K6UKd8J:scholar.google.com/&scioq=source:%22journal+of+organometallic+chemistry%22+reductive+elimination+dft&hl=en&as_sdt=0,5&as_vis=1"
1,"JX Mao, RT Mathers, K Damodaran","NMR spectroscopic and computational investigations of RuHCl (CO)(PPh3) 3 catalyzed isomerization of 1, 4-cyclohexadiene",2013,"Journal of Organometallic Chemistry","Elsevier","https://www.sciencedirect.com/science/article/pii/S0022328X1300394X","https://scholar.google.com/scholar?cites=17761482476677066958&as_sdt=2005&sciodt=0,5&hl=en",166,"2025-05-06 22:11:12","","","","",,,,,1,0.08,0,3,12,"… Subsequently, reductive elimination at a β-carbon allows isomerization of an alkene to an … Calculations for the mechanism were carried out at Density Functional Theory (DFT) level with …","https://www.academia.edu/download/79250631/j.jorganchem.2013.05.01520220121-27472-1nb24sv.pdf","https://scholar.google.com/scholar?q=related:znCpSjV2ffYJ:scholar.google.com/&scioq=source:%22journal+of+organometallic+chemistry%22+reductive+elimination+dft&hl=en&as_sdt=0,5&as_vis=1"
12,"N Ahmed","Recent advances and emerging opportunities in mechanism and applications of earth abundant manganese-catalysts for sustainable organic transformations",2024,"Journal of Organometallic Chemistry","Elsevier","https://www.sciencedirect.com/science/article/pii/S0022328X24000664","https://scholar.google.com/scholar?cites=2157725378417295432&as_sdt=2005&sciodt=0,5&hl=en",167,"2025-05-06 22:11:12","","","","",,,,,12,12.00,12,1,1,"… of their less stability, which makes reductive elimination difficult. Many homogeneous manganese … After combining observations with DFT calculations, looked into the mechanism of the …","","https://scholar.google.com/scholar?q=related:SIBor8zH8R0J:scholar.google.com/&scioq=source:%22journal+of+organometallic+chemistry%22+reductive+elimination+dft&hl=en&as_sdt=0,5&as_vis=1"
12,"M Alisha, RM Philip, G Anilkumar","An overview of rhodium-catalysed heck type reactions",2022,"Journal of Organometallic Chemistry","Elsevier","https://www.sciencedirect.com/science/article/pii/S0022328X21005283","https://scholar.google.com/scholar?cites=4334777097419206455&as_sdt=2005&sciodt=0,5&hl=en",168,"2025-05-06 22:11:12","","","","",,,,,12,4.00,4,3,3,"Heck coupling has emerged as a powerful tool for Csingle bondC bond construction in organic chemistry. Traditionally, Heck reactions were catalysed by Pd, however sufficient …","","https://scholar.google.com/scholar?q=related:N68rsM04KDwJ:scholar.google.com/&scioq=source:%22journal+of+organometallic+chemistry%22+reductive+elimination+dft&hl=en&as_sdt=0,5&as_vis=1"
10,"F Mastrocinque, CM Anderson, AM Elkafas…","Synthesis, characterization, and photophysical properties of cyclometalated N-Heterocyclic carbene platinum (II) complexes",2019,"… of Organometallic …","Elsevier","https://www.sciencedirect.com/science/article/pii/S0022328X18308210","https://scholar.google.com/scholar?cites=12893342490465350776&as_sdt=2005&sciodt=0,5&hl=en",169,"2025-05-06 22:11:12","","","","",,,,,10,1.67,3,4,6,"Thiophene and benzothiophene ligands containing N-heterocyclic carbene (NHC) moieties were used to synthesize five and six-membered Pt(II) metallacycles. Ligand scaffolding was …","https://www.sciencedirect.com/science/article/am/pii/S0022328X18308210","https://scholar.google.com/scholar?q=related:eDSj565a7rIJ:scholar.google.com/&scioq=source:%22journal+of+organometallic+chemistry%22+reductive+elimination+dft&hl=en&as_sdt=0,5&as_vis=1"
28,"C Fliedel, R Poli","Homolytically weak metal-carbon bonds make robust controlled radical polymerizations systems for “less-activated monomers”",2019,"Journal of Organometallic Chemistry","Elsevier","https://www.sciencedirect.com/science/article/pii/S0022328X18308714","https://scholar.google.com/scholar?cites=16542309635795983681&as_sdt=2005&sciodt=0,5&hl=en",170,"2025-05-06 22:11:12","","","","",,,,,28,4.67,14,2,6,"… in order to avoid the competing reductive elimination process. … DFT calculations suggest that the Cr III single bond PVAc … The DFT calculations suggest that the Co III single bond C …","https://hal.science/hal-02121118/file/J.%20Organomet.%20Chem.%2C%202019%2C%20880%2C%20241.pdf","https://scholar.google.com/scholar?q=related:QR0kBvgWkuUJ:scholar.google.com/&scioq=source:%22journal+of+organometallic+chemistry%22+reductive+elimination+dft&hl=en&as_sdt=0,5&as_vis=1"
29,"X Tian, J Lin, S Zou, J Lv, Q Huang, J Zhu…",": Efficient bulky Pd-NHC catalyst for Buchwald-Hartwig CN cross-coupling reaction",2018,"… of Organometallic …","Elsevier","https://www.sciencedirect.com/science/article/pii/S0022328X18301347","https://scholar.google.com/scholar?cites=13884818636952377083&as_sdt=2005&sciodt=0,5&hl=en",171,"2025-05-06 22:11:12","Pd (IPr* R)(acac) Cl","","","",,,,,29,4.14,4,7,7,"… The steric hindrance facilitated reductive elimination and stabilization of a low-valent active … The density functional theory (DFT) [13] at the gradient-corrected correlation functional …","","https://scholar.google.com/scholar?q=related:-xZFQvzIsMAJ:scholar.google.com/&scioq=source:%22journal+of+organometallic+chemistry%22+reductive+elimination+dft&hl=en&as_sdt=0,5&as_vis=1"
15,"A Gruenwald, D Munz","How to tame a palladium terminal imido",2018,"Journal of Organometallic Chemistry","Elsevier","https://www.sciencedirect.com/science/article/pii/S0022328X17307325","https://scholar.google.com/scholar?cites=129257790940974385&as_sdt=2005&sciodt=0,5&hl=en",172,"2025-05-06 22:11:12","","","","",,,,,15,2.14,8,2,7,"… This computational study elucidates the electronic structure of palladium(II) and palladium(IV) terminal imido complexes by CASSCF as well as DFT calculations. In search of stable …","","https://scholar.google.com/scholar?q=related:MQ19qUY3ywEJ:scholar.google.com/&scioq=source:%22journal+of+organometallic+chemistry%22+reductive+elimination+dft&hl=en&as_sdt=0,5&as_vis=1"
22,"EC Volpe, AR Chadeayne, PT Wolczanski…","Heterolytic CH-bond activation in the synthesis of Ni {(2-aryl-κC2) pyridine-κN} 2 and derivatives",2007,"… of Organometallic …","Elsevier","https://www.sciencedirect.com/science/article/pii/S0022328X07004251","https://scholar.google.com/scholar?cites=8726874916697531871&as_sdt=2005&sciodt=0,5&hl=en",173,"2025-05-06 22:11:12","","","","",,,,,22,1.22,6,4,18,"… 3a and 4a, and a brief DFT study of 3a confirmed its low spin … , evidence of reductive elimination and degradation was found… between a non-productive reductive elimination path, and an …","https://www.academia.edu/download/50040503/j.jorganchem.2007.06.04720161101-18764-1oih200.pdf","https://scholar.google.com/scholar?q=related:3-UF8X8WHHkJ:scholar.google.com/&scioq=source:%22journal+of+organometallic+chemistry%22+reductive+elimination+dft&hl=en&as_sdt=0,5&as_vis=1"
44,"M Besora, AAC Braga, WMC Sameera, J Urbano…","A computational view on the reactions of hydrocarbons with coinage metal complexes",2015,"… of Organometallic …","Elsevier","https://www.sciencedirect.com/science/article/pii/S0022328X14004732","https://scholar.google.com/scholar?cites=2277978047947931715&as_sdt=2005&sciodt=0,5&hl=en",174,"2025-05-06 22:11:12","","","","",,,,,44,4.40,9,5,10,"… DFT calculations allow the characterization of these intermediates and of their reactivity with … processes such as oxidative addition/reductive elimination, sigma bond metathesis or …","","https://scholar.google.com/scholar?q=related:QwATIvcAnR8J:scholar.google.com/&scioq=source:%22journal+of+organometallic+chemistry%22+reductive+elimination+dft&hl=en&as_sdt=0,5&as_vis=1"
24,"DA Loginov, AO Belova, AV Vologzhanina…","Cationic iridacarboranes [3-(arene)-3, 1, 2-IrC2B9H11]+ and [3-(MeCN) 3-3, 1, 2-IrC2B9H11]+: Synthesis, reactivity, and bonding. Catalysis of oxidative coupling of …",2015,"… of Organometallic …","Elsevier","https://www.sciencedirect.com/science/article/pii/S0022328X15000455","https://scholar.google.com/scholar?cites=15514915710598943550&as_sdt=2005&sciodt=0,5&hl=en",175,"2025-05-06 22:11:12","","","","",,,,,24,2.40,6,4,10,"Cationic iridacarboranes [3-(arene)-3,1,2-IrC2B9H11]+ and [3-(MeCN)3-3,1,2-IrC2B9H11]+: Synthesis, reactivity, and bonding. Catalysis of oxidative coupling of benzoic acid with …","","https://scholar.google.com/scholar?q=related:PpNgIqMNUNcJ:scholar.google.com/&scioq=source:%22journal+of+organometallic+chemistry%22+reductive+elimination+dft&hl=en&as_sdt=0,5&as_vis=1"
42,"S Schwieger, R Herzog, C Wagner…","Platina-β-diketones as catalysts for hydrosilylation and their reactivity towards hydrosilanes",2009,"… Organometallic Chemistry","Elsevier","https://www.sciencedirect.com/science/article/pii/S0022328X09004768","https://scholar.google.com/scholar?cites=15462893276369406851&as_sdt=2005&sciodt=0,5&hl=en",176,"2025-05-06 22:11:12","","","","",,,,,42,2.63,11,4,16,"… DFT calculations gave insight into the reason for this different reactivity and into the course of reaction. For comparison, the reaction of 1 with bis(2-picolyl)amine was performed …","","https://scholar.google.com/scholar?q=related:g0vGSYI7l9YJ:scholar.google.com/&scioq=source:%22journal+of+organometallic+chemistry%22+reductive+elimination+dft&hl=en&as_sdt=0,5&as_vis=1"
10,"P Majumder, P Paul, P Sengupta…","Formation of organopalladium complexes via C–Br and C–C bond activation. Application in C–C and C–N coupling reactions",2013,"… Organometallic Chemistry","Elsevier","https://www.sciencedirect.com/science/article/pii/S0022328X13001903","https://scholar.google.com/scholar?cites=10331019800100254409&as_sdt=2005&sciodt=0,5&hl=en",177,"2025-05-06 22:11:12","","","","",,,,,10,0.83,3,4,12,"… This key step is followed by the coupling of reactants, reductive elimination of the newly … complexes were carried out by density functional theory (DFT) method using the Gaussian 03 (…","","https://scholar.google.com/scholar?q=related:ybKAqMUnX48J:scholar.google.com/&scioq=source:%22journal+of+organometallic+chemistry%22+reductive+elimination+dft&hl=en&as_sdt=0,5&as_vis=1"
6,"M Horáček, R Gyepes, I Císařová, J Pinkas…","Intramolecular activation of a pendant nitrile group in Ti and Zr metallocene complexes",2015,"… of Organometallic …","Elsevier","https://www.sciencedirect.com/science/article/pii/S0022328X15002223","https://scholar.google.com/scholar?cites=11617632384152452844&as_sdt=2005&sciodt=0,5&hl=en",178,"2025-05-06 22:11:12","","","","",,,,,6,0.60,1,5,10,"… reductive elimination. Such a behaviour of group 4 metallocene dialkyls capable of β-hydrogen elimination … in 3, we have performed DFT computational analysis for complexes 3, 3′ …","","https://scholar.google.com/scholar?q=related:7D57vBkfOqEJ:scholar.google.com/&scioq=source:%22journal+of+organometallic+chemistry%22+reductive+elimination+dft&hl=en&as_sdt=0,5&as_vis=1"
35,"M Leist, C Kerner, LT Ghoochany, S Farsadpour…","Roll-over cyclometalation: A versatile tool to enhance the catalytic activity of transition metal complexes",2018,"… of Organometallic …","Elsevier","https://www.sciencedirect.com/science/article/pii/S0022328X18301906","https://scholar.google.com/scholar?cites=17689137218609364877&as_sdt=2005&sciodt=0,5&hl=en",179,"2025-05-06 22:11:12","","","","",,,,,35,5.00,7,5,7,"Roll-over cyclometalation is a special case of cyclometalation. While in classical cyclometalation, C,H-activation (deprotonation or oxidative addition) has to occur at the ligand to result …","","https://scholar.google.com/scholar?q=related:jT9aSpRwfPUJ:scholar.google.com/&scioq=source:%22journal+of+organometallic+chemistry%22+reductive+elimination+dft&hl=en&as_sdt=0,5&as_vis=1"
41,"S Ito, S Kusano, N Morita, K Mikami…","Ligand effect of bulky 2, 2-dialkyl-1-phosphaethenes on Au-catalyzed cycloisomerization of 1, 6-enynes and lactonization of pent-4-ynoic acids",2010,"… Organometallic Chemistry","Elsevier","https://www.sciencedirect.com/science/article/pii/S0022328X09006433","https://scholar.google.com/scholar?cites=1404241157339883413&as_sdt=2005&sciodt=0,5&hl=en",180,"2025-05-06 22:11:12","","","","",,,,,41,2.73,8,5,15,"… The reaction mechanisms are discussed based on DFT calculations. In addition to the … .0]hept-5-ene [8b] after reductive elimination in the cycloisomerization, although no experimental …","https://www.academia.edu/download/99975680/j.jorganchem.2009.09.04020230317-1-3b94ff.pdf","https://scholar.google.com/scholar?q=related:lSc6guTdfBMJ:scholar.google.com/&scioq=source:%22journal+of+organometallic+chemistry%22+reductive+elimination+dft&hl=en&as_sdt=0,5&as_vis=1"
16,"S Shamna, J Fairoosa, CMA Afsina…","Palladium-catalysed hydrosilylation of unsaturated compounds",2022,"… Organometallic Chemistry","Elsevier","https://www.sciencedirect.com/science/article/pii/S0022328X2100557X","https://scholar.google.com/scholar?cites=6381958172138723750&as_sdt=2005&sciodt=0,5&hl=en",181,"2025-05-06 22:11:12","","","","",,,,,16,5.33,4,4,3,"… The metal centre activates the hydrosilanes and allenes simultaneously or subsequently to produce a π-allyl metal hydride intermediate and the following reductive elimination provides …","","https://scholar.google.com/scholar?q=related:ptm6_SRFkVgJ:scholar.google.com/&scioq=source:%22journal+of+organometallic+chemistry%22+reductive+elimination+dft&hl=en&as_sdt=0,5&as_vis=1"
42,"RA Fischer, D Weiß, M Winter, I Müller…","The reaction of the group-13 alkyls ER3 (E= Al, Ga, In; R= CH2t-Bu, CH2 SiMe3) with the platinum-complex [(dcpe) Pt (H)(CH2t-Bu)]",2004,"… of organometallic …","Elsevier","https://www.sciencedirect.com/science/article/pii/S0022328X04007557","https://scholar.google.com/scholar?cites=1215050463941852758&as_sdt=2005&sciodt=0,5&hl=en",182,"2025-05-06 22:11:12","","","","",,,,,42,2.00,8,5,21,"… A brief DFT analysis of the bonding situation of the model … One possibility is the intramolecular reductive elimination of … followed by the again intramolecular reductive elimination of the (R…","","https://scholar.google.com/scholar?q=related:Vn5tl_W53BAJ:scholar.google.com/&scioq=source:%22journal+of+organometallic+chemistry%22+reductive+elimination+dft&hl=en&as_sdt=0,5&as_vis=1"
3,"E Grobbelaar, J Conradie, JA Venter, W Purcell…","A kinetic investigation of the oxidative addition reactions of the dimeric Bu4N [Ir2 (μ-Dcbp)(CO) 2 (PCy3) 2] complex with iodomethane",2011,"… of Organometallic …","Elsevier","https://www.sciencedirect.com/science/article/pii/S0022328X10006741","https://scholar.google.com/scholar?cites=17945369535551160520&as_sdt=2005&sciodt=0,5&hl=en",183,"2025-05-06 22:11:12","","","","",,,,,3,0.21,1,5,14,"… DFT calculations successfully identified the stereochemistry of … Reductive elimination of the CH 3 COI group with the … may then be activated for reductive elimination which can be very …","https://www.academia.edu/download/57865603/j.jorganchem.2010.10.04920181127-13630-k68dwo.pdf","https://scholar.google.com/scholar?q=related:yMCkkYPCCvkJ:scholar.google.com/&scioq=source:%22journal+of+organometallic+chemistry%22+reductive+elimination+dft&hl=en&as_sdt=0,5&as_vis=1"
10,"F Gholami, S Ansari, B Larijani, M Mahdavi","Xanthates routes to sulfur-containing heterocycles",2023,"… of Organometallic Chemistry","Elsevier","https://www.sciencedirect.com/science/article/pii/S0022328X23000517","https://scholar.google.com/scholar?cites=1892632557032930473&as_sdt=2005&sciodt=0,5&hl=en",184,"2025-05-06 22:11:12","","","","",,,,,10,5.00,3,4,2,"… Next, 16 underwent reductive elimination of CuBr to generate intermediate 17, which could … happen in the course of a final reductive elimination with the regeneration of CuBr. This final …","","https://scholar.google.com/scholar?q=related:qXxJdEj7QxoJ:scholar.google.com/&scioq=source:%22journal+of+organometallic+chemistry%22+reductive+elimination+dft&hl=en&as_sdt=0,5&as_vis=1"
15,"D Gattaiah, AS Reddy, SA Khan, KCK Swamy","Reactions of alkynes-copper-catalyzed cyclization of functionalized alkynes with elemental sulfur/selenium to form oxathiines/oxaselenines",2019,"… Organometallic Chemistry","Elsevier","https://www.sciencedirect.com/science/article/pii/S0022328X18310076","https://scholar.google.com/scholar?cites=10109902896186237195&as_sdt=2005&sciodt=0,5&hl=en",185,"2025-05-06 22:11:12","","","","",,,,,15,2.50,4,4,6,"In this article, a part of the work related to the reactivity of alkynes from our group will be highlighted. These include (i) [Pd]-catalyzed double arylation and phosphonylation of …","","https://scholar.google.com/scholar?q=related:C6HfmB6XTYwJ:scholar.google.com/&scioq=source:%22journal+of+organometallic+chemistry%22+reductive+elimination+dft&hl=en&as_sdt=0,5&as_vis=1"
