Cites,Authors,Title,Year,Source,Publisher,ArticleURL,CitesURL,GSRank,QueryDate,Type,DOI,ISSN,CitationURL,Volume,Issue,StartPage,EndPage,ECC,CitesPerYear,CitesPerAuthor,AuthorCount,Age,Abstract,FullTextURL,RelatedURL
6,"Q Ren, D Zhang, L Zheng","DFT studies on the mechanisms of enantioselective Ni-catalyzed reductive coupling reactions to form 1, 1-diarylalkanes",2021,"Journal of Organometallic Chemistry","Elsevier","https://www.sciencedirect.com/science/article/pii/S0022328X21003636","https://scholar.google.com/scholar?cites=15009808220911731696&as_sdt=2005&sciodt=0,5&hl=en",1,"2025-05-06 22:11:12","","","","",,,,,6,1.50,2,3,4,"… catalyzed reductive coupling of 5-bromide-2-methoxypyridine (R 1 ) and (1-chloropropyl) benzene (R 2 ) to form 1,1-diarylalkanes (R, S)-P were studied using Density Functional Theory …","","https://scholar.google.com/scholar?q=related:8IMuMg2NTdAJ:scholar.google.com/&scioq=source:%22journal+of+organometallic+chemistry%22+reductive+elimination+dft&hl=en&as_sdt=0,5&as_vis=1"
40,"Q Ren, F Jiang, H Gong","DFT study of the single electron transfer mechanisms in Ni-Catalyzed reductive cross-coupling of aryl bromide and alkyl bromide",2014,"Journal of Organometallic Chemistry","Elsevier","https://www.sciencedirect.com/science/article/pii/S0022328X14003994","https://scholar.google.com/scholar?cites=7255880985182398266&as_sdt=2005&sciodt=0,5&hl=en",2,"2025-05-06 22:11:12","","","","",,,,,40,3.64,13,3,11,"… alkyl–alkyl Suzuki cross-coupling using DFT calculations and found a single electron transfer … of Ni-catalyzed reductive homocoupling of aryl halides using DFT calculations and also did …","","https://scholar.google.com/scholar?q=related:OudODlARsmQJ:scholar.google.com/&scioq=source:%22journal+of+organometallic+chemistry%22+reductive+elimination+dft&hl=en&as_sdt=0,5&as_vis=1"
45,"A Ariafard, BF Yates","In-depth insight into the electronic and steric effects of phosphine ligands on the mechanism of the R–R reductive elimination from (PR3) 2PdR2",2009,"Journal of Organometallic Chemistry","Elsevier","https://www.sciencedirect.com/science/article/pii/S0022328X09001132","https://scholar.google.com/scholar?cites=12390210103801998678&as_sdt=2005&sciodt=0,5&hl=en",3,"2025-05-06 22:11:12","","","","",,,,,45,2.81,23,2,16,"… DFT calculations on the ease of reductive elimination of R–R′ from (PH 3 ) 2 Pd(R)(R′) and concluded that, in agreement with the experimental data, the reductive elimination of two …","","https://scholar.google.com/scholar?q=related:Vu2SeXHe8qsJ:scholar.google.com/&scioq=source:%22journal+of+organometallic+chemistry%22+reductive+elimination+dft&hl=en&as_sdt=0,5&as_vis=1"
3,"Q Ren, D Zhang, G Zhou","DFT studies on the mechanisms of nickel-catalyzed reductive-coupling cyanation of aryl bromide",2022,"Journal of Organometallic Chemistry","Elsevier","https://www.sciencedirect.com/science/article/pii/S0022328X22001164","https://scholar.google.com/scholar?cites=754895611692146391&as_sdt=2005&sciodt=0,5&hl=en",4,"2025-05-06 22:11:12","","","","",,,,,3,1.00,1,3,3,"… 2-methyl-2-phenylmalononitrile (MPMN) through the reductive-coupling reactions have been investigated using density functional theory (DFT) calculations. The Ni I catalytic cycle was …","","https://scholar.google.com/scholar?q=related:115pKY_teQoJ:scholar.google.com/&scioq=source:%22journal+of+organometallic+chemistry%22+reductive+elimination+dft&hl=en&as_sdt=0,5&as_vis=1"
11,"H Xie, F Lin, L Yang, X Chen, X Ye, X Tian, Q Lei…","A DFT study on palladium-catalyzed decarboxylative intramolecular aziridination reaction mechanism",2013,"… of Organometallic …","Elsevier","https://www.sciencedirect.com/science/article/pii/S0022328X13006372","https://scholar.google.com/scholar?cites=15168649220636767396&as_sdt=2005&sciodt=0,5&hl=en",5,"2025-05-06 22:11:12","","","","",,,,,11,0.92,1,8,12,"… Finally, the reductive elimination takes place to give product … From complex 15, the reductive elimination occurs via TS 16 … olefin insertion and reductive elimination. The decarboxylation …","","https://scholar.google.com/scholar?q=related:pHSPZhnegdIJ:scholar.google.com/&scioq=source:%22journal+of+organometallic+chemistry%22+reductive+elimination+dft&hl=en&as_sdt=0,5&as_vis=1"
24,"FN Hosseini, A Ariafard, M Rashidi, G Azimi…","… studies of influences of Ni triad metals and solvents on oxidative addition of MeI to [M (CH3) 2 (NH3) 2] complexes and C–C reductive elimination from [M (CH3) 3 …",2011,"… of Organometallic …","Elsevier","https://www.sciencedirect.com/science/article/pii/S0022328X11004797","https://scholar.google.com/scholar?cites=13483866213474634377&as_sdt=2005&sciodt=0,5&hl=en",6,"2025-05-06 22:11:12","","","","",,,,,24,1.71,5,5,14,"… the previous theoretical studies of the S N 2-type oxidation addition reactions, although the reaction mechanisms have been discussed, to the best of our knowledge limited related DFT …","","https://scholar.google.com/scholar?q=related:iQoMbeFQILsJ:scholar.google.com/&scioq=source:%22journal+of+organometallic+chemistry%22+reductive+elimination+dft&hl=en&as_sdt=0,5&as_vis=1"
10,"VHM da Silva, NH Morgon, CRD Correia…","DFT perspective on the selectivity and mechanism of ligand-free Heck reaction involving allylic esters and arenediazonium salts",2019,"Journal of Organometallic …","Elsevier","https://www.sciencedirect.com/science/article/pii/S0022328X19302153","https://scholar.google.com/scholar?cites=15692387378499064313&as_sdt=2005&sciodt=0,5&hl=en",7,"2025-05-06 22:11:12","","","","",,,,,10,1.67,3,4,6,"A density functional theory (DFT) study has been carried out with respect to the cationic and neutral mechanism of ligand-free Heck-Matsuda cross-coupling reaction involving allylic …","","https://scholar.google.com/scholar?q=related:-ZFCzS2PxtkJ:scholar.google.com/&scioq=source:%22journal+of+organometallic+chemistry%22+reductive+elimination+dft&hl=en&as_sdt=0,5&as_vis=1"
1,"H Sakurai, M Sugimoto","Alkyl group dependence of C–Si reductive eliminations from alkyl (silyl) Pt (II) complexes: a density functional study",2004,"Journal of organometallic chemistry","Elsevier","https://www.sciencedirect.com/science/article/pii/S0022328X04002700","https://scholar.google.com/scholar?cites=7422436539966120283&as_sdt=2005&sciodt=0,5&hl=en",8,"2025-05-06 22:11:12","","","","",,,,,1,0.05,1,2,21,"… C–Si reductive elimination from Pt(R)(SiPh 3 )(PMe 3 ) 2 (R=Me, Pr) was theoretically studied with the density functional theory. For comparisons with the experiment, substitution of …","","https://scholar.google.com/scholar?q=related:W2GPFLXKAWcJ:scholar.google.com/&scioq=source:%22journal+of+organometallic+chemistry%22+reductive+elimination+dft&hl=en&as_sdt=0,5&as_vis=1"
8,"S Liu, D Guo, T Liu","DFT study on the rhodium-catalyzed oxidative C–H allylation of benzamides with 1, 3-dienes by ally-to-ally 1, 4-Rh (III) migration",2019,"Journal of Organometallic Chemistry","Elsevier","https://www.sciencedirect.com/science/article/pii/S0022328X19304589","https://scholar.google.com/scholar?cites=12450176553477234010&as_sdt=2005&sciodt=0,5&hl=en",9,"2025-05-06 22:11:12","","","","",,,,,8,1.33,3,3,6,"… Path B undergoes the successive C–H oxidative addition and reductive elimination process to form IV. In path C, III would transform into IV via a σ-complex-assisted metathesis (σ-CAM) …","","https://scholar.google.com/scholar?q=related:Wl3ojJzpx6wJ:scholar.google.com/&scioq=source:%22journal+of+organometallic+chemistry%22+reductive+elimination+dft&hl=en&as_sdt=0,5&as_vis=1"
1,"H Rabaâ, S Ghosh, D Sundholm, JF Halet…","Addition and elimination reactions of H2 in ruthenaborane clusters: A computational study",2014,"… of Organometallic …","Elsevier","https://www.sciencedirect.com/science/article/pii/S0022328X14001132","https://scholar.google.com/scholar?cites=12733517347221095450&as_sdt=2005&sciodt=0,5&hl=en",10,"2025-05-06 22:11:12","","","","",,,,,1,0.09,0,5,11,"… Ruthenaborane clusters have been modelled by performing density functional theory … does not involve any oxidative addition or reductive elimination in this cluster. For F and TS4…","https://hal.science/hal-01017039v1/file/Addition_and_Elimination_Reactions_final.pdf","https://scholar.google.com/scholar?q=related:GkRj7o-KtrAJ:scholar.google.com/&scioq=source:%22journal+of+organometallic+chemistry%22+reductive+elimination+dft&hl=en&as_sdt=0,5&as_vis=1"
17,"JG Andino, H Fan, AR Fout, BC Bailey, MH Baik…","1, 2-CF bond activation of perfluoroarenes and alkylidene isomers of titanium. DFT analysis of the C–F bond activation pathway and rotation of the titanium alkylidene …",2011,"… of Organometallic …","Elsevier","https://www.sciencedirect.com/science/article/pii/S0022328X11004943","https://scholar.google.com/scholar?cites=11304500598230822731&as_sdt=2005&sciodt=0,5&hl=en",11,"2025-05-06 22:11:12","","","","",,,,,17,1.21,3,6,14,"… Single crystal X-Ray crystallographic data obtained for the two isomers of 2 (and syn isomer of 1) are in good agreement with computed DFT-optimized models. Our calculations suggest …","","https://scholar.google.com/scholar?q=related:Sy-9eGan4ZwJ:scholar.google.com/&scioq=source:%22journal+of+organometallic+chemistry%22+reductive+elimination+dft&hl=en&as_sdt=0,5&as_vis=1"
16,"A Bottoni, G Cahiez, M Calvaresi, A Moyeux…","A mechanistic insights into manganese-catalyzed oxidative homocoupling reactions of Grignard reagents: A computational DFT investigation",2016,"… of Organometallic …","Elsevier","https://www.sciencedirect.com/science/article/pii/S0022328X16301723","https://scholar.google.com/scholar?cites=8431098495908774798&as_sdt=2005&sciodt=0,5&hl=en",12,"2025-05-06 22:11:12","","","","",,,,,16,1.78,3,5,9,"… In the present paper we carry out a computational study at the DFT level on the mechanism … 6 and focusing on the oxidative addition and reductive elimination steps. First, we analyze in …","","https://scholar.google.com/scholar?q=related:jgP5gmlHAXUJ:scholar.google.com/&scioq=source:%22journal+of+organometallic+chemistry%22+reductive+elimination+dft&hl=en&as_sdt=0,5&as_vis=1"
37,"T Kinnunen, K Laasonen","Reaction mechanism of the reductive elimination in the catalytic carbonylation of methanol. A density functional study",2001,"Journal of organometallic chemistry","Elsevier","https://www.sciencedirect.com/science/article/pii/S0022328X01008002","https://scholar.google.com/scholar?cites=5580707212950625125&as_sdt=2005&sciodt=0,5&hl=en",13,"2025-05-06 22:11:12","","","","",,,,,37,1.54,19,2,24,"… Reductive elimination, the final step of the Monsanto and Cativa processes, has been studied using the density functional theory … study of the reductive elimination for which even the …","https://www.academia.edu/download/44826735/Reaction_mechanism_of_the_reductive_elim20160417-30003-12rq4k5.pdf","https://scholar.google.com/scholar?q=related:Zdthb6Snck0J:scholar.google.com/&scioq=source:%22journal+of+organometallic+chemistry%22+reductive+elimination+dft&hl=en&as_sdt=0,5&as_vis=1"
17,"S Boonseng, GW Roffe, M Targema, J Spencer…","Rationalization of the mechanism of in situ Pd (0) formation for cross-coupling reactions from novel unsymmetrical pincer palladacycles using DFT calculations",2017,"… of Organometallic …","Elsevier","https://www.sciencedirect.com/science/article/pii/S0022328X17301316","https://scholar.google.com/scholar?cites=841432940878992156&as_sdt=2005&sciodt=0,5&hl=en",14,"2025-05-06 22:11:12","","","","",,,,,17,2.13,3,5,8,"… Density functional theory (DFT) is used to determine the … key steps, transmetallation and reductive elimination. It is found … The DFT results are used to rationalize the catalytic activity of a …","","https://scholar.google.com/scholar?q=related:HJNnN81erQsJ:scholar.google.com/&scioq=source:%22journal+of+organometallic+chemistry%22+reductive+elimination+dft&hl=en&as_sdt=0,5&as_vis=1"
9,"R Liu, Y Tie, X Zhao, J Zhu, J Zou, T Liu","Mechanistic insight into the ruthenium-catalyzed cycloaddition of enynes with alkynes: A theoretical study",2018,"… of Organometallic Chemistry","Elsevier","https://www.sciencedirect.com/science/article/pii/S0022328X18304790","https://scholar.google.com/scholar?cites=10649016422267541452&as_sdt=2005&sciodt=0,5&hl=en",15,"2025-05-06 22:11:12","","","","",,,,,9,1.29,2,6,7,"… Finally, reductive elimination releases the bicyclic product … form compound F, olefin insertion, and the reductive elimination. … Herein, we report our detailed density functional theory (DFT) …","","https://scholar.google.com/scholar?q=related:zNeO4APoyJMJ:scholar.google.com/&scioq=source:%22journal+of+organometallic+chemistry%22+reductive+elimination+dft&hl=en&as_sdt=0,5&as_vis=1"
11,"D Coskun, NŞ Tüzün","A DFT study on the mechanism of Rh-catalyzed competitive 1, 2-versus 1, 3-acyloxy migration followed by [5+ 1] and [4+ 1] cycloadditions of 1, 4-enynes with CO",2017,"Journal of Organometallic Chemistry","Elsevier","https://www.sciencedirect.com/science/article/pii/S0022328X17305375","https://scholar.google.com/scholar?cites=3685870869496652245&as_sdt=2005&sciodt=0,5&hl=en",16,"2025-05-06 22:11:12","","","","",,,,,11,1.38,6,2,8,"… have been extensively investigated using density functional theory (DFT) calculations. All … The acyloxy migration step is found to be the rate determining step from the DFT study and …","","https://scholar.google.com/scholar?q=related:1eFO-AbYJjMJ:scholar.google.com/&scioq=source:%22journal+of+organometallic+chemistry%22+reductive+elimination+dft&hl=en&as_sdt=0,5&as_vis=1"
3,"MG Haghighi, E Sarkissian, H Samouei","Easy Csp2–Csp2 reductive elimination from organoplatinum complexes by electrophilic fluorinating reagents",2022,"… of Organometallic Chemistry","Elsevier","https://www.sciencedirect.com/science/article/pii/S0022328X22000870","https://scholar.google.com/scholar?cites=2101935912708882900&as_sdt=2005&sciodt=0,5&hl=en",17,"2025-05-06 22:11:12","","","","",,,,,3,1.00,1,3,3,"… The mechanism and effects of the ancillary ligands could be investigated by density functional theory (DFT) calculations. As it is shown in Fig. 2, a concerted 3-centered transition state (…","","https://scholar.google.com/scholar?q=related:1EGmeZOTKx0J:scholar.google.com/&scioq=source:%22journal+of+organometallic+chemistry%22+reductive+elimination+dft&hl=en&as_sdt=0,5&as_vis=1"
0,"F Zhao, L Han, T Liu","Mechanistic insight into the ligand-controlled regioselective hydrocarboxylation of aryl olefins with palladium catalyst: A computational study",2023,"Journal of Organometallic Chemistry","Elsevier","https://www.sciencedirect.com/science/article/pii/S0022328X23000335","",18,"2025-05-06 22:11:12","","","","",,,,,0,0.00,0,3,2,"… D and D’, which is followed by the reductive elimination to yield anhydride E and E’ with the … In this detailed density functional theory (DFT) mechanistic study, we tried to explore the …","","https://scholar.google.com/scholar?q=related:AndVq0_vmm8J:scholar.google.com/&scioq=source:%22journal+of+organometallic+chemistry%22+reductive+elimination+dft&hl=en&as_sdt=0,5&as_vis=1"
18,"R Suleiman, A Ibdah, B El Ali","A DFT study of the mechanism of palladium-catalyzed alkoxycarbonylation and aminocarbonylation of alkynes: Hydride versus amine pathways",2011,"Journal of Organometallic Chemistry","Elsevier","https://www.sciencedirect.com/science/article/pii/S0022328X11001409","https://scholar.google.com/scholar?cites=13854286099956834798&as_sdt=2005&sciodt=0,5&hl=en",19,"2025-05-06 22:11:12","","","","",,,,,18,1.29,6,3,14,"… Since it is not possible to determine the corresponding intermediates of the oxidative addition, and the subsequent transition states for the reductive elimination, no energetic data for …","https://www.academia.edu/download/42664823/A_DFT_Study_of_the_Mechanism_of_Palladiu20160213-23147-lj2kr8.pdf","https://scholar.google.com/scholar?q=related:7iGPBM5PRMAJ:scholar.google.com/&scioq=source:%22journal+of+organometallic+chemistry%22+reductive+elimination+dft&hl=en&as_sdt=0,5&as_vis=1"
20,"A Marrone, RH Fish","DFT mechanism studies: biomimetic 1, 4-NADH chemoselective, co-factor regeneration with [Cp* Rh (bpy) H]+, in tandem with the biocatalysis pathways of a core …",2021,"Journal of Organometallic Chemistry","Elsevier","https://www.sciencedirect.com/science/article/pii/S0022328X21001315","https://scholar.google.com/scholar?cites=15055341398925695808&as_sdt=2005&sciodt=0,5&hl=en",20,"2025-05-06 22:11:12","","","","",,,,,20,5.00,10,2,4,"… formally be considered an intramolecular, reductive elimination, because of the concomitant … → η 4 change in hapticity in the Cp*H ligand, the optimized DFT calculations indicated that …","https://www.osti.gov/servlets/purl/1844415","https://scholar.google.com/scholar?q=related:QNsyVzxR79AJ:scholar.google.com/&scioq=source:%22journal+of+organometallic+chemistry%22+reductive+elimination+dft&hl=en&as_sdt=0,5&as_vis=1"
1,"B Ling, YY Jiang, Y Liu, P Liu, R Liu, S Bi","Mechanism and stereospecificity of Z-enamide synthesis from salicylaldehydes with isoxazoles using DFT calculations",2019,"… of Organometallic Chemistry","Elsevier","https://www.sciencedirect.com/science/article/pii/S0022328X19304243","https://scholar.google.com/scholar?cites=14821277579814815549&as_sdt=2005&sciodt=0,5&hl=en",21,"2025-05-06 22:11:12","","","","",,,,,1,0.17,0,6,6,"… has been performed with DFT calculations. The aldehydic C–H … subsequent C–C reductive elimination generate the stable … reductive elimination with an overall barrier of 26.7 kcal/mol. …","","https://scholar.google.com/scholar?q=related:PcdSrm7Br80J:scholar.google.com/&scioq=source:%22journal+of+organometallic+chemistry%22+reductive+elimination+dft&hl=en&as_sdt=0,5&as_vis=1"
13,"K Ahmad, CR Chang, J Li","Theoretical studies on copper-catalyzed arylation of nitrogen heterocycles from benzenediazonium acetate under ligand-free conditions",2018,"Journal of Organometallic Chemistry","Elsevier","https://www.sciencedirect.com/science/article/pii/S0022328X18300068","https://scholar.google.com/scholar?cites=13579628185166395949&as_sdt=2005&sciodt=0,5&hl=en",22,"2025-05-06 22:11:12","","","","",,,,,13,1.86,4,3,7,"… The density functional theory (DFT) method was used to … for oxidative addition/reductive elimination reactions. Activation … higher than oxidative addition/reductive elimination reaction. …","","https://scholar.google.com/scholar?q=related:Lbq57uKHdLwJ:scholar.google.com/&scioq=source:%22journal+of+organometallic+chemistry%22+reductive+elimination+dft&hl=en&as_sdt=0,5&as_vis=1"
7,"M Zanganeh, SJ Hoseini, M Rashidi…","Reaction of allyl bromide with cyclometallated platinum (II) complexes: Unusual kinetic behavior and a novel case of methyl and allyl CC bond reductive elimination",2018,"… of Organometallic …","Elsevier","https://www.sciencedirect.com/science/article/pii/S0022328X17307015","https://scholar.google.com/scholar?cites=14585126085688693521&as_sdt=2005&sciodt=0,5&hl=en",23,"2025-05-06 22:11:12","","","","",,,,,7,1.00,2,4,7,"… reductive eliminations. These observations show that during the time a novel case of Me and allyl CC bond reductive elimination, as … Suggestions are made for these behaviors and DFT …","https://www.academia.edu/download/55547346/My_Paper.pdf","https://scholar.google.com/scholar?q=related:ERPCTebGaMoJ:scholar.google.com/&scioq=source:%22journal+of+organometallic+chemistry%22+reductive+elimination+dft&hl=en&as_sdt=0,5&as_vis=1"
48,"T Bolaño, MA Esteruelas, E Oñate","Osmium–carbon multiple bonds: Reduction and C–C coupling reactions",2011,"Journal of Organometallic Chemistry","Elsevier","https://www.sciencedirect.com/science/article/pii/S0022328X11003044","https://scholar.google.com/scholar?cites=5910206320596370246&as_sdt=2005&sciodt=0,5&hl=en",24,"2025-05-06 22:11:12","","","","",,,,,48,3.43,16,3,14,"… DFT calculations revealed that such a transition state results from the approach of the hydride ligand to the carbyne. As a consequence of the approach process the osmium–hydride–…","","https://scholar.google.com/scholar?q=related:RkNqwFVFBVIJ:scholar.google.com/&scioq=source:%22journal+of+organometallic+chemistry%22+reductive+elimination+dft&hl=en&as_sdt=0,5&as_vis=1"
19,"X Yuan, S Bi, Y Ding, L Liu, M Sun","DFT study of alkene hydrogenation catalyzed by Rh (acac)(CO) 2",2010,"Journal of Organometallic Chemistry","Elsevier","https://www.sciencedirect.com/science/article/pii/S0022328X10001658","https://scholar.google.com/scholar?cites=525722478034369366&as_sdt=2005&sciodt=0,5&hl=en",25,"2025-05-06 22:11:12","","","","",,,,,19,1.27,4,5,15,"… (4) Reductive elimination of ethane occurs directly from a five-coordinate intermediate where the hydride but not the ethyl group occupies the apical position of the square-pyramidal …","","https://scholar.google.com/scholar?q=related:Vjut8c69SwcJ:scholar.google.com/&scioq=source:%22journal+of+organometallic+chemistry%22+reductive+elimination+dft&hl=en&as_sdt=0,5&as_vis=1"
2,"SM Ng, C Zhao, Z Lin","Theoretical studies on the β-hydrogen elimination reactions of palladium and platinum alkoxide complexes containing bidentate ligands",2002,"Journal of organometallic chemistry","Elsevier","https://www.sciencedirect.com/science/article/pii/S0022328X02018983","https://scholar.google.com/scholar?cites=9053944693617859&as_sdt=2005&sciodt=0,5&hl=en",26,"2025-05-06 22:11:12","","","","",,,,,2,0.09,1,3,23,"… by density functional theory … by a reductive elimination reaction pathway leading to the metal-hydride products while complexes with ligand X=CH 3 favor the β-hydrogen elimination …","","https://scholar.google.com/scholar?q=related:w3RHxYMqIAAJ:scholar.google.com/&scioq=source:%22journal+of+organometallic+chemistry%22+reductive+elimination+dft&hl=en&as_sdt=0,5&as_vis=1"
9,"Q Meng, F Wang","Mechanism for Co (dppp)-catalyzed regioselective intermolecular hydroacylation of 1, 3-dienes and benzaldehydes: Insights from density functional calculations",2018,"Journal of Organometallic Chemistry","Elsevier","https://www.sciencedirect.com/science/article/pii/S0022328X18302857","https://scholar.google.com/scholar?cites=13799599536908482598&as_sdt=2005&sciodt=0,5&hl=en",27,"2025-05-06 22:11:12","","","","",,,,,9,1.29,5,2,7,"Density functional theory (DFT) was used to account and evaluate Co(dppp)-catalyzed regioselective intermolecular hydroacylation of 1,3-dienes and benzaldehydes. All species were …","","https://scholar.google.com/scholar?q=related:JjgTWKoGgr8J:scholar.google.com/&scioq=source:%22journal+of+organometallic+chemistry%22+reductive+elimination+dft&hl=en&as_sdt=0,5&as_vis=1"
43,"TR Dugan, PL Holland","New routes to low-coordinate iron hydride complexes: The binuclear oxidative addition of H2",2009,"Journal of organometallic chemistry","Elsevier","https://www.sciencedirect.com/science/article/pii/S0022328X09002526","https://scholar.google.com/scholar?cites=7747030938981705928&as_sdt=2005&sciodt=0,5&hl=en",28,"2025-05-06 22:11:12","","","","",,,,,43,2.69,22,2,16,"… and reductive elimination, especially involving the fundamentally interesting molecule H 2 . … We note that Mössbauer spectroscopy and DFT computations on L tBu FeNNFeL tBu show …","https://pmc.ncbi.nlm.nih.gov/articles/PMC2712230/pdf/nihms111237.pdf","https://scholar.google.com/scholar?q=related:yCj37Zf7gmsJ:scholar.google.com/&scioq=source:%22journal+of+organometallic+chemistry%22+reductive+elimination+dft&hl=en&as_sdt=0,5&as_vis=1"
13,"TR Cundari, BM Prince","DFT study of the reactivity of methane and dioxygen with d10-L2M complexes",2011,"Journal of Organometallic Chemistry","Elsevier","https://www.sciencedirect.com/science/article/pii/S0022328X11003706","https://scholar.google.com/scholar?cites=6603287387247255306&as_sdt=2005&sciodt=0,5&hl=en",29,"2025-05-06 22:11:12","","","","",,,,,13,0.93,7,2,14,"… These researchers observe facile C–C reductive elimination (the microscopic reverse of oxidation addition), which is consistent with the endergonic nature and high kinetic barriers …","","https://scholar.google.com/scholar?q=related:Cp-wmuSWo1sJ:scholar.google.com/&scioq=source:%22journal+of+organometallic+chemistry%22+reductive+elimination+dft&hl=en&as_sdt=0,5&as_vis=1"
6,"MV Parkes, WD Bailey, KI Goldberg…","The Effect of the cis-donor in pincer ligands on hydrogenolysis of Pd-OH: A DFT study",2017,"… Organometallic Chemistry","Elsevier","https://www.sciencedirect.com/science/article/pii/S0022328X17302644","https://scholar.google.com/scholar?cites=1812006812449184350&as_sdt=2005&sciodt=0,5&hl=en",30,"2025-05-06 22:11:12","","","","",,,,,6,0.75,2,4,8,"… DFT methods. Two possible mechanistic pathways -- oxidative addition/reductive elimination … in energy than an oxidative addition/reductive elimination pathway. For a PdOH complex …","https://www.sciencedirect.com/science/article/am/pii/S0022328X17302644","https://scholar.google.com/scholar?q=related:XhqfcpiKJRkJ:scholar.google.com/&scioq=source:%22journal+of+organometallic+chemistry%22+reductive+elimination+dft&hl=en&as_sdt=0,5&as_vis=1"
7,"X Zhang","Mechanistic study on silver-catalyzed direct amination of unactivated CH bond",2017,"Journal of Organometallic Chemistry","Elsevier","https://www.sciencedirect.com/science/article/pii/S0022328X17300268","https://scholar.google.com/scholar?cites=16394722567189011119&as_sdt=2005&sciodt=0,5&hl=en",31,"2025-05-06 22:11:12","","","","",,,,,7,0.88,7,1,8,"… H bonds in triflamides by density functional theory (DFT). The … (CMD) process and reductive elimination. Thereinto, it is the … Afterwards, the reductive elimination of complex C produces …","","https://scholar.google.com/scholar?q=related:r5ph2E_BheMJ:scholar.google.com/&scioq=source:%22journal+of+organometallic+chemistry%22+reductive+elimination+dft&hl=en&as_sdt=0,5&as_vis=1"
