Cites,Authors,Title,Year,Source,Publisher,ArticleURL,CitesURL,GSRank,QueryDate,Type,DOI,ISSN,CitationURL,Volume,Issue,StartPage,EndPage,ECC,CitesPerYear,CitesPerAuthor,AuthorCount,Age,Abstract,FullTextURL,RelatedURL
9,"B Bhattacharyya, AJ Kalita, AK Guha…","Phosphonate functionalized N-heterocyclic carbene Pd (II) complexes as efficient catalysts for Suzuki-Miyaura cross coupling reaction",2021,"… Organometallic Chemistry","Elsevier","https://www.sciencedirect.com/science/article/pii/S0022328X21003880","https://scholar.google.com/scholar?cites=3484356801228881138&as_sdt=2005&sciodt=0,5&hl=en",247,"2025-05-06 22:11:12","","","","",,,,,9,2.25,2,4,4,"… DFT calculations were performed to decipher the role phosphonate ester or phosphonic acid substituents on the catalytic efficacy. …","","https://scholar.google.com/scholar?q=related:8rz2vwzsWjAJ:scholar.google.com/&scioq=source:%22journal+of+organometallic+chemistry%22+reductive+elimination+dft&hl=en&as_sdt=0,5&as_vis=1"
0,"A Yamamoto","Design of catalytic processes based on studies of elementary processes",2004,"Journal of organometallic chemistry","Elsevier","https://www.sciencedirect.com/science/article/pii/S0022328X04005583","",248,"2025-05-06 22:11:12","","","","",,,,,0,0.00,0,1,21,"… is palladium-catalyzed reductive conversion of allylic … hydride followed by reductive elimination produces the olefin as … of carboxylic anhydride with DFT calculation and proposed a …","","https://scholar.google.com/scholar?q=related:XF4Z2BI4W2IJ:scholar.google.com/&scioq=source:%22journal+of+organometallic+chemistry%22+reductive+elimination+dft&hl=en&as_sdt=0,5&as_vis=1"
0,"T Mayer, P Mayer, HC Böttcher","Reductive NO dimerization to trans-hyponitrite in diruthenium complexes: Intramolecular attack of hyponitrite on a CO ligand",2012,"Journal of Organometallic Chemistry","Elsevier","https://www.sciencedirect.com/science/article/pii/S0022328X11007285","",249,"2025-05-06 22:11:12","","","","",,,,,0,0.00,0,3,13,"The reaction of the electronically and coordinatively unsaturated compounds [Ru 2 (CO) 4 (μ-H)(μ-PBu t 2 )(μ-L 2 )] (1) (RuRu) with nitric oxide afforded four new trans-hyponitrito …","","https://scholar.google.com/scholar?q=related:pfLQBVCGzpQJ:scholar.google.com/&scioq=source:%22journal+of+organometallic+chemistry%22+reductive+elimination+dft&hl=en&as_sdt=0,5&as_vis=1"
8,"T Amakasu, K Sato, Y Ohta, G Kitazawa, H Sato…","CpCo (I)-and Cp* Ru (II) Cl-catalyzed [2+ 2+ 2] cycloadditions of siladiynes and alkynes: A combined experimental and theoretical study",2020,"… of Organometallic …","Elsevier","https://www.sciencedirect.com/science/article/pii/S0022328X19304498","https://scholar.google.com/scholar?cites=6050601475326848136&as_sdt=2005&sciodt=0,5&hl=en",250,"2025-05-06 22:11:12","","","","",,,,,8,1.60,1,6,5,"… Stoichiometric NMR studies as well as DFT calculations … intermediates were analyzed by DFT calculations according to … ), which is followed by reductive elimination to afford the η 2 -…","","https://scholar.google.com/scholar?q=related:iKxP_vsN-FMJ:scholar.google.com/&scioq=source:%22journal+of+organometallic+chemistry%22+reductive+elimination+dft&hl=en&as_sdt=0,5&as_vis=1"
5,"S Kumari, AK Dhara, A Ratnam, K Mawai…","Role of substituents present in bidentate ligand frame of Cu (I) catalysts on Sonogashira cross coupling reactions",2020,"… of Organometallic …","Elsevier","https://www.sciencedirect.com/science/article/pii/S0022328X20302692","https://scholar.google.com/scholar?cites=11668178684565017462&as_sdt=2005&sciodt=0,5&hl=en",251,"2025-05-06 22:11:12","","","","",,,,,5,1.00,1,5,5,"Cu(I) catalysts {[Cu(L 1−4 )Cl(PPh 3 )] where L 1−4 = condensed product of 2-(1-phenylhydrazinyl)-pyridine with different benzaldehydes} were synthesized and characterized by 1 H …","https://www.academia.edu/download/95015345/j.jorganchem.2020.12136720221129-1-1ta38a3.pdf","https://scholar.google.com/scholar?q=related:dlNIZbGy7aEJ:scholar.google.com/&scioq=source:%22journal+of+organometallic+chemistry%22+reductive+elimination+dft&hl=en&as_sdt=0,5&as_vis=1"
12,"S Baksi, DK Seth, H Tadesse, AJ Blake…","Interaction of 2-(2′, 6′-dialkylphenylazo)-4-methylphenols with iridium. C–H activation and migration of alkyl group",2010,"… of Organometallic …","Elsevier","https://www.sciencedirect.com/science/article/pii/S0022328X10000343","https://scholar.google.com/scholar?cites=1024201689221038844&as_sdt=2005&sciodt=0,5&hl=en",252,"2025-05-06 22:11:12","","","","",,,,,12,0.80,2,5,15,"… side of SCE and a reductive response on the negative side. In … of the LUMO, the reductive response is assigned to reduction … carried out by density functional theory (DFT) method using …","","https://scholar.google.com/scholar?q=related:_AJgiAKyNg4J:scholar.google.com/&scioq=source:%22journal+of+organometallic+chemistry%22+reductive+elimination+dft&hl=en&as_sdt=0,5&as_vis=1"
0,"CI Mitan, P Filip, L Delaude, V Dragutan","Mechanistic aspects of the ring-closing enyne metathesis catalyzed by ruthenium-alkylidene complexes",2024,"… of Organometallic Chemistry","Elsevier","https://www.sciencedirect.com/science/article/pii/S0022328X24001852","",253,"2025-05-06 22:11:12","","","","",,,,,0,0.00,0,4,1,"… The DFT study in agreement with the kinetic data suggested that the cycloreversion step VI … to a ruthenacyclohexane followed by reductive elimination a cyclopentadiene (31) arises, in …","","https://scholar.google.com/scholar?q=related:rVWI3Ml5zaMJ:scholar.google.com/&scioq=source:%22journal+of+organometallic+chemistry%22+reductive+elimination+dft&hl=en&as_sdt=0,5&as_vis=1"
25,"A Diefenbach, FM Bickelhaupt","Activation of C–H, C–C and C–I bonds by Pd and cis-Pd (CO) 2I2. Catalyst–substrate adaptation",2005,"Journal of organometallic chemistry","Elsevier","https://www.sciencedirect.com/science/article/pii/S0022328X05001312","https://scholar.google.com/scholar?cites=13468828990900228824&as_sdt=2005&sciodt=0,5&hl=en",254,"2025-05-06 22:11:12","","","","",,,,,25,1.25,13,2,20,"… reactions of methane and ethane C–H, ethane C–C and iodomethane C–I bonds to Pd and cis-Pd(CO) 2 I 2 at the ZORA-BP86/TZ(2)P level of relativistic density functional theory (DFT). …","","https://scholar.google.com/scholar?q=related:2FIXN5vk6roJ:scholar.google.com/&scioq=source:%22journal+of+organometallic+chemistry%22+reductive+elimination+dft&hl=en&as_sdt=0,5&as_vis=1"
23,"GS Astakhov, MM Levitsky, X Bantreil, F Lamaty…","Cu (II)-silsesquioxanes as efficient precatalysts for Chan-Evans-Lam coupling",2020,"… of Organometallic …","Elsevier","https://www.sciencedirect.com/science/article/pii/S0022328X19304656","https://scholar.google.com/scholar?cites=15995439009689755399&as_sdt=2005&sciodt=0,5&hl=en",255,"2025-05-06 22:11:12","","","","",,,,,23,4.60,5,5,5,"Two cage copper(II)silsesquioxanes, namely, tricopper complex (PhSiO 1.5 ) 8 (CuO) 3 (TMEDA) 2 *(MeCN) 3 Cu-1 and hexacopper complex (MeSiO 1,5 ) 12 (CuO) 6 (Py) 6 *TMEDA …","https://hal.science/hal-02389969v1/file/2020-Hal-JOMC.pdf","https://scholar.google.com/scholar?q=related:B9_7Jgg3-90J:scholar.google.com/&scioq=source:%22journal+of+organometallic+chemistry%22+reductive+elimination+dft&hl=en&as_sdt=0,5&as_vis=1"
1,"YC Chang, YC Lee, MF Chang, FE Hong","Heteroatom-substituted secondary phosphine oxides for Suzuki-Miyaura cross-coupling reactions",2016,"… of Organometallic Chemistry","Elsevier","https://www.sciencedirect.com/science/article/pii/S0022328X16300407","https://scholar.google.com/scholar?cites=1225517511598046365&as_sdt=2005&sciodt=0,5&hl=en",256,"2025-05-06 22:11:12","","","","",,,,,1,0.11,0,4,9,"… Density functional theory were employed to examine the electronic properties of HASPO 6a–… is favorable in Suzuki-Miyaura reactions for reductive elimination, one of the three major …","","https://scholar.google.com/scholar?q=related:nXzSCK_pAREJ:scholar.google.com/&scioq=source:%22journal+of+organometallic+chemistry%22+reductive+elimination+dft&hl=en&as_sdt=0,5&as_vis=1"
5,"A Naka, T Mihara, H Kobayashi, M Ishikawa","Platinum-catalyzed reactions of 2, 3-bis (diethylsilyl) thiophene with alkynes",2016,"… of Organometallic Chemistry","Elsevier","https://www.sciencedirect.com/science/article/pii/S0022328X16303783","https://scholar.google.com/scholar?cites=11367654813429335793&as_sdt=2005&sciodt=0,5&hl=en",257,"2025-05-06 22:11:12","","","","",,,,,5,0.56,1,4,9,"… (4) reductive elimination of the platinum species from 5 to yield products 2 and 3 (Scheme 3). … We carried out the DFT calculations with the use of configuration (4–1) consisting of 4, and …","","https://scholar.google.com/scholar?q=related:8Qa3C9MFwp0J:scholar.google.com/&scioq=source:%22journal+of+organometallic+chemistry%22+reductive+elimination+dft&hl=en&as_sdt=0,5&as_vis=1"
7,"T Mihály, M Bette, B Mihály, J Schmidt…","Synthesis, structure and characterization of adenine-based aminocarbene complexes of platinum (II)",2013,"… of Organometallic …","Elsevier","https://www.sciencedirect.com/science/article/pii/S0022328X13003069","https://scholar.google.com/scholar?cites=1761190421572353935&as_sdt=2005&sciodt=0,5&hl=en",258,"2025-05-06 22:11:12","","","","",,,,,7,0.58,1,5,12,"… The electronic structure of these complexes will be further confirmed by DFT calculations as … ) complexes which are prone to reductive C–H elimination with formation of acetyl platinum(II…","","https://scholar.google.com/scholar?q=related:j_-jc1sBcRgJ:scholar.google.com/&scioq=source:%22journal+of+organometallic+chemistry%22+reductive+elimination+dft&hl=en&as_sdt=0,5&as_vis=1"
2,"S Takemoto, M Oshimo, H Matsuzaka","Synthesis and reactivity of dinuclear Cp* Ru tert-butylamido and cyclometallated Bis (trimethylsilyl) amido complexes",2015,"… of Organometallic Chemistry","Elsevier","https://www.sciencedirect.com/science/article/pii/S0022328X15301042","https://scholar.google.com/scholar?cites=5485445284383742408&as_sdt=2005&sciodt=0,5&hl=en",259,"2025-05-06 22:11:12","","","","",,,,,2,0.20,1,3,10,"… and carbene protons and indicates a reversible C–H reductive coupling between the silylcarbene and the hydride moieties, which has been reasonably modeled by DFT calculations. …","","https://scholar.google.com/scholar?q=related:yNmISmw3IEwJ:scholar.google.com/&scioq=source:%22journal+of+organometallic+chemistry%22+reductive+elimination+dft&hl=en&as_sdt=0,5&as_vis=1"
5,"PS Kulyabin, IA Portnyagin, AN Tsarev…","Ansa-zirconocenes bearing 5-NR2-6-alkyl-4-hydrocarbyl-2-methylindenyl moieties: Synthesis, structure, stereoselective polymerization of propylene",2019,"… of Organometallic …","Elsevier","https://www.sciencedirect.com/science/article/pii/S0022328X19301718","https://scholar.google.com/scholar?cites=16569534014353174043&as_sdt=2005&sciodt=0,5&hl=en",260,"2025-05-06 22:11:12","","","","",,,,,5,0.83,1,4,6,"A series of C 2 –symmetric SiMe 2 -bridged bis-indenyl zirconium complexes containing 2-methyl-4-aryl/isopropyl-5-amino/pyrrolyl-6-alkylindenyl fragments have been synthesized and …","","https://scholar.google.com/scholar?q=related:G-5Fm2XP8uUJ:scholar.google.com/&scioq=source:%22journal+of+organometallic+chemistry%22+reductive+elimination+dft&hl=en&as_sdt=0,5&as_vis=1"
10,"M Baron, M Dalla Tiezza, A Carlotto, C Tubaro…","Di (N-heterocyclic carbene) gold (III) imidate complexes obtained by oxidative addition of N-halosuccinimides",2018,"… of Organometallic …","Elsevier","https://www.sciencedirect.com/science/article/pii/S0022328X18301736","https://scholar.google.com/scholar?cites=10453665243173435452&as_sdt=2005&sciodt=0,5&hl=en",261,"2025-05-06 22:11:12","","","","",,,,,10,1.43,2,5,7,"… structure of the major species has been clarified by single crystal X-ray diffraction analysis, while the nature and the properties of the minor one have been investigated by means of DFT …","","https://scholar.google.com/scholar?q=related:PDgzHCfhEpEJ:scholar.google.com/&scioq=source:%22journal+of+organometallic+chemistry%22+reductive+elimination+dft&hl=en&as_sdt=0,5&as_vis=1"
7,"KR Chaudhari, AP Wadawale, VK Jain","Isolation of chloro-bridged arylpalladium complexes,[Pd2Ar2 (μ-Cl) 2 (PR3) 2], in palladium catalyzed C–C cross coupling reaction of triarylbismuth with arylhalides",2012,"… of Organometallic Chemistry","Elsevier","https://www.sciencedirect.com/science/article/pii/S0022328X11006322","https://scholar.google.com/scholar?cites=4970588233689801136&as_sdt=2005&sciodt=0,5&hl=en",262,"2025-05-06 22:11:12","","","","",,,,,7,0.54,2,3,13,"… has been assessed by density functional theory methods [13]… “Ar 2 PdL” undergoes reductive elimination of biaryl (a homo-… transmetallation followed by reductive elimination of biaryls …","","https://scholar.google.com/scholar?q=related:sCHRyakT-0QJ:scholar.google.com/&scioq=source:%22journal+of+organometallic+chemistry%22+reductive+elimination+dft&hl=en&as_sdt=0,5&as_vis=1"
12,"BJ Wik, M Tilset","Oxidatively induced reactions of a diimine platinum (IV) tetramethyl complex",2007,"Journal of organometallic chemistry","Elsevier","https://www.sciencedirect.com/science/article/pii/S0022328X07001817","https://scholar.google.com/scholar?cites=4191419586285147209&as_sdt=2005&sciodt=0,5&hl=en",263,"2025-05-06 22:11:12","","","","",,,,,12,0.67,6,2,18,"The oxidation of the Pt(IV) tetramethyl complex [ArNCHCHNAr]PtMe 4 (Ar=2,6-Me 2 C 6 H 3 ) has been investigated in acetonitrile and dichloromethane. Cyclic voltammetry …","","https://scholar.google.com/scholar?q=related:SRQkGejpKjoJ:scholar.google.com/&scioq=source:%22journal+of+organometallic+chemistry%22+reductive+elimination+dft&hl=en&as_sdt=0,5&as_vis=1"
15,"P Paul, MG Richmond, S Bhattacharya","Iridium-mediated N–H and methyl C–H bond activations in N-(2′, 6′-dimethylphenyl) pyrrole-2-aldimine. Synthesis, characterization and catalytic applications",2014,"… of Organometallic Chemistry","Elsevier","https://www.sciencedirect.com/science/article/pii/S0022328X13005731","https://scholar.google.com/scholar?cites=14639792527058234804&as_sdt=2005&sciodt=0,5&hl=en",264,"2025-05-06 22:11:12","","","","",,,,,15,1.36,5,3,11,"… DFT analyses have been carried out to understand the formation … side of SCE and a reductive response on the negative side (… Based on the composition of the LUMO, the reductive …","","https://scholar.google.com/scholar?q=related:tG25CL39KssJ:scholar.google.com/&scioq=source:%22journal+of+organometallic+chemistry%22+reductive+elimination+dft&hl=en&as_sdt=0,5&as_vis=1"
26,"A Paparo, J Okuda","Carbonite, the dianion of carbon dioxide and its metal complexes",2018,"Journal of Organometallic Chemistry","Elsevier","https://www.sciencedirect.com/science/article/pii/S0022328X17305818","https://scholar.google.com/scholar?cites=3558790175411680083&as_sdt=2005&sciodt=0,5&hl=en",265,"2025-05-06 22:11:12","","","","",,,,,26,3.71,13,2,7,"… However, it might be a crucial intermediate in the reductive activation of CO 2 . This review will track back carbonite and reflect on its relevance to carbon dioxide binding in metal …","","https://scholar.google.com/scholar?q=related:UzOQK89cYzEJ:scholar.google.com/&scioq=source:%22journal+of+organometallic+chemistry%22+reductive+elimination+dft&hl=en&as_sdt=0,5&as_vis=1"
32,"T Chivers, J Konu, JS Ritch, MC Copsey…","New tellurium-containing ring systems",2007,"… of organometallic …","Elsevier","https://www.sciencedirect.com/science/article/pii/S0022328X06009545","https://scholar.google.com/scholar?cites=168221134665103920&as_sdt=2005&sciodt=0,5&hl=en",266,"2025-05-06 22:11:12","","","","",,,,,32,1.78,6,5,18,"… The incentive for this was the prediction from DFT calculations that the Te–Te bond length in … 90% yield, presumably via reductive elimination from the initially formed 26 (Scheme 2) [30]. …","https://www.researchgate.net/profile/Tristram-Chivers/publication/244056516_New_tellurium-containing_ring_systems/links/5c7f2c5b299bf1268d3cde56/New-tellurium-containing-ring-systems.pdf","https://scholar.google.com/scholar?q=related:MDptDzukVQIJ:scholar.google.com/&scioq=source:%22journal+of+organometallic+chemistry%22+reductive+elimination+dft&hl=en&as_sdt=0,5&as_vis=1"
19,"P Hamidizadeh, M Rashidi, SM Nabavizadeh…","Secondary kinetic deuterium isotope effect in oxidative addition reaction of cycloplatinated (II) complexes with MeI",2015,"… of Organometallic …","Elsevier","https://www.sciencedirect.com/science/article/pii/S0022328X15300292","https://scholar.google.com/scholar?cites=11193120081610583307&as_sdt=2005&sciodt=0,5&hl=en",267,"2025-05-06 22:11:12","","","","",,,,,19,1.90,5,4,10,"… NMR spectroscopy ( 1 H and 31 P), and X-ray crystallography (supported by DFT calculations) clearly indicated that in each case the thermodynamic isomer products 2a–2e, with I …","","https://scholar.google.com/scholar?q=related:C62wGGnzVZsJ:scholar.google.com/&scioq=source:%22journal+of+organometallic+chemistry%22+reductive+elimination+dft&hl=en&as_sdt=0,5&as_vis=1"
10,"MJ Hossain, S Rajbangshi, MMM Khan…","Experimental and computational studies on the reaction of silanes with the diphosphine-bridged triruthenium clusters Ru3 (CO) 10 (μ-dppf), Ru3 (CO) 10 (μ-dppm) …",2014,"… of Organometallic …","Elsevier","https://www.sciencedirect.com/science/article/pii/S0022328X14002861","https://scholar.google.com/scholar?cites=15890432270708773154&as_sdt=2005&sciodt=0,5&hl=en",268,"2025-05-06 22:11:12","","","","",,,,,10,0.91,3,4,11,"… all other compounds were optimized by ab initio DFT methods. For those species analyzed … (μ-dppm), whose formation is expected upon reductive elimination of Ph 3 SiH from 7. Here …","","https://scholar.google.com/scholar?q=related:IhEAh_UnhtwJ:scholar.google.com/&scioq=source:%22journal+of+organometallic+chemistry%22+reductive+elimination+dft&hl=en&as_sdt=0,5&as_vis=1"
5,"W Purcell, J Conradie, TT Chiweshe, JA Venter…","Characterization and oxidative addition reactions of rhodium (I) carbonyl cupferrate diphenyl-2-pyridylphoshine complexes",2013,"… of Organometallic …","Elsevier","https://www.sciencedirect.com/science/article/pii/S0022328X13006591","https://scholar.google.com/scholar?cites=10991876585036136473&as_sdt=2005&sciodt=0,5&hl=en",269,"2025-05-06 22:11:12","","","","",,,,,5,0.42,1,5,12,"… or CO insertion, CO association and reductive elimination. Important prerequisites for these metal … Density functional theory (DFT) and calculations were carried out using the ADF (…","https://www.academia.edu/download/44666465/Characterization_and_oxidative_addition_20160412-24280-1g5stsa.pdf","https://scholar.google.com/scholar?q=related:GUADQoT9ipgJ:scholar.google.com/&scioq=source:%22journal+of+organometallic+chemistry%22+reductive+elimination+dft&hl=en&as_sdt=0,5&as_vis=1"
3,"VS Nikonova, NA Korchevin, VV Manuylov…","Unexpected one-pot formation of a selenophene by the reaction of 2, 3-dichloropropene with selenium in hydrazine hydrate–KOH: Spectroscopic monitoring and …",2022,"… of Organometallic …","Elsevier","https://www.sciencedirect.com/science/article/pii/S0022328X22002431","https://scholar.google.com/scholar?cites=12045764022991762259&as_sdt=2005&sciodt=0,5&hl=en",270,"2025-05-06 22:11:12","","","","",,,,,3,1.00,1,4,3,"Unexpected one-pot formation of a selenophene by the reaction of 2,3-dichloropropene with selenium in hydrazine hydrate–KOH: Spectroscopic monitoring and quantum-chemical …","","https://scholar.google.com/scholar?q=related:U7Oaxo4mK6cJ:scholar.google.com/&scioq=source:%22journal+of+organometallic+chemistry%22+reductive+elimination+dft&hl=en&as_sdt=0,5&as_vis=1"
37,"N Turan, K Buldurun, E Bursal, G Mahmoudi","Pd (II)-Schiff base complexes: synthesis, characterization, Suzuki–Miyaura and Mizoroki–Heck cross-coupling reactions, enzyme inhibition and antioxidant activities",2022,"… of Organometallic Chemistry","Elsevier","https://www.sciencedirect.com/science/article/pii/S0022328X22001188","https://scholar.google.com/scholar?cites=4914489108993166817&as_sdt=2005&sciodt=0,5&hl=en",271,"2025-05-06 22:11:12","","","","",,,,,37,12.33,9,4,3,"… Nowadays, a large number of studies have focalized on N-donor ligands, as the strong electron affinity of the N atom affects both reductive elimination and the oxidative addition steps in …","https://papers.ssrn.com/sol3/Delivery.cfm?abstractid=4079239","https://scholar.google.com/scholar?q=related:4U0Qes7FM0QJ:scholar.google.com/&scioq=source:%22journal+of+organometallic+chemistry%22+reductive+elimination+dft&hl=en&as_sdt=0,5&as_vis=1"
13,"E Erdik, EZ Serdar","Reactivity of mixed organozinc and mixed organocopper reagents: 5-A kinetic insight to compare the transfer ability of the same group in copper catalyzed alkylation of …",2012,"Journal of Organometallic Chemistry","Elsevier","https://www.sciencedirect.com/science/article/pii/S0022328X11007431","https://scholar.google.com/scholar?cites=10214677678382358929&as_sdt=2005&sciodt=0,5&hl=en",272,"2025-05-06 22:11:12","","","","",,,,,13,1.00,7,2,13,"A detailed kinetic investigation and activation parameters are reported for copper catalyzed coupling reaction of mixed zincate, n-BuPh 2 ZnMgBr and homozincate, Ph 3 ZnMgBr with n-…","","https://scholar.google.com/scholar?q=related:kaEXkzrTwY0J:scholar.google.com/&scioq=source:%22journal+of+organometallic+chemistry%22+reductive+elimination+dft&hl=en&as_sdt=0,5&as_vis=1"
28,"L Canovese, C Santo, T Scattolin, F Visentin…","Synthesis and characterization of palladacyclopentadiene complexes with N-heterocyclic carbene ligands",2015,"… of Organometallic …","Elsevier","https://www.sciencedirect.com/science/article/pii/S0022328X15300784","https://scholar.google.com/scholar?cites=10034077583474399980&as_sdt=2005&sciodt=0,5&hl=en",273,"2025-05-06 22:11:12","","","","",,,,,28,2.80,6,5,10,"… formed by a sequence of oxidative addition/reductive elimination through a transient Pd(IV) … Thus we preliminarily performed a DFT theoretical study to verify such occurrence. The …","https://iris.unive.it/bitstream/10278/3661663/1/JOM%202015%202%C2%B0.pdf","https://scholar.google.com/scholar?q=related:7JqzO2Y0QIsJ:scholar.google.com/&scioq=source:%22journal+of+organometallic+chemistry%22+reductive+elimination+dft&hl=en&as_sdt=0,5&as_vis=1"
2,"NK Agrawal, SR Dash, K Vanka, M Nethaji…","Reactivity of four coordinate iridium complex towards hydrogen: An experimental and computational study",2022,"… of Organometallic …","Elsevier","https://www.sciencedirect.com/science/article/pii/S0022328X22000651","https://scholar.google.com/scholar?cites=4698096254940986874&as_sdt=2005&sciodt=0,5&hl=en",274,"2025-05-06 22:11:12","","","","",,,,,2,0.67,0,5,3,"… the Ir—H bonds, resulting in reductive elimination of ethane along with regeneration of the … The DFT studies indicate that the generation of the four coordinate species (4) from complex …","","https://scholar.google.com/scholar?q=related:-r1Z_Kb9MkEJ:scholar.google.com/&scioq=source:%22journal+of+organometallic+chemistry%22+reductive+elimination+dft&hl=en&as_sdt=0,5&as_vis=1"
19,"AB Chaplin, AS Weller","The influence of phosphine cone angle on the synthesis and structures of [Rh (PR3)(Binor–S)]+ complexes that show C–C sigma interactions",2013,"Journal of Organometallic Chemistry","Elsevier","https://www.sciencedirect.com/science/article/pii/S0022328X12005645","https://scholar.google.com/scholar?cites=16096354532233805935&as_sdt=2005&sciodt=0,5&hl=en",275,"2025-05-06 22:11:12","","","","",,,,,19,1.58,10,2,12,"… For Rh we have also shown that they undergo reductive elimination of Binor–S readily on addition of exogenous Lewis base, and thus serve as a useful source of the reactive 10-…","","https://scholar.google.com/scholar?q=related:b4CLOCq9Yd8J:scholar.google.com/&scioq=source:%22journal+of+organometallic+chemistry%22+reductive+elimination+dft&hl=en&as_sdt=0,5&as_vis=1"
23,"MT Jan, S Sarkar, S Kuppuswamy, I Ghiviriga…","Synthesis and characterization of a trianionic pincer supported Mo-alkylidene anion and alkyne insertion into a Mo (IV)-Cpincer bond to form metallocyclopropene (η2 …",2011,"… of Organometallic …","Elsevier","https://www.sciencedirect.com/science/article/pii/S0022328X11003615","https://scholar.google.com/scholar?cites=4839089226950060497&as_sdt=2005&sciodt=0,5&hl=en",276,"2025-05-06 22:11:12","","","","",,,,,23,1.64,5,5,14,"… Solid state structural and DFT analyses of a metallocyclopropene. … Deprotonating an existing alkylidene and reductive coupling of terminal alkynes are the two synthetic routes employed …","https://www.academia.edu/download/47095332/j.jorganchem.2011.06.00620160707-6058-ik9cqy.pdf","https://scholar.google.com/scholar?q=related:0SnHaAPmJ0MJ:scholar.google.com/&scioq=source:%22journal+of+organometallic+chemistry%22+reductive+elimination+dft&hl=en&as_sdt=0,5&as_vis=1"
4,"P Devi, M Kannan, A Kumar, S Muthaiah","Dehydrogenative oxidation of alcohols using ruthenium (II) complexes",2022,"… of Organometallic Chemistry","Elsevier","https://www.sciencedirect.com/science/article/pii/S0022328X22002637","https://scholar.google.com/scholar?cites=17463737541344256794&as_sdt=2005&sciodt=0,5&hl=en",277,"2025-05-06 22:11:12","","","","",,,,,4,1.33,1,4,3,"A very efficient, highly atom economical and environmentally benign oxidation of secondary alcohols using three different in situ catalyst systems has been demonstrated. All the three …","","https://scholar.google.com/scholar?q=related:GmN6WsSoW_IJ:scholar.google.com/&scioq=source:%22journal+of+organometallic+chemistry%22+reductive+elimination+dft&hl=en&as_sdt=0,5&as_vis=1"
