Cites,Authors,Title,Year,Source,Publisher,ArticleURL,CitesURL,GSRank,QueryDate,Type,DOI,ISSN,CitationURL,Volume,Issue,StartPage,EndPage,ECC,CitesPerYear,CitesPerAuthor,AuthorCount,Age,Abstract,FullTextURL,RelatedURL
178,"S Kozuch, JML Martin","What makes for a bad catalytic cycle? A theoretical study on the Suzuki− Miyaura reaction within the energetic span model",2011,"ACS Catalysis","ACS Publications","https://pubs.acs.org/doi/abs/10.1021/cs100129u","https://scholar.google.com/scholar?cites=11014273691987608380&as_sdt=2005&sciodt=0,5&hl=en",95,"2025-04-12 13:48:02","","10.1021/cs100129u","","",,,,,178,12.71,89,2,14,"… Therefore, we tested for a small model reaction several DFT … a small benchmark system, and DFT is known for its inability … determining states located in the transmetalation section (C 2 …","https://www.academia.edu/download/55186232/232.pdf","https://scholar.google.com/scholar?q=related:PAPaFZGP2pgJ:scholar.google.com/&scioq=source:%22acs+catalysis%22+transmetalation+dft&hl=en&as_sdt=0,5&as_vis=1"
0,"L Dong, H Chen, X Tan, N Zhang, W Sun, D Li…","Bifunctional Copper Metal–Organic Framework Catalyst for Late-Stage Functionalization of Alkenes",2025,"… Catalysis","ACS Publications","https://pubs.acs.org/doi/abs/10.1021/acscatal.5c00755","",96,"2025-04-12 13:48:02","","10.1021/acscatal.5c00755","","",,,,,0,0.00,0,7,1,"… This is followed by transmetalation and reductive elimination, yielding the three-component … density functional theory (DFT) calculations. GCL guided the density functional theory (DFT) …","","https://scholar.google.com/scholar?q=related:tQIIbJks3M4J:scholar.google.com/&scioq=source:%22acs+catalysis%22+transmetalation+dft&hl=en&as_sdt=0,5&as_vis=1"
21,"C Hu, K Farshadfar, MC Dietl, A Cervantes-Reyes…","Gold-catalyzed [5, 5]-rearrangement",2021,"… Catalysis","ACS Publications","https://pubs.acs.org/doi/abs/10.1021/acscatal.1c01108","https://scholar.google.com/scholar?cites=11683676508384939816&as_sdt=2005&sciodt=0,5&hl=en",97,"2025-04-12 13:48:02","","10.1021/acscatal.1c01108","","",,,,,21,5.25,4,5,4,"… The results of our DFT calculations associated with the corresponding cycloisomerization are summarized in Figure 2. According to our DFT calculations, this transformation occurs by …","","https://scholar.google.com/scholar?q=related:KE_csOHBJKIJ:scholar.google.com/&scioq=source:%22acs+catalysis%22+transmetalation+dft&hl=en&as_sdt=0,5&as_vis=1"
15,"H Yamagishi, J Shimokawa, H Yorimitsu","Utilization of Silanols in Transition Metal-Catalyzed Organic Synthesis",2023,"ACS Catalysis","ACS Publications","https://pubs.acs.org/doi/abs/10.1021/acscatal.3c01504","https://scholar.google.com/scholar?cites=17253810310630752092&as_sdt=2005&sciodt=0,5&hl=en",98,"2025-04-12 13:48:02","","10.1021/acscatal.3c01504","","",,,,,15,7.50,5,3,2,"… DFT calculations suggest that the accelerated transmetalation pathway (blue arrow) of the … II) intermediate 140 is more favorable than the direct transmetalation pathway (red arrow). The …","","https://scholar.google.com/scholar?q=related:XD8eGxDZce8J:scholar.google.com/&scioq=source:%22acs+catalysis%22+transmetalation+dft&hl=en&as_sdt=0,5&as_vis=1"
3,"M G. Alférez, JJ Moreno, MA Gaona, C Maya…","Ligand Postsynthetic Functionalization with Fluorinated Boranes and Implications in Hydrogenation Catalysis",2023,"… catalysis","ACS Publications","https://pubs.acs.org/doi/abs/10.1021/acscatal.3c02764","https://scholar.google.com/scholar?cites=8688138007587570102&as_sdt=2005&sciodt=0,5&hl=en",99,"2025-04-12 13:48:02","","10.1021/acscatal.3c02764","","",,,,,3,1.50,1,5,2,"… This occurs with concomitant regain of indenyl aromaticity, which by analogy to the DFT profile depicted in Figure 3, we attribute to the return of a hydrogen from the C1 position of the …","https://pubs.acs.org/doi/full/10.1021/acscatal.3c02764","https://scholar.google.com/scholar?q=related:tsHTdXx3kngJ:scholar.google.com/&scioq=source:%22acs+catalysis%22+transmetalation+dft&hl=en&as_sdt=0,5&as_vis=1"
33,"YL Pan, HL Zheng, J Wang, C Yang, X Li…","Enantioselective Allylation of Oxocarbenium Ions Catalyzed by Bi(OAc)3/Chiral Phosphoric Acid",2020,"ACS Catalysis","ACS Publications","https://pubs.acs.org/doi/abs/10.1021/acscatal.0c02585","https://scholar.google.com/scholar?cites=12550074541413726762&as_sdt=2005&sciodt=0,5&hl=en",100,"2025-04-12 13:48:02","","10.1021/acscatal.0c02585","","",,,,,33,6.60,6,6,5,"… the C–B bond of 2a by 15 undergoes a transmetalation process to form species 17. Then the … mass spectrometry, deuterium experiment, and DFT calculations. Ongoing studies focus on …","","https://scholar.google.com/scholar?q=related:KnqjYU3SKq4J:scholar.google.com/&scioq=source:%22acs+catalysis%22+transmetalation+dft&hl=en&as_sdt=0,5&as_vis=1"
2,"X Duan, Q Jin, K Wang, Y Sun, Y Wei, Z Wang…","Copper-Catalyzed Site-Selective C(sp2)–H Alkynylation of Allenes",2024,"… Catalysis","ACS Publications","https://pubs.acs.org/doi/abs/10.1021/acscatal.4c03688","https://scholar.google.com/scholar?cites=7846862800589208404&as_sdt=2005&sciodt=0,5&hl=en",101,"2025-04-12 13:48:02","","10.1021/acscatal.4c03688","","",,,,,2,2.00,0,7,1,"… , we conducted density functional theory (DFT) calculations to investigate the transmetalation … Subsequently, the alkynylating reagent (III) undergoes evolution into the transmetalated …","","https://scholar.google.com/scholar?q=related:VLtYhiSo5WwJ:scholar.google.com/&scioq=source:%22acs+catalysis%22+transmetalation+dft&hl=en&as_sdt=0,5&as_vis=1"
3,"G Duran-Camacho, DC Bland, F Li, SR Neufeldt…","Nickel-Based Catalysts for the Selective Monoarylation of Dichloropyridines: Ligand Effects and Mechanistic Insights",2024,"… catalysis","ACS Publications","https://pubs.acs.org/doi/abs/10.1021/acscatal.4c00648","https://scholar.google.com/scholar?cites=10533268823721562089&as_sdt=2005&sciodt=0,5&hl=en",102,"2025-04-12 13:48:02","","10.1021/acscatal.4c00648","","",,,,,3,3.00,1,5,1,"… C(2)–Cl bond of 1a, transmetalation of the boronic acid to form … Density functional theory (DFT) calculations were conducted … the range of what is typical for DFT. Most importantly, the …","https://scholarworks.montana.edu/bitstreams/11430648-e2fc-4939-9e51-bcb8d766b655/download","https://scholar.google.com/scholar?q=related:6c-eATCwLZIJ:scholar.google.com/&scioq=source:%22acs+catalysis%22+transmetalation+dft&hl=en&as_sdt=0,5&as_vis=1"
40,"H Nsiri, I Belaid, P Larini, J Thuilliez, C Boisson…","Ethylene–Butadiene Copolymerization by Neodymocene Complexes: A Ligand Structure/Activity/Polymer Microstructure Relationship Based on DFT Calculations",2016,"… Catalysis","ACS Publications","https://pubs.acs.org/doi/abs/10.1021/acscatal.5b02317","https://scholar.google.com/scholar?cites=12628382620212424931&as_sdt=2005&sciodt=0,5&hl=en",103,"2025-04-12 13:48:02","","10.1021/acscatal.5b02317","","",,,,,40,4.44,7,6,9,"… allyl transmetalation, at least higher than those involved in propagations and alkyl chain transfer, seems to prevent the allyl transfer from occurring, even though this transmetalation is …","","https://scholar.google.com/scholar?q=related:43B6xRUHQa8J:scholar.google.com/&scioq=source:%22acs+catalysis%22+transmetalation+dft&hl=en&as_sdt=0,5&as_vis=1"
34,"Y Long, Z Su, Y Zheng, S He, J Zhong, H Xiang…","Rhodium-catalyzed transarylation of benzamides: C–C bond vs C–N bond activation",2020,"… Catalysis","ACS Publications","https://pubs.acs.org/doi/abs/10.1021/acscatal.9b05214","https://scholar.google.com/scholar?cites=15287727049594681437&as_sdt=2005&sciodt=0,5&hl=en",104,"2025-04-12 13:48:02","","10.1021/acscatal.9b05214","","",,,,,34,6.80,5,7,5,"… Meanwhile, DFT methods were also employed to locate the C–C bond and C–N bond insertion transition states in the oxidative addition step, respectively, for 1a–8a. (13) Their relative …","","https://scholar.google.com/scholar?q=related:Xbg49sDqKNQJ:scholar.google.com/&scioq=source:%22acs+catalysis%22+transmetalation+dft&hl=en&as_sdt=0,5&as_vis=1"
17,"X Liu, H Chen, D Yang, B Hu, Y Hu, S Wang…","Anion-tuning of organozincs steering cobalt-catalyzed radical relay couplings",2023,"… Catalysis","ACS Publications","https://pubs.acs.org/doi/abs/10.1021/acscatal.3c01763","https://scholar.google.com/scholar?cites=1860815210072689314&as_sdt=2005&sciodt=0,5&hl=en",105,"2025-04-12 13:48:02","","10.1021/acscatal.3c01763","","",,,,,17,8.50,2,7,2,"… Density functional theory calculations suggested that the … that exhibit providential reducibility and transmetalation, and (c) mild … Systematic mechanistic studies of DFT calculations and …","","https://scholar.google.com/scholar?q=related:osoGFZPx0hkJ:scholar.google.com/&scioq=source:%22acs+catalysis%22+transmetalation+dft&hl=en&as_sdt=0,5&as_vis=1"
16,"M Boudjelel, O Sadek, S Mallet-Ladeira…","Phosphine–Borane Ligands Induce Chemoselective Activation and Catalytic Coupling of Acyl Chlorides at Palladium",2021,"… Catalysis","ACS Publications","https://pubs.acs.org/doi/abs/10.1021/acscatal.0c04287","https://scholar.google.com/scholar?cites=13390402565790658814&as_sdt=2005&sciodt=0,5&hl=en",106,"2025-04-12 13:48:02","","10.1021/acscatal.0c04287","","",,,,,16,4.00,4,4,4,"… the reaction profiles have been analyzed by density functional theory (DFT) calculations. … The possibility to achieve transmetalation and ultimately cross-coupling was then investigated. …","https://univ-pau.hal.science/hal-03336163/file/ACS%20Catal%20PB%20Pd%20RCOCl.pdf","https://scholar.google.com/scholar?q=related:_nBuLTBE1LkJ:scholar.google.com/&scioq=source:%22acs+catalysis%22+transmetalation+dft&hl=en&as_sdt=0,5&as_vis=1"
12,"MC Aguilera, AR Gogoi, W Lee, L Liu…","Insight into Radical Initiation, Solvent Effects, and Biphenyl Production in Iron–Bisphosphine Cross-Couplings",2023,"… catalysis","ACS Publications","https://pubs.acs.org/doi/abs/10.1021/acscatal.3c02008","https://scholar.google.com/scholar?cites=17939986764267097824&as_sdt=2005&sciodt=0,5&hl=en",107,"2025-04-12 13:48:02","","10.1021/acscatal.3c02008","","",,,,,12,6.00,2,5,2,"… the transmetalation degree of the iron speciation to achieve high yields. We are currently exploring these effects of controlling the transmetalation … proposal based on DFT studies, we …","https://pubs.acs.org/doi/full/10.1021/acscatal.3c02008","https://scholar.google.com/scholar?q=related:4I5Zd-mi9_gJ:scholar.google.com/&scioq=source:%22acs+catalysis%22+transmetalation+dft&hl=en&as_sdt=0,5&as_vis=1"
0,"A Konter, J Rostoll-Berenguer, C Besnard…","Enantioselective Synthesis of Pillar [5] arenes by Dynamic Kinetic Resolution via Pd-Catalyzed Suzuki Cross-Coupling",2025,"… Catalysis","ACS Publications","https://pubs.acs.org/doi/abs/10.1021/acscatal.4c07646","",108,"2025-04-12 13:48:02","","10.1021/acscatal.4c07646","","",,,,,0,0.00,0,4,1,"… case, as shown by the results of DFT calculations carried out on a simplified electrophilic reagent mimicking A1/A2-triflate-aryl-pillar[5]arene 11 (Figure 8A) (DFT: ORCA 6.0.0, see the …","","https://scholar.google.com/scholar?q=related:ZBw1Er4UIKYJ:scholar.google.com/&scioq=source:%22acs+catalysis%22+transmetalation+dft&hl=en&as_sdt=0,5&as_vis=1"
9,"J Bae, W Lee, HS Hwang, S Kim, J Kang, N Iqbal…","Nonclassical Arylative Meyer–Schuster Rearrangement through Ni-Catalyzed Inner-Sphere Acyloxy Migration",2023,"… Catalysis","ACS Publications","https://pubs.acs.org/doi/abs/10.1021/acscatal.3c02374","https://scholar.google.com/scholar?cites=2038335884685969057&as_sdt=2005&sciodt=0,5&hl=en",109,"2025-04-12 13:48:02","","10.1021/acscatal.3c02374","","",,,,,9,4.50,1,7,2,"… 5B is specified using 1a and 2a and is supported by density functional theory (DFT) calculations (Figure 1). The transmetalation of 2a with Ni(OAc) 2 generates a cationic arylnickel …","","https://scholar.google.com/scholar?q=related:oYajA7CfSRwJ:scholar.google.com/&scioq=source:%22acs+catalysis%22+transmetalation+dft&hl=en&as_sdt=0,5&as_vis=1"
26,"S Geng, C Shi, B Guo, H Hou, Z Liu, Z Feng","Recent Progress in Transition-Metal-Catalyzed Reductive Cross-Coupling Reactions Using Diboron Reagents as Reductants",2023,"ACS Catalysis","ACS Publications","https://pubs.acs.org/doi/abs/10.1021/acscatal.3c04342","https://scholar.google.com/scholar?cites=8149534075396695741&as_sdt=2005&sciodt=0,5&hl=en",110,"2025-04-12 13:48:02","","10.1021/acscatal.3c04342","","",,,,,26,13.00,4,6,2,"… Density functional theory (DFT) calculations further supported the observations by … transmetalation of diboron reagents with nickel-based complexes. Conversely, this transmetalation …","","https://scholar.google.com/scholar?q=related:vSb2QBD2GHEJ:scholar.google.com/&scioq=source:%22acs+catalysis%22+transmetalation+dft&hl=en&as_sdt=0,5&as_vis=1"
58,"H Ren, GF Li, B Zhu, XD Lv, LS Yao, XL Wang…","How does iridium (III) photocatalyst regulate nickel (II) catalyst in metallaphotoredox-catalyzed C–S cross-coupling? Theoretical and experimental insights",2019,"… Catalysis","ACS Publications","https://pubs.acs.org/doi/abs/10.1021/acscatal.9b00375","https://scholar.google.com/scholar?cites=1325493618110130655&as_sdt=2005&sciodt=0,5&hl=en",111,"2025-04-12 13:48:02","","10.1021/acscatal.9b00375","","",,,,,58,9.67,8,7,6,"… has been investigated by density functional theory (DFT) calculations and … transmetalation mechanism, which consists of three elementary steps: (i) oxidative addition, (ii) transmetalation…","","https://scholar.google.com/scholar?q=related:32mAQ2wZZRIJ:scholar.google.com/&scioq=source:%22acs+catalysis%22+transmetalation+dft&hl=en&as_sdt=0,5&as_vis=1"
116,"I Funes-Ardoiz, F Maseras","Oxidative coupling mechanisms: current state of understanding",2018,"Acs Catalysis","ACS Publications","https://pubs.acs.org/doi/abs/10.1021/acscatal.7b02974","https://scholar.google.com/scholar?cites=15506452152278520081&as_sdt=2005&sciodt=0,5&hl=en",112,"2025-04-12 13:48:02","","10.1021/acscatal.7b02974","","",,,,,116,16.57,58,2,7,"… contribution from density functional theory (DFT) calculations … main steps: oxidative addition, transmetalation, and reductive … metal coordination sphere by transmetalation. Depending on …","https://pubs.acs.org/doi/full/10.1021/acscatal.7b02974","https://scholar.google.com/scholar?q=related:EREnZxP8MdcJ:scholar.google.com/&scioq=source:%22acs+catalysis%22+transmetalation+dft&hl=en&as_sdt=0,5&as_vis=1"
146,"A Kaga, S Chiba","Engaging radicals in transition metal-catalyzed cross-coupling with alkyl electrophiles: recent advances",2017,"ACS Catalysis","ACS Publications","https://pubs.acs.org/doi/abs/10.1021/acscatal.7b01405","https://scholar.google.com/scholar?cites=15608030079560343227&as_sdt=2005&sciodt=0,5&hl=en",113,"2025-04-12 13:48:02","","10.1021/acscatal.7b01405","","",,,,,146,18.25,73,2,8,"… In fact, the density functional theory (DFT) calculation of the activation energy barriers of … The catalytic cycle could be initiated by transmetalation between transient Ni(I) species 77 and …","https://dr.ntu.edu.sg/bitstream/10356/154876/2/ACS_Catalysis_Chiba_rev_original_deposit.pdf","https://scholar.google.com/scholar?q=related:u17Ol6ncmtgJ:scholar.google.com/&scioq=source:%22acs+catalysis%22+transmetalation+dft&hl=en&as_sdt=0,5&as_vis=1"
0,"K Li, B Leforestier, AI Poblador-Bahamonde…","Ni-Catalyzed Enantioconvergent Kumada–Corriu Cross-Coupling between β-Bromostyrenes and Secondary Grignard Reagents: Reaction Development, Scope and …",2024,"… Catalysis","ACS Publications","https://pubs.acs.org/doi/abs/10.1021/acscatal.4c06360","",114,"2025-04-12 13:48:02","","10.1021/acscatal.4c06360","","",,,,,0,0.00,0,4,1,"… error due to the single reference character of DFT, and should be viewed as a mechanistic … entry point into the catalytic cycle, transmetalation with one equivalent of a dimeric Grignard …","","https://scholar.google.com/scholar?q=related:NscVuUbxMR4J:scholar.google.com/&scioq=source:%22acs+catalysis%22+transmetalation+dft&hl=en&as_sdt=0,5&as_vis=1"
1,"M Kim, S Kim, Y Lee, Y Lee, S Seo, B Jung","Synthesis of (Z)-Allylsilanes by Cu-Catalyzed Regioselective Protosilylation of Allenes via a Single-Electron Process",2025,"ACS Catalysis","ACS Publications","https://pubs.acs.org/doi/abs/10.1021/acscatal.4c07488","https://scholar.google.com/scholar?cites=16392861243770587273&as_sdt=2005&sciodt=0,5&hl=en",115,"2025-04-12 13:48:02","","10.1021/acscatal.4c07488","","",,,,,1,1.00,0,6,1,"… (17) Density functional theory (DFT) calculations revealed that transmetalation between LCu(acac) 2 and PhMe 2 Si–Bpin would be thermodynamically feasible (ΔG = −24.7 kcal/mol), …","","https://scholar.google.com/scholar?q=related:icg2t3Ikf-MJ:scholar.google.com/&scioq=source:%22acs+catalysis%22+transmetalation+dft&hl=en&as_sdt=0,5&as_vis=1"
47,"RK Dhungana, S Kc, P Basnet, V Aryal, LJ Chesley…","Ni (I)-catalyzed β, δ-vinylarylation of γ, δ-alkenyl α-cyanocarboxylic esters via contraction of transient nickellacycles",2019,"… catalysis","ACS Publications","https://pubs.acs.org/doi/abs/10.1021/acscatal.9b03574","https://scholar.google.com/scholar?cites=4268707195830546969&as_sdt=2005&sciodt=0,5&hl=en",116,"2025-04-12 13:48:02","","10.1021/acscatal.9b03574","","",,,,,47,7.83,8,6,6,"… We disclose a transmetalation-initiated Ni(I)-catalyzed regioselective β,δ-vinylarylation of γ,δ-alkenyl α-cyanocarboxylic esters with vinyl triflates and arylzinc reagents. This reaction …","https://pmc.ncbi.nlm.nih.gov/articles/PMC8171255/pdf/nihms-1562460.pdf","https://scholar.google.com/scholar?q=related:GTKi-ZN-PTsJ:scholar.google.com/&scioq=source:%22acs+catalysis%22+transmetalation+dft&hl=en&as_sdt=0,5&as_vis=1"
336,"M Börjesson, T Moragas, D Gallego, R Martin","Metal-Catalyzed Carboxylation of Organic (Pseudo)halides with CO2",2016,"ACS catalysis","ACS Publications","https://pubs.acs.org/doi/abs/10.1021/acscatal.6b02124","https://scholar.google.com/scholar?cites=16927136368248741654&as_sdt=2005&sciodt=0,5&hl=en",117,"2025-04-12 13:48:02","","10.1021/acscatal.6b02124","","",,,,,336,37.33,84,4,9,"… (II)Br oxidative addition complex followed by a final transmetalation with Et 2 Zn, thus forming a … In 2014, a detailed theoretical study using DFT calculations revealed the important role of …","https://pubs.acs.org/doi/full/10.1021/acscatal.6b02124","https://scholar.google.com/scholar?q=related:Ft8P1tdE6eoJ:scholar.google.com/&scioq=source:%22acs+catalysis%22+transmetalation+dft&hl=en&as_sdt=0,5&as_vis=1"
27,"Q Wang, KB Zhong, H Xu, SN Li, WK Zhu, F Ye…","Enantioselective Nickel-Catalyzed Si–C(sp2) Bond Activation and Migratory Insertion to Aldehydes: Reaction Scope and Mechanism",2022,"… Catalysis","ACS Publications","https://pubs.acs.org/doi/abs/10.1021/acscatal.2c00533","https://scholar.google.com/scholar?cites=11780556112715386702&as_sdt=2005&sciodt=0,5&hl=en",118,"2025-04-12 13:48:02","","10.1021/acscatal.2c00533","","",,,,,27,9.00,4,7,3,"… Then, transmetalation with benzosilacyclobutene [Si] occurs to … of this reaction, density functional theory (DFT) calculation using … Transmetalation of 3 with benzosilacyclobutene 4 then …","","https://scholar.google.com/scholar?q=related:Tg_1Ul7xfKMJ:scholar.google.com/&scioq=source:%22acs+catalysis%22+transmetalation+dft&hl=en&as_sdt=0,5&as_vis=1"
83,"L Xu, LW Chung, YD Wu","Mechanism of Ni-NHC catalyzed hydrogenolysis of aryl ethers: roles of the excess base",2016,"ACS Catalysis","ACS Publications","https://pubs.acs.org/doi/abs/10.1021/acscatal.5b02089","https://scholar.google.com/scholar?cites=15663435622215328915&as_sdt=2005&sciodt=0,5&hl=en",119,"2025-04-12 13:48:02","","10.1021/acscatal.5b02089","","",,,,,83,9.22,28,3,9,"… OA step of the inert C–O bond, apart from the transmetalation step (Scheme S3 in the Supporting Information). Our DFT study further indicates that the Ni metal is essential for a low …","http://pstorage-acs-6854636.s3.amazonaws.com/3725311/cs5b02089_si_001.pdf","https://scholar.google.com/scholar?q=related:kyRYwLWzX9kJ:scholar.google.com/&scioq=source:%22acs+catalysis%22+transmetalation+dft&hl=en&as_sdt=0,5&as_vis=1"
30,"L Massignan, C Zhu, X Hou, JCA Oliveira…","Manganaelectro-catalyzed azine C–H arylations and C–H alkylations by assistance of weakly coordinating amides",2021,"… Catalysis","ACS Publications","https://pubs.acs.org/doi/abs/10.1021/acscatal.1c02516","https://scholar.google.com/scholar?cites=4251850508630498238&as_sdt=2005&sciodt=0,5&hl=en",120,"2025-04-12 13:48:02","","10.1021/acscatal.1c02516","","",,,,,30,7.50,6,5,4,"… 2 induces an irreversible redox event likely by transmetalation. Interestingly, in the presence … Intrigued by this stark difference, the catalysts’ mode of action was next studied through DFT …","","https://scholar.google.com/scholar?q=related:vhv8pIKbATsJ:scholar.google.com/&scioq=source:%22acs+catalysis%22+transmetalation+dft&hl=en&as_sdt=0,5&as_vis=1"
129,"M Garcia-Melchor, MC Pacheco, C Najera…","Mechanistic exploration of the Pd-catalyzed copper-free Sonogashira reaction",2012,"… Catalysis","ACS Publications","https://pubs.acs.org/doi/abs/10.1021/cs200526x","https://scholar.google.com/scholar?cites=13811816783420272658&as_sdt=2005&sciodt=0,5&hl=en",121,"2025-04-12 13:48:02","","10.1021/cs200526x","","",,,,,129,9.92,32,4,13,"… reaction is analyzed by means of density functional theory (DFT) calculations on a model … combined experimental and theoretical study on the transmetalation step in a Negishi cross-…","","https://scholar.google.com/scholar?q=related:EjCLti9urb8J:scholar.google.com/&scioq=source:%22acs+catalysis%22+transmetalation+dft&hl=en&as_sdt=0,5&as_vis=1"
76,"ZH Qi, J Ma","Dual role of a photocatalyst: generation of Ni (0) catalyst and promotion of catalytic C–N bond formation",2018,"ACS Catalysis","ACS Publications","https://pubs.acs.org/doi/abs/10.1021/acscatal.7b03024","https://scholar.google.com/scholar?cites=18370799130878977992&as_sdt=2005&sciodt=0,5&hl=en",122,"2025-04-12 13:48:02","","10.1021/acscatal.7b03024","","",,,,,76,10.86,38,2,7,"… The photocatalyst Ir(dFCF 3 ppy) 2 (bpy)PF 6 promotes the transmetalation of … To unveil the nature of dual catalysis, we have carried out DFT calculations to elucidate some interesting …","","https://scholar.google.com/scholar?q=related:yKcYFHow8v4J:scholar.google.com/&scioq=source:%22acs+catalysis%22+transmetalation+dft&hl=en&as_sdt=0,5&as_vis=1"
358,"X Qi, T Diao","Nickel-catalyzed dicarbofunctionalization of alkenes",2020,"ACS catalysis","ACS Publications","https://pubs.acs.org/doi/abs/10.1021/acscatal.0c02115","https://scholar.google.com/scholar?cites=9587365070756913283&as_sdt=2005&sciodt=0,5&hl=en",123,"2025-04-12 13:48:02","","10.1021/acscatal.0c02115","","",,,,,358,71.60,179,2,5,"… The transmetalation of organozinc reagents to the (terpy)Ni catalyst results in a Ni(I) … An alkyl Ni(III) intermediate ligated with (l)-isoleucine derived biOx is proposed based on DFT …","https://pmc.ncbi.nlm.nih.gov/articles/PMC7963398/pdf/nihms-1672717.pdf","https://scholar.google.com/scholar?q=related:gyB0XrwpDYUJ:scholar.google.com/&scioq=source:%22acs+catalysis%22+transmetalation+dft&hl=en&as_sdt=0,5&as_vis=1"
9,"LV Hoff, GA Chesnokov, A Linden, K Gademann","Mechanistic Studies and Data Science-Guided Exploration of Bromotetrazine Cross-Coupling",2022,"ACS Catalysis","ACS Publications","https://pubs.acs.org/doi/abs/10.1021/acscatal.2c01813","https://scholar.google.com/scholar?cites=3919081863810374924&as_sdt=2005&sciodt=0,5&hl=en",124,"2025-04-12 13:48:02","","10.1021/acscatal.2c01813","","",,,,,9,3.00,2,4,3,"… could arise from a preliminary transmetalation from B onto Ag… This case was modeled at the density functional theory (DFT) … differences of the transmetalation in the presented silver-…","https://www.zora.uzh.ch/id/eprint/219484/2/Manuscript_CCMech_final.pdf","https://scholar.google.com/scholar?q=related:DN0X4jBgYzYJ:scholar.google.com/&scioq=source:%22acs+catalysis%22+transmetalation+dft&hl=en&as_sdt=0,5&as_vis=1"
20,"JE Borowski, SH Newman-Stonebraker, AG Doyle","Comparison of monophosphine and bisphosphine precatalysts for Ni-catalyzed Suzuki–Miyaura cross-coupling: Understanding the role of the ligation state in …",2023,"ACS catalysis","ACS Publications","https://pubs.acs.org/doi/abs/10.1021/acscatal.3c01331","https://scholar.google.com/scholar?cites=11122557593551753422&as_sdt=2005&sciodt=0,5&hl=en",125,"2025-04-12 13:48:02","","10.1021/acscatal.3c01331","","",,,,,20,10.00,7,3,2,"… addition pathways using density functional theory (DFT) to determine … transmetalation, as it is a competent ligand in Ni SMCs, we hypothesize that the inefficiency of transmetalation …","https://pmc.ncbi.nlm.nih.gov/articles/PMC10688240/pdf/nihms-1938502.pdf","https://scholar.google.com/scholar?q=related:ztB5lTNDW5oJ:scholar.google.com/&scioq=source:%22acs+catalysis%22+transmetalation+dft&hl=en&as_sdt=0,5&as_vis=1"
51,"A Das, N Chatani","The Directing Group: A Tool for Efficient and Selective C–F Bond Activation",2021,"ACS Catalysis","ACS Publications","https://pubs.acs.org/doi/abs/10.1021/acscatal.1c03896","https://scholar.google.com/scholar?cites=2673414265382789444&as_sdt=2005&sciodt=0,5&hl=en",126,"2025-04-12 13:48:02","","10.1021/acscatal.1c03896","","",,,,,51,12.75,26,2,4,"… of a pentacoordinated intermediate 20 which can undergo transmetalation with Me 2 Zn to … proposed based on the experimental outcomes and a DFT study. The results suggest that C…","","https://scholar.google.com/scholar?q=related:RGGaKRzgGSUJ:scholar.google.com/&scioq=source:%22acs+catalysis%22+transmetalation+dft&hl=en&as_sdt=0,5&as_vis=1"
