Cites,Authors,Title,Year,Source,Publisher,ArticleURL,CitesURL,GSRank,QueryDate,Type,DOI,ISSN,CitationURL,Volume,Issue,StartPage,EndPage,ECC,CitesPerYear,CitesPerAuthor,AuthorCount,Age,Abstract,FullTextURL,RelatedURL
115,"CJ Wu, XY Li, TR Li, MZ Shao, LJ Niu, ...","Natural sunlight photocatalytic synthesis of benzoxazole-bridged covalent organic framework for photocatalysis",2022,"… American Chemical …","ACS Publications","https://pubs.acs.org/doi/abs/10.1021/jacs.2c07893","https://scholar.google.com/scholar?cites=14079665767759156226&as_sdt=2005&sciodt=0,5&hl=en",241,"2025-05-18 18:01:29","","10.1021/jacs.2c07893","","",,,,,115,38.33,19,6,3,"… The pore-size distribution by nonlocal density functional theory (NLDFT) analysis indicated that it possesses a narrow pore diameter distribution centered at ∼2.5 nm (Figure S3c inset), …","","https://scholar.google.com/scholar?q=related:AhSDI2sFZcMJ:scholar.google.com/&scioq=source:%22journal+of+the+american+chemical+society%22+photoredox+dft&hl=en&as_sdt=0,5&as_vis=1"
2,"J Li, P Wang, B Bai, Y Xiao, YF Wan, ...","Synthesis, Characterization, and Catalytic Activity of Ni (0)(DQ) dtbbpy, an Air-Stable, Bifunctional Red-Light-Sensitive Precatalyst",2025,"… American Chemical …","ACS Publications","https://pubs.acs.org/doi/abs/10.1021/jacs.4c14533","https://scholar.google.com/scholar?cites=1942212753749208054&as_sdt=2005&sciodt=0,5&hl=en",242,"2025-05-18 18:01:29","","10.1021/jacs.4c14533","","",,,,,2,2.00,0,6,1,"… Over the past decade, nickel photoredox catalysis has … for red-light photoredox catalysis, demonstrating remarkable … photoexcitation, we conducted DFT calculations. The individual …","","https://scholar.google.com/scholar?q=related:9mt0kTUg9BoJ:scholar.google.com/&scioq=source:%22journal+of+the+american+chemical+society%22+photoredox+dft&hl=en&as_sdt=0,5&as_vis=1"
424,"DS Hamilton, DA Nicewicz","Direct catalytic anti-Markovnikov hydroetherification of alkenols",2012,"Journal of the American Chemical …","ACS Publications","https://pubs.acs.org/doi/abs/10.1021/ja309635w","https://scholar.google.com/scholar?cites=9269137318316011738&as_sdt=2005&sciodt=0,5&hl=en",243,"2025-05-18 18:01:29","","10.1021/ja309635w","","",,,,,424,32.62,212,2,13,"… (6-9) Herein, we report the direct intramolecular anti-Markovnikov addition of alcohols to alkenes via a unique two-component single electron photoredox system. This transformation …","https://pmc.ncbi.nlm.nih.gov/articles/PMC3513336/pdf/nihms419263.pdf","https://scholar.google.com/scholar?q=related:2vCK8EeXooAJ:scholar.google.com/&scioq=source:%22journal+of+the+american+chemical+society%22+photoredox+dft&hl=en&as_sdt=0,5&as_vis=1"
37,"PZ Wang, JR Chen, WJ Xiao","Emerging trends in copper-promoted radical-involved C–O bond formations",2023,"Journal of the American Chemical …","ACS Publications","https://pubs.acs.org/doi/abs/10.1021/jacs.3c04879","https://scholar.google.com/scholar?cites=2330216319829790615&as_sdt=2005&sciodt=0,5&hl=en",244,"2025-05-18 18:01:29","","10.1021/jacs.3c04879","","",,,,,37,18.50,12,3,2,"… of photoredox catalysis and the well-established redox properties and catalytic activities of copper catalysts, cooperative photoredox … Density functional theory (DFT) calculations also …","","https://scholar.google.com/scholar?q=related:l89FmWWXViAJ:scholar.google.com/&scioq=source:%22journal+of+the+american+chemical+society%22+photoredox+dft&hl=en&as_sdt=0,5&as_vis=1"
156,"L Lu, JC Siu, Y Lai, S Lin","An electroreductive approach to radical silylation via the activation of strong Si–Cl bond",2020,"Journal of the American Chemical …","ACS Publications","https://pubs.acs.org/doi/abs/10.1021/jacs.0c10899","https://scholar.google.com/scholar?cites=7958650428787424103&as_sdt=2005&sciodt=0,5&hl=en",245,"2025-05-18 18:01:29","","10.1021/jacs.0c10899","","",,,,,156,31.20,39,4,5,"… A series of electroanalytical experiments, multivariate linear regression (MLR) analyses, and density functional theory (DFT) calculations lent strong support to the silyl radical pathway …","https://pmc.ncbi.nlm.nih.gov/articles/PMC7951502/pdf/nihms-1675796.pdf","https://scholar.google.com/scholar?q=related:Z3ti82XOcm4J:scholar.google.com/&scioq=source:%22journal+of+the+american+chemical+society%22+photoredox+dft&hl=en&as_sdt=0,5&as_vis=1"
90,"E Le Saux, M Zanini, P Melchiorre","Photochemical organocatalytic benzylation of allylic C–H bonds",2022,"… American Chemical Society","ACS Publications","https://pubs.acs.org/doi/abs/10.1021/jacs.1c11712","https://scholar.google.com/scholar?cites=13806116539414303754&as_sdt=2005&sciodt=0,5&hl=en",246,"2025-05-18 18:01:29","","10.1021/jacs.1c11712","","",,,,,90,30.00,30,3,3,"… Our approach was motivated by recent studies that combined photoredox and thiol catalysis to … The BDE value of C5 was estimated by means of DFT calculations and comparison with …","https://cris.unibo.it/bitstream/11585/897856/4/ja1c11712_si_001.pdf","https://scholar.google.com/scholar?q=related:ClRvO9gtmb8J:scholar.google.com/&scioq=source:%22journal+of+the+american+chemical+society%22+photoredox+dft&hl=en&as_sdt=0,5&as_vis=1"
30,"JT Malme, RA Clendening, R Ash, T Curry, ...","Nanosecond metal-to-ligand charge-transfer state in an Fe (II) chromophore: lifetime enhancement via nested potentials",2023,"… American Chemical …","ACS Publications","https://pubs.acs.org/doi/abs/10.1021/jacs.2c13532","https://scholar.google.com/scholar?cites=9679811163035212491&as_sdt=2005&sciodt=0,5&hl=en",247,"2025-05-18 18:01:29","","10.1021/jacs.2c13532","","",,,,,30,15.00,6,5,2,"… -state potentials using time-dependent density functional theory (TD-DFT). A vibrational mode … geometry were calculated along with a TD-DFT calculation of 50 singlets and 50 triplets. …","https://par.nsf.gov/servlets/purl/10412435","https://scholar.google.com/scholar?q=related:yxqTifeYVYYJ:scholar.google.com/&scioq=source:%22journal+of+the+american+chemical+society%22+photoredox+dft&hl=en&as_sdt=0,5&as_vis=1"
0,"M Inoue, J Stropp, A Ashuiev, Y Kakiuchi, ...","Branch-Selective Olefin Hydroaminoalkylation from Ti (III)–Al Bimetallic Intermediates Evidenced by EPR Hyperfine Spectroscopy and DFT Calculations",2024,"… American Chemical …","ACS Publications","https://pubs.acs.org/doi/abs/10.1021/jacs.5c02920","",248,"2025-05-18 18:01:29","","10.1021/jacs.5c02920","","",,,,,0,0.00,0,5,1,"… Based on these findings complemented by DFT studies, we propose a reaction mechanism featuring d 1 Ti(III) three-membered azatitanacycle species with amidoaluminate anions as …","https://www.research-collection.ethz.ch/bitstream/handle/20.500.11850/709525/branch-selective-olefin-hydroaminoalkylation-from-ti-iii-al-bimetallic-intermediates-evidenced-by-epr-hyperfine-spectroscopy-and-dft-calculations.pdf?sequence=2","https://scholar.google.com/scholar?q=related:XMtZcUqKHOEJ:scholar.google.com/&scioq=source:%22journal+of+the+american+chemical+society%22+photoredox+dft&hl=en&as_sdt=0,5&as_vis=1"
156,"H Yin, GC Fu","Mechanistic investigation of enantioconvergent Kumada reactions of racemic α-bromoketones catalyzed by a nickel/bis (oxazoline) complex",2019,"Journal of the American Chemical Society","ACS Publications","https://pubs.acs.org/doi/abs/10.1021/jacs.9b08185","https://scholar.google.com/scholar?cites=8699305476749669047&as_sdt=2005&sciodt=0,5&hl=en",249,"2025-05-18 18:01:29","","10.1021/jacs.9b08185","","",,,,,156,26.00,78,2,6,"… and reactivity studies of three of the four proposed nickel-containing intermediates, as well as interrogation via EPR spectroscopy, UV–vis spectroscopy, radical probes, and DFT …","https://pmc.ncbi.nlm.nih.gov/articles/PMC7075318/pdf/nihms-1557310.pdf","https://scholar.google.com/scholar?q=related:tzJGfj0kungJ:scholar.google.com/&scioq=source:%22journal+of+the+american+chemical+society%22+photoredox+dft&hl=en&as_sdt=0,5&as_vis=1"
4,"A Ripak, AK Vega Salgado, D Valverde, ...","Factors Controlling Cage Escape Yields of Closed-and Open-Shell Metal Complexes in Bimolecular Photoinduced Electron Transfer",2024,"… American Chemical …","ACS Publications","https://pubs.acs.org/doi/abs/10.1021/jacs.4c08158","https://scholar.google.com/scholar?cites=17070624948849790603&as_sdt=2005&sciodt=0,5&hl=en",250,"2025-05-18 18:01:29","","10.1021/jacs.4c08158","","",,,,,4,4.00,1,4,1,"… as a photocatalyst in photoredox catalysis. These yields … 2 LMCT excited state in photoredox catalysis, providing that … and oxidized states, at the DFT level, using the same level of …","https://chemrxiv.org/engage/api-gateway/chemrxiv/assets/orp/resource/item/666c4bc55101a2ffa89622b5/original/factors-controlling-cage-escape-yields-of-closed-and-open-shell-metal-complexes-in-bimolecular-photoinduced-electron-transfer.pdf","https://scholar.google.com/scholar?q=related:i84cavIK5-wJ:scholar.google.com/&scioq=source:%22journal+of+the+american+chemical+society%22+photoredox+dft&hl=en&as_sdt=0,5&as_vis=1"
121,"D Lehnherr, Y Lam, MC Nicastri, J Liu, ...","Electrochemical synthesis of hindered primary and secondary amines via proton-coupled electron transfer",2019,"… American Chemical …","ACS Publications","https://pubs.acs.org/doi/abs/10.1021/jacs.9b10870","https://scholar.google.com/scholar?cites=7575435994557390273&as_sdt=2005&sciodt=0,5&hl=en",251,"2025-05-18 18:01:29","","10.1021/jacs.9b10870","","",,,,,121,20.17,24,5,6,"… synthesis of three hindered amines via photoredox catalysis utilizing ketones in the presence … To discern between these pathways, we examined each pathway using DFT calculations. …","https://www.academia.edu/download/88016314/jacs.9b1087020220627-1-11w8fy5.pdf","https://scholar.google.com/scholar?q=related:wR1NkuZaIWkJ:scholar.google.com/&scioq=source:%22journal+of+the+american+chemical+society%22+photoredox+dft&hl=en&as_sdt=0,5&as_vis=1"
138,"L Tian, NA Till, B Kudisch, DWC MacMillan, ...","Transient absorption spectroscopy offers mechanistic insights for an iridium/nickel-catalyzed C–O coupling",2020,"… American Chemical …","ACS Publications","https://pubs.acs.org/doi/abs/10.1021/jacs.9b12835","https://scholar.google.com/scholar?cites=6113370353519947764&as_sdt=2005&sciodt=0,5&hl=en",252,"2025-05-18 18:01:29","","10.1021/jacs.9b12835","","",,,,,138,27.60,28,5,5,"… TD-DFT calculations showed that initial photoexcitation at 400 nm of 2 is predominantly … carbonyl-centered, as demonstrated by DFT calculation. Therefore, the photoactivation between …","https://www.osti.gov/servlets/purl/1634194","https://scholar.google.com/scholar?q=related:9O_1TfIN11QJ:scholar.google.com/&scioq=source:%22journal+of+the+american+chemical+society%22+photoredox+dft&hl=en&as_sdt=0,5&as_vis=1"
55,"F Zhu, S Zhang, Z Chen, J Rui, X Hong, ...","Catalytic and photochemical strategies to stabilized radicals based on anomeric nucleophiles",2020,"… American Chemical …","ACS Publications","https://pubs.acs.org/doi/abs/10.1021/jacs.0c03298","https://scholar.google.com/scholar?cites=18227561681585545670&as_sdt=2005&sciodt=0,5&hl=en",253,"2025-05-18 18:01:29","","10.1021/jacs.0c03298","","",,,,,55,11.00,9,6,5,"… Molander reported that under the photoredox conditions, the Hantzsch esters derived from … -1-thioglucosides, we resorted to density functional theory (DFT) calculations. The computed …","https://pmc.ncbi.nlm.nih.gov/articles/PMC9640225/pdf/nihms-1845417.pdf","https://scholar.google.com/scholar?q=related:xqFtkMZO9fwJ:scholar.google.com/&scioq=source:%22journal+of+the+american+chemical+society%22+photoredox+dft&hl=en&as_sdt=0,5&as_vis=1"
23,"DA Kutateladze, BK Mai, Y Dong, Y Zhang, ...","Stereoselective synthesis of trisubstituted alkenes via copper hydride-catalyzed alkyne hydroalkylation",2023,"… American Chemical …","ACS Publications","https://pubs.acs.org/doi/abs/10.1021/jacs.3c06479","https://scholar.google.com/scholar?cites=7723265960705790797&as_sdt=2005&sciodt=0,5&hl=en",254,"2025-05-18 18:01:29","","10.1021/jacs.3c06479","","",,,,,23,11.50,5,5,2,"… ferrocene), which density functional theory (DFT) calculations suggest accelerates alkyne … Photoredox catalysis has been applied to the synthesis of trisubstituted alkenes but is …","https://pmc.ncbi.nlm.nih.gov/articles/PMC10569085/pdf/nihms-1925492.pdf","https://scholar.google.com/scholar?q=related:TRO8vXiNLmsJ:scholar.google.com/&scioq=source:%22journal+of+the+american+chemical+society%22+photoredox+dft&hl=en&as_sdt=0,5&as_vis=1"
31,"S Dutta, CG Daniliuc, ...","Formal [2σ+ 2σ]-Cycloaddition of Aziridines with Bicyclo [1.1. 0] butanes: Access to Enantiopure 2-Azabicyclo [3.1. 1] heptane Derivatives",2024,"… American Chemical …","ACS Publications","https://pubs.acs.org/doi/abs/10.1021/jacs.4c11296","https://scholar.google.com/scholar?cites=2859936914939156080&as_sdt=2005&sciodt=0,5&hl=en",255,"2025-05-18 18:01:29","","10.1021/jacs.4c11296","","",,,,,31,31.00,10,3,1,"… To elucidate the reaction mechanism, we conducted density functional theory (DFT) calculations, which revealed the energies of the intermediates and key transition states (see SI for …","","https://scholar.google.com/scholar?q=related:cJb5tniJsCcJ:scholar.google.com/&scioq=source:%22journal+of+the+american+chemical+society%22+photoredox+dft&hl=en&as_sdt=0,5&as_vis=1"
470,"JD Nguyen, BS Matsuura, ...","A photochemical strategy for lignin degradation at room temperature",2014,"… the American Chemical …","ACS Publications","https://pubs.acs.org/doi/abs/10.1021/ja4113462","https://scholar.google.com/scholar?cites=11766624548578718131&as_sdt=2005&sciodt=0,5&hl=en",256,"2025-05-18 18:01:29","","10.1021/ja4113462","","",,,,,470,42.73,157,3,11,"… that we could apply photoredox catalysis (17, 18) toward the C α –O bond cleavage of lignin model substrate 1. Evaluation of a series of common photoredox catalysts including Ru(bpy) …","http://pstorage-acs-6854636.s3.amazonaws.com/3965896/ja4113462_si_001.pdf","https://scholar.google.com/scholar?q=related:s_FsR69yS6MJ:scholar.google.com/&scioq=source:%22journal+of+the+american+chemical+society%22+photoredox+dft&hl=en&as_sdt=0,5&as_vis=1"
0,"A Petti, MJ Karrasch, P Chahar, ...","Cyclic Bifunctional Reagents Enabling a Strain-Release-Driven Formal [3 + 2] Cycloaddition of 2H-Azirines by Cascade Energy Transfer",2025,"… American Chemical …","ACS Publications","https://pubs.acs.org/doi/abs/10.1021/jacs.4c18080","",257,"2025-05-18 18:01:29","","10.1021/jacs.4c18080","","",,,,,0,0.00,0,4,1,"… Mechanistic experiments in combination with density functional theory (DFT) calculations … (28−31) Although the reactivity of 2H-azirines under photoredox conditions is well established, …","https://pubs.acs.org/doi/full/10.1021/jacs.4c18080","https://scholar.google.com/scholar?q=related:dUFJ6eD036gJ:scholar.google.com/&scioq=source:%22journal+of+the+american+chemical+society%22+photoredox+dft&hl=en&as_sdt=0,5&as_vis=1"
118,"W Liu, J Li, P Querard, CJ Li","Transition-metal-free C–C, C–O, and C–N cross-couplings enabled by light",2019,"Journal of the American Chemical …","ACS Publications","https://pubs.acs.org/doi/abs/10.1021/jacs.9b02684","https://scholar.google.com/scholar?cites=12811467525708312932&as_sdt=2005&sciodt=0,5&hl=en",258,"2025-05-18 18:01:29","","10.1021/jacs.9b02684","","",,,,,118,19.67,30,4,6,"… electrophiles and (2) identifying a better photoredox catalyst instead of the triplet acetone as … Combining the above DFT calculations as well as CV and fluorescence investigations, we …","","https://scholar.google.com/scholar?q=related:ZPFLKdZ5y7EJ:scholar.google.com/&scioq=source:%22journal+of+the+american+chemical+society%22+photoredox+dft&hl=en&as_sdt=0,5&as_vis=1"
52,"RF Turro, JLH Wahlman, ZJ Tong, X Chen, ...","Mechanistic investigation of Ni-catalyzed reductive cross-coupling of alkenyl and benzyl electrophiles",2023,"… American Chemical …","ACS Publications","https://pubs.acs.org/doi/abs/10.1021/jacs.3c02649","https://scholar.google.com/scholar?cites=821645774057915480&as_sdt=2005&sciodt=0,5&hl=en",259,"2025-05-18 18:01:29","","10.1021/jacs.3c02649","","",,,,,52,26.00,10,5,2,"… DFT calculations suggest an enantiodetermining radical capture step and elucidate the … This is in contrast to previously reported computational results for a related Ni-photoredox …","https://pubs.acs.org/doi/full/10.1021/jacs.3c02649","https://scholar.google.com/scholar?q=related:WETsbXoSZwsJ:scholar.google.com/&scioq=source:%22journal+of+the+american+chemical+society%22+photoredox+dft&hl=en&as_sdt=0,5&as_vis=1"
69,"T Kratz, P Steinbach, S Breitenlechner, ...","Photochemical deracemization of chiral alkenes via triplet energy transfer",2022,"… American Chemical …","ACS Publications","https://pubs.acs.org/doi/abs/10.1021/jacs.2c02511","https://scholar.google.com/scholar?cites=7688804830565738305&as_sdt=2005&sciodt=0,5&hl=en",260,"2025-05-18 18:01:29","","10.1021/jacs.2c02511","","",,,,,69,23.00,17,4,3,"… NMR studies and DFT computations revealed that triplet energy transfer is more rapid within the substrate–catalyst complex of the minor alkene enantiomer. Since this enantiomer is …","","https://scholar.google.com/scholar?q=related:QactoUEftGoJ:scholar.google.com/&scioq=source:%22journal+of+the+american+chemical+society%22+photoredox+dft&hl=en&as_sdt=0,5&as_vis=1"
212,"X Wang, G Ma, Y Peng, CE Pitsch, BJ Moll, ...","Ni-catalyzed reductive coupling of electron-rich aryl iodides with tertiary alkyl halides",2018,"… American Chemical …","ACS Publications","https://pubs.acs.org/doi/abs/10.1021/jacs.8b09473","https://scholar.google.com/scholar?cites=12285499957886712267&as_sdt=2005&sciodt=0,5&hl=en",261,"2025-05-18 18:01:29","","10.1021/jacs.8b09473","","",,,,,212,30.29,35,6,7,"… Recently, a photoredox/Ni-catalyzed Suzuki reaction was reported by Molander, which … In view of the experimental findings above, we have employed DFT calculations in a bid to …","","https://scholar.google.com/scholar?q=related:y_npzR7dfqoJ:scholar.google.com/&scioq=source:%22journal+of+the+american+chemical+society%22+photoredox+dft&hl=en&as_sdt=0,5&as_vis=1"
65,"Y Shen, I Funez-Ardoiz, F Schoenebeck, ...","Site-selective α-C–H functionalization of trialkylamines via reversible hydrogen atom transfer catalysis",2021,"… the American Chemical …","ACS Publications","https://pubs.acs.org/doi/abs/10.1021/jacs.1c07144","https://scholar.google.com/scholar?cites=1961177568595982011&as_sdt=2005&sciodt=0,5&hl=en",262,"2025-05-18 18:01:29","","10.1021/jacs.1c07144","","",,,,,65,16.25,16,4,4,"… silylthiyl radicals as HAT catalysts to perform photoredox-catalyzed α-deuteration and tritiation … Our continuing interest in photoredox promoted amine functionalization led us to examine …","https://pmc.ncbi.nlm.nih.gov/articles/PMC8855485/pdf/nihms-1778705.pdf","https://scholar.google.com/scholar?q=related:u7agnZuANxsJ:scholar.google.com/&scioq=source:%22journal+of+the+american+chemical+society%22+photoredox+dft&hl=en&as_sdt=0,5&as_vis=1"
71,"L Leng, Y Fu, P Liu, JM Ready","Regioselective, photocatalytic α-functionalization of amines",2020,"Journal of the American Chemical …","ACS Publications","https://pubs.acs.org/doi/abs/10.1021/jacs.0c03758","https://scholar.google.com/scholar?cites=17499837972746422930&as_sdt=2005&sciodt=0,5&hl=en",263,"2025-05-18 18:01:29","","10.1021/jacs.0c03758","","",,,,,71,14.20,18,4,5,"… Density functional theory (DFT) calculations indicate that the pK a of the N-benzyl and N-methyl C–H bonds in 6· + are 2.4 and 8.2, respectively, (17) implying that the more acidic …","https://pmc.ncbi.nlm.nih.gov/articles/PMC8475292/pdf/nihms-1740849.pdf","https://scholar.google.com/scholar?q=related:kkpxCOvp2_IJ:scholar.google.com/&scioq=source:%22journal+of+the+american+chemical+society%22+photoredox+dft&hl=en&as_sdt=0,5&as_vis=1"
96,"X Xu, P Cai, H Chen, HC Zhou, ...","Three-dimensional covalent organic frameworks with she topology",2022,"… of the American Chemical …","ACS Publications","https://pubs.acs.org/doi/abs/10.1021/jacs.2c07733","https://scholar.google.com/scholar?cites=8844407142968728817&as_sdt=2005&sciodt=0,5&hl=en",264,"2025-05-18 18:01:29","","10.1021/jacs.2c07733","","",,,,,96,32.00,19,5,3,"… Based on the nonlocal density functional theory (NLDFT), the … to employ these 3D COFs as photoredox catalysts for C–C … HFPB-COF as the photoredox catalyst afforded excellent yields. …","","https://scholar.google.com/scholar?q=related:8RyU1W-lvXoJ:scholar.google.com/&scioq=source:%22journal+of+the+american+chemical+society%22+photoredox+dft&hl=en&as_sdt=0,5&as_vis=1"
79,"WR Leow, WKH Ng, T Peng, X Liu, B Li, ...","Al2O3 Surface Complexation for Photocatalytic Organic Transformations",2017,"… American Chemical …","ACS Publications","https://pubs.acs.org/doi/abs/10.1021/jacs.6b09934","https://scholar.google.com/scholar?cites=11479170308966859502&as_sdt=2005&sciodt=0,5&hl=en",265,"2025-05-18 18:01:29","","10.1021/jacs.6b09934","","",,,,,79,9.88,13,6,8,"… and earth abundant materials to effectively achieve a wider range of photoredox reactions. … The Gaussian09 package was used for the DFT calculation of the dye molecules. The B3LYP …","https://escholarship.org/content/qt0bf7k8rj/qt0bf7k8rj_noSplash_2f36a59a55b097db5eb4822d07f1e775.pdf","https://scholar.google.com/scholar?q=related:7kIuppM0Tp8J:scholar.google.com/&scioq=source:%22journal+of+the+american+chemical+society%22+photoredox+dft&hl=en&as_sdt=0,5&as_vis=1"
66,"A Stafford, D Ahn, EK Raulerson, ...","Catalyst halogenation enables rapid and efficient polymerizations with visible to far-red light",2020,"… American Chemical …","ACS Publications","https://pubs.acs.org/doi/abs/10.1021/jacs.0c07136","https://scholar.google.com/scholar?cites=17438240471600476312&as_sdt=2005&sciodt=0,5&hl=en",266,"2025-05-18 18:01:29","","10.1021/jacs.0c07136","","",,,,,66,13.20,17,4,5,"… Halogenated BODIPY photoredox catalysts were additionally employed to produce complex 3D … Additionally, density functional theory was used to support the relative electronic energy …","https://par.nsf.gov/servlets/purl/10474928","https://scholar.google.com/scholar?q=related:mDCWMVETAfIJ:scholar.google.com/&scioq=source:%22journal+of+the+american+chemical+society%22+photoredox+dft&hl=en&as_sdt=0,5&as_vis=1"
184,"L Yu, Y Xu, Z Pu, H Kang, M Li, ...","Photocatalytic superoxide radical generator that induces pyroptosis in cancer cells",2022,"… American Chemical …","ACS Publications","https://pubs.acs.org/doi/abs/10.1021/jacs.2c03256","https://scholar.google.com/scholar?cites=5896089724868575910&as_sdt=2005&sciodt=0,5&hl=en",267,"2025-05-18 18:01:29","","10.1021/jacs.2c03256","","",,,,,184,61.33,31,6,3,"… Considering that other polarity-induced structural changes could contribute to the observed AIE phenomenon, (42)NI-TA and NI-DF were analyzed using density functional theory (DFT). …","","https://scholar.google.com/scholar?q=related:pkKfrl0e01EJ:scholar.google.com/&scioq=source:%22journal+of+the+american+chemical+society%22+photoredox+dft&hl=en&as_sdt=0,5&as_vis=1"
52,"Q Niu, Q Huang, TY Yu, J Liu, JW Shi, ...","Achieving high photo/thermocatalytic product selectivity and conversion via thorium clusters with switchable functional ligands",2022,"… American Chemical …","ACS Publications","https://pubs.acs.org/doi/abs/10.1021/jacs.2c08258","https://scholar.google.com/scholar?cites=11707332705906980403&as_sdt=2005&sciodt=0,5&hl=en",268,"2025-05-18 18:01:29","","10.1021/jacs.2c08258","","",,,,,52,17.33,9,6,3,"… Moreover, catalytic characterization and density functional theory calculations consistently indicated that these thorium clusters can activate O 2 /H 2 O 2 to generate active …","","https://scholar.google.com/scholar?q=related:M_blYhHNeKIJ:scholar.google.com/&scioq=source:%22journal+of+the+american+chemical+society%22+photoredox+dft&hl=en&as_sdt=0,5&as_vis=1"
58,"J Ahmed, S Chakraborty, A Jose, SP, ...","Integrating Organic Lewis Acid and Redox Catalysis: The Phenalenyl Cation in Dual Role",2018,"… the American Chemical …","ACS Publications","https://pubs.acs.org/doi/abs/10.1021/jacs.8b04786","https://scholar.google.com/scholar?cites=6793080037058216650&as_sdt=2005&sciodt=0,5&hl=en",269,"2025-05-18 18:01:29","","10.1021/jacs.8b04786","","",,,,,58,8.29,12,5,7,"… co-workers have reported merging photoredox catalysis with … (9) Using the combination of Ru or Ir based photoredox … and arenes, we resorted to DFT calculations. Figure 3a shows the …","","https://scholar.google.com/scholar?q=related:ygKna03eRV4J:scholar.google.com/&scioq=source:%22journal+of+the+american+chemical+society%22+photoredox+dft&hl=en&as_sdt=0,5&as_vis=1"
23,"CN Muniz, CA Archer, JS Applebaum, ...","Two-coordinate coinage metal complexes as solar photosensitizers",2023,"… American Chemical …","ACS Publications","https://pubs.acs.org/doi/abs/10.1021/jacs.3c02825","https://scholar.google.com/scholar?cites=13133738324118948896&as_sdt=2005&sciodt=0,5&hl=en",270,"2025-05-18 18:01:29","","10.1021/jacs.3c02825","","",,,,,23,11.50,6,4,2,"… In this work, we probe the excited-state photoredox capabilities of several two-coordinate cMa … Density functional theory (DFT) and time-dependent DFT (TDDFT) calculations were …","https://par.nsf.gov/servlets/purl/10474083","https://scholar.google.com/scholar?q=related:IEwLlmtpRLYJ:scholar.google.com/&scioq=source:%22journal+of+the+american+chemical+society%22+photoredox+dft&hl=en&as_sdt=0,5&as_vis=1"
