Cites,Authors,Title,Year,Source,Publisher,ArticleURL,CitesURL,GSRank,QueryDate,Type,DOI,ISSN,CitationURL,Volume,Issue,StartPage,EndPage,ECC,CitesPerYear,CitesPerAuthor,AuthorCount,Age,Abstract,FullTextURL,RelatedURL
112,"PHS Paioti, J Del Pozo, MS Mikus, J Lee, ...","Catalytic enantioselective boryl and silyl substitution with trifluoromethyl alkenes: scope, utility, and mechanistic nuances of Cu–F β-elimination",2019,"… American Chemical …","ACS Publications","https://pubs.acs.org/doi/abs/10.1021/jacs.9b11382","https://scholar.google.com/scholar?cites=7835458395591246819&as_sdt=2005&sciodt=0,5&hl=en",481,"2025-05-18 18:01:29","","10.1021/jacs.9b11382","","",,,,,112,18.67,22,5,6,"… We then carried out DFT studies to obtain appropriate stereochemical models that account for stereoselectivity levels and trends, including the reversal in enantioselectivity in boryl and …","","https://scholar.google.com/scholar?q=related:44ORkeUjvWwJ:scholar.google.com/&scioq=source:%22journal+of+the+american+chemical+society%22+photoredox+dft&hl=en&as_sdt=0,5&as_vis=1"
194,"H Li, Q Xu, N Li, R Sun, J Ge, J Lu, H Gu, ...","A small-molecule-based ternary data-storage device",2010,"… the American Chemical …","ACS Publications","https://pubs.acs.org/doi/abs/10.1021/ja910243f","https://scholar.google.com/scholar?cites=14281048080456397781&as_sdt=2005&sciodt=0,5&hl=en",482,"2025-05-18 18:01:29","","10.1021/ja910243f","","",,,,,194,12.93,24,8,15,"High-density data storage (HDDS) is urgently required to address ongoing rapid increases in amounts of information. Here we present a prototype sandwich device that has ternary data…","","https://scholar.google.com/scholar?q=related:1bPgn5B5MMYJ:scholar.google.com/&scioq=source:%22journal+of+the+american+chemical+society%22+photoredox+dft&hl=en&as_sdt=0,5&as_vis=1"
466,"XB Han, ZM Zhang, T Zhang, YG Li, W Lin, ...","Polyoxometalate-based cobalt–phosphate molecular catalysts for visible light-driven water oxidation",2014,"… American Chemical …","ACS Publications","https://pubs.acs.org/doi/abs/10.1021/ja412886e","https://scholar.google.com/scholar?cites=2427885100514174363&as_sdt=2005&sciodt=0,5&hl=en",483,"2025-05-18 18:01:29","","10.1021/ja412886e","","",,,,,466,42.36,78,6,11,"… states (40-43) have been used as oxidatively resistant pure inorganic multidentate ligands in place of organic ligands for constructing well-defined structural models for photoredox …","","https://scholar.google.com/scholar?q=related:m2Wcq6KUsSEJ:scholar.google.com/&scioq=source:%22journal+of+the+american+chemical+society%22+photoredox+dft&hl=en&as_sdt=0,5&as_vis=1"
10,"SM Oburn, S Huss, J Cox, MC Gerthoffer, ...","Photochemically mediated polymerization of molecular furan and pyridine: Synthesis of nanothreads at reduced pressures",2022,"… American Chemical …","ACS Publications","https://pubs.acs.org/doi/abs/10.1021/jacs.2c09204","https://scholar.google.com/scholar?cites=8733372953133385133&as_sdt=2005&sciodt=0,5&hl=en",484,"2025-05-18 18:01:29","","10.1021/jacs.2c09204","","",,,,,10,3.33,2,5,3,"… Here, we disclose a mild method for photochemically mediated 1D polymerization of aromatic precursors under pressure and use density functional theory (DFT) and …","https://par.nsf.gov/servlets/purl/10406546","https://scholar.google.com/scholar?q=related:rQWF8m0sM3kJ:scholar.google.com/&scioq=source:%22journal+of+the+american+chemical+society%22+photoredox+dft&hl=en&as_sdt=0,5&as_vis=1"
115,"W Li, D Yuan, G Wang, Y Zhao, J Xie, ...","Cooperative Au/Ag dual-catalyzed cross-dehydrogenative biaryl coupling: reaction development and mechanistic insight",2019,"… the American Chemical …","ACS Publications","https://pubs.acs.org/doi/abs/10.1021/jacs.8b12929","https://scholar.google.com/scholar?cites=3645769709478135475&as_sdt=2005&sciodt=0,5&hl=en",485,"2025-05-18 18:01:29","","10.1021/jacs.8b12929","","",,,,,115,19.17,19,6,6,"… We then investigated the C–H activation of pyrazole with DFT calculations in detail. As shown in … Photoredox catalyzed defluoroalkylation of 3b with 1-phenylpyrrolidine also proceeded …","https://hysz.nju.edu.cn/_upload/article/files/44/7d/1677d89b45069b0132d9f752a4dd/e08e315f-0f48-4add-bcaa-208cab3f4444.pdf","https://scholar.google.com/scholar?q=related:s8ZSEjxgmDIJ:scholar.google.com/&scioq=source:%22journal+of+the+american+chemical+society%22+photoredox+dft&hl=en&as_sdt=0,5&as_vis=1"
0,"MV Pinto Pereira Junior, EP Geunes, ...","Enantioselective Hydrodifluoroalkylation of Alkenes with Conformationally Tuned Peptidyl Hydrogen Atom Transfer Catalysts",2025,"… American Chemical …","ACS Publications","https://pubs.acs.org/doi/abs/10.1021/jacs.5c01166","",486,"2025-05-18 18:01:29","","10.1021/jacs.5c01166","","",,,,,0,0.00,0,3,1,"… This photoredox-catalyzed reaction is facilitated by a … Our DFT calculations successfully reproduced the experimentally … We also conducted DFT mechanistic studies with the best-…","","https://scholar.google.com/scholar?q=related:HfL2_hyeIJkJ:scholar.google.com/&scioq=source:%22journal+of+the+american+chemical+society%22+photoredox+dft&hl=en&as_sdt=0,5&as_vis=1"
110,"X Xu, S Zhang, K Xu, H Chen, X Fan, ...","Janus dione-based conjugated covalent organic frameworks with high conductivity as superior cathode materials",2022,"… the American Chemical …","ACS Publications","https://pubs.acs.org/doi/abs/10.1021/jacs.2c10509","https://scholar.google.com/scholar?cites=3592373253229142478&as_sdt=2005&sciodt=0,5&hl=en",487,"2025-05-18 18:01:29","","10.1021/jacs.2c10509","","",,,,,110,36.67,18,6,3,"The development of conductive covalent organic frameworks (COFs) with high stability is desirable for the practical applications in optoelectronics and energy storage. Herein, we …","","https://scholar.google.com/scholar?q=related:zmFWy3Cs2jEJ:scholar.google.com/&scioq=source:%22journal+of+the+american+chemical+society%22+photoredox+dft&hl=en&as_sdt=0,5&as_vis=1"
10,"J Xu, S Pan, S Yao, C Lorent, C Teutloff, ...","Stabilizing monoatomic two-coordinate bismuth (I) and bismuth (II) using a redox noninnocent bis (germylene) ligand",2024,"… American Chemical …","ACS Publications","https://pubs.acs.org/doi/abs/10.1021/jacs.3c13016","https://scholar.google.com/scholar?cites=16248004003879788584&as_sdt=2005&sciodt=0,5&hl=en",488,"2025-05-18 18:01:29","","10.1021/jacs.3c13016","","",,,,,10,10.00,2,6,1,"… Bi I situation as suggested by density functional theory (DFT) calculations. Starting from the Bi … We are currently applying these redox-ligand-active Bi I and Bi II complexes in photoredox …","https://pubs.acs.org/doi/full/10.1021/jacs.3c13016","https://scholar.google.com/scholar?q=related:KCBhUI6BfOEJ:scholar.google.com/&scioq=source:%22journal+of+the+american+chemical+society%22+photoredox+dft&hl=en&as_sdt=0,5&as_vis=1"
30,"H Chen, I Roy, MS Myong, JSW Seale, ...","Triplet–triplet annihilation upconversion in a porphyrinic molecular container",2023,"… American Chemical …","ACS Publications","https://pubs.acs.org/doi/abs/10.1021/jacs.2c13846","https://scholar.google.com/scholar?cites=1324290675599598587&as_sdt=2005&sciodt=0,5&hl=en",489,"2025-05-18 18:01:29","","10.1021/jacs.2c13846","","",,,,,30,15.00,6,5,2,"… of 1:2 between a porphyrinic molecular container and perylene was confirmed by NMR spectroscopy, mass spectrometry, and isothermal titration calorimetry (ITC) as well as by DFT …","","https://scholar.google.com/scholar?q=related:--N5YlrTYBIJ:scholar.google.com/&scioq=source:%22journal+of+the+american+chemical+society%22+photoredox+dft&hl=en&as_sdt=0,5&as_vis=1"
60,"RWY Man, H Yi, S Malola, S Takano, ...","Synthesis and Characterization of Enantiopure Chiral Bis NHC-Stabilized Edge-Shared Au10 Nanocluster with Unique Prolate Shape",2022,"… American Chemical …","ACS Publications","https://pubs.acs.org/doi/abs/10.1021/jacs.1c11857","https://scholar.google.com/scholar?cites=18266736166518408687&as_sdt=2005&sciodt=0,5&hl=en",490,"2025-05-18 18:01:29","","10.1021/jacs.1c11857","","",,,,,60,20.00,12,5,3,"… We performed density functional theory calculations (DFT) on an isolated S-[3] 2+ unit … The optimized DFT structure retained all the geometric features seen in the crystal structure, …","","https://scholar.google.com/scholar?q=related:70UcG8N7gP0J:scholar.google.com/&scioq=source:%22journal+of+the+american+chemical+society%22+photoredox+dft&hl=en&as_sdt=0,5&as_vis=1"
29,"WL Williams, NE Gutiérrez-Valencia, ...","Branched-selective cross-electrophile coupling of 2-alkyl aziridines and (hetero) aryl iodides using Ti/Ni catalysis",2023,"… the American Chemical …","ACS Publications","https://pubs.acs.org/doi/abs/10.1021/jacs.3c08301","https://scholar.google.com/scholar?cites=16839522671234437605&as_sdt=2005&sciodt=0,5&hl=en",491,"2025-05-18 18:01:29","","10.1021/jacs.3c08301","","",,,,,29,14.50,10,3,2,"… In order to describe the steric and electronic profiles of these aryl iodides, we computed density functional theory (DFT) and structural features using Auto-QChem, a program developed …","https://pmc.ncbi.nlm.nih.gov/articles/PMC10704858/pdf/nihms-1947855.pdf","https://scholar.google.com/scholar?q=related:5dEQXqYAsukJ:scholar.google.com/&scioq=source:%22journal+of+the+american+chemical+society%22+photoredox+dft&hl=en&as_sdt=0,5&as_vis=1"
182,"JA Fernández, X López, C Bo, C de Graaf, ...","Polyoxometalates with internal cavities: Redox activity, basicity, and cation encapsulation in [X n+ P5W30O110](15-n)-Preyssler complexes, with X= Na+, Ca2+, Y3+ …",2007,"… American Chemical …","ACS Publications","https://pubs.acs.org/doi/abs/10.1021/ja0737321","https://scholar.google.com/scholar?cites=13279825111949507348&as_sdt=2005&sciodt=0,5&hl=en",492,"2025-05-18 18:01:29","","10.1021/ja0737321","","",,,,,182,10.11,36,5,18,"… Our DFT calculations indicate that the metal-oxide framework (and notably the internal cavity) is not able to coordinate the Ce covalently, leading to long Ce−O distances of ca. 2.72 Å. …","https://www.academia.edu/download/48938840/Polyoxometalates_with_Internal_Cavities_20160918-6209-1lkothl.pdf","https://scholar.google.com/scholar?q=related:FPsPbZRqS7gJ:scholar.google.com/&scioq=source:%22journal+of+the+american+chemical+society%22+photoredox+dft&hl=en&as_sdt=0,5&as_vis=1"
64,"A Migani, L Blancafort","What Controls Photocatalytic Water Oxidation on Rutile TiO2(110) under Ultra-High-Vacuum Conditions?",2017,"Journal of the American Chemical Society","ACS Publications","https://pubs.acs.org/doi/abs/10.1021/jacs.7b05121","https://scholar.google.com/scholar?cites=10772323399632454988&as_sdt=2005&sciodt=0,5&hl=en",493,"2025-05-18 18:01:29","","10.1021/jacs.7b05121","","",,,,,64,8.00,32,2,8,"… of a highly reactive intermediate through a photoredox reaction involving a hole–electron (h… -polarized DFT HSE06 calculations with triplet spin multiplicity. Spin-polarized DFT HSE06 …","https://pubs.acs.org/doi/full/10.1021/jacs.7b05121","https://scholar.google.com/scholar?q=related:TIW4yA77fpUJ:scholar.google.com/&scioq=source:%22journal+of+the+american+chemical+society%22+photoredox+dft&hl=en&as_sdt=0,5&as_vis=1"
141,"JK Jin, K Wu, XY Liu, GQ Huang, ...","Building a pyrazole–benzothiadiazole–pyrazole photosensitizer into metal–organic frameworks for photocatalytic aerobic oxidation",2021,"… American Chemical …","ACS Publications","https://pubs.acs.org/doi/abs/10.1021/jacs.1c10008","https://scholar.google.com/scholar?cites=6057058404424134624&as_sdt=2005&sciodt=0,5&hl=en",494,"2025-05-18 18:01:29","","10.1021/jacs.1c10008","","",,,,,141,35.25,28,5,4,"… Meanwhile, we conducted DFT calculations and observed the photogenerated electron distribution on Zn clusters, suggesting that Zn clusters are partially involved in the charge …","","https://scholar.google.com/scholar?q=related:4K9-84b-DlQJ:scholar.google.com/&scioq=source:%22journal+of+the+american+chemical+society%22+photoredox+dft&hl=en&as_sdt=0,5&as_vis=1"
2,"S Dadashi-Silab, C Preston-Herrera, ...","Red-Light-Induced Ligand-to-Metal Charge Transfer Catalysis by Tuning the Axial Coordination of Cobyrinate",2024,"… American Chemical …","ACS Publications","https://pubs.acs.org/doi/abs/10.1021/jacs.4c12432","https://scholar.google.com/scholar?cites=12683576211113673533&as_sdt=2005&sciodt=0,5&hl=en",495,"2025-05-18 18:01:29","","10.1021/jacs.4c12432","","",,,,,2,2.00,1,3,1,"Photoinduced ligand-to-metal charge transfer (LMCT) is a powerful technique for the formation of reactive radical species via homolytic cleavage of the metal–ligand bond. Here, we …","https://pmc.ncbi.nlm.nih.gov/articles/PMC11848849/","https://scholar.google.com/scholar?q=related:PYMGEV0dBbAJ:scholar.google.com/&scioq=source:%22journal+of+the+american+chemical+society%22+photoredox+dft&hl=en&as_sdt=0,5&as_vis=1"
60,"G Meng, W Lan, L Zhang, S Wang, ...","Synergy of single atoms and Lewis acid sites for efficient and selective lignin disassembly into monolignol derivatives",2023,"… American Chemical …","ACS Publications","https://pubs.acs.org/doi/abs/10.1021/jacs.3c04028","https://scholar.google.com/scholar?cites=17885667689491234504&as_sdt=2005&sciodt=0,5&hl=en",496,"2025-05-18 18:01:29","","10.1021/jacs.3c04028","","",,,,,60,30.00,12,5,2,"… The study with DFT computation will further support our inference in the following discussion. The spent Mo 1 Al/MgO was recycled 5 times, and the monomer yield was gradually …","","https://scholar.google.com/scholar?q=related:yH7OUgCoNvgJ:scholar.google.com/&scioq=source:%22journal+of+the+american+chemical+society%22+photoredox+dft&hl=en&as_sdt=0,5&as_vis=1"
73,"R Bevernaegie, SAM Wehlin, EJ Piechota, ...","Improved visible light absorption of potent iridium (III) photo-oxidants for excited-state electron transfer chemistry",2020,"… American Chemical …","ACS Publications","https://pubs.acs.org/doi/abs/10.1021/jacs.9b12108","https://scholar.google.com/scholar?cites=15649339283903433464&as_sdt=2005&sciodt=0,5&hl=en",497,"2025-05-18 18:01:29","","10.1021/jacs.9b12108","","",,,,,73,14.60,18,4,5,"… Time-dependent density functional theory indicated increased contribution from pzph or bpph intraligand charge transfer to these visible absorption bands (Figures S19–S24). These …","https://www.osti.gov/pages/servlets/purl/1801393","https://scholar.google.com/scholar?q=related:-EqhOiqfLdkJ:scholar.google.com/&scioq=source:%22journal+of+the+american+chemical+society%22+photoredox+dft&hl=en&as_sdt=0,5&as_vis=1"
98,"S Fernández, F Franco, C Casadevall, ...","A Unified Electro- and Photocatalytic CO2 to CO Reduction Mechanism with Aminopyridine Cobalt Complexes",2019,"… American Chemical …","ACS Publications","https://pubs.acs.org/doi/abs/10.1021/jacs.9b06633","https://scholar.google.com/scholar?cites=9365996627303640036&as_sdt=2005&sciodt=0,5&hl=en",498,"2025-05-18 18:01:29","","10.1021/jacs.9b06633","","",,,,,98,16.33,25,4,6,"… With the aim to give additional insight into the reactivity of electrochemically generated Co I species with CO 2 , we studied the reaction energy profile by DFT. The calculations were …","https://arts.units.it/bitstream/11368/3044367/8/jacs.9b06633-Post_print.pdf","https://scholar.google.com/scholar?q=related:5KvwMU-0-oEJ:scholar.google.com/&scioq=source:%22journal+of+the+american+chemical+society%22+photoredox+dft&hl=en&as_sdt=0,5&as_vis=1"
30,"DM Soro, JB Roque, JW Rackl, B Park, ...","Photo-and metal-mediated deconstructive approaches to cyclic aliphatic amine diversification",2023,"… American Chemical …","ACS Publications","https://pubs.acs.org/doi/abs/10.1021/jacs.3c01318","https://scholar.google.com/scholar?cites=2756742683947277005&as_sdt=2005&sciodt=0,5&hl=en",499,"2025-05-18 18:01:29","","10.1021/jacs.3c01318","","",,,,,30,15.00,6,5,2,"… N bond cleavage by evaluating a broad range of photoredox catalysts, oxidants, and solvent … protocol, we turned to density functional theory (DFT) and time-dependent DFT calculations. …","https://pubs.acs.org/doi/full/10.1021/jacs.3c01318","https://scholar.google.com/scholar?q=related:zZrVfd3qQSYJ:scholar.google.com/&scioq=source:%22journal+of+the+american+chemical+society%22+photoredox+dft&hl=en&as_sdt=0,5&as_vis=1"
181,"K Zhang, L Chang, Q An, X Wang, ...","Dehydroxymethylation of alcohols enabled by cerium photocatalysis",2019,"… of the American Chemical …","ACS Publications","https://pubs.acs.org/doi/abs/10.1021/jacs.9b05932","https://scholar.google.com/scholar?cites=18359929157489505166&as_sdt=2005&sciodt=0,5&hl=en",500,"2025-05-18 18:01:29","","10.1021/jacs.9b05932","","",,,,,181,30.17,36,5,6,"… The recent advancement of photoredox catalysis has enabled the activation of alcohols into … An X-ray absorption spectroscopy and density functional theory study of LnCl6(x-) (x = 3, 2). …","","https://scholar.google.com/scholar?q=related:jrN_LUuSy_4J:scholar.google.com/&scioq=source:%22journal+of+the+american+chemical+society%22+photoredox+dft&hl=en&as_sdt=0,5&as_vis=1"
80,"MM Hansmann, M Melaimi, ...","Crystalline monomeric allenyl/propargyl radical",2017,"… of the American Chemical …","ACS Publications","https://pubs.acs.org/doi/abs/10.1021/jacs.7b09622","https://scholar.google.com/scholar?cites=17822660186158660742&as_sdt=2005&sciodt=0,5&hl=en",501,"2025-05-18 18:01:29","","10.1021/jacs.7b09622","","",,,,,80,10.00,27,3,8,"… We investigated the different dimerization pathways by DFT calculations using the model compound … radicals to gain further insight into the mechanism of photoredox catalytic reactions. …","https://par.nsf.gov/servlets/purl/10056653","https://scholar.google.com/scholar?q=related:hvx7xALPVvcJ:scholar.google.com/&scioq=source:%22journal+of+the+american+chemical+society%22+photoredox+dft&hl=en&as_sdt=0,5&as_vis=1"
2,"Y Xu, C Shen, K Dong","Enantioselective Decarboxylative Hydrogen-Atom Transfer Reaction",2025,"Journal of the American Chemical Society","ACS Publications","https://pubs.acs.org/doi/abs/10.1021/jacs.4c18464","https://scholar.google.com/scholar?cites=6803616090320503904&as_sdt=2005&sciodt=0,5&hl=en",502,"2025-05-18 18:01:29","","10.1021/jacs.4c18464","","",,,,,2,2.00,1,3,1,"… established by leveraging dual catalysis of photoredox-mediated radical generation and a thiol… Computational investigation based on density functional theory was carried out to unravel …","","https://scholar.google.com/scholar?q=related:YISve8lMa14J:scholar.google.com/&scioq=source:%22journal+of+the+american+chemical+society%22+photoredox+dft&hl=en&as_sdt=0,5&as_vis=1"
238,"Q Zhi, W Liu, R Jiang, X Zhan, Y Jin, ...","Piperazine-Linked Metalphthalocyanine Frameworks for Highly Efficient Visible-Light-Driven H2O2 Photosynthesis",2022,"… American Chemical …","ACS Publications","https://pubs.acs.org/doi/abs/10.1021/jacs.2c09482","https://scholar.google.com/scholar?cites=12103305155317818160&as_sdt=2005&sciodt=0,5&hl=en",503,"2025-05-18 18:01:29","","10.1021/jacs.2c09482","","",,,,,238,79.33,40,6,3,"… To deeply understand the high catalytic performance of CoPc-BTM-COF and CoPc-DAB-COF toward 2e – ORR, DFT calculations were conducted on their asymmetric units. At the first …","","https://scholar.google.com/scholar?q=related:MGPfpumT96cJ:scholar.google.com/&scioq=source:%22journal+of+the+american+chemical+society%22+photoredox+dft&hl=en&as_sdt=0,5&as_vis=1"
2,"G Ham, Y Kim, WD Jang, S Kim","An Isolable Triarylphosphine Radical Cation Electronically Stabilized by Through-Space Radical Delocalization",2024,"… the American Chemical Society","ACS Publications","https://pubs.acs.org/doi/abs/10.1021/jacs.4c13968","https://scholar.google.com/scholar?cites=10277101064801571972&as_sdt=2005&sciodt=0,5&hl=en",504,"2025-05-18 18:01:29","","10.1021/jacs.4c13968","","",,,,,2,2.00,1,4,1,"… DFT computational studies further support the through-space radical delocalization mechanism, revealing that the HOMO of 1 exhibits antibonding character between the phosphorus …","","https://scholar.google.com/scholar?q=related:hFRJ0PeYn44J:scholar.google.com/&scioq=source:%22journal+of+the+american+chemical+society%22+photoredox+dft&hl=en&as_sdt=0,5&as_vis=1"
102,"G Li, TV Nykaza, JC Cooper, A Ramirez, ...","An Improved PIII/PV═O-Catalyzed Reductive C–N Coupling of Nitroaromatics and Boronic Acids by Mechanistic Differentiation of Rate- and Product-Determining …",2020,"… American Chemical …","ACS Publications","https://pubs.acs.org/doi/abs/10.1021/jacs.0c01666","https://scholar.google.com/scholar?cites=12444169179991062329&as_sdt=2005&sciodt=0,5&hl=en",505,"2025-05-18 18:01:29","","10.1021/jacs.0c01666","","",,,,,102,20.40,20,5,5,"… Mechanistic proposal for catalytic reductive C–N coupling supported by density functional theory (DFT) calculations at the M06-2X/6-311++G(d,p)/PCM(m-xylene) level of theory. …","https://pubs.acs.org/doi/pdf/10.1021/jacs.0c01666","https://scholar.google.com/scholar?q=related:OTc76u-RsqwJ:scholar.google.com/&scioq=source:%22journal+of+the+american+chemical+society%22+photoredox+dft&hl=en&as_sdt=0,5&as_vis=1"
4,"J Wang, S Bai, C Yang, X Qi","Enantioselective Decarboxylative C(sp3)-C(sp3) Cross-Coupling of Aliphatic Redox-Active Esters with gem-Borazirconocene Alkanes",2024,"Journal of the American Chemical …","ACS Publications","https://pubs.acs.org/doi/abs/10.1021/jacs.4c09245","https://scholar.google.com/scholar?cites=3993058213625225282&as_sdt=2005&sciodt=0,5&hl=en",506,"2025-05-18 18:01:29","","10.1021/jacs.4c09245","","",,,,,4,4.00,1,4,1,"… s group disclosed a cooperative photoredox/Fe/chiral primary … sp 3 )–H bonds via photoredox and nickel catalysis (Figure 1A… Density functional theory (DFT) calculations were performed …","","https://scholar.google.com/scholar?q=related:QmCWBkoxajcJ:scholar.google.com/&scioq=source:%22journal+of+the+american+chemical+society%22+photoredox+dft&hl=en&as_sdt=0,5&as_vis=1"
6,"I Levine, D Menzel, A Musiienko, ...","Revisiting sub-band gap emission mechanism in 2D halide perovskites: the role of defect states",2024,"… American Chemical …","ACS Publications","https://pubs.acs.org/doi/abs/10.1021/jacs.4c06621","https://scholar.google.com/scholar?cites=1769086419103640324&as_sdt=2005&sciodt=0,5&hl=en",507,"2025-05-18 18:01:29","","10.1021/jacs.4c06621","","",,,,,6,6.00,2,4,1,"… , we now turn our attention to DFT calculations. Earlier DFT calculations on the ground state … we created a BA 2 PbI 4 slab and used DFT to determine if common material defects lead to …","https://pubs.acs.org/doi/full/10.1021/jacs.4c06621","https://scholar.google.com/scholar?q=related:BOujo7kOjRgJ:scholar.google.com/&scioq=source:%22journal+of+the+american+chemical+society%22+photoredox+dft&hl=en&as_sdt=0,5&as_vis=1"
71,"C Sandford, LR Fries, TE Ball, SD Minteer, ...","Mechanistic studies into the oxidative addition of Co (I) complexes: combining electroanalytical techniques with parameterization",2019,"… American Chemical …","ACS Publications","https://pubs.acs.org/doi/abs/10.1021/jacs.9b10771","https://scholar.google.com/scholar?cites=18302345636143987737&as_sdt=2005&sciodt=0,5&hl=en",508,"2025-05-18 18:01:29","","10.1021/jacs.9b10771","","",,,,,71,11.83,14,5,6,"… catalysis, including photoredox catalysis and electrocatalysis, … As part of our program on utilizing multiple DFT-derived … whether parameters determined by DFT would allow delineation …","https://pubs.acs.org/doi/pdf/10.1021/jacs.9b10771","https://scholar.google.com/scholar?q=related:GXzI1mL-_v0J:scholar.google.com/&scioq=source:%22journal+of+the+american+chemical+society%22+photoredox+dft&hl=en&as_sdt=0,5&as_vis=1"
51,"YS Won, YS Kim, TJ Anderson, LL Reitfort, ...","… decomposition of aryl-and alkylimido precursors for the chemical vapor deposition of tungsten nitride: A combined density functional theory and experimental study",2006,"… American Chemical …","ACS Publications","https://pubs.acs.org/doi/abs/10.1021/ja0621804","https://scholar.google.com/scholar?cites=11410489978895043645&as_sdt=2005&sciodt=0,5&hl=en",509,"2025-05-18 18:01:29","","10.1021/ja0621804","","",,,,,51,2.68,10,5,19,"… In this study, we present density functional theory (DFT) calculations used to analyze bonding in the alkyl- and arylimido complexes 1−3. In addition, computational study of the CH 3 CN …","https://www.academia.edu/download/40369423/Homogeneous_Decomposition_of_Aryl-_and_A20151125-13696-yb8u95.pdf","https://scholar.google.com/scholar?q=related:PYwxMS40Wp4J:scholar.google.com/&scioq=source:%22journal+of+the+american+chemical+society%22+photoredox+dft&hl=en&as_sdt=0,5&as_vis=1"
4,"X Qiao, S Zhai, J Xu, H He, X He, L Hu, ...","Asymmetric Photoinduced Excited-State Nazarov Reaction",2024,"… the American Chemical …","ACS Publications","https://pubs.acs.org/doi/abs/10.1021/jacs.4c11481","https://scholar.google.com/scholar?cites=10994253164274311372&as_sdt=2005&sciodt=0,5&hl=en",510,"2025-05-18 18:01:29","","10.1021/jacs.4c11481","","",,,,,4,4.00,1,7,1,"… Based on the control experiments of chiral catalysts and DFT calculation, we concluded that the amide and thiourea groups in the chiral catalysts play a key role as H-bond donors, …","","https://scholar.google.com/scholar?q=related:zOBIuwBvk5gJ:scholar.google.com/&scioq=source:%22journal+of+the+american+chemical+society%22+photoredox+dft&hl=en&as_sdt=0,5&as_vis=1"
