Cites,Authors,Title,Year,Source,Publisher,ArticleURL,CitesURL,GSRank,QueryDate,Type,DOI,ISSN,CitationURL,Volume,Issue,StartPage,EndPage,ECC,CitesPerYear,CitesPerAuthor,AuthorCount,Age,Abstract,FullTextURL,RelatedURL
55,"X Chen, BB Mendes, Y Zhuang, J Conniot, ...","A Fluorinated BODIPY-Based Zirconium Metal–Organic Framework for In Vivo Enhanced Photodynamic Therapy",2024,"… American Chemical …","ACS Publications","https://pubs.acs.org/doi/abs/10.1021/jacs.3c12416","https://scholar.google.com/scholar?cites=89875112832918170&as_sdt=2005&sciodt=0,5&hl=en",751,"2025-05-18 18:01:29","","10.1021/jacs.3c12416","","",,,,,55,55.00,11,5,1,"Photodynamic therapy (PDT), an emergent noninvasive cancer treatment, is largely dependent on the presence of efficient photosensitizers (PSs) and a sufficient oxygen supply. …","https://pubs.acs.org/doi/full/10.1021/jacs.3c12416","https://scholar.google.com/scholar?q=related:muKNXvBMPwEJ:scholar.google.com/&scioq=source:%22journal+of+the+american+chemical+society%22+photoredox+dft&hl=en&as_sdt=0,5&as_vis=1"
18,"NJ Kuehl, MT Taylor","Rapid biomolecular trifluoromethylation using cationic aromatic sulfonate esters as visible-light-triggered radical photocages",2023,"Journal of the American Chemical Society","ACS Publications","https://pubs.acs.org/doi/abs/10.1021/jacs.3c08098","https://scholar.google.com/scholar?cites=2186682611831697529&as_sdt=2005&sciodt=0,5&hl=en",752,"2025-05-18 18:01:29","","10.1021/jacs.3c08098","","",,,,,18,9.00,9,2,2,"… DFT calculations suggest that the S–OAr bond in 5 is weakened by 36 kcal/mol compared to triflic acid and should … b Average value from DFT calculations using three different theories. …","https://pmc.ncbi.nlm.nih.gov/articles/PMC11076010/pdf/nihms-1987965.pdf","https://scholar.google.com/scholar?q=related:eXDA-j-oWB4J:scholar.google.com/&scioq=source:%22journal+of+the+american+chemical+society%22+photoredox+dft&hl=en&as_sdt=0,5&as_vis=1"
28,"Z Zhou, J Kweon, H Jung, D Kim, S Seo, ...","Photoinduced Transition-Metal-Free Chan–Evans–Lam-Type Coupling: Dual Photoexcitation Mode with Halide Anion Effect",2022,"… American Chemical …","ACS Publications","https://pubs.acs.org/doi/abs/10.1021/jacs.2c03343","https://scholar.google.com/scholar?cites=14216582177198875315&as_sdt=2005&sciodt=0,5&hl=en",753,"2025-05-18 18:01:29","","10.1021/jacs.2c03343","","",,,,,28,9.33,5,6,3,"… This experimental outcome was in fact consistent with our DFT calculations, which showed that the 1,2-aryl migration of VI has a high activation barrier (ΔG ‡ = 31.9 kcal/mol) (see …","","https://scholar.google.com/scholar?q=related:s6IW4CpyS8UJ:scholar.google.com/&scioq=source:%22journal+of+the+american+chemical+society%22+photoredox+dft&hl=en&as_sdt=0,5&as_vis=1"
3,"PM Keil, S Ezendu, A Schulz, M Kubisz, ...","Thermodynamic Modulation of Dihydrogen Activation Through Rational Ligand Design in GeII–Ni0 Complexes",2024,"… American Chemical …","ACS Publications","https://pubs.acs.org/doi/abs/10.1021/jacs.4c08297","https://scholar.google.com/scholar?cites=3760101983987508636&as_sdt=2005&sciodt=0,5&hl=en",754,"2025-05-18 18:01:29","","10.1021/jacs.4c08297","","",,,,,3,3.00,1,5,1,"… To gain further insights into the H 2 activation reaction, we used DFT to calculate the … In addition to these differences being within the expected accuracy of DFT methods (∼5 kcal/mol), …","https://pubs.acs.org/doi/full/10.1021/jacs.4c08297","https://scholar.google.com/scholar?q=related:nCXRItWQLjQJ:scholar.google.com/&scioq=source:%22journal+of+the+american+chemical+society%22+photoredox+dft&hl=en&as_sdt=0,5&as_vis=1"
17,"SV Park, AR Corcos, AN Jambor, T Yang, ...","Formation of the N≡ N triple bond from reductive coupling of a paramagnetic diruthenium nitrido compound",2022,"… American Chemical …","ACS Publications","https://pubs.acs.org/doi/abs/10.1021/jacs.1c13396","https://scholar.google.com/scholar?cites=18242736996080440282&as_sdt=2005&sciodt=0,5&hl=en",755,"2025-05-18 18:01:29","","10.1021/jacs.1c13396","","",,,,,17,5.67,3,5,3,"… method of DFT used (see Table S4; |P| = 0.13 based on CASSCF). This implies that DFT may … previous argument on the need to interpret DFT-calculated spin populations with caution. …","https://www.osti.gov/pages/servlets/purl/1860490","https://scholar.google.com/scholar?q=related:2lNAzqQ4K_0J:scholar.google.com/&scioq=source:%22journal+of+the+american+chemical+society%22+photoredox+dft&hl=en&as_sdt=0,5&as_vis=1"
7,"X Wang, S Xue, M Huang, W Lin, Y Hou, ...","Pressure-Induced Engineering of Surface Oxygen Vacancies on Metal Oxides for Heterogeneous Photocatalysis",2025,"… American Chemical …","ACS Publications","https://pubs.acs.org/doi/abs/10.1021/jacs.4c14073","https://scholar.google.com/scholar?cites=487981836697167889&as_sdt=2005&sciodt=0,5&hl=en",756,"2025-05-18 18:01:29","","10.1021/jacs.4c14073","","",,,,,7,7.00,1,6,1,"… are advantageous for heterogeneous photoredox reactions, such … was studied by density functional theory (DFT) simulation. … surface are beneficial for photoredox reactions, in particular, …","","https://scholar.google.com/scholar?q=related:EWgtIeWoxQYJ:scholar.google.com/&scioq=source:%22journal+of+the+american+chemical+society%22+photoredox+dft&hl=en&as_sdt=0,5&as_vis=1"
30,"NY Shin, E Tsui, A Reinhold, GD Scholes, ...","Radicals as exceptional electron-withdrawing groups: nucleophilic aromatic substitution of halophenols via homolysis-enabled electronic activation",2022,"… American Chemical …","ACS Publications","https://pubs.acs.org/doi/abs/10.1021/jacs.2c10296","https://scholar.google.com/scholar?cites=3062562003846314527&as_sdt=2005&sciodt=0,5&hl=en",757,"2025-05-18 18:01:29","","10.1021/jacs.2c10296","","",,,,,30,10.00,6,5,3,"… DFT calculations carried out using Gaussian 16 at UM11/6-311++G(d,p)/CPCM(MeCN) level of theory. The overall thermochemistry for the nucleophilic substitution is close to …","https://pmc.ncbi.nlm.nih.gov/articles/PMC10512454/pdf/nihms-1931453.pdf","https://scholar.google.com/scholar?q=related:HzrelepngCoJ:scholar.google.com/&scioq=source:%22journal+of+the+american+chemical+society%22+photoredox+dft&hl=en&as_sdt=0,5&as_vis=1"
33,"G Li, WB Swords, GJ Meyer","Bromide photo-oxidation sensitized to visible light in consecutive ion pairs",2017,"Journal of the American Chemical …","ACS Publications","https://pubs.acs.org/doi/abs/10.1021/jacs.7b06735","https://scholar.google.com/scholar?cites=13734229125546648972&as_sdt=2005&sciodt=0,5&hl=en",758,"2025-05-18 18:01:29","","10.1021/jacs.7b06735","","",,,,,33,4.13,11,3,8,"… studies complimented by density functional theory (DFT) calculations revealed how the ion-… Such well-defined ion pairs provided a new opportunity to quantify halide photoredox …","https://cdr.lib.unc.edu/downloads/2801pt251","https://scholar.google.com/scholar?q=related:jCUIZJ_Imb4J:scholar.google.com/&scioq=source:%22journal+of+the+american+chemical+society%22+photoredox+dft&hl=en&as_sdt=0,5&as_vis=1"
47,"YP Budiman, A Jayaraman, A Friedrich, ...","Palladium-catalyzed homocoupling of highly fluorinated arylboronates: studies of the influence of strongly vs weakly coordinating solvents on the reductive elimination …",2020,"… American Chemical …","ACS Publications","https://pubs.acs.org/doi/abs/10.1021/jacs.9b11871","https://scholar.google.com/scholar?cites=11966262997796510132&as_sdt=2005&sciodt=0,5&hl=en",759,"2025-05-18 18:01:29","","10.1021/jacs.9b11871","","",,,,,47,9.40,12,4,5,"… DFT computations reveal that the active catalyst formed by arene solvent coordination leads to an overall reduced barrier for the reductive elimination step compared to the formation of …","","https://scholar.google.com/scholar?q=related:tNmP6Mu0EKYJ:scholar.google.com/&scioq=source:%22journal+of+the+american+chemical+society%22+photoredox+dft&hl=en&as_sdt=0,5&as_vis=1"
1,"Q Xu, J Han, F Tian, X Zhao, J Rong, ...","Synergistic Bifunctional Covalent Organic Framework for Efficient Photocatalytic CO2 Reduction and Water Oxidation",2025,"… American Chemical …","ACS Publications","https://pubs.acs.org/doi/abs/10.1021/jacs.5c00432","https://scholar.google.com/scholar?cites=17910808119448629119&as_sdt=2005&sciodt=0,5&hl=en",760,"2025-05-18 18:01:29","","10.1021/jacs.5c00432","","",,,,,1,1.00,0,6,1,"… Furthermore, density functional theory (DFT) calculations for Btt-Bpy COF show that the highest occupied molecular orbital (HOMO) (Figures 3e and S22) is concentrated around the …","","https://scholar.google.com/scholar?q=related:f-_qzxb5j_gJ:scholar.google.com/&scioq=source:%22journal+of+the+american+chemical+society%22+photoredox+dft&hl=en&as_sdt=0,5&as_vis=1"
13,"B Wan, Y Yuan, L Zheng, Y Xu, S Zhao, ...","BaCu, a two-dimensional electride with Cu anions",2024,"… American Chemical …","ACS Publications","https://pubs.acs.org/doi/abs/10.1021/jacs.4c05723","https://scholar.google.com/scholar?cites=9826412309318887671&as_sdt=2005&sciodt=0,5&hl=en",761,"2025-05-18 18:01:29","","10.1021/jacs.4c05723","","",,,,,13,13.00,2,6,1,"… In contrast to typical ionic 2D electrides with p-block anions, density functional theory calculations find that the orbital hybridization between the delocalized anionic electrons and BaCu …","","https://scholar.google.com/scholar?q=related:92h6ye5tXogJ:scholar.google.com/&scioq=source:%22journal+of+the+american+chemical+society%22+photoredox+dft&hl=en&as_sdt=0,5&as_vis=1"
168,"Z Li, G Davidson-Rozenfeld, ...","Multi-triggered supramolecular DNA/bipyridinium dithienylethene hydrogels driven by light, redox, and chemical stimuli for shape-memory and self-healing …",2018,"… American Chemical …","ACS Publications","https://pubs.acs.org/doi/abs/10.1021/jacs.8b10481","https://scholar.google.com/scholar?cites=6745809764789108391&as_sdt=2005&sciodt=0,5&hl=en",762,"2025-05-18 18:01:29","","10.1021/jacs.8b10481","","",,,,,168,24.00,56,3,7,"… The tensile force of the intact hydrogel cross-linked by the K + -stabilized G-quadruplexes and the photo-/redox-responsive dopamine/DTE c interactions corresponded to 30–32 mN. In …","","https://scholar.google.com/scholar?q=related:p76dgD3unV0J:scholar.google.com/&scioq=source:%22journal+of+the+american+chemical+society%22+photoredox+dft&hl=en&as_sdt=0,5&as_vis=1"
23,"ME Akana, S Tcyrulnikov, ...","Computational methods enable the prediction of improved catalysts for nickel-catalyzed cross-electrophile coupling",2024,"… American Chemical …","ACS Publications","https://pubs.acs.org/doi/abs/10.1021/jacs.3c09554","https://scholar.google.com/scholar?cites=14715285148185956235&as_sdt=2005&sciodt=0,5&hl=en",763,"2025-05-18 18:01:29","","10.1021/jacs.3c09554","","",,,,,23,23.00,8,3,1,"… To gain insight into the intrinsic characteristics of each catalyst and adequately describe this diversity, we generated a library of DFT-optimized (L)Ni II (Ph)Br (Figure 2A) complexes …","https://par.nsf.gov/servlets/purl/10489752","https://scholar.google.com/scholar?q=related:i480muAxN8wJ:scholar.google.com/&scioq=source:%22journal+of+the+american+chemical+society%22+photoredox+dft&hl=en&as_sdt=0,5&as_vis=1"
43,"W Jo, S Baek, C Hwang, J Heo, MH Baik, ...","ZnMe2-Mediated, Direct Alkylation of Electron-Deficient N-Heteroarenes with 1,1-Diborylalkanes: Scope and Mechanism",2020,"… American Chemical …","ACS Publications","https://pubs.acs.org/doi/abs/10.1021/jacs.0c06827","https://scholar.google.com/scholar?cites=13087985612186976241&as_sdt=2005&sciodt=0,5&hl=en",764,"2025-05-18 18:01:29","","10.1021/jacs.0c06827","","",,,,,43,8.60,7,6,5,"… density functional theory (DFT) calculations. Since it is well-established that ZnMe 2 can initiate radical reactions, (13) we examined whether our reaction involves a radical pathway. …","","https://scholar.google.com/scholar?q=related:8f_TN5LdobUJ:scholar.google.com/&scioq=source:%22journal+of+the+american+chemical+society%22+photoredox+dft&hl=en&as_sdt=0,5&as_vis=1"
37,"H Xie, Z Li, Y Liu, Y Zhang, C Uher, ...","Silver atom off-centering in diamondoid solid solutions causes crystallographic distortion and suppresses lattice thermal conductivity",2023,"… American Chemical …","ACS Publications","https://pubs.acs.org/doi/abs/10.1021/jacs.2c13179","https://scholar.google.com/scholar?cites=3488391799152243470&as_sdt=2005&sciodt=0,5&hl=en",765,"2025-05-18 18:01:29","","10.1021/jacs.2c13179","","",,,,,37,18.50,6,6,2,"… out first-principles density functional theory (DFT) … DFT calculation, this model is in fact an ordered structure and cannot simulate the actual condition of a disordered alloy. Thus, the DFT …","","https://scholar.google.com/scholar?q=related:DvPa6dtBaTAJ:scholar.google.com/&scioq=source:%22journal+of+the+american+chemical+society%22+photoredox+dft&hl=en&as_sdt=0,5&as_vis=1"
38,"J Wang, T Ding, C Nie, M Wang, P Zhou, ...","Spin-controlled charge-recombination pathways across the inorganic/organic interface",2020,"… the American Chemical …","ACS Publications","https://pubs.acs.org/doi/abs/10.1021/jacs.9b12724","https://scholar.google.com/scholar?cites=4928634816589498651&as_sdt=2005&sciodt=0,5&hl=en",766,"2025-05-18 18:01:29","","10.1021/jacs.9b12724","","",,,,,38,7.60,6,6,5,"… from solar energy conversion using singlet fission and triplet fusion to photoredox catalysis. … The density functional theory (DFT) and time-dependent DFT (TD-DFT) calculations in the …","","https://scholar.google.com/scholar?q=related:G4lwrkAHZkQJ:scholar.google.com/&scioq=source:%22journal+of+the+american+chemical+society%22+photoredox+dft&hl=en&as_sdt=0,5&as_vis=1"
2,"C Liu, G Rao, J Nguyen, RD Britt, ...","O2 Activation and Enzymatic C–H Bond Activation Mediated by a Dimanganese Cofactor",2025,"… of the American Chemical …","ACS Publications","https://pubs.acs.org/doi/abs/10.1021/jacs.4c16271","https://scholar.google.com/scholar?cites=3934579257068609917&as_sdt=2005&sciodt=0,5&hl=en",767,"2025-05-18 18:01:29","","10.1021/jacs.4c16271","","",,,,,2,2.00,0,5,1,"… Importantly, Mn 2 –SfbO samples subjected to this photoredox … subjected to this photoredox protocol exhibit identical … from gas-phase Density Functional Theory (DFT) computations on …","https://pmc.ncbi.nlm.nih.gov/articles/PMC11819613/","https://scholar.google.com/scholar?q=related:feEx7vxumjYJ:scholar.google.com/&scioq=source:%22journal+of+the+american+chemical+society%22+photoredox+dft&hl=en&as_sdt=0,5&as_vis=1"
4,"H Pan, Q An, BK Mai, Y Chen, P Liu, ...","Iron-Catalyzed Aerobic Carbonylation of Methane via Ligand-to-Metal Charge Transfer Excitation",2025,"… of the American Chemical …","ACS Publications","https://pubs.acs.org/doi/abs/10.1021/jacs.4c16449","https://scholar.google.com/scholar?cites=16922525995975245286&as_sdt=2005&sciodt=0,5&hl=en",768,"2025-05-18 18:01:29","","10.1021/jacs.4c16449","","",,,,,4,4.00,1,6,1,"… To probe the mechanisms of methyl radical interception by iron complexes and the C2 product formation, density functional theory (DFT) calculations were carried out (Figure 3E). The …","https://pubs.acs.org/doi/full/10.1021/jacs.4c16449","https://scholar.google.com/scholar?q=related:5v1q5Lvj2OoJ:scholar.google.com/&scioq=source:%22journal+of+the+american+chemical+society%22+photoredox+dft&hl=en&as_sdt=0,5&as_vis=1"
68,"Z Ding, Z Guo, Y Zheng, Z Wang, Q Fu, ...","Radiotherapy Reduces N-Oxides for Prodrug Activation in Tumors",2022,"… the American Chemical …","ACS Publications","https://pubs.acs.org/doi/abs/10.1021/jacs.2c02521","https://scholar.google.com/scholar?cites=4055254849984342983&as_sdt=2005&sciodt=0,5&hl=en",769,"2025-05-18 18:01:29","","10.1021/jacs.2c02521","","",,,,,68,22.67,11,6,3,"… To further test this hypothesis, the B3LYP method was used for density functional theory (DFT) calculation (details are shown in the Supporting Information). According to the LUMO …","https://drive.google.com/file/d/1vKUc7emBdjaRrhrRn2blHqNJpVAGfg-j/view","https://scholar.google.com/scholar?q=related:xyv_5swoRzgJ:scholar.google.com/&scioq=source:%22journal+of+the+american+chemical+society%22+photoredox+dft&hl=en&as_sdt=0,5&as_vis=1"
19,"S Lan, H Huang, W Liu, C Xu, X Lei, ...","Asymmetric transfer hydrogenation of cyclobutenediones",2024,"… American Chemical …","ACS Publications","https://pubs.acs.org/doi/abs/10.1021/jacs.3c14239","https://scholar.google.com/scholar?cites=12829765730491415912&as_sdt=2005&sciodt=0,5&hl=en",770,"2025-05-18 18:01:29","","10.1021/jacs.3c14239","","",,,,,19,19.00,3,6,1,"… To get more mechanistic insights into the reaction, we conducted a series of control experiments and DFT calculations. First, when the phenyl ring in the substrate was replaced by a …","","https://scholar.google.com/scholar?q=related:aL1r9fR7DLIJ:scholar.google.com/&scioq=source:%22journal+of+the+american+chemical+society%22+photoredox+dft&hl=en&as_sdt=0,5&as_vis=1"
163,"DG Congrave, BH Drummond, ...","A simple molecular design strategy for delayed fluorescence toward 1000 nm",2019,"… American Chemical …","ACS Publications","https://pubs.acs.org/doi/abs/10.1021/jacs.9b09323","https://scholar.google.com/scholar?cites=3167400775652179935&as_sdt=2005&sciodt=0,5&hl=en",771,"2025-05-18 18:01:29","","10.1021/jacs.9b09323","","",,,,,163,27.17,54,3,6,"… This assignment is supported by TD-DFT (Figure S7). The photoluminescence (PL) is broad and unstructured (toluene λ max = 770 nm) and exhibits positive solvatochromism (Figures …","https://pubs.acs.org/doi/full/10.1021/jacs.9b09323","https://scholar.google.com/scholar?q=related:338LTjne9CsJ:scholar.google.com/&scioq=source:%22journal+of+the+american+chemical+society%22+photoredox+dft&hl=en&as_sdt=0,5&as_vis=1"
35,"JE Rosenberger, Y Xie, Y Fang, X Lyu, ...","Ligand-directed photocatalysts and far-red light enable catalytic bioorthogonal uncaging inside live cells",2023,"… American Chemical …","ACS Publications","https://pubs.acs.org/doi/abs/10.1021/jacs.2c10655","https://scholar.google.com/scholar?cites=8038515038712345472&as_sdt=2005&sciodt=0,5&hl=en",772,"2025-05-18 18:01:29","","10.1021/jacs.2c10655","","",,,,,35,17.50,7,5,2,"… DFT calculations were used to predict whether the intramolecular cycloaddition would be … DHTz-based photoredox cages were synthesized as shown in Figure 3. Compound 1 was …","https://pmc.ncbi.nlm.nih.gov/articles/PMC10589873/pdf/nihms-1932648.pdf","https://scholar.google.com/scholar?q=related:gLMVfNaKjm8J:scholar.google.com/&scioq=source:%22journal+of+the+american+chemical+society%22+photoredox+dft&hl=en&as_sdt=0,5&as_vis=1"
17,"C Romano, L Talavera, ...","Conformational Flexibility as a Tool for Enabling Site-Selective Functionalization of Unactivated sp3 C–O Bonds in Cyclic Acetals",2022,"… American Chemical …","ACS Publications","https://pubs.acs.org/doi/abs/10.1021/jacs.2c04513","https://scholar.google.com/scholar?cites=10657157015763496304&as_sdt=2005&sciodt=0,5&hl=en",773,"2025-05-18 18:01:29","","10.1021/jacs.2c04513","","",,,,,17,5.67,6,3,3,"… As anticipated from the DFT studies in Scheme 3, all our efforts to promote the sp 3 C–O arylation of either II-a or II-b (Scheme 3) were met with failure, corroborating the inability of five- …","https://pubs.acs.org/doi/full/10.1021/jacs.2c04513","https://scholar.google.com/scholar?q=related:cC0lgNfT5ZMJ:scholar.google.com/&scioq=source:%22journal+of+the+american+chemical+society%22+photoredox+dft&hl=en&as_sdt=0,5&as_vis=1"
13,"A Cotic, S Cerfontaine, LD Slep, B Elias, ...","Anti-dissipative strategies toward more efficient solar energy conversion",2023,"… American Chemical …","ACS Publications","https://pubs.acs.org/doi/abs/10.1021/jacs.2c11593","https://scholar.google.com/scholar?cites=5600449521758800194&as_sdt=2005&sciodt=0,5&hl=en",774,"2025-05-18 18:01:29","","10.1021/jacs.2c11593","","",,,,,13,6.50,3,5,2,"… in energy conversion devices, photoredox catalysis, and solar fuels production. … However, the calculated DFT structures of 3 MLCT(L p ) and 3 MLCT(L m ), which include L p •– and L m •…","https://www.researchsquare.com/article/rs-1760783/latest.pdf","https://scholar.google.com/scholar?q=related:Qonw5irLuE0J:scholar.google.com/&scioq=source:%22journal+of+the+american+chemical+society%22+photoredox+dft&hl=en&as_sdt=0,5&as_vis=1"
58,"L Troian-Gautier, EE Beauvilliers, ...","Redox active ion-paired excited states undergo dynamic electron transfer",2016,"… American Chemical …","ACS Publications","https://pubs.acs.org/doi/abs/10.1021/jacs.6b11337","https://scholar.google.com/scholar?cites=4318112448727115022&as_sdt=2005&sciodt=0,5&hl=en",775,"2025-05-18 18:01:29","","10.1021/jacs.6b11337","","",,,,,58,6.44,19,3,9,"… to be the most ideal when photoredox chemistry is desired. … The use of DFT computations to quantify the work terms for … photoredox chemistry and solar energy conversion applications. …","https://cdr.lib.unc.edu/downloads/rf55zk758","https://scholar.google.com/scholar?q=related:DmWSzmQE7TsJ:scholar.google.com/&scioq=source:%22journal+of+the+american+chemical+society%22+photoredox+dft&hl=en&as_sdt=0,5&as_vis=1"
43,"R Sang, W Han, H Zhang, CM Saunders, ...","Copper-Mediated Dehydrogenative C(sp3)–H Borylation of Alkanes",2023,"… American Chemical …","ACS Publications","https://pubs.acs.org/doi/abs/10.1021/jacs.3c02185","https://scholar.google.com/scholar?cites=16146333563602015927&as_sdt=2005&sciodt=0,5&hl=en",776,"2025-05-18 18:01:29","","10.1021/jacs.3c02185","","",,,,,43,21.50,9,5,2,"… We investigated the C–B bond forming step using density functional theory (DFT) calculations and found that direct homolytic substitution of O(Bcat) 2 by alkyl radicals is kinetically and …","https://pubs.acs.org/doi/full/10.1021/jacs.3c02185","https://scholar.google.com/scholar?q=related:txZ3Q9RME-AJ:scholar.google.com/&scioq=source:%22journal+of+the+american+chemical+society%22+photoredox+dft&hl=en&as_sdt=0,5&as_vis=1"
113,"FC Parks, Y Liu, S Debnath, SR Stutsman, ...","Allosteric control of photofoldamers for selecting between anion regulation and double-to-single helix switching",2018,"… American Chemical …","ACS Publications","https://pubs.acs.org/doi/abs/10.1021/jacs.8b10538","https://scholar.google.com/scholar?cites=13607240598877044089&as_sdt=2005&sciodt=0,5&hl=en",777,"2025-05-18 18:01:29","","10.1021/jacs.8b10538","","",,,,,113,16.14,23,5,7,"… We believe this size matching can occur here given that the foldamer can expand its cavity to complement anion size; we verify this expansion using density functional theory (DFT, vide …","","https://scholar.google.com/scholar?q=related:ef1W_Tqh1rwJ:scholar.google.com/&scioq=source:%22journal+of+the+american+chemical+society%22+photoredox+dft&hl=en&as_sdt=0,5&as_vis=1"
37,"H Ren, P Zhang, J Xu, W Ma, D Tu, C Lu, ...","Direct B–H Functionalization of Icosahedral Carboranes via Hydrogen Atom Transfer",2023,"… the American Chemical …","ACS Publications","https://pubs.acs.org/doi/abs/10.1021/jacs.3c01314","https://scholar.google.com/scholar?cites=2545384687481272227&as_sdt=2005&sciodt=0,5&hl=en",778,"2025-05-18 18:01:29","","10.1021/jacs.3c01314","","",,,,,37,18.50,5,7,2,"… Very recently, our group also reported a photoredox-catalyzed decarboxylation of carborane … Density functional theory (DFT) calculations were thus performed for the bond dissociation …","","https://scholar.google.com/scholar?q=related:ozcKIuMFUyMJ:scholar.google.com/&scioq=source:%22journal+of+the+american+chemical+society%22+photoredox+dft&hl=en&as_sdt=0,5&as_vis=1"
0,"Y Yin, S Feng, X Xu, Y Liu, Y Li, L Gao, ...","Multivariate Tuning of Photosensitization in Mixed-Linker Metal–Organic Frameworks for Efficient CO2 Reduction",2025,"… American Chemical …","ACS Publications","https://pubs.acs.org/doi/abs/10.1021/jacs.5c02940","",779,"2025-05-18 18:01:29","","10.1021/jacs.5c02940","","",,,,,0,0.00,0,7,1,"… Transient spectra and density functional theory calculations reveal the critical role of the framework structure in promoting efficient intrareticular energy transfer and charge separation. …","","https://scholar.google.com/scholar?q=related:uIfLs1v9_XAJ:scholar.google.com/&scioq=source:%22journal+of+the+american+chemical+society%22+photoredox+dft&hl=en&as_sdt=0,5&as_vis=1"
76,"KJ Fallon, EM Churchill, SN Sanders, ...","Molecular engineering of chromophores to enable triplet–triplet annihilation upconversion",2020,"… American Chemical …","ACS Publications","https://pubs.acs.org/doi/abs/10.1021/jacs.0c06386","https://scholar.google.com/scholar?cites=7033395515114707075&as_sdt=2005&sciodt=0,5&hl=en",780,"2025-05-18 18:01:29","","10.1021/jacs.0c06386","","",,,,,76,15.20,19,4,5,"… Time-dependent density functional theory (TD-DFT) with … S 1 energies were first calculated with TD-DFT (CAM-B3LYP/cc-… energies (computed via TD-DFT without the TDA, using CAM-…","https://par.nsf.gov/servlets/purl/10223206","https://scholar.google.com/scholar?q=related:g9g82_Sjm2EJ:scholar.google.com/&scioq=source:%22journal+of+the+american+chemical+society%22+photoredox+dft&hl=en&as_sdt=0,5&as_vis=1"
12,"L Schlosser, D Rana, P Pflüger, ...","EnTdecker− A Machine Learning-Based Platform for Guiding Substrate Discovery in Energy Transfer Catalysis",2024,"… American Chemical …","ACS Publications","https://pubs.acs.org/doi/abs/10.1021/jacs.4c01352","https://scholar.google.com/scholar?cites=9759544369831317210&as_sdt=2005&sciodt=0,5&hl=en",781,"2025-05-18 18:01:29","","10.1021/jacs.4c01352","","",,,,,12,12.00,3,4,1,"… This restriction was applied due to the scaling behavior of DFT calculations with the number … (17) Consecutive optimizations for the singlet and triplet multiplicities on the DFT level yield …","","https://scholar.google.com/scholar?q=related:2o51ZeXdcIcJ:scholar.google.com/&scioq=source:%22journal+of+the+american+chemical+society%22+photoredox+dft&hl=en&as_sdt=0,5&as_vis=1"
