Cites,Authors,Title,Year,Source,Publisher,ArticleURL,CitesURL,GSRank,QueryDate,Type,DOI,ISSN,CitationURL,Volume,Issue,StartPage,EndPage,ECC,CitesPerYear,CitesPerAuthor,AuthorCount,Age,Abstract,FullTextURL,RelatedURL
536,"ZJ Zhao, S Liu, S Zha, D Cheng, F Studt…","Theory-guided design of catalytic materials using scaling relationships and reactivity descriptors",2019,"Nature Reviews …","nature.com","https://idp.nature.com/authorize/casa?redirect_uri=https://www.nature.com/articles/s41578-019-0152-x&casa_token=WurrjtvztdUAAAAA:2cDY6Ff9XpgHxk1AmsNXv7JoUmDCFPNervT9BBi5YG3f_zrJ8zpuKKXncs2wErf1WYc-itgD2e3lTnkb","https://scholar.google.com/scholar?cites=17604007018853359838&as_sdt=2005&sciodt=0,5&hl=en",486,"2025-05-05 22:12:12","HTML","","","",,,,,536,89.33,89,6,6,"… and DFT calculations … , DFT calculations show that the Pt/Cu SAA catalyst favours desorption of propylene rather than further hydrogenation and maintains a moderate activation barrier …","https://idp.nature.com/authorize/casa?redirect_uri=https://www.nature.com/articles/s41578-019-0152-x&casa_token=WurrjtvztdUAAAAA:2cDY6Ff9XpgHxk1AmsNXv7JoUmDCFPNervT9BBi5YG3f_zrJ8zpuKKXncs2wErf1WYc-itgD2e3lTnkb","https://scholar.google.com/scholar?q=related:3uA8Fh3_TfQJ:scholar.google.com/&scioq=source:nature+ch+activation+dft&hl=en&as_sdt=0,5&as_vis=1"
14,"HT Ang, Y Miao, D Ravelli, J Wu","Pyridine N-oxides as hydrogen atom transfer reagents for site-selective photoinduced C(sp3)–H functionalization",2024,"Nature Synthesis","nature.com","https://idp.nature.com/authorize/casa?redirect_uri=https://www.nature.com/articles/s44160-024-00528-2&casa_token=92DiAULU3ikAAAAA:YTG3vK5SsKhGIwYiW4irKI_zVHV_x9V-MB0ghzRmR4DOFGxF6J7opf8rPg4qj9DpSkEKxQ6rYDSjwHCc","https://scholar.google.com/scholar?cites=16401548639588026964&as_sdt=2005&sciodt=0,5&hl=en",487,"2025-05-05 22:12:12","HTML","","","",,,,,14,14.00,4,4,1,"… In this case, the HAT reagent can be activated via single-… and computed via density functional theory (DFT) calculations, … -2X method for their DFT calculations, they employed different …","https://idp.nature.com/authorize/casa?redirect_uri=https://www.nature.com/articles/s44160-024-00528-2&casa_token=92DiAULU3ikAAAAA:YTG3vK5SsKhGIwYiW4irKI_zVHV_x9V-MB0ghzRmR4DOFGxF6J7opf8rPg4qj9DpSkEKxQ6rYDSjwHCc","https://scholar.google.com/scholar?q=related:VIrvrJYBnuMJ:scholar.google.com/&scioq=source:nature+ch+activation+dft&hl=en&as_sdt=0,5&as_vis=1"
9,"A Kushwaha, N Goel","A DFT study of superior adsorbate–surface bonding at Pt-WSe2 vertically aligned heterostructures upon NO2, SO2, CO2, and H2 interactions",2024,"Scientific Reports","nature.com","https://www.nature.com/articles/s41598-024-65213-y","https://scholar.google.com/scholar?cites=8093037250951803985&as_sdt=2005&sciodt=0,5&hl=en",488,"2025-05-05 22:12:12","HTML","","","",,,,,9,9.00,5,2,1,"This study investigates the potential of platinum (Pt) decorated single-layer WSe 2 (Pt-WSe 2 ) monolayers as high-performance gas sensors for NO 2 , CO 2 , SO 2 , and H 2 using first-…","https://www.nature.com/articles/s41598-024-65213-y","https://scholar.google.com/scholar?q=related:UXT8QIA-UHAJ:scholar.google.com/&scioq=source:nature+ch+activation+dft&hl=en&as_sdt=0,5&as_vis=1"
51,"H Sato, K Narita, A Minami, M Yamazaki, C Wang…","Theoretical study of sesterfisherol biosynthesis: computational prediction of key amino acid residue in terpene synthase",2018,"Scientific Reports","nature.com","https://www.nature.com/articles/s41598-018-20916-x","https://scholar.google.com/scholar?cites=7420252581867590002&as_sdt=2005&sciodt=0,5&hl=en",489,"2025-05-05 22:12:12","HTML","","","",,,,,51,7.29,9,6,7,"… by the C–H···π interaction, and the activation barriers … We consider that DFT calculations are a powerful tool for … be predict in the absence of DFT calculation, especially as regards their …","https://www.nature.com/articles/s41598-018-20916-x","https://scholar.google.com/scholar?q=related:cpHktWgI-mYJ:scholar.google.com/&scioq=source:nature+ch+activation+dft&hl=en&as_sdt=0,5&as_vis=1"
64,"X Fan, M Zhang, Y Gao, Q Zhou, Y Zhang, J Yu…","Stepwise on-demand functionalization of multihydrosilanes enabled by a hydrogen-atom-transfer photocatalyst based on eosin Y",2023,"Nature …","nature.com","https://idp.nature.com/authorize/casa?redirect_uri=https://www.nature.com/articles/s41557-023-01155-8&casa_token=uOigfXyf__cAAAAA:1AzkzBXyuJ-VkkB8hukW6OnBwf2cdDscWMAbWqPQc4cb-eA_zteI0bh3vSNrYUAYZAciQmRvjILvZ7ur","https://scholar.google.com/scholar?cites=14537737668507480848&as_sdt=2005&sciodt=0,5&hl=en",490,"2025-05-05 22:12:12","HTML","","","",,,,,64,32.00,9,7,2,"… in a mixture of Si–H and C–H activation products 16 . The advent of photoinduced HAT … in the presence of C–H bonds 24 . Density functional theory (DFT) calculations indicated …","https://idp.nature.com/authorize/casa?redirect_uri=https://www.nature.com/articles/s41557-023-01155-8&casa_token=uOigfXyf__cAAAAA:1AzkzBXyuJ-VkkB8hukW6OnBwf2cdDscWMAbWqPQc4cb-eA_zteI0bh3vSNrYUAYZAciQmRvjILvZ7ur","https://scholar.google.com/scholar?q=related:EDM0oWJrwMkJ:scholar.google.com/&scioq=source:nature+ch+activation+dft&hl=en&as_sdt=0,5&as_vis=1"
150,"J Wang, R Li, Z Dong, P Liu, G Dong","Complementary site-selectivity in arene functionalization enabled by overcoming the ortho constraint in palladium/norbornene catalysis",2018,"Nature Chemistry","nature.com","https://idp.nature.com/authorize/casa?redirect_uri=https://www.nature.com/articles/s41557-018-0074-z&casa_token=wemlvoKKTKsAAAAA:7AIpbU2Udkihab2XgYNL-ScobxtHorfLTAGRVFtCqP3-IxDcqyF7EamW2BSwIfg1geQ_LWbsR4Hno7dm","https://scholar.google.com/scholar?cites=7988678681715555126&as_sdt=2005&sciodt=0,5&hl=en",491,"2025-05-05 22:12:12","HTML","","","",,,,,150,21.43,30,5,7,"… study using density functional theory (DFT) was performed (Fig. 4c). The key TSs for the second C–H … reduced activation energy, probably caused by easier extrusion of the bulkier NBE. …","https://idp.nature.com/authorize/casa?redirect_uri=https://www.nature.com/articles/s41557-018-0074-z&casa_token=wemlvoKKTKsAAAAA:7AIpbU2Udkihab2XgYNL-ScobxtHorfLTAGRVFtCqP3-IxDcqyF7EamW2BSwIfg1geQ_LWbsR4Hno7dm","https://scholar.google.com/scholar?q=related:NjtkaO983W4J:scholar.google.com/&scioq=source:nature+ch+activation+dft&hl=en&as_sdt=0,5&as_vis=1"
68,"R Ye, L Ma, J Mao, X Wang, X Hong, A Gallo…","A Ce-CuZn catalyst with abundant Cu/Zn-OV-Ce active sites for CO2 hydrogenation to methanol",2024,"Nature …","nature.com","https://www.nature.com/articles/s41467-024-46513-3","https://scholar.google.com/scholar?cites=7004559839394671251&as_sdt=2005&sciodt=0,5&hl=en",492,"2025-05-05 22:12:12","HTML","","","",,,,,68,68.00,10,7,1,"… Kumari et al. reported that the number of oxygen vacancies could influence CO 2 activation via lower reaction barriers of CO 2 dissociation 55 . Our DFT calculation results have shown …","https://www.nature.com/articles/s41467-024-46513-3","https://scholar.google.com/scholar?q=related:kyoW6w8yNWEJ:scholar.google.com/&scioq=source:nature+ch+activation+dft&hl=en&as_sdt=0,5&as_vis=1"
618,"Z Lei, Q Yang, Y Xu, S Guo, W Sun, H Liu, LP Lv…","Boosting lithium storage in covalent organic framework via activation of 14-electron redox chemistry",2018,"Nature …","nature.com","https://www.nature.com/articles/s41467-018-02889-7/briefing/signup","https://scholar.google.com/scholar?cites=12237397925007316810&as_sdt=2005&sciodt=0,5&hl=en",493,"2025-05-05 22:12:12","HTML","","","",,,,,618,88.29,77,8,7,"… Structural variations and the density functional theory (DFT) calculation of COF in COF@CNTs anode. a XRD patterns of as-prepared COF@CNTs and the COF@CNTs anode after the …","https://www.nature.com/articles/s41467-018-02889-7/briefing/signup","https://scholar.google.com/scholar?q=related:Stcph5P406kJ:scholar.google.com/&scioq=source:nature+ch+activation+dft&hl=en&as_sdt=0,5&as_vis=1"
32,"M Wang, S Liu, H Liu, Y Wang, Y Lan, Q Liu","Asymmetric hydrogenation of ketimines with minimally different alkyl groups",2024,"Nature","nature.com","https://idp.nature.com/authorize/casa?redirect_uri=https://www.nature.com/articles/s41586-024-07581-z&casa_token=Hf6xDK9TSCoAAAAA:93AaobmuMxESYXlMYZPdY80zDSzI2-zhYbytUaEvPjdcj524JOZghoouBLV4C_kRU1uORJRibhhCTydJ","https://scholar.google.com/scholar?cites=5315230520444489786&as_sdt=2005&sciodt=0,5&hl=en",494,"2025-05-05 22:12:12","HTML","","","",,,,,32,32.00,5,6,1,"… metal hydride species to activate the ketimine substrate more … control, density functional theory (DFT) calculations were … , which shows a smaller activation energy difference of 1.3 kcal …","https://idp.nature.com/authorize/casa?redirect_uri=https://www.nature.com/articles/s41586-024-07581-z&casa_token=Hf6xDK9TSCoAAAAA:93AaobmuMxESYXlMYZPdY80zDSzI2-zhYbytUaEvPjdcj524JOZghoouBLV4C_kRU1uORJRibhhCTydJ","https://scholar.google.com/scholar?q=related:OpBoPv99w0kJ:scholar.google.com/&scioq=source:nature+ch+activation+dft&hl=en&as_sdt=0,5&as_vis=1"
81,"X Li, Z Li, J Sun","Quinone methides and indole imine methides as intermediates in enantioselective catalysis",2022,"Nature Synthesis","nature.com","https://idp.nature.com/authorize/casa?redirect_uri=https://www.nature.com/articles/s44160-022-00072-x&casa_token=ekCiZjHCzrwAAAAA:eK2PJhnU4auTNZXrvcjIi5E6cOniua9qQTVwmFuGL27zutuXBqPoeAI-GP6SMRCj0TNWyWC3RqhvYyhs","https://scholar.google.com/scholar?cites=12886704470851275826&as_sdt=2005&sciodt=0,5&hl=en",495,"2025-05-05 22:12:12","HTML","","","",,,,,81,27.00,27,3,3,"… Based on DFT calculations, multiple hydrogen bonds play a role in achieving excellent … Based on DFT calculations, cooperative activation by hexafluoroisopropanol and a CPA catalyst …","https://idp.nature.com/authorize/casa?redirect_uri=https://www.nature.com/articles/s44160-022-00072-x&casa_token=ekCiZjHCzrwAAAAA:eK2PJhnU4auTNZXrvcjIi5E6cOniua9qQTVwmFuGL27zutuXBqPoeAI-GP6SMRCj0TNWyWC3RqhvYyhs","https://scholar.google.com/scholar?q=related:MkyHhnDF1rIJ:scholar.google.com/&scioq=source:nature+ch+activation+dft&hl=en&as_sdt=0,5&as_vis=1"
13,"X Liu, A Sau, AR Green, MV Popescu, NF Pompetti…","Photocatalytic C–F bond activation in small molecules and polyfluoroalkyl substances",2025,"Nature","nature.com","https://idp.nature.com/authorize/casa?redirect_uri=https://www.nature.com/articles/s41586-024-08327-7&casa_token=XTOV5hboOowAAAAA:NfL-94bemzNmkbVhq7dJkbw3GYcgmItjoEfbDI2DfmCaWRFbZryWMo8Ir7o1KbsATw7AeKJut0xQ7J58","https://scholar.google.com/scholar?cites=11958275828650610205&as_sdt=2005&sciodt=0,5&hl=en",496,"2025-05-05 22:12:12","HTML","","","",,,,,13,13.00,2,6,1,"… DFT calculations suggest that this potential is not sufficient to drive F – oxidation (requiring a … This observation is supported by DFT calculations (Supplementary Fig. 65) and can be …","https://idp.nature.com/authorize/casa?redirect_uri=https://www.nature.com/articles/s41586-024-08327-7&casa_token=XTOV5hboOowAAAAA:NfL-94bemzNmkbVhq7dJkbw3GYcgmItjoEfbDI2DfmCaWRFbZryWMo8Ir7o1KbsATw7AeKJut0xQ7J58","https://scholar.google.com/scholar?q=related:HQ7cLIJU9KUJ:scholar.google.com/&scioq=source:nature+ch+activation+dft&hl=en&as_sdt=0,5&as_vis=1"
122,"B Xie, RJ Wong, TH Tan, M Higham, EK Gibson…","Synergistic ultraviolet and visible light photo-activation enables intensified low-temperature methanol synthesis over copper/zinc oxide/alumina",2020,"Nature …","nature.com","https://www.nature.com/articles/s41467-020-15445-z","https://scholar.google.com/scholar?cites=10734442985330566940&as_sdt=2005&sciodt=0,5&hl=en",497,"2025-05-05 22:12:12","HTML","","","",,,,,122,24.40,20,6,5,"… To explore this possibility, first-principles density functional theory (DFT) calculations were performed to obtain the relative orbital energies for each of the identified reactants, products, …","https://www.nature.com/articles/s41467-020-15445-z","https://scholar.google.com/scholar?q=related:HOdPigVn-JQJ:scholar.google.com/&scioq=source:nature+ch+activation+dft&hl=en&as_sdt=0,5&as_vis=1"
71,"P Tholen, CA Peeples, R Schaper, C Bayraktar…","Semiconductive microporous hydrogen-bonded organophosphonic acid frameworks",2020,"Nature …","nature.com","https://www.nature.com/articles/s41467-020-16977-0","https://scholar.google.com/scholar?cites=8549366216531022745&as_sdt=2005&sciodt=0,5&hl=en",498,"2025-05-05 22:12:12","HTML","","","",,,,,71,14.20,14,5,5,"… Density functional theory (DFT) calculations To gain insight into the semiconductive nature of GTUB5, we performed DFT … These low activation energies suggest that a Grotthuss …","https://www.nature.com/articles/s41467-020-16977-0","https://scholar.google.com/scholar?q=related:mZMOB0dzpXYJ:scholar.google.com/&scioq=source:nature+ch+activation+dft&hl=en&as_sdt=0,5&as_vis=1"
16,"S Singh, AG Anil, B Uppara, SK Behera, B Nath, PN…","Adsorption and DFT investigations of Cr (VI) removal using nanocrystals decorated with graphene oxide",2024,"Npj Clean Water","nature.com","https://www.nature.com/articles/s41545-024-00306-9","https://scholar.google.com/scholar?cites=8435870992389993923&as_sdt=2005&sciodt=0,5&hl=en",499,"2025-05-05 22:12:12","HTML","","","",,,,,16,16.00,2,7,1,"… The density functional theory simulations showed that the nanocomposite had ten times more dynamic delocalized surface states, which enhanced the adsorption capacity and agreed …","https://www.nature.com/articles/s41545-024-00306-9","https://scholar.google.com/scholar?q=related:w3Vt8Pg7EnUJ:scholar.google.com/&scioq=source:nature+ch+activation+dft&hl=en&as_sdt=0,5&as_vis=1"
2,"W Shao, Y Zhang, Z Zhou, N Li, F Jiao, Y Ling…","Dynamic control and quantification of active sites on ceria for CO activation and hydrogenation",2024,"Nature …","nature.com","https://www.nature.com/articles/s41467-024-53948-1","https://scholar.google.com/scholar?cites=4575705305688671739&as_sdt=2005&sciodt=0,5&hl=en",500,"2025-05-05 22:12:12","HTML","","","",,,,,2,2.00,0,7,1,"… (SRPES and XPS), density functional theory (DFT) calculations and model catalytic studies … of CN Ce , which correlates with CO activation and hydrogenation. The structure-reactivity …","https://www.nature.com/articles/s41467-024-53948-1","https://scholar.google.com/scholar?q=related:-4VxfrsrgD8J:scholar.google.com/&scioq=source:nature+ch+activation+dft&hl=en&as_sdt=0,5&as_vis=1"
0,"Z Sun, W Shi, LR Smith, NF Dummer, H Qi…","Concerted catalysis of single atom and nanocluster enhances bio-ethanol activation and dehydrogenation",2025,"Nature …","nature.com","https://www.nature.com/articles/s41467-025-59127-0","",501,"2025-05-05 22:12:12","HTML","","","",,,,,0,0.00,0,6,1,"… DFT calculations further substantiate that the 1Ni/MTAC catalyst is more effective for facilitating the activation of ethanol and the subsequent dehydrogenation of the intermediate species…","https://www.nature.com/articles/s41467-025-59127-0","https://scholar.google.com/scholar?q=related:6Chmgkkx7IcJ:scholar.google.com/&scioq=source:nature+ch+activation+dft&hl=en&as_sdt=0,5&as_vis=1"
104,"J Quan, F Muttaqien, T Kondo, T Kozarashi, T Mogi…","Vibration-driven reaction of CO2 on Cu surfaces via Eley–Rideal-type mechanism",2019,"Nature Chemistry","nature.com","https://idp.nature.com/authorize/casa?redirect_uri=https://www.nature.com/articles/s41557-019-0282-1&casa_token=RtkHT6MVQ-4AAAAA:C7zv4njYoJeMtAaNzONYtJVFyJAfPcwoYrbOBCpS68vUUb0GSw_vb696i63_Y_qcs-uA-j85PBBjWobP","https://scholar.google.com/scholar?cites=1816787231072079326&as_sdt=2005&sciodt=0,5&hl=en",502,"2025-05-05 22:12:12","HTML","","","",,,,,104,17.33,17,6,6,"… (according to density functional theory (DFT) calculations 18,… the dynamics of CO 2 activation, by investigating the effects of … of molecular-beam studies combined with DFT calculations. …","https://idp.nature.com/authorize/casa?redirect_uri=https://www.nature.com/articles/s41557-019-0282-1&casa_token=RtkHT6MVQ-4AAAAA:C7zv4njYoJeMtAaNzONYtJVFyJAfPcwoYrbOBCpS68vUUb0GSw_vb696i63_Y_qcs-uA-j85PBBjWobP","https://scholar.google.com/scholar?q=related:3k2EZFyGNhkJ:scholar.google.com/&scioq=source:nature+ch+activation+dft&hl=en&as_sdt=0,5&as_vis=1"
134,"M Ouyang, KG Papanikolaou, A Boubnov…","Directing reaction pathways via in situ control of active site geometries in PdAu single-atom alloy catalysts",2021,"Nature …","nature.com","https://www.nature.com/articles/s41467-021-21555-z","https://scholar.google.com/scholar?cites=16218282330264406230&as_sdt=2005&sciodt=0,5&hl=en",503,"2025-05-05 22:12:12","HTML","","","",,,,,134,33.50,34,4,4,"… Our DFT calculations indicate that after the calcination and reduction process which … for the EDH reaction; the SAA phase is active for C–H activation but not C–C scission, yielding 100% …","https://www.nature.com/articles/s41467-021-21555-z","https://scholar.google.com/scholar?q=related:1ohn6tnpEuEJ:scholar.google.com/&scioq=source:nature+ch+activation+dft&hl=en&as_sdt=0,5&as_vis=1"
0,"J Hu, W Deng, J Zhou, Y Huang","Cathodic tandem alkylation/dearomatization of heterocycles enabled by Al-facilitated carbonyl deoxygenation",2025,"Nature Communications","nature.com","https://www.nature.com/articles/s41467-025-56367-y","",504,"2025-05-05 22:12:12","HTML","","","",,,,,0,0.00,0,4,1,"… , we conducted DFT … activation energy of 16.87 kcal/mol (B3LYP-D3(BJ)) and 18.33 kcal/mol (B3LYP-D3(BJ)), respectively. The results from the DFT calculation reveal that the activation …","https://www.nature.com/articles/s41467-025-56367-y","https://scholar.google.com/scholar?q=related:ZiXQ9-xhUj4J:scholar.google.com/&scioq=source:nature+ch+activation+dft&hl=en&as_sdt=0,5&as_vis=1"
682,"A KuÈhnle, TR Linderoth, B Hammer, F Besenbacher","Chiral recognition in dimerization of adsorbed cysteine observed by scanning tunnelling microscopy",2002,"Nature","nature.com","https://idp.nature.com/authorize/casa?redirect_uri=https://www.nature.com/articles/415891a&casa_token=Jqwtmrm0SG0AAAAA:hhAvwB6aNGRf4WtAnUY3pz6InMdt5sg8hiosGFIbRLT1tzSgliWAhT_d-SlImquffFi_R3WxcFRgGAVt","https://scholar.google.com/scholar?cites=13530753578096582143&as_sdt=2005&sciodt=0,5&hl=en",505,"2025-05-05 22:12:12","HTML","","","",,,,,682,29.65,171,4,23,"… The activation energy needed to achieve vacancies in the gold surface qualitatively … , we have performed ab initio density-functional theory (DFT) calculations 10 . Starting with pairs of …","https://idp.nature.com/authorize/casa?redirect_uri=https://www.nature.com/articles/415891a&casa_token=Jqwtmrm0SG0AAAAA:hhAvwB6aNGRf4WtAnUY3pz6InMdt5sg8hiosGFIbRLT1tzSgliWAhT_d-SlImquffFi_R3WxcFRgGAVt","https://scholar.google.com/scholar?q=related:_93KtbDkxrsJ:scholar.google.com/&scioq=source:nature+ch+activation+dft&hl=en&as_sdt=0,5&as_vis=1"
44,"Q Chen, J Liu, B Yang","Identifying the key steps determining the selectivity of toluene methylation with methanol over HZSM-5",2021,"Nature Communications","nature.com","https://www.nature.com/articles/s41467-021-24098-5","https://scholar.google.com/scholar?cites=7941296798649200338&as_sdt=2005&sciodt=0,5&hl=en",506,"2025-05-05 22:12:12","HTML","","","",,,,,44,11.00,15,3,4,"… based on density functional theory (DFT) calculations. Bjørnar et al. used DFT to explore the … Recently, Mykela et al. also adopted the method of DFT to calculate the activation barrier of …","https://www.nature.com/articles/s41467-021-24098-5","https://scholar.google.com/scholar?q=related:0q5uE10nNW4J:scholar.google.com/&scioq=source:nature+ch+activation+dft&hl=en&as_sdt=0,5&as_vis=1"
37,"MM Xu, L Yang, K Tan, X Chen, QT Lu, KN Houk…","An enantioselective ambimodal cross-Diels–Alder reaction and applications in synthesis",2021,"Nature Catalysis","nature.com","https://idp.nature.com/authorize/casa?redirect_uri=https://www.nature.com/articles/s41929-021-00687-x&casa_token=TSndMVeWbO4AAAAA:GmGDcM0vaSaR0hYXqy5TXdpyEDDqlsFv1cNrVAKqCPLph1NEMB9HkAXVp_vXsdJlC29_r9xs6sxV81Uk","https://scholar.google.com/scholar?cites=251866169284111538&as_sdt=2005&sciodt=0,5&hl=en",507,"2025-05-05 22:12:12","HTML","","","",,,,,37,9.25,5,7,4,"… Non-activated 1,3-conjugated dienes are not accommodated … investigations and density functional theory (DFT) … 2+4] adduct by Cope rearrangement upon activation by the catalyst. This …","https://idp.nature.com/authorize/casa?redirect_uri=https://www.nature.com/articles/s41929-021-00687-x&casa_token=TSndMVeWbO4AAAAA:GmGDcM0vaSaR0hYXqy5TXdpyEDDqlsFv1cNrVAKqCPLph1NEMB9HkAXVp_vXsdJlC29_r9xs6sxV81Uk","https://scholar.google.com/scholar?q=related:siweT_LOfgMJ:scholar.google.com/&scioq=source:nature+ch+activation+dft&hl=en&as_sdt=0,5&as_vis=1"
30,"SK Singh, A Chaurasia, A Verma","Basics of density functional theory, molecular dynamics, and monte carlo simulation techniques in materials science",2023,"Coating materials: Computational …","Springer","https://link.springer.com/chapter/10.1007/978-981-99-3549-9_5","https://scholar.google.com/scholar?cites=11031607347866240397&as_sdt=2005&sciodt=0,5&hl=en",508,"2025-05-05 22:12:12","","10.1007/978-981-99-3549-9_5","","",,,,,30,15.00,10,3,2,"… The most accurate computational technique is based on electronic structure level and density functional theory (DFT). At the atomistic level, molecular dynamics (MD)-based simulations …","","https://scholar.google.com/scholar?q=related:jQUoV28kGJkJ:scholar.google.com/&scioq=source:nature+ch+activation+dft&hl=en&as_sdt=0,5&as_vis=1"
111,"N Goswami, T Bhattacharya, D Maiti","Transient directing ligands for selective metal-catalysed C–H activation",2021,"Nature Reviews Chemistry","nature.com","https://idp.nature.com/authorize/casa?redirect_uri=https://www.nature.com/articles/s41570-021-00311-3&casa_token=F-fk8k3B11AAAAAA:hHvluUk66AybORP7e13r0WUFYFuAdtlCMy541oAhWWKbI6R7x5FVn-8Uo9ws0RIPwXKIwTmCjakOVU7V","https://scholar.google.com/scholar?cites=1827131798936576643&as_sdt=2005&sciodt=0,5&hl=en",509,"2025-05-05 22:12:12","HTML","","","",,,,,111,27.75,37,3,4,"… Density functional theory showed that the transient moderator forms a square-planar Pd ii complex that lessens the distortion that might otherwise be necessary for C(sp 3 )–H …","https://idp.nature.com/authorize/casa?redirect_uri=https://www.nature.com/articles/s41570-021-00311-3&casa_token=F-fk8k3B11AAAAAA:hHvluUk66AybORP7e13r0WUFYFuAdtlCMy541oAhWWKbI6R7x5FVn-8Uo9ws0RIPwXKIwTmCjakOVU7V","https://scholar.google.com/scholar?q=related:g2JvybBGWxkJ:scholar.google.com/&scioq=source:nature+ch+activation+dft&hl=en&as_sdt=0,5&as_vis=1"
165,"MS Frei, C Mondelli, R García-Muelas…","Nanostructure of nickel-promoted indium oxide catalysts drives selectivity in CO2 hydrogenation",2021,"Nature …","nature.com","https://www.nature.com/articles/s41467-021-22224-x","https://scholar.google.com/scholar?cites=11850634366271663920&as_sdt=2005&sciodt=0,5&hl=en",510,"2025-05-05 22:12:12","HTML","","","",,,,,165,41.25,41,4,4,"… Density functional theory (DFT) sheds light on the unique structural rearrangements of … Since DFT calculations pointed to facilitated hydrogen activation as the origin of the promotional …","https://www.nature.com/articles/s41467-021-22224-x","https://scholar.google.com/scholar?q=related:MK-oNCvpdaQJ:scholar.google.com/&scioq=source:nature+ch+activation+dft&hl=en&as_sdt=0,5&as_vis=1"
157,"SF Hung, A Xu, X Wang, F Li, SH Hsu, Y Li…","A metal-supported single-atom catalytic site enables carbon dioxide hydrogenation",2022,"Nature …","nature.com","https://www.nature.com/articles/s41467-022-28456-9","https://scholar.google.com/scholar?cites=8853206927000273875&as_sdt=2005&sciodt=0,5&hl=en",511,"2025-05-05 22:12:12","HTML","","","",,,,,157,52.33,22,7,3,"… In examining the catalyst’s density of states by DFT calculations, we found that Fe single atoms … We offer that the activation process correlates with the fact that the phthalocyanine rings …","https://www.nature.com/articles/s41467-022-28456-9","https://scholar.google.com/scholar?q=related:0wPhNsvo3HoJ:scholar.google.com/&scioq=source:nature+ch+activation+dft&hl=en&as_sdt=0,5&as_vis=1"
149,"Y Liu, L Qin, Z Cheng, JW Goetze, F Kong…","Near 100% CO selectivity in nanoscaled iron-based oxygen carriers for chemical looping methane partial oxidation",2019,"Nature …","nature.com","https://www.nature.com/articles/s41467-019-13560-0","https://scholar.google.com/scholar?cites=17304989436050545976&as_sdt=2005&sciodt=0,5&hl=en",512,"2025-05-05 22:12:12","HTML","","","",,,,,149,24.83,25,6,6,"… were performed within the framework of density functional theory (DFT) using the Vienna Ab … atoms in the nanoparticle facilitates CH 4 adsorption and activation due to an upward shift …","https://www.nature.com/articles/s41467-019-13560-0","https://scholar.google.com/scholar?q=related:OB2u0TSsJ_AJ:scholar.google.com/&scioq=source:nature+ch+activation+dft&hl=en&as_sdt=0,5&as_vis=1"
66,"S Lee, A Halder, GA Ferguson, S Seifert…","Subnanometer cobalt oxide clusters as selective low temperature oxidative dehydrogenation catalysts",2019,"Nature …","nature.com","https://www.nature.com/articles/s41467-019-08819-5","https://scholar.google.com/scholar?cites=16721388188619714723&as_sdt=2005&sciodt=0,5&hl=en",513,"2025-05-05 22:12:12","HTML","","","",,,,,66,11.00,13,5,6,"… DFT calculations on key steps for the reaction pathway involving the Co 4 cluster. The DFT … bond interacts across the active Co–O decreasing the C–H activation energy. The hydrogen …","https://www.nature.com/articles/s41467-019-08819-5","https://scholar.google.com/scholar?q=related:ozAXvvZNDugJ:scholar.google.com/&scioq=source:nature+ch+activation+dft&hl=en&as_sdt=0,5&as_vis=1"
