Cites,Authors,Title,Year,Source,Publisher,ArticleURL,CitesURL,GSRank,QueryDate,Type,DOI,ISSN,CitationURL,Volume,Issue,StartPage,EndPage,ECC,CitesPerYear,CitesPerAuthor,AuthorCount,Age,Abstract,FullTextURL,RelatedURL
379,"M Kang, S Fang, JK Kim, BR Ortiz, SH Ryu, J Kim…","Twofold van Hove singularity and origin of charge order in topological kagome superconductor CsV3Sb5",2022,"Nature Physics","nature.com","https://www.nature.com/articles/s41567-021-01451-5","https://scholar.google.com/scholar?cites=2970786096070161777&as_sdt=2005&sciodt=0,5&hl=en",732,"2025-05-05 22:10:47","","","","",,,,,379,126.33,54,7,3,"… Here we combine angle-resolved photoemission spectroscopy and density functional theory to reveal multiple kagome-derived van Hove singularities (vHS) coexisting near the Fermi …","https://arxiv.org/pdf/2105.01689","https://scholar.google.com/scholar?q=related:cXXu5zZaOikJ:scholar.google.com/&scioq=source:nature+cross+coupling+dft&hl=en&as_sdt=0,5&as_vis=1"
61,"X Yan, K Zou, J Cao, X Li, Z Zhao, Z Li, A Wu…","Single-handed supramolecular double helix of homochiral bis(N-amidothiourea) supported by double crossed C−I···S halogen bonds",2019,"Nature …","nature.com","https://www.nature.com/articles/s41467-019-11539-5","https://scholar.google.com/scholar?cites=14849060814123803103&as_sdt=2005&sciodt=0,5&hl=en",733,"2025-05-05 22:10:47","HTML","","","",,,,,61,10.17,8,8,6,"The natural DNA double helix consists of two strands of nucleotides that are held together by multiple hydrogen bonds. Here we propose to build an artificial double helix from fragments …","https://www.nature.com/articles/s41467-019-11539-5","https://scholar.google.com/scholar?q=related:36EFAiN2Es4J:scholar.google.com/&scioq=source:nature+cross+coupling+dft&hl=en&as_sdt=0,5&as_vis=1"
14,"DT Daniel, S Oevermann, S Mitra, K Rudolf, A Heuer…","Multimodal investigation of electronic transport in PTMA and its impact on organic radical battery performance",2023,"Scientific reports","nature.com","https://www.nature.com/articles/s41598-023-37308-5","https://scholar.google.com/scholar?cites=5389000724982215618&as_sdt=2005&sciodt=0,5&hl=en",734,"2025-05-05 22:10:47","HTML","","","",,,,,14,7.00,2,6,2,"… ) spectroscopic, and theoretical molecular dynamics as well as density functional theory modelling techniques, we explored how compositional characteristics of cross-linked poly(2,2,6,…","https://www.nature.com/articles/s41598-023-37308-5","https://scholar.google.com/scholar?q=related:wjPjcpuTyUoJ:scholar.google.com/&scioq=source:nature+cross+coupling+dft&hl=en&as_sdt=0,5&as_vis=1"
22,"J Zhang, M Jiang, CS Wang, K Guo, QX Li…","Transition-metal free C–N bond formation from alkyl iodides and diazonium salts via halogen-atom transfer",2022,"Nature …","nature.com","https://www.nature.com/articles/s41467-022-35613-7","https://scholar.google.com/scholar?cites=13310419099564345668&as_sdt=2005&sciodt=0,5&hl=en",735,"2025-05-05 22:10:47","HTML","","","",,,,,22,7.33,4,6,3,"… between a methoxyl radical and methanol (for detailed discussion and density functional theory (DFT) calculation, see the Supplementary Information and Supplementary Data 1). …","https://www.nature.com/articles/s41467-022-35613-7","https://scholar.google.com/scholar?q=related:RIkbQaYbuLgJ:scholar.google.com/&scioq=source:nature+cross+coupling+dft&hl=en&as_sdt=0,5&as_vis=1"
2,"S Xu, Y Ping, Y Su, H Guo, A Luo, W Kong","A modular approach to catalytic stereoselective synthesis of chiral 1, 2-diols and 1, 3-diols",2025,"Nature Communications","nature.com","https://www.nature.com/articles/s41467-024-55744-3","https://scholar.google.com/scholar?cites=11100159223065216867&as_sdt=2005&sciodt=0,5&hl=en",736,"2025-05-05 22:10:47","HTML","","","",,,,,2,2.00,0,6,1,"… C–O cross-coupling of alcohol and aryl halides, but also confers selectivity for the critical step of C(sp 3 )–H functionalization. Herein, we successfully executed this ideal by combining a …","https://www.nature.com/articles/s41467-024-55744-3","https://scholar.google.com/scholar?q=related:YwcUkQCwC5oJ:scholar.google.com/&scioq=source:nature+cross+coupling+dft&hl=en&as_sdt=0,5&as_vis=1"
85,"I Piquero-Zulaica, J Lobo-Checa, A Sadeghi…","Precise engineering of quantum dot array coupling through their barrier widths",2017,"Nature …","nature.com","https://www.nature.com/articles/s41467-017-00872-2","https://scholar.google.com/scholar?cites=1580950603367697470&as_sdt=2005&sciodt=0,5&hl=en",737,"2025-05-05 22:10:47","HTML","","","",,,,,85,10.63,21,4,8,"… The network band periodicities relate to their interpore distances and match our DFT calculations and STM data (cf. Table 1). Contrary to STS, we find that the band minimum shift (…","https://www.nature.com/articles/s41467-017-00872-2","https://scholar.google.com/scholar?q=related:PswrkTKq8BUJ:scholar.google.com/&scioq=source:nature+cross+coupling+dft&hl=en&as_sdt=0,5&as_vis=1"
10,"T Zhou, P Gao, R Lalancette, R Szostak, M Szostak","Gold-catalysed amine synthesis by reductive hydroamination of alkynes with nitroarenes",2024,"Nature Chemistry","nature.com","https://www.nature.com/articles/s41557-024-01624-8","https://scholar.google.com/scholar?cites=6811937775312266816&as_sdt=2005&sciodt=0,5&hl=en",738,"2025-05-05 22:10:47","","","","",,,,,10,10.00,2,5,1,"Amines are the most pivotal class of organic motifs in pharmaceutical compounds. Here we provide a blueprint for a general synthesis of amines by catalyst differentiation enabled by …","","https://scholar.google.com/scholar?q=related:QGaNwVDdiF4J:scholar.google.com/&scioq=source:nature+cross+coupling+dft&hl=en&as_sdt=0,5&as_vis=1"
1726,"S Linic, U Aslam, C Boerigter, M Morabito","Photochemical transformations on plasmonic metal nanoparticles",2015,"Nature materials","nature.com","https://www.nature.com/articles/nmat4281","https://scholar.google.com/scholar?cites=1512686907283912424&as_sdt=2005&sciodt=0,5&hl=en",739,"2025-05-05 22:10:47","","","","",,,,,1726,172.60,432,4,10,"… approach (for example, density functional theory, time-dependent density functional theory and different variations of these), represent a reasonable starting point for such models. …","","https://scholar.google.com/scholar?q=related:6LYKRbok_hQJ:scholar.google.com/&scioq=source:nature+cross+coupling+dft&hl=en&as_sdt=0,5&as_vis=1"
3,"L Yin, J Li, C Wu, H Zhang, W Zhao, Z Fan…","Asymmetric synthesis of P-stereogenic phosphindane oxides via kinetic resolution and their biological activity",2024,"Nature …","nature.com","https://www.nature.com/articles/s41467-024-46892-7","https://scholar.google.com/scholar?cites=2435458398406797336&as_sdt=2005&sciodt=0,5&hl=en",740,"2025-05-05 22:10:47","HTML","","","",,,,,3,3.00,0,7,1,"… DFT calculation on the carborhodation step, which is decisive for the diastereo- and enantioselectivity of the reaction, was conducted to further understand the observed selectivity. The …","https://www.nature.com/articles/s41467-024-46892-7","https://scholar.google.com/scholar?q=related:GGhHfoJ8zCEJ:scholar.google.com/&scioq=source:nature+cross+coupling+dft&hl=en&as_sdt=0,5&as_vis=1"
2596,"S Zhao, Y Wang, J Dong, CT He, H Yin, P An, K Zhao…","Ultrathin metal–organic framework nanosheets for electrocatalytic oxygen evolution",2016,"Nature energy","nature.com","https://www.nature.com/articles/nenergy2016184","https://scholar.google.com/scholar?cites=9847080620115935129&as_sdt=2005&sciodt=0,5&hl=en",741,"2025-05-05 22:10:47","","","","",,,,,2596,288.44,325,8,9,"… spectroscopy and density-functional theory calculations. The findings suggest that the coordinatively unsaturated metal atoms are the dominating active centres and the coupling effect …","https://drive.google.com/file/d/1f0U55pmuGLAopJBLNqqZqvgeCZapkI74/view","https://scholar.google.com/scholar?q=related:mb-k5Kbbp4gJ:scholar.google.com/&scioq=source:nature+cross+coupling+dft&hl=en&as_sdt=0,5&as_vis=1"
179,"M Lilienblum, T Lottermoser, S Manz, SM Selbach…","Ferroelectricity in the multiferroic hexagonal manganites",2015,"Nature Physics","nature.com","https://www.nature.com/articles/nphys3468","https://scholar.google.com/scholar?cites=3448563646125090489&as_sdt=2005&sciodt=0,5&hl=en",742,"2025-05-05 22:10:47","","","","",,,,,179,17.90,36,5,10,"… this coupling reads H int = −g∑ j p j cos(3φ j ), where p j is the (local) polarization and g a constant. We make use of these DFT … the ‘strong-coupling limit’ revealed by DFT. The electric …","https://hal.science/hal-01239698v1/file/2015-184.pdf","https://scholar.google.com/scholar?q=related:uaacaF3C2y8J:scholar.google.com/&scioq=source:nature+cross+coupling+dft&hl=en&as_sdt=0,5&as_vis=1"
19,"C Duan, A Nandy, R Meyer, N Arunachalam…","A transferable recommender approach for selecting the best density functional approximations in chemical discovery",2023,"Nature Computational …","nature.com","https://www.nature.com/articles/s43588-022-00384-0","https://scholar.google.com/scholar?cites=13566211357708050669&as_sdt=2005&sciodt=0,5&hl=en",743,"2025-05-05 22:10:47","","","","",,,,,19,9.50,4,5,2,"… Electron densities lie at the core of Kohn–Sham (KS) DFT and can be used to derive any … density 24,25 of a TMC obtained from a DFT calculation using the global generalized gradient …","https://arxiv.org/pdf/2207.10747","https://scholar.google.com/scholar?q=related:7eAOXFrdRLwJ:scholar.google.com/&scioq=source:nature+cross+coupling+dft&hl=en&as_sdt=0,5&as_vis=1"
44,"X Lin, SN Zhang, D Xu, JJ Zhang, YX Lin…","Electrochemical activation of C–H by electron-deficient W2C nanocrystals for simultaneous alkoxylation and hydrogen evolution",2021,"Nature …","nature.com","https://www.nature.com/articles/s41467-021-24203-8","https://scholar.google.com/scholar?cites=4363580829425035649&as_sdt=2005&sciodt=0,5&hl=en",744,"2025-05-05 22:10:47","HTML","","","",,,,,44,11.00,7,6,4,"… The spin polarization density functional theory (DFT) calculations were performed by the DMol3 program on Materials Studio. The generalized gradient approximation method with …","https://www.nature.com/articles/s41467-021-24203-8","https://scholar.google.com/scholar?q=related:gWmVJqWNjjwJ:scholar.google.com/&scioq=source:nature+cross+coupling+dft&hl=en&as_sdt=0,5&as_vis=1"
7,"C Si, T Wang, Y Xu, D Lin, D Sun…","A temperature sensor with a wide spectral range based on a dual-emissive TADF dendrimer system",2024,"Nature …","nature.com","https://www.nature.com/articles/s41467-024-51231-x","https://scholar.google.com/scholar?cites=8142560347271017507&as_sdt=2005&sciodt=0,5&hl=en",745,"2025-05-05 22:10:47","HTML","","","",,,,,7,7.00,1,6,1,"… The HOMO–LUMO gaps are 2.36 and 2.05 eV for 2GCzBPPZ and 2GCzBPN, respectively, which mirror the trend in the DFT calculated values of 2.87 and 2.36 eV (Fig. 2a). …","https://www.nature.com/articles/s41467-024-51231-x","https://scholar.google.com/scholar?q=related:IzRFpX4vAHEJ:scholar.google.com/&scioq=source:nature+cross+coupling+dft&hl=en&as_sdt=0,5&as_vis=1"
1,"Y Xia, T Shao, Y Sun, J Wang, C Gu, C Zhang…","Precise placement of thioester bonds into sequence-controlled polymers containing ABAC-type units",2025,"Nature …","nature.com","https://www.nature.com/articles/s41467-025-57208-8","https://scholar.google.com/scholar?cites=17422090949014920168&as_sdt=2005&sciodt=0,5&hl=en",746,"2025-05-05 22:10:47","HTML","","","",,,,,1,1.00,0,7,1,"… Combining kinetics results and DFT calculations, we can get the conclusion that the method presented in this study leads to well-defined sequence-controlled polymers. …","https://www.nature.com/articles/s41467-025-57208-8","https://scholar.google.com/scholar?q=related:6BuVdGmzx_EJ:scholar.google.com/&scioq=source:nature+cross+coupling+dft&hl=en&as_sdt=0,5&as_vis=1"
56,"S Wang, Y Gao, Z Liu, D Ren, H Sun, L Niu, D Yang…","Site-selective amination towards tertiary aliphatic allylamines",2022,"Nature Catalysis","nature.com","https://www.nature.com/articles/s41929-022-00818-y","https://scholar.google.com/scholar?cites=14547770429974183910&as_sdt=2005&sciodt=0,5&hl=en",747,"2025-05-05 22:10:47","","","","",,,,,56,18.67,7,8,3,"… To reveal the origin of the site selectivity of the allylic amination process, density functional theory (DFT) calculations were conducted to investigate the variation of site selectivity when …","","https://scholar.google.com/scholar?q=related:5v-K8CAQ5MkJ:scholar.google.com/&scioq=source:nature+cross+coupling+dft&hl=en&as_sdt=0,5&as_vis=1"
12,"Y Wang, C Bi, Y Kawamata, LN Grant, L Samp…","Discovery of N–X anomeric amides as electrophilic halogenation reagents",2024,"Nature Chemistry","nature.com","https://www.nature.com/articles/s41557-024-01539-4","https://scholar.google.com/scholar?cites=1213006879494049421&as_sdt=2005&sciodt=0,5&hl=en",748,"2025-05-05 22:10:47","","","","",,,,,12,12.00,2,6,1,"… To gain deeper insight into this higher reactivity, density functional theory (DFT) calculations of the N–Cl bond breaking energy (from the ground state to the corresponding anion and Cl …","","https://scholar.google.com/scholar?q=related:jQ5ZglR31RAJ:scholar.google.com/&scioq=source:nature+cross+coupling+dft&hl=en&as_sdt=0,5&as_vis=1"
50,"Y Park, S Kim, L Tian, H Zhong, GD Scholes…","Visible light enables catalytic formation of weak chemical bonds with molecular hydrogen",2021,"Nature chemistry","nature.com","https://www.nature.com/articles/s41557-021-00732-z","https://scholar.google.com/scholar?cites=8527793189744598612&as_sdt=2005&sciodt=0,5&hl=en",749,"2025-05-05 22:10:47","","","","",,,,,50,12.50,8,6,4,"… This observation was consistent with the estimation of BDFEs from density functional theory (DFT) calculations, where the N–H BDFE of the cobalt amine complex Co3 was estimated as …","https://www.osti.gov/servlets/purl/1807690","https://scholar.google.com/scholar?q=related:VN64ULnOWHYJ:scholar.google.com/&scioq=source:nature+cross+coupling+dft&hl=en&as_sdt=0,5&as_vis=1"
1,"IV Khariushin, P Thielert, E Zöllner, M Mayländer…","Supramolecular dyads as photogenerated qubit candidates",2025,"Nature Chemistry","nature.com","https://www.nature.com/articles/s41557-024-01716-5","https://scholar.google.com/scholar?cites=4874397710399632047&as_sdt=2005&sciodt=0,5&hl=en",750,"2025-05-05 22:10:47","","","","",,,,,1,1.00,0,5,1,"… We next calculated the structures of the assembled pairs using density functional theory (DFT). The predicted structures for PDI–H···TZ–TEMPO and PDI–H···TZ–eTEMPO exhibit the …","","https://scholar.google.com/scholar?q=related:r_JYVuRWpUMJ:scholar.google.com/&scioq=source:nature+cross+coupling+dft&hl=en&as_sdt=0,5&as_vis=1"
0,"G Muir, G Caballero-García, T Muilu, M Nodwell…","Unmasking the halide effect in diastereoselective Grignard reactions applied to C4´ modified nucleoside synthesis",2025,"Nature …","nature.com","https://www.nature.com/articles/s41467-025-56895-7","",751,"2025-05-05 22:10:47","HTML","","","",,,,,0,0.00,0,5,1,"… To better understand this unusual halide effect on diastereoselectivity, we conducted DFT calculations (Fig. 4). Considering that the nucleobase had little impact on diastereoselectivty, …","https://www.nature.com/articles/s41467-025-56895-7","https://scholar.google.com/scholar?q=related:7ZIkZEaTLgYJ:scholar.google.com/&scioq=source:nature+cross+coupling+dft&hl=en&as_sdt=0,5&as_vis=1"
640,"X Gong, O Voznyy, A Jain, W Liu, R Sabatini…","Electron–phonon interaction in efficient perovskite blue emitters",2018,"Nature materials","nature.com","https://www.nature.com/articles/s41563-018-0081-x","https://scholar.google.com/scholar?cites=11251070520942596169&as_sdt=2005&sciodt=0,5&hl=en",752,"2025-05-05 22:10:47","","","","",,,,,640,91.43,107,6,7,"… To gain further insight into the crystal quality and high PLQY, we carried out density functional theory (DFT) calculations on C4, Ph and PhC2 structures. We first calculated the formation …","https://utoronto.scholaris.ca/bitstreams/58171ecf-857e-4f01-84f7-7460cb282309/download","https://scholar.google.com/scholar?q=related:SRCnLwfVI5wJ:scholar.google.com/&scioq=source:nature+cross+coupling+dft&hl=en&as_sdt=0,5&as_vis=1"
415,"SY Leblebici, L Leppert, Y Li, SE Reyes-Lillo…","Facet-dependent photovoltaic efficiency variations in single grains of hybrid halide perovskite",2016,"Nature Energy","nature.com","https://www.nature.com/articles/nenergy201693","https://scholar.google.com/scholar?cites=10270072582612868550&as_sdt=2005&sciodt=0,5&hl=en",753,"2025-05-05 22:10:47","","","","",,,,,415,46.11,83,5,9,"… of (CH 3 NH 3 )PbI 3 , we perform first-principles DFT calculations including spin–orbit coupling (SOC). DFT calculations were performed using the Perdew–Burke–Ernzerhof (PBE) …","https://escholarship.org/content/qt1qc478wc/qt1qc478wc.pdf","https://scholar.google.com/scholar?q=related:xl0eyJmgho4J:scholar.google.com/&scioq=source:nature+cross+coupling+dft&hl=en&as_sdt=0,5&as_vis=1"
30,"MH Elsayed, M Abdellah, AZ Alhakemy…","Overcoming small-bandgap charge recombination in visible and NIR-light-driven hydrogen evolution by engineering the polymer photocatalyst structure",2024,"Nature …","nature.com","https://www.nature.com/articles/s41467-024-45085-6","https://scholar.google.com/scholar?cites=5671708961537236722&as_sdt=2005&sciodt=0,5&hl=en",754,"2025-05-05 22:10:47","HTML","","","",,,,,30,30.00,8,4,1,"… , we employed density functional theory (DFT) and transient … density functional theory (DFT), configuration-interaction constrained DFT (CI-CDFT) and time-dependent DFT (TD-DFT). …","https://www.nature.com/articles/s41467-024-45085-6","https://scholar.google.com/scholar?q=related:8p7TIUD1tU4J:scholar.google.com/&scioq=source:nature+cross+coupling+dft&hl=en&as_sdt=0,5&as_vis=1"
202,"Z Zeng, KC Chang, J Kubal, NM Markovic, J Greeley","Stabilization of ultrathin (hydroxy) oxide films on transition metal substrates for electrochemical energy conversion",2017,"Nature Energy","nature.com","https://www.nature.com/articles/nenergy201770","https://scholar.google.com/scholar?cites=12967801740692670646&as_sdt=2005&sciodt=0,5&hl=en",755,"2025-05-05 22:10:47","","","","",,,,,202,25.25,40,5,8,"… In the present contribution, we describe a strategy, involving close coupling of periodic density functional theory (DFT) calculations and in situ synchrotron characterization, that identifies …","https://www.osti.gov/servlets/purl/1364140","https://scholar.google.com/scholar?q=related:tsitD_ri9rMJ:scholar.google.com/&scioq=source:nature+cross+coupling+dft&hl=en&as_sdt=0,5&as_vis=1"
156,"Q Zhu, SL Wegener, C Xie, O Uche, M Neurock…","Sulfur as a selective 'soft'oxidant for catalytic methane conversion probed by experiment and theory",2013,"Nature …","nature.com","https://www.nature.com/articles/nchem.1527","https://scholar.google.com/scholar?cites=343424683979668983&as_sdt=2005&sciodt=0,5&hl=en",756,"2025-05-05 22:10:47","","","","",,,,,156,13.00,26,6,12,"… the coupling of CH x –S* species on the surface, the results are essentially the same if the coupling … First-principles density functional theory (DFT) calculations were carried out to help …","","https://scholar.google.com/scholar?q=related:9321N-4WxAQJ:scholar.google.com/&scioq=source:nature+cross+coupling+dft&hl=en&as_sdt=0,5&as_vis=1"
1,"F Zhong, R Li, BK Mai, P Liu, GC Fu","Photoinduced copper-catalysed deracemization of alkyl halides",2025,"Nature","nature.com","https://www.nature.com/articles/s41586-025-08784-8","https://scholar.google.com/scholar?cites=11850708158061579708&as_sdt=2005&sciodt=0,5&hl=en",757,"2025-05-05 22:10:47","","","","",,,,,1,1.00,0,5,1,"… To gain insight into the origin of enantioselectivity in this photoinduced copper-catalysed deracemization, we carried out DFT calculations of step 3 of the catalytic cycle in the case of the …","","https://scholar.google.com/scholar?q=related:vI0VMkgsdqQJ:scholar.google.com/&scioq=source:nature+cross+coupling+dft&hl=en&as_sdt=0,5&as_vis=1"
4204,"JK Nørskov, T Bligaard, J Rossmeisl…","Towards the computational design of solid catalysts",2009,"Nature chemistry","nature.com","https://www.nature.com/articles/nchem.121","https://scholar.google.com/scholar?cites=18153804628023386447&as_sdt=2005&sciodt=0,5&hl=en",758,"2025-05-05 22:10:47","","","","",,,,,4204,262.75,1051,4,16,"… The extraordinary progress in density functional theory (DFT) … solely on the basis of DFT calculations of reaction barriers, … Overall, the agreement between DFT-based kinetic models …","","https://scholar.google.com/scholar?q=related:TyEtTyBF7_sJ:scholar.google.com/&scioq=source:nature+cross+coupling+dft&hl=en&as_sdt=0,5&as_vis=1"
636,"Y Zhao, J Wan, H Yao, L Zhang, K Lin, L Wang…","Few-layer graphdiyne doped with sp-hybridized nitrogen atoms at acetylenic sites for oxygen reduction electrocatalysis",2018,"Nature …","nature.com","https://www.nature.com/articles/s41557-018-0100-1","https://scholar.google.com/scholar?cites=18434547843466910990&as_sdt=2005&sciodt=0,5&hl=en",759,"2025-05-05 22:10:47","","","","",,,,,636,90.86,91,7,7,"… To explore the effect of N atoms on the catalytic activity of carbon, we performed density functional theory (DFT) calculations, which showed that sp-hybridized N (sp-N) atoms (…","","https://scholar.google.com/scholar?q=related:Dt3J3Jer1P8J:scholar.google.com/&scioq=source:nature+cross+coupling+dft&hl=en&as_sdt=0,5&as_vis=1"
618,"BHR Suryanto, Y Wang, RK Hocking…","Overall electrochemical splitting of water at the heterogeneous interface of nickel and iron oxide",2019,"Nature …","nature.com","https://www.nature.com/articles/s41467-019-13415-8","https://scholar.google.com/scholar?cites=16298381684089285265&as_sdt=2005&sciodt=0,5&hl=en",760,"2025-05-05 22:10:47","HTML","","","",,,,,618,103.00,155,4,6,"… Density functional theory calculations reveal that the hydrogen evolution reaction catalytic activity of the nanoparticle is induced by the strong electronic coupling effect between the iron …","https://www.nature.com/articles/s41467-019-13415-8","https://scholar.google.com/scholar?q=related:kerfBcp7L-IJ:scholar.google.com/&scioq=source:nature+cross+coupling+dft&hl=en&as_sdt=0,5&as_vis=1"
28,"Y Goto, M Sano, Y Sumida, H Ohmiya","N-heterocyclic carbene- and organic photoredox-catalysed meta-selective acylation of electron-rich arenes",2023,"Nature Synthesis","nature.com","https://www.nature.com/articles/s44160-023-00378-4","https://scholar.google.com/scholar?cites=1123667063628938864&as_sdt=2005&sciodt=0,5&hl=en",761,"2025-05-05 22:10:47","","","","",,,,,28,14.00,7,4,2,"… Density functional theory calculations were carried out at the (U)M06-2X/6-311 + G(d,p)/SMD (dcm)//(U)M06-2X/6-31 + G(d,p)_SMD(dcm) level of theory, the unit of Gibbs free energies (…","","https://scholar.google.com/scholar?q=related:cL5orT0RmA8J:scholar.google.com/&scioq=source:nature+cross+coupling+dft&hl=en&as_sdt=0,5&as_vis=1"
8,"Z Yan, D Wei, X Li, LW Chung","Accelerating reliable multiscale quantum refinement of protein–drug systems enabled by machine learning",2024,"Nature Communications","nature.com","https://www.nature.com/articles/s41467-024-48453-4","https://scholar.google.com/scholar?cites=1727844997635275888&as_sdt=2005&sciodt=0,5&hl=en",762,"2025-05-05 22:10:47","HTML","","","",,,,,8,8.00,2,4,1,"… (CC- and DFT-quality) of MLPs (denoted as MLP-CC and MLP-DFT) were further combined for the first time through an extrapolative Our own N-layered Integrated molecular Orbital and …","https://www.nature.com/articles/s41467-024-48453-4","https://scholar.google.com/scholar?q=related:cHz87t6J-hcJ:scholar.google.com/&scioq=source:nature+cross+coupling+dft&hl=en&as_sdt=0,5&as_vis=1"
24,"Y Chen, K Samanta, NA Shahed, H Zhang, C Fang…","Twist-assisted all-antiferromagnetic tunnel junction in the atomic limit",2024,"Nature","nature.com","https://www.nature.com/articles/s41586-024-07818-x","https://scholar.google.com/scholar?cites=9618562050396526077&as_sdt=2005&sciodt=0,5&hl=en",763,"2025-05-05 22:10:47","HTML","","","",,,,,24,24.00,4,6,1,"… DFT results show a negligible interlayer magnetic coupling at the twisted interface and a strong intralayer FM coupling… , the DFT results rather establish a strong interlayer AF coupling at …","https://www.nature.com/articles/s41586-024-07818-x","https://scholar.google.com/scholar?q=related:_RXwNzn_e4UJ:scholar.google.com/&scioq=source:nature+cross+coupling+dft&hl=en&as_sdt=0,5&as_vis=1"
15,"H Liu, Q Huang, R Liao, M Li, Y Xie","Ring-closing C–O/C–O metathesis of ethers with primary aliphatic alcohols",2023,"Nature Communications","nature.com","https://www.nature.com/articles/s41467-023-37538-1","https://scholar.google.com/scholar?cites=8746909081478799271&as_sdt=2005&sciodt=0,5&hl=en",764,"2025-05-05 22:10:47","HTML","","","",,,,,15,7.50,3,5,2,"… DFT calculations Parallel to experimental studies, density functional theory (DFT) calculations were … 5 (for more details on the DFT calculations, see the supplementary information). …","https://www.nature.com/articles/s41467-023-37538-1","https://scholar.google.com/scholar?q=related:p58ubHdDY3kJ:scholar.google.com/&scioq=source:nature+cross+coupling+dft&hl=en&as_sdt=0,5&as_vis=1"
