Cites,Authors,Title,Year,Source,Publisher,ArticleURL,CitesURL,GSRank,QueryDate,Type,DOI,ISSN,CitationURL,Volume,Issue,StartPage,EndPage,ECC,CitesPerYear,CitesPerAuthor,AuthorCount,Age,Abstract,FullTextURL,RelatedURL
73,"A Maji, A Dahiya, G Lu, T Bhattacharya…","H-bonded reusable template assisted para-selective ketonisation using soft electrophilic vinyl ethers",2018,"Nature …","nature.com","https://www.nature.com/articles/s41467-018-06018-2","https://scholar.google.com/scholar?cites=15797816100035714086&as_sdt=2005&sciodt=0,5&hl=en",750,"2025-05-05 22:12:12","HTML","","","",,,,,73,10.43,15,5,7,"… Over the last few decades directed C−H activation has offered a promising … DFT calculations and mechanistic cycle … The pathway was evaluated by density functional theory calculations (…","https://www.nature.com/articles/s41467-018-06018-2","https://scholar.google.com/scholar?q=related:JlyT5QoePdsJ:scholar.google.com/&scioq=source:nature+ch+activation+dft&hl=en&as_sdt=0,5&as_vis=1"
73,"A Govind Rajan, KS Silmore, J Swett, AW Robertson…","Addressing the isomer cataloguing problem for nanopores in two-dimensional materials",2019,"Nature materials","nature.com","https://idp.nature.com/authorize/casa?redirect_uri=https://www.nature.com/articles/s41563-018-0258-3&casa_token=MRFXAF3M1qUAAAAA:3oPpU4tiWjyLdaDxjp4ieX6w9kwNlDqM9xYxVg2JKhysAxYxMXPNiFFzh0E7eny8GlQ1qpVkjq7i84JO","https://scholar.google.com/scholar?cites=4949332571093933894&as_sdt=2005&sciodt=0,5&hl=en",751,"2025-05-05 22:12:12","HTML","","","",,,,,73,12.17,15,5,6,"… electronic-structure density functional theory (DFT) calculations with KMC simulations of the etching process 31,32 . DFT calculations are used to determine the activation barrier for an …","https://idp.nature.com/authorize/casa?redirect_uri=https://www.nature.com/articles/s41563-018-0258-3&casa_token=MRFXAF3M1qUAAAAA:3oPpU4tiWjyLdaDxjp4ieX6w9kwNlDqM9xYxVg2JKhysAxYxMXPNiFFzh0E7eny8GlQ1qpVkjq7i84JO","https://scholar.google.com/scholar?q=related:Rh9TL8CPr0QJ:scholar.google.com/&scioq=source:nature+ch+activation+dft&hl=en&as_sdt=0,5&as_vis=1"
4162,"J Cai, P Ruffieux, R Jaafar, M Bieri, T Braun…","Atomically precise bottom-up fabrication of graphene nanoribbons",2010,"Nature","nature.com","https://idp.nature.com/authorize/casa?redirect_uri=https://www.nature.com/articles/nature09211&casa_token=xj77kd2sKywAAAAA:8Ge0HcM3Zhy0ylmsKFCKd3R31TfSoYdQsVV4R_bAq2r7et0ArrecY1BrII4f-Lg6bQ4gsI8DFkhJkcfp","https://scholar.google.com/scholar?cites=14600944640831161948&as_sdt=2005&sciodt=0,5&hl=en",752,"2025-05-05 22:12:12","HTML","","","",,,,,4162,277.47,694,6,15,"… During a first thermal activation step, the biradical species … I = 0.08 nA), and DFT-based simulation of the STM image (right) … At the bottom left is a DFT-based STM simulation of the N = 7 …","https://idp.nature.com/authorize/casa?redirect_uri=https://www.nature.com/articles/nature09211&casa_token=xj77kd2sKywAAAAA:8Ge0HcM3Zhy0ylmsKFCKd3R31TfSoYdQsVV4R_bAq2r7et0ArrecY1BrII4f-Lg6bQ4gsI8DFkhJkcfp","https://scholar.google.com/scholar?q=related:XIbircr5oMoJ:scholar.google.com/&scioq=source:nature+ch+activation+dft&hl=en&as_sdt=0,5&as_vis=1"
39,"X Li, C Wang, J Yang, Y Xu, Y Yang, J Yu…","PdCu nanoalloy decorated photocatalysts for efficient and selective oxidative coupling of methane in flow reactors",2023,"Nature …","nature.com","https://www.nature.com/articles/s41467-023-41996-y","https://scholar.google.com/scholar?cites=10555906361466333047&as_sdt=2005&sciodt=0,5&hl=en",753,"2025-05-05 22:12:12","HTML","","","",,,,,39,19.50,6,7,2,"… , DFT … the CH activation barrier on TiO 2 (269.5 kJ/mol), indicating that the methane conversion to ethane process on TiO 2 is greatly limited by the rate-determining step of CH activation …","https://www.nature.com/articles/s41467-023-41996-y","https://scholar.google.com/scholar?q=related:d6d8fegcfpIJ:scholar.google.com/&scioq=source:nature+ch+activation+dft&hl=en&as_sdt=0,5&as_vis=1"
4,"MK Prabhu, JN Louwen, ETC Vogt…","Hydrodesulfurization of methanethiol over Co-promoted MoS2 model catalysts",2024,"Nature Communications","nature.com","https://www.nature.com/articles/s41467-024-51549-6","https://scholar.google.com/scholar?cites=14443859900074446761&as_sdt=2005&sciodt=0,5&hl=en",754,"2025-05-05 22:12:12","HTML","","","",,,,,4,4.00,1,4,1,"… density functional theory (DFT) calculations to model various reaction pathways through which HDS of CH … a very high activation barrier of 2.00 eV/atom, indicating that the CH 3 SH self-…","https://www.nature.com/articles/s41467-024-51549-6","https://scholar.google.com/scholar?q=related:qU9yYQ3mcsgJ:scholar.google.com/&scioq=source:nature+ch+activation+dft&hl=en&as_sdt=0,5&as_vis=1"
215,"X Zhang, G Lu, M Sun, M Mahankali, Y Ma, M Zhang…","A general strategy for synthesis of cyclophane-braced peptide macrocycles via palladium-catalysed intramolecular sp3 C−H arylation",2018,"Nature …","nature.com","https://idp.nature.com/authorize/casa?redirect_uri=https://www.nature.com/articles/s41557-018-0006-y&casa_token=HSI8pk99270AAAAA:yFsIXN-OKvQJXDuM-6rri3BFb2jI34A-yyz03xeUZzZW6c2BoXpmEEG2T30zEdT4XSSgfSAfFAwb_Cp0","https://scholar.google.com/scholar?cites=17793165541549730284&as_sdt=2005&sciodt=0,5&hl=en",755,"2025-05-05 22:12:12","HTML","","","",,,,,215,30.71,31,7,7,"… , probably due to the inhibition of the C–H activation step by the peptide’s terminal amide … Density functional theory (DFT) calculations were carried out to understand the energetics …","https://idp.nature.com/authorize/casa?redirect_uri=https://www.nature.com/articles/s41557-018-0006-y&casa_token=HSI8pk99270AAAAA:yFsIXN-OKvQJXDuM-6rri3BFb2jI34A-yyz03xeUZzZW6c2BoXpmEEG2T30zEdT4XSSgfSAfFAwb_Cp0","https://scholar.google.com/scholar?q=related:7OnKrckF7vYJ:scholar.google.com/&scioq=source:nature+ch+activation+dft&hl=en&as_sdt=0,5&as_vis=1"
28,"S Takebayashi, MA Iron, M Feller…","Iron-catalysed ring-opening metathesis polymerization of olefins and mechanistic studies",2022,"Nature …","nature.com","https://idp.nature.com/authorize/casa?redirect_uri=https://www.nature.com/articles/s41929-022-00793-4&casa_token=BKpctCpoozYAAAAA:5gFApiyqyJXEvf0ypXwxfwFoVQk1aEqggvsbaxbKVpfpnDnk8QWzQfO1FmKkETQzBTpuk9pMVs8sy0yN","https://scholar.google.com/scholar?cites=15042535428019677574&as_sdt=2005&sciodt=0,5&hl=en",756,"2025-05-05 22:12:12","HTML","","","",,,,,28,9.33,7,4,3,"… the possible involvement of C–H activation of norbornene in … of the ROMP via C–H activation of norbornene. However, it … ,46 , and density functional theory (DFT) calculation suggested a …","https://idp.nature.com/authorize/casa?redirect_uri=https://www.nature.com/articles/s41929-022-00793-4&casa_token=BKpctCpoozYAAAAA:5gFApiyqyJXEvf0ypXwxfwFoVQk1aEqggvsbaxbKVpfpnDnk8QWzQfO1FmKkETQzBTpuk9pMVs8sy0yN","https://scholar.google.com/scholar?q=related:hmlX5EXSwdAJ:scholar.google.com/&scioq=source:nature+ch+activation+dft&hl=en&as_sdt=0,5&as_vis=1"
158,"P Hinchliffe, QE Yang, E Portal, T Young, H Li…","Insights into the mechanistic basis of plasmid-mediated colistin resistance from crystal structures of the catalytic domain of MCR-1",2017,"Scientific reports","nature.com","https://www.nature.com/articles/srep39392","https://scholar.google.com/scholar?cites=11480480891149795239&as_sdt=2005&sciodt=0,5&hl=en",757,"2025-05-05 22:12:12","HTML","","","",,,,,158,19.75,26,6,8,"… , we used computational density functional theory (DFT) 21,22 … DFT calculations were performed on cluster models for the … act as general bases to activate Thr285, and the …","https://www.nature.com/articles/srep39392","https://scholar.google.com/scholar?q=related:p7-kV4vcUp8J:scholar.google.com/&scioq=source:nature+ch+activation+dft&hl=en&as_sdt=0,5&as_vis=1"
31,"X Wang, Y Chen, F Li, RK Miao, JE Huang…","Site-selective protonation enables efficient carbon monoxide electroreduction to acetate",2024,"Nature …","nature.com","https://www.nature.com/articles/s41467-024-44727-z","https://scholar.google.com/scholar?cites=1220886105073594002&as_sdt=2005&sciodt=0,5&hl=en",758,"2025-05-05 22:12:12","HTML","","","",,,,,31,31.00,5,6,1,"… We began using density functional theory (DFT) to seek a … From DFT, path 2 is the most energetically favored route to … the sluggish kinetics of the water activation step. The identity of the …","https://www.nature.com/articles/s41467-024-44727-z","https://scholar.google.com/scholar?q=related:ki4frHF18RAJ:scholar.google.com/&scioq=source:nature+ch+activation+dft&hl=en&as_sdt=0,5&as_vis=1"
5,"HC Wen, W Chen, M Li, C Ma, JF Wang, A Fu…","Chiral phosphoric acid-catalyzed asymmetric epoxidation of alkenyl aza-heteroarenes using hydrogen peroxide",2024,"Nature …","nature.com","https://www.nature.com/articles/s41467-024-49435-2","https://scholar.google.com/scholar?cites=6642185372810271035&as_sdt=2005&sciodt=0,5&hl=en",759,"2025-05-05 22:12:12","HTML","","","",,,,,5,5.00,1,7,1,"… activation of aza-heteroarene substrates and hydrogen peroxide. This dual activation … Integrating data from both detailed experimental studies and DFT calculations, we propose …","https://www.nature.com/articles/s41467-024-49435-2","https://scholar.google.com/scholar?q=related:O9mmnmfILVwJ:scholar.google.com/&scioq=source:nature+ch+activation+dft&hl=en&as_sdt=0,5&as_vis=1"
5,"B Sun, W Li, Q Liu, G Zhang, F Mo","Transition metal-free visible light photoredox-catalyzed remote C(sp3)−H borylation enabled by 1,5-hydrogen atom transfer",2023,"Communications Chemistry","nature.com","https://www.nature.com/articles/s42004-023-00960-z","https://scholar.google.com/scholar?cites=8293301692644933085&as_sdt=2005&sciodt=0,5&hl=en",760,"2025-05-05 22:12:12","HTML","","","",,,,,5,2.50,1,5,2,"… Specially, we found that this method can activate secondary … (vide infra, a DFT calculation was performed). Interestingly, we … , we carried out density functional theory (DFT) calculations (…","https://www.nature.com/articles/s42004-023-00960-z","https://scholar.google.com/scholar?q=related:3T0_HfO5F3MJ:scholar.google.com/&scioq=source:nature+ch+activation+dft&hl=en&as_sdt=0,5&as_vis=1"
0,"S Kunwar","Convolutional Neural Network (CNN) to reduce construction loss in JPEG compression caused by Discrete Fourier Transform (DFT)",2023,"International Conference on AI-generated Content","Springer","https://link.springer.com/chapter/10.1007/978-981-99-7587-7_25","",761,"2025-05-05 22:12:12","","10.1007/978-981-99-7587-7_25","","",,,,,0,0.00,0,1,2,"… Sigmoid activation function is used in the output layer, whose output is bound between 0 … To overcome this, Rectified Linear Unit (ReLU) is used as an activation function to increase the …","https://arxiv.org/pdf/2209.03475","https://scholar.google.com/scholar?q=related:4GEutdo3o7gJ:scholar.google.com/&scioq=source:nature+ch+activation+dft&hl=en&as_sdt=0,5&as_vis=1"
14,"J Yang, L Wang, J Wan, F El Gabaly…","Atomically synergistic Zn-Cr catalyst for iso-stoichiometric co-conversion of ethane and CO2 to ethylene and CO",2024,"Nature …","nature.com","https://www.nature.com/articles/s41467-024-44918-8","https://scholar.google.com/scholar?cites=13632386572710469657&as_sdt=2005&sciodt=0,5&hl=en",762,"2025-05-05 22:12:12","HTML","","","",,,,,14,14.00,3,5,1,"… Our DFT calculation (Fig. 3e) indicates that the intermediate of CO 2 activation is carboxyl (COOH*). The decomposition of COOH* requires the participation of the Cr site through the …","https://www.nature.com/articles/s41467-024-44918-8","https://scholar.google.com/scholar?q=related:GWA2Q1z3L70J:scholar.google.com/&scioq=source:nature+ch+activation+dft&hl=en&as_sdt=0,5&as_vis=1"
105,"T Wang, J Ibañez, K Wang, L Fang, M Sabbe…","Rational design of selective metal catalysts for alcohol amination with ammonia",2019,"Nature Catalysis","nature.com","https://idp.nature.com/authorize/casa?redirect_uri=https://www.nature.com/articles/s41929-019-0327-2&casa_token=wrifhQ7wtnsAAAAA:80YnFfRefeICFFGAC2THmUvv9HRtEms1CEnieDM2iTvUzYkOPLaeBgs7ac1wa7GQEF9WiFbYBeddYvIz","https://scholar.google.com/scholar?cites=5471986400805862677&as_sdt=2005&sciodt=0,5&hl=en",763,"2025-05-05 22:12:12","HTML","","","",,,,,105,17.50,18,6,6,"… starts by activating the C–H or O–H bond, which leads to the formation of CH 2 OH or CH 3 … to build kinetic models with limited density functional theory (DFT) calculations 44,45 . In our …","https://idp.nature.com/authorize/casa?redirect_uri=https://www.nature.com/articles/s41929-019-0327-2&casa_token=wrifhQ7wtnsAAAAA:80YnFfRefeICFFGAC2THmUvv9HRtEms1CEnieDM2iTvUzYkOPLaeBgs7ac1wa7GQEF9WiFbYBeddYvIz","https://scholar.google.com/scholar?q=related:FT3Nw6Nm8EsJ:scholar.google.com/&scioq=source:nature+ch+activation+dft&hl=en&as_sdt=0,5&as_vis=1"
0,"F Zhou, L Gai, H Liu, D Qin, T Abudouwufu, Y Liu","Enhanced electrochemical detection of dopamine and uric acid using Au@ Ni-MOF and employing 2D structure DFT simulation",2025,"Scientific Reports","nature.com","https://www.nature.com/articles/s41598-025-89797-1","",764,"2025-05-05 22:12:12","HTML","","","",,,,,0,0.00,0,6,1,"… ligands in Au@Ni-MOF (Ni(CH 3 CO 2 ) 2 ) composites with … interactions, which can activate the multi-carboxylate groups … (CH 3 CO 2 ) 2 ) materials 47,48,49 ; (2) Au@Ni-MOF (Ni(CH 3 …","https://www.nature.com/articles/s41598-025-89797-1","https://scholar.google.com/scholar?q=related:0ZY0_VuWJCYJ:scholar.google.com/&scioq=source:nature+ch+activation+dft&hl=en&as_sdt=0,5&as_vis=1"
11,"T Shima, Q Zhuo, X Zhou, P Wu, R Owada, G Luo…","Hydroamination of alkenes with dinitrogen and titanium polyhydrides",2024,"Nature","nature.com","https://idp.nature.com/authorize/casa?redirect_uri=https://www.nature.com/articles/s41586-024-07694-5&casa_token=Is9Fvq98bW8AAAAA:httOqRPrh9CZt9Lu6TLU2aTvXeoIEnHNdaZbnpj1ArKRDAVa2dD4wWdqDcs1NkOmTiUNnNdb7YDWRn02","https://scholar.google.com/scholar?cites=3078978331176220328&as_sdt=2005&sciodt=0,5&hl=en",765,"2025-05-05 22:12:12","HTML","","","",,,,,11,11.00,2,7,1,"… To have a better understanding about N 2 activation and N–C bond formation by 4a, density functional theory calculations were performed. The most favourable pathways are shown in …","https://idp.nature.com/authorize/casa?redirect_uri=https://www.nature.com/articles/s41586-024-07694-5&casa_token=Is9Fvq98bW8AAAAA:httOqRPrh9CZt9Lu6TLU2aTvXeoIEnHNdaZbnpj1ArKRDAVa2dD4wWdqDcs1NkOmTiUNnNdb7YDWRn02","https://scholar.google.com/scholar?q=related:qDbipHq6uioJ:scholar.google.com/&scioq=source:nature+ch+activation+dft&hl=en&as_sdt=0,5&as_vis=1"
9,"Y Zhang, D Fu, Z Chen, R Cui, W He, H Wang…","Bifunctional iron-catalyzed alkyne Z-selective hydroalkylation and tandem Z-E inversion via radical molding and flipping",2024,"Nature …","nature.com","https://www.nature.com/articles/s41467-024-53021-x","https://scholar.google.com/scholar?cites=1345612985935158626&as_sdt=2005&sciodt=0,5&hl=en",766,"2025-05-05 22:12:12","HTML","","","",,,,,9,9.00,1,7,1,"… The selective C–H activation strategy, which effectively … C(sp 3 )−H activation of methane and other light alkanes via … , we conducted density functional theory (DFT) calculations with the …","https://www.nature.com/articles/s41467-024-53021-x","https://scholar.google.com/scholar?q=related:Yl3Rn-GTrBIJ:scholar.google.com/&scioq=source:nature+ch+activation+dft&hl=en&as_sdt=0,5&as_vis=1"
0,"TD Tan, KZ Tee, X Luo, PC Qian, X Zhang, MJ Koh","Kinetically controlled Z-alkene synthesis using iron-catalysed allene dialkylation",2025,"Nature Synthesis","nature.com","https://idp.nature.com/authorize/casa?redirect_uri=https://www.nature.com/articles/s44160-024-00658-7&casa_token=q-l8u7F_tesAAAAA:T61EhqEeIpwhHbT_YRjIvwPxlWfiMr0AoRS6X5Jj7faQmV-UPdR4Mt-XbDSuc8P2ngkj0WQaN19r92ka","",767,"2025-05-05 22:12:12","HTML","","","",,,,,0,0.00,0,6,1,"… in the multicomponent process, density functional theory (DFT) studies were performed; the … rise to the observed lower activation barrier. Additional DFT studies using nitrogen-based …","https://idp.nature.com/authorize/casa?redirect_uri=https://www.nature.com/articles/s44160-024-00658-7&casa_token=q-l8u7F_tesAAAAA:T61EhqEeIpwhHbT_YRjIvwPxlWfiMr0AoRS6X5Jj7faQmV-UPdR4Mt-XbDSuc8P2ngkj0WQaN19r92ka","https://scholar.google.com/scholar?q=related:GNxWvNVGl1AJ:scholar.google.com/&scioq=source:nature+ch+activation+dft&hl=en&as_sdt=0,5&as_vis=1"
184,"T He, XJ Kong, ZX Bian, YZ Zhang, GR Si, LH Xie…","Trace removal of benzene vapour using double-walled metal–dipyrazolate frameworks",2022,"Nature Materials","nature.com","https://www.nature.com/articles/s41563-022-01237-x","https://scholar.google.com/scholar?cites=15278909664231453578&as_sdt=2005&sciodt=0,5&hl=en",768,"2025-05-05 22:12:12","HTML","","","",,,,,184,61.33,26,7,3,"… density functional theory calculations, which reveal that C–H···… oxidation and adsorption by activated carbons 5 . Oxidation is … sorbents such as activated carbon fibres, activated carbon (…","https://www.nature.com/articles/s41563-022-01237-x","https://scholar.google.com/scholar?q=related:inPMc2OXCdQJ:scholar.google.com/&scioq=source:nature+ch+activation+dft&hl=en&as_sdt=0,5&as_vis=1"
57,"CF Lee, DB Diaz, A Holownia, SJ Kaldas, SK Liew…","Amine hemilability enables boron to mechanistically resemble either hydride or proton",2018,"Nature Chemistry","nature.com","https://idp.nature.com/authorize/casa?redirect_uri=https://www.nature.com/articles/s41557-018-0097-5&casa_token=2106R2YncF4AAAAA:iGxM-4z7k8TrD9w8a-lDHQhx8e8WR2RA9RFcPaL-6oJ-qSUGWUSraqzCMxUuHGrc4KKXTtk8SfS_PLH3","https://scholar.google.com/scholar?cites=2265481865836301227&as_sdt=2005&sciodt=0,5&hl=en",769,"2025-05-05 22:12:12","HTML","","","",,,,,57,8.14,10,6,7,"… Density functional theory studies and in situ NMR … Since the activation barrier for hydride migration is +8.4 kcal mol −… with TS2-H-cis having an activation barrier of +4.3 kcal mol −1 (Fig. …","https://idp.nature.com/authorize/casa?redirect_uri=https://www.nature.com/articles/s41557-018-0097-5&casa_token=2106R2YncF4AAAAA:iGxM-4z7k8TrD9w8a-lDHQhx8e8WR2RA9RFcPaL-6oJ-qSUGWUSraqzCMxUuHGrc4KKXTtk8SfS_PLH3","https://scholar.google.com/scholar?q=related:qwtDAsGbcB8J:scholar.google.com/&scioq=source:nature+ch+activation+dft&hl=en&as_sdt=0,5&as_vis=1"
13,"Y Jin, J Caner, S Nishikawa, N Toriumi…","Catalytic direct hydrocarboxylation of styrenes with CO2 and H2",2022,"Nature …","nature.com","https://www.nature.com/articles/s41467-022-35293-3","https://scholar.google.com/scholar?cites=17357885112177534192&as_sdt=2005&sciodt=0,5&hl=en",770,"2025-05-05 22:12:12","HTML","","","",,,,,13,4.33,3,5,3,"… The result of DFT calculations indicated that the activation barrier of the hydrogenation pathway is higher than that of the carboxylation, which rationalized the reason for the selectivity of …","https://www.nature.com/articles/s41467-022-35293-3","https://scholar.google.com/scholar?q=related:8CRiI4uY4_AJ:scholar.google.com/&scioq=source:nature+ch+activation+dft&hl=en&as_sdt=0,5&as_vis=1"
4,"Q Wang, K Sang, C Liu, Z Zhang, W Chen, T Ji…","Nanoparticles as an antidote for poisoned gold single-atom catalysts in sustainable propylene epoxidation",2024,"Nature …","nature.com","https://www.nature.com/articles/s41467-024-47538-4","https://scholar.google.com/scholar?cites=5728544626583191282&as_sdt=2005&sciodt=0,5&hl=en",771,"2025-05-05 22:12:12","HTML","","","",,,,,4,4.00,1,7,1,"… Au n catalyst, we first performed DFT calculations on Au single atom, Au 13 … activation energy, reaction orders, and kinetic isotope effects. Further combining multi-scale simulations (DFT …","https://www.nature.com/articles/s41467-024-47538-4","https://scholar.google.com/scholar?q=related:8r52m_zgf08J:scholar.google.com/&scioq=source:nature+ch+activation+dft&hl=en&as_sdt=0,5&as_vis=1"
451,"S Gao, Z Sun, W Liu, X Jiao, X Zu, Q Hu, Y Sun…","Atomic layer confined vacancies for atomic-level insights into carbon dioxide electroreduction",2017,"Nature …","nature.com","https://www.nature.com/articles/ncomms14503","https://scholar.google.com/scholar?cites=11195586297289063968&as_sdt=2005&sciodt=0,5&hl=en",772,"2025-05-05 22:12:12","HTML","","","",,,,,451,56.38,56,8,8,"… Density functional theory calculations demonstrate the main … lower the rate-limiting activation barrier from 0.51 to 0.40 eV … step, we performed density functional theory (DFT) method to …","https://www.nature.com/articles/ncomms14503","https://scholar.google.com/scholar?q=related:ID4lrmu2XpsJ:scholar.google.com/&scioq=source:nature+ch+activation+dft&hl=en&as_sdt=0,5&as_vis=1"
160,"Z Zhang, X Chen, J Kang, Z Yu, J Tian, Z Gong…","The active sites of Cu–ZnO catalysts for water gas shift and CO hydrogenation reactions",2021,"Nature …","nature.com","https://www.nature.com/articles/s41467-021-24621-8","https://scholar.google.com/scholar?cites=14722621874806202644&as_sdt=2005&sciodt=0,5&hl=en",773,"2025-05-05 22:12:12","HTML","","","",,,,,160,40.00,23,7,4,"… DFT calculation results, an accumulation of OH groups can be expected at the Cu-ZnO interface. We thus calculated the activation … previous 46 and our DFT calculations of CO adsorbed …","https://www.nature.com/articles/s41467-021-24621-8","https://scholar.google.com/scholar?q=related:FCE4YpdCUcwJ:scholar.google.com/&scioq=source:nature+ch+activation+dft&hl=en&as_sdt=0,5&as_vis=1"
7,"PB Bai, A Durie, GW Wang, I Larrosa","Unlocking regioselective meta-alkylation with epoxides and oxetanes via dynamic kinetic catalyst control",2024,"Nature Communications","nature.com","https://www.nature.com/articles/s41467-023-44219-6","https://scholar.google.com/scholar?cites=1365572030729671810&as_sdt=2005&sciodt=0,5&hl=en",774,"2025-05-05 22:12:12","HTML","","","",,,,,7,7.00,2,4,1,"… alkylation 66 , presumably because of their less strained nature making their activation harder. Indeed, DFT calculations by Fang showed that the free energy barrier of Pd oxidative …","https://www.nature.com/articles/s41467-023-44219-6","https://scholar.google.com/scholar?q=related:gtTZ3oZ88xIJ:scholar.google.com/&scioq=source:nature+ch+activation+dft&hl=en&as_sdt=0,5&as_vis=1"
1255,"H Qiu, T Xu, Z Wang, W Ren, H Nan, Z Ni…","Hopping transport through defect-induced localized states in molybdenum disulphide",2013,"Nature …","nature.com","https://www.nature.com/articles/ncomms3642","https://scholar.google.com/scholar?cites=1956060325656695632&as_sdt=2005&sciodt=0,5&hl=en",775,"2025-05-05 22:12:12","HTML","","","",,,,,1255,104.58,179,7,12,"… of MoS 2 , we performed the DFT calculations on a 5 × 5 single-… activation barrier is the energy spacing between nearest sites. Taking T 0 =500 K and a=1.7 nm, , within the range of DFT …","https://www.nature.com/articles/ncomms3642","https://scholar.google.com/scholar?q=related:UJMApoBSJRsJ:scholar.google.com/&scioq=source:nature+ch+activation+dft&hl=en&as_sdt=0,5&as_vis=1"
17,"J Luo, L Lu, M Montag, Y Liang, D Milstein","Hydrogenative alkene perdeuteration aided by a transient cooperative ligand",2023,"Nature Chemistry","nature.com","https://idp.nature.com/authorize/casa?redirect_uri=https://www.nature.com/articles/s41557-023-01313-y&casa_token=zIFzmcLZ5P4AAAAA:9Hli0ilFQqcQFxO0geriXX_TY1Nm4xA7sBKGxNo8-0BMKl8aPTPAiFcBzzJsFs3d35l9MA46TfSQHIdK","https://scholar.google.com/scholar?cites=12882075341651323254&as_sdt=2005&sciodt=0,5&hl=en",776,"2025-05-05 22:12:12","HTML","","","",,,,,17,8.50,3,5,2,"… activation of H 2 in the absence and presence of thiol, and free energy data for the forward reactions, based on DFT … 25 , as well as density functional theory (DFT) calculations, we …","https://idp.nature.com/authorize/casa?redirect_uri=https://www.nature.com/articles/s41557-023-01313-y&casa_token=zIFzmcLZ5P4AAAAA:9Hli0ilFQqcQFxO0geriXX_TY1Nm4xA7sBKGxNo8-0BMKl8aPTPAiFcBzzJsFs3d35l9MA46TfSQHIdK","https://scholar.google.com/scholar?q=related:dinyZEVTxrIJ:scholar.google.com/&scioq=source:nature+ch+activation+dft&hl=en&as_sdt=0,5&as_vis=1"
20,"GS Lee, B Park, SH Hong","Stereoretentive cross-coupling of chiral amino acid chlorides and hydrocarbons through mechanistically controlled Ni/Ir photoredox catalysis",2022,"Nature Communications","nature.com","https://www.nature.com/articles/s41467-022-32851-7","https://scholar.google.com/scholar?cites=6628547615299620871&as_sdt=2005&sciodt=0,5&hl=en",777,"2025-05-05 22:12:12","HTML","","","",,,,,20,6.67,7,3,3,"… the acyl electrophile and C–H activation of the hydrocarbon … 16,30,31,32 and a C–H-activation-initiated pathway involving an … were performed using density functional theory (DFT) at the …","https://www.nature.com/articles/s41467-022-32851-7","https://scholar.google.com/scholar?q=related:B1Cywu9U_VsJ:scholar.google.com/&scioq=source:nature+ch+activation+dft&hl=en&as_sdt=0,5&as_vis=1"
5,"M Das, D Sen, NU Sakib, H Ravichandran, Y Sun…","High-performance p-type field-effect transistors using substitutional doping and thickness control of two-dimensional materials",2025,"Nature …","nature.com","https://idp.nature.com/authorize/casa?redirect_uri=https://www.nature.com/articles/s41928-024-01265-2&casa_token=ldP0LYLtM30AAAAA:kkm7TorL_9GphI34fCEe0400I6uOwMzHMnyLLmrKy5G_Y11z-YvDxWhfddb6MxZkTCOW5tgO4gwiC-hs","https://scholar.google.com/scholar?cites=7128715469246817912&as_sdt=2005&sciodt=0,5&hl=en",778,"2025-05-05 22:12:12","HTML","","","",,,,,5,5.00,1,6,1,"… As we will elucidate later using DFT calculations, ambipolar transport is also facilitated due … , in turn, lowers the efficiency of dopant activation 20,21 . The DFT results, however, fail to …","https://idp.nature.com/authorize/casa?redirect_uri=https://www.nature.com/articles/s41928-024-01265-2&casa_token=ldP0LYLtM30AAAAA:kkm7TorL_9GphI34fCEe0400I6uOwMzHMnyLLmrKy5G_Y11z-YvDxWhfddb6MxZkTCOW5tgO4gwiC-hs","https://scholar.google.com/scholar?q=related:eOZJIfNI7mIJ:scholar.google.com/&scioq=source:nature+ch+activation+dft&hl=en&as_sdt=0,5&as_vis=1"
