Cites,Authors,Title,Year,Source,Publisher,ArticleURL,CitesURL,GSRank,QueryDate,Type,DOI,ISSN,CitationURL,Volume,Issue,StartPage,EndPage,ECC,CitesPerYear,CitesPerAuthor,AuthorCount,Age,Abstract,FullTextURL,RelatedURL
112,"P Zhou, M Luo, S Guo","Optimizing the semiconductor–metal-single-atom interaction for photocatalytic reactivity",2022,"Nature Reviews Chemistry","nature.com","https://www.nature.com/articles/s41570-022-00434-1","https://scholar.google.com/scholar?cites=4052882350322734025&as_sdt=2005&sciodt=0,5&hl=en",496,"2025-05-05 22:10:47","","","","",,,,,112,37.33,37,3,3,"… MSA, metal single atom; DFT, density functional theory. PtSA as the cocatalyst was first revealed to be more active than PtNP on graphitic carbon nitride (g-C 3 N 4 ) in photocatalytic …","","https://scholar.google.com/scholar?q=related:ydNvRwa7PjgJ:scholar.google.com/&scioq=source:nature+cross+coupling+dft&hl=en&as_sdt=0,5&as_vis=1"
33,"D Zou, L Gan, F Yang, H Wang, Y Pu, J Li…","SET activation of nitroarenes by 2-azaallyl anions as a straightforward access to 2, 5-dihydro-1, 2, 4-oxadiazoles",2021,"Nature …","nature.com","https://www.nature.com/articles/s41467-021-26767-x","https://scholar.google.com/scholar?cites=2113039333119170009&as_sdt=2005&sciodt=0,5&hl=en",497,"2025-05-05 22:10:47","HTML","","","",,,,,33,8.25,5,7,4,"… related pronucleophiles in palladium catalyzed cross-coupling reactions with aryl halides 47,… , where the coupling in Fig. 3a is slow, cross-dehydrogenative coupling reactions take place…","https://www.nature.com/articles/s41467-021-26767-x","https://scholar.google.com/scholar?q=related:2RX__hMGUx0J:scholar.google.com/&scioq=source:nature+cross+coupling+dft&hl=en&as_sdt=0,5&as_vis=1"
38,"Z Liu, H Wang, P Sivaguru, SP Nolan, Q Song…","Silver-catalyzed site-selective C(sp3)−H benzylation of ethers with N-triftosylhydrazones",2022,"Nature …","nature.com","https://www.nature.com/articles/s41467-022-29323-3","https://scholar.google.com/scholar?cites=12379883197853498191&as_sdt=2005&sciodt=0,5&hl=en",498,"2025-05-05 22:10:47","HTML","","","",,,,,38,12.67,6,6,3,"… were also investigated by experments and DFT calculations. … C–H functionalization, DFT calculations were conducted at SMD(… These experimental observations and DFT calculations …","https://www.nature.com/articles/s41467-022-29323-3","https://scholar.google.com/scholar?q=related:T3viUC0uzqsJ:scholar.google.com/&scioq=source:nature+cross+coupling+dft&hl=en&as_sdt=0,5&as_vis=1"
55,"PA Evans, MH Huang, MJ Lawler, S Maroto","Total synthesis of marinomycin A using salicylate as a molecular switch to mediate dimerization",2012,"Nature Chemistry","nature.com","https://www.nature.com/articles/nchem.1330","https://scholar.google.com/scholar?cites=16431595590113959654&as_sdt=2005&sciodt=0,5&hl=en",499,"2025-05-05 22:10:47","","","","",,,,,55,4.23,14,4,13,"… Density functional theory (DFT) calculations further support the infrared trend, in which the carbonyl bond lengths (C=O) for phenol A (1.24 Å) and phenoxide B (1.25 Å) are slightly …","https://www.researchgate.net/profile/Mu-Hua-Huang/publication/229556137_Total_synthesis_of_marinomycin_A_using_salicylate_as_a_molecular_switch_to_mediate_dimerization/links/5870f9a508ae329d621714fb/Total-synthesis-of-marinomycin-A-using-salicylate-as-a-molecular-switch-to-mediate-dimerization.pdf","https://scholar.google.com/scholar?q=related:5h6egSHBCOQJ:scholar.google.com/&scioq=source:nature+cross+coupling+dft&hl=en&as_sdt=0,5&as_vis=1"
187,"T Sun, Z Tang, W Zang, Z Li, J Li, Z Li, L Cao…","Ferromagnetic single-atom spin catalyst for boosting water splitting",2023,"Nature …","nature.com","https://www.nature.com/articles/s41565-023-01407-1","https://scholar.google.com/scholar?cites=6798611064098515185&as_sdt=2005&sciodt=0,5&hl=en",500,"2025-05-05 22:10:47","","","","",,,,,187,93.50,23,8,2,"… , spin-polarized DFT … DFT calculations reveal that the ferromagnetic coupling between these two Ni Mo sites is favourable by 30.67 meV per Ni atom over the antiferromagnetic coupling (…","https://www.researchgate.net/profile/Chenghao-Chuang/publication/371040396_Ferromagnetic_single-atom_spin_catalyst_for_boosting_water_splitting/links/666f78f7de777205a33367c0/Ferromagnetic-single-atom-spin-catalyst-for-boosting-water-splitting.pdf","https://scholar.google.com/scholar?q=related:8eihAb6EWV4J:scholar.google.com/&scioq=source:nature+cross+coupling+dft&hl=en&as_sdt=0,5&as_vis=1"
36,"PC Bruzzese, E Salvadori, S Jäger, M Hartmann…","17O-EPR determination of the structure and dynamics of copper single-metal sites in zeolites",2021,"Nature …","nature.com","https://www.nature.com/articles/s41467-021-24935-7","https://scholar.google.com/scholar?cites=11570180117958547615&as_sdt=2005&sciodt=0,5&hl=en",501,"2025-05-05 22:10:47","HTML","","","",,,,,36,9.00,7,5,4,"… By 17 O isotopic labelling of the zeolite framework, in conjunction with advanced EPR methodologies and DFT modelling, we determine the local structure of single site Cu II species, …","https://www.nature.com/articles/s41467-021-24935-7","https://scholar.google.com/scholar?q=related:n9g0DoSJkaAJ:scholar.google.com/&scioq=source:nature+cross+coupling+dft&hl=en&as_sdt=0,5&as_vis=1"
74,"M Gantenbein, L Wang, AA Al-Jobory, AK Ismael…","Quantum interference and heteroaromaticity of para- and meta-linked bridged biphenyl units in single molecular conductance measurements",2017,"Scientific reports","nature.com","https://www.nature.com/articles/s41598-017-01903-0","https://scholar.google.com/scholar?cites=8537867952389371143&as_sdt=2005&sciodt=0,5&hl=en",502,"2025-05-05 22:10:47","HTML","","","",,,,,74,9.25,15,5,8,"… break junction measurements and density functional theory calculations, demonstrates … To enable the Sonogashira cross coupling of the corresponding aryldibromide central units (…","https://www.nature.com/articles/s41598-017-01903-0","https://scholar.google.com/scholar?q=related:BzVcyaqZfHYJ:scholar.google.com/&scioq=source:nature+cross+coupling+dft&hl=en&as_sdt=0,5&as_vis=1"
36,"M Schmitt, P Moras, G Bihlmayer, R Cotsakis…","Indirect chiral magnetic exchange through Dzyaloshinskii–Moriya-enhanced RKKY interactions in manganese oxide chains on Ir (100)",2019,"Nature …","nature.com","https://www.nature.com/articles/s41467-019-10515-3","https://scholar.google.com/scholar?cites=14123144292915171310&as_sdt=2005&sciodt=0,5&hl=en",503,"2025-05-05 22:10:47","HTML","","","",,,,,36,6.00,7,5,6,"… photoemission, and density functional theory study of MnO 2 chains on Ir(100). Whereas we find antiferromagnetic Mn–Mn coupling along the chain, the inter-chain coupling across the …","https://www.nature.com/articles/s41467-019-10515-3","https://scholar.google.com/scholar?q=related:7k_LIuh8_8MJ:scholar.google.com/&scioq=source:nature+cross+coupling+dft&hl=en&as_sdt=0,5&as_vis=1"
14,"HT Ang, Y Miao, D Ravelli, J Wu","Pyridine N-oxides as hydrogen atom transfer reagents for site-selective photoinduced C(sp3)–H functionalization",2024,"Nature Synthesis","nature.com","https://www.nature.com/articles/s44160-024-00528-2","https://scholar.google.com/scholar?cites=16401548639588026964&as_sdt=2005&sciodt=0,5&hl=en",504,"2025-05-05 22:10:47","","","","",,,,,14,14.00,4,4,1,"… cyclic voltammetry and computed via density functional theory (DFT) calculations, respectively. … Additionally, although both groups utilized the M06-2X method for their DFT calculations, …","","https://scholar.google.com/scholar?q=related:VIrvrJYBnuMJ:scholar.google.com/&scioq=source:nature+cross+coupling+dft&hl=en&as_sdt=0,5&as_vis=1"
45,"D Li, X Huang, Z Xiao, H Chen, L Zhang, Y Hao…","Polar coupling enabled nonlinear optical filtering at MoS2/ferroelectric heterointerfaces",2020,"Nature …","nature.com","https://www.nature.com/articles/s41467-020-15191-2","https://scholar.google.com/scholar?cites=17876836391314605742&as_sdt=2005&sciodt=0,5&hl=en",505,"2025-05-05 22:10:47","HTML","","","",,,,,45,9.00,6,7,5,"… walls (DWs), which reveals the intricate coupling of the polar axis of MoS 2 with the chiral … density functional theory (DFT) calculations. Unlike the extensively studied interfacial coupling …","https://www.nature.com/articles/s41467-020-15191-2","https://scholar.google.com/scholar?q=related:rkYVfPtHF_gJ:scholar.google.com/&scioq=source:nature+cross+coupling+dft&hl=en&as_sdt=0,5&as_vis=1"
321,"C Lu, Y Yang, J Wang, R Fu, X Zhao, L Zhao…","High-performance graphdiyne-based electrochemical actuators",2018,"Nature …","nature.com","https://www.nature.com/articles/s41467-018-03095-1","https://scholar.google.com/scholar?cites=1351067119140414373&as_sdt=2005&sciodt=0,5&hl=en",506,"2025-05-05 22:10:47","HTML","","","",,,,,321,45.86,46,7,7,"… density functional theory (DFT). Owing to these landmark works, various actuators with superior performance have emerged one after another, greatly promoting the development of …","https://www.nature.com/articles/s41467-018-03095-1","https://scholar.google.com/scholar?q=related:pSMT-GL0vxIJ:scholar.google.com/&scioq=source:nature+cross+coupling+dft&hl=en&as_sdt=0,5&as_vis=1"
17,"C Zhao, Y Li, Y Dong, M Li, D Xia, S Gao…","Divergent regioselective Heck-type reaction of unactivated alkenes and N-fluoro-sulfonamides",2022,"Nature …","nature.com","https://www.nature.com/articles/s41467-022-33996-1","https://scholar.google.com/scholar?cites=8281168340102896524&as_sdt=2005&sciodt=0,5&hl=en",507,"2025-05-05 22:10:47","HTML","","","",,,,,17,5.67,2,7,3,"… intermediates, which then participated in the intermolecular coupling with alkenes. Further control experiments and DFT calculations demonstrated the involvement of alkyl radical …","https://www.nature.com/articles/s41467-022-33996-1","https://scholar.google.com/scholar?q=related:jFsL1bqe7HIJ:scholar.google.com/&scioq=source:nature+cross+coupling+dft&hl=en&as_sdt=0,5&as_vis=1"
40,"E Chen, A Tamm, T Wang, ME Epler, M Asta…","Modeling antiphase boundary energies of Ni3Al-based alloys using automated density functional theory and machine learning",2022,"npj Computational …","nature.com","https://www.nature.com/articles/s41524-022-00755-1","https://scholar.google.com/scholar?cites=2117335357017048910&as_sdt=2005&sciodt=0,5&hl=en",508,"2025-05-05 22:10:47","HTML","","","",,,,,40,13.33,7,6,3,"… Next, we use VASP to perform DFT calculations to obtain γ 111 . Finally, we use ML techniques implemented in scikit-learn to analyze correlations in the data and build predictive ML …","https://www.nature.com/articles/s41524-022-00755-1","https://scholar.google.com/scholar?q=related:TkdgAUpJYh0J:scholar.google.com/&scioq=source:nature+cross+coupling+dft&hl=en&as_sdt=0,5&as_vis=1"
146,"…, N Planas, JT Stritzinger, TG Parker, JN Cross…","Unusual structure, bonding and properties in a californium borate",2014,"Nature …","nature.com","https://www.nature.com/articles/nchem.1896","https://scholar.google.com/scholar?cites=8499435709198149815&as_sdt=2005&sciodt=0,5&hl=en",509,"2025-05-05 22:10:47","","","","",,,,,146,13.27,24,6,11,"… chemical calculations were performed using density functional theory (DFT) on a finite … the Cf ions is far from the formal +3 at the DFT level. The Mulliken charges range from 1.5 to 1.85 e…","https://www.osti.gov/pages/servlets/purl/2346134","https://scholar.google.com/scholar?q=related:t6gG3r4P9HUJ:scholar.google.com/&scioq=source:nature+cross+coupling+dft&hl=en&as_sdt=0,5&as_vis=1"
74,"TJ He, Z Ye, Z Ke, JM Huang","Stereoselective synthesis of sulfur-containing β-enaminonitrile derivatives through electrochemical Csp3–H bond oxidative functionalization of acetonitrile",2019,"Nature Communications","nature.com","https://www.nature.com/articles/s41467-019-08762-5","https://scholar.google.com/scholar?cites=14735867557844683164&as_sdt=2005&sciodt=0,5&hl=en",510,"2025-05-05 22:10:47","HTML","","","",,,,,74,12.33,19,4,6,"… density functional theory (DFT) calculations to provide insights into the mechanism (Fig. 9). DFT … DFT results suggest the important role of DPPE oxide in stabilizing the imine radical 10, …","https://www.nature.com/articles/s41467-019-08762-5","https://scholar.google.com/scholar?q=related:nAmJSnhRgMwJ:scholar.google.com/&scioq=source:nature+cross+coupling+dft&hl=en&as_sdt=0,5&as_vis=1"
50,"D Choudhuri, SG Srinivasan, MA Gibson…","Exceptional increase in the creep life of magnesium rare-earth alloys due to localized bond stiffening",2017,"Nature …","nature.com","https://www.nature.com/articles/s41467-017-02112-z","https://scholar.google.com/scholar?cites=7878344841635012001&as_sdt=2005&sciodt=0,5&hl=en",511,"2025-05-05 22:10:47","HTML","","","",,,,,50,6.25,13,4,8,"… The structure of γ″–(Mg 0.8 Zn 0.2 ) 5 Nd was further confirmed by comparing our DFT calculations with atomically resolved aberration corrected HAADF-STEM microscopy results …","https://www.nature.com/articles/s41467-017-02112-z","https://scholar.google.com/scholar?q=related:oZ2vZ-SAVW0J:scholar.google.com/&scioq=source:nature+cross+coupling+dft&hl=en&as_sdt=0,5&as_vis=1"
31,"W Wang, F Hanindita, Y Hamamoto, Y Li…","Fully conjugated azacorannulene dimer as large diaza [80] fullerene fragment",2022,"Nature communications","nature.com","https://www.nature.com/articles/s41467-022-29106-w","https://scholar.google.com/scholar?cites=2198139565694457121&as_sdt=2005&sciodt=0,5&hl=en",512,"2025-05-05 22:10:47","HTML","","","",,,,,31,10.33,6,5,3,"… The conformation of molecule 4b, in which t-butyl groups of 4a are replaced by hydro groups, was analyzed by density functional theory (DFT) calculations at the B3LYP/6-31G(d) level …","https://www.nature.com/articles/s41467-022-29106-w","https://scholar.google.com/scholar?q=related:IRXz60lcgR4J:scholar.google.com/&scioq=source:nature+cross+coupling+dft&hl=en&as_sdt=0,5&as_vis=1"
20,"G He, L Peis, EF Cuddy, Z Zhao, D Li, Y Zhang…","Anharmonic strong-coupling effects at the origin of the charge density wave in CsV3Sb5",2024,"Nature …","nature.com","https://www.nature.com/articles/s41467-024-45865-0","https://scholar.google.com/scholar?cites=11388195807060947870&as_sdt=2005&sciodt=0,5&hl=en",513,"2025-05-05 22:10:47","HTML","","","",,,,,20,20.00,3,7,1,"… On the other hand, the hardening of the A 1g phonon is properly predicted by our DFT simulations (Details can be found in Table II of Supplementary Materials G). Zooming in on the …","https://www.nature.com/articles/s41467-024-45865-0","https://scholar.google.com/scholar?q=related:nvN10L__Cp4J:scholar.google.com/&scioq=source:nature+cross+coupling+dft&hl=en&as_sdt=0,5&as_vis=1"
18,"H Yi, D Yang, J Xin, X Qi, Y Lan, Y Deng…","Unravelling the hidden link of lithium halides and application in the synthesis of organocuprates",2017,"Nature …","nature.com","https://www.nature.com/articles/ncomms14794","https://scholar.google.com/scholar?cites=14103090189617579736&as_sdt=2005&sciodt=0,5&hl=en",514,"2025-05-05 22:10:47","HTML","","","",,,,,18,2.25,3,7,8,"… Density functional theory calculations Density functional theory calculation was also performed to provide support for the EXAFS fitting results. As shown in Fig. 7a, the coordination of …","https://www.nature.com/articles/ncomms14794","https://scholar.google.com/scholar?q=related:2MZzW849uMMJ:scholar.google.com/&scioq=source:nature+cross+coupling+dft&hl=en&as_sdt=0,5&as_vis=1"
46,"A Kinikar, M Di Giovannantonio, JI Urgel, K Eimre…","On-surface polyarylene synthesis by cycloaromatization of isopropyl substituents",2022,"Nature …","nature.com","https://www.nature.com/articles/s44160-022-00032-5","https://scholar.google.com/scholar?cites=3519830067921052137&as_sdt=2005&sciodt=0,5&hl=en",515,"2025-05-05 22:10:47","","","","",,,,,46,15.33,9,5,3,"… These experimental results are supported by density functional theory (DFT) calculations, which help to identify the reaction intermediates and provide activation barriers for each …","https://boris.unibe.ch/178469/2/NATSYNTH-21090174A_MainText.pdf","https://scholar.google.com/scholar?q=related:6WEsRMzy2DAJ:scholar.google.com/&scioq=source:nature+cross+coupling+dft&hl=en&as_sdt=0,5&as_vis=1"
26,"SB Jadhav, SR Dash, S Maurya, JB Nanubolu…","Enantioselective Cu (I)-catalyzed borylative cyclization of enone-tethered cyclohexadienones and mechanistic insights",2022,"Nature …","nature.com","https://www.nature.com/articles/s41467-022-28288-7","https://scholar.google.com/scholar?cites=2572348532518362518&as_sdt=2005&sciodt=0,5&hl=en",516,"2025-05-05 22:10:47","HTML","","","",,,,,26,8.67,5,5,3,"… Based on the above experimental results and DFT calculations, we propose the catalytic cycle shown in Fig. 9. The reaction starts with the formation of ligated copper-complex L n Cu-O …","https://www.nature.com/articles/s41467-022-28288-7","https://scholar.google.com/scholar?q=related:lh1Bh1zRsiMJ:scholar.google.com/&scioq=source:nature+cross+coupling+dft&hl=en&as_sdt=0,5&as_vis=1"
526,"A Bergmann, TE Jones, E Martinez Moreno…","Unified structural motifs of the catalytically active state of Co (oxyhydr) oxides during the electrochemical oxygen evolution reaction",2018,"Nature Catalysis","nature.com","https://www.nature.com/articles/s41929-018-0141-2","https://scholar.google.com/scholar?cites=7592712516415283714&as_sdt=2005&sciodt=0,5&hl=en",517,"2025-05-05 22:10:47","","","","",,,,,526,75.14,132,4,7,"… Following recent DFT calculations on the redox chemistry of Co 3 O 4 surfaces 45 , we explain this change in site occupancy of the Co 2+ T d ions to empty O h sites with the µ-O …","https://www.static.tu.berlin/fileadmin/www/10002073/AKStrassPuplications/2018-2019/2018_bergmann-unified_motif_CoOx_OER.pdf","https://scholar.google.com/scholar?q=related:AmKYRs67XmkJ:scholar.google.com/&scioq=source:nature+cross+coupling+dft&hl=en&as_sdt=0,5&as_vis=1"
33,"DT Tshitenge, D Feineis, V Mudogo, M Kaiser…","Antiplasmodial Ealapasamines AC,'Mixed' Naphthylisoquinoline Dimers from the Central African Liana Ancistrocladus ealaensis",2017,"Scientific reports","nature.com","https://www.nature.com/articles/s41598-017-05719-w","https://scholar.google.com/scholar?cites=12506399440501672567&as_sdt=2005&sciodt=0,5&hl=en",518,"2025-05-05 22:10:47","HTML","","","",,,,,33,4.13,7,5,8,"… These ‘mixed’, constitutionally unsymmetric dimers are the first stereochemically fully assigned cross-coupling products of a 5,8′- and a 7,8′-coupled naphthylisoquinoline linked via …","https://www.nature.com/articles/s41598-017-05719-w","https://scholar.google.com/scholar?q=related:dwo_hgeoj60J:scholar.google.com/&scioq=source:nature+cross+coupling+dft&hl=en&as_sdt=0,5&as_vis=1"
53,"M Giraldo, QN Meier, A Bortis, D Nowak…","Magnetoelectric coupling of domains, domain walls and vortices in a multiferroic with independent magnetic and electric order",2021,"Nature …","nature.com","https://www.nature.com/articles/s41467-021-22587-1","https://scholar.google.com/scholar?cites=6590553266815575916&as_sdt=2005&sciodt=0,5&hl=en",519,"2025-05-05 22:10:47","HTML","","","",,,,,53,13.25,11,5,4,"… density-functional theory, we show that in multiferroics with separately emerging magnetic and ferroelectric order, the microscopic magnetoelectric coupling … bulk coupling between the …","https://www.nature.com/articles/s41467-021-22587-1","https://scholar.google.com/scholar?q=related:bCfVJUdZdlsJ:scholar.google.com/&scioq=source:nature+cross+coupling+dft&hl=en&as_sdt=0,5&as_vis=1"
0,"L Ma, H Liu, B Mei, J Chen, Q Cheng, J Ma…","Cu supraparticles with enhanced mass transfer and abundant CC coupling sites achieving ampere-level CO2-to-C2+ electrosynthesis",2025,"Nature …","nature.com","https://www.nature.com/articles/s41467-025-58755-w","",520,"2025-05-05 22:10:47","HTML","","","",,,,,0,0.00,0,7,1,"… Density functional theory simulations … boundary sites, we performed density functional theory (DFT) calculations to evaluate free energy profiles for three C–C coupling pathways (CO*-…","https://www.nature.com/articles/s41467-025-58755-w","https://scholar.google.com/scholar?q=related:1DOPcZnzayQJ:scholar.google.com/&scioq=source:nature+cross+coupling+dft&hl=en&as_sdt=0,5&as_vis=1"
42,"C Chen, GC Fu","Copper-catalysed enantioconvergent alkylation of oxygen nucleophiles",2023,"Nature","nature.com","https://www.nature.com/articles/s41586-023-06001-y","https://scholar.google.com/scholar?cites=10013676168987344984&as_sdt=2005&sciodt=0,5&hl=en",521,"2025-05-05 22:10:47","","","","",,,,,42,21.00,21,2,2,"… Because density functional theory studies of N and K indicate that there is substantial spin density on copper, but not on oxygen (Extended Data Fig. 2c), we hypothesize that the organic …","https://pmc.ncbi.nlm.nih.gov/articles/PMC10986234/pdf/nihms-1973415.pdf","https://scholar.google.com/scholar?q=related:WABJxGu594oJ:scholar.google.com/&scioq=source:nature+cross+coupling+dft&hl=en&as_sdt=0,5&as_vis=1"
0,"J Hu, W Deng, J Zhou, Y Huang","Cathodic tandem alkylation/dearomatization of heterocycles enabled by Al-facilitated carbonyl deoxygenation",2025,"Nature Communications","nature.com","https://www.nature.com/articles/s41467-025-56367-y","",522,"2025-05-05 22:10:47","HTML","","","",,,,,0,0.00,0,4,1,"… To substantiate the proposed mechanism, we conducted DFT calculations at two distinct … The results from the DFT calculation reveal that the activation energy associated with the …","https://www.nature.com/articles/s41467-025-56367-y","https://scholar.google.com/scholar?q=related:ZiXQ9-xhUj4J:scholar.google.com/&scioq=source:nature+cross+coupling+dft&hl=en&as_sdt=0,5&as_vis=1"
0,"SS Chen, Y Zheng, ZX Xing, HM Huang","Borylated strain rings synthesis via photorearrangements enabled by energy transfer catalysis",2025,"Nature Communications","nature.com","https://www.nature.com/articles/s41467-025-58353-w","",523,"2025-05-05 22:10:47","HTML","","","",,,,,0,0.00,0,4,1,"… Density functional theory (DFT) computations with the DFT method were performed to … Furthermore, we performed the DFT calculation of sequential 1,5-HAT/cyclization reaction (Fig. 6B)…","https://www.nature.com/articles/s41467-025-58353-w","https://scholar.google.com/scholar?q=related:MRZT5qzc8XcJ:scholar.google.com/&scioq=source:nature+cross+coupling+dft&hl=en&as_sdt=0,5&as_vis=1"
31,"L Li, X Zhang, Y Ning, X Zhang, B Liu, Z Zhang…","Carbodefluorination of fluoroalkyl ketones via a carbene-initiated rearrangement strategy",2022,"Nature …","nature.com","https://www.nature.com/articles/s41467-022-31976-z","https://scholar.google.com/scholar?cites=3682405854720392637&as_sdt=2005&sciodt=0,5&hl=en",524,"2025-05-05 22:10:47","HTML","","","",,,,,31,10.33,4,7,3,"… The origin of chemoselectivity and the reaction mechanism are determined by experimental and DFT calculations. Collectively, this strategy by an intramolecular cascade process offers …","https://www.nature.com/articles/s41467-022-31976-z","https://scholar.google.com/scholar?q=related:vX1tWZ2IGjMJ:scholar.google.com/&scioq=source:nature+cross+coupling+dft&hl=en&as_sdt=0,5&as_vis=1"
74,"S Litters, E Kaifer, M Enders, HJ Himmel","A boron–boron coupling reaction between two ethyl cation analogues",2013,"Nature Chemistry","nature.com","https://www.nature.com/articles/nchem.1776","https://scholar.google.com/scholar?cites=17875801571160562219&as_sdt=2005&sciodt=0,5&hl=en",525,"2025-05-05 22:10:47","","","","",,,,,74,6.17,19,4,12,"… building blocks by element–element coupling reactions is one of the key … is the coupling of two elements with opposing polarity or that of two radicals. Here, we show that a B–B coupling …","","https://scholar.google.com/scholar?q=related:KxplpNGaE_gJ:scholar.google.com/&scioq=source:nature+cross+coupling+dft&hl=en&as_sdt=0,5&as_vis=1"
291,"PJ Sarver, V Bacauanu, DM Schultz, DA DiRocco…","The merger of decatungstate and copper catalysis to enable aliphatic C(sp3)–H trifluoromethylation",2020,"Nature …","nature.com","https://www.nature.com/articles/s41557-020-0436-1","https://scholar.google.com/scholar?cites=11927196556598327519&as_sdt=2005&sciodt=0,5&hl=en",526,"2025-05-05 22:10:47","","","","",,,,,291,58.20,58,5,5,"… cross-coupling 36 . Herein, we describe the first merger of decatungstate anion photochemistry with copper catalysis and introduce a new protocol for the direct trifluoromethylation of C(…","https://dmaccpanel.cpaneldev.princeton.edu/wp-content/uploads/s41557-020-0436-1.pdf","https://scholar.google.com/scholar?q=related:3zhOQhPqhaUJ:scholar.google.com/&scioq=source:nature+cross+coupling+dft&hl=en&as_sdt=0,5&as_vis=1"
132,"MK Horton, JH Montoya, M Liu…","High-throughput prediction of the ground-state collinear magnetic order of inorganic materials using density functional theory",2019,"npj Computational …","nature.com","https://www.nature.com/articles/s41524-019-0199-7","https://scholar.google.com/scholar?cites=11151073467556843403&as_sdt=2005&sciodt=0,5&hl=en",527,"2025-05-05 22:10:47","HTML","","","",,,,,132,22.00,33,4,6,"… based on purely collinear DFT simulations with the modest … using a workflow based on conventional DFT + U for a set of well-… thus determine the ground-state ordering predicted by DFT. …","https://www.nature.com/articles/s41524-019-0199-7","https://scholar.google.com/scholar?q=related:i08C4jySwJoJ:scholar.google.com/&scioq=source:nature+cross+coupling+dft&hl=en&as_sdt=0,5&as_vis=1"
