Cites,Authors,Title,Year,Source,Publisher,ArticleURL,CitesURL,GSRank,QueryDate,Type,DOI,ISSN,CitationURL,Volume,Issue,StartPage,EndPage,ECC,CitesPerYear,CitesPerAuthor,AuthorCount,Age,Abstract,FullTextURL,RelatedURL
19,"X Kong, Y Chen, X Chen, C Ma, M Chen…","Organomediated electrochemical fluorosulfonylation of aryl triflates via selective C–O bond cleavage",2023,"Nature …","nature.com","https://www.nature.com/articles/s41467-023-42699-0","https://scholar.google.com/scholar?cites=6485437791262963364&as_sdt=2005&sciodt=0,5&hl=en",267,"2025-05-05 22:10:47","HTML","","","",,,,,19,9.50,3,6,2,"… To give a deep understanding about the selective electron transfer step, additional DFT … DFT calculation indicates the need for 9.2 kcal/mol energy for this step (Fig. 7b). Eventually, …","https://www.nature.com/articles/s41467-023-42699-0","https://scholar.google.com/scholar?q=related:pHYfUU_nAFoJ:scholar.google.com/&scioq=source:nature+cross+coupling+dft&hl=en&as_sdt=0,5&as_vis=1"
116,"DH Moseley, SE Stavretis, K Thirunavukkuarasu…","Spin–phonon couplings in transition metal complexes with slow magnetic relaxation",2018,"Nature …","nature.com","https://www.nature.com/articles/s41467-018-04896-0","https://scholar.google.com/scholar?cites=11600167462153884419&as_sdt=2005&sciodt=0,5&hl=en",268,"2025-05-05 22:10:47","HTML","","","",,,,,116,16.57,29,4,7,"… Density functional theory calculations are used to rationalize energies and symmetries of the phonons. A vibronic coupling … to rationalize the behavior of the coupled Raman peaks. This …","https://www.nature.com/articles/s41467-018-04896-0","https://scholar.google.com/scholar?q=related:AxO6tNgS_KAJ:scholar.google.com/&scioq=source:nature+cross+coupling+dft&hl=en&as_sdt=0,5&as_vis=1"
65,"JL Yan, R Maiti, SC Ren, W Tian, T Li, J Xu…","Carbene-catalyzed atroposelective synthesis of axially chiral styrenes",2022,"Nature …","nature.com","https://www.nature.com/articles/s41467-021-27771-x","https://scholar.google.com/scholar?cites=4394330313776477310&as_sdt=2005&sciodt=0,5&hl=en",269,"2025-05-05 22:10:47","HTML","","","",,,,,65,21.67,9,7,3,"… The density functional theory (DFT) calculation data generated in this study are provided as Source Data. All other data are available from the authors upon request. Source data are …","https://www.nature.com/articles/s41467-021-27771-x","https://scholar.google.com/scholar?q=related:frRgYiPM-zwJ:scholar.google.com/&scioq=source:nature+cross+coupling+dft&hl=en&as_sdt=0,5&as_vis=1"
10,"Y Jiang, T Kurogi, H Yorimitsu","Reductive stereo-and regiocontrolled boryllithiation and borylsodiation of arylacetylenes using flow microreactors",2024,"Nature Synthesis","nature.com","https://www.nature.com/articles/s44160-023-00439-8","https://scholar.google.com/scholar?cites=12696868004275181267&as_sdt=2005&sciodt=0,5&hl=en",270,"2025-05-05 22:10:47","HTML","","","",,,,,10,10.00,3,3,1,"… We performed DFT calculations on the radical anions of 1b, 1c and 1d using sodium as the … We further performed DFT calculations on the reactions of the radical anions of 1c and 1d …","https://www.nature.com/articles/s44160-023-00439-8","https://scholar.google.com/scholar?q=related:01bY0i1WNLAJ:scholar.google.com/&scioq=source:nature+cross+coupling+dft&hl=en&as_sdt=0,5&as_vis=1"
100,"SF McWilliams, DLJ Broere, CJV Halliday, SM Bhutto…","Coupling dinitrogen and hydrocarbons through aryl migration",2020,"Nature","nature.com","https://www.nature.com/articles/s41586-020-2565-5","https://scholar.google.com/scholar?cites=6668608497853490763&as_sdt=2005&sciodt=0,5&hl=en",271,"2025-05-05 22:10:47","","","","",,,,,100,20.00,20,5,5,"… cross-coupling products is well known 19 , we know of no previous examples of cross-coupling … 23–25) support this difference, and density functional theory (DFT) studies indicate that …","https://pmc.ncbi.nlm.nih.gov/articles/PMC7430000/pdf/nihms-1596214.pdf","https://scholar.google.com/scholar?q=related:S2a11Bioi1wJ:scholar.google.com/&scioq=source:nature+cross+coupling+dft&hl=en&as_sdt=0,5&as_vis=1"
68,"S Xing, Z Zhang, X Fei, W Zhao, R Zhang, T Lin…","Selective on-surface covalent coupling based on metal-organic coordination template",2019,"Nature …","nature.com","https://www.nature.com/articles/s41467-018-07933-0","https://scholar.google.com/scholar?cites=14298177715340933047&as_sdt=2005&sciodt=0,5&hl=en",272,"2025-05-05 22:10:47","HTML","","","",,,,,68,11.33,10,7,6,"… microscopy, density functional theory calculations and X-ray photoelectron spectroscopy, demonstrating the template effect of Fe-tpy coordination on the on-surface covalent coupling. …","https://www.nature.com/articles/s41467-018-07933-0","https://scholar.google.com/scholar?q=related:t3dNiuBUbcYJ:scholar.google.com/&scioq=source:nature+cross+coupling+dft&hl=en&as_sdt=0,5&as_vis=1"
104,"H Chen, W Fan, XA Yuan, S Yu","Site-selective remote C(sp3)–H heteroarylation of amides via organic photoredox catalysis",2019,"Nature Communications","nature.com","https://www.nature.com/articles/s41467-019-12722-4","https://scholar.google.com/scholar?cites=8875663933195827858&as_sdt=2005&sciodt=0,5&hl=en",273,"2025-05-05 22:10:47","HTML","","","",,,,,104,17.33,26,4,6,"… To better understand and validate this mechanistic hypothesis, density functional theory (DFT) calculations using the M06–2X functional 52 were performed in an investigation of the …","https://www.nature.com/articles/s41467-019-12722-4","https://scholar.google.com/scholar?q=related:kjria1KxLHsJ:scholar.google.com/&scioq=source:nature+cross+coupling+dft&hl=en&as_sdt=0,5&as_vis=1"
6,"M Zhang, M Chapman, BR Sarode, B Xiong, H Liang…","Catalytic asymmetric synthesis of meta benzene isosteres",2024,"Nature","nature.com","https://www.nature.com/articles/s41586-024-07865-4","https://scholar.google.com/scholar?cites=3722714339754411344&as_sdt=2005&sciodt=0,5&hl=en",274,"2025-05-05 22:10:47","","","","",,,,,6,6.00,1,6,1,"… The density functional theory calculations were used to determine the free energy profile of reaction paths originating from a palladium–olefin complex (GS0) that would be obtained by …","https://pmc.ncbi.nlm.nih.gov/articles/PMC11878547/","https://scholar.google.com/scholar?q=related:UIVQ3fe8qTMJ:scholar.google.com/&scioq=source:nature+cross+coupling+dft&hl=en&as_sdt=0,5&as_vis=1"
42,"Y He, J Ma, H Song, Y Zhang, Y Liang, Y Wang…","Regio-and enantioselective remote hydroarylation using a ligand-relay strategy",2022,"Nature …","nature.com","https://www.nature.com/articles/s41467-022-30006-2","https://scholar.google.com/scholar?cites=17919283128812876191&as_sdt=2005&sciodt=0,5&hl=en",275,"2025-05-05 22:10:47","HTML","","","",,,,,42,14.00,6,7,3,"… To better understand the reaction mechanism, we conducted a DFT study of the reaction pathways shown in Fig. 7 (see Supplementary Data 1). Previous computational studies have …","https://www.nature.com/articles/s41467-022-30006-2","https://scholar.google.com/scholar?q=related:n7GKshAVrvgJ:scholar.google.com/&scioq=source:nature+cross+coupling+dft&hl=en&as_sdt=0,5&as_vis=1"
2,"X Zhang, K Huang, Y Fu, N Zhang, X Kong…","Demethylation C–C coupling reaction facilitated by the repulsive Coulomb force between two cations",2024,"Nature …","nature.com","https://www.nature.com/articles/s41467-024-49946-y","https://scholar.google.com/scholar?cites=12833422930041967440&as_sdt=2005&sciodt=0,5&hl=en",276,"2025-05-05 22:10:47","HTML","","","",,,,,2,2.00,0,6,1,"… examination of the dissociation or coupling of R1 (referring to gas-phase R1a, R1b ions of m/z 81) has been conducted through density functional theory (DFT) calculations. As depicted …","https://www.nature.com/articles/s41467-024-49946-y","https://scholar.google.com/scholar?q=related:UBOBFSl6GbIJ:scholar.google.com/&scioq=source:nature+cross+coupling+dft&hl=en&as_sdt=0,5&as_vis=1"
41,"X Zeng, Y Li, QQ Min, XS Xue, X Zhang","Copper-catalysed difluorocarbene transfer enables modular synthesis",2023,"Nature Chemistry","nature.com","https://www.nature.com/articles/s41557-023-01236-8","https://scholar.google.com/scholar?cites=13088253357118999440&as_sdt=2005&sciodt=0,5&hl=en",277,"2025-05-05 22:10:47","","","","",,,,,41,20.50,8,5,2,"… of experiments and density functional theory (DFT) reveals … DFT calculations indicate that the addition of silyl enol ether … DFT calculations reveal that LiOTf does not benefit the …","","https://scholar.google.com/scholar?q=related:kEtkcRXRorUJ:scholar.google.com/&scioq=source:nature+cross+coupling+dft&hl=en&as_sdt=0,5&as_vis=1"
781,"I Colomer, AER Chamberlain, MB Haughey…","Hexafluoroisopropanol as a highly versatile solvent",2017,"Nature Reviews …","nature.com","https://www.nature.com/articles/s41570-017-0088","https://scholar.google.com/scholar?cites=513774924155802842&as_sdt=2005&sciodt=0,5&hl=en",278,"2025-05-05 22:10:47","","","","",,,,,781,97.63,195,4,8,"… Density functional theory (DFT) calculations supported these findings, and it was stated that aggregation of HFIP molecules led to polarization of the O–O bond, thereby activating H 2 O …","https://ora.ox.ac.uk/objects/uuid:72dc250a-656e-4367-827d-17835acc28ba/files/m8a4b91e56bb28ad4538cc736a059a873","https://scholar.google.com/scholar?q=related:2lTPSJJLIQcJ:scholar.google.com/&scioq=source:nature+cross+coupling+dft&hl=en&as_sdt=0,5&as_vis=1"
36,"D Kim, GS Lee, D Kim, SH Hong","Direct C(sp2)–H alkylation of unactivated arenes enabled by photoinduced Pd catalysis",2020,"Nature communications","nature.com","https://www.nature.com/articles/s41467-020-19038-8","https://scholar.google.com/scholar?cites=7552795587202749303&as_sdt=2005&sciodt=0,5&hl=en",279,"2025-05-05 22:10:47","HTML","","","",,,,,36,7.20,9,4,5,"… To gain more information regarding the former process, we compared the DFT-calculated redox potentials of the Pd(I) bromide species and the radical σ-complexes (Supplementary Fig. …","https://www.nature.com/articles/s41467-020-19038-8","https://scholar.google.com/scholar?q=related:d5Nb9JHr0GgJ:scholar.google.com/&scioq=source:nature+cross+coupling+dft&hl=en&as_sdt=0,5&as_vis=1"
307,"MJ Plevin, DL Bryce, J Boisbouvier","Direct detection of CH/π interactions in proteins",2010,"Nature chemistry","nature.com","https://www.nature.com/articles/nchem.650","https://scholar.google.com/scholar?cites=13691588243135006514&as_sdt=2005&sciodt=0,5&hl=en",280,"2025-05-05 22:10:47","","","","",,,,,307,20.47,102,3,15,"… Hybrid density functional theory (DFT) calculations predict the existence of weak J couplings … These local structural differences affect the value of the couplings calculated by DFT. The …","https://citeseerx.ist.psu.edu/document?repid=rep1&type=pdf&doi=ebc69cd18150b66a09412b707a4fbcbfec49e64d","https://scholar.google.com/scholar?q=related:Mgf6SvdKAr4J:scholar.google.com/&scioq=source:nature+cross+coupling+dft&hl=en&as_sdt=0,5&as_vis=1"
96,"HZ Liu, XX Shu, M Huang, BB Wu, JJ Chen…","Tailoring d-band center of high-valent metal-oxo species for pollutant removal via complete polymerization",2024,"Nature …","nature.com","https://www.nature.com/articles/s41467-024-46739-1","https://scholar.google.com/scholar?cites=4016847627280534334&as_sdt=2005&sciodt=0,5&hl=en",281,"2025-05-05 22:10:47","HTML","","","",,,,,96,96.00,16,6,1,"… The distinct oxidative feature of Fe(IV)=O was revealed through a combination of density functional theory (DFT) calculations and experimental designs. As shown in Fig. 5b, the …","https://www.nature.com/articles/s41467-024-46739-1","https://scholar.google.com/scholar?q=related:PkvthKK1vjcJ:scholar.google.com/&scioq=source:nature+cross+coupling+dft&hl=en&as_sdt=0,5&as_vis=1"
8,"IU Hoque, A Samanta, S Pramanik…","Photocascade chemoselective controlling of ambident thio (seleno) cyanates with alkenes via catalyst modulation",2024,"Nature …","nature.com","https://www.nature.com/articles/s41467-024-49279-w","https://scholar.google.com/scholar?cites=990514309635635748&as_sdt=2005&sciodt=0,5&hl=en",282,"2025-05-05 22:10:47","HTML","","","",,,,,8,8.00,2,4,1,"… In addition, detailed mechanistic insights are provided by a conjugation of extensive control experiments and dispersion-corrected density functional theory (DFT) calculations. …","https://www.nature.com/articles/s41467-024-49279-w","https://scholar.google.com/scholar?q=related:JPrFQoQDvw0J:scholar.google.com/&scioq=source:nature+cross+coupling+dft&hl=en&as_sdt=0,5&as_vis=1"
32,"Z Zhou, Y Tan, Q Yang, A Bera, Z Xiong…","Gas permeation through graphdiyne-based nanoporous membranes",2022,"Nature …","nature.com","https://www.nature.com/articles/s41467-022-31779-2","https://scholar.google.com/scholar?cites=10002783769321087946&as_sdt=2005&sciodt=0,5&hl=en",283,"2025-05-05 22:10:47","HTML","","","",,,,,32,10.67,5,6,3,"… If we now take a theoretical perspective, our DFT calculations show that noble gases with d k close to d 0 should experience very large (∼1 eV) energy barriers (DFT simulations in …","https://www.nature.com/articles/s41467-022-31779-2","https://scholar.google.com/scholar?q=related:yiNtV9cG0YoJ:scholar.google.com/&scioq=source:nature+cross+coupling+dft&hl=en&as_sdt=0,5&as_vis=1"
28,"Z Zhang, Y Sun, Y Gong, DL Tang, H Luo, ZP Zhao…","Enantioselective propargylic amination and related tandem sequences to α-tertiary ethynylamines and azacycles",2024,"Nature Chemistry","nature.com","https://www.nature.com/articles/s41557-024-01479-z","https://scholar.google.com/scholar?cites=13269851295483274214&as_sdt=2005&sciodt=0,5&hl=en",284,"2025-05-05 22:10:47","","","","",,,,,28,28.00,4,7,1,"… Based on these results, density functional theory (DFT) calculations were performed to understand the role of the C4 benzyloxy group and cis-phenyl relaying group of PYBOX in …","","https://scholar.google.com/scholar?q=related:5qOJUXL7J7gJ:scholar.google.com/&scioq=source:nature+cross+coupling+dft&hl=en&as_sdt=0,5&as_vis=1"
74,"IF Yu, JL Manske, A Diéguez-Vázquez, A Misale…","Catalytic undirected borylation of tertiary C–H bonds in bicyclo [1.1. 1] pentanes and bicyclo [2.1. 1] hexanes",2023,"Nature …","nature.com","https://www.nature.com/articles/s41557-023-01159-4","https://scholar.google.com/scholar?cites=9691756981250708642&as_sdt=2005&sciodt=0,5&hl=en",285,"2025-05-05 22:10:47","","","","",,,,,74,37.00,15,5,2,"… by 1,2-metallate rearrangements or cross coupling. The boryl products also reacted to form … the C–H borylation process, we conducted density functional theory (DFT) calculations on the …","https://pmc.ncbi.nlm.nih.gov/articles/PMC10684141/pdf/nihms-1946123.pdf","https://scholar.google.com/scholar?q=related:olTcFKAJgIYJ:scholar.google.com/&scioq=source:nature+cross+coupling+dft&hl=en&as_sdt=0,5&as_vis=1"
39,"Y Shi, T Zhang, XM Jiang, G Xu, C He…","Synergistic photoredox and copper catalysis by diode-like coordination polymer with twisted and polar copper–dye conjugation",2020,"Nature …","nature.com","https://www.nature.com/articles/s41467-020-19172-3","https://scholar.google.com/scholar?cites=12379881622953953270&as_sdt=2005&sciodt=0,5&hl=en",287,"2025-05-05 22:10:47","HTML","","","",,,,,39,7.80,7,6,5,"… challenges in the fields of cross-coupling chemistry 1 . Taking … to realise the key steps of cross couplings 2 . The synergy of … DFT calculation revealed the thermodynamic feasibility of …","https://www.nature.com/articles/s41467-020-19172-3","https://scholar.google.com/scholar?q=related:9oeOob4szqsJ:scholar.google.com/&scioq=source:nature+cross+coupling+dft&hl=en&as_sdt=0,5&as_vis=1"
66,"SPP Jones, SM Gaw, KI Doig, D Prabhakaran…","High-temperature electromagnons in the magnetically induced multiferroic cupric oxide driven by intersublattice exchange",2014,"Nature …","nature.com","https://www.nature.com/articles/ncomms4787","https://scholar.google.com/scholar?cites=12266268077504630851&as_sdt=2005&sciodt=0,5&hl=en",288,"2025-05-05 22:10:47","HTML","","","",,,,,66,6.00,13,5,11,"… coupling can therefore be achieved in materials, such as CuO, that exhibit minimal static cross-coupling. … Recent DFT calculations have yielded values for J 1 ranging from −51 to −127 …","https://www.nature.com/articles/ncomms4787","https://scholar.google.com/scholar?q=related:Q5Bgt9OJOqoJ:scholar.google.com/&scioq=source:nature+cross+coupling+dft&hl=en&as_sdt=0,5&as_vis=1"
1,"X Su, G Li, L He, S Chen, X Yang, G Wang…","Nickel-catalyzed, silyl-directed, ortho-borylation of arenes via an unusual Ni (II)/Ni (IV) catalytic cycle",2024,"Nature …","nature.com","https://www.nature.com/articles/s41467-024-51997-0","https://scholar.google.com/scholar?cites=6710158927147517052&as_sdt=2005&sciodt=0,5&hl=en",289,"2025-05-05 22:10:47","HTML","","","",,,,,1,1.00,0,7,1,"… Despite impressive developments of nickel catalysis in cross-coupling reactions 20,21 , … With control experiments and DFT calculations, we propose that a Ni(II)-Bpin-ate complex is the …","https://www.nature.com/articles/s41467-024-51997-0","https://scholar.google.com/scholar?q=related:fEQLB_5FH10J:scholar.google.com/&scioq=source:nature+cross+coupling+dft&hl=en&as_sdt=0,5&as_vis=1"
25,"Z Ye, Y Yu, YM Lin, Y Chen, S Song, L Gong","Photochemical diversification of strong C(sp3)–H bonds enabled by allyl bromide and sodium fluoride",2023,"Nature Synthesis","nature.com","https://www.nature.com/articles/s44160-023-00291-w","https://scholar.google.com/scholar?cites=14235511664008774296&as_sdt=2005&sciodt=0,5&hl=en",290,"2025-05-05 22:10:47","","","","",,,,,25,12.50,4,6,2,"… that a radical–radical coupling pathway was more favourable than … Density functional theory (DFT) calculations were performed to … of radical–radical cross-coupling over self-coupling. …","","https://scholar.google.com/scholar?q=related:mEIseW-yjsUJ:scholar.google.com/&scioq=source:nature+cross+coupling+dft&hl=en&as_sdt=0,5&as_vis=1"
9,"J Zhang, M Rueping","Metallaphotoredox catalysis for sp3 C–H functionalizations through single-electron transfer",2024,"Nature Catalysis","nature.com","https://www.nature.com/articles/s41929-024-01215-3","https://scholar.google.com/scholar?cites=9068439431938326268&as_sdt=2005&sciodt=0,5&hl=en",291,"2025-05-05 22:10:47","","","","",,,,,9,9.00,5,2,1,"… A density functional theory investigation supports the plausibility of a Ni(0)/Ni(i)/Ni(iii) pathway because of the superior stability of an alkyl Ni(i) intermediate compared with a Ni(0) …","","https://scholar.google.com/scholar?q=related:_D7U352R2X0J:scholar.google.com/&scioq=source:nature+cross+coupling+dft&hl=en&as_sdt=0,5&as_vis=1"
21,"XQ Ng, CS Lim, MW Liaw, TT Quach, BM Yang…","Direct access to chiral aliphatic amines by catalytic enantioconvergent redox-neutral amination of alcohols",2023,"Nature …","nature.com","https://www.nature.com/articles/s44160-023-00264-z","https://scholar.google.com/scholar?cites=2857129895243544564&as_sdt=2005&sciodt=0,5&hl=en",292,"2025-05-05 22:10:47","","","","",,,,,21,10.50,4,6,2,"… , including reductive amination and C–N cross coupling, direct access to diverse enantioenriched … On the basis of our previous stereochemical model based on density functional theory …","","https://scholar.google.com/scholar?q=related:9Pcjg4CQpicJ:scholar.google.com/&scioq=source:nature+cross+coupling+dft&hl=en&as_sdt=0,5&as_vis=1"
124,"J Dong, XA Yuan, Z Yan, L Mu, J Ma, C Zhu, J Xie","Manganese-catalysed divergent silylation of alkenes",2021,"Nature Chemistry","nature.com","https://www.nature.com/articles/s41557-020-00589-8","https://scholar.google.com/scholar?cites=9880122880721123872&as_sdt=2005&sciodt=0,5&hl=en",293,"2025-05-05 22:10:47","","","","",,,,,124,31.00,18,7,4,"… The selectivity of the reaction has been studied using density functional theory calculations, showing the use of an i PrPNP ligand to favour dehydrosilylation, while a JackiePhos ligand …","https://chem.nju.edu.cn/_upload/article/files/2d/10/6f8f378045f58f3052fab2fbb0f9/40fca68e-0963-4aa8-943b-58f6d55e0f20.pdf","https://scholar.google.com/scholar?q=related:IHqXsmk_HYkJ:scholar.google.com/&scioq=source:nature+cross+coupling+dft&hl=en&as_sdt=0,5&as_vis=1"
2,"Q Zhang, J Zhang, W Zhu, R Lu, C Guo","Enantioselective nickel-catalyzed anodic oxidative dienylation and allylation reactions",2024,"Nature Communications","nature.com","https://www.nature.com/articles/s41467-024-48936-4","https://scholar.google.com/scholar?cites=15659977619207213756&as_sdt=2005&sciodt=0,5&hl=en",294,"2025-05-05 22:10:47","HTML","","","",,,,,2,2.00,0,5,1,"… DFT calculations suggested that radical intermediate III is oxidized to a cation IV and then undergoes TMS removal to afford the corresponding product 3 (see Supplementary …","https://www.nature.com/articles/s41467-024-48936-4","https://scholar.google.com/scholar?q=related:vNJpr6xqU9kJ:scholar.google.com/&scioq=source:nature+cross+coupling+dft&hl=en&as_sdt=0,5&as_vis=1"
169,"N Baadji, M Piacenza, T Tugsuz, FD Sala…","Electrostatic spin crossover effect in polar magnetic molecules",2009,"Nature Materials","nature.com","https://www.nature.com/articles/nmat2525","https://scholar.google.com/scholar?cites=9860788726709073571&as_sdt=2005&sciodt=0,5&hl=en",295,"2025-05-05 22:10:47","","","","",,,,,169,10.56,34,5,16,"… We carried out total-energy DFT calculations for both the singlet and triplet states under an external electric field in the direction of the two magnetic centres. Our results are presented in …","https://www.researchgate.net/profile/Stefano-Sanvito/publication/26777781_Electrostatic_spin_crossover_effect_in_polar_magnetic_molecules/links/5dd41a7c299bf11ec8626a91/Electrostatic-spin-crossover-effect-in-polar-magnetic-molecules.pdf","https://scholar.google.com/scholar?q=related:o7arLBqP2IgJ:scholar.google.com/&scioq=source:nature+cross+coupling+dft&hl=en&as_sdt=0,5&as_vis=1"
137,"D Mullangi, S Nandi, S Shalini, S Sreedhala…","Pd loaded amphiphilic COF as catalyst for multi-fold Heck reactions, CC couplings and CO oxidation",2015,"Scientific Reports","nature.com","https://www.nature.com/articles/srep10876","https://scholar.google.com/scholar?cites=3508010688456874150&as_sdt=2005&sciodt=0,5&hl=en",296,"2025-05-05 22:10:47","HTML","","","",,,,,137,13.70,27,5,10,"… ) catalyzing simultaneous multiple site Heck couplings and CC couplings using ‘non-boronic acid… DFT-TB studies showed the presence of Pd-triazine and Pd-Schiff bond interactions as …","https://www.nature.com/articles/srep10876","https://scholar.google.com/scholar?q=related:pti-iSL1rjAJ:scholar.google.com/&scioq=source:nature+cross+coupling+dft&hl=en&as_sdt=0,5&as_vis=1"
102,"H Mandai, K Fujii, H Yasuhara, K Abe, K Mitsudo…","Enantioselective acyl transfer catalysis by a combination of common catalytic motifs and electrostatic interactions",2016,"Nature …","nature.com","https://www.nature.com/articles/ncomms11297","https://scholar.google.com/scholar?cites=16265905899323052905&as_sdt=2005&sciodt=0,5&hl=en",297,"2025-05-05 22:10:47","HTML","","","",,,,,102,11.33,17,6,9,"… To gain further insight regarding the role of the chiral catalyst’s tertiary hydroxyl groups, density functional theory (DFT) calculations were performed at the B3LYP/6-31G(d) level, with 9a …","https://www.nature.com/articles/ncomms11297","https://scholar.google.com/scholar?q=related:adMUJzwbvOEJ:scholar.google.com/&scioq=source:nature+cross+coupling+dft&hl=en&as_sdt=0,5&as_vis=1"
174,"Y Moon, B Park, I Kim, G Kang, S Shin, D Kang…","Visible light induced alkene aminopyridylation using N-aminopyridinium salts as bifunctional reagents",2019,"Nature …","nature.com","https://www.nature.com/articles/s41467-019-12216-3","https://scholar.google.com/scholar?cites=13450275870748460507&as_sdt=2005&sciodt=0,5&hl=en",298,"2025-05-05 22:10:47","HTML","","","",,,,,174,29.00,25,7,6,"… , we carried out quantum chemical calculations based on density functional theory (DFT). … Whereas DFT calculations can capture these effects, as we demonstrate, it is desirable to …","https://www.nature.com/articles/s41467-019-12216-3","https://scholar.google.com/scholar?q=related:20X4TqT6qLoJ:scholar.google.com/&scioq=source:nature+cross+coupling+dft&hl=en&as_sdt=0,5&as_vis=1"
10,"Y Li, D Liu, X Hu, JY Zhang, QW Zhu, B Men…","Enantioselective alkene hydroalkylation overcoming heteroatom constraints via cobalt catalysis",2024,"Nature …","nature.com","https://www.nature.com/articles/s44160-024-00581-x","https://scholar.google.com/scholar?cites=1540525013316474690&as_sdt=2005&sciodt=0,5&hl=en",299,"2025-05-05 22:10:47","","","","",,,,,10,10.00,1,7,1,"… We performed density functional theory (DFT) calculations on a simplified reaction model (instead of the complex alkyl iodide substitutes with n-propyl iodide) involving the Co(II)–H …","","https://scholar.google.com/scholar?q=related:QhdValYLYRUJ:scholar.google.com/&scioq=source:nature+cross+coupling+dft&hl=en&as_sdt=0,5&as_vis=1"
