Cites,Authors,Title,Year,Source,Publisher,ArticleURL,CitesURL,GSRank,QueryDate,Type,DOI,ISSN,CitationURL,Volume,Issue,StartPage,EndPage,ECC,CitesPerYear,CitesPerAuthor,AuthorCount,Age,Abstract,FullTextURL,RelatedURL
15,"PG Jiang, XB Yu, YY Xiao, S Zhao, WJ Peng","Study on hydrogen adsorption on WO3(001) surface by density functional theory calculation",2023,"Tungsten","Springer","https://idp.springer.com/authorize/casa?redirect_uri=https://link.springer.com/article/10.1007/s42864-022-00195-w&casa_token=6YYRmb1U0_EAAAAA:hgYMNKb90n23U7wHIFGgslyE_a_WWeP-09VgsZWUvuPD_ZXIxw4woKggKTqrrz6XbrXtmNV_BgHFlPdU","https://scholar.google.com/scholar?cites=5166360835727523393&as_sdt=2005&sciodt=0,5&hl=en",225,"2025-05-05 22:12:12","HTML","10.1007/s42864-022-00195-w","","",,,,,15,7.50,3,5,2,"… The density functional theory (DFT) is applied to investigate the adsorption characteristic of … The activation energy of hydrogen molecule diffusion from the surface down to the first …","https://idp.springer.com/authorize/casa?redirect_uri=https://link.springer.com/article/10.1007/s42864-022-00195-w&casa_token=6YYRmb1U0_EAAAAA:hgYMNKb90n23U7wHIFGgslyE_a_WWeP-09VgsZWUvuPD_ZXIxw4woKggKTqrrz6XbrXtmNV_BgHFlPdU","https://scholar.google.com/scholar?q=related:QX4Hu86ZskcJ:scholar.google.com/&scioq=source:nature+ch+activation+dft&hl=en&as_sdt=0,5&as_vis=1"
0,"T Zeng, Y He, Y Li, L Wang, Q Hu, Y Li, Z Wei…","Photoredox cobalt-catalyzed asymmetric desymmetric reductive coupling of cyclobutenes with alkynes",2025,"Nature …","nature.com","https://www.nature.com/articles/s41467-025-58315-2","",226,"2025-05-05 22:12:12","HTML","","","",,,,,0,0.00,0,8,1,"… Preliminary density functional theory (DFT) calculations were performed to distinguish … -activation of cyclobutene can be prevented by HE or Et 3 N in this reaction. DFT calculations …","https://www.nature.com/articles/s41467-025-58315-2","https://scholar.google.com/scholar?q=related:Ta_G6YIZTO8J:scholar.google.com/&scioq=source:nature+ch+activation+dft&hl=en&as_sdt=0,5&as_vis=1"
150,"JP Reid, MS Sigman","Comparing quantitative prediction methods for the discovery of small-molecule chiral catalysts",2018,"Nature Reviews Chemistry","nature.com","https://idp.nature.com/authorize/casa?redirect_uri=https://www.nature.com/articles/s41570-018-0040-8&casa_token=Q8rPmVgeO8IAAAAA:TQXo_l_fMFbILyEtHhvinTsIJCF2fhRx8tmZbpZoX8A16I-m_2MOu5DMPIqQxIxnf3O7xOOWZ3JF9D7D","https://scholar.google.com/scholar?cites=11991282974772056476&as_sdt=2005&sciodt=0,5&hl=en",227,"2025-05-05 22:12:12","HTML","","","",,,,,150,21.43,75,2,7,"… The most popular approach involves the use of density functional theory (DFT) 11 . DFT can … The influence of ligand structure on the first step (C–H activation) was probed by measuring …","https://idp.nature.com/authorize/casa?redirect_uri=https://www.nature.com/articles/s41570-018-0040-8&casa_token=Q8rPmVgeO8IAAAAA:TQXo_l_fMFbILyEtHhvinTsIJCF2fhRx8tmZbpZoX8A16I-m_2MOu5DMPIqQxIxnf3O7xOOWZ3JF9D7D","https://scholar.google.com/scholar?q=related:nFF6QFWYaaYJ:scholar.google.com/&scioq=source:nature+ch+activation+dft&hl=en&as_sdt=0,5&as_vis=1"
276,"JL Achtyl, RR Unocic, L Xu, Y Cai, M Raju…","Aqueous proton transfer across single-layer graphene",2015,"Nature …","nature.com","https://www.nature.com/articles/ncomms7539","https://scholar.google.com/scholar?cites=17725963855735693058&as_sdt=2005&sciodt=0,5&hl=en",228,"2025-05-05 22:12:12","HTML","","","",,,,,276,27.60,46,6,10,"… DFT simulations track the detailed changes in the electronic structure and quantify the corresponding activation barriers as protons transfer from the water layer above the surface …","https://www.nature.com/articles/ncomms7539","https://scholar.google.com/scholar?q=related:Ah-K6jVG__UJ:scholar.google.com/&scioq=source:nature+ch+activation+dft&hl=en&as_sdt=0,5&as_vis=1"
74,"G Huang, T Wagner, MD Wodrich, K Ataka, E Bill…","The atomic-resolution crystal structure of activated [Fe]-hydrogenase",2019,"Nature Catalysis","nature.com","https://idp.nature.com/authorize/casa?redirect_uri=https://www.nature.com/articles/s41929-019-0289-4&casa_token=7BvFbr5AnxEAAAAA:YIsL2kn5fO8JKzCXmeacLHkg8QGp_t1SfDN86mHMjKWMZFawNNpAYu2Ok_ONMiuPY02Q8MxOyT1Pu7i8","https://scholar.google.com/scholar?cites=9648209429526620388&as_sdt=2005&sciodt=0,5&hl=en",229,"2025-05-05 22:12:12","HTML","","","",,,,,74,12.33,12,6,6,"… with the range of distances for H 2 activation predicted by previous DFT computations 19,20 . The water ligand of Fe thereby becomes dissociated (Fig. 2c,d), as predicted by Dey 18 . …","https://idp.nature.com/authorize/casa?redirect_uri=https://www.nature.com/articles/s41929-019-0289-4&casa_token=7BvFbr5AnxEAAAAA:YIsL2kn5fO8JKzCXmeacLHkg8QGp_t1SfDN86mHMjKWMZFawNNpAYu2Ok_ONMiuPY02Q8MxOyT1Pu7i8","https://scholar.google.com/scholar?q=related:5CiClVtT5YUJ:scholar.google.com/&scioq=source:nature+ch+activation+dft&hl=en&as_sdt=0,5&as_vis=1"
24,"Y Gu, JJ Zheng, K Otake, S Sakaki, H Ashitani…","Soft corrugated channel with synergistic exclusive discrimination gating for CO2 recognition in gas mixture",2023,"Nature …","nature.com","https://www.nature.com/articles/s41467-023-39470-w","https://scholar.google.com/scholar?cites=6057439367711797806&as_sdt=2005&sciodt=0,5&hl=en",230,"2025-05-05 22:12:12","HTML","","","",,,,,24,12.00,4,6,2,"… geometry optimisation using the periodic density functional theory (DFT) calculation with the … The DFT-calculated activation barrier (E a ) for diffusion decreases in the order of C 2 H 4 (…","https://www.nature.com/articles/s41467-023-39470-w","https://scholar.google.com/scholar?q=related:LrLt4AJZEFQJ:scholar.google.com/&scioq=source:nature+ch+activation+dft&hl=en&as_sdt=0,5&as_vis=1"
20,"J Cao, H Liang, J Yang, Z Zhu, J Deng, X Li…","Depolymerization mechanisms and closed-loop assessment in polyester waste recycling",2024,"Nature …","nature.com","https://www.nature.com/articles/s41467-024-50702-5","https://scholar.google.com/scholar?cites=13246939710856730874&as_sdt=2005&sciodt=0,5&hl=en",231,"2025-05-05 22:12:12","HTML","","","",,,,,20,20.00,3,7,1,"… density functional theory calculations, elucidates the reaction pathways of PET depolymerization. The process involves O 2 -assisted activation of CH 3 OH to form CH 3 … conducted DFT …","https://www.nature.com/articles/s41467-024-50702-5","https://scholar.google.com/scholar?q=related:-pihUnuV1rcJ:scholar.google.com/&scioq=source:nature+ch+activation+dft&hl=en&as_sdt=0,5&as_vis=1"
1,"M Chauhan, B Rana, P Gupta, R Kalita…","Tailored pore-confined single-site iron(III) catalyst for selective CH4 oxidation to CH3OH or CH3CO2H using O2",2024,"Nature …","nature.com","https://www.nature.com/articles/s41467-024-54101-8","https://scholar.google.com/scholar?cites=12953026041922514727&as_sdt=2005&sciodt=0,5&hl=en",232,"2025-05-05 22:12:12","HTML","","","",,,,,1,1.00,0,5,1,"… overoxidation to CO and CO 2 and the intricacy of C−H activation/C−C coupling. In this work, … experiments and DFT calculations provide the insights into methane’s C‒H activation. The …","https://www.nature.com/articles/s41467-024-54101-8","https://scholar.google.com/scholar?q=related:J-8sm45kwrMJ:scholar.google.com/&scioq=source:nature+ch+activation+dft&hl=en&as_sdt=0,5&as_vis=1"
48,"F de Azambuja, MH Yang, T Feoktistova, M Selvaraju…","Connecting remote C–H bond functionalization and decarboxylative coupling using simple amines",2020,"Nature …","nature.com","https://idp.nature.com/authorize/casa?redirect_uri=https://www.nature.com/articles/s41557-020-0428-1&casa_token=vEUy7WUB5vgAAAAA:XESpo_o8EG5eqZ_6R-B8QabAqAPzjS29AGnOZBCwn3F8Ip8npnNgHhTXtlNnU1TKFQuAw67au1eK0PT6","https://scholar.google.com/scholar?cites=17870707381347106698&as_sdt=2005&sciodt=0,5&hl=en",233,"2025-05-05 22:12:12","HTML","","","",,,,,48,9.60,10,5,5,"… This reaction complements ‘C–H activation’ strategies that convert inert C–H bonds into C–metal bonds prior to C–C … Inset: Pd ligand sphere studied by density functional theory (DFT). …","https://idp.nature.com/authorize/casa?redirect_uri=https://www.nature.com/articles/s41557-020-0428-1&casa_token=vEUy7WUB5vgAAAAA:XESpo_o8EG5eqZ_6R-B8QabAqAPzjS29AGnOZBCwn3F8Ip8npnNgHhTXtlNnU1TKFQuAw67au1eK0PT6","https://scholar.google.com/scholar?q=related:ij8lJq6BAfgJ:scholar.google.com/&scioq=source:nature+ch+activation+dft&hl=en&as_sdt=0,5&as_vis=1"
3,"X Wu, X Fan, S Xie, I Scodeller, X Wen…","Zinc-indium-sulfide favors efficient C− H bond activation by concerted proton-coupled electron transfer",2024,"Nature …","nature.com","https://www.nature.com/articles/s41467-024-49265-2","https://scholar.google.com/scholar?cites=16124386747640892805&as_sdt=2005&sciodt=0,5&hl=en",234,"2025-05-05 22:12:12","HTML","","","",,,,,3,3.00,1,6,1,"… We performed density functional theory (DFT) calculations for the toluene oxidative coupling on both the anatase TiO 2 (101) and hexagonal ZnIn 2 S 4 (001) surface. We first optimized …","https://www.nature.com/articles/s41467-024-49265-2","https://scholar.google.com/scholar?q=related:hc0m-lBUxd8J:scholar.google.com/&scioq=source:nature+ch+activation+dft&hl=en&as_sdt=0,5&as_vis=1"
21,"S Zhao, D Zeng, M Wang, X Jiang","C-SuFEx linkage of sulfonimidoyl fluorides and organotrifluoroborates",2024,"Nature Communications","nature.com","https://www.nature.com/articles/s41467-024-44998-6","https://scholar.google.com/scholar?cites=7832367109055244835&as_sdt=2005&sciodt=0,5&hl=en",235,"2025-05-05 22:12:12","HTML","","","",,,,,21,21.00,5,4,1,"… activation process of BF 3 , BF 3 may activate either substrate 1a or 2a, and the DFT calculations show that BF 3 tends to activate … of 2a was achieved under the activation of BF 3 to form …","https://www.nature.com/articles/s41467-024-44998-6","https://scholar.google.com/scholar?q=related:I-qwVWMosmwJ:scholar.google.com/&scioq=source:nature+ch+activation+dft&hl=en&as_sdt=0,5&as_vis=1"
33,"R Oktavian, R Goeminne, LT Glasby, P Song…","Gas adsorption and framework flexibility of CALF-20 explored via experiments and simulations",2024,"Nature …","nature.com","https://www.nature.com/articles/s41467-024-48136-0","https://scholar.google.com/scholar?cites=8580150970845856869&as_sdt=2005&sciodt=0,5&hl=en",236,"2025-05-05 22:12:12","HTML","","","",,,,,33,33.00,7,5,1,"… both density-functional theory (DFT) and machine learning potentials (MLPs) trained to DFT … mimicking the experimental activation process. This process assumes that the experimental …","https://www.nature.com/articles/s41467-024-48136-0","https://scholar.google.com/scholar?q=related:ZYR9MNnREncJ:scholar.google.com/&scioq=source:nature+ch+activation+dft&hl=en&as_sdt=0,5&as_vis=1"
43,"R Cheng, J Zhang, H Zhang, Z Qiu, Z Xie","Ir-catalyzed enantioselective B−H alkenylation for asymmetric synthesis of chiral-at-cage o‑carboranes",2021,"Nature Communications","nature.com","https://www.nature.com/articles/s41467-021-27441-y","https://scholar.google.com/scholar?cites=16806548237806964550&as_sdt=2005&sciodt=0,5&hl=en",237,"2025-05-05 22:12:12","HTML","","","",,,,,43,10.75,9,5,4,"… The enantiocontrol model is proposed based on Density Functional Theory calculations in … reaction temperature probably due to the activation of alkynes via their complexation with Cu(II…","https://www.nature.com/articles/s41467-021-27441-y","https://scholar.google.com/scholar?q=related:Ro_zzpPaPOkJ:scholar.google.com/&scioq=source:nature+ch+activation+dft&hl=en&as_sdt=0,5&as_vis=1"
112,"X Xie, X Zhang, M Xie, L Xiong, H Sun, Y Lu…","Au-activated N motifs in non-coherent cupric porphyrin metal organic frameworks for promoting and stabilizing ethylene production",2022,"Nature …","nature.com","https://www.nature.com/articles/s41467-021-27768-6","https://scholar.google.com/scholar?cites=7476063587492694514&as_sdt=2005&sciodt=0,5&hl=en",238,"2025-05-05 22:12:12","HTML","","","",,,,,112,37.33,16,7,3,"… We then performed DFT calculations on the configuration and … for CO 2 activation at a time, the C–C coupling is unfeasible. … 7: DFT calculations of the configuration and energetics of key …","https://www.nature.com/articles/s41467-021-27768-6","https://scholar.google.com/scholar?q=related:8gm8EjlQwGcJ:scholar.google.com/&scioq=source:nature+ch+activation+dft&hl=en&as_sdt=0,5&as_vis=1"
41,"Z Luo, R Nie, VT Nguyen, A Biswas, RK Behera…","Transition metal-like carbocatalyst",2020,"Nature …","nature.com","https://www.nature.com/articles/s41467-020-17909-8","https://scholar.google.com/scholar?cites=10196010782093366964&as_sdt=2005&sciodt=0,5&hl=en",239,"2025-05-05 22:12:12","HTML","","","",,,,,41,8.20,7,6,5,"… These results strongly suggest that activation of H 2 and C–O … in H 2 activation, density functional theory (DFT) calculations … of 1.4 eV after overcoming an activation barrier of 2.5 eV. This …","https://www.nature.com/articles/s41467-020-17909-8","https://scholar.google.com/scholar?q=related:tFa6GMmBf40J:scholar.google.com/&scioq=source:nature+ch+activation+dft&hl=en&as_sdt=0,5&as_vis=1"
233,"XQ Hu, X Qi, JR Chen, QQ Zhao, Q Wei, Y Lan…","Catalytic N-radical cascade reaction of hydrazones by oxidative deprotonation electron transfer and TEMPO mediation",2016,"Nature …","nature.com","https://www.nature.com/articles/ncomms11188","https://scholar.google.com/scholar?cites=2065849551781994494&as_sdt=2005&sciodt=0,5&hl=en",240,"2025-05-05 22:12:12","HTML","","","",,,,,233,25.89,33,7,9,"… , we initially conducted density functional theory (DFT) … of 1a-A with an activation free energy of only 8.8 kcal mol −1 … -metal-catalyzed aromatic C–H activation/functionalization reactions …","https://www.nature.com/articles/ncomms11188","https://scholar.google.com/scholar?q=related:_p9d1ThfqxwJ:scholar.google.com/&scioq=source:nature+ch+activation+dft&hl=en&as_sdt=0,5&as_vis=1"
44,"SK Kim, HW Kim, SJ Han, SW Lee, J Shin…","Mechanistic and microkinetic study of non-oxidative methane coupling on a single-atom iron catalyst",2020,"Communications …","nature.com","https://www.nature.com/articles/s42004-020-0306-1","https://scholar.google.com/scholar?cites=15703057962199048155&as_sdt=2005&sciodt=0,5&hl=en",241,"2025-05-05 22:12:12","HTML","","","",,,,,44,8.80,7,6,5,"… atom catalyst was investigated using DFT and microkinetic analyses. … C–H activation occurs actively when the reaction temperature is above 1300 K, and most CH 4 is converted into CH …","https://www.nature.com/articles/s42004-020-0306-1","https://scholar.google.com/scholar?q=related:218-rAR47NkJ:scholar.google.com/&scioq=source:nature+ch+activation+dft&hl=en&as_sdt=0,5&as_vis=1"
47,"NJ LiBretto, Y Xu, A Quigley, E Edwards…","Olefin oligomerization by main group Ga3+ and Zn2+ single site catalysts on SiO2",2021,"Nature …","nature.com","https://www.nature.com/articles/s41467-021-22512-6","https://scholar.google.com/scholar?cites=14341027223616098348&as_sdt=2005&sciodt=0,5&hl=en",242,"2025-05-05 22:12:12","HTML","","","",,,,,47,11.75,9,5,4,"… The initial ethylene C–H (sp 2 ) bond cleavage has an activation free energy of 1.69 eV. … G = E DFT + E ZPE −TS, where E DFT is the ground-state potential energy calculated using DFT. …","https://www.nature.com/articles/s41467-021-22512-6","https://scholar.google.com/scholar?q=related:LBDYIUeQBccJ:scholar.google.com/&scioq=source:nature+ch+activation+dft&hl=en&as_sdt=0,5&as_vis=1"
30,"J Xie, X Li, J Guo, L Luo, JJ Delgado…","Highly selective oxidation of benzene to phenol with air at room temperature promoted by water",2023,"Nature …","nature.com","https://www.nature.com/articles/s41467-023-40160-w","https://scholar.google.com/scholar?cites=17017649694846204462&as_sdt=2005&sciodt=0,5&hl=en",243,"2025-05-05 22:12:12","HTML","","","",,,,,30,15.00,5,6,2,"… The enhancement of water activation by Cu was also proved by DFT calculation and other experiments as mentioned above, which allows the existence of sufficient hydroxyl radicals to …","https://www.nature.com/articles/s41467-023-40160-w","https://scholar.google.com/scholar?q=related:LrpX7TvWKuwJ:scholar.google.com/&scioq=source:nature+ch+activation+dft&hl=en&as_sdt=0,5&as_vis=1"
64,"HS Pillai, Y Li, SH Wang, N Omidvar, Q Mu…","Interpretable design of Ir-free trimetallic electrocatalysts for ammonia oxidation with graph neural networks",2023,"nature …","nature.com","https://www.nature.com/articles/s41467-023-36322-5","https://scholar.google.com/scholar?cites=10019279715648981428&as_sdt=2005&sciodt=0,5&hl=en",244,"2025-05-05 22:12:12","HTML","","","",,,,,64,32.00,11,6,2,"… activation free energy using a symmetry factor of 0.5. In order to model the electrode/electrolyte interface, grand-canonical DFT … To convert the DFT energies into free energies we added …","https://www.nature.com/articles/s41467-023-36322-5","https://scholar.google.com/scholar?q=related:tMmIJNGhC4sJ:scholar.google.com/&scioq=source:nature+ch+activation+dft&hl=en&as_sdt=0,5&as_vis=1"
104,"G He, G Lu, Z Guo, P Liu, G Chen","Benzazetidine synthesis via palladium-catalysed intramolecular C− H amination",2016,"Nature Chemistry","nature.com","https://idp.nature.com/authorize/casa?redirect_uri=https://www.nature.com/articles/nchem.2585&casa_token=4onctv8x3AgAAAAA:i_OphuTY4QVWCq0cTZueAcW6ZTLX7cyaoWx3mUn1Z6FgleP_cV5W29Ht1j2ZON8urK4ZBOHeE2E2F5Wa","https://scholar.google.com/scholar?cites=10541162647814564293&as_sdt=2005&sciodt=0,5&hl=en",245,"2025-05-05 22:12:12","HTML","","","",,,,,104,11.56,21,5,9,"… Our density functional theory (DFT) calculations show that … The relatively small activation-energy difference between the … In agreement with the experimental results, DFT …","https://idp.nature.com/authorize/casa?redirect_uri=https://www.nature.com/articles/nchem.2585&casa_token=4onctv8x3AgAAAAA:i_OphuTY4QVWCq0cTZueAcW6ZTLX7cyaoWx3mUn1Z6FgleP_cV5W29Ht1j2ZON8urK4ZBOHeE2E2F5Wa","https://scholar.google.com/scholar?q=related:xWmaJpS7SZIJ:scholar.google.com/&scioq=source:nature+ch+activation+dft&hl=en&as_sdt=0,5&as_vis=1"
12,"Q Tang, B Wu, X Huang, W Ren, L Liu, L Tian…","Electron transfer mediated activation of periodate by contaminants to generate 1O2 by charge-confined single-atom catalyst",2024,"Nature …","nature.com","https://www.nature.com/articles/s41467-024-53941-8","https://scholar.google.com/scholar?cites=4516293172126289695&as_sdt=2005&sciodt=0,5&hl=en",246,"2025-05-05 22:12:12","HTML","","","",,,,,12,12.00,2,7,1,"… Furthermore, it does confirm that 1 O 2 is derived from the activation of PI by electrons … than the activation of PI by the Fe/SCN itself. DFT calculations verify that the charge channel of the …","https://www.nature.com/articles/s41467-024-53941-8","https://scholar.google.com/scholar?q=related:Hw8cMrYYrT4J:scholar.google.com/&scioq=source:nature+ch+activation+dft&hl=en&as_sdt=0,5&as_vis=1"
98,"F Maresca, D Dragoni, G Csányi, N Marzari…","Screw dislocation structure and mobility in body centered cubic Fe predicted by a Gaussian Approximation Potential",2018,"npj Computational …","nature.com","https://www.nature.com/articles/s41524-018-0125-4","https://scholar.google.com/scholar?cites=7903619409429295788&as_sdt=2005&sciodt=0,5&hl=en",247,"2025-05-05 22:12:12","HTML","","","",,,,,98,14.00,20,5,7,"… The thermally activated motion at finite temperatures occurs by … ~2 GPa consistent with DFT predictions of the Peierls potential. … sizes well beyond the capabilities of DFT (up to ~50,000 …","https://www.nature.com/articles/s41524-018-0125-4","https://scholar.google.com/scholar?q=related:rHLqSvpLr20J:scholar.google.com/&scioq=source:nature+ch+activation+dft&hl=en&as_sdt=0,5&as_vis=1"
231,"Z Li, L Yu, C Milligan, T Ma, L Zhou, Y Cui, Z Qi…","Two-dimensional transition metal carbides as supports for tuning the chemistry of catalytic nanoparticles",2018,"Nature …","nature.com","https://www.nature.com/articles/s41467-018-07502-5","https://scholar.google.com/scholar?cites=3685458290006865799&as_sdt=2005&sciodt=0,5&hl=en",248,"2025-05-05 22:12:12","HTML","","","",,,,,231,33.00,29,8,7,"… highly selective toward C–H activation. Such exploitation of … , we carried out density functional theory (DFT) calculations of … A recent study combining DFT calculations and an emerging …","https://www.nature.com/articles/s41467-018-07502-5","https://scholar.google.com/scholar?q=related:h7dg0slgJTMJ:scholar.google.com/&scioq=source:nature+ch+activation+dft&hl=en&as_sdt=0,5&as_vis=1"
45,"Y Yao, T Shi, W Chen, J Wu, Y Fan, Y Liu, L Cao…","A surface strategy boosting the ethylene selectivity for CO2 reduction and in situ mechanistic insights",2024,"Nature …","nature.com","https://www.nature.com/articles/s41467-024-45704-2","https://scholar.google.com/scholar?cites=14462896664484531385&as_sdt=2005&sciodt=0,5&hl=en",249,"2025-05-05 22:12:12","HTML","","","",,,,,45,45.00,6,8,1,"… Density functional theory calculations of activation energy barriers of the asymmetrical C–C … via DFT calculations combined with literature research. Based on DFT calculations of the …","https://www.nature.com/articles/s41467-024-45704-2","https://scholar.google.com/scholar?q=related:uUzIfeOHtsgJ:scholar.google.com/&scioq=source:nature+ch+activation+dft&hl=en&as_sdt=0,5&as_vis=1"
13,"X Liu, B Zhu, X Zhang, H Zhu, J Zhang, A Chu…","Enantioselective synthesis of [4] helicenes by organocatalyzed intermolecular CH amination",2024,"Nature …","nature.com","https://www.nature.com/articles/s41467-024-45049-w","https://scholar.google.com/scholar?cites=8349404969903845867&as_sdt=2005&sciodt=0,5&hl=en",250,"2025-05-05 22:12:12","HTML","","","",,,,,13,13.00,2,7,1,"… Moreover, DFT calculations reveal that both the hydrogen bonds and the CH---π … of polycyclic phenols and Rh-catalyzed enantioselective CH activation/annulation process of 1-aryl …","https://www.nature.com/articles/s41467-024-45049-w","https://scholar.google.com/scholar?q=related:6_H_RJUL33MJ:scholar.google.com/&scioq=source:nature+ch+activation+dft&hl=en&as_sdt=0,5&as_vis=1"
64,"J Mao, H Liu, X Cui, Y Zhang, X Meng, Y Zheng…","Direct conversion of methane with O2 at room temperature over edge-rich MoS2",2023,"Nature Catalysis","nature.com","https://idp.nature.com/authorize/casa?redirect_uri=https://www.nature.com/articles/s41929-023-01030-2&casa_token=hsJ-qxovN5YAAAAA:SYBFj5VxoZj9GcU-v0LhC8hlZkmoe4h17X7oHvppPtPEmaMbdPIkNRdybnfcLftHoVcBxs8a2IENHCYx","https://scholar.google.com/scholar?cites=14335105656822327281&as_sdt=2005&sciodt=0,5&hl=en",251,"2025-05-05 22:12:12","HTML","","","",,,,,64,32.00,9,7,2,"… Due to the extreme inertness of CH 4 , strong oxidants are mostly used for CH 4 activation … CH 4 conversion by O 2 over the MoS 2 catalyst, we conducted density functional theory (DFT) …","https://idp.nature.com/authorize/casa?redirect_uri=https://www.nature.com/articles/s41929-023-01030-2&casa_token=hsJ-qxovN5YAAAAA:SYBFj5VxoZj9GcU-v0LhC8hlZkmoe4h17X7oHvppPtPEmaMbdPIkNRdybnfcLftHoVcBxs8a2IENHCYx","https://scholar.google.com/scholar?q=related:8WeW7KSG8MYJ:scholar.google.com/&scioq=source:nature+ch+activation+dft&hl=en&as_sdt=0,5&as_vis=1"
34,"HM Huang, P Bellotti, PP Chen, KN Houk, F Glorius","Allylic C(sp3)–H arylation of olefins via ternary catalysis",2022,"Nature Synthesis","nature.com","https://idp.nature.com/authorize/casa?redirect_uri=https://www.nature.com/articles/s44160-021-00006-z&casa_token=oEgo476tERAAAAAA:AKbleKphqAXMtcMWIt3teV95zsYP0JnuJO13xtUDOWc7tIp2YgXx5UXmTQGhWHNoduY4i8C4wtLYHQ-x","https://scholar.google.com/scholar?cites=9567201145315832093&as_sdt=2005&sciodt=0,5&hl=en",252,"2025-05-05 22:12:12","HTML","","","",,,,,34,11.33,7,5,3,"… -catalysed direct allylic arylation of olefins via C–H activation; Grignard reagents were required, … Based on DFT calculations, we found that in the most favourable reaction pathway, the …","https://idp.nature.com/authorize/casa?redirect_uri=https://www.nature.com/articles/s44160-021-00006-z&casa_token=oEgo476tERAAAAAA:AKbleKphqAXMtcMWIt3teV95zsYP0JnuJO13xtUDOWc7tIp2YgXx5UXmTQGhWHNoduY4i8C4wtLYHQ-x","https://scholar.google.com/scholar?q=related:HbFCocCGxYQJ:scholar.google.com/&scioq=source:nature+ch+activation+dft&hl=en&as_sdt=0,5&as_vis=1"
38,"O Zabihi, M Ahmadi, T Abdollahi, S Nikafshar…","Collision-induced activation: Towards industrially scalable approach to graphite nanoplatelets functionalization for superior polymer nanocomposites",2017,"Scientific Reports","nature.com","https://www.nature.com/articles/s41598-017-03890-8","https://scholar.google.com/scholar?cites=1204485989282855693&as_sdt=2005&sciodt=0,5&hl=en",253,"2025-05-05 22:12:12","HTML","","","",,,,,38,4.75,8,5,8,"… , called “graphite collision-induced activation”. The mechanical impact was modelled by applying the point charge method using density functional theory (DFT). The functionalization of …","https://www.nature.com/articles/s41598-017-03890-8","https://scholar.google.com/scholar?q=related:DbsjKKAxtxAJ:scholar.google.com/&scioq=source:nature+ch+activation+dft&hl=en&as_sdt=0,5&as_vis=1"
427,"T Ling, DY Yan, H Wang, Y Jiao, Z Hu, Y Zheng…","Activating cobalt (II) oxide nanorods for efficient electrocatalysis by strain engineering",2017,"Nature …","nature.com","https://www.nature.com/articles/s41467-017-01872-y","https://scholar.google.com/scholar?cites=16509711071816682336&as_sdt=2005&sciodt=0,5&hl=en",254,"2025-05-05 22:12:12","HTML","","","",,,,,427,53.38,61,7,8,"… decreases the activation energy for the ion exchange process. Our DFT calculations indeed … As predicted by the DFT calculations, such large quantity of O-vacancies on the strained …","https://www.nature.com/articles/s41467-017-01872-y","https://scholar.google.com/scholar?q=related:YIv3Y79GHuUJ:scholar.google.com/&scioq=source:nature+ch+activation+dft&hl=en&as_sdt=0,5&as_vis=1"
