Cites,Authors,Title,Year,Source,Publisher,ArticleURL,CitesURL,GSRank,QueryDate,Type,DOI,ISSN,CitationURL,Volume,Issue,StartPage,EndPage,ECC,CitesPerYear,CitesPerAuthor,AuthorCount,Age,Abstract,FullTextURL,RelatedURL
0,"D Huang¹, Q Wei, W Huang…","Synchronous Identification of Loads and Mutual Inductances for Multi-frequencies Multi-loads",2023,"The Proceedings of 2022 …","books.google.com","https://books.google.com/books?hl=en&lr=&id=p1S1EAAAQBAJ&oi=fnd&pg=PA229&dq=source:nature+cross+coupling+dft&ots=kUGXpFTyXL&sig=ICBqGqVY1RF455mmNuslFGk27fM","",982,"2025-05-05 22:10:47","","","","",,,,,0,0.00,0,4,2,"… Since in and if need to be detected respectively when identifying different mutual inductance parameters, the sliding window DFT is adopted in this paper [8] to detect two current signals…","","https://scholar.google.com/scholar?q=related:dps0hdURpnYJ:scholar.google.com/&scioq=source:nature+cross+coupling+dft&hl=en&as_sdt=0,5&as_vis=1"
0,"M Raitza, J Trommer, T Mikolajick…","END-TRUE: Emerging Nanotechnology-Based Double-Throughput True Random Number Generator",2022,"VLSI-SoC: Technology …","books.google.com","https://books.google.com/books?hl=en&lr=&id=_9CPEAAAQBAJ&oi=fnd&pg=PA175&dq=source:nature+cross+coupling+dft&ots=68B970ksRR&sig=iEF9Cs3NQQYdZCApg0UaHBRZCu0","",997,"2025-05-05 22:10:47","","","","",,,,,0,0.00,0,4,3,"… (in this case, Block frequency , DFT , Overlap template matching and Cumulative sum-2 … The transistor-level ambipolarity in RFETs allows us to duplicate crosscoupled SR latches …","","https://scholar.google.com/scholar?q=related:e1paoacunJcJ:scholar.google.com/&scioq=source:nature+cross+coupling+dft&hl=en&as_sdt=0,5&as_vis=1"
144,"X Hai, Y Zheng, Q Yu, N Guo, S Xi, X Zhao, S Mitchell…","Geminal-atom catalysis for cross-coupling",2023,"Nature","nature.com","https://www.nature.com/articles/s41586-023-06529-z","https://scholar.google.com/scholar?cites=15975191867933158662&as_sdt=2005&sciodt=0,5&hl=en",1,"2025-05-05 22:10:47","","","","",,,,,144,72.00,18,8,2,"… To confirm the atomic structure of the Cu sites, first-principles calculations based on density functional theory (DFT) were conducted to identify possible models and simulate their …","https://drive.google.com/file/d/1YwQ5LFPiYKuXl9iZ2y601mi-BJjDobBo/view","https://scholar.google.com/scholar?q=related:Bm3dGl1Is90J:scholar.google.com/&scioq=source:nature+cross+coupling+dft&hl=en&as_sdt=0,5&as_vis=1"
84,"I Ghosh, N Shlapakov, TA Karl, J Düker, M Nikitin…","General cross-coupling reactions with adaptive dynamic homogeneous catalysis",2023,"Nature","nature.com","https://www.nature.com/articles/s41586-023-06087-4","https://scholar.google.com/scholar?cites=5620345842635784562&as_sdt=2005&sciodt=0,5&hl=en",2,"2025-05-05 22:10:47","","","","",,,,,84,42.00,14,6,2,"… The desired C(sp 2 )–S cross-coupling product 9 was obtained in an excellent 92% isolated … norm in reported traditional cross-coupling reactions as the coupling reaction is devoid of …","","https://scholar.google.com/scholar?q=related:ckEmGcR6_00J:scholar.google.com/&scioq=source:nature+cross+coupling+dft&hl=en&as_sdt=0,5&as_vis=1"
88,"L Guo, W Srimontree, C Zhu, B Maity, X Liu…","Nickel-catalyzed Suzuki–Miyaura cross-couplings of aldehydes",2019,"Nature …","nature.com","https://www.nature.com/articles/s41467-019-09766-x","https://scholar.google.com/scholar?cites=15790157343151792161&as_sdt=2005&sciodt=0,5&hl=en",3,"2025-05-05 22:10:47","HTML","","","",,,,,88,14.67,15,6,6,"… Nickel-catalyzed deformylative Suzuki–Miyaura cross coupling and related DFT studies on … (left) and nickel-catalyzed deformylative cross coupling for the synthesis of biaryls (right). b …","https://www.nature.com/articles/s41467-019-09766-x","https://scholar.google.com/scholar?q=related:IaAWmnHoIdsJ:scholar.google.com/&scioq=source:nature+cross+coupling+dft&hl=en&as_sdt=0,5&as_vis=1"
0,"J Sun, J He, L Massaro, DA Cagan, J Tsien, Y Wang…","Stereoretentive radical cross-coupling",2025,"Nature","nature.com","https://www.nature.com/articles/s41586-025-09011-0","",4,"2025-05-05 22:10:47","","","","",,,,,0,0.00,0,7,1,"… mechanistic hypothesis for the sterorentive cross-coupling reaction was studied by dispersion 189 corrected denisty functional theory (DFT) quantum chemical calculations performed in …","https://chemrxiv.org/engage/api-gateway/chemrxiv/assets/orp/resource/item/67d20d1d6dde43c908972358/original/stereoretentive-radical-cross-coupling.pdf","https://scholar.google.com/scholar?q=related:id0A--zDp1sJ:scholar.google.com/&scioq=source:nature+cross+coupling+dft&hl=en&as_sdt=0,5&as_vis=1"
13,"J Zhu, R Zhang, G Dong","Orthogonal cross-coupling through intermolecular metathesis of unstrained C (aryl)–C (aryl) single bonds",2021,"Nature Chemistry","nature.com","https://www.nature.com/articles/s41557-021-00757-4","https://scholar.google.com/scholar?cites=15424019726061282453&as_sdt=2005&sciodt=0,5&hl=en",5,"2025-05-05 22:10:47","","","","",,,,,13,3.25,4,3,4,"… insights on further optimization, density functional theory (DFT) calculations were conducted. … This was further supported by DFT calculations on the meta tert-butyl-substituted substrate …","","https://scholar.google.com/scholar?q=related:lSSAjDggDdYJ:scholar.google.com/&scioq=source:nature+cross+coupling+dft&hl=en&as_sdt=0,5&as_vis=1"
0,"J Großkopf, C Gopatta, RT Martin, A Haseloer…","Generalizing arene C–H alkylations by radical–radical cross-coupling",2025,"Nature","nature.com","https://www.nature.com/articles/s41586-025-08887-2","",6,"2025-05-05 22:10:47","","","","",,,,,0,0.00,0,5,1,"… to a statistical amount of cross-coupled product and predominantly … Density functional theory calculations support the existence … The high cross-coupling selectivity arises from the low …","","https://scholar.google.com/scholar?q=related:v3jkaGePEOYJ:scholar.google.com/&scioq=source:nature+cross+coupling+dft&hl=en&as_sdt=0,5&as_vis=1"
54,"T Niwa, Y Uetake, M Isoda, T Takimoto, M Nakaoka…","Lewis acid-mediated Suzuki–Miyaura cross-coupling reaction",2021,"Nature Catalysis","nature.com","https://www.nature.com/articles/s41929-021-00719-6","https://scholar.google.com/scholar?cites=6010333318033573893&as_sdt=2005&sciodt=0,5&hl=en",7,"2025-05-05 22:10:47","HTML","","","",,,,,54,13.50,9,6,4,"… We performed DFT calculations for each step of the zinc-mediated SMC reaction to elucidate the reaction mechanism using 4-fluorobromobenzene (1) and potassium phenyl(trifluoro)…","https://www.nature.com/articles/s41929-021-00719-6","https://scholar.google.com/scholar?q=related:BQgWA0_-aFMJ:scholar.google.com/&scioq=source:nature+cross+coupling+dft&hl=en&as_sdt=0,5&as_vis=1"
24,"ZC Wang, X Luo, JW Zhang, CF Liu, MJ Koh, SL Shi","Enantioselective C–C cross-coupling of unactivated alkenes",2023,"Nature Catalysis","nature.com","https://www.nature.com/articles/s41929-023-01037-9","https://scholar.google.com/scholar?cites=8426469020269109003&as_sdt=2005&sciodt=0,5&hl=en",8,"2025-05-05 22:10:47","","","","",,,,,24,12.00,4,6,2,"… However, enantioselective cross-coupling of unactivated … three-component cross-coupling of unactivated alkenes with aryl … of other challenging enantioselective alkene cross-couplings. …","","https://scholar.google.com/scholar?q=related:C1_5t-3U8HQJ:scholar.google.com/&scioq=source:nature+cross+coupling+dft&hl=en&as_sdt=0,5&as_vis=1"
73,"TN Ye, Y Lu, Z Xiao, J Li, T Nakao, H Abe…","Palladium-bearing intermetallic electride as an efficient and stable catalyst for Suzuki cross-coupling reactions",2019,"Nature …","nature.com","https://www.nature.com/articles/s41467-019-13679-0","https://scholar.google.com/scholar?cites=7323275171881582356&as_sdt=2005&sciodt=0,5&hl=en",9,"2025-05-05 22:10:47","HTML","","","",,,,,73,12.17,10,7,6,"… Motivated by the presence of interstitial sites, we conducted DFT calculations to clarify the … The DFT calculation also showed the electron transfer from yttrium to palladium, pushing …","https://www.nature.com/articles/s41467-019-13679-0","https://scholar.google.com/scholar?q=related:FH9w7Pd_oWUJ:scholar.google.com/&scioq=source:nature+cross+coupling+dft&hl=en&as_sdt=0,5&as_vis=1"
40,"P Li, Z Zhu, C Guo, G Kou, S Wang, P Xie, D Ma…","Nickel-electrocatalysed C(sp3)–C(sp3) cross-coupling of unactivated alkyl halides",2024,"Nature Catalysis","nature.com","https://www.nature.com/articles/s41929-024-01118-3","https://scholar.google.com/scholar?cites=17009823086149023009&as_sdt=2005&sciodt=0,5&hl=en",10,"2025-05-05 22:10:47","","","","",,,,,40,40.00,5,8,1,"… In parallel to these experiments, based on density functional theory (DFT), computational … Moreover, based on DFT calculations concerning the various oxidation states of the nickel …","","https://scholar.google.com/scholar?q=related:IbUmlvkHD-wJ:scholar.google.com/&scioq=source:nature+cross+coupling+dft&hl=en&as_sdt=0,5&as_vis=1"
22,"X Zhao, X Zhu, K Wang, J Lv, S Chen, G Yao…","Palladium catalyzed radical relay for the oxidative cross-coupling of quinolines",2022,"Nature …","nature.com","https://www.nature.com/articles/s41467-022-31967-0","https://scholar.google.com/scholar?cites=5371557826554854346&as_sdt=2005&sciodt=0,5&hl=en",11,"2025-05-05 22:10:47","HTML","","","",,,,,22,7.33,3,7,3,"… The catalyst surface was first constructed by density functional theory (DFT) calculations. Charge … DFT calculations show that methanol adsorbs on an electron-deficient Pd(111) surface. …","https://www.nature.com/articles/s41467-022-31967-0","https://scholar.google.com/scholar?q=related:yntFLmKbi0oJ:scholar.google.com/&scioq=source:nature+cross+coupling+dft&hl=en&as_sdt=0,5&as_vis=1"
6,"C Yu, Z Zhang, G Dong","Split cross-coupling via Rh-catalysed activation of unstrained aryl–aryl bonds",2024,"Nature Catalysis","nature.com","https://www.nature.com/articles/s41929-024-01120-9","https://scholar.google.com/scholar?cites=18244886755576149180&as_sdt=2005&sciodt=0,5&hl=en",12,"2025-05-05 22:10:47","","","","",,,,,6,6.00,2,3,1,"… To further understand the catalytic cycle, the density functional theory (DFT) calculation was … I) is difficult to be precisely calculated (in this DFT study, we assumed both TDAE and TDAT-I …","https://pmc.ncbi.nlm.nih.gov/articles/PMC11567681/","https://scholar.google.com/scholar?q=related:vHRYsdbbMv0J:scholar.google.com/&scioq=source:nature+cross+coupling+dft&hl=en&as_sdt=0,5&as_vis=1"
44,"R Kancherla, K Muralirajan, B Maity…","Mechanistic insights into photochemical nickel-catalyzed cross-couplings enabled by energy transfer",2022,"Nature …","nature.com","https://www.nature.com/articles/s41467-022-30278-8","https://scholar.google.com/scholar?cites=2694545342123805919&as_sdt=2005&sciodt=0,5&hl=en",13,"2025-05-05 22:10:47","HTML","","","",,,,,44,14.67,11,4,3,"… DFT and TD-DFT calculations point to a mechanism involving a Dexter triplet-triplet EnT from the *Ir(III) photosensitizer to the organometallic Ni(II) catalyst. The formation of the Ni(II) …","https://www.nature.com/articles/s41467-022-30278-8","https://scholar.google.com/scholar?q=related:3wx5XLbyZCUJ:scholar.google.com/&scioq=source:nature+cross+coupling+dft&hl=en&as_sdt=0,5&as_vis=1"
96,"FL Wang, CJ Yang, JR Liu, NY Yang, XY Dong…","Mechanism-based ligand design for copper-catalysed enantioconvergent C(sp3)–C(sp) cross-coupling of tertiary electrophiles with alkynes",2022,"Nature Chemistry","nature.com","https://www.nature.com/articles/s41557-022-00954-9","https://scholar.google.com/scholar?cites=6653521983218297191&as_sdt=2005&sciodt=0,5&hl=en",14,"2025-05-05 22:10:47","","","","",,,,,96,32.00,16,6,3,"… We next performed DFT calculations to understand the reaction mechanism and the origins of enantioselectivity. The DFT-computed free energy changes of the operative catalytic cycle …","https://liuxy.chem.sustech.edu.cn/wp-content/uploads/2022/05/s41557-022-00954-9.pdf","https://scholar.google.com/scholar?q=related:Z6n66v0OVlwJ:scholar.google.com/&scioq=source:nature+cross+coupling+dft&hl=en&as_sdt=0,5&as_vis=1"
460,"CP Johnston, RT Smith, S Allmendinger…","Metallaphotoredox-catalysed sp3–sp3 cross-coupling of carboxylic acids with alkyl halides",2016,"Nature","nature.com","https://www.nature.com/articles/nature19056","https://scholar.google.com/scholar?cites=9449827903119384486&as_sdt=2005&sciodt=0,5&hl=en",15,"2025-05-05 22:10:47","","","","",,,,,460,51.11,115,4,9,"… In the past 50 years, cross-coupling reactions mediated by … yet elusive objective for engineering cross-coupling reactions 2 . In … To address this issue, nickel-catalysed cross-coupling …","https://pmc.ncbi.nlm.nih.gov/articles/PMC5695702/pdf/nihms862288.pdf","https://scholar.google.com/scholar?q=related:pl8BGmmIJIMJ:scholar.google.com/&scioq=source:nature+cross+coupling+dft&hl=en&as_sdt=0,5&as_vis=1"
282,"K Muto, J Yamaguchi, DG Musaev, K Itami","Decarbonylative organoboron cross-coupling of esters by nickel catalysis",2015,"Nature communications","nature.com","https://www.nature.com/articles/ncomms8508","https://scholar.google.com/scholar?cites=7481940186914695721&as_sdt=2005&sciodt=0,5&hl=en",16,"2025-05-05 22:10:47","HTML","","","",,,,,282,28.20,71,4,10,"… Suzuki–Miyaura coupling, we devised a decarbonylative cross-coupling manifold employing … Subsequent reductive elimination releases the decarbonylative cross-coupling product and …","https://www.nature.com/articles/ncomms8508","https://scholar.google.com/scholar?q=related:KSrFf_Uw1WcJ:scholar.google.com/&scioq=source:nature+cross+coupling+dft&hl=en&as_sdt=0,5&as_vis=1"
33,"YF Cheng, ZL Yu, Y Tian, JR Liu, HT Wen, NC Jiang…","Cu-catalysed enantioselective radical heteroatomic S–O cross-coupling",2023,"Nature Chemistry","nature.com","https://www.nature.com/articles/s41557-022-01102-z","https://scholar.google.com/scholar?cites=12529025300251464113&as_sdt=2005&sciodt=0,5&hl=en",17,"2025-05-05 22:10:47","","","","",,,,,33,16.50,5,7,2,"… We next explored the reaction mechanism and origins of enantioselectivity with density functional theory (DFT) calculations, using diol A-1 and sulfonyl chloride S-1 as model substrates …","https://liuxy.chem.sustech.edu.cn/wp-content/uploads/2023/03/s41557-022-01102-z-1.pdf","https://scholar.google.com/scholar?q=related:sdFeAyEK4K0J:scholar.google.com/&scioq=source:nature+cross+coupling+dft&hl=en&as_sdt=0,5&as_vis=1"
225,"W Zhang, L Lu, W Zhang, Y Wang, SD Ware…","Electrochemically driven cross-electrophile coupling of alkyl halides",2022,"Nature","nature.com","https://www.nature.com/articles/s41586-022-04540-4","https://scholar.google.com/scholar?cites=90701407885383121&as_sdt=2005&sciodt=0,5&hl=en",18,"2025-05-05 22:10:47","","","","",,,,,225,75.00,38,6,3,"… guided by cyclic voltammetry and density functional theory computation. The desired reaction … Cyclic voltammetry and density functional theory data suggested that a variety of functional …","https://pmc.ncbi.nlm.nih.gov/articles/PMC9016776/pdf/nihms-1793323.pdf","https://scholar.google.com/scholar?q=related:0dWiLXM8QgEJ:scholar.google.com/&scioq=source:nature+cross+coupling+dft&hl=en&as_sdt=0,5&as_vis=1"
1,"Y Cho, YH Chang, KP Quirion, ZH Strong, ZJ Dubey…","Aryl halide cross-coupling via formate-mediated transfer hydrogenation",2025,"Nature Chemistry","nature.com","https://www.nature.com/articles/s41557-024-01729-0","https://scholar.google.com/scholar?cites=4793271825181959962&as_sdt=2005&sciodt=0,5&hl=en",19,"2025-05-05 22:10:47","","","","",,,,,1,1.00,0,6,1,"… At this stage, DFT calculations were used to discriminate … This result is consistent with previous DFT calculations by … Our DFT calculations indicate that the dimeric oxidative …","","https://scholar.google.com/scholar?q=related:GufbQ1QfhUIJ:scholar.google.com/&scioq=source:nature+cross+coupling+dft&hl=en&as_sdt=0,5&as_vis=1"
106,"DY Wang, M Kawahata, ZK Yang, K Miyamoto…","Stille coupling via C–N bond cleavage",2016,"Nature …","nature.com","https://www.nature.com/articles/ncomms12937","https://scholar.google.com/scholar?cites=2582165203897141881&as_sdt=2005&sciodt=0,5&hl=en",20,"2025-05-05 22:10:47","HTML","","","",,,,,106,11.78,21,5,9,"… DFT calculations Next, we employed density functional theory (DFT) calculations at the B3LYP (refs 49, 50, 51)/M06 (ref. 52) level, together with the artificial force-induced reaction …","https://www.nature.com/articles/ncomms12937","https://scholar.google.com/scholar?q=related:ecqpcZKx1SMJ:scholar.google.com/&scioq=source:nature+cross+coupling+dft&hl=en&as_sdt=0,5&as_vis=1"
1,"J Shi, G Wang, D Tian, X Hai, R Meng, Y Xu…","Defying the oxidative-addition prerequisite in cross-coupling through artful single-atom catalysts",2025,"Nature …","nature.com","https://www.nature.com/articles/s41467-025-58579-8","https://scholar.google.com/scholar?cites=1318973817508587397&as_sdt=2005&sciodt=0,5&hl=en",21,"2025-05-05 22:10:47","HTML","","","",,,,,1,1.00,0,7,1,"… ASAC achieved a TON up to 45,327,037 in cross coupling reactions, defined as the mole of … We first conducted Density Functional Theory (DFT) calculations to gain theoretical insights …","https://www.nature.com/articles/s41467-025-58579-8","https://scholar.google.com/scholar?q=related:heej5LLvTRIJ:scholar.google.com/&scioq=source:nature+cross+coupling+dft&hl=en&as_sdt=0,5&as_vis=1"
113,"H Wang, H Jung, F Song, S Zhu, Z Bai, D Chen…","Nitrene-mediated intermolecular N–N coupling for efficient synthesis of hydrazides",2021,"Nature Chemistry","nature.com","https://www.nature.com/articles/s41557-021-00650-0","https://scholar.google.com/scholar?cites=3174081391186298551&as_sdt=2005&sciodt=0,5&hl=en",22,"2025-05-05 22:10:47","","","","",,,,,113,28.25,16,7,4,"… The mechanism of this N–N coupling reaction under the Ir-catalysed conditions was probed by both control experiments and density functional theory (DFT) calculations. As shown in Fig…","https://drive.google.com/file/d/1OxjHqWJQYfN6thRN7lrGx5QtPIDiTX5I/view","https://scholar.google.com/scholar?q=related:t0bWUTWaDCwJ:scholar.google.com/&scioq=source:nature+cross+coupling+dft&hl=en&as_sdt=0,5&as_vis=1"
152,"T Thaler, B Haag, A Gavryushin, K Schober…","Highly diastereoselective Csp3–Csp2 Negishi cross-coupling with 1,2-, 1,3- and 1,4-substituted cycloalkylzinc compounds",2010,"Nature Chemistry","nature.com","https://www.nature.com/articles/nchem.505.pdf","https://scholar.google.com/scholar?cites=12256872339880175648&as_sdt=2005&sciodt=0,5&hl=en",23,"2025-05-05 22:10:47","","","","",,,,,152,10.13,30,5,15,"… 17a (5 equiv.) also led to the cross-coupling product 18a with … (as shown by density functional theory (DFT) calculations, … to verify our mechanistic proposal, we used DFT to carry out a …","","https://scholar.google.com/scholar?q=related:IGjeE3QoGaoJ:scholar.google.com/&scioq=source:nature+cross+coupling+dft&hl=en&as_sdt=0,5&as_vis=1"
26,"G Li, Y Nieves-Quinones, H Zhang, Q Liang…","Transition-metal-free formal cross-coupling of aryl methyl sulfoxides and alcohols via nucleophilic activation of CS bond",2020,"Nature …","nature.com","https://www.nature.com/articles/s41467-020-16713-8","https://scholar.google.com/scholar?cites=10644761077060622203&as_sdt=2005&sciodt=0,5&hl=en",24,"2025-05-05 22:10:47","HTML","","","",,,,,26,5.20,5,5,5,"… A DFT computational study suggests that the reaction proceeds via initial addition of the … use with many other electrophiles and nucleophiles leading to new cross-coupling processes. …","https://www.nature.com/articles/s41467-020-16713-8","https://scholar.google.com/scholar?q=related:e1caHc3JuZMJ:scholar.google.com/&scioq=source:nature+cross+coupling+dft&hl=en&as_sdt=0,5&as_vis=1"
111,"Y Li, Y Luo, L Peng, Y Li, B Zhao, W Wang…","Reaction scope and mechanistic insights of nickel-catalyzed migratory Suzuki–Miyaura cross-coupling",2020,"Nature …","nature.com","https://www.nature.com/articles/s41467-019-14016-1","https://scholar.google.com/scholar?cites=3387051906154052673&as_sdt=2005&sciodt=0,5&hl=en",25,"2025-05-05 22:10:47","HTML","","","",,,,,111,22.20,16,7,5,"Cross-coupling reactions have developed into powerful approaches for carbon–carbon bond formation. In this work, a Ni-catalyzed migratory Suzuki–Miyaura cross-coupling featuring …","https://www.nature.com/articles/s41467-019-14016-1","https://scholar.google.com/scholar?q=related:QTwfZsM5AS8J:scholar.google.com/&scioq=source:nature+cross+coupling+dft&hl=en&as_sdt=0,5&as_vis=1"
83,"S Asako, H Nakajima, K Takai","Organosodium compounds for catalytic cross-coupling",2019,"Nature Catalysis","nature.com","https://www.nature.com/articles/s41929-019-0250-6","https://scholar.google.com/scholar?cites=12094781897936829962&as_sdt=2005&sciodt=0,5&hl=en",26,"2025-05-05 22:10:47","","","","",,,,,83,13.83,28,3,6,"… for the palladium-catalysed Negishi cross-coupling reactions after transmetallation to the … , which was coupled with a second aryl chloride under the cross-coupling conditions developed …","","https://scholar.google.com/scholar?q=related:Cn5ZJg5M2acJ:scholar.google.com/&scioq=source:nature+cross+coupling+dft&hl=en&as_sdt=0,5&as_vis=1"
47,"AM Messinis, SLJ Luckham, PP Wells, D Gianolio…","The highly surprising behaviour of diphosphine ligands in iron-catalysed Negishi cross-coupling",2019,"Nature Catalysis","nature.com","https://www.nature.com/articles/s41929-018-0197-z","https://scholar.google.com/scholar?cites=7644966703384650470&as_sdt=2005&sciodt=0,5&hl=en",27,"2025-05-05 22:10:47","","","","",,,,,47,7.83,9,5,6,"Iron-catalysed cross-coupling is undergoing explosive development, but mechanistic understanding lags far behind synthetic methodology. Here, we find that the activity of iron–…","https://research-information.bris.ac.uk/files/181545400/accepted_version.pdf","https://scholar.google.com/scholar?q=related:5mLuQrZgGGoJ:scholar.google.com/&scioq=source:nature+cross+coupling+dft&hl=en&as_sdt=0,5&as_vis=1"
24,"Z Zhang, J Zhang, Q Gao, Y Zhou, M Yang…","Enantioselective alkylative cross-coupling of unactivated aromatic C–O electrophiles",2022,"Nature …","nature.com","https://www.nature.com/articles/s41467-022-30693-x","https://scholar.google.com/scholar?cites=9192378309223140219&as_sdt=2005&sciodt=0,5&hl=en",28,"2025-05-05 22:10:47","HTML","","","",,,,,24,8.00,4,6,3,"… is in accordance with the stereochemical outcome of the enantioselective alkylative cross-coupling. For comparison, DFT calculations on the catalytic cycle via mono-ligated pathway …","https://www.nature.com/articles/s41467-022-30693-x","https://scholar.google.com/scholar?q=related:e0tAcl7jkX8J:scholar.google.com/&scioq=source:nature+cross+coupling+dft&hl=en&as_sdt=0,5&as_vis=1"
5,"B Boekfa, T Maihom, M Ehara, J Limtrakul","Investigation of the Suzuki–Miyaura cross-coupling reaction on a palladium H-beta zeolite with DFT calculations",2024,"Scientific Reports","nature.com","https://www.nature.com/articles/s41598-023-51116-x","https://scholar.google.com/scholar?cites=15673454283049865174&as_sdt=2005&sciodt=0,5&hl=en",29,"2025-05-05 22:10:47","HTML","","","",,,,,5,5.00,1,4,1,"… this work, a coupling reaction between bromobenzene and phenylboronic acid to yield biphenyl with the Pd–H-Beta zeolite catalyst was investigated with density functional theory (DFT) …","https://www.nature.com/articles/s41598-023-51116-x","https://scholar.google.com/scholar?q=related:1g-DAKFLg9kJ:scholar.google.com/&scioq=source:nature+cross+coupling+dft&hl=en&as_sdt=0,5&as_vis=1"
5,"X Luo, D Yang, X He, S Wang, D Zhang, J Xu…","Valve turning towards on-cycle in cobalt-catalyzed Negishi-type cross-coupling",2023,"Nature …","nature.com","https://www.nature.com/articles/s41467-023-40269-y","https://scholar.google.com/scholar?cites=7794582642384218206&as_sdt=2005&sciodt=0,5&hl=en",30,"2025-05-05 22:10:47","HTML","","","",,,,,5,2.50,1,7,2,"… a basic mechanistic perspective for designing cobalt-catalyzed cross-coupling reactions. … reliable evidence for the DFT calculation of the structural simulation. DFT calculations help us …","https://www.nature.com/articles/s41467-023-40269-y","https://scholar.google.com/scholar?q=related:Xqi8o53rK2wJ:scholar.google.com/&scioq=source:nature+cross+coupling+dft&hl=en&as_sdt=0,5&as_vis=1"
18,"J Zhou, Z Zhao, N Shibata","Transition-metal-free silylboronate-mediated cross-couplings of organic fluorides with amines",2023,"Nature Communications","nature.com","https://www.nature.com/articles/s41467-023-37466-0","https://scholar.google.com/scholar?cites=7525176355337312183&as_sdt=2005&sciodt=0,5&hl=en",31,"2025-05-05 22:10:47","HTML","","","",,,,,18,9.00,6,3,2,"… cross-couplings are fundamental in the field of organic chemistry. Herein, silylboronate-mediated selective defluorinative cross-coupling of … the room-temperature cross-coupling of C–F …","https://www.nature.com/articles/s41467-023-37466-0","https://scholar.google.com/scholar?q=related:t5cMbAbMbmgJ:scholar.google.com/&scioq=source:nature+cross+coupling+dft&hl=en&as_sdt=0,5&as_vis=1"
2,"R Feng, IY Zhang, X Xu","A cross-entropy corrected hybrid multiconfiguration pair-density functional theory for complex molecular systems",2025,"Nature Communications","nature.com","https://www.nature.com/articles/s41467-024-55524-z","https://scholar.google.com/scholar?cites=7409566591459046476&as_sdt=2005&sciodt=0,5&hl=en",32,"2025-05-05 22:10:47","HTML","","","",,,,,2,2.00,1,3,1,"… Here, we extend the linear scheme of hybrid multiconfiguration pair-density functional theory (HMC-PDFT) by incorporating a cross-entropy ingredient to balance the description of static …","https://www.nature.com/articles/s41467-024-55524-z","https://scholar.google.com/scholar?q=related:TLSEr44R1GYJ:scholar.google.com/&scioq=source:nature+cross+coupling+dft&hl=en&as_sdt=0,5&as_vis=1"
