Cites,Authors,Title,Year,Source,Publisher,ArticleURL,CitesURL,GSRank,QueryDate,Type,DOI,ISSN,CitationURL,Volume,Issue,StartPage,EndPage,ECC,CitesPerYear,CitesPerAuthor,AuthorCount,Age,Abstract,FullTextURL,RelatedURL
14,"AQ Kane, AM Esper, K Searles, C Ehm, ...","Probing β-alkyl elimination and selectivity in polyolefin hydrogenolysis through DFT",2021,"… Science & Technology","pubs.rsc.org","https://pubs.rsc.org/en/content/articlehtml/2021/cy/d1cy01088c","https://scholar.google.com/scholar?cites=2074777363726320294&as_sdt=2005&sciodt=0,5&hl=en",1,"2025-04-13 10:53:18","","","","",,,,,14,3.50,3,5,4,"… of β-alkyl elimination, a method of C–C cleavage, through DFT … Chain walking via β-H elimination and insertion occurs readily … elimination also favors formation of E-alkene elimination …","","https://scholar.google.com/scholar?q=related:psLtCAUXyxwJ:scholar.google.com/&scioq=source:%22catalysis+science%22+source:technology+beta+elimination+dft&hl=en&as_sdt=0,5&as_vis=1"
19,"R Fang, L Zhou, PC Tu, L Yang","Gold (I)-catalyzed cycloisomerization of ortho-(alkynyl) styrenes: DFT analysis of the crucial role of SbF 6− in the elimination of protons",2018,"Catalysis Science & Technology","pubs.rsc.org","https://pubs.rsc.org/en/content/articlehtml/2018/cy/c8cy00367j","https://scholar.google.com/scholar?cites=3441965624753006702&as_sdt=2005&sciodt=0,5&hl=en",2,"2025-04-13 10:53:18","","","","",,,,,19,2.71,5,4,7,"… In summary, DFT calculations are employed to examine the mechanistic and regiochemical aspects of the gold(I)-catalyzed cycloisomerization of α-substituted and β,β-disubstituted o-(…","","https://scholar.google.com/scholar?q=related:biiC2H9RxC8J:scholar.google.com/&scioq=source:%22catalysis+science%22+source:technology+beta+elimination+dft&hl=en&as_sdt=0,5&as_vis=1"
0,"B Mirabi, M Lautens, MH Baik","The rhodium riddle: computational insights into competitive β-hydride vs. β-fluoride elimination",2025,"Catalysis Science & Technology","pubs.rsc.org","https://pubs.rsc.org/en/content/articlehtml/2025/cy/d4cy01495b","",3,"2025-04-13 10:53:18","HTML","","","",,,,,0,0.00,0,3,1,"… over β-hydride elimination under rhodium(I) catalysis using density functional theory (DFT) … Our modelling indicates that the kinetic preference is to undergo β-hydride elimination, but …","https://pubs.rsc.org/en/content/articlehtml/2025/cy/d4cy01495b","https://scholar.google.com/scholar?q=related:tBnD_9mzjG4J:scholar.google.com/&scioq=source:%22catalysis+science%22+source:technology+beta+elimination+dft&hl=en&as_sdt=0,5&as_vis=1"
12,"SVC Vummaleti, N Kuriakose, S Dinda, Y Wu, ...","C–C coupling at a zeolite-supported Rh (i) complex. DFT search for the mechanism",2019,"… Science & Technology","pubs.rsc.org","https://pubs.rsc.org/en/content/articlehtml/2019/cy/c9cy00617f","https://scholar.google.com/scholar?cites=11035998526352907349&as_sdt=2005&sciodt=0,5&hl=en",4,"2025-04-13 10:53:18","","","","",,,,,12,2.00,2,5,6,"… Migratory insertion is responsible for growing the alkyl chain, and β-hydride elimination terminates the growth and releases the products (Scheme 1). C−C coupling by oxidative addition …","","https://scholar.google.com/scholar?q=related:Vdz_QDC-J5kJ:scholar.google.com/&scioq=source:%22catalysis+science%22+source:technology+beta+elimination+dft&hl=en&as_sdt=0,5&as_vis=1"
20,"H Ma, Y Chen, S Wang, Z Wei, Z Qin, M Dong, ...","Reaction mechanism for the conversion of methanol to olefins over H-ITQ-13 zeolite: a density functional theory study",2018,"… Science & Technology","pubs.rsc.org","https://pubs.rsc.org/en/content/articlehtml/2017/cy/c7cy02047c","https://scholar.google.com/scholar?cites=6890543843768179645&as_sdt=2005&sciodt=0,5&hl=en",5,"2025-04-13 10:53:18","","","","",,,,,20,2.86,3,7,7,"… for the chain propagation and olefin elimination in this work, for … and the ring contraction and elimination steps were strongly … as the main route for the elimination of side chains, which …","","https://scholar.google.com/scholar?q=related:vZsORR4hoF8J:scholar.google.com/&scioq=source:%22catalysis+science%22+source:technology+beta+elimination+dft&hl=en&as_sdt=0,5&as_vis=1"
36,"PN Plessow, F Studt","Olefin methylation and cracking reactions in H-SSZ-13 investigated with ab initio and DFT calculations",2018,"Catalysis Science & Technology","pubs.rsc.org","https://pubs.rsc.org/en/content/articlehtml/2018/cy/c8cy01194j","https://scholar.google.com/scholar?cites=15110983278690887509&as_sdt=2005&sciodt=0,5&hl=en",6,"2025-04-13 10:53:18","","","","",,,,,36,5.14,18,2,7,"… As in earlier studies, we use periodic density functional theory (DFT) calculations employing the … DFT energies are corrected using a hierarchical cluster approach with MP2/def2-TZVPP …","","https://scholar.google.com/scholar?q=related:Vec8BTv_tNEJ:scholar.google.com/&scioq=source:%22catalysis+science%22+source:technology+beta+elimination+dft&hl=en&as_sdt=0,5&as_vis=1"
16,"Z Wang, L Liu, X Ma, Y Liu, P Mi, Z Liu, ...","Effect of an additional donor on decene formation in ethylene oligomerization catalyzed by a Cr/PCCP system: a combined experimental and DFT study",2021,"… Science & Technology","pubs.rsc.org","https://pubs.rsc.org/en/content/articlehtml/2021/cy/d1cy00423a","https://scholar.google.com/scholar?cites=9721078493323686534&as_sdt=2005&sciodt=0,5&hl=en",7,"2025-04-13 10:53:18","","","","",,,,,16,4.00,2,7,4,"… The DFT calculations were first employed to … elimination. The conformer of metallacyclopentane constrains the agostic interaction between Cr and β-H, thus preventing the elimination of …","","https://scholar.google.com/scholar?q=related:hnI_nGI16IYJ:scholar.google.com/&scioq=source:%22catalysis+science%22+source:technology+beta+elimination+dft&hl=en&as_sdt=0,5&as_vis=1"
3,"F Jia, Y Yang, B Zhang","Mechanism insight into palladium-catalyzed site-selective C–H functionalization of carbazoles",2023,"Catalysis Science & Technology","pubs.rsc.org","https://pubs.rsc.org/en/content/articlehtml/2023/cy/d3cy01137b","https://scholar.google.com/scholar?cites=5771967886420961856&as_sdt=2005&sciodt=0,5&hl=en",8,"2025-04-13 10:53:18","","","","",,,,,3,1.50,1,3,2,"… elimination to produce byproduct 4. Byproduct 4 may also be obtained by reductive elimination of … In conclusion, DFT theoretical calculations were performed to investigate the NH-…","","https://scholar.google.com/scholar?q=related:QGoVJTYmGlAJ:scholar.google.com/&scioq=source:%22catalysis+science%22+source:technology+beta+elimination+dft&hl=en&as_sdt=0,5&as_vis=1"
50,"M John, K Alexopoulos, MF Reyniers, ...","Mechanistic insights into the formation of butene isomers from 1-butanol in H-ZSM-5: DFT based microkinetic modelling",2017,"… Science & Technology","pubs.rsc.org","https://pubs.rsc.org/en/content/articlehtml/2017/cy/c6cy02474b","https://scholar.google.com/scholar?cites=16044022473968143674&as_sdt=2005&sciodt=0,5&hl=en",9,"2025-04-13 10:53:18","","","","",,,,,50,6.25,13,4,8,"… the cationic fragment (+0.85) in a DFT study on E1 elimination of water from 2-butanol in POM. … confirm an E1 elimination with simultaneous 1,2-hydride shift for the elimination of water …","https://www.researchgate.net/profile/Guy-Marin/publication/312161380_Mechanistic_insights_into_formation_of_butene_isomers_from_1-butanol_in_H-ZSM-5_DFT_based_microkinetic_modelling/links/60e07a54a6fdccb745035041/Mechanistic-insights-into-formation-of-butene-isomers-from-1-butanol-in-H-ZSM-5-DFT-based-microkinetic-modelling.pdf","https://scholar.google.com/scholar?q=related:Ok1BaW_Rp94J:scholar.google.com/&scioq=source:%22catalysis+science%22+source:technology+beta+elimination+dft&hl=en&as_sdt=0,5&as_vis=1"
0,"L Qin, Y Qiao, M Xu, W Li, SP Sun, Y Hu, ...","A computational mechanistic study on the Pd (ii)-catalyzed γ-C (sp 3)–H lactamization and further rational design",2025,"… Science & Technology","pubs.rsc.org","https://pubs.rsc.org/en/content/articlehtml/2025/cy/d4cy01302f","",10,"2025-04-13 10:53:18","","","","",,,,,0,0.00,0,7,1,"… DFT to … DFT calculations to analyze C–H bond cleavage in cyclic tertiary alkylamines, specifically investigating γ-C(sp 3 )–H activation on the exocyclic N-substituent and β-H elimination …","","https://scholar.google.com/scholar?q=related:68avFRtPDH8J:scholar.google.com/&scioq=source:%22catalysis+science%22+source:technology+beta+elimination+dft&hl=en&as_sdt=0,5&as_vis=1"
2,"J Xu, Y Liu, C Liu, D Zhang","DFT computational insight into Pd (0)-catalyzed oxidative cross-coupling of 1, 2-allenyl ketones and aryl boronic acids: Pd (ii)-carbenoid intermediate versus π-allyl-Pd …",2023,"Catalysis Science & Technology","pubs.rsc.org","https://pubs.rsc.org/en/content/articlehtml/2022/cy/d2cy01506d","https://scholar.google.com/scholar?cites=8642244312697128455&as_sdt=2005&sciodt=0,5&hl=en",11,"2025-04-13 10:53:18","","","","",,,,,2,1.00,1,4,2,"… It should be noted that during the final reductive elimination … β-H elimination and the O–H reductive elimination are 18.6 … In conclusion, by performing DFT calculations we have shown …","","https://scholar.google.com/scholar?q=related:B8Zz8Glr73cJ:scholar.google.com/&scioq=source:%22catalysis+science%22+source:technology+beta+elimination+dft&hl=en&as_sdt=0,5&as_vis=1"
2,"L Liu, Y Liu, Y Yang, C Liu, D Zhang","DFT calculations reveal the origin of controllable synthesis of β-boronyl carbonyl compounds from Cu/Pd-cocatalyzed four-component borocarbonylation of …",2023,"Catalysis Science & Technology","pubs.rsc.org","https://pubs.rsc.org/en/content/articlehtml/2017/90/d2cy01936a","https://scholar.google.com/scholar?cites=14325349955408158526&as_sdt=2005&sciodt=0,5&hl=en",12,"2025-04-13 10:53:18","","","","",,,,,2,1.00,0,5,2,"… Finally, the C–O reductive elimination from 8 delivers the β-boryl ketone product P 1 and … undergoes reductive elimination to give the β-boryl vinyl ester P 2 and regenerates Pd(dppp). …","","https://scholar.google.com/scholar?q=related:Pt9Cr-LdzcYJ:scholar.google.com/&scioq=source:%22catalysis+science%22+source:technology+beta+elimination+dft&hl=en&as_sdt=0,5&as_vis=1"
2,"S Yamaguchi, T Kikuchi, K Tanaka, ...","Molecular field analysis in half-titanocene complexes: computational study towards data-driven in silico optimization of single-site olefin polymerization catalysts",2024,"… Science & Technology","pubs.rsc.org","https://pubs.rsc.org/en/content/articlehtml/2024/cy/d4cy00241e","https://scholar.google.com/scholar?cites=3293327064119669070&as_sdt=2005&sciodt=0,5&hl=en",13,"2025-04-13 10:53:18","","","","",,,,,2,2.00,1,4,1,"… For collecting training samples, we conducted DFT-based TS calculations of ethylene insertion to … This would be because β-hydride elimination becomes competitive as a chain transfer …","https://chemrxiv.org/engage/api-gateway/chemrxiv/assets/orp/resource/item/65cc12cd66c1381729975d02/original/molecular-field-analysis-in-half-titanocene-complexes-computational-study-towards-data-driven-in-silico-optimization-of-single-site-olefin-polymerization-catalysts.pdf","https://scholar.google.com/scholar?q=related:TnEIGoQ_tC0J:scholar.google.com/&scioq=source:%22catalysis+science%22+source:technology+beta+elimination+dft&hl=en&as_sdt=0,5&as_vis=1"
38,"M John, K Alexopoulos, MF Reyniers, ...","Effect of zeolite confinement on the conversion of 1-butanol to butene isomers: mechanistic insights from DFT based microkinetic modelling",2017,"… Science & Technology","pubs.rsc.org","https://pubs.rsc.org/en/content/articlehtml/2017/cy/c7cy00536a","https://scholar.google.com/scholar?cites=16203760702319345516&as_sdt=2005&sciodt=0,5&hl=en",14,"2025-04-13 10:53:18","","","","",,,,,38,4.75,10,4,8,"… butanol dimer via an E1 elimination accompanied by a 1,2-hydride shift. This in turn can be attributed to an increase in enthalpic stabilization of the E1 elimination transition state for the …","","https://scholar.google.com/scholar?q=related:bL8t74FS3-AJ:scholar.google.com/&scioq=source:%22catalysis+science%22+source:technology+beta+elimination+dft&hl=en&as_sdt=0,5&as_vis=1"
27,"L Zhang, W Wei, F Alam, Y Chen, ...","Efficient chromium-based catalysts for ethylene tri-/tetramerization switched by silicon-bridged/N, P-based ancillary ligands: a structural, catalytic and DFT study",2017,"… Science & Technology","pubs.rsc.org","https://pubs.rsc.org/en/content/articlehtml/2017/cy/c7cy01561e","https://scholar.google.com/scholar?cites=17619207895100080083&as_sdt=2005&sciodt=0,5&hl=en",15,"2025-04-13 10:53:18","","","","",,,,,27,3.38,5,5,8,"… Thus, the metallacycloheptane efficiently released 1-hexene by reductive elimination and entered … , which allowed the formation of C2c and release of 1-octene by reductive elimination. …","https://drive.google.com/file/d/1Vnu9YqeSLgMA785kSMqvqLkWB0uLYkKG/view","https://scholar.google.com/scholar?q=related:078y4zoAhPQJ:scholar.google.com/&scioq=source:%22catalysis+science%22+source:technology+beta+elimination+dft&hl=en&as_sdt=0,5&as_vis=1"
33,"MH Mahyuddin, K Yoshizawa","DFT exploration of active site motifs in methane hydroxylation by Ni-ZSM-5 zeolite",2018,"Catalysis Science & Technology","pubs.rsc.org","https://pubs.rsc.org/en/content/articlehtml/2018/cy/c8cy01441h","https://scholar.google.com/scholar?cites=13692628108457821944&as_sdt=2005&sciodt=0,5&hl=en",16,"2025-04-13 10:53:18","","","","",,,,,33,4.71,17,2,7,"… -5, calculations based on density functional theory (DFT) have shown that methane activation … In the present study, we employed the DFT+U method to calculate methane hydroxylation …","https://pubs.rsc.org/en/content/getauthorversionpdf/c8cy01441h","https://scholar.google.com/scholar?q=related:-EYozrf8Bb4J:scholar.google.com/&scioq=source:%22catalysis+science%22+source:technology+beta+elimination+dft&hl=en&as_sdt=0,5&as_vis=1"
8,"OS Trofymchuk, DE Ortega, ...","Neutral and cationic methallyl nickel complexes in alkene activation: a combined DFT, ESI-MS and chemometric approach",2021,"… Science & Technology","pubs.rsc.org","https://pubs.rsc.org/en/content/articlehtml/2021/cy/d1cy01595h","https://scholar.google.com/scholar?cites=9705614769137216810&as_sdt=2005&sciodt=0,5&hl=en",17,"2025-04-13 10:53:18","","","","",,,,,8,2.00,3,3,4,"… The ethylene insertion, β-H elimination, and butene isomerization were investigated by DFT calculations. The computed free energy profile is presented in blue (Fig. 6a) and indicates …","","https://scholar.google.com/scholar?q=related:Km01wTVFsYYJ:scholar.google.com/&scioq=source:%22catalysis+science%22+source:technology+beta+elimination+dft&hl=en&as_sdt=0,5&as_vis=1"
17,"XX Ma, JB Liu, F Huang, CZ Sun, ...","O-Substituted group-controlled selectivity in Rh (III)-catalyzed coupling of benzamides with α, α-difluoromethylene alkynes: a computational mechanistic study",2018,"… Science & Technology","pubs.rsc.org","https://pubs.rsc.org/en/content/articlehtml/2018/cy/c8cy00481a","https://scholar.google.com/scholar?cites=791761318133459603&as_sdt=2005&sciodt=0,5&hl=en",18,"2025-04-13 10:53:18","","","","",,,,,17,2.43,3,5,7,"… β-F elimination from intermediate 37 at two different F (F1 or F2) sites. We only discuss the β-F1 elimination here and list the results of β-F2 elimination in … In summary, we performed DFT …","","https://scholar.google.com/scholar?q=related:k2o9Urnm_AoJ:scholar.google.com/&scioq=source:%22catalysis+science%22+source:technology+beta+elimination+dft&hl=en&as_sdt=0,5&as_vis=1"
1,"H Ye, T Sato, T Nakanishi, S Ito, S Umemiya, ...","DFT calculation-aided optimisation of a chiral phosphoric acid catalyst: case study of kinetic resolution of racemic secondary alcohols through lactonisation",2024,"… Science & Technology","pubs.rsc.org","https://pubs.rsc.org/en/content/articlehtml/2024/cy/d4cy01029a","https://scholar.google.com/scholar?cites=2147999116177964697&as_sdt=2005&sciodt=0,5&hl=en",19,"2025-04-13 10:53:18","","","","",,,,,1,1.00,0,6,1,"… by DFT (density functional theory) calculations. As a result, the selectivity factor (s-factor) was increased by using the predicted CPA with reduced computational load and experimental …","","https://scholar.google.com/scholar?q=related:mf6jydA5zx0J:scholar.google.com/&scioq=source:%22catalysis+science%22+source:technology+beta+elimination+dft&hl=en&as_sdt=0,5&as_vis=1"
33,"P Kostetskyy, G Mpourmpakis","Structure-activity relationships in the production of olefins from alcohols and ethers: a first-principles theoretical study",2015,"Catalysis Science & Technology","pubs.rsc.org","https://pubs.rsc.org/en/content/articlehtml/2015/cy/c5cy00925a","https://scholar.google.com/scholar?cites=10180915900450910456&as_sdt=2005&sciodt=0,5&hl=en",20,"2025-04-13 10:53:18","","","","",,,,,33,3.30,17,2,10,"… with the use of Density Functional Theory (DFT) calculations. In … through a concerted elimination E2 type of mechanism. … The next step is a single step elimination in which the beta …","https://citeseerx.ist.psu.edu/document?repid=rep1&type=pdf&doi=a1ca5c496ba84114cf897ac82444649cb7899d9c","https://scholar.google.com/scholar?q=related:-LCAFhLhSY0J:scholar.google.com/&scioq=source:%22catalysis+science%22+source:technology+beta+elimination+dft&hl=en&as_sdt=0,5&as_vis=1"
3,"L Guo, J Wang, J Luo, Q Shi, D Wei, ...","Prediction on chemoselectivity for selected organocatalytic reactions by the DFT version of the Hückel-defined free valence index",2022,"… Science & Technology","pubs.rsc.org","https://pubs.rsc.org/en/content/articlehtml/2022/cy/d2cy01118b","https://scholar.google.com/scholar?cites=1701599777123802557&as_sdt=2005&sciodt=0,5&hl=en",21,"2025-04-13 10:53:18","","","","",,,,,3,1.00,1,6,3,"Developing reliable indexes for the prediction of the actual chemical active site of substrates is one of the most challenging tasks in the chemistry field. Herein, we suggested a general …","","https://scholar.google.com/scholar?q=related:vR1ZWftLnRcJ:scholar.google.com/&scioq=source:%22catalysis+science%22+source:technology+beta+elimination+dft&hl=en&as_sdt=0,5&as_vis=1"
34,"Y Shi, Y Yang, YW Li, H Jiao","Theoretical study about Mo 2 C (101)-catalyzed hydrodeoxygenation of butyric acid to butane for biomass conversion",2016,"Catalysis Science & Technology","pubs.rsc.org","https://pubs.rsc.org/en/content/articlehtml/2016/cy/c5cy02008e","https://scholar.google.com/scholar?cites=10522063784023571918&as_sdt=2005&sciodt=0,5&hl=en",22,"2025-04-13 10:53:18","","","","",,,,,34,3.78,9,4,9,"… on the basis of density functional theory including dispersion (… elimination on the basis of the co-adsorbed R-CH 2 + OH + H (IS14). Compared with R-CH 3 formation, the β-H elimination …","","https://scholar.google.com/scholar?q=related:zj26ZkPhBZIJ:scholar.google.com/&scioq=source:%22catalysis+science%22+source:technology+beta+elimination+dft&hl=en&as_sdt=0,5&as_vis=1"
5,"B Yang, K Sharkas, L Gagliardi, ...","The effects of active site and support on hydrogen elimination over transition-metal-functionalized yttria-decorated metal–organic frameworks",2019,"… Science & Technology","pubs.rsc.org","https://pubs.rsc.org/en/content/articlehtml/2019/cy/c9cy01069f","https://scholar.google.com/scholar?cites=8859886790248566256&as_sdt=2005&sciodt=0,5&hl=en",23,"2025-04-13 10:53:18","","","","",,,,,5,0.83,1,4,6,"… Here we employ density-functional-theory-based … and supports on the hydrogen elimination reactions. We consider six … for both α-H elimination and β-H elimination, but for the latter we …","https://pubs.rsc.org/en/content/getauthorversionpdf/c9cy01069f","https://scholar.google.com/scholar?q=related:8A3xEhik9HoJ:scholar.google.com/&scioq=source:%22catalysis+science%22+source:technology+beta+elimination+dft&hl=en&as_sdt=0,5&as_vis=1"
15,"Z Hao, L Guo, M Xing, Q Zhang","Mechanistic study of ethanol steam reforming on TM–Mo 6 S 8 clusters: a DFT study",2019,"Catalysis Science & Technology","pubs.rsc.org","https://pubs.rsc.org/en/content/articlehtml/2019/cy/c8cy02151a","https://scholar.google.com/scholar?cites=29812595193965184&as_sdt=2005&sciodt=0,5&hl=en",24,"2025-04-13 10:53:18","","","","",,,,,15,2.50,4,4,6,"… under density functional theory (DFT) calculations. The results show that Pd–Mo6S8 shows the best performance both in terms of activity and stability, due to facile H2 evolution from the …","","https://scholar.google.com/scholar?q=related:gGpeumXqaQAJ:scholar.google.com/&scioq=source:%22catalysis+science%22+source:technology+beta+elimination+dft&hl=en&as_sdt=0,5&as_vis=1"
4,"X Ma, A Feng, C Liu, D Zhang","Mechanistic insight into construction of axially chiral biaryls via palladium/chiral norbornene cooperative catalysis: a DFT-based computational study",2022,"Catalysis Science & Technology","pubs.rsc.org","https://pubs.rsc.org/en/content/articlehtml/2021/cy/d1cy01863a","https://scholar.google.com/scholar?cites=8786818133972188781&as_sdt=2005&sciodt=0,5&hl=en",25,"2025-04-13 10:53:18","","","","",,,,,4,1.33,1,4,3,"… Herein, we report a density functional theory (DFT) … elimination viaTS8 is found to involve a barrier as high as 41.9 kcal mol −1 , explaining the fact that no the C–C reductive elimination …","","https://scholar.google.com/scholar?q=related:bX5fzYkM8XkJ:scholar.google.com/&scioq=source:%22catalysis+science%22+source:technology+beta+elimination+dft&hl=en&as_sdt=0,5&as_vis=1"
1,"G He, D Mei","The critical role of the active [GaH] 2+ site in n-heptane dehydrocyclization over Ga/H-ZSM-5 zeolite",2024,"Catalysis Science & Technology","pubs.rsc.org","https://pubs.rsc.org/en/content/articlehtml/2024/cy/d4cy00648h","https://scholar.google.com/scholar?cites=18011427177957262156&as_sdt=2005&sciodt=0,5&hl=en",26,"2025-04-13 10:53:18","","","","",,,,,1,1.00,1,2,1,"… In the present work, first principles DFT calculations have been carried out to explore the production and restoration of [GaH] 2+ . Specifically, the reaction mechanism involved in …","","https://scholar.google.com/scholar?q=related:TIP195Zx9fkJ:scholar.google.com/&scioq=source:%22catalysis+science%22+source:technology+beta+elimination+dft&hl=en&as_sdt=0,5&as_vis=1"
0,"F Jia, C Zhang, Y Yang, X Zheng, M Shi","Mechanistic insights into an enantioselective synthetic strategy for 1, 3-disubstituted planar chiral ferrocenes",2025,"… Science & Technology","pubs.rsc.org","https://pubs.rsc.org/en/content/articlehtml/2024/cy/d4cy01130a","",27,"2025-04-13 10:53:18","","","","",,,,,0,0.00,0,5,1,"… After the oxidative addition and reductive elimination reactions … Here, intermediate V can undergo β-carbon elimination, NBE … In this study, density functional theory (DFT) calculations …","","https://scholar.google.com/scholar?q=related:5aZUP7t2eu0J:scholar.google.com/&scioq=source:%22catalysis+science%22+source:technology+beta+elimination+dft&hl=en&as_sdt=0,5&as_vis=1"
35,"MM Montemore, CF Nwaokorie, ...","General screening of surface alloys for catalysis",2020,"… Science & Technology","pubs.rsc.org","https://pubs.rsc.org/en/content/articlehtml/2020/cy/d0cy00682c","https://scholar.google.com/scholar?cites=17479561323208120644&as_sdt=2005&sciodt=0,5&hl=en",28,"2025-04-13 10:53:18","","","","",,,,,35,7.00,12,3,5,"… We performed DFT calculations on a few of the structures predicted to strongly deviate from … the efficiency of DFT calculations in a variety of situations, by quickly eliminating sites or …","https://chemrxiv.org/engage/api-gateway/chemrxiv/assets/orp/resource/item/60c74a119abda27e72f8cd7d/original/general-screening-of-surface-alloys-for-catalysis.pdf","https://scholar.google.com/scholar?q=related:RBl6q2ngk_IJ:scholar.google.com/&scioq=source:%22catalysis+science%22+source:technology+beta+elimination+dft&hl=en&as_sdt=0,5&as_vis=1"
37,"X Li, H Wu, Y Lang, G Huang","Mechanism, selectivity, and reactivity of iridium-and rhodium-catalyzed intermolecular ketone α-alkylation with unactivated olefins via an enamide directing strategy",2018,"Catalysis Science & Technology","pubs.rsc.org","https://pubs.rsc.org/en/content/articlehtml/2018/cy/c8cy00290h","https://scholar.google.com/scholar?cites=5921116185246339696&as_sdt=2005&sciodt=0,5&hl=en",29,"2025-04-13 10:53:18","","","","",,,,,37,5.29,9,4,7,"… /C–C reductive elimination and the migratory insertion into the Ir–C bond/C–H reductive … To summarize, we have presented a comprehensive DFT study on the iridium- and rhodium-…","","https://scholar.google.com/scholar?q=related:cJJsj8wHLFIJ:scholar.google.com/&scioq=source:%22catalysis+science%22+source:technology+beta+elimination+dft&hl=en&as_sdt=0,5&as_vis=1"
12,"J Zhang, J Li, K Li, J Zhao, Z Yang, L Zong, ...","A heterogeneous Rh/CPOL-BINAPa&PPh 3 catalyst for hydroformylation of olefins: chemical and DFT insights into active species and the roles of BINAPa and PPh 3",2022,"… Science & Technology","pubs.rsc.org","https://pubs.rsc.org/en/content/articlehtml/2022/cy/d2cy00370h","https://scholar.google.com/scholar?cites=10093576807604413528&as_sdt=2005&sciodt=0,5&hl=en",30,"2025-04-13 10:53:18","","","","",,,,,12,4.00,2,7,3,"… Based on the results of FT-IR characterization and DFT calculations, two kinds of Rh–H complexes … Based on the above results and DFT calculations, we could conclude that the highly …","","https://scholar.google.com/scholar?q=related:WORh4qCWE4wJ:scholar.google.com/&scioq=source:%22catalysis+science%22+source:technology+beta+elimination+dft&hl=en&as_sdt=0,5&as_vis=1"
