Cites,Authors,Title,Year,Source,Publisher,ArticleURL,CitesURL,GSRank,QueryDate,Type,DOI,ISSN,CitationURL,Volume,Issue,StartPage,EndPage,ECC,CitesPerYear,CitesPerAuthor,AuthorCount,Age,Abstract,FullTextURL,RelatedURL
38,"Z Freixa","Photoswitchable catalysis using organometallic complexes",2020,"Catalysis Science & Technology","pubs.rsc.org","https://pubs.rsc.org/en/content/articlehtml/2020/cy/d0cy00431f","https://scholar.google.com/scholar?cites=14508587761717779163&as_sdt=2005&sciodt=0,5&hl=en",242,"2025-04-13 10:53:18","","","","",,,,,38,7.60,38,1,5,"… Helped by comprehensive density functional theory (DFT) calculations, the authors were able to rationalize the different relative activities in both processes. The lower activity of the …","","https://scholar.google.com/scholar?q=related:25rEEbPbWMkJ:scholar.google.com/&scioq=source:%22catalysis+science%22+source:technology+beta+elimination+dft&hl=en&as_sdt=0,5&as_vis=1"
37,"H Gao, L Hu, Y Hu, X Lv, YB Wu, G Lu","Origins of Lewis acid acceleration in nickel-catalysed C–H, C–C and C–O bond cleavage",2021,"… Science & Technology","pubs.rsc.org","https://pubs.rsc.org/en/content/articlehtml/2021/cy/d1cy00660f","https://scholar.google.com/scholar?cites=17843835129139460504&as_sdt=2005&sciodt=0,5&hl=en",243,"2025-04-13 10:53:18","","","","",,,,,37,9.25,6,6,4,"… for C–X (X = H, C, O) oxidative addition with and without LAs by using the combination of M06/def2-TZVP and B3LYP/def2-SVP methods is consistent with those from other DFT …","","https://scholar.google.com/scholar?q=related:mHn-XoIJovcJ:scholar.google.com/&scioq=source:%22catalysis+science%22+source:technology+beta+elimination+dft&hl=en&as_sdt=0,5&as_vis=1"
40,"S Wang, S Yin, G Chen, L Li, H Zhang","Nearly atomic precise gold nanoclusters on nickel-based layered double hydroxides for extraordinarily efficient aerobic oxidation of alcohols",2016,"… Science & Technology","pubs.rsc.org","https://pubs.rsc.org/en/content/articlehtml/2016/cy/c6cy00186f","https://scholar.google.com/scholar?cites=2459359166603217598&as_sdt=2005&sciodt=0,5&hl=en",244,"2025-04-13 10:53:18","","","","",,,,,40,4.44,8,5,9,"… studied the interaction between Au clusters and a Mg(OH) 2 basal plane by using DFT theory, and found strong interaction of the Au clusters with the surface –OH groups via a short …","","https://scholar.google.com/scholar?q=related:vkp8vCFmISIJ:scholar.google.com/&scioq=source:%22catalysis+science%22+source:technology+beta+elimination+dft&hl=en&as_sdt=0,5&as_vis=1"
56,"M Torimoto, Y Sekine","Effects of alloying for steam or dry reforming of methane: a review of recent studies",2022,"Catalysis Science & Technology","pubs.rsc.org","https://pubs.rsc.org/en/content/articlehtml/2022/cy/d2cy00066k","https://scholar.google.com/scholar?cites=7533376793562221901&as_sdt=2005&sciodt=0,5&hl=en",245,"2025-04-13 10:53:18","HTML","","","",,,,,56,18.67,28,2,3,"… Such explanations using DFT calculations have been reported also for CH 4 . Abild-Pedersen et al. reported the correlation between the surface d-band centre and the transition state …","https://pubs.rsc.org/en/content/articlehtml/2022/cy/d2cy00066k","https://scholar.google.com/scholar?q=related:TY1yu0fui2gJ:scholar.google.com/&scioq=source:%22catalysis+science%22+source:technology+beta+elimination+dft&hl=en&as_sdt=0,5&as_vis=1"
5,"S Maity, BB Dhar","Peroxide activation by selenium-doped graphite",2022,"Catalysis Science & Technology","pubs.rsc.org","https://pubs.rsc.org/en/content/articlehtml/2022/cy/d1cy02224e","https://scholar.google.com/scholar?cites=18421198348719473140&as_sdt=2005&sciodt=0,5&hl=en",246,"2025-04-13 10:53:18","","","","",,,,,5,1.67,3,2,3,"… of epoxidation was established with density functional theory (DFT) using Gaussian code. … potential in clean-up applications for eliminating toxic and polluting substances in the field of …","","https://scholar.google.com/scholar?q=related:9MFvaEw-pf8J:scholar.google.com/&scioq=source:%22catalysis+science%22+source:technology+beta+elimination+dft&hl=en&as_sdt=0,5&as_vis=1"
5,"M Li, J Chen, JN Hall, P Bollini","Active sites, kinetics, and inhibiting species in the catalytic dehydration of methanol over MIL-100 (Cr)",2023,"Catalysis Science & Technology","pubs.rsc.org","https://pubs.rsc.org/en/content/articlehtml/2001/vk/d2cy01877b","https://scholar.google.com/scholar?cites=14633326050423050730&as_sdt=2005&sciodt=0,5&hl=en",247,"2025-04-13 10:53:18","","","","",,,,,5,2.50,1,4,2,"… These neutral and anionic species can be eliminated using thermal treatments to generate open-metal sites 19 the participation in Lewis acid catalysis of which have either been …","","https://scholar.google.com/scholar?q=related:6pHvHYMEFMsJ:scholar.google.com/&scioq=source:%22catalysis+science%22+source:technology+beta+elimination+dft&hl=en&as_sdt=0,5&as_vis=1"
114,"JG de Vries, N Mršić","Organocatalytic asymmetric transfer hydrogenation of imines",2011,"Catalysis Science & Technology","pubs.rsc.org","https://pubs.rsc.org/en/content/articlehtml/2011/cy/c1cy00050k","https://scholar.google.com/scholar?cites=17009977956223145737&as_sdt=2005&sciodt=0,5&hl=en",248,"2025-04-13 10:53:18","","","","",,,,,114,8.14,57,2,14,"… The sequence comprises a one-pot Michael addition–isomerization–cyclization–elimination… , gives the hemiaminal 74 which upon rapid water elimination results in the formation of the …","https://research.rug.nl/files/6766773/2011CatalSciTechnoldeVries.pdf","https://scholar.google.com/scholar?q=related:CdfnFdSUD-wJ:scholar.google.com/&scioq=source:%22catalysis+science%22+source:technology+beta+elimination+dft&hl=en&as_sdt=0,5&as_vis=1"
23,"FC Jentoft","Transition metal-catalyzed deoxydehydration: missing pieces of the puzzle",2022,"Catalysis Science & Technology","pubs.rsc.org","https://pubs.rsc.org/en/content/articlehtml/2022/cy/d1cy02083h","https://scholar.google.com/scholar?cites=13569642981796202523&as_sdt=2005&sciodt=0,5&hl=en",249,"2025-04-13 10:53:18","","","","",,,,,23,7.67,23,1,3,"… In a variant, two oxido ligands may be turned into hydroxido ligands with subsequent elimination of two molecules of water during the condensation step (Scheme 8c). Finally, one oxido …","https://pubs.rsc.org/de-at/content/getauthorversionpdf/D1CY02083H","https://scholar.google.com/scholar?q=related:G8jVmmUOUbwJ:scholar.google.com/&scioq=source:%22catalysis+science%22+source:technology+beta+elimination+dft&hl=en&as_sdt=0,5&as_vis=1"
7,"M Martínez-Mingo, I Alonso, N Rodríguez, ...","Mechanistic understanding enables chemoselective sp 3 over sp 2 C–H activation in Pd-catalyzed carbonylative cyclization of amino acids",2021,"… Science & Technology","pubs.rsc.org","https://pubs.rsc.org/en/content/articlehtml/2021/cy/d0cy02328k","https://scholar.google.com/scholar?cites=10097292020450465310&as_sdt=2005&sciodt=0,5&hl=en",250,"2025-04-13 10:53:18","","","","",,,,,7,1.75,2,4,4,"… derivatives, gained by experimental observations and DFT studies, have been leveraged to … Complex IM6-B-1a might evolve through the reductive elimination transition state TS4-B-1a, …","","https://scholar.google.com/scholar?q=related:HhZWSJjJIIwJ:scholar.google.com/&scioq=source:%22catalysis+science%22+source:technology+beta+elimination+dft&hl=en&as_sdt=0,5&as_vis=1"
3,"L Hong, A Spielmeyer, J Pfeiffer, ...","Domino lignin depolymerization and reconnection to complex molecules mediated by boryl radicals",2020,"… Science & Technology","pubs.rsc.org","https://pubs.rsc.org/en/content/articlehtml/2020/cy/d0cy00558d","https://scholar.google.com/scholar?cites=1673006632366672511&as_sdt=2005&sciodt=0,5&hl=en",251,"2025-04-13 10:53:18","","","","",,,,,3,0.60,1,4,5,"… elimination of guaiacolate pinacolborane provides the vinyl ketone intermediate 7. In route C, at high temperature, the elimination … mild conditions, and the elimination of H 2 O from the γ-…","","https://scholar.google.com/scholar?q=related:f4oWDau2NxcJ:scholar.google.com/&scioq=source:%22catalysis+science%22+source:technology+beta+elimination+dft&hl=en&as_sdt=0,5&as_vis=1"
28,"S Semwal, A Kumar, J Choudhury","Iridium–NHC-based catalyst for ambient pressure storage and low temperature release of H 2 via the CO 2/HCO 2 H couple",2018,"Catalysis Science & Technology","pubs.rsc.org","https://pubs.rsc.org/en/content/articlehtml/2018/cy/c8cy02069h","https://scholar.google.com/scholar?cites=4370782364986459508&as_sdt=2005&sciodt=0,5&hl=en",252,"2025-04-13 10:53:18","","","","",,,,,28,4.00,9,3,7,"… The Ir–formato species undergoes β-hydride elimination generating Ir–H upon release of CO 2 . In an acidic medium the Ir–H species is unstable and reacts with protons, plausibly with …","","https://scholar.google.com/scholar?q=related:dEWPT2cjqDwJ:scholar.google.com/&scioq=source:%22catalysis+science%22+source:technology+beta+elimination+dft&hl=en&as_sdt=0,5&as_vis=1"
17,"NW Felvey, MJ Meloni, CX Kronawitter, ...","Ethane dehydrogenation over Cr/ZSM-5: characterization of active sites through probe molecule adsorption FTIR",2020,"… Science & Technology","pubs.rsc.org","https://pubs.rsc.org/en/content/articlehtml/2020/cy/d0cy01022g","https://scholar.google.com/scholar?cites=13650816698348758516&as_sdt=2005&sciodt=0,5&hl=en",253,"2025-04-13 10:53:18","","","","",,,,,17,3.40,4,4,5,"… Raman bands with results from density functional theory (DFT) calculations of calcined Cr/… type of Cr, while the other band was eliminated only upon exposure of the sample to methane. …","","https://scholar.google.com/scholar?q=related:9GUMR3Zxcb0J:scholar.google.com/&scioq=source:%22catalysis+science%22+source:technology+beta+elimination+dft&hl=en&as_sdt=0,5&as_vis=1"
72,"MA Ardagh, T Birol, Q Zhang, ...","Catalytic resonance theory: superVolcanoes, catalytic molecular pumps, and oscillatory steady state",2019,"… Science & Technology","pubs.rsc.org","https://pubs.rsc.org/en/content/articlehtml/2019/cy/c9cy01543d","https://scholar.google.com/scholar?cites=7724374939337550425&as_sdt=2005&sciodt=0,5&hl=en",254,"2025-04-13 10:53:18","","","","",,,,,72,12.00,18,4,6,"… : (A) alpha of 0.6, beta of 102 kJ mol −1 , and delta of 0.5 eV. (B) Alpha of 0.6, beta of 65 kJ mol −1 , and delta of 1.4 eV. (C) Alpha of 1.0, beta of 102 kJ mol −1 , and delta of 0.5 eV. …","https://pubs.rsc.org/zh-hans/content/getauthorversionpdf/C9CY01543D","https://scholar.google.com/scholar?q=related:Weok8xR-MmsJ:scholar.google.com/&scioq=source:%22catalysis+science%22+source:technology+beta+elimination+dft&hl=en&as_sdt=0,5&as_vis=1"
6,"Y Tsubonouchi, Z Zahran, D Chandra, ...","Prominently progressive development of Ni-based oxygen-evolving electrocatalysts for water splitting",2024,"… Science & Technology","pubs.rsc.org","https://pubs.rsc.org/en/content/articlehtml/2024/cy/d4cy00066h","https://scholar.google.com/scholar?cites=3180874490415668205&as_sdt=2005&sciodt=0,5&hl=en",255,"2025-04-13 10:53:18","","","","",,,,,6,6.00,2,4,1,"… Moreover, the DFT calculations suggested an energy barrier of 0.51 eV for the formation the *OOH intermediate adsorbed on NiO x (OH) y as the rate-determining step (RDS), which is …","","https://scholar.google.com/scholar?q=related:7dtT_H68JCwJ:scholar.google.com/&scioq=source:%22catalysis+science%22+source:technology+beta+elimination+dft&hl=en&as_sdt=0,5&as_vis=1"
0,"SN Pandey, A Sengupta, R Bera, S Ali, ...","A sugar-derived ligand for room temperature aerial oxidation or non-aqueous Markovnikov hydration of styrenes using a preformed or in situ generated Co complex",2024,"… Science & Technology","pubs.rsc.org","https://pubs.rsc.org/en/content/articlehtml/2024/cy/d4cy00522h","",256,"2025-04-13 10:53:18","","","","",,,,,0,0.00,0,5,1,"… to current goals of energy efficiency by eliminating the need for high temperature and pressure … The higher energy absorption at 360 nm could be correlated with the TD-DFT peak at 379 …","","https://scholar.google.com/scholar?q=related:FYRaXJn9GK0J:scholar.google.com/&scioq=source:%22catalysis+science%22+source:technology+beta+elimination+dft&hl=en&as_sdt=0,5&as_vis=1"
14,"T Liang, J Chen, S Wang, P Wang, Z Qin, ...","Conversion of methanol to hydrocarbons over H-MCM-22 zeolite: deactivation behaviours related to acid density and distribution",2022,"… Science & Technology","pubs.rsc.org","https://pubs.rsc.org/en/content/articlehtml/2022/cy/d2cy01270g","https://scholar.google.com/scholar?cites=2636251817369274123&as_sdt=2005&sciodt=0,5&hl=en",257,"2025-04-13 10:53:18","","","","",,,,,14,4.67,2,6,3,"… (HCP) species on which methanol methylation and olefin elimination (via the side-chain and/… based on the dual-cycle mechanism by a DFT method and found that both aromatic-based …","","https://scholar.google.com/scholar?q=related:CwfGeA_ZlSQJ:scholar.google.com/&scioq=source:%22catalysis+science%22+source:technology+beta+elimination+dft&hl=en&as_sdt=0,5&as_vis=1"
294,"BM Hockin, C Li, N Robertson, ...","Photoredox catalysts based on earth-abundant metal complexes",2019,"… Science & Technology","pubs.rsc.org","https://pubs.rsc.org/en/content/articlehtml/2019/cy/c8cy02336k","https://scholar.google.com/scholar?cites=8401866881069093970&as_sdt=2005&sciodt=0,5&hl=en",258,"2025-04-13 10:53:18","","","","",,,,,294,49.00,74,4,6,"Over the last decade, visible light photoredox catalysis has exploded into the consciousness of the synthetic chemist. The principal photocatalysts used are based on rare and toxic …","https://research-repository.st-andrews.ac.uk/bitstream/handle/10023/19297/Hockin_2019_CST_Photoredexcatalysts_AAM.pdf?sequence=1","https://scholar.google.com/scholar?q=related:UhQ-0GltmXQJ:scholar.google.com/&scioq=source:%22catalysis+science%22+source:technology+beta+elimination+dft&hl=en&as_sdt=0,5&as_vis=1"
284,"EV Kondratenko, T Peppel, D Seeburg, ...","Methane conversion into different hydrocarbons or oxygenates: current status and future perspectives in catalyst development and reactor operation",2017,"… Science & Technology","pubs.rsc.org","https://pubs.rsc.org/en/content/articlehtml/2017/cy/c6cy01879c","https://scholar.google.com/scholar?cites=15119984211662590774&as_sdt=2005&sciodt=0,5&hl=en",259,"2025-04-13 10:53:18","","","","",,,,,284,35.50,71,4,8,"… usage of air instead of pure oxygen for eliminating expensive air separation. In order to avoid … The same research groups also performed a detailed DFT study accompanied by ab initio …","","https://scholar.google.com/scholar?q=related:NtOpCYj51NEJ:scholar.google.com/&scioq=source:%22catalysis+science%22+source:technology+beta+elimination+dft&hl=en&as_sdt=0,5&as_vis=1"
7,"Y Fan, G Hou, Y Xiong, C Chen, W Zhao","Co-upgrading of biomass and plastic volatiles via metal-modified HZSM-5 coupled with NTP: deterioration and in situ recovery of the catalyst",2020,"… Science & Technology","pubs.rsc.org","https://pubs.rsc.org/en/content/articlehtml/2020/cy/d0cy01473g","https://scholar.google.com/scholar?cites=12164226361538984587&as_sdt=2005&sciodt=0,5&hl=en",260,"2025-04-13 10:53:18","","","","",,,,,7,1.40,1,5,5,"… precursors, while higher temperature intensified the elimination effect of plasma, and the coked … The specific surface area (S DFT ) and pore volume (V DFT ) were calculated by the DFT …","","https://scholar.google.com/scholar?q=related:izr5Tm0D0KgJ:scholar.google.com/&scioq=source:%22catalysis+science%22+source:technology+beta+elimination+dft&hl=en&as_sdt=0,5&as_vis=1"
0,"L Zhu, D Wang","A central functional group-dependent stereoinduction mechanism for chiral super Brønsted C–H acid catalysis",2023,"Catalysis Science & Technology","pubs.rsc.org","https://pubs.rsc.org/en/content/articlehtml/2023/cy/d3cy00886j","",261,"2025-04-13 10:53:18","","","","",,,,,0,0.00,0,2,2,"… the substrates and facilitates the initial water elimination step. The distortion–interaction analysis … In this study, by means of density functional theory, a comprehensive investigation was …","","https://scholar.google.com/scholar?q=related:JUHEgvurqqEJ:scholar.google.com/&scioq=source:%22catalysis+science%22+source:technology+beta+elimination+dft&hl=en&as_sdt=0,5&as_vis=1"
63,"A Hernández-Gordillo, M Bizarro, TA Gadhi, ...","Good practices for reporting the photocatalytic evaluation of a visible-light active semiconductor: Bi 2 O 3, a case study",2019,"… Science & Technology","pubs.rsc.org","https://pubs.rsc.org/en/content/articlehtml/2019/cy/c9cy00038k","https://scholar.google.com/scholar?cites=15984670492369969156&as_sdt=2005&sciodt=0,5&hl=en",262,"2025-04-13 10:53:18","","","","",,,,,63,10.50,16,4,6,"… of new technologies to achieve the elimination of dyes before wastewater discharge. By … DFT in its adiabatic kernel approximation. However, for the purpose of this investigation, TD-DFT …","https://drive.google.com/file/d/1RZe1S9GYEWefUgQbcEuKzYilX5UKc1ux/view","https://scholar.google.com/scholar?q=related:BGBhVR_11N0J:scholar.google.com/&scioq=source:%22catalysis+science%22+source:technology+beta+elimination+dft&hl=en&as_sdt=0,5&as_vis=1"
46,"Q Lin, B Liu, F Jiang, X Fang, Y Xu, X Liu","Assessing the formation of cobalt carbide and its catalytic performance under realistic reaction conditions and tuning product selectivity in a cobalt-based FTS reaction",2019,"… Science & Technology","pubs.rsc.org","https://pubs.rsc.org/en/content/articlehtml/2019/cy/c9cy00328b","https://scholar.google.com/scholar?cites=10229443578220327737&as_sdt=2005&sciodt=0,5&hl=en",263,"2025-04-13 10:53:18","","","","",,,,,46,7.67,8,6,6,"Cobalt carbide (Co2C) has recently attracted many researchers because of arguments about properties and formation conditions. The work reported in this paper was aimed at …","","https://scholar.google.com/scholar?q=related:OTO5ibxI9o0J:scholar.google.com/&scioq=source:%22catalysis+science%22+source:technology+beta+elimination+dft&hl=en&as_sdt=0,5&as_vis=1"
72,"C Santra, S Rahman, S Bojja, OO James, ...","Barium, calcium and magnesium doped mesoporous ceria supported gold nanoparticle for benzyl alcohol oxidation using molecular O 2",2013,"… Science & Technology","pubs.rsc.org","https://pubs.rsc.org/en/content/articlehtml/2012/cy/c2cy20523h","https://scholar.google.com/scholar?cites=16889542361397986715&as_sdt=2005&sciodt=0,5&hl=en",264,"2025-04-13 10:53:18","","","","",,,,,72,6.00,14,5,12,"… distribution where the NLDFT (Non linear density functional theory) model 29 is adopted to … The reduction is mainly due to the progressive elimination of surface hydroxyls and oxygen …","https://www.researchgate.net/profile/Chiranjit-Santra/publication/255759353_Barium_calcium_and_magnesium_doped_mesoporous_ceria_supported_gold_nanoparticle_for_benzyl_alcohol_oxidation_using_molecular_O2/links/55eeb12208aedecb68fcad8d/Barium-calcium-and-magnesium-doped-mesoporous-ceria-supported-gold-nanoparticle-for-benzyl-alcohol-oxidation-using-molecular-O2.pdf","https://scholar.google.com/scholar?q=related:mwUKBku1Y-oJ:scholar.google.com/&scioq=source:%22catalysis+science%22+source:technology+beta+elimination+dft&hl=en&as_sdt=0,5&as_vis=1"
123,"W Iqbal, B Yang, X Zhao, M Rauf, M Waqas, ...","Controllable synthesis of graphitic carbon nitride nanomaterials for solar energy conversion and environmental remediation: the road travelled and the way forward",2018,"… Science & Technology","pubs.rsc.org","https://pubs.rsc.org/en/content/articlehtml/2018/cy/c8cy01061g","https://scholar.google.com/scholar?cites=6990749208089493059&as_sdt=2005&sciodt=0,5&hl=en",265,"2025-04-13 10:53:18","","","","",,,,,123,17.57,21,6,7,"… Density functional theory (DFT) calculations are usually applied to expose the structures of … the precursor without any need for further elimination, which facilitates the construction of the …","https://drive.google.com/file/d/1qxUp8jp18seSo3UEk33rNdNqCjIanX-f/view","https://scholar.google.com/scholar?q=related:Q34Evl0hBGEJ:scholar.google.com/&scioq=source:%22catalysis+science%22+source:technology+beta+elimination+dft&hl=en&as_sdt=0,5&as_vis=1"
22,"S Barata-Vallejo, DE Yerien, A Postigo","Synthetic strategies for fluorosulfonylated compounds: application to click chemistry reactions",2023,"… Science & Technology","pubs.rsc.org","https://pubs.rsc.org/en/content/articlehtml/2023/cy/d2cy01998a","https://scholar.google.com/scholar?cites=11722028589456761317&as_sdt=2005&sciodt=0,5&hl=en",266,"2025-04-13 10:53:18","","","","",,,,,22,11.00,7,3,2,"The syntheses and applications of fluorosulfonylated organic compounds have flourished in the last ten years due to their versatility to participate in click chemistry (SuFEx) reactions. …","https://ri.conicet.gov.ar/bitstream/handle/11336/225016/CONICET_Digital_Nro.ab171686-da1a-43ba-a9f1-c8900c3c50af_B.pdf?sequence=2&isAllowed=y","https://scholar.google.com/scholar?q=related:5SGLaeUCraIJ:scholar.google.com/&scioq=source:%22catalysis+science%22+source:technology+beta+elimination+dft&hl=en&as_sdt=0,5&as_vis=1"
12,"S Wang, T Yin, X Meng, N Liu, L Shi","Synthesis of Al-incorporated sulfated zirconia with improved and stabilized surface sulfur species for removal of trace olefins from aromatics",2022,"Catalysis Science & Technology","pubs.rsc.org","https://pubs.rsc.org/en/content/articlehtml/2022/cy/d1cy01443a","https://scholar.google.com/scholar?cites=16567300979908556278&as_sdt=2005&sciodt=0,5&hl=en",267,"2025-04-13 10:53:18","","","","",,,,,12,4.00,2,5,3,"… For the sake of eliminating pollution problems to meet the increasing demands for … with the content of T-ZrO 2 and DFT calculation results confirmed the higher adsorption energies of SO …","","https://scholar.google.com/scholar?q=related:9jVuwnbg6uUJ:scholar.google.com/&scioq=source:%22catalysis+science%22+source:technology+beta+elimination+dft&hl=en&as_sdt=0,5&as_vis=1"
42,"B Dragoi, I Mazilu, A Chirieac, C Ciotonea, ...","Highly dispersed copper (oxide) nanoparticles prepared on SBA-15 partially occluded with the P123 surfactant: toward the design of active hydrogenation catalysts",2017,"… Science & Technology","pubs.rsc.org","https://pubs.rsc.org/en/content/articlehtml/2017/cy/c7cy01015j","https://scholar.google.com/scholar?cites=12184210654487653946&as_sdt=2005&sciodt=0,5&hl=en",268,"2025-04-13 10:53:18","","","","",,,,,42,5.25,8,5,8,"… S BET ) and non-local density functional theory (NL-DFT) for cylindrical pores was applied to … However, in these examples, the migration of the metal species was avoided by eliminating …","","https://scholar.google.com/scholar?q=related:Oi5EGQkDF6kJ:scholar.google.com/&scioq=source:%22catalysis+science%22+source:technology+beta+elimination+dft&hl=en&as_sdt=0,5&as_vis=1"
36,"Z Tang, Y Yu, W Liu, Z Chen, R Wang, H Liu, ...","Deboronation-assisted construction of defective Ti (OSi) 3 OH species in MWW-type titanosilicate and their enhanced catalytic performance",2020,"… Science & Technology","pubs.rsc.org","https://pubs.rsc.org/en/content/articlehtml/2020/cy/d0cy00126k","https://scholar.google.com/scholar?cites=3946722131976249138&as_sdt=2005&sciodt=0,5&hl=en",269,"2025-04-13 10:53:18","","","","",,,,,36,7.20,5,7,5,"… to consider eradicating pollution by minimizing or eliminating the hazards of chemical feedstocks, … Density functional theory theoretical calculations have suggested that the Lewis-acid …","","https://scholar.google.com/scholar?q=related:Mt-dT96SxTYJ:scholar.google.com/&scioq=source:%22catalysis+science%22+source:technology+beta+elimination+dft&hl=en&as_sdt=0,5&as_vis=1"
14,"E Martínez-Morales, CM Zicovich-Wilson","Adjusting framework ionicity to favour crystallisation of zeolites with strained structural units. Periodic quantum chemical studies",2011,"… Science & Technology","pubs.rsc.org","https://pubs.rsc.org/en/content/articlehtml/2011/cy/c1cy00010a","https://scholar.google.com/scholar?cites=11814975302183217202&as_sdt=2005&sciodt=0,5&hl=en",270,"2025-04-13 10:53:18","","","","",,,,,14,1.00,7,2,14,"… Finally the way the F − anion is eliminated from the small … level using the hybrid-DFT approach. When comparing systems … materials the hybrid-DFT computational level provides good …","","https://scholar.google.com/scholar?q=related:MuikXHA596MJ:scholar.google.com/&scioq=source:%22catalysis+science%22+source:technology+beta+elimination+dft&hl=en&as_sdt=0,5&as_vis=1"
57,"I Kainthla, JT Bhanushali, RS Keri, ...","Activity studies of vanadium, iron, carbon and mixed oxides based catalysts for the oxidative dehydrogenation of ethylbenzene to styrene: a review",2015,"… Science & Technology","pubs.rsc.org","https://pubs.rsc.org/en/content/articlehtml/2015/cy/c5cy00996k","https://scholar.google.com/scholar?cites=11753920513283235043&as_sdt=2005&sciodt=0,5&hl=en",271,"2025-04-13 10:53:18","","","","",,,,,57,5.70,14,4,10,"… kinetic study as well as density functional theory calculations. The investigations suggest that … The optimal Mg-content in the alumina support eliminated the above-mentioned negative …","","https://scholar.google.com/scholar?q=related:45xskG5QHqMJ:scholar.google.com/&scioq=source:%22catalysis+science%22+source:technology+beta+elimination+dft&hl=en&as_sdt=0,5&as_vis=1"
25,"C Liu, A Taheri, B Lai, Y Gu","Synergistic catalysis-induced ring-opening reactions of 2-substituted 3, 4-dihydropyrans with α-oxoketene dithioacetals",2015,"Catalysis Science & Technology","pubs.rsc.org","https://pubs.rsc.org/en/content/articlehtml/2014/cy/c4cy01212g","https://scholar.google.com/scholar?cites=7122819447487999803&as_sdt=2005&sciodt=0,5&hl=en",272,"2025-04-13 10:53:18","","","","",,,,,25,2.50,6,4,10,"… DFT calculation revealed that in the geometry-optimized … , and as a result, formation of the proton elimination product 5a is … bond formation through a proton elimination reaction pathway. …","","https://scholar.google.com/scholar?q=related:Oy_EloxW2WIJ:scholar.google.com/&scioq=source:%22catalysis+science%22+source:technology+beta+elimination+dft&hl=en&as_sdt=0,5&as_vis=1"
