Cites,Authors,Title,Year,Source,Publisher,ArticleURL,CitesURL,GSRank,QueryDate,Type,DOI,ISSN,CitationURL,Volume,Issue,StartPage,EndPage,ECC,CitesPerYear,CitesPerAuthor,AuthorCount,Age,Abstract,FullTextURL,RelatedURL
35,"Z Liu, Y Lu, J Guo, W Hu, Y Dang, ZX Wang","DFT Mechanistic Account for the Site Selectivity of Electron-Rich C(sp3)–H Bond in the Manganese-Catalyzed Aminations",2020,"Organic Letters","ACS Publications","https://pubs.acs.org/doi/abs/10.1021/acs.orglett.9b04215","https://scholar.google.com/scholar?cites=14197265083448712404&as_sdt=2005&sciodt=0,5&hl=en",1,"2025-05-19 18:00:53","","10.1021/acs.orglett.9b04215","","",,,,,35,7.00,6,6,5,"… In summary, the DFT study elucidates why and how Mn III (ClPc) + catalyzes the electron-rich C(sp 3 )–H amination. The study unveils that the C–H cleavage occurs via a hydride-…","","https://scholar.google.com/scholar?q=related:1FwEgV_RBsUJ:scholar.google.com/&scioq=source:%22organic+letters%22+%221523+7052%22+transition+metal+dft&hl=en&as_sdt=0,5&as_vis=1"
0,"X Shi, L Zhu, L Zhang, Z Yang, M Pu, M Lei","The Origin of Enantioselectivity of Aryl Terminal Alkenes Hydroboration Catalyzed by Cobalt Complex: A Density Functional Theory (DFT) Study",2025,"Organic Letters","ACS Publications","https://pubs.acs.org/doi/abs/10.1021/acs.orglett.5c00809","",2,"2025-05-19 18:00:53","","10.1021/acs.orglett.5c00809","","",,,,,0,0.00,0,6,1,"… In summary, a DFT study was performed to investigate the mechanism and the origin of enantioselective hydroboration of aryl terminal alkenes catalyzed by Co-IPO complex. Among …","","https://scholar.google.com/scholar?q=related:qP8t1_H8lvcJ:scholar.google.com/&scioq=source:%22organic+letters%22+%221523+7052%22+transition+metal+dft&hl=en&as_sdt=0,5&as_vis=1"
22,"X Ren, Y Lu, G Lu, ZX Wang","Density functional theory mechanistic study of Ni-catalyzed reductive alkyne–alkyne cyclodimerization: Oxidative cyclization versus outer-sphere proton transfer",2020,"Organic Letters","ACS Publications","https://pubs.acs.org/doi/abs/10.1021/acs.orglett.0c00674","https://scholar.google.com/scholar?cites=9863396484012506616&as_sdt=2005&sciodt=0,5&hl=en",3,"2025-05-19 18:00:53","","10.1021/acs.orglett.0c00674","","",,,,,22,4.40,6,4,5,"… In summary, we present a DFT study to understand the mechanism of the Ni-catalyzed reductive alkyne–alkyne cyclodimerization with MeOH/BEt 3 , the stereoselectivity, and the ligand …","","https://scholar.google.com/scholar?q=related:-P1m_NfS4YgJ:scholar.google.com/&scioq=source:%22organic+letters%22+%221523+7052%22+transition+metal+dft&hl=en&as_sdt=0,5&as_vis=1"
27,"J Kitano, Y Nishii, M Miura","Selective synthesis of C4-functionalized benzofurans by rhodium-catalyzed vinylene transfer: Computational study on the cyclopentadienyl ligand",2022,"Organic Letters","ACS Publications","https://pubs.acs.org/doi/abs/10.1021/acs.orglett.2c02030","https://scholar.google.com/scholar?cites=16112965831258484369&as_sdt=2005&sciodt=0,5&hl=en",4,"2025-05-19 18:00:53","","10.1021/acs.orglett.2c02030","","",,,,,27,9.00,9,3,3,"… We conducted DFT calculations on the proposed reaction pathway to shed light on the mechanism. Figure 1 displays an energy profile relative to a cationic Rh complex intA. After the …","https://ir.library.osaka-u.ac.jp/repo/ouka/all/92807/OrgLett_24_31_5679.pdf","https://scholar.google.com/scholar?q=related:kS4rqg3BnN8J:scholar.google.com/&scioq=source:%22organic+letters%22+%221523+7052%22+transition+metal+dft&hl=en&as_sdt=0,5&as_vis=1"
22,"L Zhang, Z Liu, X Tian, Y Zi, S Duan, Y Fang…","Transition-Metal-Free C(sp3)–H Coupling of Cycloalkanes Enabled by Single-Electron Transfer and Hydrogen Atom Transfer",2021,"Organic …","ACS Publications","https://pubs.acs.org/doi/abs/10.1021/acs.orglett.1c00135","https://scholar.google.com/scholar?cites=151529533461888233&as_sdt=2005&sciodt=0,5&hl=en",5,"2025-05-19 18:00:53","","10.1021/acs.orglett.1c00135","","",,,,,22,5.50,3,7,4,"… In summary, we have developed a unique transition-metal-free C(sp 3 )–H/C(sp 3 )–H … It is noteworthy that this method does not require transition metals, initiators, or oxidants, enabling …","","https://scholar.google.com/scholar?q=related:6fz5zk5XGgIJ:scholar.google.com/&scioq=source:%22organic+letters%22+%221523+7052%22+transition+metal+dft&hl=en&as_sdt=0,5&as_vis=1"
4,"K Nagai, S Morishitabara, Y Nishi, C Kajimoto…","Experimental and Theoretical Studies on Cobalt-Catalyzed Regioselective Hydrosilylation of Tetrafluorinated Cyclohexa-1, 3-dienes",2023,"Organic …","ACS Publications","https://pubs.acs.org/doi/abs/10.1021/acs.orglett.3c02453","https://scholar.google.com/scholar?cites=2664153643693867414&as_sdt=2005&sciodt=0,5&hl=en",6,"2025-05-19 18:00:53","","10.1021/acs.orglett.3c02453","","",,,,,4,2.00,1,5,2,"… ; via DFT … transition metals. (7) Over the past decade, our group has focused on discovering synthetic methods for producing fluorinated molecules using a first-row transition metal, …","","https://scholar.google.com/scholar?q=related:loFvp5_5-CQJ:scholar.google.com/&scioq=source:%22organic+letters%22+%221523+7052%22+transition+metal+dft&hl=en&as_sdt=0,5&as_vis=1"
28,"Y Yamaguchi, Y Seino, A Suzuki, Y Kamei…","Intramolecular Hydrogen Atom Transfer Hydroarylation of Alkenes toward δ-Lactams Using Cobalt-Photoredox Dual Catalysis",2022,"Organic …","ACS Publications","https://pubs.acs.org/doi/abs/10.1021/acs.orglett.2c00700","https://scholar.google.com/scholar?cites=15097306032433713192&as_sdt=2005&sciodt=0,5&hl=en",7,"2025-05-19 18:00:53","","10.1021/acs.orglett.2c00700","","",,,,,28,9.33,6,5,3,"… The proposed mechanism is supported by experiments and DFT calculations. … that the reaction can be performed under noble-metal-free conditions. The hydroarylation proceeded in …","","https://scholar.google.com/scholar?q=related:KNCS-NhnhNEJ:scholar.google.com/&scioq=source:%22organic+letters%22+%221523+7052%22+transition+metal+dft&hl=en&as_sdt=0,5&as_vis=1"
0,"F Zhang, XF Cheng, X Liang, DD Hu, Q Gao…","… Ni-Catalyzed Three-Component Arylsulfonation Inspired by Density Functional Theory/Time-Dependent Density Functional Theory-Simulated Photoactive Nickel …",2024,"Organic …","ACS Publications","https://pubs.acs.org/doi/abs/10.1021/acs.orglett.4c04222","",8,"2025-05-19 18:00:53","","10.1021/acs.orglett.4c04222","","",,,,,0,0.00,0,6,1,"… transition metal catalytic cycle. However, such a method heavily relies on the usage of noble-metal-… of photosensitizer and transition metal, photoinduced transition metal catalysis does …","https://pubs.acs.org/doi/full/10.1021/acs.orglett.4c04222","https://scholar.google.com/scholar?q=related:k8wQY_dmLOUJ:scholar.google.com/&scioq=source:%22organic+letters%22+%221523+7052%22+transition+metal+dft&hl=en&as_sdt=0,5&as_vis=1"
56,"RN Gaykar, S Bhattacharjee, AT Biju","Transition-Metal-Free Thioamination of Arynes Using Sulfenamides",2019,"Organic Letters","ACS Publications","https://pubs.acs.org/doi/abs/10.1021/acs.orglett.8b03966","https://scholar.google.com/scholar?cites=9082817322759323491&as_sdt=2005&sciodt=0,5&hl=en",9,"2025-05-19 18:00:53","","10.1021/acs.orglett.8b03966","","",,,,,56,9.33,19,3,6,"… A detailed mechanistic study including DFT calculations is ongoing in our laboratory. For an early mechanistic study on the reaction of aryne with ethylene, see:Hayes, DM; Hoffmann, R. …","","https://scholar.google.com/scholar?q=related:Y3_VcjumDH4J:scholar.google.com/&scioq=source:%22organic+letters%22+%221523+7052%22+transition+metal+dft&hl=en&as_sdt=0,5&as_vis=1"
5,"T Liu, KB Gan, RL Zhong, X He, FY Kwong","A Metal-Free and Redox-Neutral Benzylic C–O Cyclization for Succinct Access of Helical Chromenes",2022,"Organic Letters","ACS Publications","https://pubs.acs.org/doi/abs/10.1021/acs.orglett.2c02728","https://scholar.google.com/scholar?cites=18004083540119902491&as_sdt=2005&sciodt=0,5&hl=en",10,"2025-05-19 18:00:53","","10.1021/acs.orglett.2c02728","","",,,,,5,1.67,1,5,3,"… intrigued whether an oxidant-free and transition metal-circumvented protocol would be able … in existing metal-catalyzed ring-closure processes. It is worth noting that DFT calculation …","","https://scholar.google.com/scholar?q=related:G9lNC5da2_kJ:scholar.google.com/&scioq=source:%22organic+letters%22+%221523+7052%22+transition+metal+dft&hl=en&as_sdt=0,5&as_vis=1"
88,"J Ma, K Chen, H Fu, L Zhang, W Wu, H Jiang…","Dual catalysis: proton/metal-catalyzed tandem benzofuran annulation/carbene transfer reaction",2016,"Organic …","ACS Publications","https://pubs.acs.org/doi/abs/10.1021/acs.orglett.6b00260","https://scholar.google.com/scholar?cites=16131979586451101688&as_sdt=2005&sciodt=0,5&hl=en",11,"2025-05-19 18:00:53","","10.1021/acs.orglett.6b00260","","",,,,,88,9.78,13,7,9,"… DFT-based computational studies indicated that the reaction was initiated through the dehydration of o-HBA via a Brønsted acid mediated proton shuttle transition … a transition metal via o…","","https://scholar.google.com/scholar?q=related:-FdFhvZN4N8J:scholar.google.com/&scioq=source:%22organic+letters%22+%221523+7052%22+transition+metal+dft&hl=en&as_sdt=0,5&as_vis=1"
7,"QQ Mu, AX Guo, X Cai, YY Qin, XL Liu, FZ Ye…","Cobalt's Dual Role in Promoting C3-Glycosylation of Indoles: Unraveling Mechanistic Insights",2023,"Organic …","ACS Publications","https://pubs.acs.org/doi/abs/10.1021/acs.orglett.3c02624","https://scholar.google.com/scholar?cites=1889600163234522351&as_sdt=2005&sciodt=0,5&hl=en",12,"2025-05-19 18:00:53","","10.1021/acs.orglett.3c02624","","",,,,,7,3.50,1,7,2,"… Next, we also performed DFT calculations to elucidate the anomerization mechanism (Supporting Information, Figure S13). Upon the formation of the α-anomer, the coordination of the …","","https://scholar.google.com/scholar?q=related:7yQdQVY1ORoJ:scholar.google.com/&scioq=source:%22organic+letters%22+%221523+7052%22+transition+metal+dft&hl=en&as_sdt=0,5&as_vis=1"
6,"Y Toda, K Sato, K Sato, K Nagasaki, H Nakajima…","… Ylides with Aldehydes Catalyzed by a Chiral Binaphthyldiimine-Ni (II) Complex: Enantioselective Synthesis of 1, 3-Dioxolanes and Mechanistic Studies by DFT …",2022,"Organic …","ACS Publications","https://pubs.acs.org/doi/abs/10.1021/acs.orglett.2c01682","https://scholar.google.com/scholar?cites=17273357558188109449&as_sdt=2005&sciodt=0,5&hl=en",13,"2025-05-19 18:00:53","","10.1021/acs.orglett.2c01682","","",,,,,6,2.00,1,6,3,"… DFT calculations of the transition states convincingly explained the high levels of asymmetric induction. A concerted-asynchronous endo approach of benzaldehyde toward a Δ-cis β …","","https://scholar.google.com/scholar?q=related:iW4cVi5Lt-8J:scholar.google.com/&scioq=source:%22organic+letters%22+%221523+7052%22+transition+metal+dft&hl=en&as_sdt=0,5&as_vis=1"
18,"S Han, HS Kim, M Zhang, Y Xia, S Lee","Ni/Cu-Catalyzed Decarboxylative Addition of Alkynoic Acids to Terminal Alkynes for the Synthesis of gem-1,3-Enynes",2019,"Organic Letters","ACS Publications","https://pubs.acs.org/doi/abs/10.1021/acs.orglett.9b01625","https://scholar.google.com/scholar?cites=10911357237645199687&as_sdt=2005&sciodt=0,5&hl=en",14,"2025-05-19 18:00:53","","10.1021/acs.orglett.9b01625","","",,,,,18,3.00,4,5,6,"… In this context, transition metal-catalyzed reactions of … The employment of first-row transition metals like nickel and copper for … On the basis of DFT calculations, we suggested that alkynyl …","https://www.academia.edu/download/87677689/5_OL_Enyne.pdf","https://scholar.google.com/scholar?q=related:R8k6x5jtbJcJ:scholar.google.com/&scioq=source:%22organic+letters%22+%221523+7052%22+transition+metal+dft&hl=en&as_sdt=0,5&as_vis=1"
5,"Q Song, Y Zhao, S Liu, Y Wu, Z Liu","Stereoselective Synthesis of trans-Stilbenes through Silver-Catalyzed Self-Coupling of N-Triftosylhydrazones: An Experimental and Theoretical Study",2023,"Organic Letters","ACS Publications","https://pubs.acs.org/doi/abs/10.1021/acs.orglett.3c01040","https://scholar.google.com/scholar?cites=6341334430734385214&as_sdt=2005&sciodt=0,5&hl=en",15,"2025-05-19 18:00:53","","10.1021/acs.orglett.3c01040","","",,,,,5,2.50,1,5,2,"… on the basis of experimental results and DFT calculations, which further indicates that π–π … After a survey of reaction parameters, including carbene sources, transition metal catalysts, …","","https://scholar.google.com/scholar?q=related:PoDgIRHyAFgJ:scholar.google.com/&scioq=source:%22organic+letters%22+%221523+7052%22+transition+metal+dft&hl=en&as_sdt=0,5&as_vis=1"
4,"XZ Wang, HG Huang, WB Liu","Pd/Cu Dual Metal-Catalyzed Regioselective [2+ 2+ 2] Cycloaddition of Malononitriles with Alkynes to Densely Substituted Pyridines",2024,"Organic Letters","ACS Publications","https://pubs.acs.org/doi/abs/10.1021/acs.orglett.4c02443","https://scholar.google.com/scholar?cites=8744138642953877379&as_sdt=2005&sciodt=0,5&hl=en",16,"2025-05-19 18:00:53","","10.1021/acs.orglett.4c02443","","",,,,,4,4.00,1,3,1,"Transition metal-catalyzed [2 + 2 + 2] cycloaddition of nitriles and two alkynes is an efficient method for assembling pyridines. However, examples employing palladium catalysis have …","","https://scholar.google.com/scholar?q=related:gzcIcMRrWXkJ:scholar.google.com/&scioq=source:%22organic+letters%22+%221523+7052%22+transition+metal+dft&hl=en&as_sdt=0,5&as_vis=1"
8,"R Fang, L Zhou, AM Kirillov, L Yang","DFT Study on Zr-Catalyzed Alkene Hydroaminoalkylation: Origin of Regioselectivity, Diastereoselectivity, and Influence of Substrate",2021,"Organic Letters","ACS Publications","https://pubs.acs.org/doi/abs/10.1021/acs.orglett.0c04119","https://scholar.google.com/scholar?cites=13158280215634491323&as_sdt=2005&sciodt=0,5&hl=en",17,"2025-05-19 18:00:53","","10.1021/acs.orglett.0c04119","","",,,,,8,2.00,2,4,4,"… the late transition metal catalysts, which usually produce linear products, (9) the early transition metal … of target molecules is challenging when early transition metal catalysts are used. …","","https://scholar.google.com/scholar?q=related:u7fx-yOam7YJ:scholar.google.com/&scioq=source:%22organic+letters%22+%221523+7052%22+transition+metal+dft&hl=en&as_sdt=0,5&as_vis=1"
15,"Y An, Y Li, XY Zhang, Z Zhang, XY Gou, YN Ding…","Palladium-Catalyzed C–H Amination/[2 + 3] or [2 + 4] Cyclization via C(sp3 or sp2)–H Activation",2021,"Organic …","ACS Publications","https://pubs.acs.org/doi/abs/10.1021/acs.orglett.1c02964","https://scholar.google.com/scholar?cites=11917834111287971477&as_sdt=2005&sciodt=0,5&hl=en",18,"2025-05-19 18:00:53","","10.1021/acs.orglett.1c02964","","",,,,,15,3.75,2,7,4,"… process for the first time, and verified the mechanism by density functional theory (DFT) calculations. In 2020, we further verified the … Our DFT calculations agree with the experiment. …","","https://scholar.google.com/scholar?q=related:lU5aF_umZKUJ:scholar.google.com/&scioq=source:%22organic+letters%22+%221523+7052%22+transition+metal+dft&hl=en&as_sdt=0,5&as_vis=1"
35,"S Ohno, J Qiu, R Miyazaki, H Aoyama, K Murai…","Ni-Catalyzed cycloisomerization between 3-phenoxy acrylic acid derivatives and alkynes via intramolecular cleavage and formation of the C–O bond to give 2, 3 …",2019,"Organic …","ACS Publications","https://pubs.acs.org/doi/abs/10.1021/acs.orglett.9b03170","https://scholar.google.com/scholar?cites=17720296353765066496&as_sdt=2005&sciodt=0,5&hl=en",19,"2025-05-19 18:00:53","","10.1021/acs.orglett.9b03170","","",,,,,35,5.83,6,6,6,"… This report also described theoretical (DFT) insights into the … The mechanism of this reaction was proposed by DFT … Also, when transition metal catalysts with the property of a π-Lewis …","http://pstorage-acs-6854636.s3.amazonaws.com/17851514/ol9b03170_si_001.pdf","https://scholar.google.com/scholar?q=related:AAfRyKUj6_UJ:scholar.google.com/&scioq=source:%22organic+letters%22+%221523+7052%22+transition+metal+dft&hl=en&as_sdt=0,5&as_vis=1"
32,"RJ Maza, E Davenport, N Miralles, JJ Carbó…","Transition-metal-free allylic borylation of 1, 3-dienes",2019,"Organic …","ACS Publications","https://pubs.acs.org/doi/abs/10.1021/acs.orglett.9b00531","https://scholar.google.com/scholar?cites=3146161887630843382&as_sdt=2005&sciodt=0,5&hl=en",20,"2025-05-19 18:00:53","","10.1021/acs.orglett.9b00531","","",,,,,32,5.33,6,5,6,"… This work explains the reactivity of diboron reagents with 1,3-dienes in a transition-metal-free … DFT calculations show that the distribution of charge in the allylic anion intermediate …","","https://scholar.google.com/scholar?q=related:9t0bVpFpqSsJ:scholar.google.com/&scioq=source:%22organic+letters%22+%221523+7052%22+transition+metal+dft&hl=en&as_sdt=0,5&as_vis=1"
3,"T Huang, M Suleman, Z Xu, L Wei, Y Yang…","Transition-Metal-Free Sulfoximidation of Sulfonylhydrazones for the Synthesis of N-Sulfanylidenehydrazonamides",2024,"Organic …","ACS Publications","https://pubs.acs.org/doi/abs/10.1021/acs.orglett.4c02170","https://scholar.google.com/scholar?cites=18012939555232393153&as_sdt=2005&sciodt=0,5&hl=en",21,"2025-05-19 18:00:53","","10.1021/acs.orglett.4c02170","","",,,,,3,3.00,1,6,1,"… Herein, we report a transition-metal-free C–H bond sulfoximidation protocol of sulfonyl hydrazones with hypervalent iodine(III) reagents. A library of novel N-…","","https://scholar.google.com/scholar?q=related:wac1vhbR-vkJ:scholar.google.com/&scioq=source:%22organic+letters%22+%221523+7052%22+transition+metal+dft&hl=en&as_sdt=0,5&as_vis=1"
15,"A Hazra, R Dey, A Kushwaha, TJ Dhilip Kumar…","Organocatalytic Activation of Donor–Acceptor Cyclopropanes: A Tandem (3+ 3)-Cycloaddition/Aryl Migration toward the Synthesis of Enantioenriched …",2023,"Organic …","ACS Publications","https://pubs.acs.org/doi/abs/10.1021/acs.orglett.3c01804","https://scholar.google.com/scholar?cites=3022810633171095201&as_sdt=2005&sciodt=0,5&hl=en",22,"2025-05-19 18:00:53","","10.1021/acs.orglett.3c01804","","",,,,,15,7.50,3,5,2,"… kinetic resolution, and control experiments and DFT calculations unveiled that 1,3-aryl migration was concerted and intramolecular and proceeds via a four-membered transition state. …","","https://scholar.google.com/scholar?q=related:oc5vXUEu8ykJ:scholar.google.com/&scioq=source:%22organic+letters%22+%221523+7052%22+transition+metal+dft&hl=en&as_sdt=0,5&as_vis=1"
16,"AV Agafonova, IA Smetanin, NV Rostovskii…","Synthesis of 2-(2-Pyridyl)-2H-azirines via Metal-Free C–C Cross-Coupling of Bromoazirines with 2-Stannylpyridines",2021,"Organic …","ACS Publications","https://pubs.acs.org/doi/abs/10.1021/acs.orglett.1c03060","https://scholar.google.com/scholar?cites=13523694703294528097&as_sdt=2005&sciodt=0,5&hl=en",23,"2025-05-19 18:00:53","","10.1021/acs.orglett.1c03060","","",,,,,16,4.00,4,4,4,"… to DFT … transition metal catalysis and is obviously inherent only in 2H-azirine derivatives, which are unreactive in classical cross-coupling reactions. Although quite a few transition metal-…","","https://scholar.google.com/scholar?q=related:YbqzWK7QrbsJ:scholar.google.com/&scioq=source:%22organic+letters%22+%221523+7052%22+transition+metal+dft&hl=en&as_sdt=0,5&as_vis=1"
168,"L Zhou, S Tang, X Qi, C Lin, K Liu, C Liu, Y Lan…","Transition-Metal-Assisted Radical/Radical Cross-Coupling: A New Strategy to the Oxidative C(sp3)–H/N–H Cross-Coupling",2014,"Organic …","ACS Publications","https://pubs.acs.org/doi/abs/10.1021/ol501485f","https://scholar.google.com/scholar?cites=16092825986046755410&as_sdt=2005&sciodt=0,5&hl=en",24,"2025-05-19 18:00:53","","10.1021/ol501485f","","",,,,,168,15.27,21,8,11,"… Experiments and DFT calculations revealed that transition-metal catalyst could lower the reactivity of the generated nitrogen radical by the coordination of the transition metal, which …","https://drive.google.com/file/d/17rtFf3IJYUlxwBXFGE9LoxhY0bFpVqES/view","https://scholar.google.com/scholar?q=related:UgJ-ivgzVd8J:scholar.google.com/&scioq=source:%22organic+letters%22+%221523+7052%22+transition+metal+dft&hl=en&as_sdt=0,5&as_vis=1"
1,"L Kan, Y Zhou, LQ Kong, ZX Yu","Cobalt-Catalyzed Intramolecular [4+ 2] Cycloaddition of Cyclopropyl-Capped Dienes with Alkynes/Alkenes/Allene and Reaction Mechanism",2024,"Organic Letters","ACS Publications","https://pubs.acs.org/doi/abs/10.1021/acs.orglett.4c03772","https://scholar.google.com/scholar?cites=15905851312419029379&as_sdt=2005&sciodt=0,5&hl=en",25,"2025-05-19 18:00:53","","10.1021/acs.orglett.4c03772","","",,,,,1,1.00,0,4,1,"… A density functional theory study on the reaction mechanisms is also reported here. … We then turned our attention to screen non-noble transition metal catalysts, such as nickel and cobalt …","https://www.chem.pku.edu.cn/zxyu/docs/2024-12/20241224162955943274.pdf","https://scholar.google.com/scholar?q=related:g8Hq7n7vvNwJ:scholar.google.com/&scioq=source:%22organic+letters%22+%221523+7052%22+transition+metal+dft&hl=en&as_sdt=0,5&as_vis=1"
4,"BH Zhu, CH Shen, ML Nie, F Zheng, C Huang…","Highly Site-Selective Oxidative Cyclization of Ene-ynamides via Non-Noble-Metal Catalysis: Access to Functionalized Lactams",2022,"Organic …","ACS Publications","https://pubs.acs.org/doi/abs/10.1021/acs.orglett.2c02871","https://scholar.google.com/scholar?cites=9488764637450973486&as_sdt=2005&sciodt=0,5&hl=en",26,"2025-05-19 18:00:53","","10.1021/acs.orglett.2c02871","","",,,,,4,1.33,1,6,3,"… Moreover, density functional theory (DFT) calculations indicate that this protocol probably … (3,4) Among these methods, the catalytic oxidative cyclization of enynes using transition metals …","","https://scholar.google.com/scholar?q=related:LrGNBCrdroMJ:scholar.google.com/&scioq=source:%22organic+letters%22+%221523+7052%22+transition+metal+dft&hl=en&as_sdt=0,5&as_vis=1"
14,"N Wang, X Yan, ZT Hu, Y Feng, L Zhu, ZH Chen…","Intramolecular H-bonds in an organocatalyst enabled an asymmetric michael/alkylation cascade reaction to construct spirooxindoles incorporating a densely …",2022,"Organic …","ACS Publications","https://pubs.acs.org/doi/abs/10.1021/acs.orglett.2c03578","https://scholar.google.com/scholar?cites=9309949431327974759&as_sdt=2005&sciodt=0,5&hl=en",27,"2025-05-19 18:00:53","","10.1021/acs.orglett.2c03578","","",,,,,14,4.67,2,7,3,"… Density functional theory (DFT) calculations indicated that the tentative intramolecular … Furthermore, DFT calculations demonstrated that the intramolecular hydrogen bonds in the chiral …","","https://scholar.google.com/scholar?q=related:Z2Une66VM4EJ:scholar.google.com/&scioq=source:%22organic+letters%22+%221523+7052%22+transition+metal+dft&hl=en&as_sdt=0,5&as_vis=1"
30,"C Niu, Y Zhou, Q Chen, Y Zhu, S Tang, ZX Yu…","Atroposelective Synthesis of N-Arylindoles via Enantioselective N–H Bond Insertion",2022,"Organic …","ACS Publications","https://pubs.acs.org/doi/abs/10.1021/acs.orglett.2c03003","https://scholar.google.com/scholar?cites=16586663366419276193&as_sdt=2005&sciodt=0,5&hl=en",28,"2025-05-19 18:00:53","","10.1021/acs.orglett.2c03003","","",,,,,30,10.00,4,7,3,"… Finally, DFT calculations were performed to study the key transition states of the NHI reaction (Figure 1). Rh carbenoid 2-Rh is generated from the reaction of 2 with Rh catalyst. Then 2-…","https://www.chem.pku.edu.cn/zxyu/docs/2022-10/20221017101210497390.pdf","https://scholar.google.com/scholar?q=related:oeFnrHOqL-YJ:scholar.google.com/&scioq=source:%22organic+letters%22+%221523+7052%22+transition+metal+dft&hl=en&as_sdt=0,5&as_vis=1"
2,"C Zhang, Y Cui, X Zhou, Y Pan, J Zhang, D Hu…","Pd-Catalyzed Decarboxylative Negishi Coupling of Zinc Aryl Carboxylates with Arylthianthrenium Salts",2025,"Organic …","ACS Publications","https://pubs.acs.org/doi/abs/10.1021/acs.orglett.5c00408","https://scholar.google.com/scholar?cites=13882927466930133280&as_sdt=2005&sciodt=0,5&hl=en",29,"2025-05-19 18:00:53","","10.1021/acs.orglett.5c00408","","",,,,,2,2.00,0,7,1,"… In recent years, the advent of transition metal-catalyzed … C-heteroatom bonds through transition metal or photocatalysis in … Based on these control experiments and DFT calculations (for …","","https://scholar.google.com/scholar?q=related:IFni7PkQqsAJ:scholar.google.com/&scioq=source:%22organic+letters%22+%221523+7052%22+transition+metal+dft&hl=en&as_sdt=0,5&as_vis=1"
97,"MB Chaudhari, Y Sutar, S Malpathak, A Hazra…","Transition-metal-free C–H hydroxylation of carbonyl compounds",2017,"Organic …","ACS Publications","https://pubs.acs.org/doi/abs/10.1021/acs.orglett.7b01616","https://scholar.google.com/scholar?cites=12653464283931920052&as_sdt=2005&sciodt=0,5&hl=en",30,"2025-05-19 18:00:53","","10.1021/acs.orglett.7b01616","","",,,,,97,12.13,19,5,8,"… oxidants or transition metals or metal oxide and additive (phosphine as a reductant) which were the drawback for above protocols. Despite their success for transition-metal-catalyzed α-…","https://www.academia.edu/download/92946933/acs.orglett.7b0161620221024-1-iqkgno.pdf","https://scholar.google.com/scholar?q=related:tMbarbkimq8J:scholar.google.com/&scioq=source:%22organic+letters%22+%221523+7052%22+transition+metal+dft&hl=en&as_sdt=0,5&as_vis=1"
