Cites,Authors,Title,Year,Source,Publisher,ArticleURL,CitesURL,GSRank,QueryDate,Type,DOI,ISSN,CitationURL,Volume,Issue,StartPage,EndPage,ECC,CitesPerYear,CitesPerAuthor,AuthorCount,Age,Abstract,FullTextURL,RelatedURL
48,"AG Tathe, NT Patil","Ligand-Enabled Gold-Catalyzed C(sp2)–S Cross-Coupling Reactions",2022,"Organic Letters","ACS Publications","https://pubs.acs.org/doi/abs/10.1021/acs.orglett.2c01692","https://scholar.google.com/scholar?cites=6679288446527802970&as_sdt=2005&sciodt=0,5&hl=en",741,"2025-05-19 18:00:53","","10.1021/acs.orglett.2c01692","","",,,,,48,16.00,24,2,3,"Herein we report C(sp 2 )–S cross-coupling reactions of aryl iodides and arylsulfonyl hydrazides under ligand-enabled, Au(I)/Au(III) redox catalysis. This strategy operates under mild …","","https://scholar.google.com/scholar?q=related:Wg6pJ3SZsVwJ:scholar.google.com/&scioq=source:%22organic+letters%22+%221523+7052%22+transition+metal+dft&hl=en&as_sdt=0,5&as_vis=1"
116,"A Dzudza, TJ Marks","Efficient intramolecular hydroalkoxylation/cyclization of unactivated alkenols mediated by lanthanide triflate ionic liquids",2009,"Organic Letters","ACS Publications","https://pubs.acs.org/doi/abs/10.1021/ol8029559","https://scholar.google.com/scholar?cites=6548491747974934175&as_sdt=2005&sciodt=0,5&hl=en",742,"2025-05-19 18:00:53","","10.1021/ol8029559","","",,,,,116,7.25,58,2,16,"… (7) The above observation argues for development in the present case of a transition state … This suggests a transition state configuration in which the aryl-functionalized hydroxyalkene …","","https://scholar.google.com/scholar?q=related:n26fpIzq4FoJ:scholar.google.com/&scioq=source:%22organic+letters%22+%221523+7052%22+transition+metal+dft&hl=en&as_sdt=0,5&as_vis=1"
2,"W Guo, EE Robinson, RJ Thomson, DJ Tantillo","Heavy Atom Quantum Mechanical Tunneling in Total Synthesis",2024,"Organic Letters","ACS Publications","https://pubs.acs.org/doi/abs/10.1021/acs.orglett.4c01152","https://scholar.google.com/scholar?cites=14186485737319516984&as_sdt=2005&sciodt=0,5&hl=en",743,"2025-05-19 18:00:53","","10.1021/acs.orglett.4c01152","","",,,,,2,2.00,1,4,1,"… to the rates of several radical coupling reactions between carbon sp 2 centers used as key steps in natural product total syntheses were computed using density functional theory. …","","https://scholar.google.com/scholar?q=related:OEsTaJ2F4MQJ:scholar.google.com/&scioq=source:%22organic+letters%22+%221523+7052%22+transition+metal+dft&hl=en&as_sdt=0,5&as_vis=1"
4,"ZH Dong, S Li, T Long, J Zhan, C Ruan, X Yan…","Copper-Catalyzed Enantioselective 1, 2-Allylation of Azadienes with Allylboronates",2024,"Organic …","ACS Publications","https://pubs.acs.org/doi/abs/10.1021/acs.orglett.4c00869","https://scholar.google.com/scholar?cites=14852567496100904937&as_sdt=2005&sciodt=0,5&hl=en",744,"2025-05-19 18:00:53","","10.1021/acs.orglett.4c00869","","",,,,,4,4.00,1,7,1,"… By taking advantage of the ability of nitrogen ligated metal complexes, we successfully … Extensive DFT calculations were carried out to elucidate the origins of high regioselectivity (…","","https://scholar.google.com/scholar?q=related:6X-bB3LrHs4J:scholar.google.com/&scioq=source:%22organic+letters%22+%221523+7052%22+transition+metal+dft&hl=en&as_sdt=0,5&as_vis=1"
1,"S Kundu, C Ghosh, A Metya, A Banerjee…","Carbazoquinocin Analogues as Small Molecule Biomimetic Organocatalysts in Dehydrogenative Coupling of Amines",2024,"Organic Letters","ACS Publications","https://pubs.acs.org/doi/abs/10.1021/acs.orglett.4c00229","https://scholar.google.com/scholar?cites=11049791242666932541&as_sdt=2005&sciodt=0,5&hl=en",745,"2025-05-19 18:00:53","","10.1021/acs.orglett.4c00229","","",,,,,1,1.00,0,5,1,"… Furthermore, in-depth density functional theory (DFT) calculations were performed on the rest of the three possible H-transfer pathways (Scheme 5). A 26.0 kcal/mol energy barrier (for …","","https://scholar.google.com/scholar?q=related:PXliRZe-WJkJ:scholar.google.com/&scioq=source:%22organic+letters%22+%221523+7052%22+transition+metal+dft&hl=en&as_sdt=0,5&as_vis=1"
1,"Y Hashimoto, WY Kong, DJ Tantillo","Discovery of a Formal Dyotropic Rearrangement during Acid-Mediated Dioxabicyclo [4.2. 1] nonanone Formation",2024,"Organic Letters","ACS Publications","https://pubs.acs.org/doi/abs/10.1021/acs.orglett.4c01616","https://scholar.google.com/scholar?cites=3593843236375957787&as_sdt=2005&sciodt=0,5&hl=en",746,"2025-05-19 18:00:53","","10.1021/acs.orglett.4c01616","","",,,,,1,1.00,0,3,1,"A new reaction mechanism for the construction of dioxabicyclo[4.2.1]nonanone skeletons via a cation cascade has been proposed and examined by DFT and ab initio computations. …","","https://scholar.google.com/scholar?q=related:GxGh6mHl3zEJ:scholar.google.com/&scioq=source:%22organic+letters%22+%221523+7052%22+transition+metal+dft&hl=en&as_sdt=0,5&as_vis=1"
79,"T van Leeuwen, J Pol, D Roke, SJ Wezenberg…","Visible-light excitation of a molecular motor with an extended aromatic core",2017,"Organic …","ACS Publications","https://pubs.acs.org/doi/abs/10.1021/acs.orglett.7b00317","https://scholar.google.com/scholar?cites=3693334157441834023&as_sdt=2005&sciodt=0,5&hl=en",747,"2025-05-19 18:00:53","","10.1021/acs.orglett.7b00317","","",,,,,79,9.88,16,5,8,"… ⧧ G = 93.9 ± 1 kJ/mol) and motor 1 (Δ ⧧ G = 86 kJ/mol) reveals that the speed of rotation of motor 2 is slightly lower due to the structural modification, as anticipated on the basis of DFT …","https://pubs.acs.org/doi/full/10.1021/acs.orglett.7b00317","https://scholar.google.com/scholar?q=related:JxwjG9lbQTMJ:scholar.google.com/&scioq=source:%22organic+letters%22+%221523+7052%22+transition+metal+dft&hl=en&as_sdt=0,5&as_vis=1"
54,"B Li, AE Wendlandt, SS Stahl","Replacement of Stoichiometric DDQ with a Low Potential o-Quinone Catalyst Enabling Aerobic Dehydrogenation of Tertiary Indolines in Pharmaceutical …",2019,"Organic letters","ACS Publications","https://pubs.acs.org/doi/abs/10.1021/acs.orglett.9b00111","https://scholar.google.com/scholar?cites=7832978132573899882&as_sdt=2005&sciodt=0,5&hl=en",748,"2025-05-19 18:00:53","","10.1021/acs.orglett.9b00111","","",,,,,54,9.00,18,3,6,"A transition-metal/quinone complex, [Ru(phd) 3 ] 2+ (phd = 1,10-phenanthroline-5,6-dione), is shown to be effective for aerobic dehydrogenation of 3 indolines to the corresponding …","https://pmc.ncbi.nlm.nih.gov/articles/PMC6413530/pdf/nihms-1012106.pdf","https://scholar.google.com/scholar?q=related:akx4VRxUtGwJ:scholar.google.com/&scioq=source:%22organic+letters%22+%221523+7052%22+transition+metal+dft&hl=en&as_sdt=0,5&as_vis=1"
18,"K Gao, M Xu, C Cai, Y Ding, J Chen, B Liu, Y Xia","Cobalt-catalyzed reductive C–O bond cleavage of lignin β-O-4 ketone models via in situ generation of the cobalt–boryl species",2020,"Organic Letters","ACS Publications","https://pubs.acs.org/doi/abs/10.1021/acs.orglett.0c02117","https://scholar.google.com/scholar?cites=8538709621108086752&as_sdt=2005&sciodt=0,5&hl=en",749,"2025-05-19 18:00:53","","10.1021/acs.orglett.0c02117","","",,,,,18,3.60,3,7,5,"… -abundant transition metal–boryl (M–B) complexes generated in situ from a mixture of metal … DFT calculations were carried out to improve our understanding (Figures 2 and 3). Upon the …","","https://scholar.google.com/scholar?q=related:4JdbDimXf3YJ:scholar.google.com/&scioq=source:%22organic+letters%22+%221523+7052%22+transition+metal+dft&hl=en&as_sdt=0,5&as_vis=1"
12,"R Tomifuji, S Masuda, T Kurahashi, S Matsubara","Cationic Cobalt Porphyrin-Catalyzed Allylation of Aldehydes with Allyltrimethylsilanes",2019,"Organic Letters","ACS Publications","https://pubs.acs.org/doi/abs/10.1021/acs.orglett.9b01303","https://scholar.google.com/scholar?cites=11476808384133390713&as_sdt=2005&sciodt=0,5&hl=en",750,"2025-05-19 18:00:53","","10.1021/acs.orglett.9b01303","","",,,,,12,2.00,3,4,6,"… we carried out density functional theory (DFT) calculations to … by Co K-edge XAS analysis and DFT calculations. Moreover, … activity of first-row transition metals. Studies in this regard are …","","https://scholar.google.com/scholar?q=related:eeF-K2vQRZ8J:scholar.google.com/&scioq=source:%22organic+letters%22+%221523+7052%22+transition+metal+dft&hl=en&as_sdt=0,5&as_vis=1"
11,"S Hong, B Kweon, W Lee, S Chang, S Hong","Deconstructive Pyridylation of Unstrained Cyclic Amines through a One-Pot Umpolung Approach",2023,"Organic Letters","ACS Publications","https://pubs.acs.org/doi/abs/10.1021/acs.orglett.3c00922","https://scholar.google.com/scholar?cites=4827385660648404952&as_sdt=2005&sciodt=0,5&hl=en",751,"2025-05-19 18:00:53","","10.1021/acs.orglett.3c00922","","",,,,,11,5.50,2,5,2,"… (8) To eliminate the use of transition metals and oxidants, difluorocarbene reagents have … To elucidate the origin of selectivity, we performed density functional theory (DFT) calculations, …","","https://scholar.google.com/scholar?q=related:2DfDiK5R_kIJ:scholar.google.com/&scioq=source:%22organic+letters%22+%221523+7052%22+transition+metal+dft&hl=en&as_sdt=0,5&as_vis=1"
30,"L Zhang, Z Huang, D Dai, Y Xiao, K Lei, S Tan…","Thio-bisnaphthalimides as heavy-atom-free photosensitizers with efficient singlet oxygen generation and large stokes shifts: synthesis and properties",2016,"Organic …","ACS Publications","https://pubs.acs.org/doi/abs/10.1021/acs.orglett.6b02902","https://scholar.google.com/scholar?cites=14269765030875021155&as_sdt=2005&sciodt=0,5&hl=en",752,"2025-05-19 18:00:53","","10.1021/acs.orglett.6b02902","","",,,,,30,3.33,4,7,9,"… ISC process is to introduce heavy atom effects, ie transition metal complexes with Ru(II), Ir(III… optimized by time-dependent density functional theory (TD-DFT) calculations at the B3LYP/6-…","http://pstorage-acs-6854636.s3.amazonaws.com/6500160/ol6b02902_si_001.pdf","https://scholar.google.com/scholar?q=related:Y7-Y7bBjCMYJ:scholar.google.com/&scioq=source:%22organic+letters%22+%221523+7052%22+transition+metal+dft&hl=en&as_sdt=0,5&as_vis=1"
19,"X Ren, L Zhu, Y Yu, ZX Wang, X Huang","Understanding the Chemoselectivity in Palladium-Catalyzed Three-Component Reaction of o-Bromobenzaldehyde, N-Tosylhydrazone, and Methanol",2020,"Organic Letters","ACS Publications","https://pubs.acs.org/doi/abs/10.1021/acs.orglett.0c01040","https://scholar.google.com/scholar?cites=4437032447539597841&as_sdt=2005&sciodt=0,5&hl=en",753,"2025-05-19 18:00:53","","10.1021/acs.orglett.0c01040","","",,,,,19,3.80,4,5,5,"… In summary, combing DFT calculations and experiments, we have studied the catalytic mechanisms of the Pd-catalyzed three-component coupling of o-bromobenzaldehyde, N-…","","https://scholar.google.com/scholar?q=related:EdJ6rICBkz0J:scholar.google.com/&scioq=source:%22organic+letters%22+%221523+7052%22+transition+metal+dft&hl=en&as_sdt=0,5&as_vis=1"
10,"Y Zong, Y Tang, GC Tsui","Rhodium (I)-catalyzed defluorinative coupling of boronic acids with monofluoroalkenes",2022,"Organic Letters","ACS Publications","https://pubs.acs.org/doi/abs/10.1021/acs.orglett.2c02294","https://scholar.google.com/scholar?cites=14795129221891947258&as_sdt=2005&sciodt=0,5&hl=en",754,"2025-05-19 18:00:53","","10.1021/acs.orglett.2c02294","","",,,,,10,3.33,3,3,3,"… Organic reactions catalyzed by transition metals have … as one of the most versatile transition metals in organic synthesis. (… On the basis of literature evidence and DFT calculations for the …","","https://scholar.google.com/scholar?q=related:-vrerKPbUs0J:scholar.google.com/&scioq=source:%22organic+letters%22+%221523+7052%22+transition+metal+dft&hl=en&as_sdt=0,5&as_vis=1"
19,"R Pertschi, P Wagner, N Ghosh, V Gandon…","Gold (I)-catalyzed synthesis of furopyrans: insight into hetero-Diels–Alder reactions",2019,"Organic …","ACS Publications","https://pubs.acs.org/doi/abs/10.1021/acs.orglett.9b02228","https://scholar.google.com/scholar?cites=1140190169582819211&as_sdt=2005&sciodt=0,5&hl=en",755,"2025-05-19 18:00:53","","10.1021/acs.orglett.9b02228","","",,,,,19,3.17,4,5,6,"… DFT calculations provide the mechanistic basis of this … DFT calculations provide the mechanistic insight of this … software package at the B3LYP level of DFT. The effective-core potential …","https://hal.science/hal-02989337/file/manuscript.pdf","https://scholar.google.com/scholar?q=related:i1dgEuvE0g8J:scholar.google.com/&scioq=source:%22organic+letters%22+%221523+7052%22+transition+metal+dft&hl=en&as_sdt=0,5&as_vis=1"
35,"F Beltran, I Fabre, I Ciofini, L Miesch","Direct spirocyclization from keto-sulfonamides: an approach to azaspiro compounds",2017,"Organic Letters","ACS Publications","https://pubs.acs.org/doi/abs/10.1021/acs.orglett.7b02216","https://scholar.google.com/scholar?cites=10179324159325713741&as_sdt=2005&sciodt=0,5&hl=en",756,"2025-05-19 18:00:53","","10.1021/acs.orglett.7b02216","","",,,,,35,4.38,9,4,8,"… pathway, calculations based on Density Functional Theory (DFT) were performed (computational details in the Supporting Information (SI)). DFT calculations have been shown to be …","https://hal.science/hal-03511227/document","https://scholar.google.com/scholar?q=related:TTUp-mM5RI0J:scholar.google.com/&scioq=source:%22organic+letters%22+%221523+7052%22+transition+metal+dft&hl=en&as_sdt=0,5&as_vis=1"
24,"MH Li, XJ Si, H Zhang, D Yang, JL Niu, MP Song","Directed Cobalt-Catalyzed C–H Activation to Form C–C and C–O Bonds in One Pot via Three-Component Coupling",2021,"Organic Letters","ACS Publications","https://pubs.acs.org/doi/abs/10.1021/acs.orglett.0c04122","https://scholar.google.com/scholar?cites=2261306127130625278&as_sdt=2005&sciodt=0,5&hl=en",757,"2025-05-19 18:00:53","","10.1021/acs.orglett.0c04122","","",,,,,24,6.00,4,6,4,"… Transition metal catalyzed C–H bond activation has emerged as a powerful strategy to … a great scope of the reactions mainly relies on precious transition metal catalysts (such as Rh, (2) …","","https://scholar.google.com/scholar?q=related:_gQJFPHFYR8J:scholar.google.com/&scioq=source:%22organic+letters%22+%221523+7052%22+transition+metal+dft&hl=en&as_sdt=0,5&as_vis=1"
41,"YN Kotovshchikov, GV Latyshev, MA Navasardyan…","Annulation-induced cascade transformation of 5-iodo-1, 2, 3-triazoles to 2-(1-aminoalkyl) benzoxazoles",2018,"Organic …","ACS Publications","https://pubs.acs.org/doi/abs/10.1021/acs.orglett.8b01755","https://scholar.google.com/scholar?cites=1356684913121689729&as_sdt=2005&sciodt=0,5&hl=en",758,"2025-05-19 18:00:53","","10.1021/acs.orglett.8b01755","","",,,,,41,5.86,10,4,7,"… 4 by transition metals, followed by insertion of the metallocarbenoid into an NH bond. … Based on the foregoing observations and DFT calculations for model substrates, we propose the …","","https://scholar.google.com/scholar?q=related:gQDAjr3p0xIJ:scholar.google.com/&scioq=source:%22organic+letters%22+%221523+7052%22+transition+metal+dft&hl=en&as_sdt=0,5&as_vis=1"
93,"X Tan, Y Wang, Y Liu, F Wang, L Shi, KH Lee…","Highly efficient tetradentate ruthenium catalyst for ester reduction: especially for hydrogenation of fatty acid esters",2015,"Organic …","ACS Publications","https://pubs.acs.org/doi/abs/10.1021/ol503456j","https://scholar.google.com/scholar?cites=5541893914074390848&as_sdt=2005&sciodt=0,5&hl=en",759,"2025-05-19 18:00:53","","10.1021/ol503456j","","",,,,,93,9.30,13,7,10,"… In order to gain more mechanistic insight for the high efficiency for catalytic hydrogenation of using catalyst III, we carried out DFT calculations based on the proposed mechanism for …","http://pstorage-acs-6854636.s3.amazonaws.com/3844225/ol503456j_si_001.pdf","https://scholar.google.com/scholar?q=related:QKFNEyfD6EwJ:scholar.google.com/&scioq=source:%22organic+letters%22+%221523+7052%22+transition+metal+dft&hl=en&as_sdt=0,5&as_vis=1"
8,"CR Youshaw, MH Yang, AR Gogoi…","Iron-Catalyzed Enantioselective Multicomponent Cross-Couplings of α-Boryl Radicals",2023,"Organic …","ACS Publications","https://pubs.acs.org/doi/abs/10.1021/acs.orglett.3c03387","https://scholar.google.com/scholar?cites=6457475515595005578&as_sdt=2005&sciodt=0,5&hl=en",760,"2025-05-19 18:00:53","","10.1021/acs.orglett.3c03387","","",,,,,8,4.00,2,4,2,"Despite recent interest in the development of iron-catalyzed transformations, methods that use iron-based catalysts capable of controlling the enantioselectivity in carbon–carbon cross-…","https://pubs.acs.org/doi/full/10.1021/acs.orglett.3c03387","https://scholar.google.com/scholar?q=related:ip7SrMSPnVkJ:scholar.google.com/&scioq=source:%22organic+letters%22+%221523+7052%22+transition+metal+dft&hl=en&as_sdt=0,5&as_vis=1"
24,"Z Huang, Q Zhang, Q Zhao, W Yu, J Chang","Synthesis of 2-Imino-1,3,4-thiadiazoles from Hydrazides and Isothiocyanates via Sequential Oxidation and P(NMe2)3-Mediated Annulation Reactions",2020,"Organic Letters","ACS Publications","https://pubs.acs.org/doi/abs/10.1021/acs.orglett.0c01393","https://scholar.google.com/scholar?cites=5157543009595278459&as_sdt=2005&sciodt=0,5&hl=en",761,"2025-05-19 18:00:53","","10.1021/acs.orglett.0c01393","","",,,,,24,4.80,5,5,5,"… The reaction does not require transition metals and is a simple, scalable operation with … It does not require transition metals and is operationally simple, requires no purification of the …","","https://scholar.google.com/scholar?q=related:e8S5mApGk0cJ:scholar.google.com/&scioq=source:%22organic+letters%22+%221523+7052%22+transition+metal+dft&hl=en&as_sdt=0,5&as_vis=1"
21,"Y Zhang, D Duan, Y Zhong, XA Guo, J Guo, J Gou…","Fe (iii)-catalyzed aerobic intramolecular N–N coupling of aliphatic azides with amines",2019,"Organic …","ACS Publications","https://pubs.acs.org/doi/abs/10.1021/acs.orglett.9b01396","https://scholar.google.com/scholar?cites=11641379818138653167&as_sdt=2005&sciodt=0,5&hl=en",762,"2025-05-19 18:00:53","","10.1021/acs.orglett.9b01396","","",,,,,21,3.50,3,7,6,"… in situ metal complex formation and N–N cyclization, we initially investigated the reaction of benzyl protected linear γ-azidoamine 1a in the presence of various transition metal … , a DFT …","","https://scholar.google.com/scholar?q=related:71GOE0R9jqEJ:scholar.google.com/&scioq=source:%22organic+letters%22+%221523+7052%22+transition+metal+dft&hl=en&as_sdt=0,5&as_vis=1"
27,"A Singh, A Dey, K Pal, OP Dash, CMR Volla","Pd (II)-Catalyzed Transient Directing Group-Assisted Regioselective Diverse C4–H Functionalizations of Indoles",2022,"Organic Letters","ACS Publications","https://pubs.acs.org/doi/abs/10.1021/acs.orglett.2c00320","https://scholar.google.com/scholar?cites=7413456346861521276&as_sdt=2005&sciodt=0,5&hl=en",763,"2025-05-19 18:00:53","","10.1021/acs.orglett.2c00320","","",,,,,27,9.00,5,5,3,"… Accordingly, by the judicious choice of a directing group and a transition metal catalyst, alkenylation, arylation, allylation, and other functionalizations have been demonstrated at C4-…","","https://scholar.google.com/scholar?q=related:fMmL8ETj4WYJ:scholar.google.com/&scioq=source:%22organic+letters%22+%221523+7052%22+transition+metal+dft&hl=en&as_sdt=0,5&as_vis=1"
18,"H Chen, X Tang, H Ye, X Wang, H Zheng, Y Hai…","Effects of n→ π* Orbital Interactions on Molecular Rotors: The Control and Switching of Rotational Pathway and Speed",2020,"Organic …","ACS Publications","https://pubs.acs.org/doi/abs/10.1021/acs.orglett.0c03969","https://scholar.google.com/scholar?cites=15924851079543721483&as_sdt=2005&sciodt=0,5&hl=en",764,"2025-05-19 18:00:53","","10.1021/acs.orglett.0c03969","","",,,,,18,3.60,3,7,5,"… The trend of DFT barriers is consistent with the experimental data. (20) … Moreover, 3A gave a lower DFT barrier than 3O, corroborating the experimental data and the acceleration of …","","https://scholar.google.com/scholar?q=related:Cw4z8a5vAN0J:scholar.google.com/&scioq=source:%22organic+letters%22+%221523+7052%22+transition+metal+dft&hl=en&as_sdt=0,5&as_vis=1"
25,"VK Rawat, H Hayashi, H Katsuyama…","Revisiting the Electrochemical Carboxylation of Naphthalene with CO2: Selective Monocarboxylation of 2-Substituted Naphthalenes",2023,"Organic …","ACS Publications","https://pubs.acs.org/doi/abs/10.1021/acs.orglett.3c01033","https://scholar.google.com/scholar?cites=4245284193045325510&as_sdt=2005&sciodt=0,5&hl=en",765,"2025-05-19 18:00:53","","10.1021/acs.orglett.3c01033","","",,,,,25,12.50,6,4,2,"… more traditional carboxylation methods that use expensive and often scarce transition metals in the presence of a stoichiometric amount of metal reductants. (3) Among the reported …","","https://scholar.google.com/scholar?q=related:xiYMKXtH6joJ:scholar.google.com/&scioq=source:%22organic+letters%22+%221523+7052%22+transition+metal+dft&hl=en&as_sdt=0,5&as_vis=1"
27,"RK Jha, A Upadhyay, Kanika, S Jain, N KA…","Light-Driven Carbon–Carbon Coupling of α-sp3–CH of Aliphatic Alcohols with sp2–CH Bond of 1,4-Naphthoquinones",2022,"Organic …","ACS Publications","https://pubs.acs.org/doi/abs/10.1021/acs.orglett.2c03066","https://scholar.google.com/scholar?cites=18006731647855680482&as_sdt=2005&sciodt=0,5&hl=en",766,"2025-05-19 18:00:53","","10.1021/acs.orglett.2c03066","","",,,,,27,9.00,5,6,3,"… ; however, halogenating reagents or transition metals are required to activate the C–H bonds. (7) … DFT calculations have also been performed to predict a more feasible path for HAT. …","","https://scholar.google.com/scholar?q=related:4ts4rAfD5PkJ:scholar.google.com/&scioq=source:%22organic+letters%22+%221523+7052%22+transition+metal+dft&hl=en&as_sdt=0,5&as_vis=1"
85,"W Song, N Zheng","Iridium-catalyzed highly regioselective azide–ynamide cycloaddition to access 5-amido Fully substituted 1, 2, 3-triazoles under mild, air, aqueous, and bioorthogonal …",2017,"Organic Letters","ACS Publications","https://pubs.acs.org/doi/abs/10.1021/acs.orglett.7b03123","https://scholar.google.com/scholar?cites=1931702997050588994&as_sdt=2005&sciodt=0,5&hl=en",767,"2025-05-19 18:00:53","","10.1021/acs.orglett.7b03123","","",,,,,85,10.63,43,2,8,"… (12) The development and application of various transition metal catalysts in AAC reactions indicated that the metal-catalyzed azide–alkyne cycloaddition (MAAC) has become popular …","","https://scholar.google.com/scholar?q=related:Qv_BJqTJzhoJ:scholar.google.com/&scioq=source:%22organic+letters%22+%221523+7052%22+transition+metal+dft&hl=en&as_sdt=0,5&as_vis=1"
36,"H Zhang, P Tian, L Ma, Y Zhou, C Jiang, X Lin…","Remote Directed Isocyanation of Unactivated C(sp3)–H Bonds: Forging Seven-Membered Cyclic Ureas Enabled by Copper Catalysis",2020,"Organic …","ACS Publications","https://pubs.acs.org/doi/abs/10.1021/acs.orglett.9b04542","https://scholar.google.com/scholar?cites=10264041520798491861&as_sdt=2005&sciodt=0,5&hl=en",768,"2025-05-19 18:00:53","","10.1021/acs.orglett.9b04542","","",,,,,36,7.20,5,7,5,"… Noteworthy, the isocyanate group transfer step was confirmed by density functional theory (DFT) calculation, indicating that a lower energy was needed for the process involving Cu(III) …","https://homepage.zjut.edu.cn/_upload/article/files/59/7a/cc3ffd964fc89670698052ed793b/6d8f7cf2-952f-4b06-8298-233eac8421ee.pdf","https://scholar.google.com/scholar?q=related:1eQNx2EzcY4J:scholar.google.com/&scioq=source:%22organic+letters%22+%221523+7052%22+transition+metal+dft&hl=en&as_sdt=0,5&as_vis=1"
18,"K Ogura, I Isozumi, T Takehara, T Suzuki…","Enantioselective Reaction of N-Unprotected Activated Ketimines with Phosphine Oxides Catalyzed by Chiral Imidazoline-Phosphoric Acids",2022,"Organic …","ACS Publications","https://pubs.acs.org/doi/abs/10.1021/acs.orglett.2c03457","https://scholar.google.com/scholar?cites=13701474840766878382&as_sdt=2005&sciodt=0,5&hl=en",769,"2025-05-19 18:00:53","","10.1021/acs.orglett.2c03457","","",,,,,18,6.00,4,5,3,"… Based on experimental results and DFT calculation, transition states were proposed to … Based on the reaction cycle, the DFT calculations of the transition state between 1a and 2a using …","","https://scholar.google.com/scholar?q=related:rpLcLsZqJb4J:scholar.google.com/&scioq=source:%22organic+letters%22+%221523+7052%22+transition+metal+dft&hl=en&as_sdt=0,5&as_vis=1"
0,"CY Shi, X Wang, X Liu, ZH Ai, S Xiong, LW Ye…","Copper-Catalyzed [2, 3]-Sigmatropic Rearrangement of Azide–Ynamides via Selenium Ylides",2024,"Organic …","ACS Publications","https://pubs.acs.org/doi/abs/10.1021/acs.orglett.4c04444","",770,"2025-05-19 18:00:53","","10.1021/acs.orglett.4c04444","","",,,,,0,0.00,0,7,1,"… According to our DFT computational results, the extrusion of N 2 and the formation of the copper carbene intermediate C are the rate-determining steps (barrier height 29.2 kcal/mol) and …","","https://scholar.google.com/scholar?q=related:UeZDVu7qbQYJ:scholar.google.com/&scioq=source:%22organic+letters%22+%221523+7052%22+transition+metal+dft&hl=en&as_sdt=0,5&as_vis=1"
189,"F Wang, H Wang, Q Wang, S Yu, X Li","Co(III)-Catalyzed Synthesis of Quinazolines via C–H Activation of N-Sulfinylimines and Benzimidates",2016,"Organic Letters","ACS Publications","https://pubs.acs.org/doi/abs/10.1021/acs.orglett.6b00227","https://scholar.google.com/scholar?cites=8201744294576494723&as_sdt=2005&sciodt=0,5&hl=en",771,"2025-05-19 18:00:53","","10.1021/acs.orglett.6b00227","","",,,,,189,21.00,38,5,9,"… benign first row transition metals have been increasingly employed as catalysts. (3) Given the higher Lewis acidity of the Co(III) congeners and enhanced metal–ligand corporation, …","https://xingweili.snnu.edu.cn/__local/2/C3/A3/852A59CB05DF8DA2DF6397B71F5_5CB68F52_8083B.pdf","https://scholar.google.com/scholar?q=related:g5jRMPty0nEJ:scholar.google.com/&scioq=source:%22organic+letters%22+%221523+7052%22+transition+metal+dft&hl=en&as_sdt=0,5&as_vis=1"
