Cites,Authors,Title,Year,Source,Publisher,ArticleURL,CitesURL,GSRank,QueryDate,Type,DOI,ISSN,CitationURL,Volume,Issue,StartPage,EndPage,ECC,CitesPerYear,CitesPerAuthor,AuthorCount,Age,Abstract,FullTextURL,RelatedURL
29,"M Skaria, YC Hsu, YT Jiang, MY Lu, TC Kuo…","Gold-catalyzed oxidations of 1, 3-diynamides with C (1) versus C (3) regioselectivity: catalyst-dependent oxidative cyclizations in the C (3) oxidation",2020,"Organic …","ACS Publications","https://pubs.acs.org/doi/abs/10.1021/acs.orglett.0c01480","https://scholar.google.com/scholar?cites=5799579721243085061&as_sdt=2005&sciodt=0,5&hl=en",247,"2025-05-19 18:00:53","","10.1021/acs.orglett.0c01480","","",,,,,29,5.80,5,6,5,"… In this work, density functional theory (DFT) calculations are performed to confirm the feasibility of C(3) regioselectivity. In our DFT calculations, gold−π-alkynes A and B are convertible …","","https://scholar.google.com/scholar?q=related:BclAawc_fFAJ:scholar.google.com/&scioq=source:%22organic+letters%22+%221523+7052%22+transition+metal+dft&hl=en&as_sdt=0,5&as_vis=1"
35,"Y Li, X Liang, K Niu, J Gu, F Liu, Q Xia, Q Wang…","Visible-light-induced photocatalyst-free radical trifluoromethylation",2022,"Organic …","ACS Publications","https://pubs.acs.org/doi/abs/10.1021/acs.orglett.2c02150","https://scholar.google.com/scholar?cites=10045636838639513010&as_sdt=2005&sciodt=0,5&hl=en",248,"2025-05-19 18:00:53","","10.1021/acs.orglett.2c02150","","",,,,,35,11.67,4,8,3,"… yields in the absence of transition metals, photocatalysts, and oxidants. … by time-dependent density functional theory (TDDFT) … supported by density functional theory (DFT) calculations (…","","https://scholar.google.com/scholar?q=related:sq2vDXtFaYsJ:scholar.google.com/&scioq=source:%22organic+letters%22+%221523+7052%22+transition+metal+dft&hl=en&as_sdt=0,5&as_vis=1"
0,"S Basappa, A Prakash, A KP, MV Mane…","Base Mediated 1, 2-Carboboration: Direct Access to Multisubstituted Alkenyl and Alkylboronates",2025,"Organic Letters","ACS Publications","https://pubs.acs.org/doi/abs/10.1021/acs.orglett.5c01382","",249,"2025-05-19 18:00:53","","10.1021/acs.orglett.5c01382","","",,,,,0,0.00,0,5,1,"… The protocol is simple, clean, and more economical compared to reported transition metal-… Experimental results and density functional theory (DFT) calculations provide insights into …","","https://scholar.google.com/scholar?q=related:CMxz38KOxhMJ:scholar.google.com/&scioq=source:%22organic+letters%22+%221523+7052%22+transition+metal+dft&hl=en&as_sdt=0,5&as_vis=1"
35,"L Pan, MM Deckert, MV Cooke, AR Bleeke…","Solvent anions enable photoinduced borylation and phosphonation of aryl halides via EDA complexes",2022,"Organic letters","ACS Publications","https://pubs.acs.org/doi/abs/10.1021/acs.orglett.2c02631","https://scholar.google.com/scholar?cites=4414245437402105303&as_sdt=2005&sciodt=0,5&hl=en",250,"2025-05-19 18:00:53","","10.1021/acs.orglett.2c02631","","",,,,,35,11.67,7,5,3,"… Time dependent-density functional theory (TD-DFT) calculations suggest that the acetonitrile anion and the DMF anion (carbamoyl anion) (14) could form an EDA complex with aryl …","https://pmc.ncbi.nlm.nih.gov/articles/PMC9652786/pdf/nihms-1848837.pdf","https://scholar.google.com/scholar?q=related:18W9b9aMQj0J:scholar.google.com/&scioq=source:%22organic+letters%22+%221523+7052%22+transition+metal+dft&hl=en&as_sdt=0,5&as_vis=1"
6,"H Yang, Y Zhou, Z Zhang, J Wen, X Zhang","Iridium-Catalyzed Hydroiodination and Formal Hydroamination of Olefins with N-Iodo Reagents and Molecular Hydrogen: An Umpolung Strategy",2022,"Organic Letters","ACS Publications","https://pubs.acs.org/doi/abs/10.1021/acs.orglett.2c00392","https://scholar.google.com/scholar?cites=15232248036864647372&as_sdt=2005&sciodt=0,5&hl=en",251,"2025-05-19 18:00:53","","10.1021/acs.orglett.2c00392","","",,,,,6,2.00,1,5,3,"… Control experiments and DFT calculations tentatively excluded … (2) Transition metal-catalyzed hydroamination reactions … of hydroiodination, and a transition metal-catalyzed approach …","","https://scholar.google.com/scholar?q=related:zGD1t-LQY9MJ:scholar.google.com/&scioq=source:%22organic+letters%22+%221523+7052%22+transition+metal+dft&hl=en&as_sdt=0,5&as_vis=1"
121,"C Shu, YH Wang, CH Shen, PP Ruan, X Lu…","Gold-catalyzed intermolecular ynamide amination-initiated aza-Nazarov cyclization: access to functionalized 2-aminopyrroles",2016,"Organic Letters","ACS Publications","https://pubs.acs.org/doi/abs/10.1021/acs.orglett.6b01503","https://scholar.google.com/scholar?cites=6355268920995223296&as_sdt=2005&sciodt=0,5&hl=en",252,"2025-05-19 18:00:53","","10.1021/acs.orglett.6b01503","","",,,,,121,13.44,20,6,9,"… , is also well supported by DFT (density functional theory) computations. The high flexibility, … Finally, it should be mentioned that other typical transition metals such as PtCl 2 , AgNTf 2 , …","","https://scholar.google.com/scholar?q=related:ABcAeGlzMlgJ:scholar.google.com/&scioq=source:%22organic+letters%22+%221523+7052%22+transition+metal+dft&hl=en&as_sdt=0,5&as_vis=1"
22,"H Chen, T Zhang, C Shan, S Liu, Q Song, R Bai…","Mechanism of Brønsted-Base-Mediated Borylation of Propynols: A DFT Study",2019,"Organic …","ACS Publications","https://pubs.acs.org/doi/abs/10.1021/acs.orglett.9b01180","https://scholar.google.com/scholar?cites=1193821335636100760&as_sdt=2005&sciodt=0,5&hl=en",253,"2025-05-19 18:00:53","","10.1021/acs.orglett.9b01180","","",,,,,22,3.67,3,7,6,"… (4) However, transition metals have restricted application in organic synthesis because of … developing borylation reactions in the absence of transition metal catalysts, which allow highly …","","https://scholar.google.com/scholar?q=related:mEbf-y1OkRAJ:scholar.google.com/&scioq=source:%22organic+letters%22+%221523+7052%22+transition+metal+dft&hl=en&as_sdt=0,5&as_vis=1"
15,"P Zhou, Y Li, T Xu","Molybdenum-Catalyzed Cross-Coupling of Benzyl Alcohols: Direct C–OH Bond Transformation via [2+ 2]-Type Addition and Elimination",2022,"Organic Letters","ACS Publications","https://pubs.acs.org/doi/abs/10.1021/acs.orglett.2c01537","https://scholar.google.com/scholar?cites=14893822436459676726&as_sdt=2005&sciodt=0,5&hl=en",254,"2025-05-19 18:00:53","","10.1021/acs.orglett.2c01537","","",,,,,15,5.00,5,3,3,"… , which requires low-valent precious metals and an inert atmosphere and which initiates … transition metals, such as aryl halides, can be well tolerated. The mechanistic studies and DFT …","","https://scholar.google.com/scholar?q=related:NgTsWJh8sc4J:scholar.google.com/&scioq=source:%22organic+letters%22+%221523+7052%22+transition+metal+dft&hl=en&as_sdt=0,5&as_vis=1"
5,"M Metzler, M Bolte, A Virovets, HW Lerner…","Vicinal vinylation of boron-doped acenes via heck coupling",2023,"Organic …","ACS Publications","https://pubs.acs.org/doi/abs/10.1021/acs.orglett.3c02086","https://scholar.google.com/scholar?cites=6876347279314796201&as_sdt=2005&sciodt=0,5&hl=en",255,"2025-05-19 18:00:53","","10.1021/acs.orglett.3c02086","","",,,,,5,2.50,1,5,2,"… (21−25) Since the propensity for ArX activation in transition-metal-mediated C–C-coupling … ; the frontier-orbital energies are the unscaled values E HOMO DFT /E LUMO DFT . (40) …","","https://scholar.google.com/scholar?q=related:qT7IB2uxbV8J:scholar.google.com/&scioq=source:%22organic+letters%22+%221523+7052%22+transition+metal+dft&hl=en&as_sdt=0,5&as_vis=1"
8,"W Li, J Qiu, H Li, W Chen, C Hou, H Li","Indolization of N-Aryl Tertiary Amines with Diazoacetates by a Single Organophotocatalyst",2023,"Organic Letters","ACS Publications","https://pubs.acs.org/doi/abs/10.1021/acs.orglett.3c01288","https://scholar.google.com/scholar?cites=10470792020700849001&as_sdt=2005&sciodt=0,5&hl=en",256,"2025-05-19 18:00:53","","10.1021/acs.orglett.3c01288","","",,,,,8,4.00,1,6,2,"… by the need for transition metals, oxidants, or … transition state from G to H is only 10.9 kcal/mol, which suggests the reaction can occur at room temperature. Therefore, the results of DFT …","","https://scholar.google.com/scholar?q=related:aWPevt25T5EJ:scholar.google.com/&scioq=source:%22organic+letters%22+%221523+7052%22+transition+metal+dft&hl=en&as_sdt=0,5&as_vis=1"
135,"T Hatakeyama, Y Yoshimoto, SK Ghorai…","Transition-Metal-Free Electrophilic Amination between Aryl Grignard Reagents and N-Chloroamines",2010,"Organic …","ACS Publications","https://pubs.acs.org/doi/abs/10.1021/ol100235b","https://scholar.google.com/scholar?cites=13838784941104881533&as_sdt=2005&sciodt=0,5&hl=en",257,"2025-05-19 18:00:53","","10.1021/ol100235b","","",,,,,135,9.00,34,4,15,"… transition metals can contribute to practical syntheses of the above-mentioned functional arylamines. Herein, we report a transition-metal-free … The DFT method was employed using the …","","https://scholar.google.com/scholar?q=related:fd-UOZU9DcAJ:scholar.google.com/&scioq=source:%22organic+letters%22+%221523+7052%22+transition+metal+dft&hl=en&as_sdt=0,5&as_vis=1"
42,"ZC Cao, XL Li, QY Luo, H Fang, ZJ Shi","Direct Borylation of Tertiary Anilines via C–N Bond Activation",2018,"Organic Letters","ACS Publications","https://pubs.acs.org/doi/abs/10.1021/acs.orglett.8b00545","https://scholar.google.com/scholar?cites=172896520529599645&as_sdt=2005&sciodt=0,5&hl=en",258,"2025-05-19 18:00:53","","10.1021/acs.orglett.8b00545","","",,,,,42,6.00,8,5,7,"… might be cleaved if a proper combination of transition metal and ligand set was submitted as catalyst… On the basis of our observations and DFT calculations (see details in the Supporting …","","https://scholar.google.com/scholar?q=related:nVwRKXhAZgIJ:scholar.google.com/&scioq=source:%22organic+letters%22+%221523+7052%22+transition+metal+dft&hl=en&as_sdt=0,5&as_vis=1"
66,"Q Liu, J Hong, B Sun, G Bai, F Li, G Liu, Y Yang…","Transition-metal-free borylation of alkyl iodides via a radical mechanism",2019,"Organic …","ACS Publications","https://pubs.acs.org/doi/abs/10.1021/acs.orglett.9b01951","https://scholar.google.com/scholar?cites=517612928027539271&as_sdt=2005&sciodt=0,5&hl=en",259,"2025-05-19 18:00:53","","10.1021/acs.orglett.9b01951","","",,,,,66,11.00,8,8,6,"… Furthermore, we performed density functional theory (DFT) calculations on the C–B bond formation step (see the Supporting Information for details). Previous study proposed that the …","https://authors.library.caltech.edu/records/br12g-9ec58/files/ol9b01951_si_001.pdf","https://scholar.google.com/scholar?q=related:Rzc7MjfuLgcJ:scholar.google.com/&scioq=source:%22organic+letters%22+%221523+7052%22+transition+metal+dft&hl=en&as_sdt=0,5&as_vis=1"
11,"S Poorsadeghi, K Endo, S Arimitsu","Enantioselective Fluorination of α-Substituted β-Diketones Using β, β-Diaryl Serines",2021,"Organic Letters","ACS Publications","https://pubs.acs.org/doi/abs/10.1021/acs.orglett.1c04104","https://scholar.google.com/scholar?cites=14203647447258060044&as_sdt=2005&sciodt=0,5&hl=en",260,"2025-05-19 18:00:53","","10.1021/acs.orglett.1c04104","","",,,,,11,2.75,4,3,4,"… of transition-metal catalysis, this steric barrier can be overcome by the strong interaction of a transition metal … mechanism by density functional theory calculations is currently under way. …","","https://scholar.google.com/scholar?q=related:DFWzYBl-HcUJ:scholar.google.com/&scioq=source:%22organic+letters%22+%221523+7052%22+transition+metal+dft&hl=en&as_sdt=0,5&as_vis=1"
130,"W Liu, H Wang, CJ Li","Metal-free markovnikov-type alkyne hydration under mild conditions",2016,"Organic letters","ACS Publications","https://pubs.acs.org/doi/abs/10.1021/acs.orglett.6b00801","https://scholar.google.com/scholar?cites=1340609233834708174&as_sdt=2005&sciodt=0,5&hl=en",261,"2025-05-19 18:00:53","","10.1021/acs.orglett.6b00801","","",,,,,130,14.44,43,3,9,"… in the absence of any transition metal. The success of this … metal and Brønsted catalysts). To quantitatively compare the difference between TFE and other solvents, we conducted DFT …","https://escholarship.mcgill.ca/downloads/b8515s17b","https://scholar.google.com/scholar?q=related:zoxTzf7MmhIJ:scholar.google.com/&scioq=source:%22organic+letters%22+%221523+7052%22+transition+metal+dft&hl=en&as_sdt=0,5&as_vis=1"
115,"AG Campaña, RE Estévez, N Fuentes, R Robles…","Unprecedented Hydrogen Transfer from Water to Alkenes and Alkynes Mediated by TiIII and Late Transition Metals",2007,"Organic …","ACS Publications","https://pubs.acs.org/doi/abs/10.1021/ol070779i","https://scholar.google.com/scholar?cites=13759462749375157102&as_sdt=2005&sciodt=0,5&hl=en",262,"2025-05-19 18:00:53","","10.1021/ol070779i","","",,,,,115,6.39,23,5,18,"… Thus, by means of calculations at the DFT level we could locate a transition state (Figure 1) that showed moderate activation energy (17.3 kcal mol -1 ), 14 suggesting that this H-atom …","","https://scholar.google.com/scholar?q=related:btO5RHhu874J:scholar.google.com/&scioq=source:%22organic+letters%22+%221523+7052%22+transition+metal+dft&hl=en&as_sdt=0,5&as_vis=1"
191,"Y Zhao, DG Truhlar","Attractive noncovalent interactions in the mechanism of Grubbs second-generation Ru catalysts for olefin metathesis",2007,"Organic letters","ACS Publications","https://pubs.acs.org/doi/abs/10.1021/ol0705548","https://scholar.google.com/scholar?cites=1996432952913360399&as_sdt=2005&sciodt=0,5&hl=en",263,"2025-05-19 18:00:53","","10.1021/ol0705548","","",,,,,191,10.61,96,2,18,"… large transition metal complexes”, and that the absence of dispersion-like interactions in DFT … Our understanding of organometallic catalysts requires identifying the physical elements …","","https://scholar.google.com/scholar?q=related:D_ZIcDHBtBsJ:scholar.google.com/&scioq=source:%22organic+letters%22+%221523+7052%22+transition+metal+dft&hl=en&as_sdt=0,5&as_vis=1"
2,"N Kato, Y Seki, T Nanjo, Y Takemoto","Bulky Alkyl Substituents Enhance the Photocatalytic Activity of Pyridine-Based Donor–Acceptor Molecules in the Direct Reductive Cleavage of the C–Br Bond of …",2024,"Organic Letters","ACS Publications","https://pubs.acs.org/doi/abs/10.1021/acs.orglett.4c01613","https://scholar.google.com/scholar?cites=6578391076730946438&as_sdt=2005&sciodt=0,5&hl=en",264,"2025-05-19 18:00:53","","10.1021/acs.orglett.4c01613","","",,,,,2,2.00,1,4,1,"We report new pyridine-based donor–acceptor (D–A) molecules that enable the direct reductive transformation of a variety of secondary and tertiary aliphatic bromides. A series of …","","https://scholar.google.com/scholar?q=related:hsMlmtQjS1sJ:scholar.google.com/&scioq=source:%22organic+letters%22+%221523+7052%22+transition+metal+dft&hl=en&as_sdt=0,5&as_vis=1"
63,"BJ Fallon, E Derat, M Amatore, C Aubert…","C2-Alkylation and Alkenylation of Indoles Catalyzed by a Low-Valent Cobalt Complex in the Absence of Reductant",2016,"Organic …","ACS Publications","https://pubs.acs.org/doi/abs/10.1021/acs.orglett.6b00939","https://scholar.google.com/scholar?cites=5961005054067778166&as_sdt=2005&sciodt=0,5&hl=en",265,"2025-05-19 18:00:53","","10.1021/acs.orglett.6b00939","","",,,,,63,7.00,13,5,9,"… second and third row transition metal catalysts. In recent … abundant catalysts based on first row transition metals. (2) Given … -labeling experiments and DFT calculations, we can propose …","","https://scholar.google.com/scholar?q=related:dqIEkIO-uVIJ:scholar.google.com/&scioq=source:%22organic+letters%22+%221523+7052%22+transition+metal+dft&hl=en&as_sdt=0,5&as_vis=1"
1,"NH Nguyen, S Seo, J Jang, H Kim, S Shin","Cu (I)-Catalyzed Atropselective Heterobiaryl Coupling Employing Umpoled Indoles",2024,"Organic letters","ACS Publications","https://pubs.acs.org/doi/abs/10.1021/acs.orglett.4c02482","https://scholar.google.com/scholar?cites=5157914995575310819&as_sdt=2005&sciodt=0,5&hl=en",266,"2025-05-19 18:00:53","","10.1021/acs.orglett.4c02482","","",,,,,1,1.00,0,5,1,"… Our mechanistic studies, bolstered by experimental evidence and DFT calculations, reveal a novel closed-shell mechanism involving outer-sphere attack of N-carboxyindoles on the Cu-…","https://chemrxiv.org/engage/api-gateway/chemrxiv/assets/orp/resource/item/65d1eae79138d2316161bd85/original/cu-i-catalyzed-atropselective-heterobiaryl-coupling-employing-umpoled-indoles.pdf","https://scholar.google.com/scholar?q=related:40ntVFyYlEcJ:scholar.google.com/&scioq=source:%22organic+letters%22+%221523+7052%22+transition+metal+dft&hl=en&as_sdt=0,5&as_vis=1"
42,"PK Dutta, J Chauhan, MK Ravva, S Sen","Directing-group-assisted manganese-catalyzed cyclopropanation of indoles",2019,"Organic Letters","ACS Publications","https://pubs.acs.org/doi/abs/10.1021/acs.orglett.9b00150","https://scholar.google.com/scholar?cites=8383626735907770806&as_sdt=2005&sciodt=0,5&hl=en",267,"2025-05-19 18:00:53","","10.1021/acs.orglett.9b00150","","",,,,,42,7.00,11,4,6,"… Control experiments and DFT studies elucidated the probable pathway for the formation of … Manganese is the third most abundant transition metal after iron and titanium. It is found in the …","","https://scholar.google.com/scholar?q=related:thFAExmgWHQJ:scholar.google.com/&scioq=source:%22organic+letters%22+%221523+7052%22+transition+metal+dft&hl=en&as_sdt=0,5&as_vis=1"
21,"NE Behnke, R Kielawa, DH Kwon, DH Ess…","Direct Primary Amination of Alkylmetals with NH-Oxaziridine",2018,"Organic letters","ACS Publications","https://pubs.acs.org/doi/abs/10.1021/acs.orglett.8b03734","https://scholar.google.com/scholar?cites=16550172186811898844&as_sdt=2005&sciodt=0,5&hl=en",268,"2025-05-19 18:00:53","","10.1021/acs.orglett.8b03734","","",,,,,21,3.00,4,5,7,"… at ambient temperature and without transition metal catalysts or purification by column … Therefore, we used density functional theory (DFT) calculations to examine the transition states to …","https://pmc.ncbi.nlm.nih.gov/articles/PMC7803087/pdf/nihms-1614178.pdf","https://scholar.google.com/scholar?q=related:3Bt51uoFruUJ:scholar.google.com/&scioq=source:%22organic+letters%22+%221523+7052%22+transition+metal+dft&hl=en&as_sdt=0,5&as_vis=1"
81,"A Rivera-Hernandez, BJ Fallon, S Ventre…","Regio-and stereoselective hydrosilylation of unsymmetrical alkynes catalyzed by a well-defined, low-valent cobalt catalyst",2016,"Organic …","ACS Publications","https://pubs.acs.org/doi/abs/10.1021/acs.orglett.6b01987","https://scholar.google.com/scholar?cites=6788744866557072197&as_sdt=2005&sciodt=0,5&hl=en",269,"2025-05-19 18:00:53","","10.1021/acs.orglett.6b01987","","",,,,,81,9.00,20,4,9,"… Transition metal-catalyzed hydrosilylation of alkynes represents one of the most … To gain deeper insight into the mechanistic details, DFT (density functional theory) calculations were …","","https://scholar.google.com/scholar?q=related:RRPk4Xx3Nl4J:scholar.google.com/&scioq=source:%22organic+letters%22+%221523+7052%22+transition+metal+dft&hl=en&as_sdt=0,5&as_vis=1"
89,"K Ota, K Nagao, H Ohmiya","N-Heterocyclic carbene-catalyzed radical relay enabling synthesis of δ-ketocarbonyls",2020,"Organic Letters","ACS Publications","https://pubs.acs.org/doi/abs/10.1021/acs.orglett.0c01199","https://scholar.google.com/scholar?cites=5493365673858278402&as_sdt=2005&sciodt=0,5&hl=en",270,"2025-05-19 18:00:53","","10.1021/acs.orglett.0c01199","","",,,,,89,17.80,30,3,5,"… This protocol enabled the conversion of readily available starting materials to congested and functionalized δ-ketocarbonyls in a single step without using transition metals. …","","https://scholar.google.com/scholar?q=related:AqSlq_laPEwJ:scholar.google.com/&scioq=source:%22organic+letters%22+%221523+7052%22+transition+metal+dft&hl=en&as_sdt=0,5&as_vis=1"
64,"Z Qu, X Chen, S Zhong, GJ Deng, H Huang","NaI/PPh3-Mediated Photochemical Reduction and Amination of Nitroarenes",2021,"Organic Letters","ACS Publications","https://pubs.acs.org/doi/abs/10.1021/acs.orglett.1c01654","https://scholar.google.com/scholar?cites=1720099039232580807&as_sdt=2005&sciodt=0,5&hl=en",271,"2025-05-19 18:00:53","","10.1021/acs.orglett.1c01654","","",,,,,64,16.00,13,5,4,"… Further, we did density functional theory (DFT) calculations to support the proposed photoactivating action models (Figure 1b). Without the iodide additive, the electron-poor nitroarene …","","https://scholar.google.com/scholar?q=related:x9zyc_YE3xcJ:scholar.google.com/&scioq=source:%22organic+letters%22+%221523+7052%22+transition+metal+dft&hl=en&as_sdt=0,5&as_vis=1"
45,"SP Panda, SK Hota, R Dash, L Roy, S Murarka","Photodecarboxylative C–H Alkylation of Azauracils with N-(Acyloxy)phthalimides",2023,"Organic Letters","ACS Publications","https://pubs.acs.org/doi/abs/10.1021/acs.orglett.3c01210","https://scholar.google.com/scholar?cites=9728423783363974533&as_sdt=2005&sciodt=0,5&hl=en",272,"2025-05-19 18:00:53","","10.1021/acs.orglett.3c01210","","",,,,,45,22.50,9,5,2,"… In order to understand the nature of the CTC assembly and the role of TMEDA, we performed density functional theory (DFT) and time-dependent DFT (TD-DFT) calculations at B3LYP-…","","https://scholar.google.com/scholar?q=related:hRXfN-NNAocJ:scholar.google.com/&scioq=source:%22organic+letters%22+%221523+7052%22+transition+metal+dft&hl=en&as_sdt=0,5&as_vis=1"
0,"K Wu, X Ruan, Q Li, Q Jiang, S Ni, Q Zhou","Phosphine-Catalyzed [3+ 4] Annulations of Salicylaldehyde Schiff Bases with α-Substituted Allenes: Construction of Functionalized Benzoxepine Fused Succinimide …",2024,"Organic Letters","ACS Publications","https://pubs.acs.org/doi/abs/10.1021/acs.orglett.4c02952","",273,"2025-05-19 18:00:53","","10.1021/acs.orglett.4c02952","","",,,,,0,0.00,0,6,1,"… Density functional theory calculations were conducted to study the possible mechanism. Moreover, this class of compounds exhibited the potential ability of cytotoxicity toward cancer …","","https://scholar.google.com/scholar?q=related:KgmXf4r36xIJ:scholar.google.com/&scioq=source:%22organic+letters%22+%221523+7052%22+transition+metal+dft&hl=en&as_sdt=0,5&as_vis=1"
38,"S Bhattacharjee, S Deswal, N Manoj, G Jindal…","Aryne Three-Component Coupling Involving CS2 for the Synthesis of S-Aryl Dithiocarbamates",2021,"Organic …","ACS Publications","https://pubs.acs.org/doi/abs/10.1021/acs.orglett.1c03378","https://scholar.google.com/scholar?cites=9530383017544721504&as_sdt=2005&sciodt=0,5&hl=en",274,"2025-05-19 18:00:53","","10.1021/acs.orglett.1c03378","","",,,,,38,9.50,8,5,4,"… To gain insight into the divergent reactivity patterns of the isoelectronic electrophiles CS 2 and CO 2 in aryne MCCs, density functional theory (DFT) methods (M06-2X-D3 functional) …","","https://scholar.google.com/scholar?q=related:YCQrPty4QoQJ:scholar.google.com/&scioq=source:%22organic+letters%22+%221523+7052%22+transition+metal+dft&hl=en&as_sdt=0,5&as_vis=1"
23,"H Chung, J Kim, GA Gonzalez-Montiel…","Modular Counter-Fischer–Indole Synthesis through Radical-Enolate Coupling",2021,"Organic …","ACS Publications","https://pubs.acs.org/doi/abs/10.1021/acs.orglett.1c00003","https://scholar.google.com/scholar?cites=2764260210893317799&as_sdt=2005&sciodt=0,5&hl=en",275,"2025-05-19 18:00:53","","10.1021/acs.orglett.1c00003","","",,,,,23,5.75,6,4,4,"… both mechanisms by density functional theory (DFT) with … transition-metal-free KOt-Bu-mediated protocol for indole synthesis. This method is advantageous in that no transition metal or …","","https://scholar.google.com/scholar?q=related:p-YKIQSgXCYJ:scholar.google.com/&scioq=source:%22organic+letters%22+%221523+7052%22+transition+metal+dft&hl=en&as_sdt=0,5&as_vis=1"
25,"L Bao, ZX Wang, XY Chen","Metal-free generation of acyl radical via photoinduced single-electron transfer from lewis base to acyl chloride",2022,"Organic Letters","ACS Publications","https://pubs.acs.org/doi/abs/10.1021/acs.orglett.2c03339","https://scholar.google.com/scholar?cites=5025123061386372778&as_sdt=2005&sciodt=0,5&hl=en",276,"2025-05-19 18:00:53","","10.1021/acs.orglett.2c03339","","",,,,,25,8.33,8,3,3,"… On the basis of these experiment results and the DFT/TD-DFT … using photocatalysts and transition metals. Mechanistic … carbonyl compounds under transition metal-free conditions. …","","https://scholar.google.com/scholar?q=related:quaO0szSvEUJ:scholar.google.com/&scioq=source:%22organic+letters%22+%221523+7052%22+transition+metal+dft&hl=en&as_sdt=0,5&as_vis=1"
32,"H Wang, Q Wu, JD Zhang, HY Li, HX Li","Photocatalyst- and Transition-Metal-Free Visible-Light-Promoted Intramolecular C(sp2)–S Formation",2021,"Organic Letters","ACS Publications","https://pubs.acs.org/doi/abs/10.1021/acs.orglett.1c00235","https://scholar.google.com/scholar?cites=13921326999049974202&as_sdt=2005&sciodt=0,5&hl=en",277,"2025-05-19 18:00:53","","10.1021/acs.orglett.1c00235","","",,,,,32,8.00,6,5,4,"… This C–S cross coupling photoreaction was also investigated through density functional theory (DFT) calculations. The molecular geometry was optimized using the DFT method of …","","https://scholar.google.com/scholar?q=related:urFttCV9MsEJ:scholar.google.com/&scioq=source:%22organic+letters%22+%221523+7052%22+transition+metal+dft&hl=en&as_sdt=0,5&as_vis=1"
93,"H Furuta, H Maeda, A Osuka","Regioselective oxidative liberation of aryl-substituted tripyrrinone metal complexes from N-confused porphyrin",2002,"Organic letters","ACS Publications","https://pubs.acs.org/doi/abs/10.1021/ol0168521","https://scholar.google.com/scholar?cites=279510935018234445&as_sdt=2005&sciodt=0,5&hl=en",278,"2025-05-19 18:00:53","","10.1021/ol0168521","","",,,,,93,4.04,31,3,23,"… of NCP compounds, especially during metalation with various transition metals such as Cu, Mn, Fe, … Synthetic procedures and spectral data of free base 3 and the metal complexes, DFT …","","https://scholar.google.com/scholar?q=related:TWKZ6LYF4QMJ:scholar.google.com/&scioq=source:%22organic+letters%22+%221523+7052%22+transition+metal+dft&hl=en&as_sdt=0,5&as_vis=1"
