Cites,Authors,Title,Year,Source,Publisher,ArticleURL,CitesURL,GSRank,QueryDate,Type,DOI,ISSN,CitationURL,Volume,Issue,StartPage,EndPage,ECC,CitesPerYear,CitesPerAuthor,AuthorCount,Age,Abstract,FullTextURL,RelatedURL
13,"M Zhang, W Zhao, J Ma, J Li, Q Meng, C Shen…","Syn-Selective Chlorosulfonylation of Alkynes via a Copper-Powder-Initiated Atom Transfer Radical Addition Reaction and Mechanistic Studies",2022,"Organic …","ACS Publications","https://pubs.acs.org/doi/abs/10.1021/acs.orglett.2c04074","https://scholar.google.com/scholar?cites=7880453262389513411&as_sdt=2005&sciodt=0,5&hl=en",493,"2025-05-19 18:00:53","","10.1021/acs.orglett.2c04074","","",,,,,13,4.33,2,7,3,"… Mechanistic investigations and DFT calculation studies revealed that the stereoselectivity is controlled by the thermodynamic stabilities of the in situ-generated cyclic alkenyl Cu II …","","https://scholar.google.com/scholar?q=related:w4zLXX3-XG0J:scholar.google.com/&scioq=source:%22organic+letters%22+%221523+7052%22+transition+metal+dft&hl=en&as_sdt=0,5&as_vis=1"
33,"A Parija, RB Sunoj","Mechanism of catalytic functionalization of primary C–H bonds using a silylation strategy",2013,"Organic Letters","ACS Publications","https://pubs.acs.org/doi/abs/10.1021/ol401597t","https://scholar.google.com/scholar?cites=8949937911809690825&as_sdt=2005&sciodt=0,5&hl=en",494,"2025-05-19 18:00:53","","10.1021/ol401597t","","",,,,,33,2.75,17,2,12,"… Transition metal catalyzed C–H activation reactions have been one of the most active … by locating the transition states and intermediates using the M06 density functional theory with the …","","https://scholar.google.com/scholar?q=related:ycw3qxyRNHwJ:scholar.google.com/&scioq=source:%22organic+letters%22+%221523+7052%22+transition+metal+dft&hl=en&as_sdt=0,5&as_vis=1"
153,"M Pawliczek, LKB Garve, DB Werz","Activation of aryl thiocyanates followed by aryne insertion: access to 1, 2-thiobenzonitriles",2015,"Organic letters","ACS Publications","https://pubs.acs.org/doi/abs/10.1021/acs.orglett.5b00494","https://scholar.google.com/scholar?cites=6660244973863939694&as_sdt=2005&sciodt=0,5&hl=en",495,"2025-05-19 18:00:53","","10.1021/acs.orglett.5b00494","","",,,,,153,15.30,51,3,10,"… (6) No activation of the N–CN bond by a transition metal was required. Intrigued by this simple reaction, we asked ourselves whether other Het–CN bonds such as S–CN are able to …","","https://scholar.google.com/scholar?q=related:bq49KITxbVwJ:scholar.google.com/&scioq=source:%22organic+letters%22+%221523+7052%22+transition+metal+dft&hl=en&as_sdt=0,5&as_vis=1"
24,"S Li, Y Wang, Z Wu, W Shi, Y Lei, PW Davies…","A radical-initiated fragmentary rearrangement cascade of ene-ynamides to [1, 2]-annulated indoles via site-selective cyclization",2021,"Organic …","ACS Publications","https://pubs.acs.org/doi/abs/10.1021/acs.orglett.1c02519","https://scholar.google.com/scholar?cites=713159066976950191&as_sdt=2005&sciodt=0,5&hl=en",496,"2025-05-19 18:00:53","","10.1021/acs.orglett.1c02519","","",,,,,24,6.00,3,7,4,"… DFT calculations support oxidation of N-centered radical species to cations prior to the C–N … DFT calculations verified that an aza-Nazarov type cyclization is responsible for the …","","https://scholar.google.com/scholar?q=related:r5eCl2Sm5QkJ:scholar.google.com/&scioq=source:%22organic+letters%22+%221523+7052%22+transition+metal+dft&hl=en&as_sdt=0,5&as_vis=1"
4,"L Hu, Y Xiang, XB Lan, Y Xie","An Intermolecular Hydroarylation of Unactivated Arylcyclopropane via Re2O7/HFIP-Mediated Ring Opening",2024,"Organic Letters","ACS Publications","https://pubs.acs.org/doi/abs/10.1021/acs.orglett.4c00272","https://scholar.google.com/scholar?cites=17533757414104221418&as_sdt=2005&sciodt=0,5&hl=en",497,"2025-05-19 18:00:53","","10.1021/acs.orglett.4c00272","","",,,,,4,4.00,1,4,1,"… To shed light on the reaction mechanism, we carried out density functional theory (DFT) calculations at the SMD-B3LYP-D3/def2-TZVPP//B3LYP-D3/def2-SVP+SDD(Re) level. The Re 2 …","","https://scholar.google.com/scholar?q=related:6saNZXhrVPMJ:scholar.google.com/&scioq=source:%22organic+letters%22+%221523+7052%22+transition+metal+dft&hl=en&as_sdt=0,5&as_vis=1"
167,"N Kim, Y Kim, W Park, D Sung, AK Gupta, CH Oh","Gold-Catalyzed Cycloisomerization of o-Alkynylbenzaldehydes with a Pendant Unsaturated Bond:  [3 + 2] Cycloaddition of Gold-Bound 1,3-Dipolar Species with …",2005,"Organic letters","ACS Publications","https://pubs.acs.org/doi/abs/10.1021/ol052229v","https://scholar.google.com/scholar?cites=7819387585625023388&as_sdt=2005&sciodt=0,5&hl=en",498,"2025-05-19 18:00:53","","10.1021/ol052229v","","",,,,,167,8.35,28,6,20,"… This study strongly supports the intermediacy of [3 + 2] cycloaddition proposed by DFT calculation and provides an easy access to key skeletons found in a variety of natural products. …","","https://scholar.google.com/scholar?q=related:nGNHipQLhGwJ:scholar.google.com/&scioq=source:%22organic+letters%22+%221523+7052%22+transition+metal+dft&hl=en&as_sdt=0,5&as_vis=1"
16,"A Banik, P Datta, SK Mandal","C-Alkylation by Phenalenyl-Based Molecule via a Borrowing Hydrogen Pathway",2023,"Organic Letters","ACS Publications","https://pubs.acs.org/doi/abs/10.1021/acs.orglett.3c00223","https://scholar.google.com/scholar?cites=10551556128955045839&as_sdt=2005&sciodt=0,5&hl=en",499,"2025-05-19 18:00:53","","10.1021/acs.orglett.3c00223","","",,,,,16,8.00,5,3,2,"The present study demonstrates the first transition-metal-free catalytic C-alkylation via a borrowing hydrogen pathway for the α-alkylation of ketone, synthesis of substituted quinoline, …","","https://scholar.google.com/scholar?q=related:zxf2DWWobpIJ:scholar.google.com/&scioq=source:%22organic+letters%22+%221523+7052%22+transition+metal+dft&hl=en&as_sdt=0,5&as_vis=1"
30,"W Ding, A Yu, L Zhang, X Meng","Construction of Eight-Membered Cyclic Diaryl Sulfides via Domino Reaction of Arynes with Thioaurone Analogues and DFT Study on the Reaction Mechanism",2019,"Organic Letters","ACS Publications","https://pubs.acs.org/doi/abs/10.1021/acs.orglett.9b03417","https://scholar.google.com/scholar?cites=12296654967115749914&as_sdt=2005&sciodt=0,5&hl=en",500,"2025-05-19 18:00:53","","10.1021/acs.orglett.9b03417","","",,,,,30,5.00,8,4,6,"… We have also performed DFT analyses on the formation of F (leading to 4) from E (see Figure S2) and found that E can evolve to F through intramolecular aromatic substitution, but the …","","https://scholar.google.com/scholar?q=related:Ghp6yIp-pqoJ:scholar.google.com/&scioq=source:%22organic+letters%22+%221523+7052%22+transition+metal+dft&hl=en&as_sdt=0,5&as_vis=1"
36,"T Morofuji, K Inagawa, N Kano","Sequential Ring-Opening and Ring-Closing Reactions for Converting para-Substituted Pyridines into meta-Substituted Anilines",2021,"Organic Letters","ACS Publications","https://pubs.acs.org/doi/abs/10.1021/acs.orglett.1c02225","https://scholar.google.com/scholar?cites=14352138261905950367&as_sdt=2005&sciodt=0,5&hl=en",501,"2025-05-19 18:00:53","","10.1021/acs.orglett.1c02225","","",,,,,36,9.00,12,3,4,"Herein we report a method for converting para-substituted pyridine rings into meta-dialkylamino-substituted benzene rings through sequential ring-opening and ring-closing reactions. …","","https://scholar.google.com/scholar?q=related:n0YyVLUJLccJ:scholar.google.com/&scioq=source:%22organic+letters%22+%221523+7052%22+transition+metal+dft&hl=en&as_sdt=0,5&as_vis=1"
20,"T Sandmeier, EM Carreira","Enantio- and Chemoselective Intramolecular Iridium-Catalyzed O-Allylation of Oximes",2021,"Organic Letters","ACS Publications","https://pubs.acs.org/doi/abs/10.1021/acs.orglett.1c00559","https://scholar.google.com/scholar?cites=10652606340270040639&as_sdt=2005&sciodt=0,5&hl=en",502,"2025-05-19 18:00:53","","10.1021/acs.orglett.1c00559","","",,,,,20,5.00,10,2,4,"… Interestingly, density functional theory calculations at the B3PW91/6-311++G(d,p) level of theory revealed that the nitrone products were thermodynamically favored over the oxime …","https://ethz.ch/content/dam/ethz/special-interest/chab/organic-chemistry/carreira-research-group-dam/documents/snf/2021-carreira-sandmeier-orglett.pdf","https://scholar.google.com/scholar?q=related:P6beywap1ZMJ:scholar.google.com/&scioq=source:%22organic+letters%22+%221523+7052%22+transition+metal+dft&hl=en&as_sdt=0,5&as_vis=1"
29,"T Wang, L Zhou, Y Yang, X Zhang, Z Shi, YD Wu","Directing Effects on the Copper-Catalyzed Site-Selective Arylation of Indoles",2018,"Organic Letters","ACS Publications","https://pubs.acs.org/doi/abs/10.1021/acs.orglett.8b02825","https://scholar.google.com/scholar?cites=5186499191814173206&as_sdt=2005&sciodt=0,5&hl=en",503,"2025-05-19 18:00:53","","10.1021/acs.orglett.8b02825","","",,,,,29,4.14,5,6,7,"… DFT calculated binding energies also indicated that the binding of the copper center to N-TBPO indole and N-Bn-3-Piv indole is stronger than that of the N-Ac indole (see Figure S1). …","","https://scholar.google.com/scholar?q=related:FjLvI4kl-kcJ:scholar.google.com/&scioq=source:%22organic+letters%22+%221523+7052%22+transition+metal+dft&hl=en&as_sdt=0,5&as_vis=1"
24,"S Lim, H Cho, J Jeong, M Jang, H Kim, SH Cho…","Cobalt-catalyzed defluorosilylation of aryl fluorides via grignard reagent formation",2020,"Organic …","ACS Publications","https://pubs.acs.org/doi/abs/10.1021/acs.orglett.0c02752","https://scholar.google.com/scholar?cites=16716902536896725741&as_sdt=2005&sciodt=0,5&hl=en",504,"2025-05-19 18:00:53","","10.1021/acs.orglett.0c02752","","",,,,,24,4.80,3,7,5,"… valent transition metal relative to C–H or C–C bonds. (2) On the other hand, utilization of aryl fluorides (Ar–F) in metal… Further density functional theory (DFT) calculations on the structural …","http://pstorage-acs-6854636.s3.amazonaws.com/24624274/ol0c02752_si_001.pdf","https://scholar.google.com/scholar?q=related:7UKOkEle_ucJ:scholar.google.com/&scioq=source:%22organic+letters%22+%221523+7052%22+transition+metal+dft&hl=en&as_sdt=0,5&as_vis=1"
69,"J Zhao, Q Zhang, L Liu, Y He, J Li, J Li, Q Zhu","CuI-Mediated Sequential Iodination/Cycloetherification of o-Arylphenols: Synthesis of 2- or 4-Iododibenzofurans and Mechanistic Studies",2012,"Organic letters","ACS Publications","https://pubs.acs.org/doi/abs/10.1021/ol302562a","https://scholar.google.com/scholar?cites=8708245057352363940&as_sdt=2005&sciodt=0,5&hl=en",505,"2025-05-19 18:00:53","","10.1021/ol302562a","","",,,,,69,5.31,10,7,13,"… Density functional theory (DFT) calculations were carried out for both Cu(III)- and Cu(II)-mediated … Being consistent with the experimental results, data of DFT calculations suggest that …","","https://scholar.google.com/scholar?q=related:pO-JzL3m2XgJ:scholar.google.com/&scioq=source:%22organic+letters%22+%221523+7052%22+transition+metal+dft&hl=en&as_sdt=0,5&as_vis=1"
9,"T Singha, NA Bapat, SK Mishra, DP Hari","Photoredox-Catalyzed Strain-Release-Driven Synthesis of Functionalized Spirocyclobutyl Oxindoles",2024,"Organic Letters","ACS Publications","https://pubs.acs.org/doi/abs/10.1021/acs.orglett.4c02177","https://scholar.google.com/scholar?cites=8848997131825435909&as_sdt=2005&sciodt=0,5&hl=en",506,"2025-05-19 18:00:53","","10.1021/acs.orglett.4c02177","","",,,,,9,9.00,2,4,1,"… To comprehend the diastereoselective outcome, we have carried out a DFT study at the SMD (MeCN) /UM06–2x/6-311++G(d,p)//SMD (MeCN) /UM06–2x/6-31G(d) level of theory. The …","https://chemrxiv.org/engage/api-gateway/chemrxiv/assets/orp/resource/item/660eb4b721291e5d1d0c54aa/original/photoredox-catalyzed-strain-release-driven-synthesis-of-functionalized-spirocyclobutyl-oxindoles.pdf","https://scholar.google.com/scholar?q=related:BdXn5AH0zXoJ:scholar.google.com/&scioq=source:%22organic+letters%22+%221523+7052%22+transition+metal+dft&hl=en&as_sdt=0,5&as_vis=1"
1,"S Medvedko, M Ströbele, M Fechter, A Fischer…","Synthesis of Thiourea and Thioamide S-Oxides via SO Transfer from a Thiirane S-Oxide onto N-Heterocyclic Carbenes",2024,"Organic …","ACS Publications","https://pubs.acs.org/doi/abs/10.1021/acs.orglett.4c02253","https://scholar.google.com/scholar?cites=17215818631613240739&as_sdt=2005&sciodt=0,5&hl=en",507,"2025-05-19 18:00:53","","10.1021/acs.orglett.4c02253","","",,,,,1,1.00,0,5,1,"… Reaction conditions and DFT computations suggest a … Simple DFT computations suggest that the reaction might … been seen for some transition metal complexes where coordination …","","https://scholar.google.com/scholar?q=related:o9XbBtXf6u4J:scholar.google.com/&scioq=source:%22organic+letters%22+%221523+7052%22+transition+metal+dft&hl=en&as_sdt=0,5&as_vis=1"
72,"X Zeng, S Liu, Z Shi, B Xu","Hydrogen Bonding Cluster-Enabled Addition of Sulfonic Acids to Haloalkynes: Access to Both (E)- and (Z)-Alkenyl Sulfonates",2016,"Organic Letters","ACS Publications","https://pubs.acs.org/doi/abs/10.1021/acs.orglett.6b02061","https://scholar.google.com/scholar?cites=16653311642935020283&as_sdt=2005&sciodt=0,5&hl=en",508,"2025-05-19 18:00:53","","10.1021/acs.orglett.6b02061","","",,,,,72,8.00,18,4,9,"… DFT calculations indicate that … via transition metal or superacid catalysis. A hydrogen bonding network or cluster has the advantages of being environmentally friendly (vs transition metal…","","https://scholar.google.com/scholar?q=related:-8oEy7RyHOcJ:scholar.google.com/&scioq=source:%22organic+letters%22+%221523+7052%22+transition+metal+dft&hl=en&as_sdt=0,5&as_vis=1"
59,"H Han, T Zhang, SD Yang, Y Lan, JB Xia","Palladium-catalyzed enantioselective C–H aminocarbonylation: synthesis of chiral isoquinolinones",2019,"Organic Letters","ACS Publications","https://pubs.acs.org/doi/abs/10.1021/acs.orglett.9b00315","https://scholar.google.com/scholar?cites=18066595656730151236&as_sdt=2005&sciodt=0,5&hl=en",509,"2025-05-19 18:00:53","","10.1021/acs.orglett.9b00315","","",,,,,59,9.83,12,5,6,"… density functional theory (DFT) method M06 to calculate the free energy profiles for the possible reaction pathways. As shown in Figure 1, Pd(II) amino acid salt 8, which is considered to …","","https://scholar.google.com/scholar?q=related:RAkEZAdxufoJ:scholar.google.com/&scioq=source:%22organic+letters%22+%221523+7052%22+transition+metal+dft&hl=en&as_sdt=0,5&as_vis=1"
9,"JF Bai, J Tang, X Gao, ZJ Jiang, B Tang, J Chen…","Regioselective Cycloaddition and Substitution Reaction of Tertiary Propargylic Alcohols and Heteroareneboronic Acids via Acid Catalysis",2022,"Organic …","ACS Publications","https://pubs.acs.org/doi/abs/10.1021/acs.orglett.2c01403","https://scholar.google.com/scholar?cites=488637502599067637&as_sdt=2005&sciodt=0,5&hl=en",510,"2025-05-19 18:00:53","","10.1021/acs.orglett.2c01403","","",,,,,9,3.00,1,7,3,"We report an acid-catalyzed formal cycloaddition and dehydrative substitution reaction of tertiary propargylic alcohols and heteroareneboronic acids. The properties of the substituents …","","https://scholar.google.com/scholar?q=related:9fdZPjj9xwYJ:scholar.google.com/&scioq=source:%22organic+letters%22+%221523+7052%22+transition+metal+dft&hl=en&as_sdt=0,5&as_vis=1"
36,"T Delouche, A Mocanu, T Roisnel, R Szucs…","π-Extended Phosphepines: Redox and Optically Active P-Heterocycles with Nonplanar Framework",2019,"Organic …","ACS Publications","https://pubs.acs.org/doi/abs/10.1021/acs.orglett.8b04064","https://scholar.google.com/scholar?cites=7530984182568793776&as_sdt=2005&sciodt=0,5&hl=en",511,"2025-05-19 18:00:53","","10.1021/acs.orglett.8b04064","","",,,,,36,6.00,7,5,6,"In this letter, we present the synthesis of a new family of π-extended dithieno[b,f]phosphepines. The Pd-catalyzed direct arylation allows the introduction of various substituents, which …","https://hal.science/hal-01992161/document","https://scholar.google.com/scholar?q=related:sDYZkzZug2gJ:scholar.google.com/&scioq=source:%22organic+letters%22+%221523+7052%22+transition+metal+dft&hl=en&as_sdt=0,5&as_vis=1"
228,"R Martínez, F Zapata, A Caballero, A Espinosa…","2-Aza-1,3-butadiene Derivatives Featuring an Anthracene or Pyrene Unit:  Highly Selective Colorimetric and Fluorescent Signaling of Cu2+ Cation",2006,"Organic …","ACS Publications","https://pubs.acs.org/doi/abs/10.1021/ol0610791","https://scholar.google.com/scholar?cites=16357485571080891484&as_sdt=2005&sciodt=0,5&hl=en",512,"2025-05-19 18:00:53","","10.1021/ol0610791","","",,,,,228,12.00,46,5,19,"… The soft transition metal ion Cu 2+ is third in abundance (after Fe 2+ and Zn 2+ ) among the essential heavy metal ions in the human body and plays a pivotal role in a variety of …","https://www.academia.edu/download/47276480/-Aza-13-butadiene_Derivatives_Featuring_20160715-25002-2qva6n.pdf","https://scholar.google.com/scholar?q=related:XKzaEnZ2AeMJ:scholar.google.com/&scioq=source:%22organic+letters%22+%221523+7052%22+transition+metal+dft&hl=en&as_sdt=0,5&as_vis=1"
42,"GA Jones, MN Paddon-Row, MS Sherburn…","On the Endo/Exo Stereoselectivity of Intramolecular Diels−Alder Reactions of Hexadienylacrylates:  An Interesting Failure of Density Functional Theory",2002,"Organic …","ACS Publications","https://pubs.acs.org/doi/abs/10.1021/ol0264713","https://scholar.google.com/scholar?cites=13656633095729091577&as_sdt=2005&sciodt=0,5&hl=en",513,"2025-05-19 18:00:53","","10.1021/ol0264713","","",,,,,42,1.83,11,4,23,"… In summary, DFT should not be used to calculate the relative energies of stereoisomeric TSs that possess differing degrees of conjugation. Instead, we recommend the MP2//B3LYP …","","https://scholar.google.com/scholar?q=related:-ZPG0nEbhr0J:scholar.google.com/&scioq=source:%22organic+letters%22+%221523+7052%22+transition+metal+dft&hl=en&as_sdt=0,5&as_vis=1"
22,"B Darses, P Maldivi, C Philouze, P Dauban…","Asymmetric Intramolecular Buchner Reaction: From High Stereoselectivity to Coexistence of Norcaradiene, Cycloheptatriene, and an Intermediate Form in the Solid …",2021,"Organic …","ACS Publications","https://pubs.acs.org/doi/abs/10.1021/acs.orglett.0c03774","https://scholar.google.com/scholar?cites=11908249911505944866&as_sdt=2005&sciodt=0,5&hl=en",514,"2025-05-19 18:00:53","","10.1021/acs.orglett.0c03774","","",,,,,22,5.50,4,5,4,"… We thus decided to model the thermodynamics profile of the isomers of 2e at 298 K using Density Functional Theory (DFT) calculations to evaluate the Gibbs energies of the …","https://hal.science/hal-03371078v1/file/Version%20HAL.pdf","https://scholar.google.com/scholar?q=related:IoHjrzOaQqUJ:scholar.google.com/&scioq=source:%22organic+letters%22+%221523+7052%22+transition+metal+dft&hl=en&as_sdt=0,5&as_vis=1"
70,"S Gao, Z Wu, X Fang, A Lin, H Yao","Palladium-catalyzed dearomative allylic alkylation of indoles with alkynes to synthesize indolenines with C3-quarternary centers",2016,"Organic Letters","ACS Publications","https://pubs.acs.org/doi/abs/10.1021/acs.orglett.6b01947","https://scholar.google.com/scholar?cites=10446788816260170826&as_sdt=2005&sciodt=0,5&hl=en",515,"2025-05-19 18:00:53","","10.1021/acs.orglett.6b01947","","",,,,,70,7.78,14,5,9,"A palladium-catalyzed dearomative allylic alkylation of indoles with alkynes to construct indolenines with C3-quarternary centers was reported. The in situ formed arylallene …","http://pstorage-acs-6854636.s3.amazonaws.com/5522612/ol6b01947_si_001.pdf","https://scholar.google.com/scholar?q=related:SgS2NBRz-pAJ:scholar.google.com/&scioq=source:%22organic+letters%22+%221523+7052%22+transition+metal+dft&hl=en&as_sdt=0,5&as_vis=1"
58,"L Saya, I Fernandez, F Lopez, JL Mascarenas","Nickel-catalyzed intramolecular [3+ 2+ 2] cycloadditions of alkylidenecyclopropanes. A straightforward entry to fused 6, 7, 5-tricyclic systems",2014,"Organic Letters","ACS Publications","https://pubs.acs.org/doi/abs/10.1021/ol502288x","https://scholar.google.com/scholar?cites=10366415660988943365&as_sdt=2005&sciodt=0,5&hl=en",516,"2025-05-19 18:00:53","","10.1021/ol502288x","","",,,,,58,5.27,15,4,11,"… information on the reaction mechanism and, in particular, to gain insights into the effect of the external ligand in the [3 + 2 + 2] cycloaddition of enediynes like 1i–k, we carried out a DFT …","https://pubs.acs.org/doi/full/10.1021/ol502288x","https://scholar.google.com/scholar?q=related:BcxKux7o3I8J:scholar.google.com/&scioq=source:%22organic+letters%22+%221523+7052%22+transition+metal+dft&hl=en&as_sdt=0,5&as_vis=1"
66,"QQ Li, ZF Xiao, CZ Yao, HX Zheng, YB Kang","Direct alkylation of amines with alcohols catalyzed by base",2015,"Organic Letters","ACS Publications","https://pubs.acs.org/doi/abs/10.1021/acs.orglett.5b02685","https://scholar.google.com/scholar?cites=9218446706484412758&as_sdt=2005&sciodt=0,5&hl=en",517,"2025-05-19 18:00:53","","10.1021/acs.orglett.5b02685","","",,,,,66,6.60,13,5,10,"… In our investigation on the transition-metal-catalyzed oxidative coupling of benzyl alcohol 1a … , transition metals such as Pd, Ru, and Cu were not observed. Highly pure (99.999% metal …","","https://scholar.google.com/scholar?q=related:VoHfKHCA7n8J:scholar.google.com/&scioq=source:%22organic+letters%22+%221523+7052%22+transition+metal+dft&hl=en&as_sdt=0,5&as_vis=1"
6,"SL Hejnosz, DR Beres, AH Cocolas, MJ Neal…","Cycloadditions of Tertiary Amine N-Oxides and Silyl Imines as an Innovative Route to 1,2-Diamines",2023,"Organic …","ACS Publications","https://pubs.acs.org/doi/abs/10.1021/acs.orglett.3c01396","https://scholar.google.com/scholar?cites=9314871146588854510&as_sdt=2005&sciodt=0,5&hl=en",518,"2025-05-19 18:00:53","3 + 2","10.1021/acs.orglett.3c01396","","",,,,,6,3.00,1,5,2,"… Finally, using DFT modeling, we propose a reasonable mechanism that agrees with our previously reported data. This approach allows for variable substitutions and flexibility that other …","https://pubs.acs.org/doi/full/10.1021/acs.orglett.3c01396","https://scholar.google.com/scholar?q=related:7tj2nPQRRYEJ:scholar.google.com/&scioq=source:%22organic+letters%22+%221523+7052%22+transition+metal+dft&hl=en&as_sdt=0,5&as_vis=1"
142,"RI McDonald, PB White, AB Weinstein, CP Tam…","Enantioselective Pd (II)-catalyzed aerobic oxidative amidation of alkenes and insights into the role of electronic asymmetry in pyridine-oxazoline ligands",2011,"Organic …","ACS Publications","https://pubs.acs.org/doi/abs/10.1021/ol200784y","https://scholar.google.com/scholar?cites=80250078460032243&as_sdt=2005&sciodt=0,5&hl=en",519,"2025-05-19 18:00:53","","10.1021/ol200784y","","",,,,,142,10.14,28,5,14,"… DFT calculations suggest that the electronic asymmetry of the pyrox ligand synergizes with steric asymmetry to control the stereochemical outcome of the key amidopalladation step. …","https://pmc.ncbi.nlm.nih.gov/articles/PMC3103601/pdf/nihms-293520.pdf","https://scholar.google.com/scholar?q=related:87TOawUbHQEJ:scholar.google.com/&scioq=source:%22organic+letters%22+%221523+7052%22+transition+metal+dft&hl=en&as_sdt=0,5&as_vis=1"
0,"P Singh, Deepshikha, N Lal, MV Mane…","Ruthenium-Catalyzed Intramolecular Allene–alkyne Cascade Cyclization: Access to the Sulfone-cyclopenta[a]naphthalene Core",2025,"Organic Letters","ACS Publications","https://pubs.acs.org/doi/abs/10.1021/acs.orglett.4c04659","",520,"2025-05-19 18:00:53","","10.1021/acs.orglett.4c04659","","",,,,,0,0.00,0,5,1,"… To shed light on the mechanism, we conducted density functional theory (DFT) calculations by employing the Gaussian 16 suite of programs. (19) As shown in Scheme 1A, the …","","https://scholar.google.com/scholar?q=related:rb_CLlvCkdgJ:scholar.google.com/&scioq=source:%22organic+letters%22+%221523+7052%22+transition+metal+dft&hl=en&as_sdt=0,5&as_vis=1"
83,"F Labre, Y Gimbert, P Bannwarth, S Olivero…","Application of cooperative iron/copper catalysis to a palladium-free borylation of aryl bromides with pinacolborane",2014,"Organic …","ACS Publications","https://pubs.acs.org/doi/abs/10.1021/ol500675q","https://scholar.google.com/scholar?cites=15442887313947536109&as_sdt=2005&sciodt=0,5&hl=en",521,"2025-05-19 18:00:53","","10.1021/ol500675q","","",,,,,83,7.55,17,5,11,"… action (10) of two transition metals, where each metal is competent for different steps in the … , characterization data of all products, DFT calculation details and geometries, copies of 1 H …","","https://scholar.google.com/scholar?q=related:7ao6LjEoUNYJ:scholar.google.com/&scioq=source:%22organic+letters%22+%221523+7052%22+transition+metal+dft&hl=en&as_sdt=0,5&as_vis=1"
0,"B Gopal, M Lamba, A Kushwaha, PR Singh…","Nucleophilic Ring Opening of Donor–Acceptor Cyclopropanes through Umpolung Reactivity of Organochlorophosphines: Phosphine Oxide-Functionalized Boron …",2024,"Organic …","ACS Publications","https://pubs.acs.org/doi/abs/10.1021/acs.orglett.4c02418","",522,"2025-05-19 18:00:53","","10.1021/acs.orglett.4c02418","","",,,,,0,0.00,0,5,1,"… The enol form was identified by single-crystal XRD analysis, and DFT … transition metals and promotes the usage of readily available, cheaper, and nontoxic earth-abundant elements. …","","https://scholar.google.com/scholar?q=related:8w-oYIvf1UgJ:scholar.google.com/&scioq=source:%22organic+letters%22+%221523+7052%22+transition+metal+dft&hl=en&as_sdt=0,5&as_vis=1"
