Cites,Authors,Title,Year,Source,Publisher,ArticleURL,CitesURL,GSRank,QueryDate,Type,DOI,ISSN,CitationURL,Volume,Issue,StartPage,EndPage,ECC,CitesPerYear,CitesPerAuthor,AuthorCount,Age,Abstract,FullTextURL,RelatedURL
15,"V Hosseininasab, IM DiMucci, P Ghosh, JA Bertke…","Lewis acid-assisted reduction of nitrite to nitric and nitrous oxides via the elusive nitrite radical dianion",2022,"… chemistry","nature.com","https://www.nature.com/articles/s41557-022-01025-9","https://scholar.google.com/scholar?cites=7869693259489829213&as_sdt=2005&sciodt=0,5&hl=en",326,"2025-05-05 15:49:10","HTML","","","",,,,,15,5.00,3,5,3,"… Hybrid density functional theory (DFT) calculations using the B3LYP hybrid density … Time-dependent DFT calculations of the N K-edge XAS confirm that the pre-edge feature in the …","https://www.nature.com/articles/s41557-022-01025-9","https://scholar.google.com/scholar?q=related:XWEt91LENm0J:scholar.google.com/&scioq=source:%22nature+chemistry%22+cross+coupling+dft&hl=en&as_sdt=0,5&as_vis=1"
0,"G Zhan, B Koek, Y Yuan, Y Liu, V Mishra, V Lenzi…","Moiré two-dimensional covalent organic framework superlattices",2025,"Nature Chemistry","nature.com","https://www.nature.com/articles/s41557-025-01748-5","",327,"2025-05-05 15:49:10","HTML","","","",,,,,0,0.00,0,7,1,"… In addition, a second set of DFT calculations incorporating D3 dispersion corrections were … Utilizing DFT, we investigated the influence of the twist angle on structural energies. …","https://www.nature.com/articles/s41557-025-01748-5","https://scholar.google.com/scholar?q=related:Wpl2h1qidZQJ:scholar.google.com/&scioq=source:%22nature+chemistry%22+cross+coupling+dft&hl=en&as_sdt=0,5&as_vis=1"
47,"J Lawrence, A Berdonces-Layunta, S Edalatmanesh…","Circumventing the stability problems of graphene nanoribbon zigzag edges",2022,"Nature Chemistry","nature.com","https://www.nature.com/articles/s41557-022-01042-8","https://scholar.google.com/scholar?cites=16546803235481756428&as_sdt=2005&sciodt=0,5&hl=en",328,"2025-05-05 15:49:10","HTML","","","",,,,,47,15.67,12,4,3,"… (BR-STM) and non-contact atomic force microscopy (nc-AFM), along with scanning tunnelling spectroscopy, X-ray photoemission spectroscopy (XPS) and density functional theory (DFT…","https://www.nature.com/articles/s41557-022-01042-8","https://scholar.google.com/scholar?q=related:DKMsu98NouUJ:scholar.google.com/&scioq=source:%22nature+chemistry%22+cross+coupling+dft&hl=en&as_sdt=0,5&as_vis=1"
0,"JA Seed, X Deng, J Tomeček, A Brookfield…","Valence-delocalized trithorium nanocluster superatoms with open-shell exalted diamagnetism",2025,"Nature Chemistry","nature.com","https://www.nature.com/articles/s41557-025-01790-3","",329,"2025-05-05 15:49:10","HTML","","","",,,,,0,0.00,0,5,1,"… Hence, 4′ has predominant single-reference character, and density functional theory (DFT) is thus an appropriate method with which to probe its electronic structure. PBE0 all-electron …","https://www.nature.com/articles/s41557-025-01790-3","https://scholar.google.com/scholar?q=related:K15tRmxp2_MJ:scholar.google.com/&scioq=source:%22nature+chemistry%22+cross+coupling+dft&hl=en&as_sdt=0,5&as_vis=1"
153,"M Stei, E Carrascosa, MA Kainz, AH Kelkar, J Meyer…","Influence of the leaving group on the dynamics of a gas-phase SN2 reaction",2016,"… chemistry","nature.com","https://www.nature.com/articles/nchem.2400","https://scholar.google.com/scholar?cites=17820328038352613885&as_sdt=2005&sciodt=0,5&hl=en",330,"2025-05-05 15:49:10","HTML","","","",,,,,153,17.00,26,6,9,"… To shed light on the origin of the differences for the Cl − and I − leaving groups, we tested the influence of the vibrational coupling between the entrance and the exit channel by …","https://www.nature.com/articles/nchem.2400","https://scholar.google.com/scholar?q=related:_fHwSu-FTvcJ:scholar.google.com/&scioq=source:%22nature+chemistry%22+cross+coupling+dft&hl=en&as_sdt=0,5&as_vis=1"
17,"J Luo, L Lu, M Montag, Y Liang, D Milstein","Hydrogenative alkene perdeuteration aided by a transient cooperative ligand",2023,"Nature Chemistry","nature.com","https://www.nature.com/articles/s41557-023-01313-y","https://scholar.google.com/scholar?cites=12882075341651323254&as_sdt=2005&sciodt=0,5&hl=en",331,"2025-05-05 15:49:10","HTML","","","",,,,,17,8.50,3,5,2,"… Based on the above and previous results 25 , as well as density functional theory (DFT) calculations, we propose a mechanism for H 2 deuteration, as shown in Fig. 2c (Extended Data …","https://www.nature.com/articles/s41557-023-01313-y","https://scholar.google.com/scholar?q=related:dinyZEVTxrIJ:scholar.google.com/&scioq=source:%22nature+chemistry%22+cross+coupling+dft&hl=en&as_sdt=0,5&as_vis=1"
566,"RK Hocking, R Brimblecombe, LY Chang, A Singh…","Water-oxidation catalysis by manganese in a geochemical-like cycle",2011,"… chemistry","nature.com","https://www.nature.com/articles/nchem.1049","https://scholar.google.com/scholar?cites=13214518865207551342&as_sdt=2005&sciodt=0,5&hl=en",332,"2025-05-05 15:49:10","HTML","","","",,,,,566,40.43,113,5,14,"Water oxidation in all oxygenic photosynthetic organisms is catalysed by the Mn 4 CaO 4 cluster of Photosystem II. This cluster has inspired the development of synthetic manganese …","https://www.nature.com/articles/nchem.1049","https://scholar.google.com/scholar?q=related:buVk9uRmY7cJ:scholar.google.com/&scioq=source:%22nature+chemistry%22+cross+coupling+dft&hl=en&as_sdt=0,5&as_vis=1"
194,"H Ito, S Kunii, M Sawamura","Direct enantio-convergent transformation of racemic substrates without racemization or symmetrization",2010,"Nature Chemistry","nature.com","https://www.nature.com/articles/nchem.801","https://scholar.google.com/scholar?cites=12981067670430719301&as_sdt=2005&sciodt=0,5&hl=en",333,"2025-05-05 15:49:10","HTML","","","",,,,,194,12.93,65,3,15,"Asymmetric reactions that transform racemic mixtures into enantio-enriched products are in high demand, but classical kinetic resolution produces enantiopure compounds in <50% …","https://www.nature.com/articles/nchem.801","https://scholar.google.com/scholar?q=related:RZ1UBUUEJrQJ:scholar.google.com/&scioq=source:%22nature+chemistry%22+cross+coupling+dft&hl=en&as_sdt=0,5&as_vis=1"
103,"S Knecht, HJA Jensen, T Saue","Relativistic quantum chemical calculations show that the uranium molecule U2 has a quadruple bond",2019,"Nature chemistry","nature.com","https://www.nature.com/articles/s41557-018-0158-9","https://scholar.google.com/scholar?cites=6651087204398729570&as_sdt=2005&sciodt=0,5&hl=en",334,"2025-05-05 15:49:10","HTML","","","",,,,,103,17.17,34,3,6,"… The latter case implies that spin–orbit coupling reduces the ferromagnetic character of the coupling of the six unpaired electrons in both states 33 . We can, however, not provide a …","https://www.nature.com/articles/s41557-018-0158-9","https://scholar.google.com/scholar?q=related:YglVzJJoTVwJ:scholar.google.com/&scioq=source:%22nature+chemistry%22+cross+coupling+dft&hl=en&as_sdt=0,5&as_vis=1"
242,"MD Allendorf, V Stavila, JL Snider, M Witman…","Challenges to developing materials for the transport and storage of hydrogen",2022,"… chemistry","nature.com","https://www.nature.com/articles/s41557-022-01056-2","https://scholar.google.com/scholar?cites=17090392252861218908&as_sdt=2005&sciodt=0,5&hl=en",335,"2025-05-05 15:49:10","HTML","","","",,,,,242,80.67,48,5,3,"… Density functional theory calculations are now regularly executed within high-throughput material property predictions 116,117,118 and have already been used for large-scale …","https://www.nature.com/articles/s41557-022-01056-2","https://scholar.google.com/scholar?q=related:XIDhhzRFLe0J:scholar.google.com/&scioq=source:%22nature+chemistry%22+cross+coupling+dft&hl=en&as_sdt=0,5&as_vis=1"
5,"D Kass, VA Larson, T Corona, U Kuhlmann…","Trapping of a phenoxyl radical at a non-haem high-spin iron (II) centre",2024,"Nature Chemistry","nature.com","https://www.nature.com/articles/s41557-023-01405-9","https://scholar.google.com/scholar?cites=15867540329582185523&as_sdt=2005&sciodt=0,5&hl=en",336,"2025-05-05 15:49:10","HTML","","","",,,,,5,5.00,1,5,1,"… These results indicate a systematic error in the DFT calculations, which overestimate the … to be an intrinsic deficiency of the present DFT approach. Nevertheless, these results allow us …","https://www.nature.com/articles/s41557-023-01405-9","https://scholar.google.com/scholar?q=related:M0zuI9zTNNwJ:scholar.google.com/&scioq=source:%22nature+chemistry%22+cross+coupling+dft&hl=en&as_sdt=0,5&as_vis=1"
54,"A Martin, P Rivera-Fuentes","A general strategy to develop fluorogenic polymethine dyes for bioimaging",2024,"Nature Chemistry","nature.com","https://www.nature.com/articles/s41557-023-01367-y","https://scholar.google.com/scholar?cites=6164688965177667199&as_sdt=2005&sciodt=0,5&hl=en",337,"2025-05-05 15:49:10","HTML","","","",,,,,54,54.00,27,2,1,"… To test our hypothesis, we used density functional theory (DFT) to calculate the energies of ring opening and closure for HMSiR (1)—a silicon rhodamine derivative with an efficient 5-…","https://www.nature.com/articles/s41557-023-01367-y","https://scholar.google.com/scholar?q=related:f24vsPNfjVUJ:scholar.google.com/&scioq=source:%22nature+chemistry%22+cross+coupling+dft&hl=en&as_sdt=0,5&as_vis=1"
48,"W Mu, L Jia, M Zhou, J Wu, Y Lin, S Mann, Y Qiao","Superstructural ordering in self-sorting coacervate-based protocell networks",2024,"Nature Chemistry","nature.com","https://www.nature.com/articles/s41557-023-01356-1","https://scholar.google.com/scholar?cites=17211870418553144244&as_sdt=2005&sciodt=0,5&hl=en",338,"2025-05-05 15:49:10","HTML","","","",,,,,48,48.00,7,7,1,"… Similar to literature reports 60,61 , DFT calculations used the B3LYP exchange-correlation and 6–31 G basis set. The solvent effect was considered by using a conductor-like screening …","https://www.nature.com/articles/s41557-023-01356-1","https://scholar.google.com/scholar?q=related:tAPqCfTY3O4J:scholar.google.com/&scioq=source:%22nature+chemistry%22+cross+coupling+dft&hl=en&as_sdt=0,5&as_vis=1"
1,"Y Li, GJ Stec, HK Kim, S Thapa, SL Zheng…","Self-assembly of chiroptical ionic co-crystals from silver nanoclusters and organic macrocycles",2025,"Nature Chemistry","nature.com","https://www.nature.com/articles/s41557-024-01696-6","https://scholar.google.com/scholar?cites=16116336077632264780&as_sdt=2005&sciodt=0,5&hl=en",339,"2025-05-05 15:49:10","HTML","","","",,,,,1,1.00,0,6,1,"… to the silver nanoclusters, the interactions between TATA3C 7 + and Ag 25 (SR) 18 − were analysed through a combination of crystallography and density function theory (DFT) …","https://www.nature.com/articles/s41557-024-01696-6","https://scholar.google.com/scholar?q=related:TFoVTEa6qN8J:scholar.google.com/&scioq=source:%22nature+chemistry%22+cross+coupling+dft&hl=en&as_sdt=0,5&as_vis=1"
110,"CM Krest, A Silakov, J Rittle, TH Yosca, EL Onderko…","Significantly shorter Fe–S bond in cytochrome P450-I is consistent with greater reactivity relative to chloroperoxidase",2015,"… chemistry","nature.com","https://www.nature.com/articles/nchem.2306","https://scholar.google.com/scholar?cites=10806158968199224839&as_sdt=2005&sciodt=0,5&hl=en",340,"2025-05-05 15:49:10","HTML","","","",,,,,110,11.00,18,6,10,"… to affect the exchange coupling of compound I. Electron paramagnetic resonance (EPR) measurements on CPO-I have revealed strong antiferromagnetic coupling between the S = 1 …","https://www.nature.com/articles/nchem.2306","https://scholar.google.com/scholar?q=related:B57q_VMw95UJ:scholar.google.com/&scioq=source:%22nature+chemistry%22+cross+coupling+dft&hl=en&as_sdt=0,5&as_vis=1"
9,"Y Schulte, C Wölper, SM Rupf, M Malischewski…","Structural characterization and reactivity of a room-temperature-stable, antiaromatic cyclopentadienyl cation salt",2024,"Nature Chemistry","nature.com","https://www.nature.com/articles/s41557-023-01417-5","https://scholar.google.com/scholar?cites=10785335374812002510&as_sdt=2005&sciodt=0,5&hl=en",341,"2025-05-05 15:49:10","HTML","","","",,,,,9,9.00,2,5,1,"… DFT and double-hybrid DFT methods, as implemented in the quantum chemistry program packages Gaussian16 76 , Amsterdam Density Functional (ADF) 77 and Orca 5.0.0 , were …","https://www.nature.com/articles/s41557-023-01417-5","https://scholar.google.com/scholar?q=related:zrgfV2E1rZUJ:scholar.google.com/&scioq=source:%22nature+chemistry%22+cross+coupling+dft&hl=en&as_sdt=0,5&as_vis=1"
124,"W Kulig, N Agmon","A 'clusters-in-liquid'method for calculating infrared spectra identifies the proton-transfer mode in acidic aqueous solutions",2013,"Nature chemistry","nature.com","https://www.nature.com/articles/nchem.1503","https://scholar.google.com/scholar?cites=7340258417838722930&as_sdt=2005&sciodt=0,5&hl=en",342,"2025-05-05 15:49:10","HTML","","","",,,,,124,10.33,62,2,12,"… To verify this, we calculated optimized geometries and infrared spectra for n = 2–6 clusters using density functional theory (DFT) at the B3LYP/aug-cc-pVTZ level. For n = 3–6 the global …","https://www.nature.com/articles/nchem.1503","https://scholar.google.com/scholar?q=related:cg_ZAiTW3WUJ:scholar.google.com/&scioq=source:%22nature+chemistry%22+cross+coupling+dft&hl=en&as_sdt=0,5&as_vis=1"
6,"A Del Rio Flores, R Zhai, DW Kastner, K Seshadri…","Enzymatic synthesis of azide by a promiscuous N-nitrosylase",2024,"Nature Chemistry","nature.com","https://www.nature.com/articles/s41557-024-01646-2","https://scholar.google.com/scholar?cites=9481631663251518470&as_sdt=2005&sciodt=0,5&hl=en",343,"2025-05-05 15:49:10","HTML","","","",,,,,6,6.00,1,5,1,"… TS) geometries were initially optimized using density functional theory (DFT) with the global … -empirical DFT-D3 dispersion correction with default Becke–Johnson damping 62 to all DFT …","https://www.nature.com/articles/s41557-024-01646-2","https://scholar.google.com/scholar?q=related:BvQzC8OFlYMJ:scholar.google.com/&scioq=source:%22nature+chemistry%22+cross+coupling+dft&hl=en&as_sdt=0,5&as_vis=1"
107,"S Schrettl, C Stefaniu, C Schwieger, G Pasche…","Functional carbon nanosheets prepared from hexayne amphiphile monolayers at room temperature",2014,"… chemistry","nature.com","https://www.nature.com/articles/nchem.1939","https://scholar.google.com/scholar?cites=16474562245764030845&as_sdt=2005&sciodt=0,5&hl=en",344,"2025-05-05 15:49:10","HTML","","","",,,,,107,9.73,21,5,11,"… with regard to the experimentally inaccessible dihedral angles between the head group, and the hexayne and dodecyl segments, we performed geometry optimizations by DFT …","https://www.nature.com/articles/nchem.1939","https://scholar.google.com/scholar?q=related:faHTmBNnoeQJ:scholar.google.com/&scioq=source:%22nature+chemistry%22+cross+coupling+dft&hl=en&as_sdt=0,5&as_vis=1"
1,"S Ghosh, NL Frank","Noncovalent interactions enable optical initialization of spin-based quantum states",2025,"Nature Chemistry","nature.com","https://www.nature.com/articles/s41557-025-01786-z","https://scholar.google.com/scholar?cites=10303476793091417574&as_sdt=2005&sciodt=0,5&hl=en",345,"2025-05-05 15:49:10","HTML","","","",,,,,1,1.00,1,2,1,"… The structure of the assembled pairs was modelled by density functional theory to support the predicted triple-hydrogen-bonded pattern in the structures for PDI–H:TZ–TEMPO and PDI–…","https://www.nature.com/articles/s41557-025-01786-z","https://scholar.google.com/scholar?q=related:5uWxm41N_Y4J:scholar.google.com/&scioq=source:%22nature+chemistry%22+cross+coupling+dft&hl=en&as_sdt=0,5&as_vis=1"
86,"Y Ye, J Cao, DG Oblinsky, D Verma, CK Prier…","Using enzymes to tame nitrogen-centred radicals for enantioselective hydroamination",2023,"… chemistry","nature.com","https://www.nature.com/articles/s41557-022-01083-z","https://scholar.google.com/scholar?cites=6268146549753904832&as_sdt=2005&sciodt=0,5&hl=en",346,"2025-05-05 15:49:10","HTML","","","",,,,,86,43.00,14,6,2,"… mechanisms that exploit the inherent nucleophilicity of amines coupled with the electrophilicity of carbonyls and alkenes … Qiao for assistance with density functional theory calculations. …","https://www.nature.com/articles/s41557-022-01083-z","https://scholar.google.com/scholar?q=related:wP4rshPu_FYJ:scholar.google.com/&scioq=source:%22nature+chemistry%22+cross+coupling+dft&hl=en&as_sdt=0,5&as_vis=1"
5,"S Doobary, AJD Lacey, SG Sweeting, SB Coppock…","Diastereodivergent nucleophile–nucleophile alkene chlorofluorination",2024,"Nature Chemistry","nature.com","https://www.nature.com/articles/s41557-024-01561-6","https://scholar.google.com/scholar?cites=10366043708899733917&as_sdt=2005&sciodt=0,5&hl=en",347,"2025-05-05 15:49:10","HTML","","","",,,,,5,5.00,1,5,1,"… An explanation for the current limitation of syn-chlorofluorination to homo-allylic amines was revealed by DFT calculations of iodine(III)–π complex formation with IF 2 (Supplementary Fig…","https://www.nature.com/articles/s41557-024-01561-6","https://scholar.google.com/scholar?q=related:nTEk49SV248J:scholar.google.com/&scioq=source:%22nature+chemistry%22+cross+coupling+dft&hl=en&as_sdt=0,5&as_vis=1"
1,"H Lv, X Dong, R Li, C Zeng, X Zhang, Y Song, H Liu…","Super-dry reforming of methane using a tandem electro-thermocatalytic system",2025,"Nature Chemistry","nature.com","https://www.nature.com/articles/s41557-025-01768-1","https://scholar.google.com/scholar?cites=12876458694512478437&as_sdt=2005&sciodt=0,5&hl=en",348,"2025-05-05 15:49:10","HTML","","","",,,,,1,1.00,0,8,1,"… Density functional theory (DFT) calculations were performed to investigate the effects of the support, namely, the exposed crystal facet effects of SDC on V O formation and Rh NP …","https://www.nature.com/articles/s41557-025-01768-1","https://scholar.google.com/scholar?q=related:5Qho0_VesrIJ:scholar.google.com/&scioq=source:%22nature+chemistry%22+cross+coupling+dft&hl=en&as_sdt=0,5&as_vis=1"
101,"BK Shaw, AR Hughes, M Ducamp, S Moss…","Melting of hybrid organic–inorganic perovskites",2021,"… chemistry","nature.com","https://www.nature.com/articles/s41557-021-00681-7","https://scholar.google.com/scholar?cites=9709633304697591864&as_sdt=2005&sciodt=0,5&hl=en",349,"2025-05-05 15:49:10","HTML","","","",,,,,101,25.25,20,5,4,"… nature of bond breaking prevented the use of classical force fields and so FPMD simulations based on a quantum chemical description of the system at the density functional theory …","https://www.nature.com/articles/s41557-021-00681-7","https://scholar.google.com/scholar?q=related:OFjN-QuMv4YJ:scholar.google.com/&scioq=source:%22nature+chemistry%22+cross+coupling+dft&hl=en&as_sdt=0,5&as_vis=1"
15,"A Gomez, WH Thompson, D Laage","Neural-network-based molecular dynamics simulations reveal that proton transport in water is doubly gated by sequential hydrogen-bond exchange",2024,"Nature Chemistry","nature.com","https://www.nature.com/articles/s41557-024-01593-y","https://scholar.google.com/scholar?cites=6701228950907604594&as_sdt=2005&sciodt=0,5&hl=en",350,"2025-05-05 15:49:10","HTML","","","",,,,,15,15.00,5,3,1,"… We have trained a DNN potential at the revPBE0-D3 hybrid density functional theory (DFT) level and used it to perform simulations of an excess proton in water at ambient conditions …","https://www.nature.com/articles/s41557-024-01593-y","https://scholar.google.com/scholar?q=related:ck5p6TmM_1wJ:scholar.google.com/&scioq=source:%22nature+chemistry%22+cross+coupling+dft&hl=en&as_sdt=0,5&as_vis=1"
0,"P Chuai, Z Hu, YR Yao, Z Jiang, A Ullah, Y Zhao…","Lanthanide–nickel molecular intermetallic complexes featuring a ligand-free Ni2− anion in endohedral fullerenes",2025,"Nature Chemistry","nature.com","https://www.nature.com/articles/s41557-025-01802-2","",351,"2025-05-05 15:49:10","HTML","","","",,,,,0,0.00,0,7,1,"… To gain insight into the intermetallic Tb 2 Ni cluster in 1 and 2, a density functional theory (DFT) study was carried out. The optimized structures of 1 and 2 are in excellent agreement …","https://www.nature.com/articles/s41557-025-01802-2","https://scholar.google.com/scholar?q=related:YV0HMrgJOVIJ:scholar.google.com/&scioq=source:%22nature+chemistry%22+cross+coupling+dft&hl=en&as_sdt=0,5&as_vis=1"
30,"J Wade, F Salerno, RC Kilbride, DK Kim, JA Schmidt…","Controlling anisotropic properties by manipulating the orientation of chiral small molecules",2022,"Nature Chemistry","nature.com","https://www.nature.com/articles/s41557-022-01044-6","https://scholar.google.com/scholar?cites=12114521327879348598&as_sdt=2005&sciodt=0,5&hl=en",352,"2025-05-05 15:49:10","HTML","","","",,,,,30,10.00,5,6,3,"… To better understand the role of the cyano groups on the molecular packing on CuI surfaces, we used density functional theory to investigate the binding interactions in various …","https://www.nature.com/articles/s41557-022-01044-6","https://scholar.google.com/scholar?q=related:dmEkVPZsH6gJ:scholar.google.com/&scioq=source:%22nature+chemistry%22+cross+coupling+dft&hl=en&as_sdt=0,5&as_vis=1"
5,"C Hu, NH Rees, M Pink, JM Goicoechea","Isolation and characterization of a two-coordinate phosphinidene oxide",2024,"Nature Chemistry","nature.com","https://www.nature.com/articles/s41557-024-01586-x","https://scholar.google.com/scholar?cites=12121862518315855631&as_sdt=2005&sciodt=0,5&hl=en",353,"2025-05-05 15:49:10","HTML","","","",,,,,5,5.00,1,4,1,"… Density functional theory (DFT) calculations were conducted to elucidate the electronic structure of 3. The optimized geometries of both the free ion ([ArNPO] – ) and the ion-paired salt (3…","https://www.nature.com/articles/s41557-024-01586-x","https://scholar.google.com/scholar?q=related:D69WbLyBOagJ:scholar.google.com/&scioq=source:%22nature+chemistry%22+cross+coupling+dft&hl=en&as_sdt=0,5&as_vis=1"
55,"A Mardyukov, H Quanz, PR Schreiner","Conformer-specific hydrogen atom tunnelling in trifluoromethylhydroxycarbene",2017,"Nature Chemistry","nature.com","https://www.nature.com/articles/nchem.2609","https://scholar.google.com/scholar?cites=7928195109110647166&as_sdt=2005&sciodt=0,5&hl=en",354,"2025-05-05 15:49:10","HTML","","","",,,,,55,6.88,18,3,8,"… The ultraviolet/visible (UV–vis) absorption maximum of 1t computed with time-dependent density functional theory (TD-DFT) at TD-M06-2X/cc-pVTZ predicts a weak transition at λ max = …","https://www.nature.com/articles/nchem.2609","https://scholar.google.com/scholar?q=related:fomHRHKbBm4J:scholar.google.com/&scioq=source:%22nature+chemistry%22+cross+coupling+dft&hl=en&as_sdt=0,5&as_vis=1"
5,"S Adak, N Ye, LA Calderone, M Duan, W Lubeck…","A single diiron enzyme catalyses the oxidative rearrangement of tryptophan to indole nitrile",2024,"… chemistry","nature.com","https://www.nature.com/articles/s41557-024-01603-z","https://scholar.google.com/scholar?cites=13997955059965851783&as_sdt=2005&sciodt=0,5&hl=en",355,"2025-05-05 15:49:10","HTML","","","",,,,,5,5.00,1,6,1,"… We next performed density functional theory (DFT) calculations (Extended Data Fig. 10 and … , crystallographic and spectroscopic data, DFT calculations, and mechanistic precedents for …","https://www.nature.com/articles/s41557-024-01603-z","https://scholar.google.com/scholar?q=related:h3glc_a5QsIJ:scholar.google.com/&scioq=source:%22nature+chemistry%22+cross+coupling+dft&hl=en&as_sdt=0,5&as_vis=1"
1,"L Ploenes, P Straňák, A Mishra, X Liu, J Pérez-Ríos…","Collisional alignment and molecular rotation control the chemi-ionization of individual conformers of hydroquinone with metastable neon",2024,"Nature Chemistry","nature.com","https://www.nature.com/articles/s41557-024-01590-1","https://scholar.google.com/scholar?cites=9401796892282697217&as_sdt=2005&sciodt=0,5&hl=en",356,"2025-05-05 15:49:10","HTML","","","",,,,,1,1.00,0,6,1,"… CI reaction have been calculated with density functional theory using the hybrid exchange-… was calculated with time-dependent density functional theory using the same functional as …","https://www.nature.com/articles/s41557-024-01590-1","https://scholar.google.com/scholar?q=related:Abbh7nXkeYIJ:scholar.google.com/&scioq=source:%22nature+chemistry%22+cross+coupling+dft&hl=en&as_sdt=0,5&as_vis=1"
41,"G Chen, X Liu, J An, S Wang, X Zhao, Z Gu, C Yuan…","Nucleation-mediated growth of chiral 3D organic–inorganic perovskite single crystals",2023,"Nature Chemistry","nature.com","https://www.nature.com/articles/s41557-023-01290-2","https://scholar.google.com/scholar?cites=10303279613935460832&as_sdt=2005&sciodt=0,5&hl=en",357,"2025-05-05 15:49:10","HTML","","","",,,,,41,20.50,5,8,2,"… Density functional theory (DFT) calculations with various types of MA orientation distribution patterns were performed to elucidate the chiroptical activity-related structures. The structures …","https://www.nature.com/articles/s41557-023-01290-2","https://scholar.google.com/scholar?q=related:4KElQjia_I4J:scholar.google.com/&scioq=source:%22nature+chemistry%22+cross+coupling+dft&hl=en&as_sdt=0,5&as_vis=1"
32,"P Dabringhaus, J Willrett, I Krossing","Synthesis of a low-valent Al4+ cluster cation salt",2022,"Nature Chemistry","nature.com","https://www.nature.com/articles/s41557-022-01000-4","https://scholar.google.com/scholar?cites=11991660236161486308&as_sdt=2005&sciodt=0,5&hl=en",358,"2025-05-05 15:49:10","HTML","","","",,,,,32,10.67,11,3,3,"… is in line with the time-dependent density functional theory (DFT) computed spectrum of the dimer … This hypothesis agrees with DFT calculations (bp86-d3bj/def2-svp), which suggest the …","https://www.nature.com/articles/s41557-022-01000-4","https://scholar.google.com/scholar?q=related:5A2VQ3PvaqYJ:scholar.google.com/&scioq=source:%22nature+chemistry%22+cross+coupling+dft&hl=en&as_sdt=0,5&as_vis=1"
