Cites,Authors,Title,Year,Source,Publisher,ArticleURL,CitesURL,GSRank,QueryDate,Type,DOI,ISSN,CitationURL,Volume,Issue,StartPage,EndPage,ECC,CitesPerYear,CitesPerAuthor,AuthorCount,Age,Abstract,FullTextURL,RelatedURL
153,"H Sakaguchi, S Song, T Kojima, T Nakae","Homochiral polymerization-driven selective growth of graphene nanoribbons",2017,"Nature Chemistry","nature.com","https://www.nature.com/articles/nchem.2614","https://scholar.google.com/scholar?cites=311257885954150170&as_sdt=2005&sciodt=0,5&hl=en",196,"2025-05-05 15:49:10","HTML","","","",,,,,153,19.13,38,4,8,"… QM/MM is based on a hybrid method of DFT and MM, which allows us to perform a geometry optimization of molecules adsorbed on the surface by taking into account electronic …","https://www.nature.com/articles/nchem.2614","https://scholar.google.com/scholar?q=related:Gg_W7WXPUQQJ:scholar.google.com/&scioq=source:%22nature+chemistry%22+cross+coupling+dft&hl=en&as_sdt=0,5&as_vis=1"
652,"Y Morita, S Suzuki, K Sato, T Takui","Synthetic organic spin chemistry for structurally well-defined open-shell graphene fragments",2011,"Nature chemistry","nature.com","https://www.nature.com/articles/nchem.985","https://scholar.google.com/scholar?cites=7234179532090755875&as_sdt=2005&sciodt=0,5&hl=en",197,"2025-05-05 15:49:10","HTML","","","",,,,,652,46.57,163,4,14,"… In this case, DFT calculations indicate that the spin densities are mainly centred on two β-… unpaired electron over the π-electronic system, as was expected from the DFT calculations. …","https://www.nature.com/articles/nchem.985","https://scholar.google.com/scholar?q=related:I8urw_T3ZGQJ:scholar.google.com/&scioq=source:%22nature+chemistry%22+cross+coupling+dft&hl=en&as_sdt=0,5&as_vis=1"
245,"TJA Wolf, DM Sanchez, J Yang, RM Parrish…","The photochemical ring-opening of 1, 3-cyclohexadiene imaged by ultrafast electron diffraction",2019,"… chemistry","nature.com","https://www.nature.com/articles/s41557-019-0252-7","https://scholar.google.com/scholar?cites=14305781412382307174&as_sdt=2005&sciodt=0,5&hl=en",198,"2025-05-05 15:49:10","HTML","","","",,,,,245,40.83,49,5,6,"… molecular dynamics with unrestricted density functional theory (DFT) using the Perdew–Burke–… propagated, with 86 of these being adiabatically continued on the ground state with DFT. …","https://www.nature.com/articles/s41557-019-0252-7","https://scholar.google.com/scholar?q=related:ZvNuN2ZYiMYJ:scholar.google.com/&scioq=source:%22nature+chemistry%22+cross+coupling+dft&hl=en&as_sdt=0,5&as_vis=1"
82,"AM Li, O Borodin, TP Pollard, W Zhang, N Zhang…","Methylation enables the use of fluorine-free ether electrolytes in high-voltage lithium metal batteries",2024,"Nature Chemistry","nature.com","https://www.nature.com/articles/s41557-024-01497-x","https://scholar.google.com/scholar?cites=7701198200287603128&as_sdt=2005&sciodt=0,5&hl=en",199,"2025-05-05 15:49:10","HTML","","","",,,,,82,82.00,14,6,1,"… spectra, we performed DFT calculations on the isolated FSI − … Density functional theory calculations predict the same trend … Density functional theory calculations demonstrated a strong …","https://www.nature.com/articles/s41557-024-01497-x","https://scholar.google.com/scholar?q=related:uCkF4fUm4GoJ:scholar.google.com/&scioq=source:%22nature+chemistry%22+cross+coupling+dft&hl=en&as_sdt=0,5&as_vis=1"
231,"G Heimel, S Duhm, I Salzmann, A Gerlach…","Charged and metallic molecular monolayers through surface-induced aromatic stabilization",2013,"… chemistry","nature.com","https://www.nature.com/articles/nchem.1572","https://scholar.google.com/scholar?cites=16981539161125805424&as_sdt=2005&sciodt=0,5&hl=en",200,"2025-05-05 15:49:10","HTML","","","",,,,,231,19.25,46,5,12,"… on molecular (sub)monolayers to deduce detailed structural models (Supplementary Section A), which served as an input for dispersion-corrected hybrid density functional theory (DFT) …","https://www.nature.com/articles/nchem.1572","https://scholar.google.com/scholar?q=related:cN1JHuWLqusJ:scholar.google.com/&scioq=source:%22nature+chemistry%22+cross+coupling+dft&hl=en&as_sdt=0,5&as_vis=1"
15,"W Zhou, S Xi, H Chen, D Jiang, J Yang, S Liu, L He…","A bridged backbone strategy enables collective synthesis of strychnan alkaloids",2023,"Nature Chemistry","nature.com","https://www.nature.com/articles/s41557-023-01264-4","https://scholar.google.com/scholar?cites=10039665847274523880&as_sdt=2005&sciodt=0,5&hl=en",201,"2025-05-05 15:49:10","HTML","","","",,,,,15,7.50,2,8,2,"… In summary, the DFT calculations collectively indicate that the bifunctional organocatalyst can activate the substrate via formation of an enamine intermediate and synergistic hydrogen …","https://www.nature.com/articles/s41557-023-01264-4","https://scholar.google.com/scholar?q=related:6ExrSuUOVIsJ:scholar.google.com/&scioq=source:%22nature+chemistry%22+cross+coupling+dft&hl=en&as_sdt=0,5&as_vis=1"
298,"ZS Yoon, A Osuka, D Kim","Möbius aromaticity and antiaromaticity in expanded porphyrins",2009,"Nature chemistry","nature.com","https://www.nature.com/articles/nchem.172","https://scholar.google.com/scholar?cites=15073528814242441677&as_sdt=2005&sciodt=0,5&hl=en",202,"2025-05-05 15:49:10","HTML","","","",,,,,298,18.63,99,3,16,"… , as determined by density functional theory (DFT) calculations. … On the basis of DFT calculations, they concluded that the “… –Plesset) and various DFT calculations reproduced the …","https://www.nature.com/articles/nchem.172","https://scholar.google.com/scholar?q=related:zSmJ9JfuL9EJ:scholar.google.com/&scioq=source:%22nature+chemistry%22+cross+coupling+dft&hl=en&as_sdt=0,5&as_vis=1"
14,"Z Feng, W Guo, WY Kong, D Chen, S Wang…","Analogies between photochemical reactions and ground-state post-transition-state bifurcations shed light on dynamical origins of selectivity",2024,"Nature Chemistry","nature.com","https://www.nature.com/articles/s41557-023-01410-y","https://scholar.google.com/scholar?cites=5883243730371311913&as_sdt=2005&sciodt=0,5&hl=en",203,"2025-05-05 15:49:10","HTML","","","",,,,,14,14.00,2,6,1,"… Now, using machine-learning-assisted non-adiabatic molecular dynamics and multiconfiguration pair-density functional theory, these factors are examined for a classic photochemical …","https://www.nature.com/articles/s41557-023-01410-y","https://scholar.google.com/scholar?q=related:KXnTgwB7pVEJ:scholar.google.com/&scioq=source:%22nature+chemistry%22+cross+coupling+dft&hl=en&as_sdt=0,5&as_vis=1"
69,"N Renaud, MA Harris, APN Singh, YA Berlin…","Deep-hole transfer leads to ultrafast charge migration in DNA hairpins",2016,"… chemistry","nature.com","https://www.nature.com/articles/nchem.2590","https://scholar.google.com/scholar?cites=6337034049813624958&as_sdt=2005&sciodt=0,5&hl=en",204,"2025-05-05 15:49:10","HTML","","","",,,,,69,7.67,14,5,9,"… The energy levels and electronic couplings involved in our model were determined by DFT electronic structure calculations combined with molecular dynamics to account for the …","https://www.nature.com/articles/nchem.2590","https://scholar.google.com/scholar?q=related:fjiyrOSq8VcJ:scholar.google.com/&scioq=source:%22nature+chemistry%22+cross+coupling+dft&hl=en&as_sdt=0,5&as_vis=1"
117,"J Lee, S Radomkit, S Torker, J Del Pozo…","Mechanism-based enhancement of scope and enantioselectivity for reactions involving a copper-substituted stereogenic carbon centre",2018,"Nature chemistry","nature.com","https://www.nature.com/articles/nchem.2861","https://scholar.google.com/scholar?cites=16347172447462642433&as_sdt=2005&sciodt=0,5&hl=en",205,"2025-05-05 15:49:10","HTML","","","",,,,,117,16.71,23,5,7,"… Density functional theory (DFT) calculations confirm that addition of an achiral Cu–B(pin) to … -containing v because, as supported by DFT calculations, in the chiral complex one arm of …","https://www.nature.com/articles/nchem.2861","https://scholar.google.com/scholar?q=related:AVMQ3brS3OIJ:scholar.google.com/&scioq=source:%22nature+chemistry%22+cross+coupling+dft&hl=en&as_sdt=0,5&as_vis=1"
110,"A Saha, BJ Gifford, X He, G Ao, M Zheng, H Kataura…","Narrow-band single-photon emission through selective aryl functionalization of zigzag carbon nanotubes",2018,"Nature Chemistry","nature.com","https://www.nature.com/articles/s41557-018-0126-4","https://scholar.google.com/scholar?cites=8616438595024331870&as_sdt=2005&sciodt=0,5&hl=en",206,"2025-05-05 15:49:10","HTML","","","",,,,,110,15.71,16,7,7,"… Furthermore, our TD-DFT modelling indicates that zigzag functionalization provides an effective route to eliminating the corresponding configurational diversity in the binding chemistry. …","https://www.nature.com/articles/s41557-018-0126-4","https://scholar.google.com/scholar?q=related:XiRkFUC9k3cJ:scholar.google.com/&scioq=source:%22nature+chemistry%22+cross+coupling+dft&hl=en&as_sdt=0,5&as_vis=1"
157,"JJ Dressler, M Teraoka, GL Espejo, R Kishi…","Thiophene and its sulfur inhibit indenoindenodibenzothiophene diradicals from low-energy lying thermal triplets",2018,"Nature Chemistry","nature.com","https://www.nature.com/articles/s41557-018-0133-5","https://scholar.google.com/scholar?cites=14073141154012122419&as_sdt=2005&sciodt=0,5&hl=en",207,"2025-05-05 15:49:10","HTML","","","",,,,,157,22.43,31,5,7,"… . Suzuki cross-coupling of 12 with benzothiophene 2-pinacolate ester 49 gave the desired naphthalene 13 in 88% yield. Saponification of diester 13 followed by intramolecular Friedel–…","https://www.nature.com/articles/s41557-018-0133-5","https://scholar.google.com/scholar?q=related:M83SHlHXTcMJ:scholar.google.com/&scioq=source:%22nature+chemistry%22+cross+coupling+dft&hl=en&as_sdt=0,5&as_vis=1"
34,"S Song, A Pinar Solé, A Matěj, G Li, O Stetsovych…","Highly entangled polyradical nanographene with coexisting strong correlation and topological frustration",2024,"Nature Chemistry","nature.com","https://www.nature.com/articles/s41557-024-01453-9","https://scholar.google.com/scholar?cites=7080459696866245075&as_sdt=2005&sciodt=0,5&hl=en",208,"2025-05-05 15:49:10","HTML","","","",,,,,34,34.00,6,6,1,"… As the single-determinant density functional theory (DFT) method is inadequate for accurately modelling polyradical systems with a strong multi-reference character, our DFT …","https://www.nature.com/articles/s41557-024-01453-9","https://scholar.google.com/scholar?q=related:07kulpTYQmIJ:scholar.google.com/&scioq=source:%22nature+chemistry%22+cross+coupling+dft&hl=en&as_sdt=0,5&as_vis=1"
57,"DB Diaz, SD Appavoo, AF Bogdanchikova…","Illuminating the dark conformational space of macrocycles using dominant rotors",2021,"… chemistry","nature.com","https://www.nature.com/articles/s41557-020-00620-y","https://scholar.google.com/scholar?cites=10361239733758984523&as_sdt=2005&sciodt=0,5&hl=en",209,"2025-05-05 15:49:10","HTML","","","",,,,,57,14.25,14,4,4,"… The .xyz files with outputs of all DFT and xtb calculations performed in this study are contained in the .zip file named SI_data.zip, and are also hosted on the following GitHub page: https:/…","https://www.nature.com/articles/s41557-020-00620-y","https://scholar.google.com/scholar?q=related:SwFeQ6SEyo8J:scholar.google.com/&scioq=source:%22nature+chemistry%22+cross+coupling+dft&hl=en&as_sdt=0,5&as_vis=1"
115,"H Jang, F Romiti, S Torker, AH Hoveyda","Catalytic diastereo-and enantioselective additions of versatile allyl groups to N–H ketimines",2017,"Nature chemistry","nature.com","https://www.nature.com/articles/nchem.2816","https://scholar.google.com/scholar?cites=17334283137733890186&as_sdt=2005&sciodt=0,5&hl=en",210,"2025-05-05 15:49:10","HTML","","","",,,,,115,14.38,29,4,8,"… Stereochemical models developed with the aid of density functional theory calculations, which account for the observed trends and levels of enantioselectivity, are presented. …","https://www.nature.com/articles/nchem.2816","https://scholar.google.com/scholar?q=related:ihCsPKy-j_AJ:scholar.google.com/&scioq=source:%22nature+chemistry%22+cross+coupling+dft&hl=en&as_sdt=0,5&as_vis=1"
15,"R Ueoka, P Sondermann, S Leopold-Messer, Y Liu…","Genome-based discovery and total synthesis of janustatins, potent cytotoxins from a plant-associated bacterium",2022,"… chemistry","nature.com","https://www.nature.com/articles/s41557-022-01020-0","https://scholar.google.com/scholar?cites=12132147590494262762&as_sdt=2005&sciodt=0,5&hl=en",211,"2025-05-05 15:49:10","HTML","","","",,,,,15,5.00,3,5,3,"… moiety of 13, density functional theory (DFT) calculations were … field (MMFF) followed by DFT geometry optimization and chemical shift … The experimental data agreed quite well with DFT …","https://www.nature.com/articles/s41557-022-01020-0","https://scholar.google.com/scholar?q=related:6pUFZvQLXqgJ:scholar.google.com/&scioq=source:%22nature+chemistry%22+cross+coupling+dft&hl=en&as_sdt=0,5&as_vis=1"
40,"B Ma, H Zhang, R Li, S Zhang, L Chen, T Zhou…","Molecular-docking electrolytes enable high-voltage lithium battery chemistries",2024,"Nature Chemistry","nature.com","https://www.nature.com/articles/s41557-024-01585-y","https://scholar.google.com/scholar?cites=14137599226876756234&as_sdt=2005&sciodt=0,5&hl=en",212,"2025-05-05 15:49:10","HTML","","","",,,,,40,40.00,6,7,1,"… The interaction energies of BTP/FB and BTP/DCE were calculated using density functional theory (DFT) calculations to be −7.48 kcal mol –1 and −6.54 kcal mol –1 , respectively. These …","https://www.nature.com/articles/s41557-024-01585-y","https://scholar.google.com/scholar?q=related:CoHTtpfXMsQJ:scholar.google.com/&scioq=source:%22nature+chemistry%22+cross+coupling+dft&hl=en&as_sdt=0,5&as_vis=1"
27,"WE Meador, EY Lin, I Lim, HC Friedman, D Ndaleh…","Silicon-RosIndolizine fluorophores with shortwave infrared absorption and emission profiles enable in vivo fluorescence imaging",2024,"… chemistry","nature.com","https://www.nature.com/articles/s41557-024-01464-6","https://scholar.google.com/scholar?cites=2550621280578926591&as_sdt=2005&sciodt=0,5&hl=en",213,"2025-05-05 15:49:10","HTML","","","",,,,,27,27.00,5,6,1,"… Time-dependent density functional theory calculations were conducted for SiRos1300, SiRos1550 and SiRos1700 at the B3LYP/6-311g(d,p) level of theory 49,50,51 using Gaussian 16 …","https://www.nature.com/articles/s41557-024-01464-6","https://scholar.google.com/scholar?q=related:_3d1eYqgZSMJ:scholar.google.com/&scioq=source:%22nature+chemistry%22+cross+coupling+dft&hl=en&as_sdt=0,5&as_vis=1"
103,"J Sun, J Abbenseth, H Verplancke, M Diefenbach…","A platinum(ii) metallonitrene with a triplet ground state",2020,"Nature Chemistry","nature.com","https://www.nature.com/articles/s41557-020-0522-4","https://scholar.google.com/scholar?cites=7601161724765769741&as_sdt=2005&sciodt=0,5&hl=en",214,"2025-05-05 15:49:10","HTML","","","",,,,,103,20.60,21,5,5,"… Quantum-chemical modelling of complex 2 gave square-planar metal coordination for density functional theory (DFT) optimized geometries of both the triplet and singlet states. While …","https://www.nature.com/articles/s41557-020-0522-4","https://scholar.google.com/scholar?q=related:DZD15FDAfGkJ:scholar.google.com/&scioq=source:%22nature+chemistry%22+cross+coupling+dft&hl=en&as_sdt=0,5&as_vis=1"
13,"Z Zhao, Y Wang, X Yang, J Quan, BC Krüger…","Spin-dependent reactivity and spin-flipping dynamics in oxygen atom scattering from graphite",2023,"Nature Chemistry","nature.com","https://www.nature.com/articles/s41557-023-01204-2","https://scholar.google.com/scholar?cites=7665703154487040812&as_sdt=2005&sciodt=0,5&hl=en",215,"2025-05-05 15:49:10","HTML","","","",,,,,13,6.50,2,6,2,"… However, when density functional theory (DFT) calculations … , and, indeed, spin-restricted DFT calculations predict a barrier to … In this line of reasoning, weaknesses in the ability of DFT-…","https://www.nature.com/articles/s41557-023-01204-2","https://scholar.google.com/scholar?q=related:LJvKhGcMYmoJ:scholar.google.com/&scioq=source:%22nature+chemistry%22+cross+coupling+dft&hl=en&as_sdt=0,5&as_vis=1"
41,"M Li, W Harrison, Z Zhang, Y Yuan, H Zhao","Remote stereocontrol with azaarenes via enzymatic hydrogen atom transfer",2024,"Nature Chemistry","nature.com","https://www.nature.com/articles/s41557-023-01368-x","https://scholar.google.com/scholar?cites=6850016119639509093&as_sdt=2005&sciodt=0,5&hl=en",216,"2025-05-05 15:49:10","HTML","","","",,,,,41,41.00,8,5,1,"… DFT calculations were carried out using the Gaussian 16 program package, Revision C.02 software 45 . The B3LYP method 46,47 and the dispersion energy corrections by D3 version …","https://www.nature.com/articles/s41557-023-01368-x","https://scholar.google.com/scholar?q=related:ZQjQLF4lEF8J:scholar.google.com/&scioq=source:%22nature+chemistry%22+cross+coupling+dft&hl=en&as_sdt=0,5&as_vis=1"
578,"BJ Walker, AJ Musser, D Beljonne, RH Friend","Singlet exciton fission in solution",2013,"Nature chemistry","nature.com","https://www.nature.com/articles/nchem.1801","https://scholar.google.com/scholar?cites=14591009904187618076&as_sdt=2005&sciodt=0,5&hl=en",217,"2025-05-05 15:49:10","HTML","","","",,,,,578,48.17,145,4,12,"… As a result, this parameter can be used with time-dependent density functional theory (TDDFT) calculations to investigate plausible structures of the 1 [TP − TP]* state that precedes …","https://www.nature.com/articles/nchem.1801","https://scholar.google.com/scholar?q=related:HDNPjTOufcoJ:scholar.google.com/&scioq=source:%22nature+chemistry%22+cross+coupling+dft&hl=en&as_sdt=0,5&as_vis=1"
85,"YQ Zhang, M Paszkiewicz, P Du, L Zhang, T Lin…","Complex supramolecular interfacial tessellation through convergent multi-step reaction of a dissymmetric simple organic precursor",2018,"Nature Chemistry","nature.com","https://www.nature.com/articles/nchem.2924","https://scholar.google.com/scholar?cites=12352754372351956297&as_sdt=2005&sciodt=0,5&hl=en",218,"2025-05-05 15:49:10","HTML","","","",,,,,85,12.14,14,6,7,"… Our previous DFT modelling has already recognized that the dehydrogenation barrier of terminal alkyne catalysed by a Ag adatom is even higher than directly by the Ag(111) substrate (…","https://www.nature.com/articles/nchem.2924","https://scholar.google.com/scholar?q=related:SRWxaafMbasJ:scholar.google.com/&scioq=source:%22nature+chemistry%22+cross+coupling+dft&hl=en&as_sdt=0,5&as_vis=1"
2,"BIC Tresco, KJY Wu, A Ramkissoon…","Discovery of a fluorinated macrobicyclic antibiotic through chemical synthesis",2025,"Nature Chemistry","nature.com","https://www.nature.com/articles/s41557-025-01738-7","https://scholar.google.com/scholar?cites=2914951362817966008&as_sdt=2005&sciodt=0,5&hl=en",219,"2025-05-05 15:49:10","HTML","","","",,,,,2,2.00,1,4,1,"… Through variable-temperature 1 H NMR experiments, density functional theory calculations and vibrational circular dichroism spectroscopy, we compare macrobicyclic homologues of …","https://www.nature.com/articles/s41557-025-01738-7","https://scholar.google.com/scholar?q=related:uD9OBtL8cygJ:scholar.google.com/&scioq=source:%22nature+chemistry%22+cross+coupling+dft&hl=en&as_sdt=0,5&as_vis=1"
0,"A Pita-Milleiro, N Hidalgo, JJ Moreno, I Fernández…","An open-shell Ir (II)/Ir (IV) redox couple outperforms an Ir (I)/Ir (III) pair in olefin isomerization",2025,"Nature Chemistry","nature.com","https://www.nature.com/articles/s41557-024-01722-7","",220,"2025-05-05 15:49:10","HTML","","","",,,,,0,0.00,0,5,1,"… To check the reliability of our density functional theory results, energy refinements for the profile involving the Ir II system were carried out by means of single-point calculations at the …","https://www.nature.com/articles/s41557-024-01722-7","https://scholar.google.com/scholar?q=related:R4ppuFS9YxAJ:scholar.google.com/&scioq=source:%22nature+chemistry%22+cross+coupling+dft&hl=en&as_sdt=0,5&as_vis=1"
155,"DM Herlihy, MM Waegele, X Chen, CD Pemmaraju…","Detecting the oxyl radical of photocatalytic water oxidation at an n-SrTiO3/aqueous interface through its subsurface vibration",2016,"… chemistry","nature.com","https://www.nature.com/articles/nchem.2497","https://scholar.google.com/scholar?cites=16785032093231730621&as_sdt=2005&sciodt=0,5&hl=en",221,"2025-05-05 15:49:10","HTML","","","",,,,,155,17.22,31,5,9,"… These experiments demonstrate subsurface vibrations and their coupling to solvent and … One can envision using the subsurface vibrations and their coupling across the interface to …","https://www.nature.com/articles/nchem.2497","https://scholar.google.com/scholar?q=related:vc-bBMJp8OgJ:scholar.google.com/&scioq=source:%22nature+chemistry%22+cross+coupling+dft&hl=en&as_sdt=0,5&as_vis=1"
196,"J Calleja, D Pla, TW Gorman, V Domingo…","A steric tethering approach enables palladium-catalysed C–H activation of primary amino alcohols",2015,"Nature Chemistry","nature.com","https://www.nature.com/articles/nchem.2367","https://scholar.google.com/scholar?cites=11175437764393804268&as_sdt=2005&sciodt=0,5&hl=en",222,"2025-05-05 15:49:10","HTML","","","",,,,,196,19.60,39,5,10,"… Smalley for density functional theory calculations and Y. Shimidzu for assistance with optimization of the C–H acetoxylation reaction. Mass spectrometry data were acquired at the …","https://www.nature.com/articles/nchem.2367","https://scholar.google.com/scholar?q=related:7KEtzG8hF5sJ:scholar.google.com/&scioq=source:%22nature+chemistry%22+cross+coupling+dft&hl=en&as_sdt=0,5&as_vis=1"
123,"Z Zhou, ZX Wang, YC Zhou, W Xiao, Q Ouyang…","Switchable regioselectivity in amine-catalysed asymmetric cycloadditions",2017,"Nature Chemistry","nature.com","https://www.nature.com/articles/nchem.2698","https://scholar.google.com/scholar?cites=9420704967770773233&as_sdt=2005&sciodt=0,5&hl=en",223,"2025-05-05 15:49:10","HTML","","","",,,,,123,15.38,21,6,8,"… Moreover, density functional theory (DFT) computational calculations showed that the previous γ,β′-regioselective [6+2] cycloaddition might proceed in a stepwise Michael−Michael …","https://www.nature.com/articles/nchem.2698","https://scholar.google.com/scholar?q=related:8Ra8UUERvYIJ:scholar.google.com/&scioq=source:%22nature+chemistry%22+cross+coupling+dft&hl=en&as_sdt=0,5&as_vis=1"
117,"S Ostovar Pour, L Rocks, K Faulds, D Graham…","Through-space transfer of chiral information mediated by a plasmonic nanomaterial",2015,"… chemistry","nature.com","https://www.nature.com/articles/nchem.2280","https://scholar.google.com/scholar?cites=3341664857860040217&as_sdt=2005&sciodt=0,5&hl=en",224,"2025-05-05 15:49:10","HTML","","","",,,,,117,11.70,23,5,10,"… To investigate various factors important for the chirality transfer, we performed a number of density functional theory (DFT) computations on simplified models including the dye and …","https://www.nature.com/articles/nchem.2280","https://scholar.google.com/scholar?q=related:GWYnu3v6Xy4J:scholar.google.com/&scioq=source:%22nature+chemistry%22+cross+coupling+dft&hl=en&as_sdt=0,5&as_vis=1"
124,"X Shen, C Viney, ER Johnson, C Wang, JQ Lu","Large negative thermal expansion of a polymer driven by a submolecular conformational change",2013,"Nature Chemistry","nature.com","https://www.nature.com/articles/nchem.1780","https://scholar.google.com/scholar?cites=1409442491508528119&as_sdt=2005&sciodt=0,5&hl=en",225,"2025-05-05 15:49:10","HTML","","","",,,,,124,10.33,25,5,12,"… All DFT calculations described in this work were carried out using the Gaussian 09 program 38 with the B3LYP functional 39,40 and dispersion-correcting potentials 41 . Geometry …","https://www.nature.com/articles/nchem.1780","https://scholar.google.com/scholar?q=related:9xO1fXpYjxMJ:scholar.google.com/&scioq=source:%22nature+chemistry%22+cross+coupling+dft&hl=en&as_sdt=0,5&as_vis=1"
156,"C Martí-Gastaldo, D Antypov, JE Warren, ME Briggs…","Side-chain control of porosity closure in single-and multiple-peptide-based porous materials by cooperative folding",2014,"… chemistry","nature.com","https://www.nature.com/articles/nchem.1871","https://scholar.google.com/scholar?cites=12177002712657616502&as_sdt=2005&sciodt=0,5&hl=en",226,"2025-05-05 15:49:10","HTML","","","",,,,,156,14.18,31,5,11,"… To verify the details of the collapse pathway we conducted density functional theory (DFT) … The DFT optimization of a unit cell in the open state after removal of the methanol molecules …","https://www.nature.com/articles/nchem.1871","https://scholar.google.com/scholar?q=related:dt7sXHNn_agJ:scholar.google.com/&scioq=source:%22nature+chemistry%22+cross+coupling+dft&hl=en&as_sdt=0,5&as_vis=1"
0,"K Zhao, Z Gu","Aryl ortho methoxylation",2023,"Nature Chemistry","nature.com","https://www.nature.com/articles/s41557-023-01323-w","",227,"2025-05-05 15:49:10","HTML","","","",,,,,0,0.00,0,2,2,"… The reaction mechanism was thoroughly studied through theoretical calculations based on density functional theory. The electron-rich four-coordinated anionic ANP2, formed from the …","https://www.nature.com/articles/s41557-023-01323-w","https://scholar.google.com/scholar?q=related:hGq0duSgP3oJ:scholar.google.com/&scioq=source:%22nature+chemistry%22+cross+coupling+dft&hl=en&as_sdt=0,5&as_vis=1"
