Cites,Authors,Title,Year,Source,Publisher,ArticleURL,CitesURL,GSRank,QueryDate,Type,DOI,ISSN,CitationURL,Volume,Issue,StartPage,EndPage,ECC,CitesPerYear,CitesPerAuthor,AuthorCount,Age,Abstract,FullTextURL,RelatedURL
90,"L Zhou, L Liu, Z Hao, Z Yan, XF Yu, PK Chu, K Zhang, ...","Opportunities and challenges for aqueous metal-proton batteries",2021,"Matter","cell.com","https://www.cell.com/matter/fulltext/S2590-2385(21)00055-2","https://scholar.google.com/scholar?cites=3759518953654202110&as_sdt=2005&sciodt=0,5&hl=en",160,"2025-05-15 21:42:57","HTML","","","",,,,,90,22.50,11,8,4,"… First-principles calculation has been performed based on the density functional theory to predict the effects of pH on Li + or H + intercalation into lithium transition-metal oxides (Li x MO …","https://www.cell.com/matter/fulltext/S2590-2385(21)00055-2","https://scholar.google.com/scholar?q=related:_i7ozpF-LDQJ:scholar.google.com/&scioq=source:matter+%222590+2385%22+oxidative+addition+dft&hl=en&as_sdt=0,5&as_vis=1"
3,"JX Wang, T He, O Shekhah, L Gutiérrez-Arzaluz, ...","In situ electrochemical deposition of compact metal-organic framework thin films for high-resolution X-ray imaging",2025,"Matter","cell.com","https://www.cell.com/matter/abstract/S2590-2385(24)00628-3","https://scholar.google.com/scholar?cites=11396317191327901040&as_sdt=2005&sciodt=0,5&hl=en",161,"2025-05-15 21:42:57","","","","",,,,,3,3.00,1,5,1,"… Additionally, using density functional theory (DFT) calculations, we were able to determine the T 1 energy levels for the linkers in these RE-MOFs. These energy levels showed good …","https://www.cell.com/matter/pdfExtended/S2590-2385(24)00628-3","https://scholar.google.com/scholar?q=related:cOXG8BraJ54J:scholar.google.com/&scioq=source:matter+%222590+2385%22+oxidative+addition+dft&hl=en&as_sdt=0,5&as_vis=1"
15,"JH Kim, H Yun, DW Kang, J Shin, M Kang, N Singh, ...","Isomeric sp2-C-conjugated porous organic polymer-mediated photo-and sono-catalytic detoxification of sulfur mustard simulant under ambient conditions",2021,"Matter","cell.com","https://www.cell.com/matter/fulltext/S2590-2385(21)00504-X","https://scholar.google.com/scholar?cites=1905695528020469237&as_sdt=2005&sciodt=0,5&hl=en",162,"2025-05-15 21:42:57","HTML","","","",,,,,15,3.75,2,7,4,"… participate in the oxidative mechanism to a greater extent in ambient conditions than in the O 2 atmosphere. In addition, we demonstrate the sono-catalytic selective oxidation of CEES …","https://www.cell.com/matter/fulltext/S2590-2385(21)00504-X","https://scholar.google.com/scholar?q=related:9eW1ZfxjchoJ:scholar.google.com/&scioq=source:matter+%222590+2385%22+oxidative+addition+dft&hl=en&as_sdt=0,5&as_vis=1"
8,"S Peng, Z Miao, Y Liang, R Zhao, F Yuan, H Zhu, ...","Governing the dispersion of quasi-2D perovskite phases toward efficient and stable perovskite solar cells",2024,"Matter","cell.com","https://www.cell.com/matter/abstract/S2590-2385(24)00317-5","https://scholar.google.com/scholar?cites=5733094997131553918&as_sdt=2005&sciodt=0,5&hl=en",163,"2025-05-15 21:42:57","","","","",,,,,8,8.00,1,7,1,"… Through density functional theory calculations and analysis of quasi-2D perovskite film crystallization processes, we unravel the dynamic process and mechanism of AcOH to modulate …","","https://scholar.google.com/scholar?q=related:fmyYT4YLkE8J:scholar.google.com/&scioq=source:matter+%222590+2385%22+oxidative+addition+dft&hl=en&as_sdt=0,5&as_vis=1"
2,"H Luo, Z Pan, T Yang, W Chang, D Zhang, H Cheng, ...","A high-entropy alloy for superior resistance to biogenic sulfuric acid corrosion and hydrogen embrittlement",2025,"Matter","cell.com","https://www.cell.com/matter/abstract/S2590-2385(24)00637-4","https://scholar.google.com/scholar?cites=16979143029236094478&as_sdt=2005&sciodt=0,5&hl=en",164,"2025-05-15 21:42:57","","","","",,,,,2,2.00,0,7,1,"… Therefore, the effect of the hydrogen-vacancy interaction on the SFE of this HEA was explored by density functional theory (DFT) calculations, as illustrated in Figure S5. It was observed …","","https://scholar.google.com/scholar?q=related:DtYqMKAIousJ:scholar.google.com/&scioq=source:matter+%222590+2385%22+oxidative+addition+dft&hl=en&as_sdt=0,5&as_vis=1"
111,"R Du, X Fan, X Jin, R Hübner, Y Hu, A Eychmüller","Emerging noble metal aerogels: state of the art and a look forward",2019,"Matter","cell.com","https://www.cell.com/matter/fulltext/S2590-2385(19)30031-1","https://scholar.google.com/scholar?cites=2618473404108836613&as_sdt=2005&sciodt=0,5&hl=en",165,"2025-05-15 21:42:57","HTML","","","",,,,,111,18.50,19,6,6,"… This hypothesis has been partially supported by experiments and calculations by density functional theory, whereby stronger cation-ligand interactions increase the isotropic attraction …","https://www.cell.com/matter/fulltext/S2590-2385(19)30031-1","https://scholar.google.com/scholar?q=related:BQ-3EbCvViQJ:scholar.google.com/&scioq=source:matter+%222590+2385%22+oxidative+addition+dft&hl=en&as_sdt=0,5&as_vis=1"
26,"H Park, Z Li, A Walsh","Has generative artificial intelligence solved inverse materials design?",2024,"Matter","cell.com","https://www.cell.com/matter/fulltext/S2590-2385(24)00242-X","https://scholar.google.com/scholar?cites=14726421767674072573&as_sdt=2005&sciodt=0,5&hl=en",166,"2025-05-15 21:42:57","HTML","","","",,,,,26,26.00,9,3,1,"The directed design and discovery of compounds with pre-determined properties is a long-standing challenge in materials research. We provide a perspective on progress toward …","https://www.cell.com/matter/fulltext/S2590-2385(24)00242-X","https://scholar.google.com/scholar?q=related:_Q3L4pLCXswJ:scholar.google.com/&scioq=source:matter+%222590+2385%22+oxidative+addition+dft&hl=en&as_sdt=0,5&as_vis=1"
59,"Y Qin, Z Li, Y Duan, J Guo, M Zhao, Z Tang","Nanostructural engineering of metal-organic frameworks: Construction strategies and catalytic applications",2022,"Matter","cell.com","https://www.cell.com/matter/fulltext/S2590-2385(22)00413-1","https://scholar.google.com/scholar?cites=480615111698247812&as_sdt=2005&sciodt=0,5&hl=en",167,"2025-05-15 21:42:57","HTML","","","",,,,,59,19.67,10,6,3,"Famous as emerging inorganic-organic hybrid materials, metal-organic frameworks (MOFs) and MOF-based composites have been displaying bright prospects in catalysis fields. It is …","https://www.cell.com/matter/fulltext/S2590-2385(22)00413-1","https://scholar.google.com/scholar?q=related:hHB1zuV8qwYJ:scholar.google.com/&scioq=source:matter+%222590+2385%22+oxidative+addition+dft&hl=en&as_sdt=0,5&as_vis=1"
2,"G Zhao, LM Brabson, S Chheda, J Huang, H Kim, K Liu, ...","CoRE MOF DB: A curated experimental metal-organic framework database with machine-learned properties for integrated material-process screening",2025,"Matter","cell.com","https://www.cell.com/matter/abstract/S2590-2385(25)00183-3","https://scholar.google.com/scholar?cites=12482229105328180941&as_sdt=2005&sciodt=0,5&hl=en",168,"2025-05-15 21:42:57","","","","",,,,,2,2.00,0,7,1,"We present an updated version of the Computation-Ready, Experimental (CoRE) Metal-Organic Framework (MOF) database, which includes a curated set of computation-ready MOF …","https://chemrxiv.org/engage/api-gateway/chemrxiv/assets/orp/resource/item/67dcd65bfa469535b91019ba/original/co-re-mof-db-a-curated-experimental-metal-organic-framework-database-with-machine-learned-properties-for-integrated-material-process-screening.pdf","https://scholar.google.com/scholar?q=related:zc4g1DzJOa0J:scholar.google.com/&scioq=source:matter+%222590+2385%22+oxidative+addition+dft&hl=en&as_sdt=0,5&as_vis=1"
27,"PP Shetty, N Kondekar, AC Thenuwara, MG Boebinger, ...","In situ dynamics during heating of copper-intercalated bismuth telluride",2020,"Matter","cell.com","https://www.cell.com/matter/fulltext/S2590-2385(20)30386-6","https://scholar.google.com/scholar?cites=9197101101189808886&as_sdt=2005&sciodt=0,5&hl=en",169,"2025-05-15 21:42:57","HTML","","","",,,,,27,5.40,5,5,5,"… This is consistent with previous experimental observations that have shown the sublimation of pure Bi 2 Te 3 platelets between 350C and 450C, as well as density functional theory (DFT…","https://www.cell.com/matter/fulltext/S2590-2385(20)30386-6","https://scholar.google.com/scholar?q=related:9sLFI7mqon8J:scholar.google.com/&scioq=source:matter+%222590+2385%22+oxidative+addition+dft&hl=en&as_sdt=0,5&as_vis=1"
1,"J Fan, L Yu, D Deng","Two-dimensional crystal lattice confining atoms for electrocatalysis",2024,"Matter","cell.com","https://www.cell.com/matter/abstract/S2590-2385(23)00629-X","https://scholar.google.com/scholar?cites=107746319576403607&as_sdt=2005&sciodt=0,5&hl=en",170,"2025-05-15 21:42:57","","","","",,,,,1,1.00,0,3,1,"… Density functional theory (DFT) calculations reveal that confining single Co atoms can reduce the energy barrier of H 2 O dissociation on the surrounding Ru sites and thus boost the …","https://www.cell.com/matter/pdf/S2590-2385(23)00629-X.pdf","https://scholar.google.com/scholar?q=related:lw418LTKfgEJ:scholar.google.com/&scioq=source:matter+%222590+2385%22+oxidative+addition+dft&hl=en&as_sdt=0,5&as_vis=1"
0,"M Luo, Z Xie, H Li, B Zhang, J Cao, Y Huang, H Qu, ...","Physics-informed, dual-objective optimization of high-entropy-alloy nanozymes by a robotic AI chemist",2025,"Matter","cell.com","https://www.cell.com/matter/abstract/S2590-2385(25)00052-9","",171,"2025-05-15 21:42:57","","","","",,,,,0,0.00,0,8,1,"… density functional theory (DFT) calculations, to accurately design nanozymes with well-defined active sites. This strategy overcomes the drawbacks of the trial-and-error paradigm and …","https://chemrxiv.org/engage/api-gateway/chemrxiv/assets/orp/resource/item/66f433c812ff75c3a17075ff/original/physics-informed-dual-objective-optimization-of-high-entropy-alloy-nanozymes-by-a-robotic-ai-chemist.pdf","https://scholar.google.com/scholar?q=related:L4jFHLU0clsJ:scholar.google.com/&scioq=source:matter+%222590+2385%22+oxidative+addition+dft&hl=en&as_sdt=0,5&as_vis=1"
30,"Y Shi, W Su, Q Teng, C Li, T Yuan, H Xu, X Song, ...","Opportunity and application of chiral carbon dots",2023,"Matter","cell.com","https://www.cell.com/matter/abstract/S2590-2385(23)00299-0","https://scholar.google.com/scholar?cites=11483800648460050567&as_sdt=2005&sciodt=0,5&hl=en",172,"2025-05-15 21:42:57","","","","",,,,,30,15.00,4,8,2,"Carbon dots (CDs), with the unique advantages of low cost, low toxicity, good photostability, and tunable photoluminescence, have achieved remarkable progress in terms of their …","https://www.sciencedirect.com/science/article/pii/S2590238523002990","https://scholar.google.com/scholar?q=related:h6DcktinXp8J:scholar.google.com/&scioq=source:matter+%222590+2385%22+oxidative+addition+dft&hl=en&as_sdt=0,5&as_vis=1"
31,"JT Kim, X Hao, C Wang, X Sun","Cathode materials for single-phase solid-solid conversion Li-S batteries",2023,"Matter","cell.com","https://www.cell.com/matter/fulltext/S2590-2385(22)00650-6","https://scholar.google.com/scholar?cites=2166339725862357500&as_sdt=2005&sciodt=0,5&hl=en",173,"2025-05-15 21:42:57","HTML","","","",,,,,31,15.50,8,4,2,"Widespread adoption of lithium-sulfur batteries (LSBs) remains inhibited, given their unrealized energy densities, drastic capacity fade, and severe self-discharge stemming from the …","https://www.cell.com/matter/fulltext/S2590-2385(22)00650-6","https://scholar.google.com/scholar?q=related:_MnXvoBiEB4J:scholar.google.com/&scioq=source:matter+%222590+2385%22+oxidative+addition+dft&hl=en&as_sdt=0,5&as_vis=1"
8,"J Liu, Y Ding, M Zeng, L Fu","Chemical insights into two-dimensional quantum materials",2022,"Matter","cell.com","https://www.cell.com/matter/fulltext/S2590-2385(22)00254-5","https://scholar.google.com/scholar?cites=14410161686663665708&as_sdt=2005&sciodt=0,5&hl=en",174,"2025-05-15 21:42:57","HTML","","","",,,,,8,2.67,2,4,3,"… It has been calculated by density functional theory that the excess charge (x) is 0.2–0.4 electrons per MX 2 . By changing temperature and pressure, the distorted octahedral structure …","https://www.cell.com/matter/fulltext/S2590-2385(22)00254-5","https://scholar.google.com/scholar?q=related:LBiIqbQt-8cJ:scholar.google.com/&scioq=source:matter+%222590+2385%22+oxidative+addition+dft&hl=en&as_sdt=0,5&as_vis=1"
151,"J Cai, X Han, X Wang, X Meng","Atomic layer deposition of two-dimensional layered materials: processes, growth mechanisms, and characteristics",2020,"Matter","cell.com","https://www.cell.com/matter/fulltext/S2590-2385(19)30417-5","https://scholar.google.com/scholar?cites=15981322091491823105&as_sdt=2005&sciodt=0,5&hl=en",175,"2025-05-15 21:42:57","HTML","","","",,,,,151,30.20,38,4,5,"Since the discovery of graphene, there has been an ever-increasing interest in two-dimensional (2D) layered materials with exceptional properties. To this end, a variety of synthesis …","https://www.cell.com/matter/fulltext/S2590-2385(19)30417-5","https://scholar.google.com/scholar?q=related:AQ55AMUPyd0J:scholar.google.com/&scioq=source:matter+%222590+2385%22+oxidative+addition+dft&hl=en&as_sdt=0,5&as_vis=1"
10,"H Ma, L Liu, H He, S Sun, S Yang, Y Huang, Y Li, K Tan, ...","Atomically precise Ag clusters for intelligent NIR-II imaging",2024,"Matter","cell.com","https://www.cell.com/matter/abstract/S2590-2385(24)00065-1","https://scholar.google.com/scholar?cites=4731495257774805768&as_sdt=2005&sciodt=0,5&hl=en",176,"2025-05-15 21:42:57","","","","",,,,,10,10.00,1,9,1,"… The density functional theory shows that Ag 29 behaves as a molecular-like semiconductor with a direct band gap of 1.3 eV. Meanwhile, the Pt single atom introduces rich 5d states in …","https://www.cell.com/matter/fulltext/S2590-2385(24)00065-1","https://scholar.google.com/scholar?q=related:CNMcUN6lqUEJ:scholar.google.com/&scioq=source:matter+%222590+2385%22+oxidative+addition+dft&hl=en&as_sdt=0,5&as_vis=1"
23,"JL Andrews, P Stein, DA Santos, CJ Chalker, ...","Curvature-induced modification of mechano-electrochemical coupling and nucleation kinetics in a cathode material",2020,"Matter","cell.com","https://www.cell.com/matter/fulltext/S2590-2385(20)30494-X","https://scholar.google.com/scholar?cites=10744828129551769637&as_sdt=2005&sciodt=0,5&hl=en",177,"2025-05-15 21:42:57","HTML","","","",,,,,23,4.60,5,5,5,"… Based on time-dependent density functional theory (TD-DFT) calculations, the t 2g absorption features are attributed primarily to transitions from O 1s core states of the V=O oxygens in …","https://www.cell.com/matter/fulltext/S2590-2385(20)30494-X","https://scholar.google.com/scholar?q=related:JeCOWkFMHZUJ:scholar.google.com/&scioq=source:matter+%222590+2385%22+oxidative+addition+dft&hl=en&as_sdt=0,5&as_vis=1"
10,"SY Yang, J Wang, Z Deng, Y Xu, X Su, L Zhang, ...","Spiro-materials with aggregation-induced emission",2024,"Matter","cell.com","https://www.cell.com/matter/abstract/S2590-2385(24)00427-2","https://scholar.google.com/scholar?cites=16988246432888210222&as_sdt=2005&sciodt=0,5&hl=en",178,"2025-05-15 21:42:57","","","","",,,,,10,10.00,1,7,1,"… S35 has high thermal stability, morphological stability, and low oxidation potential, and it proved to be a promising optoelectronic material. By utilizing the AIE and good photoelectric …","https://www.cell.com/matter/pdf/S2590-2385(24)00427-2.pdf","https://scholar.google.com/scholar?q=related:LkMZhR9gwusJ:scholar.google.com/&scioq=source:matter+%222590+2385%22+oxidative+addition+dft&hl=en&as_sdt=0,5&as_vis=1"
60,"Z Cai, H Ji, Y Ha, J Liu, DH Kwon, Y Zhang, A Urban, ...","Realizing continuous cation order-to-disorder tuning in a class of high-energy spinel-type Li-ion cathodes",2021,"Matter","cell.com","https://www.cell.com/matter/fulltext/S2590-2385(21)00512-9","https://scholar.google.com/scholar?cites=10340217358009187984&as_sdt=2005&sciodt=0,5&hl=en",179,"2025-05-15 21:42:57","HTML","","","",,,,,60,15.00,8,8,4,"Conventional Li-ion cathode materials are dominated by well-ordered structures, in which Li and transition metals occupy distinct crystallographic sites. We show in this paper that …","https://www.cell.com/matter/fulltext/S2590-2385(21)00512-9","https://scholar.google.com/scholar?q=related:kD53_ObUf48J:scholar.google.com/&scioq=source:matter+%222590+2385%22+oxidative+addition+dft&hl=en&as_sdt=0,5&as_vis=1"
4,"X Shi, L Shi, J Wang, Y Zhou, S Zhao","Defect engineering of nanomaterials for selective electrocatalytic CO2 reduction",2024,"Matter","cell.com","https://www.cell.com/matter/abstract/S2590-2385(24)00503-4","https://scholar.google.com/scholar?cites=6829744551384677616&as_sdt=2005&sciodt=0,5&hl=en",180,"2025-05-15 21:42:57","","","","",,,,,4,4.00,1,5,1,"… Atomic-resolution electron microscopy and density functional theory (DFT) calculations indicate that the introduction of O V s leads to the distortion of the lattice structure and charge …","","https://scholar.google.com/scholar?q=related:8Hzx43sgyF4J:scholar.google.com/&scioq=source:matter+%222590+2385%22+oxidative+addition+dft&hl=en&as_sdt=0,5&as_vis=1"
19,"K Zhang, T Chen, Y Abbas, SU Jan, Z Zhou, S Chu, ...","Atomic arrangement matters: band-gap variation in composition-tunable (Ga1–xZnx)(N1–xOx) nanowires",2021,"Matter","cell.com","https://www.cell.com/matter/fulltext/S2590-2385(20)30693-7","https://scholar.google.com/scholar?cites=2267184339289836013&as_sdt=2005&sciodt=0,5&hl=en",181,"2025-05-15 21:42:57","HTML","","","",,,,,19,4.75,3,7,4,"We synthesized single-crystal (Ga 1–x Zn x )(N 1–x O x ) nanowires with fully tunable compositions (0 <x <1) using a customized chemical vapor deposition strategy. Despite the …","https://www.cell.com/matter/fulltext/S2590-2385(20)30693-7","https://scholar.google.com/scholar?q=related:7Qmz_ySodh8J:scholar.google.com/&scioq=source:matter+%222590+2385%22+oxidative+addition+dft&hl=en&as_sdt=0,5&as_vis=1"
4,"E Hernández-Santiago, J Espinosa-Rocha, ...","Local and global dynamics in organic soft porous crystals",2024,"Matter","cell.com","https://www.cell.com/matter/abstract/S2590-2385(23)00608-2","https://scholar.google.com/scholar?cites=18263720180020082783&as_sdt=2005&sciodt=0,5&hl=en",182,"2025-05-15 21:42:57","","","","",,,,,4,4.00,1,3,1,"… Juanqiao Dong et al. described some of the first cases of phenylene mobility within COFs through computational density functional theory (DFT) calculations in the material labeled NUS-…","https://www.sciencedirect.com/science/article/pii/S2590238523006082","https://scholar.google.com/scholar?q=related:X_g6B73Edf0J:scholar.google.com/&scioq=source:matter+%222590+2385%22+oxidative+addition+dft&hl=en&as_sdt=0,5&as_vis=1"
54,"X Xu, T Guo, M Lanza, HN Alshareef","Status and prospects of MXene-based nanoelectronic devices",2023,"Matter","cell.com","https://www.cell.com/matter/fulltext/S2590-2385(23)00045-0","https://scholar.google.com/scholar?cites=3303778060592418019&as_sdt=2005&sciodt=0,5&hl=en",183,"2025-05-15 21:42:57","HTML","","","",,,,,54,27.00,14,4,2,"… Density functional theory (DFT) calculations performed by Y. Liu and co-workers indicated that with respect to MXenes free of surface groups, the =O surface groups lead to high MXene …","https://www.cell.com/matter/fulltext/S2590-2385(23)00045-0","https://scholar.google.com/scholar?q=related:4wxXVqRg2S0J:scholar.google.com/&scioq=source:matter+%222590+2385%22+oxidative+addition+dft&hl=en&as_sdt=0,5&as_vis=1"
2,"MTK Ng, ASM Ismail, AJS Hammer","A catalyst acceleration platform toward realizing the energy transition",2022,"Matter","cell.com","https://www.cell.com/matter/fulltext/S2590-2385(22)00649-X","https://scholar.google.com/scholar?cites=9011665267600444331&as_sdt=2005&sciodt=0,5&hl=en",184,"2025-05-15 21:42:57","HTML","","","",,,,,2,0.67,1,3,3,"… Traditional ab initio simulation methods, such as density functional theory (DFT), remain the … , a database of surface reactions generated with DFT. Researchers around the world have …","https://www.cell.com/matter/fulltext/S2590-2385(22)00649-X","https://scholar.google.com/scholar?q=related:q8sMptDdD30J:scholar.google.com/&scioq=source:matter+%222590+2385%22+oxidative+addition+dft&hl=en&as_sdt=0,5&as_vis=1"
96,"X Jiang, R Du, R Hübner, Y Hu, A Eychmüller","A roadmap for 3D metal aerogels: materials design and application attempts",2021,"Matter","cell.com","https://www.cell.com/matter/fulltext/S2590-2385(20)30555-5","https://scholar.google.com/scholar?cites=8853094550106699403&as_sdt=2005&sciodt=0,5&hl=en",185,"2025-05-15 21:42:57","HTML","","","",,,,,96,24.00,19,5,4,"… To decipher the nanoscale formation mechanisms, we have recently probed the microscopic assembly process by experiments and density functional theory (DFT) calculations for the …","https://www.cell.com/matter/fulltext/S2590-2385(20)30555-5","https://scholar.google.com/scholar?q=related:i3YObpaC3HoJ:scholar.google.com/&scioq=source:matter+%222590+2385%22+oxidative+addition+dft&hl=en&as_sdt=0,5&as_vis=1"
6,"L An, D de Camargo Branco, X Liu, H Jiang, M Wang, ...","Pulsed laser-enabled liquid-solid transfer for scalable printing of two-dimensional metal oxide thin film",2023,"Matter","cell.com","https://www.cell.com/matter/fulltext/S2590-2385(23)00047-4","https://scholar.google.com/scholar?cites=9736951633718597745&as_sdt=2005&sciodt=0,5&hl=en",186,"2025-05-15 21:42:57","HTML","","","",,,,,6,3.00,1,6,2,"Two-dimensional metal oxides are gathering emerging focus as the next-generation semiconductor due to their unique electric properties. Room temperature liquid metal is promising …","https://www.cell.com/matter/fulltext/S2590-2385(23)00047-4","https://scholar.google.com/scholar?q=related:cdj0GuyZIIcJ:scholar.google.com/&scioq=source:matter+%222590+2385%22+oxidative+addition+dft&hl=en&as_sdt=0,5&as_vis=1"
41,"R Li, NN Adarsh, H Lu, M Wriedt","Metal-organic frameworks as platforms for the removal of per-and polyfluoroalkyl substances from contaminated waters",2022,"Matter","cell.com","https://www.cell.com/matter/fulltext/S2590-2385(22)00442-8","https://scholar.google.com/scholar?cites=10705158100886428290&as_sdt=2005&sciodt=0,5&hl=en",187,"2025-05-15 21:42:57","HTML","","","",,,,,41,13.67,10,4,3,"Poly- and perfluoroalkyl substances (PFAS) have received considerable attention due to their toxicity, ubiquitous presence, and recalcitrance in the environment. The manufacturing and …","https://www.cell.com/matter/fulltext/S2590-2385(22)00442-8","https://scholar.google.com/scholar?q=related:ghq7C5NckJQJ:scholar.google.com/&scioq=source:matter+%222590+2385%22+oxidative+addition+dft&hl=en&as_sdt=0,5&as_vis=1"
0,"SW Ong, SA Agnew, MS Rahman, WJ Scheideler","Sub-nm kinetically controlled liquid metal printing of ternary antimony indium oxide transistors",2025,"Matter","cell.com","https://www.cell.com/matter/abstract/S2590-2385(25)00046-3","",188,"2025-05-15 21:42:57","","","","",,,,,0,0.00,0,4,1,"… These results show a reduction in the optical band gap as Sb doping increases, which matches density functional theory (DFT) predictions that Sb-doped InO x will have a lower …","https://papers.ssrn.com/sol3/Delivery.cfm?abstractid=4967744","https://scholar.google.com/scholar?q=related:Kvpv4DIoH0UJ:scholar.google.com/&scioq=source:matter+%222590+2385%22+oxidative+addition+dft&hl=en&as_sdt=0,5&as_vis=1"
1,"K Fan, P Liu, H Zhao","Distinctive OO bond formation pathways at different electrode potentials",2021,"Matter","cell.com","https://www.cell.com/matter/fulltext/S2590-2385(21)00351-9","https://scholar.google.com/scholar?cites=9359343634189648053&as_sdt=2005&sciodt=0,5&hl=en",189,"2025-05-15 21:42:57","HTML","","","",,,,,1,0.25,0,3,4,"… Density-functional-theory (DFT) calculation elucidated the relative predominance of the IMOC pathway at lower overpotentials and the WNA pathway at higher overpotentials, but it has …","https://www.cell.com/matter/fulltext/S2590-2385(21)00351-9","https://scholar.google.com/scholar?q=related:tQCwhnIR44EJ:scholar.google.com/&scioq=source:matter+%222590+2385%22+oxidative+addition+dft&hl=en&as_sdt=0,5&as_vis=1"
0,"T Feng, J Yang, J Huang, T Zhang, S Lu","Carbon-based nanomaterials for carbon neutralization through electrochemical CO2 reduction and C–N coupling",2025,"Matter","cell.com","https://www.cell.com/matter/abstract/S2590-2385(25)00120-1","",190,"2025-05-15 21:42:57","","","","",,,,,0,0.00,0,5,1,"Carbon nanomaterials are widely used in constructing efficient catalysts to promote electrochemical CO 2 reduction (CO 2 RR) and C–N coupling. They serve as either direct active …","","https://scholar.google.com/scholar?q=related:rCUs0juxOMUJ:scholar.google.com/&scioq=source:matter+%222590+2385%22+oxidative+addition+dft&hl=en&as_sdt=0,5&as_vis=1"
50,"X Tan, S Wang, Q Zhang, H Liu, W Li, L Zhu, H Chen","Stabilizing CsPbI3 perovskite for photovoltaic applications",2023,"Matter","cell.com","https://www.cell.com/matter/fulltext/S2590-2385(22)00702-0","https://scholar.google.com/scholar?cites=1266796542330382710&as_sdt=2005&sciodt=0,5&hl=en",191,"2025-05-15 21:42:57","HTML","","","",,,,,50,25.00,7,7,2,"With suitable band gap (E g ∼1.7 eV), superb optoelectronic properties, and thermal stability, CsPbI 3 has been widely acknowledged as a competitive candidate for photovoltaic …","https://www.cell.com/matter/fulltext/S2590-2385(22)00702-0","https://scholar.google.com/scholar?q=related:dqlLVL6QlBEJ:scholar.google.com/&scioq=source:matter+%222590+2385%22+oxidative+addition+dft&hl=en&as_sdt=0,5&as_vis=1"
