Cites,Authors,Title,Year,Source,Publisher,ArticleURL,CitesURL,GSRank,QueryDate,Type,DOI,ISSN,CitationURL,Volume,Issue,StartPage,EndPage,ECC,CitesPerYear,CitesPerAuthor,AuthorCount,Age,Abstract,FullTextURL,RelatedURL
115,"X Li, M Ji, H Li, H Wang, M Xu, H Rong, J Wei, J Liu, ...","Cation/anion exchange reactions toward the syntheses of upgraded nanostructures: principles and applications",2020,"Matter","cell.com","https://www.cell.com/matter/fulltext/S2590-2385(19)30415-1","https://scholar.google.com/scholar?cites=12478337089301514085&as_sdt=2005&sciodt=0,5&hl=en",127,"2025-05-15 21:42:57","HTML","","","",,,,,115,23.00,13,9,5,"The last 5 years have witnessed rapid progress in the field of hybrid nanostructures toward enhanced optical and electronic properties. On this topic, we focus on the relevant progress …","https://www.cell.com/matter/fulltext/S2590-2385(19)30415-1","https://scholar.google.com/scholar?q=related:ZQdmO3j1K60J:scholar.google.com/&scioq=source:matter+%222590+2385%22+oxidative+addition+dft&hl=en&as_sdt=0,5&as_vis=1"
0,"L Zhang, Q Bing, H Qin, L Yu, H Li, D Deng","Artificial intelligence for catalyst design and synthesis",2025,"Matter","cell.com","https://www.cell.com/matter/abstract/S2590-2385(25)00181-X","",128,"2025-05-15 21:42:57","","","","",,,,,0,0.00,0,6,1,"… On the other hand, ML can significantly accelerate large-scale theoretical computations, offering advantages over traditional methods such as density functional theory (DFT) …","","https://scholar.google.com/scholar?q=related:pduFlhOpJScJ:scholar.google.com/&scioq=source:matter+%222590+2385%22+oxidative+addition+dft&hl=en&as_sdt=0,5&as_vis=1"
6,"Z Li, Q Liu, X Wang","Two-dimensional cluster-assembled materials with properties beyond their individualities and bulks",2023,"Matter","cell.com","https://www.cell.com/matter/abstract/S2590-2385(23)00460-5","https://scholar.google.com/scholar?cites=16341918701809223905&as_sdt=2005&sciodt=0,5&hl=en",129,"2025-05-15 21:42:57","","","","",,,,,6,3.00,2,3,2,"… By employing computational techniques like density functional theory and MD simulations, we can analyze the atomic-level interactions in ultrathin 2D CAMs. This analysis will provide …","https://www.cell.com/matter/pdf/S2590-2385(23)00460-5.pdf","https://scholar.google.com/scholar?q=related:4cim4XkoyuIJ:scholar.google.com/&scioq=source:matter+%222590+2385%22+oxidative+addition+dft&hl=en&as_sdt=0,5&as_vis=1"
114,"G Jia, Y Wang, X Cui, H Zhang, J Zhao, LH Li, L Gu, ...","Wet-chemistry hydrogen doped TiO2 with switchable defects control for photocatalytic hydrogen evolution",2022,"Matter","cell.com","https://www.cell.com/matter/fulltext/S2590-2385(21)00559-2?uuid=uuid%3A949f30ae-beb6-4907-bba8-bde5d63c3e65","https://scholar.google.com/scholar?cites=1801717121097729828&as_sdt=2005&sciodt=0,5&hl=en",130,"2025-05-15 21:42:57","HTML","","","",,,,,114,38.00,14,8,3,"Hydrogen has a remarkably flexible chemistry in oxides. We show that the introduction of H into simple TiO 2 leads to greatly enhanced photocatalytic properties, and specifically yields …","https://www.cell.com/matter/fulltext/S2590-2385(21)00559-2?uuid=uuid%3A949f30ae-beb6-4907-bba8-bde5d63c3e65","https://scholar.google.com/scholar?q=related:JAfF_Cz8ABkJ:scholar.google.com/&scioq=source:matter+%222590+2385%22+oxidative+addition+dft&hl=en&as_sdt=0,5&as_vis=1"
155,"Y Ding, M Zeng, L Fu","Surface chemistry of gallium-based liquid metals",2020,"Matter","cell.com","https://www.cell.com/matter/fulltext/S2590-2385(20)30439-2","https://scholar.google.com/scholar?cites=17091907042214074156&as_sdt=2005&sciodt=0,5&hl=en",131,"2025-05-15 21:42:57","HTML","","","",,,,,155,31.00,52,3,5,"… However, the surface tension will be influenced by surface oxidation. The surface oxidation layer gives liquid metals a certain rigidity, which stabilizes them in an unbalanced shape, …","https://www.cell.com/matter/fulltext/S2590-2385(20)30439-2","https://scholar.google.com/scholar?q=related:LNcq6eWmMu0J:scholar.google.com/&scioq=source:matter+%222590+2385%22+oxidative+addition+dft&hl=en&as_sdt=0,5&as_vis=1"
0,"P Moradifar, T Wang, N Nayir, T Sharifi, K Wang, ...","Thermally induced structural evolution and nanoscale interfacial dynamics in Bi-Sb-Te layered nanostructures",2024,"Matter","cell.com","https://www.cell.com/matter/abstract/S2590-2385(24)00438-7","",132,"2025-05-15 21:42:57","","","","",,,,,0,0.00,0,6,1,"… The experimental findings are further combined with density functional theory (DFT) calculations to … Based on our in situ S/TEM observations and DFT calculations, we identify the most …","","https://scholar.google.com/scholar?q=related:xPnL1Wqf6WsJ:scholar.google.com/&scioq=source:matter+%222590+2385%22+oxidative+addition+dft&hl=en&as_sdt=0,5&as_vis=1"
85,"T Lv, J Li, N Arif, L Qi, J Lu, Z Ye, YJ Zeng","Polarization and external-field enhanced photocatalysis",2022,"Matter","cell.com","https://www.cell.com/matter/fulltext/S2590-2385(22)00299-5","https://scholar.google.com/scholar?cites=7827853390854636967&as_sdt=2005&sciodt=0,5&hl=en",133,"2025-05-15 21:42:57","HTML","","","",,,,,85,28.33,12,7,3,"… In addition, the existence of multiple electric domains causes the surface of the material to … and inefficient spatial separation of the reduction and oxidation sites, which is not conducive to …","https://www.cell.com/matter/fulltext/S2590-2385(22)00299-5","https://scholar.google.com/scholar?q=related:p0W6ay8fomwJ:scholar.google.com/&scioq=source:matter+%222590+2385%22+oxidative+addition+dft&hl=en&as_sdt=0,5&as_vis=1"
11,"CA Triana, R Moré, AJ Bloomfield, PV Petrović, ...","Soft templating and disorder in an applied 1D cobalt coordination polymer electrocatalyst",2019,"Matter","cell.com","https://www.cell.com/matter/fulltext/S2590-2385(19)30103-1","https://scholar.google.com/scholar?cites=17647574821405356211&as_sdt=2005&sciodt=0,5&hl=en",134,"2025-05-15 21:42:57","HTML","","","",,,,,11,1.83,2,5,6,"… To this end, we applied a combination of in situ infrared spectroscopy and density functional theory (DFT) to monitor and determine the structure of synthetic intermediate species toward …","https://www.cell.com/matter/fulltext/S2590-2385(19)30103-1","https://scholar.google.com/scholar?q=related:s3D-mMzH6PQJ:scholar.google.com/&scioq=source:matter+%222590+2385%22+oxidative+addition+dft&hl=en&as_sdt=0,5&as_vis=1"
0,"J Tan, J Wang, S Li, H Nong, S Zeng, X Zou, B Liu, ...","Metal-lattice-heredity synthesis of single-crystalline 2D transition metal oxides",2025,"Matter","cell.com","https://www.cell.com/matter/abstract/S2590-2385(24)00496-X","",135,"2025-05-15 21:42:57","","","","",,,,,0,0.00,0,8,1,"… Density functional theory calculations For the electronic states of Fe 2 O 3 , first-principles density functional theory calculations were performed using the Vienna ab initio simulation …","","https://scholar.google.com/scholar?q=related:EWEbAEK9u-IJ:scholar.google.com/&scioq=source:matter+%222590+2385%22+oxidative+addition+dft&hl=en&as_sdt=0,5&as_vis=1"
0,"T Zhai, X Gao, H Wang, Y Cheng, J Gao, J Pan, ...","Ultrafine semi-crystalline Y-doped RuO2 for highly active and durable proton-exchange-membrane water electrolysis",2025,"Matter","cell.com","https://www.cell.com/matter/abstract/S2590-2385(25)00184-5","",136,"2025-05-15 21:42:57","","","","",,,,,0,0.00,0,7,1,"… DFT simulations were conducted for pristine RuO 2 and … Y-doped RuO 2 , DFT simulations were carried out to calculate … HRTEM, we conducted comparative DFT analyses on the (200) …","","https://scholar.google.com/scholar?q=related:wkr0mAdpjhMJ:scholar.google.com/&scioq=source:matter+%222590+2385%22+oxidative+addition+dft&hl=en&as_sdt=0,5&as_vis=1"
8,"X Guo, H Hong, Q Li, J Zhu, Z Wu, Y Wang, S Yang, ...","Dual robust electrode-electrolyte interfaces enabled by fluorinated electrolyte for high-performance zinc metal batteries",2024,"Matter","cell.com","https://www.cell.com/matter/abstract/S2590-2385(24)00434-X","https://scholar.google.com/scholar?cites=8505898221207198493&as_sdt=2005&sciodt=0,5&hl=en",137,"2025-05-15 21:42:57","","","","",,,,,8,8.00,1,8,1,"… Both ESP maps of solvents and orbital energy (HOMO and LUMO) calculations were performed on the Materials Studio using density functional theory (DFT). The B3LYP functional with …","","https://scholar.google.com/scholar?q=related:HZuusl0FC3YJ:scholar.google.com/&scioq=source:matter+%222590+2385%22+oxidative+addition+dft&hl=en&as_sdt=0,5&as_vis=1"
9,"J Zhou, H Ren, J Zhou, Z Wan, Q Qian, B Peng, S Du, ...","Modular assembly of a library of hybrid superlattices and artificial quantum solids",2024,"Matter","cell.com","https://www.cell.com/matter/abstract/S2590-2385(23)00642-2","https://scholar.google.com/scholar?cites=13809031416475509923&as_sdt=2005&sciodt=0,5&hl=en",138,"2025-05-15 21:42:57","","","","",,,,,9,9.00,1,8,1,"Hybrid superlattices, composed of two-dimensional atomic crystals (2DACs) and self-assembled molecular layers, provide a platform for synergizing the rich physical properties of solid-…","https://www.cell.com/matter/fulltext/S2590-2385(23)00642-2","https://scholar.google.com/scholar?q=related:o2Q77-iIo78J:scholar.google.com/&scioq=source:matter+%222590+2385%22+oxidative+addition+dft&hl=en&as_sdt=0,5&as_vis=1"
31,"J Meng, Z Xiao, L Zhu, X Zhang, X Hong, Y Jia, F Liu, ...","Fluorinated electrode materials for high-energy batteries",2023,"Matter","cell.com","https://www.cell.com/matter/fulltext/S2590-2385(23)00163-7","https://scholar.google.com/scholar?cites=210344065501797758&as_sdt=2005&sciodt=0,5&hl=en",139,"2025-05-15 21:42:57","","","","",,,,,31,15.50,4,8,2,"High-capacity and high-voltage fluorinated electrode materials have attracted great interest for next-generation high-energy batteries, which is associated with the high electronegativity …","https://www.sciencedirect.com/science/article/pii/S2590238523001637","https://scholar.google.com/scholar?q=related:fp3YKNBK6wIJ:scholar.google.com/&scioq=source:matter+%222590+2385%22+oxidative+addition+dft&hl=en&as_sdt=0,5&as_vis=1"
4,"S Liu, CW Pao, JL Chen, S Li, K Chen, Z Xuan, C Song, ...","A general flame aerosol route to high-entropy nanoceramics",2024,"Matter","cell.com","https://www.cell.com/matter/abstract/S2590-2385(24)00429-6","https://scholar.google.com/scholar?cites=1882356917514544285&as_sdt=2005&sciodt=0,5&hl=en",140,"2025-05-15 21:42:57","","","","",,,,,4,4.00,1,8,1,"… Density functional theory (DFT) relaxation of lattice and ionic positions was performed using Vienna Ab initio Simulation Package v.5.4.4 following the default parameters adopted by the …","","https://scholar.google.com/scholar?q=related:nST0sKR5HxoJ:scholar.google.com/&scioq=source:matter+%222590+2385%22+oxidative+addition+dft&hl=en&as_sdt=0,5&as_vis=1"
11,"CA Triana, R Moré, AJ Bloomfield, PV Petrović, ...","Soft templating and disorder in an applied 1D cobalt coordination polymer electrocatalyst",2019,"Matter","cell.com","https://www.cell.com/matter/fulltext/S2590-2385(19)30103-1","https://scholar.google.com/scholar?cites=17647574821405356211&as_sdt=2005&sciodt=0,5&hl=en",141,"2025-05-15 21:42:57","HTML","","","",,,,,11,1.83,2,5,6,"… in oxidation catalysis. First and foremost, it shows high performance as a water oxidation … of in situ infrared spectroscopy and density functional theory (DFT) to monitor and determine …","https://www.cell.com/matter/fulltext/S2590-2385(19)30103-1","https://scholar.google.com/scholar?q=related:s3D-mMzH6PQJ:scholar.google.com/&scioq=source:matter+%222590+2385%22+oxidative+addition+dft&hl=en&as_sdt=0,5&as_vis=1"
45,"F Xu, B Ding, Y Qiu, R Dong, W Zhuang, X Xu, H Han, ...","Generalized domino-driven synthesis of hollow hybrid carbon spheres with ultrafine metal nitrides/oxides",2020,"Matter","cell.com","https://www.cell.com/matter/fulltext/S2590-2385(20)30245-9","https://scholar.google.com/scholar?cites=15098623717240968914&as_sdt=2005&sciodt=0,5&hl=en",142,"2025-05-15 21:42:57","HTML","","","",,,,,45,9.00,6,8,5,"… The density functional theory (DFT) pore-size distributions show similar hierarchically microporous, mesoporous, and macroporous structure especially for those with ultrafine VN …","https://www.cell.com/matter/fulltext/S2590-2385(20)30245-9","https://scholar.google.com/scholar?q=related:0pZvX0YWidEJ:scholar.google.com/&scioq=source:matter+%222590+2385%22+oxidative+addition+dft&hl=en&as_sdt=0,5&as_vis=1"
5,"M Abdelsamie, K Hong, K Cruse, CJ Bartel, ...","Combining text mining, in situ characterization, and ab initio calculations to rationalize BiFeO3 crystallization pathways",2023,"Matter","cell.com","https://www.cell.com/matter/abstract/S2590-2385(23)00502-7","https://scholar.google.com/scholar?cites=4424885218603679488&as_sdt=2005&sciodt=0,5&hl=en",143,"2025-05-15 21:42:57","","","","",,,,,5,2.50,1,5,2,"… Last, we used density functional theory calculations to rationalize observed crystallization … Highlighting the effect of this intermediate on competing reactions in this system, our DFT …","https://www.cell.com/matter/pdfExtended/S2590-2385(23)00502-7","https://scholar.google.com/scholar?q=related:AL-_iqlZaD0J:scholar.google.com/&scioq=source:matter+%222590+2385%22+oxidative+addition+dft&hl=en&as_sdt=0,5&as_vis=1"
111,"R Du, X Fan, X Jin, R Hübner, Y Hu, A Eychmüller","Emerging noble metal aerogels: state of the art and a look forward",2019,"Matter","cell.com","https://www.cell.com/matter/fulltext/S2590-2385(19)30031-1","https://scholar.google.com/scholar?cites=2618473404108836613&as_sdt=2005&sciodt=0,5&hl=en",144,"2025-05-15 21:42:57","HTML","","","",,,,,111,18.50,19,6,6,"… by experiments and calculations by density functional theory, whereby stronger cation-ligand … The alcohol electro-oxidation reaction (ethanol oxidation, methanol oxidation) is the most …","https://www.cell.com/matter/fulltext/S2590-2385(19)30031-1","https://scholar.google.com/scholar?q=related:BQ-3EbCvViQJ:scholar.google.com/&scioq=source:matter+%222590+2385%22+oxidative+addition+dft&hl=en&as_sdt=0,5&as_vis=1"
46,"Y Hu, J Fu, J Xu, J Luo, F Zhao, H Su, Y Liu, X Lin, W Li, ...","Superionic amorphous NaTaCl6 halide electrolyte for highly reversible all-solid-state Na-ion batteries",2024,"Matter","cell.com","https://www.cell.com/matter/abstract/S2590-2385(23)00630-6","https://scholar.google.com/scholar?cites=5946288827920043437&as_sdt=2005&sciodt=0,5&hl=en",145,"2025-05-15 21:42:57","","","","",,,,,46,46.00,5,10,1,"Designing Na-ion solid electrolytes (SEs) of high ionic conductivity and excellent chemical/mechanical compatibility with cathode materials remains challenging for all-solid-state Na-ion …","https://www.cell.com/matter/fulltext/S2590-2385(23)00630-6","https://scholar.google.com/scholar?q=related:rU0MKC92hVIJ:scholar.google.com/&scioq=source:matter+%222590+2385%22+oxidative+addition+dft&hl=en&as_sdt=0,5&as_vis=1"
59,"Y Qin, Z Li, Y Duan, J Guo, M Zhao, Z Tang","Nanostructural engineering of metal-organic frameworks: Construction strategies and catalytic applications",2022,"Matter","cell.com","https://www.cell.com/matter/fulltext/S2590-2385(22)00413-1","https://scholar.google.com/scholar?cites=480615111698247812&as_sdt=2005&sciodt=0,5&hl=en",146,"2025-05-15 21:42:57","HTML","","","",,,,,59,19.67,10,6,3,"Famous as emerging inorganic-organic hybrid materials, metal-organic frameworks (MOFs) and MOF-based composites have been displaying bright prospects in catalysis fields. It is …","https://www.cell.com/matter/fulltext/S2590-2385(22)00413-1","https://scholar.google.com/scholar?q=related:hHB1zuV8qwYJ:scholar.google.com/&scioq=source:matter+%222590+2385%22+oxidative+addition+dft&hl=en&as_sdt=0,5&as_vis=1"
62,"F Jin, B Wang, J Wang, Y Wang, Y Ning, J Yang, ...","Boosting electrochemical kinetics of S cathodes for room temperature Na/S batteries",2021,"Matter","cell.com","https://www.cell.com/matter/fulltext/S2590-2385(21)00111-9","https://scholar.google.com/scholar?cites=3317422004474648026&as_sdt=2005&sciodt=0,5&hl=en",147,"2025-05-15 21:42:57","HTML","","","",,,,,62,15.50,9,7,4,"… Density functional theory (DFT) calculation explained that the migration energy barrier for Se 0.08 S 0.92 @pPAN (0.22 eV) was lower than that of S@pPAN (0.95 eV). Therefore, the …","https://www.cell.com/matter/fulltext/S2590-2385(21)00111-9","https://scholar.google.com/scholar?q=related:2pXGkrzZCS4J:scholar.google.com/&scioq=source:matter+%222590+2385%22+oxidative+addition+dft&hl=en&as_sdt=0,5&as_vis=1"
4,"S Liu, CW Pao, JL Chen, S Li, K Chen, Z Xuan, C Song, ...","A general flame aerosol route to high-entropy nanoceramics",2024,"Matter","cell.com","https://www.cell.com/matter/abstract/S2590-2385(24)00429-6","https://scholar.google.com/scholar?cites=1882356917514544285&as_sdt=2005&sciodt=0,5&hl=en",148,"2025-05-15 21:42:57","","","","",,,,,4,4.00,1,8,1,"… Density functional theory (DFT) relaxation of lattice and ionic positions was performed using Vienna Ab initio Simulation Package v.5.4.4 following the default parameters adopted by the …","","https://scholar.google.com/scholar?q=related:nST0sKR5HxoJ:scholar.google.com/&scioq=source:matter+%222590+2385%22+oxidative+addition+dft&hl=en&as_sdt=0,5&as_vis=1"
5,"P Li, S Yang, J Zhu, S Wang, Y Hou, H Cui, Z Chen, ...","Achieving high-concentration Cl− ions in non-aqueous electrolytes for high-energy-density Li-Cl2 batteries",2024,"Matter","cell.com","https://www.cell.com/matter/abstract/S2590-2385(24)00139-5","https://scholar.google.com/scholar?cites=15580209975573757729&as_sdt=2005&sciodt=0,5&hl=en",149,"2025-05-15 21:42:57","","","","",,,,,5,5.00,1,8,1,"Chlorine-based electrochemical energy storage is a promising candidate for sustainable battery technology. The anionic redox reaction of Cl 0/−1 is of interest due to its superior redox …","","https://scholar.google.com/scholar?q=related:IT8S4GwGONgJ:scholar.google.com/&scioq=source:matter+%222590+2385%22+oxidative+addition+dft&hl=en&as_sdt=0,5&as_vis=1"
90,"L Zhou, L Liu, Z Hao, Z Yan, XF Yu, PK Chu, K Zhang, ...","Opportunities and challenges for aqueous metal-proton batteries",2021,"Matter","cell.com","https://www.cell.com/matter/fulltext/S2590-2385(21)00055-2","https://scholar.google.com/scholar?cites=3759518953654202110&as_sdt=2005&sciodt=0,5&hl=en",150,"2025-05-15 21:42:57","HTML","","","",,,,,90,22.50,11,8,4,"… First-principles calculation has been performed based on the density functional theory to predict the effects of pH on Li + or H + intercalation into lithium transition-metal oxides (Li x MO …","https://www.cell.com/matter/fulltext/S2590-2385(21)00055-2","https://scholar.google.com/scholar?q=related:_i7ozpF-LDQJ:scholar.google.com/&scioq=source:matter+%222590+2385%22+oxidative+addition+dft&hl=en&as_sdt=0,5&as_vis=1"
65,"Q Cui, X Song, Y Liu, Z Xu, H Ye, Z Yang, K Zhao, ...","Halide-modulated self-assembly of metal-free perovskite single crystals for bio-friendly X-ray detection",2021,"Matter","cell.com","https://www.cell.com/matter/fulltext/S2590-2385(21)00237-X","https://scholar.google.com/scholar?cites=2765262881056260077&as_sdt=2005&sciodt=0,5&hl=en",151,"2025-05-15 21:42:57","HTML","","","",,,,,65,16.25,8,8,4,"Not until recently have metal-free halide perovskites become recognized as novel candidates for ferroelectrics and X-ray detection. However, molecular self-assembly of these …","https://www.cell.com/matter/fulltext/S2590-2385(21)00237-X","https://scholar.google.com/scholar?q=related:7X_ud_AvYCYJ:scholar.google.com/&scioq=source:matter+%222590+2385%22+oxidative+addition+dft&hl=en&as_sdt=0,5&as_vis=1"
0,"P Yang, C Yang, Z Wu, Z Tang","Evolving metal-organic frameworks for highly active oxygen evolution",2025,"Matter","cell.com","https://www.cell.com/matter/abstract/S2590-2385(25)00089-X","",152,"2025-05-15 21:42:57","","","","",,,,,0,0.00,0,4,1,"… Since there are several well-established MOF structure databases, 65 , 66 it is wise to employ high-throughput density functional theory (DFT) calculations to cultivate large amounts of …","https://www.cell.com/matter/pdf/S2590-2385(25)00089-X.pdf","https://scholar.google.com/scholar?q=related:hDfpCERjr3oJ:scholar.google.com/&scioq=source:matter+%222590+2385%22+oxidative+addition+dft&hl=en&as_sdt=0,5&as_vis=1"
2,"KJ Jun, G Wei, X Yang, Y Chen, G Ceder","Exploring the soft cradle effect and ionic transport mechanisms in the LiMXCl4 superionic conductor family",2025,"Matter","cell.com","https://www.cell.com/matter/fulltext/S2590-2385(25)00044-X","https://scholar.google.com/scholar?cites=15506322382855261750&as_sdt=2005&sciodt=0,5&hl=en",153,"2025-05-15 21:42:57","HTML","","","",,,,,2,2.00,0,5,1,"… Adams, employing density functional theory (DFT) and empirical molecular dynamics simulations, demonstrated the high compressibility and rotational mobility of NbO 2 Cl 4 polyhedra …","https://www.cell.com/matter/fulltext/S2590-2385(25)00044-X","https://scholar.google.com/scholar?q=related:Ns7GGg2GMdcJ:scholar.google.com/&scioq=source:matter+%222590+2385%22+oxidative+addition+dft&hl=en&as_sdt=0,5&as_vis=1"
4,"X Zhan, X Fan, W Li, X Tan, AW Robertson, ...","Coupled metal atomic pairs for synergistic electrocatalytic CO2 reduction",2024,"Matter","cell.com","https://www.cell.com/matter/abstract/S2590-2385(24)00492-2","https://scholar.google.com/scholar?cites=10338075847718725180&as_sdt=2005&sciodt=0,5&hl=en",154,"2025-05-15 21:42:57","","","","",,,,,4,4.00,1,6,1,"… elemental distribution is an invaluable partner to density functional theory (DFT) calculations, with the experimental data acting as ideal inputs for DFT modeling. In the future, performing …","","https://scholar.google.com/scholar?q=related:POZRxDU5eI8J:scholar.google.com/&scioq=source:matter+%222590+2385%22+oxidative+addition+dft&hl=en&as_sdt=0,5&as_vis=1"
30,"L Xiang, P Zhang, C Liu, X He, HB Li, Y Li, Z Wang, ...","Conductance and configuration of molecular gold-water-gold junctions under electric fields",2020,"Matter","cell.com","https://www.cell.com/matter/fulltext/S2590-2385(20)30171-5","https://scholar.google.com/scholar?cites=14970836007340785130&as_sdt=2005&sciodt=0,5&hl=en",155,"2025-05-15 21:42:57","HTML","","","",,,,,30,6.00,4,8,5,"… density functional theory (DFT). Finally, because water molecules have a large electric dipole moment, we examined the influence of the molecular orientation on the conductance of a …","https://www.cell.com/matter/fulltext/S2590-2385(20)30171-5","https://scholar.google.com/scholar?q=related:6r0soAcYw88J:scholar.google.com/&scioq=source:matter+%222590+2385%22+oxidative+addition+dft&hl=en&as_sdt=0,5&as_vis=1"
109,"Y Xu, L Gao, L Shen, Q Liu, Y Zhu, Q Liu, L Li, X Kong, ...","Ion-transport-rectifying layer enables Li-metal batteries with high energy density",2020,"Matter","cell.com","https://www.cell.com/matter/fulltext/S2590-2385(20)30438-0","https://scholar.google.com/scholar?cites=350618542422539209&as_sdt=2005&sciodt=0,5&hl=en",156,"2025-05-15 21:42:57","HTML","","","",,,,,109,21.80,12,9,5,"… The fixation of PF 6 − anions to the Zr sites was further revealed by their binding energies (E B ), which were estimated from density functional theory (DFT) calculation for both rigid (…","https://www.cell.com/matter/fulltext/S2590-2385(20)30438-0","https://scholar.google.com/scholar?q=related:ybvC6LSl3QQJ:scholar.google.com/&scioq=source:matter+%222590+2385%22+oxidative+addition+dft&hl=en&as_sdt=0,5&as_vis=1"
146,"S Yang, R He, Z Zhang, Y Cao, X Gao, X Liu","CHAIN: cyber hierarchy and interactional network enabling digital solution for battery full-lifespan management",2020,"Matter","cell.com","https://www.cell.com/matter/fulltext/S2590-2385(20)30186-7","https://scholar.google.com/scholar?cites=8576871765086008321&as_sdt=2005&sciodt=0,5&hl=en",157,"2025-05-15 21:42:57","HTML","","","",,,,,146,29.20,24,6,5,"… Single atoms are synthesized under the guidance of density functional theory calculations, … , a reaction model represents a suitable description of the surface deposition and oxidation …","https://www.cell.com/matter/fulltext/S2590-2385(20)30186-7","https://scholar.google.com/scholar?q=related:AXQHmm0rB3cJ:scholar.google.com/&scioq=source:matter+%222590+2385%22+oxidative+addition+dft&hl=en&as_sdt=0,5&as_vis=1"
32,"Q Gong, H Zhang, H Yu, S Jeon, Y Ren, Z Yang, ...","Amino-tethering synthesis strategy toward highly accessible sub-3-nm L10-PtM catalysts for high-power fuel cells",2023,"Matter","cell.com","https://www.cell.com/matter/fulltext/S2590-2385(22)00701-9","https://scholar.google.com/scholar?cites=17959347565671511303&as_sdt=2005&sciodt=0,5&hl=en",158,"2025-05-15 21:42:57","HTML","","","",,,,,32,16.00,5,7,2,"Because of the poor accessibility of embedded active sites, platinum (Pt)-based electrocatalysts suffer from insufficient Pt utilization and mass transport in membrane electrode …","https://www.cell.com/matter/fulltext/S2590-2385(22)00701-9","https://scholar.google.com/scholar?q=related:B3WgUXVrPPkJ:scholar.google.com/&scioq=source:matter+%222590+2385%22+oxidative+addition+dft&hl=en&as_sdt=0,5&as_vis=1"
0,"B Zhao, Z Xin, YC Wang, C Wu, W Wang, R Shi, ...","Bioinspired gas-receptor synergistic interaction for high-performance two-dimensional neuromorphic devices",2025,"Matter","cell.com","https://www.cell.com/matter/abstract/S2590-2385(25)00087-6","",159,"2025-05-15 21:42:57","","","","",,,,,0,0.00,0,7,1,"… Using density functional theory (DFT) calculations, we explore the adsorption behaviors of a H 2 O molecule on pr-MoS 2 and de-MoS 2 (including V S -MoS 2 and O S -MoS 2 ). A (3 × 3…","","https://scholar.google.com/scholar?q=related:yyvT6uN2kNgJ:scholar.google.com/&scioq=source:matter+%222590+2385%22+oxidative+addition+dft&hl=en&as_sdt=0,5&as_vis=1"
