Cites,Authors,Title,Year,Source,Publisher,ArticleURL,CitesURL,GSRank,QueryDate,Type,DOI,ISSN,CitationURL,Volume,Issue,StartPage,EndPage,ECC,CitesPerYear,CitesPerAuthor,AuthorCount,Age,Abstract,FullTextURL,RelatedURL
59,"S Teale, M Degani, B Chen, EH Sargent, G Grancini","Molecular cation and low-dimensional perovskite surface passivation in perovskite solar cells",2024,"Nature Energy","nature.com","https://www.nature.com/articles/s41560-024-01529-3","https://scholar.google.com/scholar?cites=2958988200802706164&as_sdt=2005&sciodt=0,5&hl=en",720,"2025-05-05 22:27:38","","","","",,,,,59,59.00,12,5,1,"… Density functional theory calculations consistently show that the formation energy of 2D perovskite is lower than that of a 3D structure: this drives the conversion from 3D to 2D upon …","https://light.northwestern.edu/wp-content/uploads/2024/07/Teale_et_al-2024-Nature_Energy.pdf","https://scholar.google.com/scholar?q=related:9OJqWxdwECkJ:scholar.google.com/&scioq=source:nature+migratory+insertion+dft&hl=en&as_sdt=0,5&as_vis=1"
11,"X Li, MD Wodrich, J Waser","Accessing elusive σ-type cyclopropenium cation equivalents through redox gold catalysis",2024,"Nature Chemistry","nature.com","https://www.nature.com/articles/s41557-024-01535-8","https://scholar.google.com/scholar?cites=17011303674180871919&as_sdt=2005&sciodt=0,5&hl=en",721,"2025-05-05 22:27:38","HTML","","","",,,,,11,11.00,4,3,1,"… First, we used density functional theory (DFT) at the B3PW91-D3(BJ)/def2-TZVP//PBE0-D3(BJ)/def2-SVP level (Supplementary Section 8.8 and Supplementary Fig. 19) to further assess …","https://www.nature.com/articles/s41557-024-01535-8","https://scholar.google.com/scholar?q=related:7ybZ2Y9KFOwJ:scholar.google.com/&scioq=source:nature+migratory+insertion+dft&hl=en&as_sdt=0,5&as_vis=1"
51,"K Zuo, X Zhang, X Huang, EF Oliveira, H Guo…","Ultrahigh resistance of hexagonal boron nitride to mineral scale formation",2022,"Nature …","nature.com","https://www.nature.com/articles/s41467-022-32193-4","https://scholar.google.com/scholar?cites=7267239289162844037&as_sdt=2005&sciodt=0,5&hl=en",722,"2025-05-05 22:27:38","HTML","","","",,,,,51,17.00,9,6,3,"… Our DFT simulation and QCMD water vapor adsorption experiments demonstrate the alignment of water molecules and formation of a condensed hydration layer on hBN. Interestingly, …","https://www.nature.com/articles/s41467-022-32193-4","https://scholar.google.com/scholar?q=related:hUdQSKFr2mQJ:scholar.google.com/&scioq=source:nature+migratory+insertion+dft&hl=en&as_sdt=0,5&as_vis=1"
107,"X Wang, Y Tong, W Feng, P Liu, X Li, Y Cui…","Embedding oxophilic rare-earth single atom in platinum nanoclusters for efficient hydrogen electro-oxidation",2023,"Nature …","nature.com","https://www.nature.com/articles/s41467-023-39475-5","https://scholar.google.com/scholar?cites=13381316353897214714&as_sdt=2005&sciodt=0,5&hl=en",723,"2025-05-05 22:27:38","HTML","","","",,,,,107,53.50,15,7,2,"… Considering that the sluggish HOR on the Pt-based catalyst in an alkaline environment is largely related to the intrinsic poor OH - adsorption on Pt (111) 29 , we conducted a DFT …","https://www.nature.com/articles/s41467-023-39475-5","https://scholar.google.com/scholar?q=related:-jIrnVP8s7kJ:scholar.google.com/&scioq=source:nature+migratory+insertion+dft&hl=en&as_sdt=0,5&as_vis=1"
157,"J Tuček, K Holá, AB Bourlinos, P Błoński…","Room temperature organic magnets derived from sp3 functionalized graphene",2017,"Nature …","nature.com","https://www.nature.com/articles/ncomms14525","https://scholar.google.com/scholar?cites=13517087309952866602&as_sdt=2005&sciodt=0,5&hl=en",724,"2025-05-05 22:27:38","HTML","","","",,,,,157,19.63,31,5,8,"… on density functional theory (DFT) calculations for the C 18 (OH) y F x basic studied cell (Fig. 6). The magnetization map shows the propensity for the formation of FM ground states as a …","https://www.nature.com/articles/ncomms14525","https://scholar.google.com/scholar?q=related:Klmus0pXlrsJ:scholar.google.com/&scioq=source:nature+migratory+insertion+dft&hl=en&as_sdt=0,5&as_vis=1"
3,"Y Fu, X Ai, Z Hu, S Zhao, X Lu, J Huang…","Interface kinetic manipulation enabling efficient and reliable Mg3Sb2 thermoelectrics",2024,"Nature …","nature.com","https://www.nature.com/articles/s41467-024-53598-3","https://scholar.google.com/scholar?cites=5773780668179012861&as_sdt=2005&sciodt=0,5&hl=en",725,"2025-05-05 22:27:38","HTML","","","",,,,,3,3.00,0,7,1,"… Density functional theory (DFT) calculations were further performed to elucidate the interface kinetic differences. First, the vacancy formation energies of a number of barrier layer …","https://www.nature.com/articles/s41467-024-53598-3","https://scholar.google.com/scholar?q=related:_dzTSe2WIFAJ:scholar.google.com/&scioq=source:nature+migratory+insertion+dft&hl=en&as_sdt=0,5&as_vis=1"
0,"OH CH3O, H OO","3.7. 2 Sequential C–H Activation and Inner-Sphere Carbene Insertion",2021,"Computational Advances of Rh-Catalyzed C …","books.google.com","https://books.google.com/books?hl=en&lr=&id=WHggEAAAQBAJ&oi=fnd&pg=PA80&dq=source:nature+migratory+insertion+dft&ots=ToGeadlplF&sig=1YWFTK6bkuB4uIyqh5bYAeNy-RU","",726,"2025-05-05 22:27:38","","","","",,,,,0,0.00,0,2,4,"… In 2015, Xie and co-workers [193] reported a DFT study on the mechanism of dirhodium-catalyzed carbene insertion into the nucleophilic C–H bond of … The migratory insertion of the …","","https://scholar.google.com/scholar?q=related:3COkgfdb95kJ:scholar.google.com/&scioq=source:nature+migratory+insertion+dft&hl=en&as_sdt=0,5&as_vis=1"
21,"Y Chen, P Shen, T Cao, H Chen, Z Zhao…","Bottom-up modular synthesis of well-defined oligo (arylfuran) s",2021,"Nature …","nature.com","https://www.nature.com/articles/s41467-021-26387-5","https://scholar.google.com/scholar?cites=5926865824443517450&as_sdt=2005&sciodt=0,5&hl=en",727,"2025-05-05 22:27:38","HTML","","","",,,,,21,5.25,4,6,4,"… migration might proceed through a β-silyl palatium carbene intermediate, wherein the 1,2-Si migration … , theoretical calculation based on density functional theory (DFT) were carried out …","https://www.nature.com/articles/s41467-021-26387-5","https://scholar.google.com/scholar?q=related:CspbwRB1QFIJ:scholar.google.com/&scioq=source:nature+migratory+insertion+dft&hl=en&as_sdt=0,5&as_vis=1"
23,"JH Hur","The origin of the exceptionally low activation energy of oxygen vacancy in tantalum pentoxide based resistive memory",2019,"Scientific reports","nature.com","https://www.nature.com/articles/s41598-019-53498-3","https://scholar.google.com/scholar?cites=15162799532435233031&as_sdt=2005&sciodt=0,5&hl=en",728,"2025-05-05 22:27:38","HTML","","","",,,,,23,3.83,23,1,6,"… By means of analyzing all the most plausible cases, we find the decisive migration … λ phase Ta 2 O 5 via first-principles DFT calculations has been made. The study was aimed to …","https://www.nature.com/articles/s41598-019-53498-3","https://scholar.google.com/scholar?q=related:B9lCu9YVbdIJ:scholar.google.com/&scioq=source:nature+migratory+insertion+dft&hl=en&as_sdt=0,5&as_vis=1"
48,"M Wang, Y Wei, X Wang, R Li, S Zhang, K Wang…","An integrated system with functions of solar desalination, power generation and crop irrigation",2023,"Nature Water","nature.com","https://www.nature.com/articles/s44221-023-00118-0","https://scholar.google.com/scholar?cites=8479200350133399752&as_sdt=2005&sciodt=0,5&hl=en",729,"2025-05-05 22:27:38","","","","",,,,,48,24.00,7,7,2,"… density functional theory (DFT) optimization 37,38 . Simulations (Fig. 3b) depict the whole process of continuous H 2 O evaporation over time from the high Na + concentration region on …","","https://scholar.google.com/scholar?q=related:yLARMcsrrHUJ:scholar.google.com/&scioq=source:nature+migratory+insertion+dft&hl=en&as_sdt=0,5&as_vis=1"
1,"P Bourbon, K Vitse, A Martin-Mingot, H Geindre…","Leveraging long-lived arenium ions in superacid for meta-selective methylation",2024,"Nature …","nature.com","https://www.nature.com/articles/s41467-024-49421-8","https://scholar.google.com/scholar?cites=2586968635577148320&as_sdt=2005&sciodt=0,5&hl=en",730,"2025-05-05 22:27:38","HTML","","","",,,,,1,1.00,0,5,1,"… sole basis (see below for the proposition from DFT calculations). Similarly, 1 H NMR spectrum … In each case, the preferred site of protonation was further confirmed by DFT calculations at …","https://www.nature.com/articles/s41467-024-49421-8","https://scholar.google.com/scholar?q=related:oCOniETC5iMJ:scholar.google.com/&scioq=source:nature+migratory+insertion+dft&hl=en&as_sdt=0,5&as_vis=1"
107,"KT Butler, G Sai Gautam, P Canepa","Designing interfaces in energy materials applications with first-principles calculations",2019,"npj Computational Materials","nature.com","https://www.nature.com/articles/s41524-019-0160-9","https://scholar.google.com/scholar?cites=15358688989486306062&as_sdt=2005&sciodt=0,5&hl=en",731,"2025-05-05 22:27:38","HTML","","","",,,,,107,17.83,36,3,6,"… electronic structure methods, particularly density functional theory (DFT). Having provided the … We survey the state-of-the-art in the use of DFT in the aforementioned applications. …","https://www.nature.com/articles/s41524-019-0160-9","https://scholar.google.com/scholar?q=related:DtMIGkMGJdUJ:scholar.google.com/&scioq=source:nature+migratory+insertion+dft&hl=en&as_sdt=0,5&as_vis=1"
70,"Y Wang, T Szilvási, S Yao, M Driess","A bis (silylene)-stabilized diphosphorus compound and its reactivity as a monophosphorus anion transfer reagent",2020,"Nature Chemistry","nature.com","https://www.nature.com/articles/s41557-020-0518-0","https://scholar.google.com/scholar?cites=11761403198849909567&as_sdt=2005&sciodt=0,5&hl=en",732,"2025-05-05 22:27:38","","","","",,,,,70,14.00,18,4,5,"… We also studied the mechanism of the reaction of 1 with P 4 by DFT calculations (Extended Data Fig. 2). We found that the lone pair of electrons at one silylene group could induce cage …","","https://scholar.google.com/scholar?q=related:P4OXD-XlOKMJ:scholar.google.com/&scioq=source:nature+migratory+insertion+dft&hl=en&as_sdt=0,5&as_vis=1"
94,"Z Li, C Mao, Q Pei, PN Duchesne, T He, M Xia…","Engineered disorder in CO2 photocatalysis",2022,"Nature …","nature.com","https://www.nature.com/articles/s41467-022-34798-1","https://scholar.google.com/scholar?cites=11874833108940103347&as_sdt=2005&sciodt=0,5&hl=en",733,"2025-05-05 22:27:38","HTML","","","",,,,,94,31.33,13,7,3,"… Appreciable underestimation of band gap and delocalization of d and f electrons are well-known limitations of DFT. Therefore, DFT with Hubbard energy correction (DFT + U) formalism …","https://www.nature.com/articles/s41467-022-34798-1","https://scholar.google.com/scholar?q=related:sx5sCczhy6QJ:scholar.google.com/&scioq=source:nature+migratory+insertion+dft&hl=en&as_sdt=0,5&as_vis=1"
24,"N Arora, A Greco, S Meloni, A Hinderhofer…","Kinetics and energetics of metal halide perovskite conversion reactions at the nanoscale",2022,"Communications …","nature.com","https://www.nature.com/articles/s43246-022-00239-1","https://scholar.google.com/scholar?cites=5016410318605912550&as_sdt=2005&sciodt=0,5&hl=en",734,"2025-05-05 22:27:38","HTML","","","",,,,,24,8.00,5,5,3,"… dynamics (MD) and density functional theory (DFT) calculations to understand … migration of ions from site to site between the PbX 2 slabs. In the case of MAI-PbI 2 system, the migration …","https://www.nature.com/articles/s43246-022-00239-1","https://scholar.google.com/scholar?q=related:5gkcUJvenUUJ:scholar.google.com/&scioq=source:nature+migratory+insertion+dft&hl=en&as_sdt=0,5&as_vis=1"
200,"JM Spruell, A Coskun, DC Friedman, RS Forgan…","Highly stable tetrathiafulvalene radical dimers in [3] catenanes",2010,"Nature …","nature.com","https://www.nature.com/articles/nchem.749","https://scholar.google.com/scholar?cites=1917402166829058826&as_sdt=2005&sciodt=0,5&hl=en",735,"2025-05-05 22:27:38","","","","",,,,,200,13.33,40,5,15,"… Density functional theory (DFT) using the M06 suite of functionals 54,55 —a combination that we have shown previously to provide accurate structural and energetic descriptions of …","https://www.scholars.northwestern.edu/en/publications/highly-stable-tetrathiafulvalene-radical-dimers-in-3catenanes","https://scholar.google.com/scholar?q=related:CgtppRz7mxoJ:scholar.google.com/&scioq=source:nature+migratory+insertion+dft&hl=en&as_sdt=0,5&as_vis=1"
341,"R Van Den Berg, G Prieto, G Korpershoek…","Structure sensitivity of Cu and CuZn catalysts relevant to industrial methanol synthesis",2016,"Nature …","nature.com","https://www.nature.com/articles/ncomms13057","https://scholar.google.com/scholar?cites=2428488052931077193&as_sdt=2005&sciodt=0,5&hl=en",736,"2025-05-05 22:27:38","HTML","","","",,,,,341,37.89,85,4,9,"… Recently, in the case of the methanol synthesis reaction, density functional theory (DFT) … The DFT calculations predict that the energies of both the intermediates, as well as the …","https://www.nature.com/articles/ncomms13057","https://scholar.google.com/scholar?q=related:SaQ8eAS5syEJ:scholar.google.com/&scioq=source:nature+migratory+insertion+dft&hl=en&as_sdt=0,5&as_vis=1"
13,"G Li, S Jiang, A Liu, L Ye, J Ke, C Liu, L Chen…","Proof of crystal-field-perturbation-enhanced luminescence of lanthanide-doped nanocrystals through interstitial H+ doping",2023,"Nature …","nature.com","https://www.nature.com/articles/s41467-023-41411-6","https://scholar.google.com/scholar?cites=3135560246501187940&as_sdt=2005&sciodt=0,5&hl=en",737,"2025-05-05 22:27:38","HTML","","","",,,,,13,6.50,2,8,2,"… This reasoning was supported by first-principles density functional theory (DFT) calculations, … Motivated by these positive DFT results, we synthesized a series of interstitially H + -doped …","https://www.nature.com/articles/s41467-023-41411-6","https://scholar.google.com/scholar?q=related:ZCGKaG6_gysJ:scholar.google.com/&scioq=source:nature+migratory+insertion+dft&hl=en&as_sdt=0,5&as_vis=1"
11,"A Diggs, Z Zhao, RV Meidanshahi, D Unruh…","Hydrogen-induced degradation dynamics in silicon heterojunction solar cells via machine learning",2023,"Communications …","nature.com","https://www.nature.com/articles/s43246-023-00347-6","https://scholar.google.com/scholar?cites=1760503489810209626&as_sdt=2005&sciodt=0,5&hl=en",738,"2025-05-05 22:27:38","HTML","","","",,,,,11,5.50,2,5,2,"… DFT with DFT-level accuracy, as described in detail below. … GAP energy-per-atom and the DFT energy-per-atom to below … different DFT methods, as well as the differences between DFT …","https://www.nature.com/articles/s43246-023-00347-6","https://scholar.google.com/scholar?q=related:Whv5r5iQbhgJ:scholar.google.com/&scioq=source:nature+migratory+insertion+dft&hl=en&as_sdt=0,5&as_vis=1"
364,"M Fahlman, S Fabiano, V Gueskine, D Simon…","Interfaces in organic electronics",2019,"Nature Reviews …","nature.com","https://www.nature.com/articles/s41578-019-0127-y","https://scholar.google.com/scholar?cites=6839528085335586950&as_sdt=2005&sciodt=0,5&hl=en",739,"2025-05-05 22:27:38","","","","",,,,,364,60.67,73,5,6,"… Density functional theory (DFT) is the main approach for determining the ground-state … For weak chemisorption, the DFT-calculated DOS is typically broadened with a Lorentzian function …","https://www.diva-portal.org/smash/get/diva2:1353621/FULLTEXT01.pdf","https://scholar.google.com/scholar?q=related:hji8ZY7i6l4J:scholar.google.com/&scioq=source:nature+migratory+insertion+dft&hl=en&as_sdt=0,5&as_vis=1"
102,"H Mandai, K Fujii, H Yasuhara, K Abe, K Mitsudo…","Enantioselective acyl transfer catalysis by a combination of common catalytic motifs and electrostatic interactions",2016,"Nature …","nature.com","https://www.nature.com/articles/ncomms11297","https://scholar.google.com/scholar?cites=16265905899323052905&as_sdt=2005&sciodt=0,5&hl=en",740,"2025-05-05 22:27:38","HTML","","","",,,,,102,11.33,17,6,9,"… To gain further insight regarding the role of the chiral catalyst’s tertiary hydroxyl groups, density functional theory (DFT) calculations were performed at the B3LYP/6-31G(d) level, with 9a …","https://www.nature.com/articles/ncomms11297","https://scholar.google.com/scholar?q=related:adMUJzwbvOEJ:scholar.google.com/&scioq=source:nature+migratory+insertion+dft&hl=en&as_sdt=0,5&as_vis=1"
14,"P Zou, D Iuga, S Ling, AJ Brown, S Chen…","A fast ceramic mixed OH−/H+ ionic conductor for low temperature fuel cells",2024,"Nature …","nature.com","https://www.nature.com/articles/s41467-024-45060-1","https://scholar.google.com/scholar?cites=4223466243171219747&as_sdt=2005&sciodt=0,5&hl=en",741,"2025-05-05 22:27:38","HTML","","","",,,,,14,14.00,2,6,1,"… OH − diffusion in SZYO20, we performed DFT based ab initio molecular dynamics (AIMD) … This is consistent with the DFT calculations, which showed that the migration of OH − ions in …","https://www.nature.com/articles/s41467-024-45060-1","https://scholar.google.com/scholar?q=related:I_kS2SvEnDoJ:scholar.google.com/&scioq=source:nature+migratory+insertion+dft&hl=en&as_sdt=0,5&as_vis=1"
15,"AM Goryaeva, C Domain, A Chartier…","Compact A15 Frank-Kasper nano-phases at the origin of dislocation loops in face-centred cubic metals",2023,"Nature …","nature.com","https://www.nature.com/articles/s41467-023-38729-6","https://scholar.google.com/scholar?cites=52415245098718470&as_sdt=2005&sciodt=0,5&hl=en",742,"2025-05-05 22:27:38","HTML","","","",,,,,15,7.50,4,4,2,"… In this section, by means of DFT calculations, we determine the relative stability of the A15 clusters with respect to the conventional 2D SIA loops and describe their formation mechanism…","https://www.nature.com/articles/s41467-023-38729-6","https://scholar.google.com/scholar?q=related:BpXsQGM3ugAJ:scholar.google.com/&scioq=source:nature+migratory+insertion+dft&hl=en&as_sdt=0,5&as_vis=1"
5,"R Johnson","Converting the biomasses",2013,"Nature Chemistry","nature.com","https://www.nature.com/articles/nchem.1544","https://scholar.google.com/scholar?cites=4316431700915496563&as_sdt=2005&sciodt=0,5&hl=en",743,"2025-05-05 22:27:38","","","","",,,,,5,0.42,5,1,12,"… Using ab initio and density functional theory calculations, Radom, Karton and colleagues … They explore the potential energy surface for the shift reaction and see that the migration …","https://www.nature.com/articles/nchem.1544.pdf","https://scholar.google.com/scholar?q=related:c6ZNNsML5zsJ:scholar.google.com/&scioq=source:nature+migratory+insertion+dft&hl=en&as_sdt=0,5&as_vis=1"
2,"S Bajo, E Soto, M Fernández-Buenestado…","A low-coordinate platinum (0)-germylene for E–H bond activation and catalytic hydrodehalogenation",2024,"Nature …","nature.com","https://www.nature.com/articles/s41467-024-53940-9","https://scholar.google.com/scholar?cites=14136886663132258304&as_sdt=2005&sciodt=0,5&hl=en",744,"2025-05-05 22:27:38","HTML","","","",,,,,2,2.00,1,4,1,"… Then, we conducted DFT calculations on the chemical system comprising 2t, neopentyl bromide (NpBr) as the substrate, and HMDS - as the base (see Fig. S57 for details). Our studies …","https://www.nature.com/articles/s41467-024-53940-9","https://scholar.google.com/scholar?q=related:AKD0CYVPMMQJ:scholar.google.com/&scioq=source:nature+migratory+insertion+dft&hl=en&as_sdt=0,5&as_vis=1"
89,"SA Ok, B Jo, S Somasundaram, HJ Woo…","Management of transition dipoles in organic hole-transporting materials under solar irradiation for perovskite solar cells",2018,"Nature …","nature.com","https://www.nature.com/articles/s41467-018-06998-1","https://scholar.google.com/scholar?cites=14599620770002797146&as_sdt=2005&sciodt=0,5&hl=en",745,"2025-05-05 22:27:38","HTML","","","",,,,,89,12.71,18,5,7,"… The dipole moments of the designed molecules including their energy levels and frontier orbital distributions were calculated using the density functional theory (DFT) method with the …","https://www.nature.com/articles/s41467-018-06998-1","https://scholar.google.com/scholar?q=related:WoJu-7xFnMoJ:scholar.google.com/&scioq=source:nature+migratory+insertion+dft&hl=en&as_sdt=0,5&as_vis=1"
11,"MI Abdullah, Y Fang, X Wu, M Hu, J Shao…","Tackling activity-stability paradox of reconstructed NiIrOx electrocatalysts by bridged WO moiety",2024,"Nature …","nature.com","https://www.nature.com/articles/s41467-024-54987-4","https://scholar.google.com/scholar?cites=12816431880905629705&as_sdt=2005&sciodt=0,5&hl=en",746,"2025-05-05 22:27:38","HTML","","","",,,,,11,11.00,2,6,1,"… Density functional theory (DFT) calculation is performed to elucidate the catalytic … focus of DFT calculations is not on surface construction or amorphization. For the models used for DFT …","https://www.nature.com/articles/s41467-024-54987-4","https://scholar.google.com/scholar?q=related:CSBfLeQc3bEJ:scholar.google.com/&scioq=source:nature+migratory+insertion+dft&hl=en&as_sdt=0,5&as_vis=1"
18,"H Wang, S Wang, S Liu, Y Dai, Z Jia, X Li, S Liu…","Redox-induced controllable engineering of MnO2-MnxCo3-xO4 interface to boost catalytic oxidation of ethane",2024,"Nature …","nature.com","https://www.nature.com/articles/s41467-024-48120-8","https://scholar.google.com/scholar?cites=17674894416299152090&as_sdt=2005&sciodt=0,5&hl=en",747,"2025-05-05 22:27:38","HTML","","","",,,,,18,18.00,2,8,1,"… All calculations performed in this work were within the framework of Density Functional Theory (DFT) by using the Vienna Ab initio simulation program (VASP) 6.1.0. The projector-…","https://www.nature.com/articles/s41467-024-48120-8","https://scholar.google.com/scholar?q=related:2tILdtPWSfUJ:scholar.google.com/&scioq=source:nature+migratory+insertion+dft&hl=en&as_sdt=0,5&as_vis=1"
175,"R Chen, J Wang, Z Liu, F Ren, S Liu, J Zhou, H Wang…","Reduction of bulk and surface defects in inverted methylammonium-and bromide-free formamidinium perovskite solar cells",2023,"Nature Energy","nature.com","https://www.nature.com/articles/s41560-023-01288-7","https://scholar.google.com/scholar?cites=17084916006813903683&as_sdt=2005&sciodt=0,5&hl=en",748,"2025-05-05 22:27:38","","","","",,,,,175,87.50,22,8,2,"… Based on the molecular structures of NMP, DBSO and PbI 2 octahedral, we used density functional theory (DFT) to calculate the interaction energy between PbI 2 and the two …","","https://scholar.google.com/scholar?q=related:QyuHo5bQGe0J:scholar.google.com/&scioq=source:nature+migratory+insertion+dft&hl=en&as_sdt=0,5&as_vis=1"
5,"F Chen, CW Bai, PJ Duan, ZQ Zhang, YJ Sun…","Merging semi-crystallization and multispecies iodine intercalation at photo-redox interfaces for dual high-value synthesis",2024,"Nature …","nature.com","https://www.nature.com/articles/s41467-024-52158-z","https://scholar.google.com/scholar?cites=9845932091668771588&as_sdt=2005&sciodt=0,5&hl=en",749,"2025-05-05 22:27:38","HTML","","","",,,,,5,5.00,1,6,1,"… The I - /I 3 - redox mediators significantly boost charge migration and continuous electron and … We conducted density functional theory (DFT) calculations within the generalized gradient …","https://www.nature.com/articles/s41467-024-52158-z","https://scholar.google.com/scholar?q=related:BDOJRhLHo4gJ:scholar.google.com/&scioq=source:nature+migratory+insertion+dft&hl=en&as_sdt=0,5&as_vis=1"
85,"YC Wang, W Zhang, LY Wang, Z Zhuang, E Ma…","In situ TEM study of deformation-induced crystalline-to-amorphous transition in silicon",2016,"NPG Asia …","nature.com","https://www.nature.com/articles/am201692","https://scholar.google.com/scholar?cites=10007365939548269470&as_sdt=2005&sciodt=0,5&hl=en",750,"2025-05-05 22:27:38","HTML","","","",,,,,85,9.44,14,6,9,"… By employing density functional theory simulations, we find that energetically unfavorable single-layer SFs create very strong antibonding interactions, which trigger the subsequent …","https://www.nature.com/articles/am201692","https://scholar.google.com/scholar?q=related:nise_ExO4YoJ:scholar.google.com/&scioq=source:nature+migratory+insertion+dft&hl=en&as_sdt=0,5&as_vis=1"
59,"Y Xu, Y Wen, R Grote, J Amoroso, L Shuller Nickles…","A-site compositional effects in Ga-doped hollandite materials of the form BaxCsyGa2x+yTi8−2x−yO16: implications for Cs immobilization in crystalline …",2016,"Scientific reports","nature.com","https://www.nature.com/articles/srep27412","https://scholar.google.com/scholar?cites=12603650941476793971&as_sdt=2005&sciodt=0,5&hl=en",751,"2025-05-05 22:27:38","HTML","","","",,,,,59,6.56,10,6,9,"… cost for density functional theory (DFT) calculations. The detailed design methodology is described in experimental section. In addition, a baseline hollandite composition Ba1.…","https://www.nature.com/articles/srep27412","https://scholar.google.com/scholar?q=related:c-69F8Ep6a4J:scholar.google.com/&scioq=source:nature+migratory+insertion+dft&hl=en&as_sdt=0,5&as_vis=1"
2,"J Tang, D Guan, H Xu, L Zhao, U Arshad…","Undoped ruthenium oxide as a stable catalyst for the acidic oxygen evolution reaction",2025,"Nature …","nature.com","https://www.nature.com/articles/s41467-025-56188-z","https://scholar.google.com/scholar?cites=6152343294121920662&as_sdt=2005&sciodt=0,5&hl=en",752,"2025-05-05 22:27:38","HTML","","","",,,,,2,2.00,0,6,1,"… Density functional theory (DFT) calculations were conducted to provide a side support of the … We recognize that selecting an appropriate model for DFT theoretical calculations to …","https://www.nature.com/articles/s41467-025-56188-z","https://scholar.google.com/scholar?q=related:lshkJqGDYVUJ:scholar.google.com/&scioq=source:nature+migratory+insertion+dft&hl=en&as_sdt=0,5&as_vis=1"
