Cites,Authors,Title,Year,Source,Publisher,ArticleURL,CitesURL,GSRank,QueryDate,Type,DOI,ISSN,CitationURL,Volume,Issue,StartPage,EndPage,ECC,CitesPerYear,CitesPerAuthor,AuthorCount,Age,Abstract,FullTextURL,RelatedURL
113,"J Yin, J Jin, Z Yin, L Zhu, X Du, Y Peng, P Xi…","The built-in electric field across FeN/Fe3N interface for efficient electrochemical reduction of CO2 to CO",2023,"Nature …","nature.com","https://www.nature.com/articles/s41467-023-37360-9","https://scholar.google.com/scholar?cites=8133563319548358822&as_sdt=2005&sciodt=0,5&hl=en",493,"2025-05-05 22:27:38","HTML","","","",,,,,113,56.50,14,8,2,"… We used the density functional theory (DFT) to further investigate the FeN/Fe 3 N structure (Fig. 1f–k). The (100) planes of FeN (pink) (interplanar distance 4.230 Å) and (001) planes of …","https://www.nature.com/articles/s41467-023-37360-9","https://scholar.google.com/scholar?q=related:prDT47444HAJ:scholar.google.com/&scioq=source:nature+migratory+insertion+dft&hl=en&as_sdt=0,5&as_vis=1"
77,"A Gao, Q Zhang, X Li, T Shang, Z Tang, X Lu…","Topologically protected oxygen redox in a layered manganese oxide cathode for sustainable batteries",2022,"Nature …","nature.com","https://www.nature.com/articles/s41893-021-00809-0","https://scholar.google.com/scholar?cites=14334360382225586082&as_sdt=2005&sciodt=0,5&hl=en",494,"2025-05-05 22:27:38","","","","",,,,,77,25.67,11,7,3,"… 2g) and a small number of -α-β- stacks, which was also consistent with the results of DFT calculations. The slight stacking fault was confirmed in our previous work 19 . The Na-ion …","https://hal.science/hal-03659118v1/file/2022-046.pdf","https://scholar.google.com/scholar?q=related:ohf9KNLg7cYJ:scholar.google.com/&scioq=source:nature+migratory+insertion+dft&hl=en&as_sdt=0,5&as_vis=1"
9,"Q Chen, K Yang, M Liang, J Kang, X Yi, J Wang, J Li…","Lattice modulation strategies for 2D material assisted epitaxial growth",2023,"Nano …","Springer","https://link.springer.com/article/10.1186/s40580-023-00388-0","https://scholar.google.com/scholar?cites=14865047055441606023&as_sdt=2005&sciodt=0,5&hl=en",495,"2025-05-05 22:27:38","HTML","10.1186/s40580-023-00388-0","","",,,,,9,4.50,1,8,2,"… Density functional theory (DFT) calculations are first performed to investigate the … insertion of graphene could sufficiently decrease the migration barrier and promote the lateral migration …","https://link.springer.com/article/10.1186/s40580-023-00388-0","https://scholar.google.com/scholar?q=related:hzUQ3YlBS84J:scholar.google.com/&scioq=source:nature+migratory+insertion+dft&hl=en&as_sdt=0,5&as_vis=1"
46,"R Liu, Y Xing, J Liao, X Xia, C Wang, C Zhu…","Thermal-inert and ohmic-contact interface for high performance half-Heusler based thermoelectric generator",2022,"Nature …","nature.com","https://www.nature.com/articles/s41467-022-35290-6","https://scholar.google.com/scholar?cites=10451549733635760266&as_sdt=2005&sciodt=0,5&hl=en",496,"2025-05-05 22:27:38","HTML","","","",,,,,46,15.33,7,7,3,"… migration channel for Au in ZrNiSn is considered as from Ni site to neighboring Ni vacancy site, and the migration … We carried out the density functional theory (DFT) calculation using the …","https://www.nature.com/articles/s41467-022-35290-6","https://scholar.google.com/scholar?q=related:iiCwqRtdC5EJ:scholar.google.com/&scioq=source:nature+migratory+insertion+dft&hl=en&as_sdt=0,5&as_vis=1"
6,"Y Li, H Shi, G Yin","Synthetic techniques for thermodynamically disfavoured substituted six-membered rings",2024,"Nature Reviews Chemistry","nature.com","https://www.nature.com/articles/s41570-024-00612-3","https://scholar.google.com/scholar?cites=10944802049745212200&as_sdt=2005&sciodt=0,5&hl=en",497,"2025-05-05 22:27:38","","","","",,,,,6,6.00,2,3,1,"… The reaction pathway involves a cis-migratory insertion and a cis-reductive elimination, … This hypothesis finds support in density functional theory computations, which indicate that the …","","https://scholar.google.com/scholar?q=related:KNMH6Hm_45cJ:scholar.google.com/&scioq=source:nature+migratory+insertion+dft&hl=en&as_sdt=0,5&as_vis=1"
1275,"W Pan, H Wu, J Luo, Z Deng, C Ge, C Chen, X Jiang…","Cs2AgBiBr6 single-crystal X-ray detectors with a low detection limit",2017,"Nature …","nature.com","https://www.nature.com/articles/s41566-017-0012-4","https://scholar.google.com/scholar?cites=14580988015726128639&as_sdt=2005&sciodt=0,5&hl=en",498,"2025-05-05 22:27:38","","","","",,,,,1275,159.38,159,8,8,"… Only when the field-driven ionic migration was suppressed could we apply a large external … (VASP) 38 , which is based on density functional theory (DFT) with the projector-augmented-…","https://www.researchgate.net/profile/Deng-Zhenzhou/publication/320171224_Cs2AgBiBr6_single-crystal_X-ray_detectors_with_a_low_detection_limit/links/5bc9e6dd299bf17a1c5ff93c/Cs2AgBiBr6-single-crystal-X-ray-detectors-with-a-low-detection-limit.pdf","https://scholar.google.com/scholar?q=related:_22Vz1gTWsoJ:scholar.google.com/&scioq=source:nature+migratory+insertion+dft&hl=en&as_sdt=0,5&as_vis=1"
101,"TW Chamberlain, JC Meyer, J Biskupek, J Leschner…","Reactions of the inner surface of carbon nanotubes and nanoprotrusion processes imaged at the atomic scale",2011,"Nature …","nature.com","https://www.nature.com/articles/nchem.1115","https://scholar.google.com/scholar?cites=11182318519661789521&as_sdt=2005&sciodt=0,5&hl=en",499,"2025-05-05 22:27:38","","","","",,,,,101,7.21,20,5,14,"… Unrestricted B3LYP density functional theory (DFT) calculations showed that C 2 biradicals 2 do not react with the inner surface of SWNTs, as they have a binding energy in the end-on …","https://www.researchgate.net/profile/Elena-Besley/publication/51589170_Reactions_of_the_inner_surface_of_carbon_nanotubes_and_nanoprotrusion_processes_imaged_at_the_atomic_scale/links/0a85e534fa592392ea000000/Reactions-of-the-inner-surface-of-carbon-nanotubes-and-nanoprotrusion-processes-imaged-at-the-atomic-scale.pdf","https://scholar.google.com/scholar?q=related:UYG2eXKTL5sJ:scholar.google.com/&scioq=source:nature+migratory+insertion+dft&hl=en&as_sdt=0,5&as_vis=1"
228,"W Zuo, X Liu, J Qiu, D Zhang, Z Xiao, J Xie…","Engineering Na+-layer spacings to stabilize Mn-based layered cathodes for sodium-ion batteries",2021,"Nature …","nature.com","https://www.nature.com/articles/s41467-021-25074-9","https://scholar.google.com/scholar?cites=9476715065955308983&as_sdt=2005&sciodt=0,5&hl=en",500,"2025-05-05 22:27:38","HTML","","","",,,,,228,57.00,33,7,4,"… The major causes for such phase transformations include the migration of Tm ions that results … DFT+U method was adopted and the U eff of Mn 3d states were set to 4.9 eV. The Brillouin …","https://www.nature.com/articles/s41467-021-25074-9","https://scholar.google.com/scholar?q=related:t9XbhyQOhIMJ:scholar.google.com/&scioq=source:nature+migratory+insertion+dft&hl=en&as_sdt=0,5&as_vis=1"
0,"CW Bai, FQ Yang, PJ Duan, ZQ Zhang, YJ Sun…","Dynamic in-situ reconstruction of active site circulators for photo-Fenton-like reactions",2025,"Nature …","nature.com","https://www.nature.com/articles/s41467-025-58392-3","",501,"2025-05-05 22:27:38","HTML","","","",,,,,0,0.00,0,6,1,"… the interlayer insertion of K + and I − . Such enhancement could improve the migration and … gradient approximation framework for density functional theory (DFT) calculations 54 . A 2 × …","https://www.nature.com/articles/s41467-025-58392-3","https://scholar.google.com/scholar?q=related:UEl9TcRHhE8J:scholar.google.com/&scioq=source:nature+migratory+insertion+dft&hl=en&as_sdt=0,5&as_vis=1"
223,"WL Li, X Chen, T Jian, TT Chen, J Li…","From planar boron clusters to borophenes and metalloborophenes",2017,"Nature Reviews …","nature.com","https://www.nature.com/articles/s41570-017-0071","https://scholar.google.com/scholar?cites=170078573608581492&as_sdt=2005&sciodt=0,5&hl=en",502,"2025-05-05 22:27:38","","","","",,,,,223,27.88,37,6,8,"… The structures of a series of B n + cationic clusters for n = 12–25 were investigated using ion mobility experiments in combination with density functional theory (DFT) calculations 72 . …","https://www.researchgate.net/profile/Wan-Lu-Li/publication/320059916_From_planar_boron_clusters_to_borophenes_and_metalloborophenes/links/5b222c12458515270fc70946/From-planar-boron-clusters-to-borophenes-and-metalloborophenes.pdf","https://scholar.google.com/scholar?q=related:dDnYw489XAIJ:scholar.google.com/&scioq=source:nature+migratory+insertion+dft&hl=en&as_sdt=0,5&as_vis=1"
83,"C Yan, Z Guo, W Chi, W Fu, SAA Abedi, X Liu…","Fluorescence umpolung enables light-up sensing of N-acetyltransferases and nerve agents",2021,"Nature …","nature.com","https://www.nature.com/articles/s41467-021-24187-5","https://scholar.google.com/scholar?cites=9584850398898483672&as_sdt=2005&sciodt=0,5&hl=en",503,"2025-05-05 22:27:38","HTML","","","",,,,,83,20.75,12,7,4,"… As demonstrated, we show that the electron density perturbation of the insertion building block can lead to a mutational effect on intramolecular rotation driving energy (ΔE RDE ), …","https://www.nature.com/articles/s41467-021-24187-5","https://scholar.google.com/scholar?q=related:2PGas6c6BIUJ:scholar.google.com/&scioq=source:nature+migratory+insertion+dft&hl=en&as_sdt=0,5&as_vis=1"
117,"X Liu, GL Xu, VSC Kolluru, C Zhao, Q Li, X Zhou, Y Liu…","Origin and regulation of oxygen redox instability in high-voltage battery cathodes",2022,"Nature Energy","nature.com","https://www.nature.com/articles/s41560-022-01036-3","https://scholar.google.com/scholar?cites=7083405162574135490&as_sdt=2005&sciodt=0,5&hl=en",504,"2025-05-05 22:27:38","","","","",,,,,117,39.00,15,8,3,"… DFT calculations We performed DFT calculations on the tilt and twin DB structures. We used … DFT calculations are performed on both the fully lithiated and partially lithiated, tilt and twin …","https://escholarship.org/content/qt9v54808m/qt9v54808m.pdf","https://scholar.google.com/scholar?q=related:wkBmQ3dPTWIJ:scholar.google.com/&scioq=source:nature+migratory+insertion+dft&hl=en&as_sdt=0,5&as_vis=1"
268,"J Li, Z Zhang, L Wu, W Zhang, P Chen, Z Lin, G Liu","Site-specific allylic C–H bond functionalization with a copper-bound N-centred radical",2019,"Nature","nature.com","https://www.nature.com/articles/s41586-019-1655-8","https://scholar.google.com/scholar?cites=4294063547041050595&as_sdt=2005&sciodt=0,5&hl=en",505,"2025-05-05 22:27:38","","","","",,,,,268,44.67,38,7,6,"… Density functional theory calculations at the M06 level of theory were performed to gain more mechanistic insights. The reaction of (L1)Cu(i)(CN) with the N–F reagent 2e was first …","","https://scholar.google.com/scholar?q=related:4-9VjAuUlzsJ:scholar.google.com/&scioq=source:nature+migratory+insertion+dft&hl=en&as_sdt=0,5&as_vis=1"
79,"X Wang, H Zhang, T Baba, H Jiang, C Liu, Y Guan…","Radiation-induced segregation in a ceramic",2020,"Nature Materials","nature.com","https://www.nature.com/articles/s41563-020-0683-y","https://scholar.google.com/scholar?cites=9419373123156704951&as_sdt=2005&sciodt=0,5&hl=en",506,"2025-05-05 22:27:38","","","","",,,,,79,15.80,11,7,5,"… migration barrier of the carbon interstitial along the GB can be estimated. We applied DFT to … By plugging all these values into equation (10), we obtained the migration energy barrier for …","https://par.nsf.gov/servlets/purl/10190338","https://scholar.google.com/scholar?q=related:t_6dFPNVuIIJ:scholar.google.com/&scioq=source:nature+migratory+insertion+dft&hl=en&as_sdt=0,5&as_vis=1"
21,"Z Liu, Y Song, X Xiong, Y Zhang, J Cui, J Zhu…","Sintering-induced cation displacement in protonic ceramics and way for its suppression",2023,"Nature …","nature.com","https://www.nature.com/articles/s41467-023-43725-x","https://scholar.google.com/scholar?cites=10709661714009817464&as_sdt=2005&sciodt=0,5&hl=en",507,"2025-05-05 22:27:38","HTML","","","",,,,,21,10.50,3,7,2,"… Subsequently, we performed density functional theory (DFT) … Therefore, the DFT simulations further confirm that the lattice … To clarify Y 3+ displacement, DFT calculations have also been …","https://www.nature.com/articles/s41467-023-43725-x","https://scholar.google.com/scholar?q=related:eAEoMJZcoJQJ:scholar.google.com/&scioq=source:nature+migratory+insertion+dft&hl=en&as_sdt=0,5&as_vis=1"
206,"M Keener, C Hunt, TG Carroll, V Kampel…","Redox-switchable carboranes for uranium capture and release",2020,"Nature","nature.com","https://www.nature.com/articles/s41586-019-1926-4","https://scholar.google.com/scholar?cites=4250666409367921496&as_sdt=2005&sciodt=0,5&hl=en",508,"2025-05-05 22:27:38","","","","",,,,,206,41.20,41,5,5,"… Density functional theory (DFT) calculations further supported these observations. The electron density surfaces with integrated electrostatic potentials for 1 and 2a clearly indicate …","","https://scholar.google.com/scholar?q=related:WGMPDZRm_ToJ:scholar.google.com/&scioq=source:nature+migratory+insertion+dft&hl=en&as_sdt=0,5&as_vis=1"
17,"A VanderWeide, DE Prokopchuk","Cyclopentadienyl ring activation in organometallic chemistry and catalysis",2023,"Nature Reviews Chemistry","nature.com","https://www.nature.com/articles/s41570-023-00501-1","https://scholar.google.com/scholar?cites=7950059504509956064&as_sdt=2005&sciodt=0,5&hl=en",509,"2025-05-05 22:27:38","","","","",,,,,17,8.50,9,2,2,"… Compelling DFT calculations and electron paramagnetic resonance (EPR) experiments … DFT calculations further support this hypothesis by revealing that the calculated N–H bond …","https://par.nsf.gov/servlets/purl/10429224","https://scholar.google.com/scholar?q=related:4K-Ihf9IVG4J:scholar.google.com/&scioq=source:nature+migratory+insertion+dft&hl=en&as_sdt=0,5&as_vis=1"
16,"Y Zhang, Y Wang, Y Wu, X Shu, F Zhang…","Artificially controlled nanoscale chemical reduction in VO2 through electron beam illumination",2023,"Nature …","nature.com","https://www.nature.com/articles/s41467-023-39812-8","https://scholar.google.com/scholar?cites=13980540332955398404&as_sdt=2005&sciodt=0,5&hl=en",510,"2025-05-05 22:27:38","HTML","","","",,,,,16,8.00,3,6,2,"… transformation, we carried out density functional theory (DFT) calculations. We considered … We then calculated the migration barriers of the oxygen vacancies from surfaces toward the …","https://www.nature.com/articles/s41467-023-39812-8","https://scholar.google.com/scholar?q=related:BPHTWVzbBMIJ:scholar.google.com/&scioq=source:nature+migratory+insertion+dft&hl=en&as_sdt=0,5&as_vis=1"
22,"T Yang, K Zhang, Y Zuo, J Song, Y Yang, C Gao…","Ultrahigh-nickel layered cathode with cycling stability for sustainable lithium-ion batteries",2024,"Nature …","nature.com","https://www.nature.com/articles/s41893-024-01402-x","https://scholar.google.com/scholar?cites=2003101359748045627&as_sdt=2005&sciodt=0,5&hl=en",511,"2025-05-05 22:27:38","HTML","","","",,,,,22,22.00,3,7,1,"… Using density functional theory (DFT) computation, the ordered arranged Te cations manifest lower total energy than the randomly distributed model, as is shown in Supplementary Fig. …","https://www.nature.com/articles/s41893-024-01402-x","https://scholar.google.com/scholar?q=related:O1vi5BJyzBsJ:scholar.google.com/&scioq=source:nature+migratory+insertion+dft&hl=en&as_sdt=0,5&as_vis=1"
1383,"G Assat, JM Tarascon","Fundamental understanding and practical challenges of anionic redox activity in Li-ion batteries",2018,"Nature Energy","nature.com","https://www.nature.com/articles/s41560-018-0097-0","https://scholar.google.com/scholar?cites=12774036055622148541&as_sdt=2005&sciodt=0,5&hl=en",512,"2025-05-05 22:27:38","","","","",,,,,1383,197.57,692,2,7,"… Capturing such dynamic changes of the band structure requires further DFT development. … TEM and neutron diffraction experiments supported by DFT calculations. This discovery hence …","https://hal.science/hal-03315776/file/Fundamental%20understanding%20of%20anionic%20redox.pdf","https://scholar.google.com/scholar?q=related:veFj4xx-RrEJ:scholar.google.com/&scioq=source:nature+migratory+insertion+dft&hl=en&as_sdt=0,5&as_vis=1"
3,"K Elibol, T Susi, C Mangler, D Eder, JC Meyer…","Linear indium atom chains at graphene edges",2023,"npj 2D Materials and …","nature.com","https://www.nature.com/articles/s41699-023-00364-6","https://scholar.google.com/scholar?cites=16544519835925989096&as_sdt=2005&sciodt=0,5&hl=en",513,"2025-05-05 22:27:38","HTML","","","",,,,,3,1.50,1,6,2,"… during STEM induces migration of In atoms along the edges of the GNRs and triggers the formation of longer In atom chains during imaging. Density functional theory (DFT) calculations …","https://www.nature.com/articles/s41699-023-00364-6","https://scholar.google.com/scholar?q=related:6MbFVyLxmeUJ:scholar.google.com/&scioq=source:nature+migratory+insertion+dft&hl=en&as_sdt=0,5&as_vis=1"
60,"Q Hong, H Yang, Y Fang, W Li, C Zhu, Z Wang…","Adaptable graphitic C6N6-based copper single-atom catalyst for intelligent biosensing",2023,"Nature …","nature.com","https://www.nature.com/articles/s41467-023-38459-9","https://scholar.google.com/scholar?cites=10801850084770793685&as_sdt=2005&sciodt=0,5&hl=en",514,"2025-05-05 22:27:38","HTML","","","",,,,,60,30.00,9,7,2,"… further supported by density functional theory (DFT) calculations… The comprehensive experiments and DFT calculations … charge separation and migration, thus successfully inhibiting …","https://www.nature.com/articles/s41467-023-38459-9","https://scholar.google.com/scholar?q=related:1UjJ42vh55UJ:scholar.google.com/&scioq=source:nature+migratory+insertion+dft&hl=en&as_sdt=0,5&as_vis=1"
32,"Y Liu, R Zhang, L Lin, Y Wang, C Liu, R Mu…","Direct observation of accelerating hydrogen spillover via surface-lattice-confinement effect",2023,"Nature …","nature.com","https://www.nature.com/articles/s41467-023-36044-8","https://scholar.google.com/scholar?cites=15212130671598941497&as_sdt=2005&sciodt=0,5&hl=en",515,"2025-05-05 22:27:38","HTML","","","",,,,,32,16.00,5,7,2,"… 1 , depicts the dynamic migration of surface adsorbed hydrogen … In many cases, the migration of spilt hydrogen atoms is … Density functional theory (DFT) calculations demonstrate that …","https://www.nature.com/articles/s41467-023-36044-8","https://scholar.google.com/scholar?q=related:ObV6nT9YHNMJ:scholar.google.com/&scioq=source:nature+migratory+insertion+dft&hl=en&as_sdt=0,5&as_vis=1"
744,"W Auwärter, D Écija, F Klappenberger, JV Barth","Porphyrins at interfaces",2015,"Nature chemistry","nature.com","https://www.nature.com/articles/nchem.2159","https://scholar.google.com/scholar?cites=15299781961741178990&as_sdt=2005&sciodt=0,5&hl=en",516,"2025-05-05 22:27:38","","","","",,,,,744,74.40,186,4,10,"… of complex molecules with interfaces poses challenges for conclusive theoretical description, but careful computational modelling — frequently relying on density functional theory (DFT) …","","https://scholar.google.com/scholar?q=related:bhiD6qG-U9QJ:scholar.google.com/&scioq=source:nature+migratory+insertion+dft&hl=en&as_sdt=0,5&as_vis=1"
70,"P Prakash, B Fall, J Aguirre, LA Sonnenberg…","A soft co-crystalline solid electrolyte for lithium-ion batteries",2023,"Nature Materials","nature.com","https://www.nature.com/articles/s41563-023-01508-1","https://scholar.google.com/scholar?cites=11630213177336684033&as_sdt=2005&sciodt=0,5&hl=en",517,"2025-05-05 22:27:38","","","","",,,,,70,35.00,14,5,2,"… N peaks was validated using the density functional theory (DFT) calculations for a geometry … 2 LiPF 6 have an interstitial solvent-mediated migration of Li + ions, which we demonstrate is …","https://par.nsf.gov/servlets/purl/10488772","https://scholar.google.com/scholar?q=related:AV446UPRZqEJ:scholar.google.com/&scioq=source:nature+migratory+insertion+dft&hl=en&as_sdt=0,5&as_vis=1"
31,"K Sun, Y Huang, F Sun, Q Wang, Y Zhou, J Wang…","Dynamic structural twist in metal–organic frameworks enhances solar overall water splitting",2024,"Nature Chemistry","nature.com","https://www.nature.com/articles/s41557-024-01599-6","https://scholar.google.com/scholar?cites=4933933349684636979&as_sdt=2005&sciodt=0,5&hl=en",518,"2025-05-05 22:27:38","","","","",,,,,31,31.00,4,7,1,"… Based on density functional theory (DFT) calculations, the CBM and VBM of ground-state CFA-Zn are located on crystallographically independent linkers and do not overlap (Fig. 2a,b), …","https://mof.ustc.edu.cn/_upload/tpl/10/58/4184/template4184/fulltexts/232.pdf","https://scholar.google.com/scholar?q=related:M-1njT3aeEQJ:scholar.google.com/&scioq=source:nature+migratory+insertion+dft&hl=en&as_sdt=0,5&as_vis=1"
82,"Y Wang, Y Zhang, G Gao, Y Fan, R Wang, J Feng…","Effectively Modulating Oxygen Vacancies in Flower-Like δ-MnO2 Nanostructures for Large Capacity and High-Rate Zinc-Ion Storage",2023,"Nano-Micro Letters","Springer","https://link.springer.com/article/10.1007/s40820-023-01194-3","https://scholar.google.com/scholar?cites=10799220291477368650&as_sdt=2005&sciodt=0,5&hl=en",519,"2025-05-05 22:27:38","HTML","10.1007/s40820-023-01194-3","","",,,,,82,41.00,12,7,2,"… accelerating ion migration and reducing the stress induced by ions extraction and insertion [32,33,… the electrochemical performances, density functional theory (DFT) calculations were …","https://link.springer.com/article/10.1007/s40820-023-01194-3","https://scholar.google.com/scholar?q=related:Su-ybKOJ3pUJ:scholar.google.com/&scioq=source:nature+migratory+insertion+dft&hl=en&as_sdt=0,5&as_vis=1"
1,"C Sun, T Qi, FU Rahman, T Hayashi, J Ming","Ligand-controlled regiodivergent arylation of aryl (alkyl) alkynes and asymmetric synthesis of axially chiral 9-alkylidene-9, 10-dihydroanthracenes",2024,"Nature Communications","nature.com","https://www.nature.com/articles/s41467-024-53767-4","https://scholar.google.com/scholar?cites=47116069305988592&as_sdt=2005&sciodt=0,5&hl=en",520,"2025-05-05 22:27:38","HTML","","","",,,,,1,1.00,0,5,1,"… Density functional theory (DFT) calculations were performed to elucidate the … ,4-migration of Rh from intermediate B to C makes the location of rhodium ready for the cyclization. Insertion …","https://www.nature.com/articles/s41467-024-53767-4","https://scholar.google.com/scholar?q=related:8DUyvtBjpwAJ:scholar.google.com/&scioq=source:nature+migratory+insertion+dft&hl=en&as_sdt=0,5&as_vis=1"
65,"J Klein, T Pham, JD Thomsen, JB Curtis…","Control of structure and spin texture in the van der Waals layered magnet CrSBr",2022,"Nature …","nature.com","https://www.nature.com/articles/s41467-022-32737-8","https://scholar.google.com/scholar?cites=14328779095959795439&as_sdt=2005&sciodt=0,5&hl=en",521,"2025-05-05 22:27:38","HTML","","","",,,,,65,21.67,13,5,3,"… 1c, d) and our relaxed ab initio DFT crystallographic model. We find that the ratio between … Since Cr atom column intensities change throughout the video due to the Cr migration, we use …","https://www.nature.com/articles/s41467-022-32737-8","https://scholar.google.com/scholar?q=related:7_a5r6sM2sYJ:scholar.google.com/&scioq=source:nature+migratory+insertion+dft&hl=en&as_sdt=0,5&as_vis=1"
229,"Q Shi, R Qi, X Feng, J Wang, Y Li, Z Yao…","Niobium-doped layered cathode material for high-power and low-temperature sodium-ion batteries",2022,"Nature …","nature.com","https://www.nature.com/articles/s41467-022-30942-z","https://scholar.google.com/scholar?cites=1985047093003370216&as_sdt=2005&sciodt=0,5&hl=en",522,"2025-05-05 22:27:38","HTML","","","",,,,,229,76.33,33,7,3,"… Density functional theory calculations reveal the formation energies of Nb substitution for different atoms on both the bulk and surface (detailed information shown in Supplementary Fig. …","https://www.nature.com/articles/s41467-022-30942-z","https://scholar.google.com/scholar?q=related:6D7jWNBNjBsJ:scholar.google.com/&scioq=source:nature+migratory+insertion+dft&hl=en&as_sdt=0,5&as_vis=1"
539,"AD Jodlowski, C Roldán-Carmona, G Grancini…","Large guanidinium cation mixed with methylammonium in lead iodide perovskites for 19% efficient solar cells",2017,"Nature Energy","nature.com","https://www.nature.com/articles/s41560-017-0054-3","https://scholar.google.com/scholar?cites=4612821063118209703&as_sdt=2005&sciodt=0,5&hl=en",523,"2025-05-05 22:27:38","HTML","","","",,,,,539,67.38,135,4,8,"… The effect of the lattice expansion on the optoelectronic properties was also analysed by DFT–GGA calculations. The electronic band structures and density of states for MAPbI 3 and …","https://www.nature.com/articles/s41560-017-0054-3","https://scholar.google.com/scholar?q=related:p8KZL1EIBEAJ:scholar.google.com/&scioq=source:nature+migratory+insertion+dft&hl=en&as_sdt=0,5&as_vis=1"
11,"K Chen, Z Yu, SH Mousavi, R Singh, Q Gu…","Regulating adsorption performance of zeolites by pre-activation in electric fields",2023,"Nature …","nature.com","https://www.nature.com/articles/s41467-023-41227-4","https://scholar.google.com/scholar?cites=12490594330574437067&as_sdt=2005&sciodt=0,5&hl=en",524,"2025-05-05 22:27:38","HTML","","","",,,,,11,5.50,2,6,2,"… The periodic density functional theory (DFT) calculation was conducted using the Vienna ab initio Simulation Package (VASP) V5.0.4 . The initial crystal structure of r2KCHA was a …","https://www.nature.com/articles/s41467-023-41227-4","https://scholar.google.com/scholar?q=related:y7plm12BV60J:scholar.google.com/&scioq=source:nature+migratory+insertion+dft&hl=en&as_sdt=0,5&as_vis=1"
