Cites,Authors,Title,Year,Source,Publisher,ArticleURL,CitesURL,GSRank,QueryDate,Type,DOI,ISSN,CitationURL,Volume,Issue,StartPage,EndPage,ECC,CitesPerYear,CitesPerAuthor,AuthorCount,Age,Abstract,FullTextURL,RelatedURL
87,"J Peng, Y Liu, H Lv, Y Li, Y Lin, Y Su, J Wu, H Liu…","Stoichiometric two-dimensional non-van der Waals AgCrS2 with superionic behaviour at room temperature",2021,"Nature Chemistry","nature.com","https://www.nature.com/articles/s41557-021-00800-4","https://scholar.google.com/scholar?cites=14312120488768643656&as_sdt=2005&sciodt=0,5&hl=en",264,"2025-05-05 22:27:38","","","","",,,,,87,21.75,10,9,4,"… , we have compared the migration barriers of bulk and monolayer … on the basis of density functional theory (DFT) with the … DFT + D3 was used to describe the vdW interactions. The cut-…","","https://scholar.google.com/scholar?q=related:SCKlc8HdnsYJ:scholar.google.com/&scioq=source:nature+migratory+insertion+dft&hl=en&as_sdt=0,5&as_vis=1"
88,"L Guo, W Srimontree, C Zhu, B Maity, X Liu…","Nickel-catalyzed Suzuki–Miyaura cross-couplings of aldehydes",2019,"Nature …","nature.com","https://www.nature.com/articles/s41467-019-09766-x","https://scholar.google.com/scholar?cites=15790157343151792161&as_sdt=2005&sciodt=0,5&hl=en",265,"2025-05-05 22:27:38","HTML","","","",,,,,88,14.67,15,6,6,"… Nickel-catalyzed deformylative Suzuki–Miyaura cross coupling and related DFT studies on the role of trifluoroacetophenone. a Previously reported transition-metal-catalyzed …","https://www.nature.com/articles/s41467-019-09766-x","https://scholar.google.com/scholar?q=related:IaAWmnHoIdsJ:scholar.google.com/&scioq=source:nature+migratory+insertion+dft&hl=en&as_sdt=0,5&as_vis=1"
296,"P Canepa, SH Bo, G Sai Gautam, B Key…","High magnesium mobility in ternary spinel chalcogenides",2017,"Nature …","nature.com","https://www.nature.com/articles/s41467-017-01772-1","https://scholar.google.com/scholar?cites=988650503427409205&as_sdt=2005&sciodt=0,5&hl=en",266,"2025-05-05 22:27:38","HTML","","","",,,,,296,37.00,59,5,8,"… Mg and Zn migration barriers are assessed using the NEB 35 method in combination with DFT 60 , whereas approximating the exchange correlation with the Perdew–Burke–Ernzerhof …","https://www.nature.com/articles/s41467-017-01772-1","https://scholar.google.com/scholar?q=related:NUXND2VkuA0J:scholar.google.com/&scioq=source:nature+migratory+insertion+dft&hl=en&as_sdt=0,5&as_vis=1"
162,"Y Li, A Vasileiadis, Q Zhou, Y Lu, Q Meng, Y Li…","Origin of fast charging in hard carbon anodes",2024,"Nature Energy","nature.com","https://www.nature.com/articles/s41560-023-01414-5","https://scholar.google.com/scholar?cites=8667539667503932019&as_sdt=2005&sciodt=0,5&hl=en",267,"2025-05-05 22:27:38","","","","",,,,,162,162.00,23,7,1,"… Moreover, the DFT calculations indicate that there are 2–3 … the energy 46 , consistent with our DFT calculations. It is also … Further, we quantitatively show with DFT calculations how the …","https://www.iop.cas.cn/xwzx/kydt/202401/P020240126384022673600.pdf","https://scholar.google.com/scholar?q=related:c-ItrmdJSXgJ:scholar.google.com/&scioq=source:nature+migratory+insertion+dft&hl=en&as_sdt=0,5&as_vis=1"
0,"SQ Liu, W Xiong, JC Huang, X Jiang, W Xu…","Construction of planar chiral [2, 2] paracyclophanes via photoinduced cobalt-catalyzed desymmetric addition",2025,"Nature …","nature.com","https://www.nature.com/articles/s41467-025-59089-3","",268,"2025-05-05 22:27:38","HTML","","","",,,,,0,0.00,0,6,1,"… Subsequent migratory insertion into the remaining aldehyde group occurs, followed by … To further elucidate the origin of the stereoselectivity, we perform density functional theory (DFT) …","https://www.nature.com/articles/s41467-025-59089-3","https://scholar.google.com/scholar?q=related:g1ropfiODaMJ:scholar.google.com/&scioq=source:nature+migratory+insertion+dft&hl=en&as_sdt=0,5&as_vis=1"
102,"A Vattré, T Jourdan, H Ding, MC Marinica…","Non-random walk diffusion enhances the sink strength of semicoherent interfaces",2016,"Nature …","nature.com","https://www.nature.com/articles/ncomms10424","https://scholar.google.com/scholar?cites=5613701395023784689&as_sdt=2005&sciodt=0,5&hl=en",269,"2025-05-05 22:27:38","HTML","","","",,,,,102,11.33,20,5,9,"… We use density functional theory (DFT) to calculate P-tensors for two types of point defects in Ag and Cu (see Methods for details): vacancies and self-interstitials of lowest formation …","https://www.nature.com/articles/ncomms10424","https://scholar.google.com/scholar?q=related:8eqBFa3f500J:scholar.google.com/&scioq=source:nature+migratory+insertion+dft&hl=en&as_sdt=0,5&as_vis=1"
34,"S Sun, Z Han, W Liu, Q Xia, L Xue, X Lei, T Zhai…","Lattice pinning in MoO3 via coherent interface with stabilized Li+ intercalation",2023,"Nature …","nature.com","https://www.nature.com/articles/s41467-023-42335-x","https://scholar.google.com/scholar?cites=17180199982637815320&as_sdt=2005&sciodt=0,5&hl=en",270,"2025-05-05 22:27:38","HTML","","","",,,,,34,17.00,4,8,2,"… The density functional theory (DFT) calculations indicate the interface pinning can effectively improve the structural stability of α-MoO 3 and suppress Mo migration during charge/…","https://www.nature.com/articles/s41467-023-42335-x","https://scholar.google.com/scholar?q=related:GJZMD9xUbO4J:scholar.google.com/&scioq=source:nature+migratory+insertion+dft&hl=en&as_sdt=0,5&as_vis=1"
275,"FR Fortea-Pérez, M Mon, J Ferrando-Soria…","The MOF-driven synthesis of supported palladium clusters with catalytic activity for carbene-mediated chemistry",2017,"Nature Materials","nature.com","https://www.nature.com/articles/nmat4910","https://scholar.google.com/scholar?cites=4705469049418990183&as_sdt=2005&sciodt=0,5&hl=en",271,"2025-05-05 22:27:38","","","","",,,,,275,34.38,69,4,8,"… The nature of the Pd 4 –MOF compound 4 was established by the combination of a variety of techniques including: density functional theory calculations, inductively coupled plasma–…","https://iris.unical.it/retrieve/dc8b3535-469c-4b59-a1f2-6a388feebec7/Manuscript%202017%20-%20NATURE%20MATERIALS.pdf","https://scholar.google.com/scholar?q=related:Z8I2eCsvTUEJ:scholar.google.com/&scioq=source:nature+migratory+insertion+dft&hl=en&as_sdt=0,5&as_vis=1"
9,"J Zhang, M Rueping","Metallaphotoredox catalysis for sp3 C–H functionalizations through single-electron transfer",2024,"Nature Catalysis","nature.com","https://www.nature.com/articles/s41929-024-01215-3","https://scholar.google.com/scholar?cites=9068439431938326268&as_sdt=2005&sciodt=0,5&hl=en",272,"2025-05-05 22:27:38","","","","",,,,,9,9.00,5,2,1,"… A density functional theory investigation supports the plausibility of a Ni(0)/Ni(i)/Ni(iii) … Subsequently, dienes undergo migratory insertion into the Co(iii)–H species to yield Co(iii)–allyl …","","https://scholar.google.com/scholar?q=related:_D7U352R2X0J:scholar.google.com/&scioq=source:nature+migratory+insertion+dft&hl=en&as_sdt=0,5&as_vis=1"
29,"AV Kelleghan, AS Bulger, DC Witkowski, NK Garg","Strain-promoted reactions of 1, 2, 3-cyclohexatriene and its derivatives",2023,"Nature","nature.com","https://www.nature.com/articles/s41586-023-06075-8","https://scholar.google.com/scholar?cites=6762049399706292555&as_sdt=2005&sciodt=0,5&hl=en",273,"2025-05-05 22:27:38","","","","",,,,,29,14.50,7,4,2,"… We performed DFT studies to directly compare the geometric and electronic structures of 1,2,3-cyclohexatriene (5) with those of its isomer benzene (1) and its relative benzyne (20) (Fig. …","https://pmc.ncbi.nlm.nih.gov/articles/PMC10460091/pdf/nihms-1926229.pdf","https://scholar.google.com/scholar?q=related:SxEjJxqg110J:scholar.google.com/&scioq=source:nature+migratory+insertion+dft&hl=en&as_sdt=0,5&as_vis=1"
212,"WM Bloch, A Burgun, CJ Coghlan, R Lee, ML Coote…","Capturing snapshots of post-synthetic metallation chemistry in metal–organic frameworks",2014,"Nature …","nature.com","https://www.nature.com/articles/nchem.2045","https://scholar.google.com/scholar?cites=9699766070289092469&as_sdt=2005&sciodt=0,5&hl=en",274,"2025-05-05 22:27:38","","","","",,,,,212,19.27,35,6,11,"… insertion (methyl migration) reaction of one of the CO ligands into the newly formed Rh–Me bond. This migration … COMe)I]I, a density functional theory study of the reaction of a simplified …","https://www.researchgate.net/profile/Campbell-Coghlan-2/publication/266027073_Capturing_snapshots_of_post-synthetic_metallation_chemistry_in_metal-organic_frameworks/links/5435f1a30cf2bf1f1f2b5630/Capturing-snapshots-of-post-synthetic-metallation-chemistry-in-metal-organic-frameworks.pdf","https://scholar.google.com/scholar?q=related:dc_3b9l9nIYJ:scholar.google.com/&scioq=source:nature+migratory+insertion+dft&hl=en&as_sdt=0,5&as_vis=1"
94,"SC Ren, FL Zhang, AQ Xu, Y Yang, M Zheng…","Regioselective radical α-borylation of α, β-unsaturated carbonyl compounds for direct synthesis of α-borylcarbonyl molecules",2019,"Nature …","nature.com","https://www.nature.com/articles/s41467-019-09825-3","https://scholar.google.com/scholar?cites=9372441288784148132&as_sdt=2005&sciodt=0,5&hl=en",275,"2025-05-05 22:27:38","HTML","","","",,,,,94,15.67,16,6,6,"… 4, the Density Functional Theory (DFT) studies revealed that the energy barriers of α- and β-additions are comparable (+6.4 kcal mol −1 for α-addition and +7.7 kcal mol −1 for β-addition…","https://www.nature.com/articles/s41467-019-09825-3","https://scholar.google.com/scholar?q=related:pPYu4LGZEYIJ:scholar.google.com/&scioq=source:nature+migratory+insertion+dft&hl=en&as_sdt=0,5&as_vis=1"
31,"L Li, X Zhang, Y Ning, X Zhang, B Liu, Z Zhang…","Carbodefluorination of fluoroalkyl ketones via a carbene-initiated rearrangement strategy",2022,"Nature …","nature.com","https://www.nature.com/articles/s41467-022-31976-z","https://scholar.google.com/scholar?cites=3682405854720392637&as_sdt=2005&sciodt=0,5&hl=en",276,"2025-05-05 22:27:38","HTML","","","",,,,,31,10.33,4,7,3,"… The origin of chemoselectivity and the reaction mechanism are determined by experimental and DFT calculations. Collectively, this strategy by an intramolecular cascade process offers …","https://www.nature.com/articles/s41467-022-31976-z","https://scholar.google.com/scholar?q=related:vX1tWZ2IGjMJ:scholar.google.com/&scioq=source:nature+migratory+insertion+dft&hl=en&as_sdt=0,5&as_vis=1"
115,"S Han, P Wen, H Wang, Y Zhou, Y Gu, L Zhang…","Sequencing polymers to enable solid-state lithium batteries",2023,"Nature Materials","nature.com","https://www.nature.com/articles/s41563-023-01693-z","https://scholar.google.com/scholar?cites=3873917730744181638&as_sdt=2005&sciodt=0,5&hl=en",277,"2025-05-05 22:27:38","","","","",,,,,115,57.50,16,7,2,"… DFT calculations All DFT calculations conducted in this study were carried out using the Gaussian 16 suite of programmes. Detailed methods are given in section 3.3 of Supplementary …","","https://scholar.google.com/scholar?q=related:hiMYtqbrwjUJ:scholar.google.com/&scioq=source:nature+migratory+insertion+dft&hl=en&as_sdt=0,5&as_vis=1"
5,"LW Qi, T Rogge, KN Houk, Y Lu","Iridium nitrenoid-enabled arene C− H functionalization",2024,"Nature Catalysis","nature.com","https://www.nature.com/articles/s41929-024-01207-3","https://scholar.google.com/scholar?cites=14859780959679724852&as_sdt=2005&sciodt=0,5&hl=en",278,"2025-05-05 22:27:38","","","","",,,,,5,5.00,1,4,1,"… We also performed DFT calculations on the reaction of naphthyl azide 8a with β-naphthol (9a) in the presence of iridium complex Ir16 at the PBE0-D3(BJ)/def2-TZVP + SMD(TFE)//PBE0-…","","https://scholar.google.com/scholar?q=related:NL3SZQ2MOM4J:scholar.google.com/&scioq=source:nature+migratory+insertion+dft&hl=en&as_sdt=0,5&as_vis=1"
80,"Q Zhu, Z Pan, Z Zhao, G Cao, L Luo, C Ni…","Defect-driven selective metal oxidation at atomic scale",2021,"Nature …","nature.com","https://www.nature.com/articles/s41467-020-20876-9","https://scholar.google.com/scholar?cites=7658724585953713756&as_sdt=2005&sciodt=0,5&hl=en",279,"2025-05-05 22:27:38","HTML","","","",,,,,80,20.00,11,7,4,"… Here, our DFT-based calculations confirm that the higher … Our DFT calculations have predicted intrinsic TB and SF … We have also plotted the cumulative step migration at the reaction …","https://www.nature.com/articles/s41467-020-20876-9","https://scholar.google.com/scholar?q=related:XF5S6m5BSWoJ:scholar.google.com/&scioq=source:nature+migratory+insertion+dft&hl=en&as_sdt=0,5&as_vis=1"
6,"M Zhang, M Chapman, BR Sarode, B Xiong, H Liang…","Catalytic asymmetric synthesis of meta benzene isosteres",2024,"Nature","nature.com","https://www.nature.com/articles/s41586-024-07865-4","https://scholar.google.com/scholar?cites=3722714339754411344&as_sdt=2005&sciodt=0,5&hl=en",280,"2025-05-05 22:27:38","","","","",,,,,6,6.00,1,6,1,"… The density functional theory calculations were used to determine the free energy profile of … is lower in energy, with the olefin migratory insertion to give GS1a occurring by a much lower …","https://pmc.ncbi.nlm.nih.gov/articles/PMC11878547/","https://scholar.google.com/scholar?q=related:UIVQ3fe8qTMJ:scholar.google.com/&scioq=source:nature+migratory+insertion+dft&hl=en&as_sdt=0,5&as_vis=1"
110,"F Zuo, P Panda, M Kotiuga, J Li, M Kang…","Habituation based synaptic plasticity and organismic learning in a quantum perovskite",2017,"Nature …","nature.com","https://www.nature.com/articles/s41467-017-00248-6","https://scholar.google.com/scholar?cites=5557957670332014039&as_sdt=2005&sciodt=0,5&hl=en",281,"2025-05-05 22:27:38","HTML","","","",,,,,110,13.75,18,6,8,"… 7b); however, a detailed comparison requires including strong core-hole effects, which is beyond the scope of density functional theory (DFT). Thus, the fully doped case (1e − /Ni) …","https://www.nature.com/articles/s41467-017-00248-6","https://scholar.google.com/scholar?q=related:1x3MyA3VIU0J:scholar.google.com/&scioq=source:nature+migratory+insertion+dft&hl=en&as_sdt=0,5&as_vis=1"
41,"X Zhang, T Yan, H Hou, J Yin, H Wan, X Sun, Q Zhang…","Regioselective hydroformylation of propene catalysed by rhodium-zeolite",2024,"Nature","nature.com","https://www.nature.com/articles/s41586-024-07342-y","https://scholar.google.com/scholar?cites=18225942419445739248&as_sdt=2005&sciodt=0,5&hl=en",282,"2025-05-05 22:27:38","","","","",,,,,41,41.00,5,8,1,"… performed density functional theory (DFT) … insertion step proceeded through a three-centre transition state (TS(5/6)), accompanied by elongation of the Rh–propyl bond and migration of …","","https://scholar.google.com/scholar?q=related:8G7JtxCO7_wJ:scholar.google.com/&scioq=source:nature+migratory+insertion+dft&hl=en&as_sdt=0,5&as_vis=1"
1,"X Tan, Y Jing, J Wu, J Li, Z Yang, W Wu, Z Ke…","Palladium catalyzed ortho-C(sp2)–H activation/cyclization of aryl amines assisted by imine and vinylacetic acid",2024,"Nature …","nature.com","https://www.nature.com/articles/s41467-024-54018-2","https://scholar.google.com/scholar?cites=11348446617656379692&as_sdt=2005&sciodt=0,5&hl=en",283,"2025-05-05 22:27:38","HTML","","","",,,,,1,1.00,0,8,1,"… -insertion of the Pd−D species to generate the (Z)-alkene intermediate, leading to the migration of … After obtaining the experimental details of this reaction, density functional theory (DFT) …","https://www.nature.com/articles/s41467-024-54018-2","https://scholar.google.com/scholar?q=related:LEnkdRLIfZ0J:scholar.google.com/&scioq=source:nature+migratory+insertion+dft&hl=en&as_sdt=0,5&as_vis=1"
39,"H Han, Q Jacquet, Z Jiang, FN Sayed, JC Jeon…","Li iontronics in single-crystalline T-Nb2O5 thin films with vertical ionic transport channels",2023,"Nature Materials","nature.com","https://www.nature.com/articles/s41563-023-01612-2","https://scholar.google.com/scholar?cites=6281687921413295923&as_sdt=2005&sciodt=0,5&hl=en",284,"2025-05-05 22:27:38","HTML","","","",,,,,39,19.50,7,6,2,"… These vertical 2D channels enable fast Li-ion migration, which we show gives rise to a … and rationalized with the help of density functional theory (DFT) calculations. This understanding …","https://www.nature.com/articles/s41563-023-01612-2","https://scholar.google.com/scholar?q=related:M4-z-eEJLVcJ:scholar.google.com/&scioq=source:nature+migratory+insertion+dft&hl=en&as_sdt=0,5&as_vis=1"
32,"GA El-Nagar, MA Hassan, I Lauermann, C Roth","Efficient direct formic acid fuel cells (DFAFCs) anode derived from seafood waste: migration mechanism",2017,"Scientific reports","nature.com","https://www.nature.com/articles/s41598-017-17978-8","https://scholar.google.com/scholar?cites=3682112975553882792&as_sdt=2005&sciodt=0,5&hl=en",285,"2025-05-05 22:27:38","HTML","","","",,,,,32,4.00,8,4,8,"… The interaction of FA, CO and PtNPs with the chitosan matrix is modeled by a density functional theory (DFT) approach using Gaussian 09 suite of programs. All the structures were …","https://www.nature.com/articles/s41598-017-17978-8","https://scholar.google.com/scholar?q=related:qOq-Gj5-GTMJ:scholar.google.com/&scioq=source:nature+migratory+insertion+dft&hl=en&as_sdt=0,5&as_vis=1"
101,"Y Hu, D Dietrich, W Xu, A Patel, JAJ Thuss…","A carbonate-forming Baeyer-Villiger monooxygenase",2014,"Nature chemical …","nature.com","https://www.nature.com/articles/nchembio.1527","https://scholar.google.com/scholar?cites=6428113611200844664&as_sdt=2005&sciodt=0,5&hl=en",286,"2025-05-05 22:27:38","","","","",,,,,101,9.18,17,6,11,"… line with the rules of migratory aptitude. We propose that insertion of the second oxygen into … AP and KNH performed and interpreted the density functional theory calculations. All of the …","https://pmc.ncbi.nlm.nih.gov/articles/PMC4062580/pdf/nihms585726.pdf","https://scholar.google.com/scholar?q=related:eNN6k0U_NVkJ:scholar.google.com/&scioq=source:nature+migratory+insertion+dft&hl=en&as_sdt=0,5&as_vis=1"
43,"L Li, G Chen, H Zheng, W Meng, S Jia, L Zhao…","Room-temperature oxygen vacancy migration induced reversible phase transformation during the anelastic deformation in CuO",2021,"Nature …","nature.com","https://www.nature.com/articles/s41467-021-24155-z","https://scholar.google.com/scholar?cites=12150191903191498549&as_sdt=2005&sciodt=0,5&hl=en",287,"2025-05-05 22:27:38","HTML","","","",,,,,43,10.75,6,7,4,"… Here, we show the stress-induced reversible oxygen vacancy migration in CuO nanowires at room temperature, causing the unanticipated anelastic deformation. The anelastic strain is …","https://www.nature.com/articles/s41467-021-24155-z","https://scholar.google.com/scholar?q=related:NX-OViknnqgJ:scholar.google.com/&scioq=source:nature+migratory+insertion+dft&hl=en&as_sdt=0,5&as_vis=1"
46,"X Xiao, J Zhou, K Song, J Zhao, Y Zhou…","Layer number dependent ferroelasticity in 2D Ruddlesden–Popper organic-inorganic hybrid perovskites",2021,"Nature …","nature.com","https://www.nature.com/articles/s41467-021-21493-w","https://scholar.google.com/scholar?cites=13552136707637583684&as_sdt=2005&sciodt=0,5&hl=en",288,"2025-05-05 22:27:38","HTML","","","",,,,,46,11.50,8,6,4,"… , we perform first-principles density functional theory (DFT) calculations, as implemented in … Due to the intense computational cost in DFT calculations, here we focus on the BAI-N1 and …","https://www.nature.com/articles/s41467-021-21493-w","https://scholar.google.com/scholar?q=related:RB9FhojcErwJ:scholar.google.com/&scioq=source:nature+migratory+insertion+dft&hl=en&as_sdt=0,5&as_vis=1"
0,"P Brizuela, MT Quirós","Seeking selectivity in alkene couplings",2024,"Nature Catalysis","nature.com","https://www.nature.com/articles/s41929-024-01242-0","",289,"2025-05-05 22:27:38","","","","",,,,,0,0.00,0,2,1,"… Ni−H VI that undergoes an alkene migratory insertion, affording a new alkyl−Ni complex VII in … Density functional theory calculations confirm that the β-H elimination process in III is …","","https://scholar.google.com/scholar?q=related:Mwzvb-pI7MYJ:scholar.google.com/&scioq=source:nature+migratory+insertion+dft&hl=en&as_sdt=0,5&as_vis=1"
324,"D Li, F Xu, X Tang, S Dai, T Pu, X Liu, P Tian, F Xuan…","Induced activation of the commercial Cu/ZnO/Al2O3 catalyst for the steam reforming of methanol",2022,"Nature Catalysis","nature.com","https://www.nature.com/articles/s41929-021-00729-4","https://scholar.google.com/scholar?cites=14626378858194421920&as_sdt=2005&sciodt=0,5&hl=en",290,"2025-05-05 22:27:38","","","","",,,,,324,108.00,36,9,3,"… of in situ characterization studies and density functional theory (DFT) calculations. This work … Here, we propose a simplified alternative solution: to calculate the migration energy of the …","","https://scholar.google.com/scholar?q=related:oEj24BNW-8oJ:scholar.google.com/&scioq=source:nature+migratory+insertion+dft&hl=en&as_sdt=0,5&as_vis=1"
788,"X Wang, X Wang, J Huang, S Li, A Meng, Z Li","Interfacial chemical bond and internal electric field modulated Z-scheme Sv-ZnIn2S4/MoSe2 photocatalyst for efficient hydrogen evolution",2021,"Nature Communications","nature.com","https://www.nature.com/articles/s41467-021-24511-z","https://scholar.google.com/scholar?cites=1756423782914438294&as_sdt=2005&sciodt=0,5&hl=en",291,"2025-05-05 22:27:38","HTML","","","",,,,,788,197.00,131,6,4,"… Z-scheme charge transfer mechanism as confirmed by the surface photovoltage spectra, DMPO spin-trapping electron paramagnetic resonance spectra and density functional theory …","https://www.nature.com/articles/s41467-021-24511-z","https://scholar.google.com/scholar?q=related:lrSp5x8SYBgJ:scholar.google.com/&scioq=source:nature+migratory+insertion+dft&hl=en&as_sdt=0,5&as_vis=1"
20,"L Li, M Yang, Q He, R Fan","Conversion of anilines to chiral benzylic amines via formal one-carbon insertion into aromatic C–N bonds",2020,"Nature Communications","nature.com","https://www.nature.com/articles/s41467-020-18593-4","https://scholar.google.com/scholar?cites=12646432913877333536&as_sdt=2005&sciodt=0,5&hl=en",292,"2025-05-05 22:27:38","HTML","","","",,,,,20,4.00,5,4,5,"Insertion of atoms into aromatic carbon-nitrogen bonds is an appealing method for the synthesis of nitrogen-containing molecules and it has the advantage of the availability and …","https://www.nature.com/articles/s41467-020-18593-4","https://scholar.google.com/scholar?q=related:IHZ3Q7snga8J:scholar.google.com/&scioq=source:nature+migratory+insertion+dft&hl=en&as_sdt=0,5&as_vis=1"
16,"YB Chen, LG Liu, ZQ Wang, R Chang, X Lu…","Enantioselective functionalization of unactivated C(sp3)–H bonds through copper-catalyzed diyne cyclization by kinetic resolution",2024,"Nature …","nature.com","https://www.nature.com/articles/s41467-024-46288-7","https://scholar.google.com/scholar?cites=10977280110349850665&as_sdt=2005&sciodt=0,5&hl=en",293,"2025-05-05 22:27:38","HTML","","","",,,,,16,16.00,3,6,1,"… results, density functional theory (DFT) calculations have … [1,4]-H migration and demetallation process occurs to afford … height (subsequent H-migration and demetallation step is omitted …","https://www.nature.com/articles/s41467-024-46288-7","https://scholar.google.com/scholar?q=related:KRhdqRkiV5gJ:scholar.google.com/&scioq=source:nature+migratory+insertion+dft&hl=en&as_sdt=0,5&as_vis=1"
174,"I Ro, J Qi, S Lee, M Xu, X Yan, Z Xie, G Zakem…","Bifunctional hydroformylation on heterogeneous Rh-WOx pair site catalysts",2022,"Nature","nature.com","https://www.nature.com/articles/s41586-022-05075-4","https://scholar.google.com/scholar?cites=14654874156798519684&as_sdt=2005&sciodt=0,5&hl=en",294,"2025-05-05 22:27:38","","","","",,,,,174,58.00,22,8,3,"… The data and code necessary to build the DFT-based microkinetic model that supports the plots in this paper are available on Zenodo at https://doi.org/10.5281/zenodo.6525676. Any …","https://par.nsf.gov/servlets/purl/10405782","https://scholar.google.com/scholar?q=related:hCkHmGaSYMsJ:scholar.google.com/&scioq=source:nature+migratory+insertion+dft&hl=en&as_sdt=0,5&as_vis=1"
6,"L Yang, S Li, L Ning, H Zhao, L Zhou, W Cao…","Aza-[4+ 2]-cycloaddition of benzocyclobutenones into isoquinolinone derivatives enabled by photoinduced regio-specific C–C bond cleavage",2024,"Nature …","nature.com","https://www.nature.com/articles/s41467-024-55110-3","https://scholar.google.com/scholar?cites=10479783351260355341&as_sdt=2005&sciodt=0,5&hl=en",295,"2025-05-05 22:27:38","HTML","","","",,,,,6,6.00,1,7,1,"… DFT calculations revealed that the aryl-metallacycle intermediate is more … C1−C2 bond cleavage followed by diverse migratory insertion reactions to construct bridged and fused ring …","https://www.nature.com/articles/s41467-024-55110-3","https://scholar.google.com/scholar?q=related:DRvtBm-rb5EJ:scholar.google.com/&scioq=source:nature+migratory+insertion+dft&hl=en&as_sdt=0,5&as_vis=1"
204,"T Li, J Xu, R Lin, S Teale, H Li, Z Liu, C Duan, Q Zhao…","Inorganic wide-bandgap perovskite subcells with dipole bridge for all-perovskite tandems",2023,"Nature Energy","nature.com","https://www.nature.com/articles/s41560-023-01250-7","https://scholar.google.com/scholar?cites=17066641453211531655&as_sdt=2005&sciodt=0,5&hl=en",296,"2025-05-05 22:27:38","","","","",,,,,204,102.00,23,9,2,"… We carried out density functional theory (DFT) calculations to understand how the molecular … The DFT simulation results herein indicate that better surface passivation enabled by CF3-…","https://utoronto.scholaris.ca/bitstreams/60c4d7cf-d8af-487d-a806-450bdaf2db9d/download","https://scholar.google.com/scholar?q=related:hzmhj_rj2OwJ:scholar.google.com/&scioq=source:nature+migratory+insertion+dft&hl=en&as_sdt=0,5&as_vis=1"
