Cites,Authors,Title,Year,Source,Publisher,ArticleURL,CitesURL,GSRank,QueryDate,Type,DOI,ISSN,CitationURL,Volume,Issue,StartPage,EndPage,ECC,CitesPerYear,CitesPerAuthor,AuthorCount,Age,Abstract,FullTextURL,RelatedURL
57,"F Christoffel, NV Igareta, MM Pellizzoni…","Design and evolution of chimeric streptavidin for protein-enabled dual gold catalysis",2021,"Nature Catalysis","nature.com","https://www.nature.com/articles/s41929-021-00651-9","https://scholar.google.com/scholar?cites=11091640536392802678&as_sdt=2005&sciodt=0,5&hl=en",223,"2025-05-05 18:15:52","","","","",,,,,57,14.25,14,4,4,"… For this purpose, we applied the following workflow: (1) Density functional theory (DFT) calculations were carried out on the theozyme, the core catalytic centre (alkyne 1 coordinated to …","https://edoc.unibas.ch/84516/2/Final_Resub_HAMase_Main_final__with_Images_withBLozhkinAckno.pdf","https://scholar.google.com/scholar?q=related:diEERE1s7ZkJ:scholar.google.com/&scioq=source:%22nature+catalysis%22+cross+coupling+dft&hl=en&as_sdt=0,5&as_vis=1"
55,"T Yuan, L Sun, Z Wu, R Wang, X Cai, W Lin, M Zheng…","Mild and metal-free Birch-type hydrogenation of (hetero) arenes with boron carbonitride in water",2022,"Nature Catalysis","nature.com","https://www.nature.com/articles/s41929-022-00886-0","https://scholar.google.com/scholar?cites=13834779820911424475&as_sdt=2005&sciodt=0,5&hl=en",224,"2025-05-05 18:15:52","","","","",,,,,55,18.33,7,8,3,"… Density functional theory calculations revealed π–π stacking interactions between anthracene and BCN, and the proclivity of anthracene adsorption on the B−N−B site (Supplementary …","","https://scholar.google.com/scholar?q=related:2_Mqg_IC_78J:scholar.google.com/&scioq=source:%22nature+catalysis%22+cross+coupling+dft&hl=en&as_sdt=0,5&as_vis=1"
52,"ZM Zhang, T Wang, YC Cai, XY Li, JY Ye, Y Zhou…","Probing electrolyte effects on cation-enhanced CO2 reduction on copper in acidic media",2024,"Nature Catalysis","nature.com","https://www.nature.com/articles/s41929-024-01179-4","https://scholar.google.com/scholar?cites=14735634305277653343&as_sdt=2005&sciodt=0,5&hl=en",225,"2025-05-05 18:15:52","","","","",,,,,52,52.00,7,7,1,"… Besides, the vibration frequencies are also calculated by density functional theory (DFT), confirming that the asymmetry stretching of the CO 2 adsorbed on Cu via the carbon site is at …","https://www.researchgate.net/profile/Xiaoyu-Li-85/publication/381667600_Probing_electrolyte_effects_on_cation-enhanced_CO2_reduction_on_copper_in_acidic_media/links/6724697d5852dd723ca08fdf/Probing-electrolyte-effects-on-cation-enhanced-CO2-reduction-on-copper-in-acidic-media.pdf","https://scholar.google.com/scholar?q=related:X3Ei8lN9f8wJ:scholar.google.com/&scioq=source:%22nature+catalysis%22+cross+coupling+dft&hl=en&as_sdt=0,5&as_vis=1"
50,"S Wang, V Fung, MJ Hülsey, X Liang, Z Yu, J Chang…","H2-reduced phosphomolybdate promotes room-temperature aerobic oxidation of methane to methanol",2023,"Nature Catalysis","nature.com","https://www.nature.com/articles/s41929-023-01011-5","https://scholar.google.com/scholar?cites=6877686413553705476&as_sdt=2005&sciodt=0,5&hl=en",226,"2025-05-05 18:15:52","","","","",,,,,50,25.00,7,7,2,"… Density functional theory (DFT) calculations were performed to further verify the potential … The O–O bond length of the adsorbed species is also elongated from the DFT gas-phase …","https://orca.cardiff.ac.uk/id/eprint/162312/1/PP.pdf","https://scholar.google.com/scholar?q=related:BCJmhFpzcl8J:scholar.google.com/&scioq=source:%22nature+catalysis%22+cross+coupling+dft&hl=en&as_sdt=0,5&as_vis=1"
237,"P Zhu, H Wang","High-purity and high-concentration liquid fuels through CO2 electroreduction",2021,"Nature Catalysis","nature.com","https://www.nature.com/articles/s41929-021-00694-y","https://scholar.google.com/scholar?cites=2403712256334260021&as_sdt=2005&sciodt=0,5&hl=en",227,"2025-05-05 18:15:52","","","","",,,,,237,59.25,119,2,4,"… Previous density functional theory calculations and experimental studies have suggested that the interfacial pH can influence the product distribution considerably 41,42,43 . For …","https://par.nsf.gov/servlets/purl/10351385","https://scholar.google.com/scholar?q=related:NWcOzY-zWyEJ:scholar.google.com/&scioq=source:%22nature+catalysis%22+cross+coupling+dft&hl=en&as_sdt=0,5&as_vis=1"
99,"SM Jung, SW Yun, JH Kim, SH You, J Park, S Lee…","Selective electrocatalysis imparted by metal–insulator transition for durability enhancement of automotive fuel cells",2020,"Nature Catalysis","nature.com","https://www.nature.com/articles/s41929-020-0475-4","https://scholar.google.com/scholar?cites=14202580601857709632&as_sdt=2005&sciodt=0,5&hl=en",228,"2025-05-05 18:15:52","","","","",,,,,99,19.80,14,7,5,"… density functional theory (DFT) calculations of the resulting band structures; the bulk structure of H x WO 3 (x = 0, 0.1) from DFT … These DFT results verify that proton intercalation is the …","","https://scholar.google.com/scholar?q=related:QBaVE8-zGcUJ:scholar.google.com/&scioq=source:%22nature+catalysis%22+cross+coupling+dft&hl=en&as_sdt=0,5&as_vis=1"
127,"AR Rosales, J Wahlers, E Limé, RE Meadows…","Rapid virtual screening of enantioselective catalysts using CatVS",2019,"Nature Catalysis","nature.com","https://www.nature.com/articles/s41929-018-0193-3","https://scholar.google.com/scholar?cites=11195938008512938713&as_sdt=2005&sciodt=0,5&hl=en",229,"2025-05-05 18:15:52","","","","",,,,,127,21.17,25,5,6,"… generates small libraries of transition states of ligand analogues that are, after limited conformational search at the semiempirical level, fully optimized using density functional theory to …","","https://scholar.google.com/scholar?q=related:2UK11Ez2X5sJ:scholar.google.com/&scioq=source:%22nature+catalysis%22+cross+coupling+dft&hl=en&as_sdt=0,5&as_vis=1"
0,"JS Völler","Gilding σ-type cyclopropenium cations",2024,"Nature Catalysis","nature.com","https://www.nature.com/articles/s41929-024-01183-8","",230,"2025-05-05 18:15:52","","","","",,,,,0,0.00,0,1,1,"… Based on experimental studies and density functional theory calculations, the researchers proposed a catalytic cycle involving a gold (III)–cyclopropenyl intermediate whose existence …","","https://scholar.google.com/scholar?q=related:skZEB1vPj2MJ:scholar.google.com/&scioq=source:%22nature+catalysis%22+cross+coupling+dft&hl=en&as_sdt=0,5&as_vis=1"
30,"B Peng, Z Liu, L Sementa, Q Jia, Q Sun, CU Segre…","Embedded oxide clusters stabilize sub-2 nm Pt nanoparticles for highly durable fuel cells",2024,"Nature Catalysis","nature.com","https://www.nature.com/articles/s41929-024-01180-x","https://scholar.google.com/scholar?cites=12405461064872982161&as_sdt=2005&sciodt=0,5&hl=en",231,"2025-05-05 18:15:52","","","","",,,,,30,30.00,4,7,1,"… In addition, we characterized the MEA cross-section after the AST and evaluated the Pt loss to the Pt band as a result of redeposition of the dissolved Pt at the membrane interface 46 . …","","https://scholar.google.com/scholar?q=related:kXaxjhwNKawJ:scholar.google.com/&scioq=source:%22nature+catalysis%22+cross+coupling+dft&hl=en&as_sdt=0,5&as_vis=1"
15,"R Wan, T Yuan, L Wang, B Li, M Liu, B Zhao","Earth-abundant electrocatalysts for acidic oxygen evolution",2024,"Nature Catalysis","nature.com","https://www.nature.com/articles/s41929-024-01266-6","https://scholar.google.com/scholar?cites=3439275190404233161&as_sdt=2005&sciodt=0,5&hl=en",232,"2025-05-05 18:15:52","","","","",,,,,15,15.00,3,6,1,"… Figure 4 shows Pourbaix diagrams that are based on the formation energies (predicted using density functional theory (DFT)) of solvated and solid species associated with different …","","https://scholar.google.com/scholar?q=related:ybfbSJDCui8J:scholar.google.com/&scioq=source:%22nature+catalysis%22+cross+coupling+dft&hl=en&as_sdt=0,5&as_vis=1"
83,"H Zhang, L Osmieri, JH Park, HT Chung, DA Cullen…","Standardized protocols for evaluating platinum group metal-free oxygen reduction reaction electrocatalysts in polymer electrolyte fuel cells",2022,"… catalysis","nature.com","https://www.nature.com/articles/s41929-022-00778-3","https://scholar.google.com/scholar?cites=1436545042834687060&as_sdt=2005&sciodt=0,5&hl=en",233,"2025-05-05 18:15:52","","","","",,,,,83,27.67,14,6,3,"… This approach—consistent with the strategies developed to minimize voltage excursions above OCV during the cell start-up and shut-down—was also used during the cross-laboratory …","https://www.osti.gov/servlets/purl/1875343","https://scholar.google.com/scholar?q=related:VIQC9hqi7xMJ:scholar.google.com/&scioq=source:%22nature+catalysis%22+cross+coupling+dft&hl=en&as_sdt=0,5&as_vis=1"
290,"Y Lum, JW Ager","Evidence for product-specific active sites on oxide-derived Cu catalysts for electrochemical CO2 reduction",2019,"Nature Catalysis","nature.com","https://www.nature.com/articles/s41929-018-0201-7","https://scholar.google.com/scholar?cites=16468788895826757867&as_sdt=2005&sciodt=0,5&hl=en",234,"2025-05-05 18:15:52","","","","",,,,,290,48.33,145,2,6,"… Here, by reducing mixtures of 13 CO and 12 CO 2 , we show that oxide-derived Cu catalysts have three different types of active sites for C–C coupled products, one that produces …","https://escholarship.org/content/qt5nq0v65q/qt5nq0v65q_noSplash_316c09ff0380fef7bffc3328acf51d2e.pdf","https://scholar.google.com/scholar?q=related:68im0D7kjOQJ:scholar.google.com/&scioq=source:%22nature+catalysis%22+cross+coupling+dft&hl=en&as_sdt=0,5&as_vis=1"
85,"J Becher, DF Sanchez, DE Doronkin, D Zengel…","Chemical gradients in automotive Cu-SSZ-13 catalysts for NOx removal revealed by operando X-ray spectrotomography",2021,"Nature Catalysis","nature.com","https://www.nature.com/articles/s41929-020-00552-3","https://scholar.google.com/scholar?cites=17379714341169387832&as_sdt=2005&sciodt=0,5&hl=en",235,"2025-05-05 18:15:52","","","","",,,,,85,21.25,17,5,4,"… X-ray computed tomography can be coupled with various contrasts such as X-ray absorption, fluorescence or diffraction, producing highly spatially resolved chemical data that are …","https://www.dora.lib4ri.ch/psi/islandora/object/psi%3A35282/datastream/PDF2/Becher-2021-Chemical_gradients_in_automotive_Cu-SSZ-13-%28accepted_version%29.pdf","https://scholar.google.com/scholar?q=related:ONkpkxwmMfEJ:scholar.google.com/&scioq=source:%22nature+catalysis%22+cross+coupling+dft&hl=en&as_sdt=0,5&as_vis=1"
0,"J Wang, K Liu, W Liao, Y Kang, H Xiao, Y Chen…","Metal vacancies in semiconductor oxides enhance hole mobility for efficient photoelectrochemical water splitting",2025,"Nature Catalysis","nature.com","https://www.nature.com/articles/s41929-025-01300-1","",236,"2025-05-05 18:15:52","","","","",,,,,0,0.00,0,7,1,"… Our DFT calculations elucidate that the presence of V M induces a bending effect in top VBs, reducing the effective mass of holes accordingly. As a direct consequence, we observe a …","","https://scholar.google.com/scholar?q=related:c2i31Bx2pb4J:scholar.google.com/&scioq=source:%22nature+catalysis%22+cross+coupling+dft&hl=en&as_sdt=0,5&as_vis=1"
0,"X Shi, Y Jiang, B Zeng, Z Sun, M Yun, P Lv, Y Jia…","In situ electrochemical production of solid peroxide from urine",2025,"Nature Catalysis","nature.com","https://www.nature.com/articles/s41929-024-01277-3","",237,"2025-05-05 18:15:52","","","","",,,,,0,0.00,0,8,1,"… functional 55 based on the density functional theory (DFT) implemented in the Vienna ab … der Waals (vdW) correction proposed by Grimme (DFT + D3) was chosen 58 . A vacuum layer …","","https://scholar.google.com/scholar?q=related:lb6IPVKetvsJ:scholar.google.com/&scioq=source:%22nature+catalysis%22+cross+coupling+dft&hl=en&as_sdt=0,5&as_vis=1"
19,"BJ Bloomer, SN Natoli, M Garcia-Borràs, JH Pereira…","Mechanistic and structural characterization of an iridium-containing cytochrome reveals kinetically relevant cofactor dynamics",2023,"Nature Catalysis","nature.com","https://www.nature.com/articles/s41929-022-00899-9","https://scholar.google.com/scholar?cites=14933383479534057337&as_sdt=2005&sciodt=0,5&hl=en",238,"2025-05-05 18:15:52","","","","",,,,,19,9.50,4,5,2,"… We first performed density functional theory (DFT) calculations with the parent Ir–porphine … DFT calculations of the reaction catalysed by the Ir–porphine were conducted to describe …","","https://scholar.google.com/scholar?q=related:eXdQeCcJPs8J:scholar.google.com/&scioq=source:%22nature+catalysis%22+cross+coupling+dft&hl=en&as_sdt=0,5&as_vis=1"
89,"B Böller, KM Durner, J Wintterlin","The active sites of a working Fischer–Tropsch catalyst revealed by operando scanning tunnelling microscopy",2019,"Nature Catalysis","nature.com","https://www.nature.com/articles/s41929-019-0360-1","https://scholar.google.com/scholar?cites=10612154823403668376&as_sdt=2005&sciodt=0,5&hl=en",239,"2025-05-05 18:15:52","","","","",,,,,89,14.83,30,3,6,"Direct identification of the active sites of a working catalyst is still a major problem in heterogeneous catalysis. Here we present an operando scanning tunnelling microscopy study, in …","","https://scholar.google.com/scholar?q=related:mINsFpbyRZMJ:scholar.google.com/&scioq=source:%22nature+catalysis%22+cross+coupling+dft&hl=en&as_sdt=0,5&as_vis=1"
0,"B Martindale","Core strength",2022,"Nature Catalysis","nature.com","https://www.nature.com/articles/s41929-022-00866-4","",240,"2025-05-05 18:15:52","","","","",,,,,0,0.00,0,1,3,"… Notably, the net 13 C hyperfine coupling measured is near-zero in all cases, and seemingly invariant to the environment. Density functional theory (DFT) calculations indicate that the …","","https://scholar.google.com/scholar?q=related:EvedE0MyQvAJ:scholar.google.com/&scioq=source:%22nature+catalysis%22+cross+coupling+dft&hl=en&as_sdt=0,5&as_vis=1"
134,"H Liu, J Xia, N Zhang, H Cheng, W Bi, X Zu, W Chu…","Solid–liquid phase transition induced electrocatalytic switching from hydrogen evolution to highly selective CO2 reduction",2021,"Nature Catalysis","nature.com","https://www.nature.com/articles/s41929-021-00576-3","https://scholar.google.com/scholar?cites=7196582704229207628&as_sdt=2005&sciodt=0,5&hl=en",241,"2025-05-05 18:15:52","","","","",,,,,134,33.50,17,8,4,"… According to previous density functional theory calculations and XPS studies 36,37 , we conclude that the valence band of Ga–Sn is mainly composed of Sn 5p, Sn 4d, Sn 5s, Ga 4p and …","","https://scholar.google.com/scholar?q=related:TE5NItdl32MJ:scholar.google.com/&scioq=source:%22nature+catalysis%22+cross+coupling+dft&hl=en&as_sdt=0,5&as_vis=1"
256,"Y Guo, M Wang, Q Zhu, D Xiao, D Ma","Ensemble effect for single-atom, small cluster and nanoparticle catalysts",2022,"Nature Catalysis","nature.com","https://www.nature.com/articles/s41929-022-00839-7","https://scholar.google.com/scholar?cites=9681350395502250755&as_sdt=2005&sciodt=0,5&hl=en",242,"2025-05-05 18:15:52","","","","",,,,,256,85.33,51,5,3,"… in the oxidative coupling of toluene (Fig. 3m), in which the functional acetate ligand is proposed to assist the hydrogen-transfer step from the C–C coupled cyclohexadienyl adduct to the …","https://www.researchgate.net/profile/Dequan-Xiao/publication/363706574_Ensemble_effect_for_single-atom_small_cluster_and_nanoparticle_catalysts/links/6333126713096c2907d42b09/Ensemble-effect-for-single-atom-small-cluster-and-nanoparticle-catalysts.pdf?_sg%5B0%5D=started_experiment_milestone&_sg%5B1%5D=started_experiment_milestone&origin=journalDetail&_rtd=e30%3D","https://scholar.google.com/scholar?q=related:A8v_BeQQW4YJ:scholar.google.com/&scioq=source:%22nature+catalysis%22+cross+coupling+dft&hl=en&as_sdt=0,5&as_vis=1"
33,"S Das, B Mitschke, CK De, I Harden, G Bistoni, B List","Harnessing the ambiphilicity of silyl nitronates in a catalytic asymmetric approach to aliphatic β3-amino acids",2021,"Nature Catalysis","nature.com","https://www.nature.com/articles/s41929-021-00714-x","https://scholar.google.com/scholar?cites=5088568875400407396&as_sdt=2005&sciodt=0,5&hl=en",243,"2025-05-05 18:15:52","HTML","","","",,,,,33,8.25,6,6,4,"… The ion-pair structure 3e-TBS-1b was optimized using density functional theory (DFT). A large number of conformers was initially generated using a semi-empirical method, and the low-…","https://www.nature.com/articles/s41929-021-00714-x","https://scholar.google.com/scholar?q=related:ZKlZiW46nkYJ:scholar.google.com/&scioq=source:%22nature+catalysis%22+cross+coupling+dft&hl=en&as_sdt=0,5&as_vis=1"
29,"L Sandoval-Diaz, D Cruz, M Vuijk, G Ducci…","Metastable nickel–oxygen species modulate rate oscillations during dry reforming of methane",2024,"Nature Catalysis","nature.com","https://www.nature.com/articles/s41929-023-01090-4","https://scholar.google.com/scholar?cites=13249706051476488044&as_sdt=2005&sciodt=0,5&hl=en",244,"2025-05-05 18:15:52","HTML","","","",,,,,29,29.00,6,5,1,"When a heterogeneous catalyst is active, it forms metastable structures that constantly transform into each other. These structures contribute differently to the catalytic function. Here we …","https://www.nature.com/articles/s41929-023-01090-4","https://scholar.google.com/scholar?q=related:bH-ZMHRp4LcJ:scholar.google.com/&scioq=source:%22nature+catalysis%22+cross+coupling+dft&hl=en&as_sdt=0,5&as_vis=1"
217,"ST Thompson, D Papageorgopoulos","Platinum group metal-free catalysts boost cost competitiveness of fuel cell vehicles",2019,"Nature Catalysis","nature.com","https://www.nature.com/articles/s41929-019-0291-x","https://scholar.google.com/scholar?cites=12773671516921386649&as_sdt=2005&sciodt=0,5&hl=en",245,"2025-05-05 18:15:52","","","","",,,,,217,36.17,109,2,6,"… Hydrogen can reduce emissions by coupling clean energy sources such as solar, wind and nuclear with other energy sectors including transportation and industry through efficient …","","https://scholar.google.com/scholar?q=related:mdafG5EyRbEJ:scholar.google.com/&scioq=source:%22nature+catalysis%22+cross+coupling+dft&hl=en&as_sdt=0,5&as_vis=1"
205,"R Shi, Z Wang, Y Zhao, GIN Waterhouse, Z Li…","Room-temperature electrochemical acetylene reduction to ethylene with high conversion and selectivity",2021,"Nature Catalysis","nature.com","https://www.nature.com/articles/s41929-021-00640-y","https://scholar.google.com/scholar?cites=2361650638331117333&as_sdt=2005&sciodt=0,5&hl=en",246,"2025-05-05 18:15:52","","","","",,,,,205,51.25,34,6,4,"… To better understand the origins of the acetylene electroreduction activity and ethylene selectivity, density functional theory calculations were then performed. Details of the …","","https://scholar.google.com/scholar?q=related:Ff9MNb5ExiAJ:scholar.google.com/&scioq=source:%22nature+catalysis%22+cross+coupling+dft&hl=en&as_sdt=0,5&as_vis=1"
371,"C Xia, S Back, S Ringe, K Jiang, F Chen, X Sun…","Confined local oxygen gas promotes electrochemical water oxidation to hydrogen peroxide",2020,"Nature Catalysis","nature.com","https://www.nature.com/articles/s41929-019-0402-8","https://scholar.google.com/scholar?cites=4400984497698167050&as_sdt=2005&sciodt=0,5&hl=en",247,"2025-05-05 18:15:52","","","","",,,,,371,74.20,53,7,5,"… From experiments and density functional theory studies, we explain this shift by the generation of a triple-phase boundary at which the *OH binding energy shifts towards the top of the …","https://orbit.dtu.dk/files/199803892/Accepted_Manuscript.pdf","https://scholar.google.com/scholar?q=related:CtlMTxVwEz0J:scholar.google.com/&scioq=source:%22nature+catalysis%22+cross+coupling+dft&hl=en&as_sdt=0,5&as_vis=1"
76,"G Cheng, A Jentys, OY Gutiérrez, Y Liu, YH Chin…","Critical role of solvent-modulated hydrogen-binding strength in the catalytic hydrogenation of benzaldehyde on palladium",2021,"Nature Catalysis","nature.com","https://www.nature.com/articles/s41929-021-00701-2","https://scholar.google.com/scholar?cites=9235765600387922727&as_sdt=2005&sciodt=0,5&hl=en",248,"2025-05-05 18:15:52","","","","",,,,,76,19.00,13,6,4,"Solvents not only disperse reactants to enhance mass transport in catalytic reactions but also alter the reaction kinetically. Here, we show that the rate of benzaldehyde hydrogenation …","https://www.osti.gov/pages/servlets/purl/1842503","https://scholar.google.com/scholar?q=related:J_vkX-EHLIAJ:scholar.google.com/&scioq=source:%22nature+catalysis%22+cross+coupling+dft&hl=en&as_sdt=0,5&as_vis=1"
43,"W Chang, A Jain, F Rezaie, K Manthiram","Lithium-mediated nitrogen reduction to ammonia via the catalytic solid–electrolyte interphase",2024,"Nature Catalysis","nature.com","https://www.nature.com/articles/s41929-024-01115-6","https://scholar.google.com/scholar?cites=10451678979273903541&as_sdt=2005&sciodt=0,5&hl=en",249,"2025-05-05 18:15:52","","","","",,,,,43,43.00,11,4,1,"… In parallel, refinement of kinetic and transport models supported by theoretical calculations (using density functional theory, molecular dynamics simulations and so on) will help to …","http://catalysis.eprints.iitm.ac.in/4117/1/s41929-024-01115-6dated.pdf","https://scholar.google.com/scholar?q=related:tc0JAqjSC5EJ:scholar.google.com/&scioq=source:%22nature+catalysis%22+cross+coupling+dft&hl=en&as_sdt=0,5&as_vis=1"
0,"M Capdevila-Cortada","A toast from the couple",2022,"Nature Catalysis","nature.com","https://www.nature.com/articles/s41929-022-00864-6","",250,"2025-05-05 18:15:52","","","","",,,,,0,0.00,0,1,3,"… A few recent reports have also demonstrated the coupling of CO 2 with other reagents to form a … on in situ infrared and Raman spectroscopies and density functional theory calculations. …","","https://scholar.google.com/scholar?q=related:q-WbvS9xq5cJ:scholar.google.com/&scioq=source:%22nature+catalysis%22+cross+coupling+dft&hl=en&as_sdt=0,5&as_vis=1"
4,"E Liu, D Higgins","Tunable layered Mn oxides for oxygen electrocatalysis",2024,"Nature Catalysis","nature.com","https://www.nature.com/articles/s41929-024-01144-1","https://scholar.google.com/scholar?cites=16824082243853773254&as_sdt=2005&sciodt=0,5&hl=en",251,"2025-05-05 18:15:52","","","","",,,,,4,4.00,2,2,1,"… stability of Li 2 Mn 0.85 Ru 0.15 O 3 , density functional theory (DFT) calculations were combined with advanced materials characterization. DFT revealed that Li 2 Mn 0.85 Ru 0.15 O 3 …","","https://scholar.google.com/scholar?q=related:xmncuKkle-kJ:scholar.google.com/&scioq=source:%22nature+catalysis%22+cross+coupling+dft&hl=en&as_sdt=0,5&as_vis=1"
83,"S Xu, Y Kim, J Park, D Higgins, SJ Shen, P Schindler…","Extending the limits of Pt/C catalysts with passivation-gas-incorporated atomic layer deposition",2018,"… catalysis","nature.com","https://www.nature.com/articles/s41929-018-0118-1","https://scholar.google.com/scholar?cites=13704103801132367781&as_sdt=2005&sciodt=0,5&hl=en",252,"2025-05-05 18:15:52","","","","",,,,,83,11.86,12,7,7,"… The adsorption energy of precursor onto Pt- and CO-passivated Pt clusters was calculated by density functional theory with the package QUANTUM ESPRESSO 64 . The Perdew–Burke…","https://ntnuopen.ntnu.no/ntnu-xmlui/bitstream/handle/11250/2596385/e.Proofing.pdf?sequence=4","https://scholar.google.com/scholar?q=related:pT-Tt8zBLr4J:scholar.google.com/&scioq=source:%22nature+catalysis%22+cross+coupling+dft&hl=en&as_sdt=0,5&as_vis=1"
1,"Y Liang, J Luo, C You, Y Diskin-Posner, D Milstein","A hydrogenative oxidation strategy for the single-step synthesis of lactams from N-heteroarenes using water",2025,"Nature Catalysis","nature.com","https://www.nature.com/articles/s41929-024-01286-2","https://scholar.google.com/scholar?cites=11637524453235594983&as_sdt=2005&sciodt=0,5&hl=en",253,"2025-05-05 18:15:52","","","","",,,,,1,1.00,0,5,1,"… To gain insight into the reaction mechanism we conducted detailed mechanistic studies, including control experiments and density functional theory (DFT) calculations. This strategy …","","https://scholar.google.com/scholar?q=related:55YH_NTKgKEJ:scholar.google.com/&scioq=source:%22nature+catalysis%22+cross+coupling+dft&hl=en&as_sdt=0,5&as_vis=1"
194,"JJ Leung, J Warnan, KH Ly, N Heidary, DH Nam…","Solar-driven reduction of aqueous CO2 with a cobalt bis(terpyridine)-based photocathode",2019,"Nature Catalysis","nature.com","https://www.nature.com/articles/s41929-019-0254-2","https://scholar.google.com/scholar?cites=3444500000410976634&as_sdt=2005&sciodt=0,5&hl=en",254,"2025-05-05 18:15:52","","","","",,,,,194,32.33,32,6,6,"The selective reduction of CO 2 with inexpensive solar-driven photoelectrochemical devices is a contemporary challenge in the quest for renewable fuel production. Here, we report a …","https://www.repository.cam.ac.uk/bitstreams/cfa96a44-0aa2-431a-bc69-9f4f04f9e933/download","https://scholar.google.com/scholar?q=related:ekFUKYBSzS8J:scholar.google.com/&scioq=source:%22nature+catalysis%22+cross+coupling+dft&hl=en&as_sdt=0,5&as_vis=1"
63,"D Chen, Z Guan, D Zhang, L Trotochaud, E Crumlin…","Constructing a pathway for mixed ion and electron transfer reactions for O2 incorporation in Pr0.1Ce0.9O2−x",2020,"Nature Catalysis","nature.com","https://www.nature.com/articles/s41929-019-0401-9","https://scholar.google.com/scholar?cites=6444499733180385225&as_sdt=2005&sciodt=0,5&hl=en",255,"2025-05-05 18:15:52","","","","",,,,,63,12.60,11,6,5,"… They are substantially more complex than electron transfer and proton-coupled electron transfer reactions because the ions also cross the electrochemical double layer 1 . The net …","https://pure.mpg.de/rest/items/item_3189459_5/component/file_3221401/content","https://scholar.google.com/scholar?q=related:yQdR51x2b1kJ:scholar.google.com/&scioq=source:%22nature+catalysis%22+cross+coupling+dft&hl=en&as_sdt=0,5&as_vis=1"
