Cites,Authors,Title,Year,Source,Publisher,ArticleURL,CitesURL,GSRank,QueryDate,Type,DOI,ISSN,CitationURL,Volume,Issue,StartPage,EndPage,ECC,CitesPerYear,CitesPerAuthor,AuthorCount,Age,Abstract,FullTextURL,RelatedURL
6,"C Yu, Z Zhang, G Dong","Split cross-coupling via Rh-catalysed activation of unstrained aryl–aryl bonds",2024,"Nature Catalysis","nature.com","https://www.nature.com/articles/s41929-024-01120-9","https://scholar.google.com/scholar?cites=18244886755576149180&as_sdt=2005&sciodt=0,5&hl=en",1,"2025-05-05 18:15:52","","","","",,,,,6,6.00,2,3,1,"… To further understand the catalytic cycle, the density functional theory (DFT) calculation was … I) is difficult to be precisely calculated (in this DFT study, we assumed both TDAE and TDAT-I …","https://pmc.ncbi.nlm.nih.gov/articles/PMC11567681/","https://scholar.google.com/scholar?q=related:vHRYsdbbMv0J:scholar.google.com/&scioq=source:%22nature+catalysis%22+cross+coupling+dft&hl=en&as_sdt=0,5&as_vis=1"
54,"T Niwa, Y Uetake, M Isoda, T Takimoto, M Nakaoka…","Lewis acid-mediated Suzuki–Miyaura cross-coupling reaction",2021,"Nature Catalysis","nature.com","https://www.nature.com/articles/s41929-021-00719-6","https://scholar.google.com/scholar?cites=6010333318033573893&as_sdt=2005&sciodt=0,5&hl=en",2,"2025-05-05 18:15:52","HTML","","","",,,,,54,13.50,9,6,4,"… We performed DFT calculations for each step of the zinc-mediated SMC reaction to elucidate the reaction mechanism using 4-fluorobromobenzene (1) and potassium phenyl(trifluoro)…","https://www.nature.com/articles/s41929-021-00719-6","https://scholar.google.com/scholar?q=related:BQgWA0_-aFMJ:scholar.google.com/&scioq=source:%22nature+catalysis%22+cross+coupling+dft&hl=en&as_sdt=0,5&as_vis=1"
40,"P Li, Z Zhu, C Guo, G Kou, S Wang, P Xie, D Ma…","Nickel-electrocatalysed C(sp3)–C(sp3) cross-coupling of unactivated alkyl halides",2024,"Nature Catalysis","nature.com","https://www.nature.com/articles/s41929-024-01118-3","https://scholar.google.com/scholar?cites=17009823086149023009&as_sdt=2005&sciodt=0,5&hl=en",3,"2025-05-05 18:15:52","","","","",,,,,40,40.00,5,8,1,"… In parallel to these experiments, based on density functional theory (DFT), computational … Moreover, based on DFT calculations concerning the various oxidation states of the nickel …","","https://scholar.google.com/scholar?q=related:IbUmlvkHD-wJ:scholar.google.com/&scioq=source:%22nature+catalysis%22+cross+coupling+dft&hl=en&as_sdt=0,5&as_vis=1"
97,"Y Li, W Nie, Z Chang, JW Wang, X Lu, Y Fu","Cobalt-catalysed enantioselective C(sp3)–C(sp3) coupling",2021,"Nature Catalysis","nature.com","https://www.nature.com/articles/s41929-021-00688-w","https://scholar.google.com/scholar?cites=16261542559382633056&as_sdt=2005&sciodt=0,5&hl=en",4,"2025-05-05 18:15:52","","","","",,,,,97,24.25,16,6,4,"… are few examples of its use in asymmetric cross-coupling. Here we report a cobalt-catalysed enantioselective C(sp 3 )–C(sp 3 ) coupling reaction, namely, alkene hydroalkylation, to …","https://lac.dicp.ac.cn/11.29ts.pdf","https://scholar.google.com/scholar?q=related:YPrl58yarOEJ:scholar.google.com/&scioq=source:%22nature+catalysis%22+cross+coupling+dft&hl=en&as_sdt=0,5&as_vis=1"
4,"D Wu, W Kong, Y Bao, C Huang, W Liu, Y Li, G Yin","Overcoming limitations in non-activated alkene cross-coupling with nickel catalysis and anionic ligands",2024,"Nature Catalysis","nature.com","https://www.nature.com/articles/s41929-024-01211-7","https://scholar.google.com/scholar?cites=11570865353326903655&as_sdt=2005&sciodt=0,5&hl=en",5,"2025-05-05 18:15:52","","","","",,,,,4,4.00,1,7,1,"… high regioselectivity of the multicomponent cross-coupling of non-activated alkene and the role of native functional group, we performed density functional theory (DFT) calculations. As …","","https://scholar.google.com/scholar?q=related:Z8Hs2Lv4k6AJ:scholar.google.com/&scioq=source:%22nature+catalysis%22+cross+coupling+dft&hl=en&as_sdt=0,5&as_vis=1"
235,"R Mao, A Frey, J Balon, X Hu","Decarboxylative C(sp3)–N cross-coupling via synergetic photoredox and copper catalysis",2018,"Nature Catalysis","nature.com","https://www.nature.com/articles/s41929-017-0023-z","https://scholar.google.com/scholar?cites=12807529284799606079&as_sdt=2005&sciodt=0,5&hl=en",6,"2025-05-05 18:15:52","","","","",,,,,235,33.57,59,4,7,"… catalysis enables C(sp 3 )–N cross-coupling. Decarboxylative amination can be used for the … 2) was obtained in only 9% yield, consistent with the challenge in cross-coupling of the very …","https://infoscience.epfl.ch/record/257884/files/SI.pdf","https://scholar.google.com/scholar?q=related:P63k_gZ8vbEJ:scholar.google.com/&scioq=source:%22nature+catalysis%22+cross+coupling+dft&hl=en&as_sdt=0,5&as_vis=1"
148,"B Zhang, J Wang, G Liu, CM Weiss, D Liu, Y Chen…","A strongly coupled Ru–CrOx cluster–cluster heterostructure for efficient alkaline hydrogen electrocatalysis",2024,"Nature Catalysis","nature.com","https://www.nature.com/articles/s41929-024-01126-3","https://scholar.google.com/scholar?cites=6765163855028856750&as_sdt=2005&sciodt=0,5&hl=en",7,"2025-05-05 18:15:52","","","","",,,,,148,148.00,21,7,1,"… To further illustrate the mechanism, density functional theory (DFT) calculations were performed on the cluster–cluster heterostructure model that was built on the basis of the …","","https://scholar.google.com/scholar?q=related:rqdOyq6w4l0J:scholar.google.com/&scioq=source:%22nature+catalysis%22+cross+coupling+dft&hl=en&as_sdt=0,5&as_vis=1"
1,"T von Münchow, NK Pandit, S Dana, P Boos…","Enantioselective C–H annulations enabled by either nickel-or cobalt-electrocatalysed C–H activation for catalyst-controlled chemodivergence",2025,"Nature Catalysis","nature.com","https://www.nature.com/articles/s41929-025-01306-9","https://scholar.google.com/scholar?cites=13930496127118736252&as_sdt=2005&sciodt=0,5&hl=en",8,"2025-05-05 18:15:52","HTML","","","",,,,,1,1.00,0,5,1,"… ,4-dioxane) level of theory to acquire density functional theory (DFT)-derived descriptors (for … (µ net ) were derived from single-point DFT calculations. To assess the steric and geometric …","https://www.nature.com/articles/s41929-025-01306-9","https://scholar.google.com/scholar?q=related:fPvdsWsQU8EJ:scholar.google.com/&scioq=source:%22nature+catalysis%22+cross+coupling+dft&hl=en&as_sdt=0,5&as_vis=1"
0,"Q Wang, SF Hung, K Lao, X Huang, F Li, HB Tao…","Breaking the linear scaling limit in multi-electron-transfer electrocatalysis through intermediate spillover",2025,"Nature Catalysis","nature.com","https://www.nature.com/articles/s41929-025-01323-8","",9,"2025-05-05 18:15:52","","","","",,,,,0,0.00,0,7,1,"… We also carried out DFT calculations to gain insights into the possibility of transferring the OH* … The DFT results are summarized in Fig. 3c. It can be seen that only moderate energy …","","https://scholar.google.com/scholar?q=related:SdVTcStlkp0J:scholar.google.com/&scioq=source:%22nature+catalysis%22+cross+coupling+dft&hl=en&as_sdt=0,5&as_vis=1"
47,"AM Messinis, SLJ Luckham, PP Wells, D Gianolio…","The highly surprising behaviour of diphosphine ligands in iron-catalysed Negishi cross-coupling",2019,"Nature Catalysis","nature.com","https://www.nature.com/articles/s41929-018-0197-z","https://scholar.google.com/scholar?cites=7644966703384650470&as_sdt=2005&sciodt=0,5&hl=en",10,"2025-05-05 18:15:52","","","","",,,,,47,7.83,9,5,6,"Iron-catalysed cross-coupling is undergoing explosive development, but mechanistic understanding lags far behind synthetic methodology. Here, we find that the activity of iron–…","https://research-information.bris.ac.uk/files/181545400/accepted_version.pdf","https://scholar.google.com/scholar?q=related:5mLuQrZgGGoJ:scholar.google.com/&scioq=source:%22nature+catalysis%22+cross+coupling+dft&hl=en&as_sdt=0,5&as_vis=1"
34,"Z Novák, R Adamik, JT Csenki, F Béke, R Gavaldik…","Revisiting the amine-catalysed cross-coupling",2021,"Nature Catalysis","nature.com","https://www.nature.com/articles/s41929-021-00709-8","https://scholar.google.com/scholar?cites=2196039240835984267&as_sdt=2005&sciodt=0,5&hl=en",11,"2025-05-05 18:15:52","","","","",,,,,34,8.50,6,6,4,"… cross-coupling and draws attention to the impurity effect in this field of chemical research. The palladium-catalysed Suzuki–Miyaura cross-coupling … the density functional theory studies. …","","https://scholar.google.com/scholar?q=related:i-vY7g3meR4J:scholar.google.com/&scioq=source:%22nature+catalysis%22+cross+coupling+dft&hl=en&as_sdt=0,5&as_vis=1"
157,"H Hu, SJ Chen, M Mandal, SM Pratik, JA Buss…","Copper-catalysed benzylic C–H coupling with alcohols via radical relay enabled by redox buffering",2020,"… catalysis","nature.com","https://www.nature.com/articles/s41929-020-0425-1","https://scholar.google.com/scholar?cites=2459869372010277240&as_sdt=2005&sciodt=0,5&hl=en",12,"2025-05-05 18:15:52","","","","",,,,,157,31.40,26,6,5,"… Cross-coupling reactions enable rapid, … coupling partners, such as aryl halides or related pre-functionalized substrates. Here, we demonstrate copper-catalysed oxidative cross-coupling …","https://pmc.ncbi.nlm.nih.gov/articles/PMC7197765/pdf/nihms-1548657.pdf","https://scholar.google.com/scholar?q=related:eCmJMCk2IyIJ:scholar.google.com/&scioq=source:%22nature+catalysis%22+cross+coupling+dft&hl=en&as_sdt=0,5&as_vis=1"
28,"L van Dijk, R Ardkhean, M Sidera, S Karabiyikoglu…","Mechanistic investigation of Rh(i)-catalysed asymmetric Suzuki–Miyaura coupling with racemic allyl halides",2021,"Nature Catalysis","nature.com","https://www.nature.com/articles/s41929-021-00589-y","https://scholar.google.com/scholar?cites=4718351086998855458&as_sdt=2005&sciodt=0,5&hl=en",13,"2025-05-05 18:15:52","","","","",,,,,28,7.00,6,5,4,"… After one hour, the product ratio was 20:1 in favour of product 6, which indicates that oxidative addition is faster for 5, which is qualitatively in agreement with the results of our DFT …","https://ora.ox.ac.uk/objects/uuid:a53f14d0-3a1f-437e-9ce7-624a6430a3ab/download_file?file_format=&safe_filename=vanDijk_et_al_2021_Mechanistic_investigation.pdf&type_of_work=Journal+article","https://scholar.google.com/scholar?q=related:Ih8lklDzekEJ:scholar.google.com/&scioq=source:%22nature+catalysis%22+cross+coupling+dft&hl=en&as_sdt=0,5&as_vis=1"
151,"C Zhu, H Yue, B Maity, I Atodiresei, L Cavallo…","A multicomponent synthesis of stereodefined olefins via nickel catalysis and single electron/triplet energy transfer",2019,"Nature Catalysis","nature.com","https://www.nature.com/articles/s41929-019-0311-x","https://scholar.google.com/scholar?cites=17738408218476900445&as_sdt=2005&sciodt=0,5&hl=en",14,"2025-05-05 18:15:52","","","","",,,,,151,25.17,25,6,6,"… To further support the proposed mechanism, we examined the nickel catalytic cycle in detail, using density functional theory (DFT)-based calculations. The energy profile is displayed in …","https://repository.kaust.edu.sa/bitstream/handle/10754/656150/41929_2019_311_MOESM1_ESM.pdf?sequence=2&isAllowed=y","https://scholar.google.com/scholar?q=related:XXAv50p8K_YJ:scholar.google.com/&scioq=source:%22nature+catalysis%22+cross+coupling+dft&hl=en&as_sdt=0,5&as_vis=1"
13,"TD Tan, JMI Serviano, X Luo, PC Qian, PL Holland…","Congested C(sp3)-rich architectures enabled by iron-catalysed conjunctive alkylation",2024,"Nature Catalysis","nature.com","https://www.nature.com/articles/s41929-024-01113-8%E2%80%A6","https://scholar.google.com/scholar?cites=16681609105627825473&as_sdt=2005&sciodt=0,5&hl=en",15,"2025-05-05 18:15:52","","","","",,,,,13,13.00,2,6,1,"… Our DFT studies on the formation of the minor alkene product via iron–carbon bond … , as it may fall within the accuracy level possible via DFT, and that TST may not correlate perfectly. …","https://pmc.ncbi.nlm.nih.gov/articles/PMC11155680/","https://scholar.google.com/scholar?q=related:QUXePhn7gOcJ:scholar.google.com/&scioq=source:%22nature+catalysis%22+cross+coupling+dft&hl=en&as_sdt=0,5&as_vis=1"
37,"R Wu, Q Meng, J Yan, Z Zhang, B Chen, H Liu, J Tai…","Intermetallic synergy in platinum–cobalt electrocatalysts for selective C–O bond cleavage",2024,"Nature Catalysis","nature.com","https://www.nature.com/articles/s41929-024-01165-w","https://scholar.google.com/scholar?cites=17614951972156290212&as_sdt=2005&sciodt=0,5&hl=en",16,"2025-05-05 18:15:52","","","","",,,,,37,37.00,5,8,1,"… bimetallic Pt–Co catalysts, we performed density functional theory (DFT) calculations to study the … Aligning well with the HDO performance (Table 1, entry 1), DFT calculations verify that …","","https://scholar.google.com/scholar?q=related:pDTxm33hdPQJ:scholar.google.com/&scioq=source:%22nature+catalysis%22+cross+coupling+dft&hl=en&as_sdt=0,5&as_vis=1"
50,"CF Liu, H Wang, RT Martin, H Zhao, O Gutierrez…","Olefin functionalization/isomerization enables stereoselective alkene synthesis",2021,"… catalysis","nature.com","https://www.nature.com/articles/s41929-021-00658-2","https://scholar.google.com/scholar?cites=13822411865091468549&as_sdt=2005&sciodt=0,5&hl=en",17,"2025-05-05 18:15:52","","","","",,,,,50,12.50,8,6,4,"… Taken together, these DFT results reveal the crucial roles played by the sterically encumbered tert-pentoxide and IPr ligand in inducing high stereoselectivity, a shift in C=C bond …","https://pmc.ncbi.nlm.nih.gov/articles/PMC9431960/pdf/nihms-1768391.pdf","https://scholar.google.com/scholar?q=related:Be3rZVsS078J:scholar.google.com/&scioq=source:%22nature+catalysis%22+cross+coupling+dft&hl=en&as_sdt=0,5&as_vis=1"
99,"HM O'Brien, M Manzotti, RD Abrams, D Elorriaga…","Iron-catalysed substrate-directed Suzuki biaryl cross-coupling",2018,"Nature Catalysis","nature.com","https://www.nature.com/articles/s41929-018-0081-x","https://scholar.google.com/scholar?cites=6548759748051704333&as_sdt=2005&sciodt=0,5&hl=en",18,"2025-05-05 18:15:52","","","","",,,,,99,14.14,20,5,7,"Although the replacement of ubiquitous palladium catalysts with more sustainable iron-based analogues continues apace, the simple biaryl Suzuki cross-coupling reaction remains …","https://research-information.bris.ac.uk/files/157241256/Fe_Suzuki_accepted_version.pdf","https://scholar.google.com/scholar?q=related:DZr_RUve4VoJ:scholar.google.com/&scioq=source:%22nature+catalysis%22+cross+coupling+dft&hl=en&as_sdt=0,5&as_vis=1"
19,"D Wu, W Kong, Y Bao, D Zhao, Y Li, G Yin","Alkene 1, 1-difunctionalizations via organometallic-radical relay",2023,"Nature Catalysis","nature.com","https://www.nature.com/articles/s41929-023-01032-0","https://scholar.google.com/scholar?cites=2080939178944283489&as_sdt=2005&sciodt=0,5&hl=en",19,"2025-05-05 18:15:52","","","","",,,,,19,9.50,3,6,2,"… DFT calculations were performed at the M06L/6-311+G(d,p)-SDD(for Ni)-SMD (THF)//B3LYP-D3(BJ)/6-31 G*-SDD(for Ni)-SMD (THF) level of theory. CP, complex; TS, transition state; …","","https://scholar.google.com/scholar?q=related:YcMqcCj74BwJ:scholar.google.com/&scioq=source:%22nature+catalysis%22+cross+coupling+dft&hl=en&as_sdt=0,5&as_vis=1"
41,"S Bera, C Fan, X Hu","Enantio- and diastereoselective construction of vicinal C(sp3) centres via nickel-catalysed hydroalkylation of alkenes",2022,"Nature Catalysis","nature.com","https://www.nature.com/articles/s41929-022-00894-0","https://scholar.google.com/scholar?cites=17928084814158592734&as_sdt=2005&sciodt=0,5&hl=en",20,"2025-05-05 18:15:52","","","","",,,,,41,13.67,14,3,3,"… To overcome these drawbacks while maintaining the inherent advantages of cross-coupling, nickel–hydride (Ni–H)-catalysed hydroalkylation of alkenes has been developed 5,6,7,8 . In …","https://infoscience.epfl.ch/bitstreams/e4d01ef6-c572-4a91-9dfd-2828783dded6/download","https://scholar.google.com/scholar?q=related:3nr_wiZazfgJ:scholar.google.com/&scioq=source:%22nature+catalysis%22+cross+coupling+dft&hl=en&as_sdt=0,5&as_vis=1"
78,"CS Day, Á Rentería-Gómez, SJ Ton, AR Gogoi…","Elucidating electron-transfer events in polypyridine nickel complexes for reductive coupling reactions",2023,"… catalysis","nature.com","https://www.nature.com/articles/s41929-023-00925-4","https://scholar.google.com/scholar?cites=14794972266016758339&as_sdt=2005&sciodt=0,5&hl=en",21,"2025-05-05 18:15:52","","","","",,,,,78,39.00,16,5,2,"… , we next turned to dispersion-corrected density functional theory (DFT) and domain-based local pair natural orbital coupled cluster method with single and double and perturbative …","https://pmc.ncbi.nlm.nih.gov/articles/PMC11546168/","https://scholar.google.com/scholar?q=related:Q1qvieNMUs0J:scholar.google.com/&scioq=source:%22nature+catalysis%22+cross+coupling+dft&hl=en&as_sdt=0,5&as_vis=1"
6,"BJS Rowsell, HM O'brien, G Athavan, PR Daley-Dee…","The iron-catalysed Suzuki coupling of aryl chlorides",2024,"Nature Catalysis","nature.com","https://www.nature.com/articles/s41929-024-01234-0","https://scholar.google.com/scholar?cites=16877262102657862385&as_sdt=2005&sciodt=0,5&hl=en",22,"2025-05-05 18:15:52","HTML","","","",,,,,6,6.00,1,5,1,"… The proposed cross-coupling manifolds were probed using density functional theory (DFT) employing the Orca software package 62,63 . Geometries were optimized with the BP86 …","https://www.nature.com/articles/s41929-024-01234-0","https://scholar.google.com/scholar?q=related:8YoVenYUOOoJ:scholar.google.com/&scioq=source:%22nature+catalysis%22+cross+coupling+dft&hl=en&as_sdt=0,5&as_vis=1"
18,"QZ Li, WL Zou, ZY Yu, XX Kou, YQ Liu, X Zhang…","Remote site-selective arene C–H functionalization enabled by N-heterocyclic carbene organocatalysis",2024,"Nature Catalysis","nature.com","https://www.nature.com/articles/s41929-024-01194-5","https://scholar.google.com/scholar?cites=17518995358910459760&as_sdt=2005&sciodt=0,5&hl=en",23,"2025-05-05 18:15:52","","","","",,,,,18,18.00,3,7,1,"… The radical reaction mechanism was investigated by experimental studies and density functional theory (DFT) calculations. Further … Qi regarding the DFT calculations in this study. …","","https://scholar.google.com/scholar?q=related:cC-TlXX5H_MJ:scholar.google.com/&scioq=source:%22nature+catalysis%22+cross+coupling+dft&hl=en&as_sdt=0,5&as_vis=1"
8,"QC Chen, S Kress, R Molinelli, A Wuttig","Interfacial tuning of electrocatalytic Ag surfaces for fragment-based electrophile coupling",2024,"Nature catalysis","nature.com","https://www.nature.com/articles/s41929-023-01073-5","https://scholar.google.com/scholar?cites=9069717640862568129&as_sdt=2005&sciodt=0,5&hl=en",24,"2025-05-05 18:15:52","","","","",,,,,8,8.00,2,4,1,"… the conditions of Ag-catalysed electrophile coupling. Our results demonstrate that the baseline reactivity for the reductive coupling between the electrophiles by Ag electrocatalysis …","https://pmc.ncbi.nlm.nih.gov/articles/PMC10906991/pdf/nihms-1966554.pdf","https://scholar.google.com/scholar?q=related:wQ61FCQc3n0J:scholar.google.com/&scioq=source:%22nature+catalysis%22+cross+coupling+dft&hl=en&as_sdt=0,5&as_vis=1"
438,"Y Sun, H Liao, J Wang, B Chen, S Sun, SJH Ong, S Xi…","Covalency competition dominates the water oxidation structure–activity relationship on spinel oxides",2020,"… catalysis","nature.com","https://www.nature.com/articles/s41929-020-0465-6","https://scholar.google.com/scholar?cites=1092306647978083892&as_sdt=2005&sciodt=0,5&hl=en",25,"2025-05-05 18:15:52","","","","",,,,,438,87.60,55,8,5,"… by density functional theory (DFT). By contrast, the MAE from the model in which the data are trained without the structural feature is considerably higher, with a value of 0.09 eV (…","https://www.osti.gov/pages/servlets/purl/1638798","https://scholar.google.com/scholar?q=related:NAaI6hunKA8J:scholar.google.com/&scioq=source:%22nature+catalysis%22+cross+coupling+dft&hl=en&as_sdt=0,5&as_vis=1"
64,"J Vercammen, M Bocus, S Neale, A Bugaev…","Shape-selective C–H activation of aromatics to biarylic compounds using molecular palladium in zeolites",2020,"Nature Catalysis","nature.com","https://www.nature.com/articles/s41929-020-00533-6","https://scholar.google.com/scholar?cites=8042589842451369616&as_sdt=2005&sciodt=0,5&hl=en",26,"2025-05-05 18:15:52","","","","",,,,,64,12.80,13,5,5,"… dynamics-based dispersion-corrected density functional theory (DFT) calculations. The first-… toluene loadings, whereas the static DFT calculations afforded adsorption free energies and …","https://lirias.kuleuven.be/retrieve/597724","https://scholar.google.com/scholar?q=related:kI56qdkEnW8J:scholar.google.com/&scioq=source:%22nature+catalysis%22+cross+coupling+dft&hl=en&as_sdt=0,5&as_vis=1"
138,"J Zhao, S Ji, C Guo, H Li, J Dong, P Guo, D Wang…","A heterogeneous iridium single-atom-site catalyst for highly regioselective carbenoid O–H bond insertion",2021,"Nature Catalysis","nature.com","https://www.nature.com/articles/s41929-021-00637-7","https://scholar.google.com/scholar?cites=9781346388209730986&as_sdt=2005&sciodt=0,5&hl=en",27,"2025-05-05 18:15:52","","","","",,,,,138,34.50,17,8,4,"… Notably, a selective O–H insertion of glycosides has been reported by Tang and co-workers; however, density-functional theory (DFT) calculations suggest that site selectivity and …","https://escholarship.org/content/qt4t9775r9/qt4t9775r9.pdf","https://scholar.google.com/scholar?q=related:qoVKXrdSvocJ:scholar.google.com/&scioq=source:%22nature+catalysis%22+cross+coupling+dft&hl=en&as_sdt=0,5&as_vis=1"
5,"D Ding, L Yin, AT Poore, YS Ho, YH Cheng, CT Hsieh…","Enantioconvergent copper-catalysed difluoromethylation of alkyl halides",2024,"Nature Catalysis","nature.com","https://www.nature.com/articles/s41929-024-01253-x","https://scholar.google.com/scholar?cites=5501452292567545013&as_sdt=2005&sciodt=0,5&hl=en",28,"2025-05-05 18:15:52","","","","",,,,,5,5.00,1,7,1,"… We next performed DFT calculations to understand the origin of enantioselectivity in this … Therefore, we focused our DFT studies on the reaction between the Cu II intermediate [L * Cu II (…","https://pmc.ncbi.nlm.nih.gov/articles/PMC11343281/pdf/nihpp-rs3645899v1.pdf","https://scholar.google.com/scholar?q=related:tTQ_T7YVWUwJ:scholar.google.com/&scioq=source:%22nature+catalysis%22+cross+coupling+dft&hl=en&as_sdt=0,5&as_vis=1"
80,"C Chen, S Yu, Y Yang, S Louisia, I Roh, J Jin, S Chen…","Exploration of the bio-analogous asymmetric C–C coupling mechanism in tandem CO2 electroreduction",2022,"Nature Catalysis","nature.com","https://www.nature.com/articles/s41929-022-00844-w","https://scholar.google.com/scholar?cites=9700169079672268360&as_sdt=2005&sciodt=0,5&hl=en",29,"2025-05-05 18:15:52","","","","",,,,,80,26.67,10,8,3,"… Nevertheless, there is still a lack of a comprehensive and convincing molecular picture of such a C–C coupling. Although some density functional theory calculations and in situ …","https://escholarship.org/content/qt5m1176n2/qt5m1176n2.pdf","https://scholar.google.com/scholar?q=related:SOYXX2LsnYYJ:scholar.google.com/&scioq=source:%22nature+catalysis%22+cross+coupling+dft&hl=en&as_sdt=0,5&as_vis=1"
92,"X Huang, J Feng, J Cui, G Jiang, W Harrison, X Zang…","Photoinduced chemomimetic biocatalysis for enantioselective intermolecular radical conjugate addition",2022,"Nature Catalysis","nature.com","https://www.nature.com/articles/s41929-022-00777-4","https://scholar.google.com/scholar?cites=8015672543983923731&as_sdt=2005&sciodt=0,5&hl=en",30,"2025-05-05 18:15:52","","","","",,,,,92,30.67,13,7,3,"… inherent difficulty in photoenzymatic intermolecular cross-coupling reactions over competing … All DFT calculations were performed with the software Gaussian 16, Revision A.03 (ref. ). …","https://www.osti.gov/servlets/purl/1902704","https://scholar.google.com/scholar?q=related:E3IDvLVjPW8J:scholar.google.com/&scioq=source:%22nature+catalysis%22+cross+coupling+dft&hl=en&as_sdt=0,5&as_vis=1"
37,"MM Xu, L Yang, K Tan, X Chen, QT Lu, KN Houk…","An enantioselective ambimodal cross-Diels–Alder reaction and applications in synthesis",2021,"Nature Catalysis","nature.com","https://www.nature.com/articles/s41929-021-00687-x","https://scholar.google.com/scholar?cites=251866169284111538&as_sdt=2005&sciodt=0,5&hl=en",31,"2025-05-05 18:15:52","","","","",,,,,37,9.25,5,7,4,"… investigations and density functional theory (DFT) calculations have revealed a possible reaction pathway and mechanism. In the presence of a copper catalyst, the cross-Diels–Alder …","https://par.nsf.gov/servlets/purl/10346570","https://scholar.google.com/scholar?q=related:siweT_LOfgMJ:scholar.google.com/&scioq=source:%22nature+catalysis%22+cross+coupling+dft&hl=en&as_sdt=0,5&as_vis=1"
5,"LW Qi, T Rogge, KN Houk, Y Lu","Iridium nitrenoid-enabled arene C− H functionalization",2024,"Nature Catalysis","nature.com","https://www.nature.com/articles/s41929-024-01207-3","https://scholar.google.com/scholar?cites=14859780959679724852&as_sdt=2005&sciodt=0,5&hl=en",32,"2025-05-05 18:15:52","","","","",,,,,5,5.00,1,4,1,"… We also performed DFT calculations on the reaction of naphthyl azide 8a with β-naphthol (9a) in the presence of iridium complex Ir16 at the PBE0-D3(BJ)/def2-TZVP + SMD(TFE)//PBE0-…","","https://scholar.google.com/scholar?q=related:NL3SZQ2MOM4J:scholar.google.com/&scioq=source:%22nature+catalysis%22+cross+coupling+dft&hl=en&as_sdt=0,5&as_vis=1"
