Cites,Authors,Title,Year,Source,Publisher,ArticleURL,CitesURL,GSRank,QueryDate,Type,DOI,ISSN,CitationURL,Volume,Issue,StartPage,EndPage,ECC,CitesPerYear,CitesPerAuthor,AuthorCount,Age,Abstract,FullTextURL,RelatedURL
34,"A Tayyebi, R Mehrotra, MA Mubarok, J Kim, M Zafari…","Bias-free solar NH3 production by perovskite-based photocathode coupled to valorization of glycerol",2024,"Nature Catalysis","nature.com","https://www.nature.com/articles/s41929-024-01133-4","https://scholar.google.com/scholar?cites=5635809060163425719&as_sdt=2005&sciodt=0,5&hl=en",129,"2025-05-05 18:15:52","","","","",,,,,34,34.00,6,6,1,"… integrated electrocatalyst to achieve high SAP and coupled glycerol oxidation instead of water oxidation … Our photoelectrochemical NH 3 production system coupled to glycerol oxidation …","","https://scholar.google.com/scholar?q=related:txX4_HpqNk4J:scholar.google.com/&scioq=source:%22nature+catalysis%22+cross+coupling+dft&hl=en&as_sdt=0,5&as_vis=1"
102,"W Gao, Y Xu, L Fu, X Chang, B Xu","Experimental evidence of distinct sites for CO2-to-CO and CO conversion on Cu in the electrochemical CO2 reduction reaction",2023,"Nature Catalysis","nature.com","https://www.nature.com/articles/s41929-023-01002-6","https://scholar.google.com/scholar?cites=8099404825959592258&as_sdt=2005&sciodt=0,5&hl=en",130,"2025-05-05 18:15:52","","","","",,,,,102,51.00,20,5,2,"… While density functional theory calculations suggested that coupling between two CO adsorbed on distinct types of sites was responsible for the enhanced ethylene production, …","","https://scholar.google.com/scholar?q=related:QvFn18bdZnAJ:scholar.google.com/&scioq=source:%22nature+catalysis%22+cross+coupling+dft&hl=en&as_sdt=0,5&as_vis=1"
356,"AJ Therrien, AJR Hensley, MD Marcinkowski…","An atomic-scale view of single-site Pt catalysis for low-temperature CO oxidation",2018,"Nature Catalysis","nature.com","https://www.nature.com/articles/s41929-018-0028-2","https://scholar.google.com/scholar?cites=12257951806364879066&as_sdt=2005&sciodt=0,5&hl=en",131,"2025-05-05 18:15:52","","","","",,,,,356,50.86,89,4,7,"… decreasing dipole–dipole coupling between CO molecules … been modelled by density functional theory (DFT) 28 . At a Pt … DFT calculations confirm that a dicarbonyl species is unlikely …","https://par.nsf.gov/servlets/purl/10058407","https://scholar.google.com/scholar?q=related:2og89Dj-HKoJ:scholar.google.com/&scioq=source:%22nature+catalysis%22+cross+coupling+dft&hl=en&as_sdt=0,5&as_vis=1"
2,"S Pinus, J Genzling, M Burai-Patrascu, N Moitessier","Computational methods for asymmetric catalysis",2024,"Nature Catalysis","nature.com","https://www.nature.com/articles/s41929-024-01258-6","https://scholar.google.com/scholar?cites=154406775800988702&as_sdt=2005&sciodt=0,5&hl=en",132,"2025-05-05 18:15:52","","","","",,,,,2,2.00,1,4,1,"… The power of quantum mechanics (QM) calculations, density functional theory (DFT) in … In fact, the computational cost associated with ab initio QM or DFT methods, let alone the required …","","https://scholar.google.com/scholar?q=related:HgSI_iSQJAIJ:scholar.google.com/&scioq=source:%22nature+catalysis%22+cross+coupling+dft&hl=en&as_sdt=0,5&as_vis=1"
178,"VK Singh, C Yu, S Badgujar, Y Kim, Y Kwon, D Kim…","Highly efficient organic photocatalysts discovered via a computer-aided-design strategy for visible-light-driven atom transfer radical polymerization",2018,"Nature Catalysis","nature.com","https://www.nature.com/articles/s41929-018-0156-8","https://scholar.google.com/scholar?cites=5110752431633427524&as_sdt=2005&sciodt=0,5&hl=en",133,"2025-05-05 18:15:52","","","","",,,,,178,25.43,25,7,7,"… of the photoluminescence at 77 K for all molecules and compared them with the corresponding vertical S 1 energies (E vert ) calculated by time-dependent density functional theory (DFT…","https://drive.google.com/file/d/1POYPFxCUGkMg0316zZRBa1ebfNSWU-32/view","https://scholar.google.com/scholar?q=related:RGx5NkIK7UYJ:scholar.google.com/&scioq=source:%22nature+catalysis%22+cross+coupling+dft&hl=en&as_sdt=0,5&as_vis=1"
164,"Y Luo, K Xie, P Ou, C Lavallais, T Peng, Z Chen…","Selective electrochemical synthesis of urea from nitrate and CO2 via relay catalysis on hybrid catalysts",2023,"Nature Catalysis","nature.com","https://www.nature.com/articles/s41929-023-01020-4","https://scholar.google.com/scholar?cites=12334975127727617613&as_sdt=2005&sciodt=0,5&hl=en",134,"2025-05-05 18:15:52","","","","",,,,,164,82.00,23,7,2,"… To investigate their low selectivity to urea, we used DFT calculations to analyse the reaction pathway for the co-electrolysis of NO 3 − and CO 2 on some of the single-component metals (…","https://par.nsf.gov/servlets/purl/10471673","https://scholar.google.com/scholar?q=related:TbZ7cYaiLqsJ:scholar.google.com/&scioq=source:%22nature+catalysis%22+cross+coupling+dft&hl=en&as_sdt=0,5&as_vis=1"
190,"S Song, X Li, J Wei, W Wang, Y Zhang, L Ai, Y Zhu…","DMSO-catalysed late-stage chlorination of (hetero) arenes",2020,"Nature Catalysis","nature.com","https://www.nature.com/articles/s41929-019-0398-0","https://scholar.google.com/scholar?cites=3540785472271319758&as_sdt=2005&sciodt=0,5&hl=en",135,"2025-05-05 18:15:52","","","","",,,,,190,38.00,24,8,5,"… a–c, Structures of DMSO·Cl + (a), (DMSO) 2 ·Cl + (b) and (DMSO) 3 ·Cl + (c), as indicated by DFT calculations at the M06-2X-D3(PCM)/6-31+G(d,p) level. d, A DFT-computed energy …","https://www.researchgate.net/profile/Weijin-Wang-3/publication/338128329_DMSO-catalysed_late-stage_chlorination_of_heteroarenes/links/5e68a3c44585153fb3d5fa52/DMSO-catalysed-late-stage-chlorination-of-heteroarenes.pdf","https://scholar.google.com/scholar?q=related:zoKYjKBlIzEJ:scholar.google.com/&scioq=source:%22nature+catalysis%22+cross+coupling+dft&hl=en&as_sdt=0,5&as_vis=1"
125,"Y Zhou, F Wei, H Qi, Y Chai, L Cao, J Lin, Q Wan…","Peripheral-nitrogen effects on the Ru1 centre for highly efficient propane dehydrogenation",2022,"Nature Catalysis","nature.com","https://www.nature.com/articles/s41929-022-00885-1","https://scholar.google.com/scholar?cites=2570450774511846523&as_sdt=2005&sciodt=0,5&hl=en",136,"2025-05-05 18:15:52","","","","",,,,,125,41.67,16,8,3,"… Various experimental tests and density functional theory (DFT) calculations then unravel the critical role of peripheral N species from the inner and outer shell on the Ru 1 centre for the …","","https://scholar.google.com/scholar?q=related:ewRoT1wTrCMJ:scholar.google.com/&scioq=source:%22nature+catalysis%22+cross+coupling+dft&hl=en&as_sdt=0,5&as_vis=1"
3,"WJ Teh, E Romeo, S Xi, B Rowley, F Illas…","Selective electroreduction of acetylene to 1,3-butadiene on iodide-induced Cuδ+–Cu0 sites",2024,"Nature Catalysis","nature.com","https://www.nature.com/articles/s41929-024-01250-0","https://scholar.google.com/scholar?cites=7175714550356069695&as_sdt=2005&sciodt=0,5&hl=en",137,"2025-05-05 18:15:52","HTML","","","",,,,,3,3.00,1,6,1,"… Using density functional theory (DFT) calculations, we show that the presence of iodide helps preserve the partially oxidized copper sites. In addition, coadsorbed iodide species on the …","https://www.nature.com/articles/s41929-024-01250-0","https://scholar.google.com/scholar?q=related:P02Tb11ClWMJ:scholar.google.com/&scioq=source:%22nature+catalysis%22+cross+coupling+dft&hl=en&as_sdt=0,5&as_vis=1"
117,"H Yin, LQ Zheng, W Fang, YH Lai, N Porenta…","Nanometre-scale spectroscopic visualization of catalytic sites during a hydrogenation reaction on a Pd/Au bimetallic catalyst",2020,"Nature Catalysis","nature.com","https://www.nature.com/articles/s41929-020-00511-y","https://scholar.google.com/scholar?cites=7160872409527323728&as_sdt=2005&sciodt=0,5&hl=en",138,"2025-05-05 18:15:52","","","","",,,,,117,23.40,20,6,5,"… Here we combine ambient STM-TERS and density functional theory (DFT) to study the selective hydrogenation of chloronitrobenzenethiol (CNBT) to chloroaminobenzenethiol (CABT) …","https://www.research-collection.ethz.ch/bitstream/handle/20.500.11850/442395/1/RevisedManuscript-200922.pdf","https://scholar.google.com/scholar?q=related:UIzFO4SHYGMJ:scholar.google.com/&scioq=source:%22nature+catalysis%22+cross+coupling+dft&hl=en&as_sdt=0,5&as_vis=1"
8,"S Jin, C Kwon, A Bugaev, B Karakurt, YC Lin…","Atom-by-atom design of Cu/ZrOx clusters on MgO for CO2 hydrogenation using liquid-phase atomic layer deposition",2024,"Nature Catalysis","nature.com","https://www.nature.com/articles/s41929-024-01236-y","https://scholar.google.com/scholar?cites=6834119081902959755&as_sdt=2005&sciodt=0,5&hl=en",139,"2025-05-05 18:15:52","","","","",,,,,8,8.00,1,6,1,"… of our density functional theory (DFT) model. Upon H adsorption on Cu and Zr atoms of Cu/MgOZrO 2 , we found that the formation of b-formate was energetically favourable over that of …","https://www.dora.lib4ri.ch/psi/islandora/object/psi%3A66815/datastream/PDF2/Jin-2024-Atom-by-atom_design_of_Cu-ZrOx_clusters-%28accepted_version%29.pdf","https://scholar.google.com/scholar?q=related:i2yLpRir114J:scholar.google.com/&scioq=source:%22nature+catalysis%22+cross+coupling+dft&hl=en&as_sdt=0,5&as_vis=1"
109,"K Qi, Y Zhang, N Onofrio, E Petit, X Cui, J Ma, J Fan…","Unlocking direct CO2 electrolysis to C3 products via electrolyte supersaturation",2023,"Nature Catalysis","nature.com","https://www.nature.com/articles/s41929-023-00938-z","https://scholar.google.com/scholar?cites=8769874969867222935&as_sdt=2005&sciodt=0,5&hl=en",140,"2025-05-05 18:15:52","","","","",,,,,109,54.50,14,8,2,"… Finally, we used density functional theory (DFT) calculations to elucidate the critical role of silver atoms in orienting the reaction towards the formation of 2-propanol over 1-propanol. …","https://hal.umontpellier.fr/hal-04095481/document","https://scholar.google.com/scholar?q=related:l3-G_9HatHkJ:scholar.google.com/&scioq=source:%22nature+catalysis%22+cross+coupling+dft&hl=en&as_sdt=0,5&as_vis=1"
87,"Q Wang, H Wang, H Cao, CW Tung, W Liu, SF Hung…","Atomic metal–non-metal catalytic pair drives efficient hydrogen oxidation catalysis in fuel cells",2023,"Nature Catalysis","nature.com","https://www.nature.com/articles/s41929-023-01017-z","https://scholar.google.com/scholar?cites=10637264453523559991&as_sdt=2005&sciodt=0,5&hl=en",141,"2025-05-05 18:15:52","","","","",,,,,87,43.50,12,7,2,"… In this study, we present structurally uniform catalytic pairs (CPs) consisting of coupled … spectroscopic measurements and density functional theory (DFT) calculations unambiguously …","","https://scholar.google.com/scholar?q=related:N1Ypbqknn5MJ:scholar.google.com/&scioq=source:%22nature+catalysis%22+cross+coupling+dft&hl=en&as_sdt=0,5&as_vis=1"
46,"Q Zhu, CL Rooney, H Shema, C Zeng, JA Panetier…","The solvation environment of molecularly dispersed cobalt phthalocyanine determines methanol selectivity during electrocatalytic CO2 reduction",2024,"Nature Catalysis","nature.com","https://www.nature.com/articles/s41929-024-01190-9","https://scholar.google.com/scholar?cites=14201162528333903688&as_sdt=2005&sciodt=0,5&hl=en",142,"2025-05-05 18:15:52","","","","",,,,,46,46.00,8,6,1,"… Combining evidence from in situ SFG spectroscopy and DFT calculations, here we provide a schematic to explain the interfacial structure associated with the CoPc/CNT hybrid catalyst …","","https://scholar.google.com/scholar?q=related:SDfuGhSqFMUJ:scholar.google.com/&scioq=source:%22nature+catalysis%22+cross+coupling+dft&hl=en&as_sdt=0,5&as_vis=1"
41,"M Andersen","Revelations of the d band",2023,"Nature Catalysis","nature.com","https://www.nature.com/articles/s41929-023-00964-x","https://scholar.google.com/scholar?cites=4325757331177318217&as_sdt=2005&sciodt=0,5&hl=en",143,"2025-05-05 18:15:52","","","","",,,,,41,20.50,41,1,2,"… density functional theory (DFT). Indeed, the late 80s and early 90s had seen the development of DFT … Riding on these waves, several researchers had started using DFT-GGA methods …","","https://scholar.google.com/scholar?q=related:SaddtV8tCDwJ:scholar.google.com/&scioq=source:%22nature+catalysis%22+cross+coupling+dft&hl=en&as_sdt=0,5&as_vis=1"
28,"R Jiang, QR Zhao, C Zheng, SL You","Structurally defined anti-π-allyliridium complexes catalyse Z-retentive asymmetric allylic alkylation of oxindoles",2022,"Nature Catalysis","nature.com","https://www.nature.com/articles/s41929-022-00879-z","https://scholar.google.com/scholar?cites=9935638313082319643&as_sdt=2005&sciodt=0,5&hl=en",144,"2025-05-05 18:15:52","","","","",,,,,28,9.33,7,4,3,"The enantioselective synthesis of chiral Z-olefins is an important but challenging topic in organic chemistry. Iridium-catalysed Z-retentive asymmetric allylic substitution reactions have …","","https://scholar.google.com/scholar?q=related:G3MIjGd64okJ:scholar.google.com/&scioq=source:%22nature+catalysis%22+cross+coupling+dft&hl=en&as_sdt=0,5&as_vis=1"
135,"H Robatjazi, JL Bao, M Zhang, L Zhou, P Christopher…","Plasmon-driven carbon–fluorine (C(sp3)–F) bond activation with mechanistic insights into hot-carrier-mediated pathways",2020,"Nature Catalysis","nature.com","https://www.nature.com/articles/s41929-020-0466-5","https://scholar.google.com/scholar?cites=4871698213084794995&as_sdt=2005&sciodt=0,5&hl=en",145,"2025-05-05 18:15:52","","","","",,,,,135,27.00,23,6,5,"The activation of carbon–fluorine bonds is an industrially and environmentally critical, but energetically challenging, transformation. Here we demonstrate a plasmonic photocatalysis …","","https://scholar.google.com/scholar?q=related:cxDTo7a_m0MJ:scholar.google.com/&scioq=source:%22nature+catalysis%22+cross+coupling+dft&hl=en&as_sdt=0,5&as_vis=1"
149,"BH Lee, H Shin, AS Rasouli, H Choubisa, P Ou…","Supramolecular tuning of supported metal phthalocyanine catalysts for hydrogen peroxide electrosynthesis",2023,"Nature Catalysis","nature.com","https://www.nature.com/articles/s41929-023-00924-5","https://scholar.google.com/scholar?cites=6515647937615827698&as_sdt=2005&sciodt=0,5&hl=en",146,"2025-05-05 18:15:52","","","","",,,,,149,74.50,25,6,2,"… All the density functional theory (DFT) calculations were spin-polarized and performed using VASP 45 software package. AW pseudopotentials 46 and GGA 47 exchange-correlation (xc…","https://utoronto.scholaris.ca/bitstreams/eb19b04f-fb72-4c26-96e4-a59158635d1f/download","https://scholar.google.com/scholar?q=related:8hIZI0c7bFoJ:scholar.google.com/&scioq=source:%22nature+catalysis%22+cross+coupling+dft&hl=en&as_sdt=0,5&as_vis=1"
47,"V Paunović, P Hemberger, A Bodi, N López…","Evidence of radical chemistry in catalytic methane oxybromination",2018,"Nature Catalysis","nature.com","https://www.nature.com/articles/s41929-018-0071-z","https://scholar.google.com/scholar?cites=14929776881023807362&as_sdt=2005&sciodt=0,5&hl=en",147,"2025-05-05 18:15:52","","","","",,,,,47,6.71,9,5,7,"… , which is rationalized by density functional theory calculations. The findings emphasize the role of … Density functional theory (DFT) strengthens the understanding of the surface and gas-…","https://recercat.cat/bitstream/handle/2072/359769/10.1038@s41929-018-0071-z.pdf?sequence=1","https://scholar.google.com/scholar?q=related:gm9D0fg4Mc8J:scholar.google.com/&scioq=source:%22nature+catalysis%22+cross+coupling+dft&hl=en&as_sdt=0,5&as_vis=1"
16,"M Klingenhof, H Trzesniowski, S Koch, J Zhu, Z Zeng…","High-performance anion-exchange membrane water electrolysers using NiX (X= Fe, Co, Mn) catalyst-coated membranes with redox-active Ni–O ligands",2024,"Nature Catalysis","nature.com","https://www.nature.com/articles/s41929-024-01238-w","https://scholar.google.com/scholar?cites=14927691298348353926&as_sdt=2005&sciodt=0,5&hl=en",148,"2025-05-05 18:15:52","","","","",,,,,16,16.00,3,6,1,"… To elucidate the chemical and geometric origin and identity of the O-529eV species in γ-LDH phases, we carried out DFT predictions of absorption spectra of Ni-based LDH catalysts. …","https://www.researchgate.net/profile/Malte-Klingenhof/publication/385320115_High-performance_anion-exchange_membrane_water_electrolysers_using_NiX_X_FeCoMn_catalyst-coated_membranes_with_redox-active_Ni-O_ligands/links/6790f97982501639f504868c/High-performance-anion-exchange-membrane-water-electrolysers-using-NiX-X-Fe-Co-Mn-catalyst-coated-membranes-with-redox-active-Ni-O-ligands.pdf","https://scholar.google.com/scholar?q=related:hkm-QiXQKc8J:scholar.google.com/&scioq=source:%22nature+catalysis%22+cross+coupling+dft&hl=en&as_sdt=0,5&as_vis=1"
1417,"BHR Suryanto, HL Du, D Wang, J Chen, AN Simonov…","Challenges and prospects in the catalysis of electroreduction of nitrogen to ammonia",2019,"Nature Catalysis","nature.com","https://www.nature.com/articles/s41929-019-0252-4","https://scholar.google.com/scholar?cites=4653203351968041578&as_sdt=2005&sciodt=0,5&hl=en",149,"2025-05-05 18:15:52","","","","",,,,,1417,236.17,236,6,6,"… However, some density functional theory (DFT) calculations reveal instances where both of the nitrogen atoms can be absorbed to the surface (*N–N*), which is predicted to be a more …","https://ro.uow.edu.au/articles/journal_contribution/Challenges_and_prospects_in_the_catalysis_of_electroreduction_of_nitrogen_to_ammonia/27758445/1/files/50521803.pdf","https://scholar.google.com/scholar?q=related:akq2fct_k0AJ:scholar.google.com/&scioq=source:%22nature+catalysis%22+cross+coupling+dft&hl=en&as_sdt=0,5&as_vis=1"
405,"Z Shen, X Jin, J Tian, M Li, Y Yuan, S Zhang, S Fang…","Cation-doped ZnS catalysts for polysulfide conversion in lithium–sulfur batteries",2022,"Nature Catalysis","nature.com","https://www.nature.com/articles/s41929-022-00804-4","https://scholar.google.com/scholar?cites=7027307928518616276&as_sdt=2005&sciodt=0,5&hl=en",150,"2025-05-05 18:15:52","","","","",,,,,405,135.00,51,8,3,"… Polysulfide adsorption was simulated and analysed using density functional theory (DFT, see Supplementary Note 2 for details of model construction). Figure 3a presents the binding …","https://itcc.nju.edu.cn/interface/publications/20.pdf","https://scholar.google.com/scholar?q=related:1GSjJlQDhmEJ:scholar.google.com/&scioq=source:%22nature+catalysis%22+cross+coupling+dft&hl=en&as_sdt=0,5&as_vis=1"
41,"Z Lian, F Dattila, N López","Stability and lifetime of diffusion-trapped oxygen in oxide-derived copper CO2 reduction electrocatalysts",2024,"Nature Catalysis","nature.com","https://www.nature.com/articles/s41929-024-01132-5","https://scholar.google.com/scholar?cites=7051332291190791827&as_sdt=2005&sciodt=0,5&hl=en",151,"2025-05-05 18:15:52","HTML","","","",,,,,41,41.00,14,3,1,"… To this end, we generated a DFT (Perdew–Burke–Ernzerhof functional and refitted DFT-D2 van der Waals parameters (PBE-D2; (refs. )) initial dataset with the most common Cu, Cu x O …","https://www.nature.com/articles/s41929-024-01132-5","https://scholar.google.com/scholar?q=related:kx6r-Vtd22EJ:scholar.google.com/&scioq=source:%22nature+catalysis%22+cross+coupling+dft&hl=en&as_sdt=0,5&as_vis=1"
72,"JYT Kim, C Sellers, S Hao, TP Senftle, H Wang","Different distributions of multi-carbon products in CO2 and CO electroreduction under practical reaction conditions",2023,"Nature Catalysis","nature.com","https://www.nature.com/articles/s41929-023-01082-4","https://scholar.google.com/scholar?cites=1924793322911440456&as_sdt=2005&sciodt=0,5&hl=en",152,"2025-05-05 18:15:52","","","","",,,,,72,36.00,14,5,2,"… 2 RR by combining transport models and density functional theory (DFT) (for example, Fig. 3b… Whereas DFT alone can be used to obtain energies related to many catalytic processes, in …","https://par.nsf.gov/servlets/purl/10562911","https://scholar.google.com/scholar?q=related:SB4uRlQ9thoJ:scholar.google.com/&scioq=source:%22nature+catalysis%22+cross+coupling+dft&hl=en&as_sdt=0,5&as_vis=1"
54,"B Zhao, J Feng, L Yu, Z Xing, B Chen, A Liu, F Liu…","Direct visible-light-excited flavoproteins for redox-neutral asymmetric radical hydroarylation",2023,"Nature Catalysis","nature.com","https://www.nature.com/articles/s41929-023-01024-0","https://scholar.google.com/scholar?cites=9190656303849337641&as_sdt=2005&sciodt=0,5&hl=en",153,"2025-05-05 18:15:52","","","","",,,,,54,27.00,7,8,2,"State-of-the-art non-natural photoenzymatic catalysis typically relies on either ultraviolet light activation or the formation of electron donor–acceptor complexes. Inspired by nature, …","","https://scholar.google.com/scholar?q=related:KfOk0zbFi38J:scholar.google.com/&scioq=source:%22nature+catalysis%22+cross+coupling+dft&hl=en&as_sdt=0,5&as_vis=1"
81,"G Righi, J Plescher, FP Schmidt, RK Campen…","On the origin of multihole oxygen evolution in haematite photoanodes",2022,"Nature Catalysis","nature.com","https://www.nature.com/articles/s41929-022-00845-9","https://scholar.google.com/scholar?cites=2176307745070444314&as_sdt=2005&sciodt=0,5&hl=en",154,"2025-05-05 18:15:52","HTML","","","",,,,,81,27.00,16,5,3,"… Simulations, mostly based on density functional theory (DFT), have contributed remarkably to our knowledge of the OER mechanism. Most of our current understanding is based on a …","https://www.nature.com/articles/s41929-022-00845-9","https://scholar.google.com/scholar?q=related:Gu_aEl3MMx4J:scholar.google.com/&scioq=source:%22nature+catalysis%22+cross+coupling+dft&hl=en&as_sdt=0,5&as_vis=1"
299,"T Zheng, M Zhang, L Wu, S Guo, X Liu, J Zhao…","Upcycling CO2 into energy-rich long-chain compounds via electrochemical and metabolic engineering",2022,"Nature Catalysis","nature.com","https://www.nature.com/articles/s41929-022-00775-6","https://scholar.google.com/scholar?cites=12894520258408704083&as_sdt=2005&sciodt=0,5&hl=en",155,"2025-05-05 18:15:52","","","","",,,,,299,99.67,43,7,3,"… was optimized by periodic density functional theory plus U (… using the empirical density functional theory plus D3 method. … (ΔE) obtained from density functional theory calculations, ΔZPE …","","https://scholar.google.com/scholar?q=related:U2iHX9uJ8rIJ:scholar.google.com/&scioq=source:%22nature+catalysis%22+cross+coupling+dft&hl=en&as_sdt=0,5&as_vis=1"
208,"H Zhou, Z Chen, AV López, ED López, E Lam…","Engineering the Cu/Mo2CTx (MXene) interface to drive CO2 hydrogenation to methanol",2021,"Nature Catalysis","nature.com","https://www.nature.com/articles/s41929-021-00684-0","https://scholar.google.com/scholar?cites=5738552255934550571&as_sdt=2005&sciodt=0,5&hl=en",156,"2025-05-05 18:15:52","","","","",,,,,208,52.00,35,6,4,"… To summarize, the DFT calculations highlight the likely intermediates and TS and allow to … Finally, the most strongly adsorbed reaction intermediates determined by our DFT calculations …","https://www.research-collection.ethz.ch/bitstream/handle/20.500.11850/512844/3/Nat.Catal.2021_acceptedversion.pdf","https://scholar.google.com/scholar?q=related:K9L-Y99uo08J:scholar.google.com/&scioq=source:%22nature+catalysis%22+cross+coupling+dft&hl=en&as_sdt=0,5&as_vis=1"
96,"Z Li, Y Xiao, PR Chowdhury, Z Wu, T Ma, JZ Chen…","Direct methane activation by atomically thin platinum nanolayers on two-dimensional metal carbides",2021,"Nature Catalysis","nature.com","https://www.nature.com/articles/s41929-021-00686-y","https://scholar.google.com/scholar?cites=8452922547381014939&as_sdt=2005&sciodt=0,5&hl=en",157,"2025-05-05 18:15:52","","","","",,,,,96,24.00,14,7,4,"… the NOCM reaction and side reactions were investigated using DFT (Fig. 4c). The structures … Our DFT results suggest that the free energy changes of all C–H bond scission steps on the …","https://www.osti.gov/pages/servlets/purl/1870841","https://scholar.google.com/scholar?q=related:mxGJdkXQTnUJ:scholar.google.com/&scioq=source:%22nature+catalysis%22+cross+coupling+dft&hl=en&as_sdt=0,5&as_vis=1"
49,"MG Lee, XY Li, A Ozden, J Wicks, P Ou, Y Li…","Selective synthesis of butane from carbon monoxide using cascade electrolysis and thermocatalysis at ambient conditions",2023,"Nature Catalysis","nature.com","https://www.nature.com/articles/s41929-023-00937-0","https://scholar.google.com/scholar?cites=5600028162711237601&as_sdt=2005&sciodt=0,5&hl=en",158,"2025-05-05 18:15:52","","","","",,,,,49,24.50,7,7,2,"… To further study selective C 4 H 10 generation under a CO-rich environment, we performed density functional theory (DFT) calculations by modelling a 5-atomic-layer 2 × 3 NiO(110) …","https://utoronto.scholaris.ca/bitstreams/26af48a1-3466-445c-bb08-14377efe9711/download","https://scholar.google.com/scholar?q=related:4TOWmvFLt00J:scholar.google.com/&scioq=source:%22nature+catalysis%22+cross+coupling+dft&hl=en&as_sdt=0,5&as_vis=1"
557,"J Li, MT Sougrati, A Zitolo, JM Ablett, IC Oğuz…","Identification of durable and non-durable FeNx sites in Fe–N–C materials for proton exchange membrane fuel cells",2021,"Nature Catalysis","nature.com","https://www.nature.com/articles/s41929-020-00545-2","https://scholar.google.com/scholar?cites=7536419583575848331&as_sdt=2005&sciodt=0,5&hl=en",159,"2025-05-05 18:15:52","","","","",,,,,557,139.25,93,6,4,"… To further support this, we applied our recently reported DFT … DFT-calculated QS for high-spin OH–Fe(III)–N 4 C 12 and high-spin Fe(II)–N 4 C 12 structures, demonstrating that our DFT …","https://hal.science/hal-02931434v2/file/Li2020_just_accepted.pdf","https://scholar.google.com/scholar?q=related:i_VVfa69lmgJ:scholar.google.com/&scioq=source:%22nature+catalysis%22+cross+coupling+dft&hl=en&as_sdt=0,5&as_vis=1"
