Cites,Authors,Title,Year,Source,Publisher,ArticleURL,CitesURL,GSRank,QueryDate,Type,DOI,ISSN,CitationURL,Volume,Issue,StartPage,EndPage,ECC,CitesPerYear,CitesPerAuthor,AuthorCount,Age,Abstract,FullTextURL,RelatedURL
11,"J Hossain, JS Gopinath, S Tothadi, ...","NHSi/NHGe-Supported Copper Halide and Pseudohalide Complexes: Synthesis and Application",2022,"…","ACS Publications","https://pubs.acs.org/doi/abs/10.1021/acs.organomet.2c00480","https://scholar.google.com/scholar?cites=337267003374691596&as_sdt=2005&sciodt=0,5&hl=en",492,"2025-05-18 17:50:09","","10.1021/acs.organomet.2c00480","","",,,,,11,3.67,3,4,3,"… The density functional theory studies indicate that the bimetallic Cu catalyst facilitates the cycloaddition reaction by anchoring the reactants to the close proximity and reducing the …","","https://scholar.google.com/scholar?q=related:DOWbeo02rgQJ:scholar.google.com/&scioq=source:organometallics+%221520+6041%22+metal+catalyzed+dft&hl=en&as_sdt=0,5&as_vis=1"
19,"X Xu, G Luo, A Mehmood, Y Zhao, G Zhou, Z Hou, ...","Theoretical mechanistic studies on redox-switchable polymerization of trimethylene carbonate catalyzed by an indium complex bearing a ferrocene-based ligand",2018,"…","ACS Publications","https://pubs.acs.org/doi/abs/10.1021/acs.organomet.8b00599","https://scholar.google.com/scholar?cites=13358775456486759169&as_sdt=2005&sciodt=0,5&hl=en",493,"2025-05-18 17:50:09","","10.1021/acs.organomet.8b00599","","",,,,,19,2.71,3,7,7,"… DFT method has been applied to investigate the mechanism of TMC polymerization catalyzed … of the catalytic metal center to the monomer and further on the subsequent reaction steps. …","","https://scholar.google.com/scholar?q=related:AZsZ9n_nY7kJ:scholar.google.com/&scioq=source:organometallics+%221520+6041%22+metal+catalyzed+dft&hl=en&as_sdt=0,5&as_vis=1"
179,"H Li, X Wang, F Huang, G Lu, J Jiang, ZX Wang","Computational study on the catalytic role of pincer ruthenium (II)-PNN complex in directly synthesizing amide from alcohol and amine: the origin of selectivity of amide …",2011,"Organometallics","ACS Publications","https://pubs.acs.org/doi/abs/10.1021/om200620n","https://scholar.google.com/scholar?cites=8357348656158393542&as_sdt=2005&sciodt=0,5&hl=en",494,"2025-05-18 17:50:09","","10.1021/om200620n","","",,,,,179,12.79,30,6,14,"… Density functional theory calculations have been performed to investigate the mechanism of the reactions of amines with primary alcohols to produce amides, catalyzed by the pincer …","","https://scholar.google.com/scholar?q=related:xsRo2lJE-3MJ:scholar.google.com/&scioq=source:organometallics+%221520+6041%22+metal+catalyzed+dft&hl=en&as_sdt=0,5&as_vis=1"
2,"S Saha, F Assanar, A Ahmad, A Bains, ...","Synthesis, Structure, and Bonding of Group 8 Transition Metal Germyl Complexes, [Cp*M{κ2-Ge,S-GeCl2C7H4NS2}(PPh3)] (M = Ru or Os)",2024,"…","ACS Publications","https://pubs.acs.org/doi/abs/10.1021/acs.organomet.3c00495","https://scholar.google.com/scholar?cites=555257470051579480&as_sdt=2005&sciodt=0,5&hl=en",495,"2025-05-18 17:50:09","","10.1021/acs.organomet.3c00495","","",,,,,2,2.00,0,5,1,"… To investigate the bonding modes of these complexes, density functional theory (DFT) … germyl complexes, 2a and 2b density functional theory (DFT) calculations were conducted for …","","https://scholar.google.com/scholar?q=related:WHZOJbqrtAcJ:scholar.google.com/&scioq=source:organometallics+%221520+6041%22+metal+catalyzed+dft&hl=en&as_sdt=0,5&as_vis=1"
6,"W Yao, G Olajide, CM Boudreaux, MM Wysocki, ...","Cobalt(I) Pincer Complexes as Catalysts for CO2 Hydrogenation to Formate",2024,"…","ACS Publications","https://pubs.acs.org/doi/abs/10.1021/acs.organomet.4c00161","https://scholar.google.com/scholar?cites=7661216929283810827&as_sdt=2005&sciodt=0,5&hl=en",496,"2025-05-18 17:50:09","","10.1021/acs.organomet.4c00161","","",,,,,6,6.00,1,5,1,"… DFT-derived reaction mechanism for CO 2 hydrogenation using 1 as the catalyst. All calculations were done at the DLPNO–CCSD(T)(SMD = THF)/def2-TZVPP//ωB97X-D(SMD = THF)/…","https://chemrxiv.org/engage/api-gateway/chemrxiv/assets/orp/resource/item/6626a61921291e5d1d6553f9/original/cobalt-i-pincer-complexes-as-catalysts-for-co2-hydrogenation-to-formate.pdf","https://scholar.google.com/scholar?q=related:C6Yr0TQcUmoJ:scholar.google.com/&scioq=source:organometallics+%221520+6041%22+metal+catalyzed+dft&hl=en&as_sdt=0,5&as_vis=1"
63,"A Manzoor, P Wienefeld, MC Baird, ...","Catalysis of cross-coupling and homocoupling reactions of aryl halides utilizing Ni (0), Ni (I), and Ni (II) precursors; Ni (0) compounds as the probable catalytic species …",2017,"…","ACS Publications","https://pubs.acs.org/doi/abs/10.1021/acs.organomet.7b00446","https://scholar.google.com/scholar?cites=13304272528179442762&as_sdt=2005&sciodt=0,5&hl=en",497,"2025-05-18 17:50:09","","10.1021/acs.organomet.7b00446","","",,,,,63,7.88,16,4,8,"… in nickel if carried out in the presence of zinc dust, which would convert the Ni(I) product to Ni(0) catalyst. We have carried out DFT calculations to assess the feasibility of these …","","https://scholar.google.com/scholar?q=related:SrQfFWBForgJ:scholar.google.com/&scioq=source:organometallics+%221520+6041%22+metal+catalyzed+dft&hl=en&as_sdt=0,5&as_vis=1"
10,"J Morvan, F Vermersch, Z Zhang, T Vives, ...","Ambivalent role of rotamers in cyclic (alkyl)(amino) carbene ruthenium complexes for enantioselective ring-opening cross-metathesis",2023,"…","ACS Publications","https://pubs.acs.org/doi/abs/10.1021/acs.organomet.3c00054","https://scholar.google.com/scholar?cites=17984346957178625959&as_sdt=2005&sciodt=0,5&hl=en",498,"2025-05-18 17:50:09","","10.1021/acs.organomet.3c00054","","",,,,,10,5.00,2,5,2,"… insights and density functional theory (DFT) computations, we show that catalytic performances in … Using DFT, we also demonstrate that these results can help accelerate the process of …","https://hal.science/hal-04087525/file/2023-M.pdf","https://scholar.google.com/scholar?q=related:p18CvEU8lfkJ:scholar.google.com/&scioq=source:organometallics+%221520+6041%22+metal+catalyzed+dft&hl=en&as_sdt=0,5&as_vis=1"
37,"APC Ribeiro, LM Martins, ML Kuznetsov, ...","Tuning Cyclohexane Oxidation: Combination of Microwave Irradiation and Ionic Liquid with the C-Scorpionate [FeCl2(Tpm)] Catalyst",2017,"…","ACS Publications","https://pubs.acs.org/doi/abs/10.1021/acs.organomet.6b00620","https://scholar.google.com/scholar?cites=7152283781421951288&as_sdt=2005&sciodt=0,5&hl=en",499,"2025-05-18 17:50:09","","10.1021/acs.organomet.6b00620","","",,,,,37,4.63,9,4,8,"… Water, organics, and ionic liquids (ILs, [bmim][N(CN) 2 ] and [bmim][BF 4 ]) were used as solvents, and their interactions with 1 were determined by DFT calculations. The possibility to …","","https://scholar.google.com/scholar?q=related:OGlxbDQEQmMJ:scholar.google.com/&scioq=source:organometallics+%221520+6041%22+metal+catalyzed+dft&hl=en&as_sdt=0,5&as_vis=1"
14,"J Liu, SA Johnson","Mechanism of 8-Aminoquinoline-Directed Ni-Catalyzed C(sp3)–H Functionalization: Paramagnetic Ni(II) Species and the Deleterious Effect of Carbonate as a Base",2021,"Organometallics","ACS Publications","https://pubs.acs.org/doi/abs/10.1021/acs.organomet.1c00265","https://scholar.google.com/scholar?cites=5063219927204616553&as_sdt=2005&sciodt=0,5&hl=en",500,"2025-05-18 17:50:09","","10.1021/acs.organomet.1c00265","","",,,,,14,3.50,7,2,4,"… catalytic functionalization, which counter to DFT predictions involves neither the expected C–H activation nor Ni(II)–Ni(IV) oxidative addition, but rather the deprotonation step, when Na …","https://chemrxiv.org/engage/api-gateway/chemrxiv/assets/orp/resource/item/60c754904c89191b03ad4560/original/mechanism-of-8-aminoquinoline-directed-ni-catalyzed-c-sp3-h-functionalization-paramagnetic-ni-ii-species-and-the-deleterious-effect-of-na2co3-as-a-base.pdf","https://scholar.google.com/scholar?q=related:adm1nLIrREYJ:scholar.google.com/&scioq=source:organometallics+%221520+6041%22+metal+catalyzed+dft&hl=en&as_sdt=0,5&as_vis=1"
11,"R Pradhan, KL Gutman, A Mas Ud, EB Hulley, ...","Catalytic carboxylation of terminal alkynes with copper (I) azothioformamide complexes",2023,"…","ACS Publications","https://pubs.acs.org/doi/abs/10.1021/acs.organomet.2c00546","https://scholar.google.com/scholar?cites=13957929317598428428&as_sdt=2005&sciodt=0,5&hl=en",501,"2025-05-18 17:50:09","","10.1021/acs.organomet.2c00546","","",,,,,11,5.50,2,5,2,"… an entry point for the investigation of these metal/ligand systems as the reactions have been … density functional theory (DFT) calculations, provides insight into the copper(I)-catalyzed …","","https://scholar.google.com/scholar?q=related:DP12F8OGtMEJ:scholar.google.com/&scioq=source:organometallics+%221520+6041%22+metal+catalyzed+dft&hl=en&as_sdt=0,5&as_vis=1"
852,"L Falivene, R Credendino, A Poater, A Petta, ...","SambVca 2. A web tool for analyzing catalytic pockets with topographic steric maps",2016,"…","ACS Publications","https://pubs.acs.org/doi/abs/10.1021/acs.organomet.6b00371","https://scholar.google.com/scholar?cites=13907061455954790161&as_sdt=2005&sciodt=0,5&hl=en",502,"2025-05-18 17:50:09","","10.1021/acs.organomet.6b00371","","",,,,,852,94.67,170,5,9,"… Figure 10 was an exception because bulkiness is not given by groups directly bound to the metal. The value of 3.5 Å was selected as the optimal value to correlate the DFT dimerization …","https://pubs.acs.org/doi/full/10.1021/acs.organomet.6b00371","https://scholar.google.com/scholar?q=related:EUe2H7bO_8AJ:scholar.google.com/&scioq=source:organometallics+%221520+6041%22+metal+catalyzed+dft&hl=en&as_sdt=0,5&as_vis=1"
17,"C Cesari, R Mazzoni, E Matteucci, A Baschieri, ...","Hydrogen Transfer Activation via Stabilization of Coordinatively Vacant Sites: Tuning Long-Range π-System Electronic Interaction between Ru (0) and NHC Pendants",2019,"…","ACS Publications","https://pubs.acs.org/doi/abs/10.1021/acs.organomet.8b00850","https://scholar.google.com/scholar?cites=15790104666495591373&as_sdt=2005&sciodt=0,5&hl=en",503,"2025-05-18 17:50:09","","10.1021/acs.organomet.8b00850","","",,,,,17,2.83,3,5,6,"… mechanism for the transfer hydrogenation promoted by 1N catalyst exploiting the reliable and efficient in situ FT-ATR technique in synergy with catalytic results and DFT calculations. …","","https://scholar.google.com/scholar?q=related:zSO13Ii4IdsJ:scholar.google.com/&scioq=source:organometallics+%221520+6041%22+metal+catalyzed+dft&hl=en&as_sdt=0,5&as_vis=1"
12,"L Pavlovic, LN Mendelsohn, H Zhong, PJ Chirik, ...","Cobalt-Catalyzed Asymmetric Hydrogenation of Enamides: Insights into Mechanisms and Solvent Effects",2022,"…","ACS Publications","https://pubs.acs.org/doi/abs/10.1021/acs.organomet.2c00180","https://scholar.google.com/scholar?cites=2057695732198058426&as_sdt=2005&sciodt=0,5&hl=en",504,"2025-05-18 17:50:09","","10.1021/acs.organomet.2c00180","","",,,,,12,4.00,2,5,3,"… The overall DFT and experimental results draw a complex mechanistic picture about ( Ph BPE)Co-catalyzed hydrogenation of enamides. However, by combining the different insights, …","https://pubs.acs.org/doi/full/10.1021/acs.organomet.2c00180","https://scholar.google.com/scholar?q=related:uqmAxV1njhwJ:scholar.google.com/&scioq=source:organometallics+%221520+6041%22+metal+catalyzed+dft&hl=en&as_sdt=0,5&as_vis=1"
15,"T Shi, Y Luo, XL Wang, S Lu, YL Zhao, J Zhang","Theoretical studies on the mechanism, enantioselectivity, and axial ligand effect of a Ru (salen)-catalyzed asymmetric cyclopropanation reaction",2014,"Organometallics","ACS Publications","https://pubs.acs.org/doi/abs/10.1021/om400956z","https://scholar.google.com/scholar?cites=14273729081602124914&as_sdt=2005&sciodt=0,5&hl=en",505,"2025-05-18 17:50:09","","10.1021/om400956z","","",,,,,15,1.36,3,6,11,"… To fully understand the reaction mechanism of the Ru-catalyzed cyclopropanation of styrene with EDA, we employ DFT methods to investigate the electronic structure and energetics …","http://life.sjtu.edu.cn/teacher/assets/userfiles/files/Net/20190902184930610/Files/20191010/6370630211659754986053351.pdf","https://scholar.google.com/scholar?q=related:cqwOafl4FsYJ:scholar.google.com/&scioq=source:organometallics+%221520+6041%22+metal+catalyzed+dft&hl=en&as_sdt=0,5&as_vis=1"
59,"MK Karunananda, SR Parmelee, GW Waldhart, ...","Experimental and computational characterization of the transition state for C–X bimetallic oxidative addition at a Cu–Fe reaction center",2015,"…","ACS Publications","https://pubs.acs.org/doi/abs/10.1021/acs.organomet.5b00476","https://scholar.google.com/scholar?cites=5061602398705855845&as_sdt=2005&sciodt=0,5&hl=en",506,"2025-05-18 17:50:09","","10.1021/acs.organomet.5b00476","","",,,,,59,5.90,15,4,10,"The heterobimetallic complex (IPr)Cu-Fp (IPr = N,N′-bis(2,6-diisopropylimidazol-2-ylidene, Fp = FeCp(CO) 2 ) was identified previously as a nonprecious metal catalyst for C–H …","","https://scholar.google.com/scholar?q=related:Za0gaZBsPkYJ:scholar.google.com/&scioq=source:organometallics+%221520+6041%22+metal+catalyzed+dft&hl=en&as_sdt=0,5&as_vis=1"
107,"A Scarso, M Colladon, P Sgarbossa, C Santo, ...","Highly Active and Selective Platinum(II)-Catalyzed Isomerization of Allylbenzenes: Efficient Access to (E)-Anethole and Other Fragrances via Unusual Agostic …",2010,"…","ACS Publications","https://pubs.acs.org/doi/abs/10.1021/om100033a","https://scholar.google.com/scholar?cites=4205261040435935635&as_sdt=2005&sciodt=0,5&hl=en",507,"2025-05-18 17:50:09","","10.1021/om100033a","","",,,,,107,7.13,21,5,15,"… DFT calculations on the possible agostic intermediates shed light on their structure and enable the formulation of a possible catalytic … kinetic studies and DFT calculations enable the …","","https://scholar.google.com/scholar?q=related:kzn5xqIWXDoJ:scholar.google.com/&scioq=source:organometallics+%221520+6041%22+metal+catalyzed+dft&hl=en&as_sdt=0,5&as_vis=1"
20,"V San Nacianceno, MA Garralda, JM Matxain, ...","Proton-responsive ruthenium (ii) catalysts for the solvolysis of ammonia-borane",2020,"…","ACS Publications","https://pubs.acs.org/doi/abs/10.1021/acs.organomet.0c00032","https://scholar.google.com/scholar?cites=7576341563426943011&as_sdt=2005&sciodt=0,5&hl=en",508,"2025-05-18 17:50:09","","10.1021/acs.organomet.0c00032","","",,,,,20,4.00,5,4,5,"… On the basis of catalytic evidence combined with NMR spectroscopic studies and DFT calculations, we proposed that two pH-interrelated catalytic cycles operate in a single run. …","http://pstorage-acs-6854636.s3.amazonaws.com/21979911/om0c00032_si_001.pdf","https://scholar.google.com/scholar?q=related:IzAXwYKSJGkJ:scholar.google.com/&scioq=source:organometallics+%221520+6041%22+metal+catalyzed+dft&hl=en&as_sdt=0,5&as_vis=1"
10,"X Zhang, S Zhou, D Wang, L Zhang, Y Wei, ...","Syntheses of rare-earth metal alkyl complexes bearing a dianionic α-iminopyridyl ligand and their catalytic activities toward polymerization of 2-vinylpyridine",2021,"…","ACS Publications","https://pubs.acs.org/doi/abs/10.1021/acs.organomet.1c00470","https://scholar.google.com/scholar?cites=9099680282191494680&as_sdt=2005&sciodt=0,5&hl=en",509,"2025-05-18 17:50:09","","10.1021/acs.organomet.1c00470","","",,,,,10,2.50,2,6,4,"… in P2VP was investigated by density functional theory (DFT) calculations. Considering that all the dinuclear complexes 2a–2f could effectively catalyze 2-VP polymerization with the …","","https://scholar.google.com/scholar?q=related:GH6mJQGPSH4J:scholar.google.com/&scioq=source:organometallics+%221520+6041%22+metal+catalyzed+dft&hl=en&as_sdt=0,5&as_vis=1"
22,"A Ariafard","Computational mechanistic study of palladium (II)-catalyzed carboxyalkynylation of an olefin using an iodine (III) oxidant reagent",2014,"Organometallics","ACS Publications","https://pubs.acs.org/doi/abs/10.1021/om5011758","https://scholar.google.com/scholar?cites=14263685289920840235&as_sdt=2005&sciodt=0,5&hl=en",510,"2025-05-18 17:50:09","","10.1021/om5011758","","",,,,,22,2.00,22,1,11,"… (II)-catalyzed carboxyalkynylation of an olefin using an alkynyl benziodoxolone reagent was elucidated with the aid of density functional theory calculations. The catalytic reaction was …","","https://scholar.google.com/scholar?q=related:K0Ky7TLK8sUJ:scholar.google.com/&scioq=source:organometallics+%221520+6041%22+metal+catalyzed+dft&hl=en&as_sdt=0,5&as_vis=1"
18,"PK Vardhanapu, V Bheemireddy, M Bhunia, ...","Cyclic (Alkyl) amino Carbene Complex of Aluminum (III) in Catalytic Guanylation Reaction of Carbodiimides",2018,"…","ACS Publications","https://pubs.acs.org/doi/abs/10.1021/acs.organomet.8b00358","https://scholar.google.com/scholar?cites=3503164843941412088&as_sdt=2005&sciodt=0,5&hl=en",511,"2025-05-18 17:50:09","","10.1021/acs.organomet.8b00358","","",,,,,18,2.57,5,4,7,"… We undertook a density functional theory (DFT) study to understand further details on this step. DFT study suggests that path b, leading to formation of intermediate 11, is more favorable …","https://www.researchgate.net/profile/Pavan-Kumar-Vardhanapu/publication/363209755_Cyclic_Alkylamino_Carbene_Complex_of_AluminumIII_in_Catalytic_Guanylation_Reaction_of_Carbodiimides/links/631184b55eed5e4bd13bfba8/Cyclic-Alkylamino-Carbene-Complex-of-AluminumIII-in-Catalytic-Guanylation-Reaction-of-Carbodiimides.pdf","https://scholar.google.com/scholar?q=related:-LzDcN29nTAJ:scholar.google.com/&scioq=source:organometallics+%221520+6041%22+metal+catalyzed+dft&hl=en&as_sdt=0,5&as_vis=1"
109,"N Solin, KJ Szabó","Mechanism of the η3−η1−η3 Isomerization in Allylpalladium Complexes:  Solvent Coordination, Ligand, and Substituent Effects",2001,"Organometallics","ACS Publications","https://pubs.acs.org/doi/abs/10.1021/om010793d","https://scholar.google.com/scholar?cites=793329018912131879&as_sdt=2005&sciodt=0,5&hl=en",512,"2025-05-18 17:50:09","","10.1021/om010793d","","",,,,,109,4.54,55,2,24,"… as catalytic intermediates in important synthetic transformations has been studied by applying density functional theory at the B3PW91(DZ+P) level. It was found that under catalytic …","","https://scholar.google.com/scholar?q=related:J0tEGop4AgsJ:scholar.google.com/&scioq=source:organometallics+%221520+6041%22+metal+catalyzed+dft&hl=en&as_sdt=0,5&as_vis=1"
34,"BJ Anding, J Brgoch, GJ Miller, LK Woo","C–H Insertion Catalyzed by Tetratolylporphyrinato Methyliridium via a Metal–Carbene Intermediate",2012,"Organometallics","ACS Publications","https://pubs.acs.org/doi/abs/10.1021/om3005433","https://scholar.google.com/scholar?cites=8584926432395494499&as_sdt=2005&sciodt=0,5&hl=en",513,"2025-05-18 17:50:09","","10.1021/om3005433","","",,,,,34,2.62,9,4,13,"… To validate that the changes observed in the absorption spectra arose from the formation of a carbene complex, time-dependent density functional theory (TD-DFT) was used to …","","https://scholar.google.com/scholar?q=related:Y4TL-RrJI3cJ:scholar.google.com/&scioq=source:organometallics+%221520+6041%22+metal+catalyzed+dft&hl=en&as_sdt=0,5&as_vis=1"
41,"MG Timerbulatova, MRD Gatus, KQ Vuong, ...","Bimetallic complexes for enhancing catalyst efficiency: probing the relationship between activity and intermetallic distance",2013,"…","ACS Publications","https://pubs.acs.org/doi/abs/10.1021/om4005059","https://scholar.google.com/scholar?cites=1962739333635677058&as_sdt=2005&sciodt=0,5&hl=en",514,"2025-05-18 17:50:09","","10.1021/om4005059","","",,,,,41,3.42,10,4,12,"… DFT calculations on the structures of bimetallic catalysts 4–6, 8, and 9 were performed to assess the role of metal–metal separation in catalyst activity. Although the anticipated …","","https://scholar.google.com/scholar?q=related:gpsKYAYNPRsJ:scholar.google.com/&scioq=source:organometallics+%221520+6041%22+metal+catalyzed+dft&hl=en&as_sdt=0,5&as_vis=1"
1,"LF Yao, L Zhang, DC Fang","Theoretical Exploration of Rh/Cu Cooperative Catalysis in C–H Allylation of Benzamide with 1, 3-Diene",2024,"Organometallics","ACS Publications","https://pubs.acs.org/doi/abs/10.1021/acs.organomet.3c00418","https://scholar.google.com/scholar?cites=934677221054800974&as_sdt=2005&sciodt=0,5&hl=en",515,"2025-05-18 17:50:09","","10.1021/acs.organomet.3c00418","","",,,,,1,1.00,0,3,1,"… Owing to the increasing importance of the rhodium-catalyzed reactions, especially with external oxidant Cu(OAc) 2 (refer to Scheme 1), we employed DFT studies to investigate intricate …","","https://scholar.google.com/scholar?q=related:TuSe_Pqj-AwJ:scholar.google.com/&scioq=source:organometallics+%221520+6041%22+metal+catalyzed+dft&hl=en&as_sdt=0,5&as_vis=1"
44,"W Guo, C Michel, R Schwiedernoch, R Wischert, ...","Formation of Acrylates from Ethylene and CO2 on Ni Complexes: A Mechanistic Viewpoint from a Hybrid DFT Approach",2014,"…","ACS Publications","https://pubs.acs.org/doi/abs/10.1021/om5006808","https://scholar.google.com/scholar?cites=2311634596872350009&as_sdt=2005&sciodt=0,5&hl=en",516,"2025-05-18 17:50:09","","10.1021/om5006808","","",,,,,44,4.00,9,5,11,"The most challenging step in the production of acrylates from ethylene and CO 2 mediated by transition-metal complexes is the release of the acrylate from the metallalactone …","","https://scholar.google.com/scholar?q=related:OWkUFWuTFCAJ:scholar.google.com/&scioq=source:organometallics+%221520+6041%22+metal+catalyzed+dft&hl=en&as_sdt=0,5&as_vis=1"
111,"LR Moore, EC Western, R Craciun, JM Spruell, ...","Sterically demanding, sulfonated, triarylphosphines: Application to palladium-catalyzed cross-coupling, steric and electronic properties, and coordination chemistry",2008,"…","ACS Publications","https://pubs.acs.org/doi/abs/10.1021/om7008606","https://scholar.google.com/scholar?cites=15937207140180007986&as_sdt=2005&sciodt=0,5&hl=en",517,"2025-05-18 17:50:09","","10.1021/om7008606","","",,,,,111,6.53,22,5,17,"… In the Heck coupling, TXPTS·Na 3 provides the most effective catalyst system. Cone angles determined from DFT-optimized structures show that both TXPTS·Na 3 (206) and TMAPTS·…","http://pstorage-acs-6854636.s3.amazonaws.com/4654540/om7008606_si_001.pdf","https://scholar.google.com/scholar?q=related:Mpw_fnRVLN0J:scholar.google.com/&scioq=source:organometallics+%221520+6041%22+metal+catalyzed+dft&hl=en&as_sdt=0,5&as_vis=1"
15,"K Farshadfar, A Chipman, M Hosseini, BF Yates, ...","A Modified Cationic Mechanism for PdCl2-Catalyzed Transformation of a Homoallylic Alcohol to an Allyl Ether",2019,"…","ACS Publications","https://pubs.acs.org/doi/abs/10.1021/acs.organomet.9b00276","https://scholar.google.com/scholar?cites=14661569909130674071&as_sdt=2005&sciodt=0,5&hl=en",518,"2025-05-18 17:50:09","","10.1021/acs.organomet.9b00276","","",,,,,15,2.50,3,5,6,"… Density functional theory calculations were utilized to investigate a PdCl 2 -catalyzed transformation involving double-bond migration (alkene isomerization), followed by condensation …","https://www.academia.edu/download/94058849/acs.organomet.9b0027620221111-1-1k46i4t.pdf","https://scholar.google.com/scholar?q=related:lz9K6yZceMsJ:scholar.google.com/&scioq=source:organometallics+%221520+6041%22+metal+catalyzed+dft&hl=en&as_sdt=0,5&as_vis=1"
167,"M Torrent, L Deng, M Duran, M Sola, T Ziegler","Density functional study of the [2+ 2]-and [2+ 3]-cycloaddition mechanisms for the osmium-catalyzed dihydroxylation of olefins",1997,"Organometallics","ACS Publications","https://pubs.acs.org/doi/abs/10.1021/om960783q","https://scholar.google.com/scholar?cites=7288315079151282447&as_sdt=2005&sciodt=0,5&hl=en",519,"2025-05-18 17:50:09","","10.1021/om960783q","","",,,,,167,5.96,33,5,28,"… The postulated intermediates in the base-free and base-assisted addition of OsO 4 to olefins have been optimized using density functional theory (DFT). Ammonia was chosen as the …","","https://scholar.google.com/scholar?q=related:D2nvB_NLJWUJ:scholar.google.com/&scioq=source:organometallics+%221520+6041%22+metal+catalyzed+dft&hl=en&as_sdt=0,5&as_vis=1"
50,"LOC Sraj, GN Khairallah, G da Silva, ...","Who wins: Pesci, Peters, or Deacon? Intrinsic reactivity orders for organocuprate formation via ligand decomposition",2012,"Organometallics","ACS Publications","https://pubs.acs.org/doi/abs/10.1021/om2011722","https://scholar.google.com/scholar?cites=9861065121682769414&as_sdt=2005&sciodt=0,5&hl=en",520,"2025-05-18 17:50:09","","10.1021/om2011722","","",,,,,50,3.85,13,4,13,"… in an ion trap mass spectrometer and DFT calculations was used. Simple ligand competition … This is consistent with DFT calculations at the M06/SDD/cc-pVTZ//M06/cc-pVDZ level of …","","https://scholar.google.com/scholar?q=related:BkblZHuK2YgJ:scholar.google.com/&scioq=source:organometallics+%221520+6041%22+metal+catalyzed+dft&hl=en&as_sdt=0,5&as_vis=1"
167,"MV Jimenez, J Fernández-Tornos, ...","Iridium (I) complexes with hemilabile N-heterocyclic carbenes: efficient and versatile transfer hydrogenation catalysts",2011,"…","ACS Publications","https://pubs.acs.org/doi/abs/10.1021/om200747k","https://scholar.google.com/scholar?cites=399942293645377931&as_sdt=2005&sciodt=0,5&hl=en",521,"2025-05-18 17:50:09","","10.1021/om200747k","","",,,,,167,11.93,56,3,14,"… Fragment: DFT Calculations In order to understand the superior catalytic activity of the … key steps of the proposed mechanism by DFT calculations. The unsaturated hydride intermediate […","https://digital.csic.es/bitstream/10261/57986/3/Ir(I)ComplexesHemilabil.pdf","https://scholar.google.com/scholar?q=related:i0Fjp2XhjAUJ:scholar.google.com/&scioq=source:organometallics+%221520+6041%22+metal+catalyzed+dft&hl=en&as_sdt=0,5&as_vis=1"
