Cites,Authors,Title,Year,Source,Publisher,ArticleURL,CitesURL,GSRank,QueryDate,Type,DOI,ISSN,CitationURL,Volume,Issue,StartPage,EndPage,ECC,CitesPerYear,CitesPerAuthor,AuthorCount,Age,Abstract,FullTextURL,RelatedURL
148,"S Schünemann, M van Gastel, H Tüysüz","A CsPbBr3/TiO2 Composite for Visible‐Light‐Driven Photocatalytic Benzyl Alcohol Oxidation",2018,"ChemSusChem","Wiley Online Library","https://chemistry-europe.onlinelibrary.wiley.com/doi/abs/10.1002/cssc.201800679","https://scholar.google.com/scholar?cites=10580564588957436071&as_sdt=2005&sciodt=0,5&hl=en",234,"2025-05-07 11:24:32","","10.1002/cssc.201800679","","",,,,,148,21.14,49,3,7,"… oxidation reactions for organic synthesis has not yet been addressed. The selective photocatalytic oxidation … However, detailed DFT calculations regarding the reaction mechanism will …","https://chemistry-europe.onlinelibrary.wiley.com/doi/pdf/10.1002/cssc.201800679","https://scholar.google.com/scholar?q=related:p4jid2-31ZIJ:scholar.google.com/&scioq=source:chemsuschem+oxidative+addition+dft&hl=en&as_sdt=0,5&as_vis=1"
36,"C Barolo, JH Yum, E Artuso, N Barbero, ...","A Simple Synthetic Route to Obtain Pure Trans‐Ruthenium(II) Complexes for Dye‐Sensitized Solar Cell Applications",2013,"…","Wiley Online Library","https://chemistry-europe.onlinelibrary.wiley.com/doi/abs/10.1002/cssc.201200973","https://scholar.google.com/scholar?cites=1125512502990240707&as_sdt=2005&sciodt=0,5&hl=en",235,"2025-05-07 11:24:32","","10.1002/cssc.201200973","","",,,,,36,3.00,7,5,12,"… DFT/time-dependent DFT calculations have been performed on the ruthenium complex in solution and adsorbed onto TiO 2 to analyze relative electronic and optical properties. The …","https://chemistry-europe.onlinelibrary.wiley.com/doi/pdf/10.1002/cssc.201200973","https://scholar.google.com/scholar?q=related:w3v-gqifng8J:scholar.google.com/&scioq=source:chemsuschem+oxidative+addition+dft&hl=en&as_sdt=0,5&as_vis=1"
50,"Y Yang, H Gao, J Feng, S Zeng, L Liu, L Liu, ...","Aromatic Ester‐Functionalized Ionic Liquid for Highly Efficient CO2 Electrochemical Reduction to Oxalic Acid",2020,"…","Wiley Online Library","https://chemistry-europe.onlinelibrary.wiley.com/doi/abs/10.1002/cssc.202001194","https://scholar.google.com/scholar?cites=11670502011196964325&as_sdt=2005&sciodt=0,5&hl=en",236,"2025-05-07 11:24:32","","10.1002/cssc.202001194","","",,,,,50,10.00,7,7,5,"… Moreover, the results of density functional theory calculations demonstrated that CO 2 was efficiently activated to a −COOH intermediate by bis‐active sites of the aromatic ester anion …","https://chemistry-europe.onlinelibrary.wiley.com/doi/pdfdirect/10.1002/cssc.202001194","https://scholar.google.com/scholar?q=related:5X3gB7_z9aEJ:scholar.google.com/&scioq=source:chemsuschem+oxidative+addition+dft&hl=en&as_sdt=0,5&as_vis=1"
73,"L Chen, Y Xiong, H Qin, Z Qi","Advances of Ionic Liquids and Deep Eutectic Solvents in Green Processes of Biomass‐Derived 5‐Hydroxymethylfurfural",2022,"ChemSusChem","Wiley Online Library","https://chemistry-europe.onlinelibrary.wiley.com/doi/abs/10.1002/cssc.202102635","https://scholar.google.com/scholar?cites=4610316755768577553&as_sdt=2005&sciodt=0,5&hl=en",237,"2025-05-07 11:24:32","","10.1002/cssc.202102635","","",,,,,73,24.33,18,4,3,"… Density functional theory (DFT) study was also performed on functionalized IL [BSO 3 HMIm]Cl with a shuttled proton to promote glucose dehydration to HMF. The chloride anion …","https://chemistry-europe.onlinelibrary.wiley.com/doi/pdf/10.1002/cssc.202102635","https://scholar.google.com/scholar?q=related:EQ6esaki-z8J:scholar.google.com/&scioq=source:chemsuschem+oxidative+addition+dft&hl=en&as_sdt=0,5&as_vis=1"
50,"E Skrzyńska, J Ftouni, JS Girardon, M Capron, ...","Quasi‐homogeneous oxidation of glycerol by unsupported gold nanoparticles in the liquid phase",2012,"…","Wiley Online Library","https://chemistry-europe.onlinelibrary.wiley.com/doi/abs/10.1002/cssc.201200173","https://scholar.google.com/scholar?cites=9412192876902333333&as_sdt=2005&sciodt=0,5&hl=en",238,"2025-05-07 11:24:32","","10.1002/cssc.201200173","","",,,,,50,3.85,10,5,13,"… To confirm that this reaction is possible under the actual experimental conditions, we performed DFT calculations (B3LYP) taking into account the solvent (water) in the polarized …","https://chemistry-europe.onlinelibrary.wiley.com/doi/pdf/10.1002/cssc.201200173","https://scholar.google.com/scholar?q=related:lbs5uY3TnoIJ:scholar.google.com/&scioq=source:chemsuschem+oxidative+addition+dft&hl=en&as_sdt=0,5&as_vis=1"
31,"X Zhong, K Huang, Y Zhang, Y Wang, ...","Constructed interfacial oxygen‐bridge chemical bonding in core‐shell transition metal phosphides/carbon hybrid boosting oxygen evolution reaction",2021,"ChemSusChem","Wiley Online Library","https://chemistry-europe.onlinelibrary.wiley.com/doi/abs/10.1002/cssc.202100129","https://scholar.google.com/scholar?cites=15602905311731395865&as_sdt=2005&sciodt=0,5&hl=en",239,"2025-05-07 11:24:32","","10.1002/cssc.202100129","","",,,,,31,7.75,6,5,4,"… In combination with theoretical calculations based on density functional theory (DFT), we demonstrated that the strong interactions of Co−O−C bonds between Fe 2 O 3 @C and CoP in …","https://chemistry-europe.onlinelibrary.wiley.com/doi/pdfdirect/10.1002/cssc.202100129","https://scholar.google.com/scholar?q=related:GS3OmbaniNgJ:scholar.google.com/&scioq=source:chemsuschem+oxidative+addition+dft&hl=en&as_sdt=0,5&as_vis=1"
23,"A K. Bains, Y Ankit, D Adhikari","Bioinspired Radical‐Mediated Transition‐Metal‐Free Synthesis of N‐Heterocycles under Visible Light",2021,"ChemSusChem","Wiley Online Library","https://chemistry-europe.onlinelibrary.wiley.com/doi/abs/10.1002/cssc.202002161","https://scholar.google.com/scholar?cites=15949637017667430324&as_sdt=2005&sciodt=0,5&hl=en",240,"2025-05-07 11:24:32","","10.1002/cssc.202002161","","",,,,,23,5.75,8,3,4,"… A preliminary density functional theory (DFT) calculation using the M06-2x functional 6 … a six-membered ring, which is also clearly observed during structural optimization by DFT. …","https://chemistry-europe.onlinelibrary.wiley.com/doi/pdfdirect/10.1002/cssc.202002161","https://scholar.google.com/scholar?q=related:tOd83lx-WN0J:scholar.google.com/&scioq=source:chemsuschem+oxidative+addition+dft&hl=en&as_sdt=0,5&as_vis=1"
17,"Z Liu, W Jiang, Z Liu, Y Wang, D Wang, D Hao, ...","Optimizing the carbon dioxide reduction pathway through surface modification by halogenation",2020,"…","Wiley Online Library","https://chemistry-europe.onlinelibrary.wiley.com/doi/abs/10.1002/cssc.202001855","https://scholar.google.com/scholar?cites=3592416234024012255&as_sdt=2005&sciodt=0,5&hl=en",241,"2025-05-07 11:24:32","","10.1002/cssc.202001855","","",,,,,17,3.40,2,7,5,"… Density functional theory (DFT) calculations revealed that the modification of Bi 2 WO 6 with Br atoms can decrease the formation energy of the *COOH intermediate, which accelerates …","https://chemistry-europe.onlinelibrary.wiley.com/doi/pdfdirect/10.1002/cssc.202001855","https://scholar.google.com/scholar?q=related:3wlZCojT2jEJ:scholar.google.com/&scioq=source:chemsuschem+oxidative+addition+dft&hl=en&as_sdt=0,5&as_vis=1"
225,"J Artz, S Mallmann, R Palkovits","Selective aerobic oxidation of HMF to 2, 5‐diformylfuran on covalent triazine frameworks‐supported Ru catalysts",2015,"ChemSusChem","Wiley Online Library","https://chemistry-europe.onlinelibrary.wiley.com/doi/abs/10.1002/cssc.201403078","https://scholar.google.com/scholar?cites=16000996121864363890&as_sdt=2005&sciodt=0,5&hl=en",242,"2025-05-07 11:24:32","","10.1002/cssc.201403078","","",,,,,225,22.50,75,3,10,"The selective aerobic oxidation of 5‐hydroxymethylfurfural (HMF) to 2,5‐diformylfuran has been performed under mild conditions at 80 C and 20 bar of synthetic air in methyl t‐butyl …","https://chemistry-europe.onlinelibrary.wiley.com/doi/pdfdirect/10.1002/cssc.201403078","https://scholar.google.com/scholar?q=related:ct8gKDL1Dt4J:scholar.google.com/&scioq=source:chemsuschem+oxidative+addition+dft&hl=en&as_sdt=0,5&as_vis=1"
3,"J Sun, Y Dang, X Sun, S Heumann, Y Ding","Can carbon be used as an anode for water splitting?",2025,"ChemSusChem","Wiley Online Library","https://chemistry-europe.onlinelibrary.wiley.com/doi/abs/10.1002/cssc.202401340","https://scholar.google.com/scholar?cites=16160522876921382330&as_sdt=2005&sciodt=0,5&hl=en",243,"2025-05-07 11:24:32","","10.1002/cssc.202401340","","",,,,,3,3.00,1,5,1,"… The possible oxidation process of the selected model molecules (blue color). The thermodynamic energy is calculated for each step with DFT method. The steps are the most energy-…","https://chemistry-europe.onlinelibrary.wiley.com/doi/pdf/10.1002/cssc.202401340","https://scholar.google.com/scholar?q=related:ugV5N--1ReAJ:scholar.google.com/&scioq=source:chemsuschem+oxidative+addition+dft&hl=en&as_sdt=0,5&as_vis=1"
89,"Y Farré, M Raissi, A Fihey, Y Pellegrin, E Blart, ...","A Blue Diketopyrrolopyrrole Sensitizer with High Efficiency in Nickel‐Oxide‐based Dye‐Sensitized Solar Cells",2017,"…","Wiley Online Library","https://chemistry-europe.onlinelibrary.wiley.com/doi/abs/10.1002/cssc.201700468","https://scholar.google.com/scholar?cites=11227521008060204518&as_sdt=2005&sciodt=0,5&hl=en",244,"2025-05-07 11:24:32","","10.1002/cssc.201700468","","",,,,,89,11.13,15,6,8,"… These new dyes were completely characterized by absorption and emission spectroscopy along with electrochemistry and they were modeled by time-dependent DFT (TD-DFT) …","https://chemistry-europe.onlinelibrary.wiley.com/doi/pdfdirect/10.1002/cssc.201700468","https://scholar.google.com/scholar?q=related:5gWq8d4q0JsJ:scholar.google.com/&scioq=source:chemsuschem+oxidative+addition+dft&hl=en&as_sdt=0,5&as_vis=1"
21,"YY Lee, E Cagli, A Klemm, Y Park, R Dikki, ...","Microwave regeneration and thermal and oxidative stability of imidazolium cyanopyrrolide ionic liquid for direct air capture of carbon dioxide",2023,"…","Wiley Online Library","https://chemistry-europe.onlinelibrary.wiley.com/doi/abs/10.1002/cssc.202300118","https://scholar.google.com/scholar?cites=3610941779870466620&as_sdt=2005&sciodt=0,5&hl=en",245,"2025-05-07 11:24:32","","10.1002/cssc.202300118","","",,,,,21,10.50,4,6,2,"… Density functional theory (DFT) calculations indicate the dominant pathway to be pathway 2 involving the C2 position of the imidazolium ring. Therefore, bulky substituents at the C2, C4, …","https://chemistry-europe.onlinelibrary.wiley.com/doi/pdf/10.1002/cssc.202300118","https://scholar.google.com/scholar?q=related:PMLLzWqkHDIJ:scholar.google.com/&scioq=source:chemsuschem+oxidative+addition+dft&hl=en&as_sdt=0,5&as_vis=1"
19,"FC Hu, SW Wang, M Planells, N Robertson, ...","Design of OsII‐based Sensitizers for Dye‐Sensitized Solar Cells: Influence of Heterocyclic Ancillaries",2013,"…","Wiley Online Library","https://chemistry-europe.onlinelibrary.wiley.com/doi/abs/10.1002/cssc.201300417","https://scholar.google.com/scholar?cites=3324446506259114153&as_sdt=2005&sciodt=0,5&hl=en",246,"2025-05-07 11:24:32","","10.1002/cssc.201300417","","",,,,,19,1.58,4,5,12,"… The basic properties were extensively probed by using spectroscopic and electrochemical methods as well as time-dependent density functional theory (TD-DFT) calculations. …","https://chemistry-europe.onlinelibrary.wiley.com/doi/pdf/10.1002/cssc.201300417","https://scholar.google.com/scholar?q=related:qehc2HvOIi4J:scholar.google.com/&scioq=source:chemsuschem+oxidative+addition+dft&hl=en&as_sdt=0,5&as_vis=1"
12,"G Li, Z Li, Q Cai, C Yan, L Xing, W Li","Construction of Low‐Impedance and High‐Passivated Interphase for Nickel‐Rich Cathode by Low‐Cost Boron‐Containing Electrolyte Additive",2022,"ChemSusChem","Wiley Online Library","https://chemistry-europe.onlinelibrary.wiley.com/doi/abs/10.1002/cssc.202200543","https://scholar.google.com/scholar?cites=12446536437131593404&as_sdt=2005&sciodt=0,5&hl=en",247,"2025-05-07 11:24:32","","10.1002/cssc.202200543","","",,,,,12,4.00,2,6,3,"… Thus, DFT theoretical calculation is utilized to predict the oxidation capability of the PBA additive. As displayed in Figure 1A, PBA shows the highest HOMO (highest occupied molecular …","https://chemistry-europe.onlinelibrary.wiley.com/doi/pdfdirect/10.1002/cssc.202200543","https://scholar.google.com/scholar?q=related:vEYv6_H6uqwJ:scholar.google.com/&scioq=source:chemsuschem+oxidative+addition+dft&hl=en&as_sdt=0,5&as_vis=1"
1,"J Biemolt, EJ Meeus, FJ de Zwart, J de Graaf, ...","Creating Conjugated C− C Bonds between Commercial Carbon Electrode and Molecular Catalyst for Oxygen Reduction to Hydrogen Peroxide",2023,"…","Wiley Online Library","https://chemistry-europe.onlinelibrary.wiley.com/doi/abs/10.1002/cssc.202300841","https://scholar.google.com/scholar?cites=6799029871631200769&as_sdt=2005&sciodt=0,5&hl=en",248,"2025-05-07 11:24:32","","10.1002/cssc.202300841","","",,,,,1,0.50,0,5,2,"… Our density functional theory (DFT) calculations showed that the H 2 O 2 selectivity originates from the close to optimal *OOH binding (▵G *OOH =4.34 eV) and less ideal *OH binding (▵…","https://chemistry-europe.onlinelibrary.wiley.com/doi/pdfdirect/10.1002/cssc.202300841","https://scholar.google.com/scholar?q=related:AfLYO6UBW14J:scholar.google.com/&scioq=source:chemsuschem+oxidative+addition+dft&hl=en&as_sdt=0,5&as_vis=1"
40,"KH Chen, N Wang, ZW Yang, SM Xia, LN He","Tuning of Ionic Second Coordination Sphere in Evolved Rhenium Catalyst for Efficient Visible‐Light‐Driven CO2 Reduction",2020,"ChemSusChem","Wiley Online Library","https://chemistry-europe.onlinelibrary.wiley.com/doi/abs/10.1002/cssc.202000698","https://scholar.google.com/scholar?cites=15908471771445041539&as_sdt=2005&sciodt=0,5&hl=en",249,"2025-05-07 11:24:32","","10.1002/cssc.202000698","","",,,,,40,8.00,8,5,5,"… )amine (THEA) group to enhance visible-light absorption, stabilize reaction intermediates, and suppress the Re–Re dimer formation was evidenced by experimental outcomes and DFT …","https://chemistry-europe.onlinelibrary.wiley.com/doi/pdfdirect/10.1002/cssc.202000698","https://scholar.google.com/scholar?q=related:g5lPGMo-xtwJ:scholar.google.com/&scioq=source:chemsuschem+oxidative+addition+dft&hl=en&as_sdt=0,5&as_vis=1"
14,"J Li, W Tian, Q Li, S Zhao","Acidic oxygen evolution reaction: fundamental understanding and electrocatalysts design",2024,"ChemSusChem","Wiley Online Library","https://chemistry-europe.onlinelibrary.wiley.com/doi/abs/10.1002/cssc.202400239","https://scholar.google.com/scholar?cites=6083431154539610309&as_sdt=2005&sciodt=0,5&hl=en",250,"2025-05-07 11:24:32","","10.1002/cssc.202400239","","",,,,,14,14.00,4,4,1,"… Several possible theoretical models of reaction mechanisms have been proposed based on kinetic studies and thermochemical density functional theory (DFT) analysis. The widely …","https://chemistry-europe.onlinelibrary.wiley.com/doi/pdf/10.1002/cssc.202400239","https://scholar.google.com/scholar?q=related:xcDgVWewbFQJ:scholar.google.com/&scioq=source:chemsuschem+oxidative+addition+dft&hl=en&as_sdt=0,5&as_vis=1"
7,"S Huang, M Wang, DJ Su, J Liang, F Sun, ...","Co‐Doped Mn3O4 Nanocubes via Galvanic Replacement Reactions for Photocatalytic Reduction of CO2 with High Turnover Number",2022,"…","Wiley Online Library","https://chemistry-europe.onlinelibrary.wiley.com/doi/abs/10.1002/cssc.202200704","https://scholar.google.com/scholar?cites=1290030906596165047&as_sdt=2005&sciodt=0,5&hl=en",251,"2025-05-07 11:24:32","","10.1002/cssc.202200704","","",,,,,7,2.33,1,6,3,"… To have deep insights on the photocatalytic reaction mechanism of CO 2 reduction, density functional theory (DFT) calculations are carried out to study the influence of doped-Co atoms …","https://chemistry-europe.onlinelibrary.wiley.com/doi/pdf/10.1002/cssc.202200704","https://scholar.google.com/scholar?q=related:t4XwUEYc5xEJ:scholar.google.com/&scioq=source:chemsuschem+oxidative+addition+dft&hl=en&as_sdt=0,5&as_vis=1"
123,"L Wang, R Wang, X Zhang, J Mu, Z Zhou, ...","Improved Photoreduction of CO2 with Water by Tuning the Valence Band of Covalent Organic Frameworks",2020,"ChemSusChem","Wiley Online Library","https://chemistry-europe.onlinelibrary.wiley.com/doi/abs/10.1002/cssc.202000103","https://scholar.google.com/scholar?cites=11780778145890493571&as_sdt=2005&sciodt=0,5&hl=en",252,"2025-05-07 11:24:32","","10.1002/cssc.202000103","","",,,,,123,24.60,21,6,5,"… The geometry optimization calculations were performed by using density functional theory (DFT) for the ground states of TAPBB-COF at the B3LYP level with a 6-31G basis set. The …","https://chemistry-europe.onlinelibrary.wiley.com/doi/pdfdirect/10.1002/cssc.202000103","https://scholar.google.com/scholar?q=related:g-R8c067faMJ:scholar.google.com/&scioq=source:chemsuschem+oxidative+addition+dft&hl=en&as_sdt=0,5&as_vis=1"
31,"E Azaceta, L Lutz, A Grimaud, JM Vicent‐Luna, ...","Electrochemical Reduction of Oxygen in Aprotic Ionic Liquids Containing Metal Cations: A Case Study on the Na–O2 system",2017,"…","Wiley Online Library","https://chemistry-europe.onlinelibrary.wiley.com/doi/abs/10.1002/cssc.201601464","https://scholar.google.com/scholar?cites=8843529509514674669&as_sdt=2005&sciodt=0,5&hl=en",253,"2025-05-07 11:24:32","","10.1002/cssc.201601464","","",,,,,31,3.88,6,5,8,"… Once the most probable solvated states for each cation were obtained using classical molecular dynamics simulations, we studied the clusters using DFT calculations, as implemented …","https://chemistry-europe.onlinelibrary.wiley.com/doi/pdf/10.1002/cssc.201601464","https://scholar.google.com/scholar?q=related:7YFO3zuHunoJ:scholar.google.com/&scioq=source:chemsuschem+oxidative+addition+dft&hl=en&as_sdt=0,5&as_vis=1"
76,"Y Jiao, Y Zheng, SC Smith, A Du, Z Zhu","Electrocatalytically Switchable CO2 Capture: First Principle Computational Exploration of Carbon Nanotubes with Pyridinic Nitrogen",2014,"ChemSusChem","Wiley Online Library","https://chemistry-europe.onlinelibrary.wiley.com/doi/abs/10.1002/cssc.201300624","https://scholar.google.com/scholar?cites=13368171116541295639&as_sdt=2005&sciodt=0,5&hl=en",254,"2025-05-07 11:24:32","","10.1002/cssc.201300624","","",,,,,76,6.91,15,5,11,"… In this paper we use DFT calculations with dispersion correction (DFT-D) to investigate the adsorption of CO 2 on N-CNTs that have extra electron injection. DFT-D32, 33 calculations …","https://chemistry-europe.onlinelibrary.wiley.com/doi/pdfdirect/10.1002/cssc.201300624","https://scholar.google.com/scholar?q=related:F7wUis1IhbkJ:scholar.google.com/&scioq=source:chemsuschem+oxidative+addition+dft&hl=en&as_sdt=0,5&as_vis=1"
20,"TC Palmer, A Beamer, T Pitt, IA Popov, ...","A Comparative Review of Metal‐Based Charge Carriers in Nonaqueous Flow Batteries",2021,"…","Wiley Online Library","https://chemistry-europe.onlinelibrary.wiley.com/doi/abs/10.1002/cssc.202002354","https://scholar.google.com/scholar?cites=14240185108650748759&as_sdt=2005&sciodt=0,5&hl=en",255,"2025-05-07 11:24:32","","10.1002/cssc.202002354","","",,,,,20,5.00,4,5,4,"… complemented with computational modeling, density functional theory (DFT) calculations are usually … Therefore, the known ability of DFT to predict the redox potentials of transition metal …","https://chemistry-europe.onlinelibrary.wiley.com/doi/pdfdirect/10.1002/cssc.202002354","https://scholar.google.com/scholar?q=related:V2vvmOhMn8UJ:scholar.google.com/&scioq=source:chemsuschem+oxidative+addition+dft&hl=en&as_sdt=0,5&as_vis=1"
7,"A Mondal, D Pal, HJ Phukan, M Roy, S Kumar, ...","Manganese Complex Catalyzed Sequential Multi‐component Reaction: Enroute to a Quinoline‐Derived Azafluorenes",2024,"…","Wiley Online Library","https://chemistry-europe.onlinelibrary.wiley.com/doi/abs/10.1002/cssc.202301138","https://scholar.google.com/scholar?cites=6898899424918266126&as_sdt=2005&sciodt=0,5&hl=en",256,"2025-05-07 11:24:32","","10.1002/cssc.202301138","","",,,,,7,7.00,1,6,1,"… DFT calculation To gain further understanding of the reaction pathway, density functional theory (DFT) … The entire catalytic cycle is prevailed from DFT and is presented in Figures 4 &5. …","https://chemistry-europe.onlinelibrary.wiley.com/doi/pdfdirect/10.1002/cssc.202301138","https://scholar.google.com/scholar?q=related:DmFmm3nQvV8J:scholar.google.com/&scioq=source:chemsuschem+oxidative+addition+dft&hl=en&as_sdt=0,5&as_vis=1"
10,"W Li, Y Bu, X Ge, F Li, GF Han, JB Baek","Recent Advances in Iridium‐based Electrocatalysts for Acidic Electrolyte Oxidation",2024,"ChemSusChem","Wiley Online Library","https://chemistry-europe.onlinelibrary.wiley.com/doi/abs/10.1002/cssc.202400295","https://scholar.google.com/scholar?cites=11054857063808165908&as_sdt=2005&sciodt=0,5&hl=en",257,"2025-05-07 11:24:32","","10.1002/cssc.202400295","","",,,,,10,10.00,2,6,1,"… In situ XAS measurements and DFT calculations showed that the introduction of Li is beneficial for reducing the original energy barrier and, compared with traditional spinel-phase IrO2, …","https://chemistry-europe.onlinelibrary.wiley.com/doi/pdf/10.1002/cssc.202400295","https://scholar.google.com/scholar?q=related:FOgAq-29apkJ:scholar.google.com/&scioq=source:chemsuschem+oxidative+addition+dft&hl=en&as_sdt=0,5&as_vis=1"
19,"S Kwak, K An, YHT Tran, SW Song","Design of Non‐Incendive High‐Voltage Liquid Electrolyte Formulation for Safe Lithium‐Ion Batteries",2022,"ChemSusChem","Wiley Online Library","https://chemistry-europe.onlinelibrary.wiley.com/doi/abs/10.1002/cssc.202102546","https://scholar.google.com/scholar?cites=8373237995083827576&as_sdt=2005&sciodt=0,5&hl=en",258,"2025-05-07 11:24:32","","10.1002/cssc.202102546","","",,,,,19,6.33,5,4,3,"… Through DFT calculation, oxidation and reduction potentials of solvents were obtained (Figure 1A and Figure S1A). A remarkable lowering of HOMO energy level of FES from those of …","https://chemistry-europe.onlinelibrary.wiley.com/doi/pdf/10.1002/cssc.202102546","https://scholar.google.com/scholar?q=related:eInG3Je3M3QJ:scholar.google.com/&scioq=source:chemsuschem+oxidative+addition+dft&hl=en&as_sdt=0,5&as_vis=1"
3,"RP Carvalho, M Alhanash, CFN Marchiori, ...","Exploring metastable phases during lithiation of organic battery electrode materials",2022,"…","Wiley Online Library","https://chemistry-europe.onlinelibrary.wiley.com/doi/abs/10.1002/cssc.202200354","https://scholar.google.com/scholar?cites=6021009410363312672&as_sdt=2005&sciodt=0,5&hl=en",259,"2025-05-07 11:24:32","","10.1002/cssc.202200354","","",,,,,3,1.00,1,4,3,"… In this context, an evolutionary algorithm interplayed with density functional theory (DFT) has previously been successfully employed to predict the crystal structure of several OEMs …","https://chemistry-europe.onlinelibrary.wiley.com/doi/pdfdirect/10.1002/cssc.202200354","https://scholar.google.com/scholar?q=related:IEr9dSjsjlMJ:scholar.google.com/&scioq=source:chemsuschem+oxidative+addition+dft&hl=en&as_sdt=0,5&as_vis=1"
136,"U Azzena, M Carraro, L Pisano, S Monticelli, ...","Cyclopentyl methyl ether: an elective ecofriendly ethereal solvent in classical and modern organic chemistry",2019,"…","Wiley Online Library","https://chemistry-europe.onlinelibrary.wiley.com/doi/abs/10.1002/cssc.201801768","https://scholar.google.com/scholar?cites=10953068666250467995&as_sdt=2005&sciodt=0,5&hl=en",260,"2025-05-07 11:24:32","","10.1002/cssc.201801768","","",,,,,136,22.67,27,5,6,"… the reactivity of the C−CN bond toward oxidative addition to the nickel(0) complex. This study … The energy barrier calculated for each step at the DFT/M06-2X(6-311++G**) level shows a …","https://chemistry-europe.onlinelibrary.wiley.com/doi/pdf/10.1002/cssc.201801768","https://scholar.google.com/scholar?q=related:mxpSjOsdAZgJ:scholar.google.com/&scioq=source:chemsuschem+oxidative+addition+dft&hl=en&as_sdt=0,5&as_vis=1"
178,"P Pal, S Saravanamurugan","Recent advances in the development of 5‐hydroxymethylfurfural oxidation with base (nonprecious)‐metal‐containing catalysts",2019,"ChemSusChem","Wiley Online Library","https://chemistry-europe.onlinelibrary.wiley.com/doi/abs/10.1002/cssc.201801744","https://scholar.google.com/scholar?cites=199109053160456802&as_sdt=2005&sciodt=0,5&hl=en",261,"2025-05-07 11:24:32","","10.1002/cssc.201801744","","",,,,,178,29.67,89,2,6,"… It was further supported by DFT calculations that DFF weakly interacted with active sites, … (111) crystal faces for the oxidation of HMF to DFF, in addition to the magnetic properties of Fe 3 …","https://chemistry-europe.onlinelibrary.wiley.com/doi/pdfdirect/10.1002/cssc.201801744","https://scholar.google.com/scholar?q=related:YoIxAaFgwwIJ:scholar.google.com/&scioq=source:chemsuschem+oxidative+addition+dft&hl=en&as_sdt=0,5&as_vis=1"
2,"H Ullah, Z Ullah, ZAK Khattak, M Tahir, E Kang, ...","Solvent Free Ambient Pressure CO2 Cycloaddition Catalyzed by Cobalt‐Impregnated 2D‐Nanofibrous COFs",2025,"…","Wiley Online Library","https://chemistry-europe.onlinelibrary.wiley.com/doi/abs/10.1002/cssc.202401046","https://scholar.google.com/scholar?cites=25663659309597397&as_sdt=2005&sciodt=0,5&hl=en",262,"2025-05-07 11:24:32","","10.1002/cssc.202401046","","",,,,,2,2.00,0,6,1,"… matrix catalyze CO2 cycloaddition through density functional theory calculations. We also … Theoretical interpretation of the reaction pathway We used density functional theory (DFT) …","https://chemistry-europe.onlinelibrary.wiley.com/doi/pdf/10.1002/cssc.202401046","https://scholar.google.com/scholar?q=related:1QLJUPYsWwAJ:scholar.google.com/&scioq=source:chemsuschem+oxidative+addition+dft&hl=en&as_sdt=0,5&as_vis=1"
