Cites,Authors,Title,Year,Source,Publisher,ArticleURL,CitesURL,GSRank,QueryDate,Type,DOI,ISSN,CitationURL,Volume,Issue,StartPage,EndPage,ECC,CitesPerYear,CitesPerAuthor,AuthorCount,Age,Abstract,FullTextURL,RelatedURL
10,"J Li, HP Ma, G Zhao, G Huang, W Sun, ...","Plastic Waste Conversion by Leveraging Renewable Photo/Electro‐Catalytic Technologies",2024,"ChemSusChem","Wiley Online Library","https://chemistry-europe.onlinelibrary.wiley.com/doi/abs/10.1002/cssc.202301352","https://scholar.google.com/scholar?cites=10794014911192321056&as_sdt=2005&sciodt=0,5&hl=en",757,"2025-05-07 11:24:32","","10.1002/cssc.202301352","","",,,,,10,10.00,2,6,1,"… Through 1 H NMR spectroscopy, infrared spectroscopy (IR), and density functional theory (DFT) calculations, they explored the mechanisms of oxidative C−C bond cleavage by the V V /…","https://chemistry-europe.onlinelibrary.wiley.com/doi/pdf/10.1002/cssc.202301352","https://scholar.google.com/scholar?q=related:IEzjYV8LzJUJ:scholar.google.com/&scioq=source:chemsuschem+oxidative+addition+dft&hl=en&as_sdt=0,5&as_vis=1"
1,"AK Manal, D Rajendra Kanchan, A Banerjee, ...","Recycling Valuable Phenol from Polycarbonate Plastic Waste Via Direct Depolymerization and Csp2−Csp3 Bond Cleavage Under Mild Conditions",2024,"…","Wiley Online Library","https://chemistry-europe.onlinelibrary.wiley.com/doi/abs/10.1002/cssc.202401146","https://scholar.google.com/scholar?cites=2646172229324024690&as_sdt=2005&sciodt=0,5&hl=en",758,"2025-05-07 11:24:32","","10.1002/cssc.202401146","","",,,,,1,1.00,0,4,1,"… Mechanistic studies were undertaken to comprehend the fundamental steps involved in this conversion process through control experiments and density functional theory (DFT) analysis…","https://chemistry-europe.onlinelibrary.wiley.com/doi/pdfdirect/10.1002/cssc.202401146","https://scholar.google.com/scholar?q=related:cqtcX58XuSQJ:scholar.google.com/&scioq=source:chemsuschem+oxidative+addition+dft&hl=en&as_sdt=0,5&as_vis=1"
7,"J Zhu, J Huang, J Dai, L Jiang, Y Xu, R Chen, ...","Synergistic Combination of Fermi Level Equilibrium and Plasmonic Effect for Formic Acid Dehydrogenation",2023,"…","Wiley Online Library","https://chemistry-europe.onlinelibrary.wiley.com/doi/abs/10.1002/cssc.202202069","https://scholar.google.com/scholar?cites=12454976626438962925&as_sdt=2005&sciodt=0,5&hl=en",759,"2025-05-07 11:24:32","","10.1002/cssc.202202069","","",,,,,7,3.50,1,7,2,"… To more comprehensively understand the origin of the promoted dehydrogenation thermodynamics by surface-enhanced heterogeneity, we used DFT to model the dehydrogenation …","https://chemistry-europe.onlinelibrary.wiley.com/doi/pdfdirect/10.1002/cssc.202202069","https://scholar.google.com/scholar?q=related:7f6voED32KwJ:scholar.google.com/&scioq=source:chemsuschem+oxidative+addition+dft&hl=en&as_sdt=0,5&as_vis=1"
0,"R Miao, Q Niu, L Li, Y Yu","Ni‐Metalized Covalent Organic Cage as a Photocatalyst for Selective Photoreduction of CO2 to CO",2025,"ChemSusChem","Wiley Online Library","https://chemistry-europe.onlinelibrary.wiley.com/doi/abs/10.1002/cssc.202401699","",760,"2025-05-07 11:24:32","","10.1002/cssc.202401699","","",,,,,0,0.00,0,4,1,"… In-situ diffuse reflectance FTIR (DRIFT) and DFT calculations were further performed to … DFT calculated Gibbs energy of CO formation proved the reasonable route (Figure 4b). The …","https://chemistry-europe.onlinelibrary.wiley.com/doi/pdfdirect/10.1002/cssc.202401699","https://scholar.google.com/scholar?q=related:3DG2M8tnCogJ:scholar.google.com/&scioq=source:chemsuschem+oxidative+addition+dft&hl=en&as_sdt=0,5&as_vis=1"
1,"M Melchionna, P Fornasiero","What Is to Be Expected from Heterogeneous Catalysis in the Pipeline to Circular Economy?",2025,"ChemSusChem","Wiley Online Library","https://chemistry-europe.onlinelibrary.wiley.com/doi/abs/10.1002/cssc.202402064","https://scholar.google.com/scholar?cites=12454958470106721464&as_sdt=2005&sciodt=0,5&hl=en",761,"2025-05-07 11:24:32","","10.1002/cssc.202402064","","",,,,,1,1.00,1,2,1,"… (time-dependent) DFT calculations. Top panel: sketch of the proposed mechanism. a) DFT-… the bound Ni made the oxidation state of the metal oscillating, and when in oxidation state (I), …","https://chemistry-europe.onlinelibrary.wiley.com/doi/pdf/10.1002/cssc.202402064","https://scholar.google.com/scholar?q=related:uCz0Rr3m2KwJ:scholar.google.com/&scioq=source:chemsuschem+oxidative+addition+dft&hl=en&as_sdt=0,5&as_vis=1"
87,"C Pei, Y Gu, Z Liu, X Yu, L Feng","Fluoridated iron–nickel layered double hydroxide for enhanced performance in the oxygen evolution reaction",2019,"ChemSusChem","Wiley Online Library","https://chemistry-europe.onlinelibrary.wiley.com/doi/abs/10.1002/cssc.201901153","https://scholar.google.com/scholar?cites=1562665310466622695&as_sdt=2005&sciodt=0,5&hl=en",762,"2025-05-07 11:24:32","","10.1002/cssc.201901153","","",,,,,87,14.50,17,5,6,"… This was further supported by the DFT calculations with which the authors investigated several model structures to simulate the overpotentials for OER based on the well-recognized four…","https://chemistry-europe.onlinelibrary.wiley.com/doi/pdf/10.1002/cssc.201901153","https://scholar.google.com/scholar?q=related:50QwDdKzrxUJ:scholar.google.com/&scioq=source:chemsuschem+oxidative+addition+dft&hl=en&as_sdt=0,5&as_vis=1"
0,"A Dey, A Pramanik, S Purohit, S Biswas, ...","Stable Na+ Ion Storage via Dual Active Sites Utilization in Covalent Organic Framework‐Carbon Nanotube Composite",,"…","Wiley Online Library","https://chemistry-europe.onlinelibrary.wiley.com/doi/abs/10.1002/cssc.202402325","",763,"2025-05-07 11:24:32","","10.1002/cssc.202402325","","",,,,,0,0.00,0,5,,"… Lastly, density functional theory (DFT) calculations were carried out to explain the atomistic origins of the experimentally observed capacity, voltages, Na + binding sites, and COF’s …","","https://scholar.google.com/scholar?q=related:ahjw4fxiWWsJ:scholar.google.com/&scioq=source:chemsuschem+oxidative+addition+dft&hl=en&as_sdt=0,5&as_vis=1"
5,"N Reddy Samala, I Grinberg","Origin of the Rarely Reported High Performance of Mn‐doped Carbon‐based Oxygen Reduction Catalysts",2022,"ChemSusChem","Wiley Online Library","https://chemistry-europe.onlinelibrary.wiley.com/doi/abs/10.1002/cssc.202200795","https://scholar.google.com/scholar?cites=16162694700720840423&as_sdt=2005&sciodt=0,5&hl=en",764,"2025-05-07 11:24:32","","10.1002/cssc.202200795","","",,,,,5,1.67,3,2,3,"… Using the onset potential (V onset ) evaluated by DFT calculations as a descriptor of activity, we show that precise material synthesis and engineering of the active site is necessary to …","https://chemistry-europe.onlinelibrary.wiley.com/doi/pdfdirect/10.1002/cssc.202200795","https://scholar.google.com/scholar?q=related:596NWTJtTeAJ:scholar.google.com/&scioq=source:chemsuschem+oxidative+addition+dft&hl=en&as_sdt=0,5&as_vis=1"
38,"H Nishiyama, H Kobayashi, Y Inoue","Effects of Distortion of Metal–Oxygen Octahedra on Photocatalytic Water‐Splitting Performance of RuO2‐Loaded Niobium and Tantalum Phosphate Bronzes",2011,"ChemSusChem","Wiley Online Library","https://chemistry-europe.onlinelibrary.wiley.com/doi/abs/10.1002/cssc.201000294","https://scholar.google.com/scholar?cites=7143777308349456856&as_sdt=2005&sciodt=0,5&hl=en",765,"2025-05-07 11:24:32","","10.1002/cssc.201000294","","",,,,,38,2.71,13,3,14,"… The band structures and density of states were calculated using DFT with the CASTEP … Figure 6 shows the influence of oxidation temperature of the Ru complex on the activity of Na 4 Ta …","https://chemistry-europe.onlinelibrary.wiley.com/doi/pdfdirect/10.1002/cssc.201000294","https://scholar.google.com/scholar?q=related:2GGq0pzLI2MJ:scholar.google.com/&scioq=source:chemsuschem+oxidative+addition+dft&hl=en&as_sdt=0,5&as_vis=1"
1,"H Pan, R Hao, L Wang, Y Yu, N Yang","Constructing Hydrangea‐Like Iron‐Cobalt Phosphides via Boron‐Assisted Strategy as an Efficient Catalyst for Water Splitting at High Current Density",2025,"ChemSusChem","Wiley Online Library","https://chemistry-europe.onlinelibrary.wiley.com/doi/abs/10.1002/cssc.202400900","https://scholar.google.com/scholar?cites=11353355495056553264&as_sdt=2005&sciodt=0,5&hl=en",766,"2025-05-07 11:24:32","","10.1002/cssc.202400900","","",,,,,1,1.00,0,5,1,"… Density functional theory (DFT) calculations were performed to further clarify the mechanism of surface-B-doping for boosted HER performance. The calculation model were established …","https://chemistry-europe.onlinelibrary.wiley.com/doi/pdfdirect/10.1002/cssc.202400900","https://scholar.google.com/scholar?q=related:MDWTi6s4j50J:scholar.google.com/&scioq=source:chemsuschem+oxidative+addition+dft&hl=en&as_sdt=0,5&as_vis=1"
34,"A Jena, HC Hsieh, S Thoka, SF Hu, H Chang, ...","Curtailing the Overpotential of Li–CO2 Batteries with Shape‐Controlled Cu2O as Cathode: Effect of Illuminating the Cathode",2020,"…","Wiley Online Library","https://chemistry-europe.onlinelibrary.wiley.com/doi/abs/10.1002/cssc.202000097","https://scholar.google.com/scholar?cites=18347839470692269843&as_sdt=2005&sciodt=0,5&hl=en",767,"2025-05-07 11:24:32","","10.1002/cssc.202000097","","",,,,,34,6.80,6,6,5,"… In the case of Cu 2 O, DFT calculation predicts that a linear CO 2 molecule adsorbs on the … A DFT study on single Co atoms anchored on graphene oxide (GO) showed that the binding …","https://chemistry-europe.onlinelibrary.wiley.com/doi/pdfdirect/10.1002/cssc.202000097","https://scholar.google.com/scholar?q=related:E_-AnsmeoP4J:scholar.google.com/&scioq=source:chemsuschem+oxidative+addition+dft&hl=en&as_sdt=0,5&as_vis=1"
11,"X Lu, K Yan, Z Yu, J Wang, R Liu, R Zhang, ...","Transition metal phosphides: synthesis nanoarchitectonics, catalytic properties, and biomass conversion applications",2024,"…","Wiley Online Library","https://chemistry-europe.onlinelibrary.wiley.com/doi/abs/10.1002/cssc.202301687","https://scholar.google.com/scholar?cites=10082867077889186580&as_sdt=2005&sciodt=0,5&hl=en",768,"2025-05-07 11:24:32","","10.1002/cssc.202301687","","",,,,,11,11.00,2,7,1,"… As shown in Figure 9b–d, DFT also revealed that the adsorption structure of furfural on the surface of Co 2 P can be roughly divided into three groups: C=O and furan ring adsorbed …","https://chemistry-europe.onlinelibrary.wiley.com/doi/pdfdirect/10.1002/cssc.202301687","https://scholar.google.com/scholar?q=related:FNsQny-K7YsJ:scholar.google.com/&scioq=source:chemsuschem+oxidative+addition+dft&hl=en&as_sdt=0,5&as_vis=1"
246,"Y Gong, M Li, Y Wang","Carbon nitride in energy conversion and storage: recent advances and future prospects",2015,"ChemSusChem","Wiley Online Library","https://chemistry-europe.onlinelibrary.wiley.com/doi/abs/10.1002/cssc.201403287","https://scholar.google.com/scholar?cites=1983555792587594685&as_sdt=2005&sciodt=0,5&hl=en",769,"2025-05-07 11:24:32","","10.1002/cssc.201403287","","",,,,,246,24.60,82,3,10,"… a) Free energy plots of the ORR determined by DFT calculations and optimized configurations of adsorbed species on the gC 3 N 4 surface with participation from zero, two, and four …","https://chemistry-europe.onlinelibrary.wiley.com/doi/pdf/10.1002/cssc.201403287","https://scholar.google.com/scholar?q=related:vRta6XsBhxsJ:scholar.google.com/&scioq=source:chemsuschem+oxidative+addition+dft&hl=en&as_sdt=0,5&as_vis=1"
5,"J Peng, H Peng, CG Shi, L Huang, SG Sun","Surface Passivation of LiCoO2 by Solid Electrolyte Nanoshell for High Interfacial Stability and Conductivity",2023,"ChemSusChem","Wiley Online Library","https://chemistry-europe.onlinelibrary.wiley.com/doi/abs/10.1002/cssc.202300715","https://scholar.google.com/scholar?cites=68618735014109493&as_sdt=2005&sciodt=0,5&hl=en",770,"2025-05-07 11:24:32","","10.1002/cssc.202300715","","",,,,,5,2.50,1,5,2,"… The doping mechanism was investigated by density functional theory (DFT+U) calculations. The detailed calculation method is provided in the Supporting Information. We replaced one …","https://chemistry-europe.onlinelibrary.wiley.com/doi/pdf/10.1002/cssc.202300715","https://scholar.google.com/scholar?q=related:NeFzPWDI8wAJ:scholar.google.com/&scioq=source:chemsuschem+oxidative+addition+dft&hl=en&as_sdt=0,5&as_vis=1"
1,"M Jabłońska, A Mollá Robles, M Rotko, ...","Unraveling the NH3‐SCR‐DeNOx Mechanism of Cu‐SSZ‐13 Variants by Spectroscopic and Transient Techniques",2024,"…","Wiley Online Library","https://chemistry-europe.onlinelibrary.wiley.com/doi/abs/10.1002/cssc.202400198","https://scholar.google.com/scholar?cites=13273189896677400915&as_sdt=2005&sciodt=0,5&hl=en",771,"2025-05-07 11:24:32","","10.1002/cssc.202400198","","",,,,,1,1.00,0,4,1,"… DFT calculations confirmed that the oxidation of individual [CuI(NH3)]+ by NO + O2 in the presence of H+ also enables the restoration of the [CuII(OH)(NH3)2]+ active site but this path is …","https://chemistry-europe.onlinelibrary.wiley.com/doi/pdfdirect/10.1002/cssc.202400198","https://scholar.google.com/scholar?q=related:U6HC--LXM7gJ:scholar.google.com/&scioq=source:chemsuschem+oxidative+addition+dft&hl=en&as_sdt=0,5&as_vis=1"
1,"K Song, H Jing, B Yang, J Shao, Y Tao, ...","Enhancing Oxygen Reduction Reaction of Single‐Atom Catalysts by Structure Tuning",2025,"…","Wiley Online Library","https://chemistry-europe.onlinelibrary.wiley.com/doi/abs/10.1002/cssc.202401713","https://scholar.google.com/scholar?cites=11074455828060732994&as_sdt=2005&sciodt=0,5&hl=en",772,"2025-05-07 11:24:32","","10.1002/cssc.202401713","","",,,,,1,1.00,0,6,1,"… The density functional theory (DFT) calculation revealed that the replacement of the α-carbon on Pt-N3 with a P atom led to a deeper d-band center of Pt, consequently enhancing the …","https://chemistry-europe.onlinelibrary.wiley.com/doi/pdfdirect/10.1002/cssc.202401713","https://scholar.google.com/scholar?q=related:Qn5QkOZesJkJ:scholar.google.com/&scioq=source:chemsuschem+oxidative+addition+dft&hl=en&as_sdt=0,5&as_vis=1"
0,"C Clark, CA O'Keefe, DS Wright, CP Grey","Solid‐State Nuclear Magnetic Resonance Investigations of the Lithium‐and Sodium‐Storage Mechanisms of Pyrolytic Phosphorus‐Carbon Composites",2025,"ChemSusChem","Wiley Online Library","https://chemistry-europe.onlinelibrary.wiley.com/doi/abs/10.1002/cssc.202500103","",773,"2025-05-07 11:24:32","","10.1002/cssc.202500103","","",,,,,0,0.00,0,4,1,"… Finally, we suggest that further density functional theory (DFT) calculations and heteronuclear NMR experiments may help provide additional insight into the nature of the wide range of …","https://chemistry-europe.onlinelibrary.wiley.com/doi/pdfdirect/10.1002/cssc.202500103","https://scholar.google.com/scholar?q=related:pdebn_-RpywJ:scholar.google.com/&scioq=source:chemsuschem+oxidative+addition+dft&hl=en&as_sdt=0,5&as_vis=1"
220,"KA Rogers, Y Zheng","Selective deoxygenation of biomass‐derived bio‐oils within hydrogen‐modest environments: a review and new insights",2016,"ChemSusChem","Wiley Online Library","https://chemistry-europe.onlinelibrary.wiley.com/doi/abs/10.1002/cssc.201600144","https://scholar.google.com/scholar?cites=3884290802684250356&as_sdt=2005&sciodt=0,5&hl=en",774,"2025-05-07 11:24:32","","10.1002/cssc.201600144","","",,,,,220,24.44,110,2,9,"… 25b Through DFT calculations it was found that, compared to Pd and Fe individually, pairing … Through DFT calculations, the most likely catalytic mechanism is dehydroxylation. In …","https://chemistry-europe.onlinelibrary.wiley.com/doi/pdf/10.1002%2Fcssc.201600144","https://scholar.google.com/scholar?q=related:9MhPuufF5zUJ:scholar.google.com/&scioq=source:chemsuschem+oxidative+addition+dft&hl=en&as_sdt=0,5&as_vis=1"
9,"Z Ma, X Ma, W Luo, Y Jiang, W Shen, R He, ...","Dopant‐Induced Surface Self‐Etching of Cobalt Carbonate Hydroxide Boosts Efficient Water Splitting",2023,"…","Wiley Online Library","https://chemistry-europe.onlinelibrary.wiley.com/doi/abs/10.1002/cssc.202201892","https://scholar.google.com/scholar?cites=12451188673608714445&as_sdt=2005&sciodt=0,5&hl=en",775,"2025-05-07 11:24:32","","10.1002/cssc.202201892","","",,,,,9,4.50,1,7,2,"… The density functional theory (DFT) was used to investigate the intrinsic mechanism of OER on V−CoCH. The (300) plane of CoCH was employed as a theoretical model, because the …","https://chemistry-europe.onlinelibrary.wiley.com/doi/pdf/10.1002/cssc.202201892","https://scholar.google.com/scholar?q=related:zYjQISGCy6wJ:scholar.google.com/&scioq=source:chemsuschem+oxidative+addition+dft&hl=en&as_sdt=0,5&as_vis=1"
5,"S Kumar, P Choudhary, D Sharma, D Sajwan, ...","Tailored Engineering of Layered Double Hydroxide Catalysts for Biomass Valorization: A Way Towards Waste to Wealth",2024,"…","Wiley Online Library","https://chemistry-europe.onlinelibrary.wiley.com/doi/abs/10.1002/cssc.202400737","https://scholar.google.com/scholar?cites=16687660847732263587&as_sdt=2005&sciodt=0,5&hl=en",776,"2025-05-07 11:24:32","","10.1002/cssc.202400737","","",,,,,5,5.00,1,5,1,"… The DFT calculations were performed to understand the relationship between substrate … DFT shows that the remarkable properties of the Cu3Co1 (111) crystal surface make it an …","https://chemistry-europe.onlinelibrary.wiley.com/doi/pdfdirect/10.1002/cssc.202400737","https://scholar.google.com/scholar?q=related:o4pGQSB7lucJ:scholar.google.com/&scioq=source:chemsuschem+oxidative+addition+dft&hl=en&as_sdt=0,5&as_vis=1"
1,"Y Zhang, ZA Chen, ZJ Xu, JY Li, XY Li, ZB Fang, ...","Anchoring Single‐Atomic Metal Sites in Metalloporphyrin‐Based Covalent Organic Frameworks for Enhanced Photocatalytic Hydrogen Evolution",2024,"…","Wiley Online Library","https://chemistry-europe.onlinelibrary.wiley.com/doi/abs/10.1002/cssc.202400556","https://scholar.google.com/scholar?cites=8518774626495543831&as_sdt=2005&sciodt=0,5&hl=en",777,"2025-05-07 11:24:32","","10.1002/cssc.202400556","","",,,,,1,1.00,0,7,1,"… Nonlocal density functional theory (NL-DFT) pore-size distribution analysis showed that PB-COF mainly possesses mesopores with the size of about 30 Å, Fig. S6), which matched well …","https://chemistry-europe.onlinelibrary.wiley.com/doi/pdf/10.1002/cssc.202400556","https://scholar.google.com/scholar?q=related:F7rgbWPEOHYJ:scholar.google.com/&scioq=source:chemsuschem+oxidative+addition+dft&hl=en&as_sdt=0,5&as_vis=1"
0,"J Jangir, BR Jagirdar","Unveiling the Potential of Heterogeneous Systems for Reversible Hydrogen Storage in Liquid Organic Hydrogen Carriers",2025,"ChemSusChem","Wiley Online Library","https://chemistry-europe.onlinelibrary.wiley.com/doi/abs/10.1002/cssc.202402018","",778,"2025-05-07 11:24:32","","10.1002/cssc.202402018","","",,,,,0,0.00,0,2,1,"… Utilizing density functional theory allows for the consideration of parameters such as electron affinity, electronegativity, d-band center, and Mulliken charge, could elucidate the reactivity …","https://chemistry-europe.onlinelibrary.wiley.com/doi/pdf/10.1002/cssc.202402018","https://scholar.google.com/scholar?q=related:o0H_no08clkJ:scholar.google.com/&scioq=source:chemsuschem+oxidative+addition+dft&hl=en&as_sdt=0,5&as_vis=1"
6,"Y Yu, X Wei, W Chen, G Qian, C Chen, S Wang, ...","Design of Single‐Atom Catalysts for E lectrocatalytic Nitrogen Fixation",2024,"…","Wiley Online Library","https://chemistry-europe.onlinelibrary.wiley.com/doi/abs/10.1002/cssc.202301105","https://scholar.google.com/scholar?cites=9663132441438105763&as_sdt=2005&sciodt=0,5&hl=en",779,"2025-05-07 11:24:32","","10.1002/cssc.202301105","","",,,,,6,6.00,1,7,1,"… In addition, the competitive activity between ENRR and HER was judged … DFT studies (ΔU=U L,NRR −U L,HER ), the larger the value of ΔU, the higher the selectivity of ENRR. The DFT …","https://chemistry-europe.onlinelibrary.wiley.com/doi/pdfdirect/10.1002/cssc.202301105","https://scholar.google.com/scholar?q=related:o7B4DcJXGoYJ:scholar.google.com/&scioq=source:chemsuschem+oxidative+addition+dft&hl=en&as_sdt=0,5&as_vis=1"
0,"F Xue, J Wang, P Li, Y Yao, J Li, Z Lu, D Yi, F Yuan, ...","Enhancing Stability and Activity of Fe‐based Catalysts for Propane Dehydrogenation via Anchoring Isolated Fe‐Cl Sites",,"…","Wiley Online Library","https://chemistry-europe.onlinelibrary.wiley.com/doi/abs/10.1002/cssc.202402408","",780,"2025-05-07 11:24:32","","10.1002/cssc.202402408","","",,,,,0,0.00,0,9,,"… characterizations and density functional theory (DFT) … -FTIR) spectroscopy combined with DFT calculations further verified that … Furthermore, density functional theory (DFT) calculations …","https://chemistry-europe.onlinelibrary.wiley.com/doi/am-pdf/10.1002/cssc.202402408","https://scholar.google.com/scholar?q=related:uAYvo5L75DAJ:scholar.google.com/&scioq=source:chemsuschem+oxidative+addition+dft&hl=en&as_sdt=0,5&as_vis=1"
54,"YC Chen, SK Huang, SS Li, YY Tsai, CP Chen, ...","Facilely Synthesized spiro [fluorene‐9, 9′‐phenanthren‐10′‐one] in Donor–Acceptor–Donor Hole‐Transporting Materials for Perovskite Solar Cells",2018,"…","Wiley Online Library","https://chemistry-europe.onlinelibrary.wiley.com/doi/abs/10.1002/cssc.201801258","https://scholar.google.com/scholar?cites=16066955127612920822&as_sdt=2005&sciodt=0,5&hl=en",781,"2025-05-07 11:24:32","","10.1002/cssc.201801258","","",,,,,54,7.71,9,6,7,"… geometrical optimizations were performed using density functional theory (DFT) with the B3LYP/6-… According to the results obtained using time-dependent (TD) DFT, the HOMO/LUMO …","https://chemistry-europe.onlinelibrary.wiley.com/doi/pdf/10.1002/cssc.201801258","https://scholar.google.com/scholar?q=related:9lOC649K-d4J:scholar.google.com/&scioq=source:chemsuschem+oxidative+addition+dft&hl=en&as_sdt=0,5&as_vis=1"
23,"N Dagar, PP Sen, SR Roy","Electrifying Sustainability on Transition Metal‐Free Modes: An Eco‐Friendly Approach for the Formation of C− N Bonds",2021,"ChemSusChem","Wiley Online Library","https://chemistry-europe.onlinelibrary.wiley.com/doi/abs/10.1002/cssc.202002567","https://scholar.google.com/scholar?cites=12948933691350054384&as_sdt=2005&sciodt=0,5&hl=en",782,"2025-05-07 11:24:32","","10.1002/cssc.202002567","","",,,,,23,5.75,8,3,4,"… The DFT study was performed to elucidate the mechanism, and it was suggested that regioselective C−N bond formation to afford 86 is eventually kinetically favored than the C−C bond-…","https://chemistry-europe.onlinelibrary.wiley.com/doi/pdfdirect/10.1002/cssc.202002567","https://scholar.google.com/scholar?q=related:8PUB_ZXas7MJ:scholar.google.com/&scioq=source:chemsuschem+oxidative+addition+dft&hl=en&as_sdt=0,5&as_vis=1"
121,"Y Liu, D Zhou, T Deng, G He, A Chen, X Sun, ...","Research progress of oxygen evolution reaction catalysts for electrochemical water splitting",2021,"…","Wiley Online Library","https://chemistry-europe.onlinelibrary.wiley.com/doi/abs/10.1002/cssc.202101898","https://scholar.google.com/scholar?cites=3648372126793370176&as_sdt=2005&sciodt=0,5&hl=en",783,"2025-05-07 11:24:32","","10.1002/cssc.202101898","","",,,,,121,30.25,17,7,4,"… The high activity of Co-based double perovskites can be explained by the movement of the Fermi level in the center of the O−P band and predicted by density functional theory (DFT). …","https://chemistry-europe.onlinelibrary.wiley.com/doi/pdf/10.1002/cssc.202101898","https://scholar.google.com/scholar?q=related:QIr0kR6foTIJ:scholar.google.com/&scioq=source:chemsuschem+oxidative+addition+dft&hl=en&as_sdt=0,5&as_vis=1"
61,"Y Hu, H Yu, L Qi, J Dong, P Yan, ...","Interface Engineering of Needle‐Like P‐Doped MoS2/CoP Arrays as Highly Active and Durable Bifunctional Electrocatalyst for Overall Water Splitting",2021,"…","Wiley Online Library","https://chemistry-europe.onlinelibrary.wiley.com/doi/abs/10.1002/cssc.202002873","https://scholar.google.com/scholar?cites=14313387495035589418&as_sdt=2005&sciodt=0,5&hl=en",784,"2025-05-07 11:24:32","","10.1002/cssc.202002873","","",,,,,61,15.25,10,6,4,"Developing a bifunctional water splitting catalyst with high efficiency and low cost are crucial in the electrolysis water industry. Here, we report a rational design and simple preparation …","https://chemistry-europe.onlinelibrary.wiley.com/doi/pdf/10.1002/cssc.202002873","https://scholar.google.com/scholar?q=related:KlMdVhdeo8YJ:scholar.google.com/&scioq=source:chemsuschem+oxidative+addition+dft&hl=en&as_sdt=0,5&as_vis=1"
137,"B Saha, MM Abu‐Omar","Current Technologies, Economics, and Perspectives for 2, 5‐Dimethylfuran Production from Biomass‐Derived Intermediates",2015,"ChemSusChem","Wiley Online Library","https://chemistry-europe.onlinelibrary.wiley.com/doi/abs/10.1002/cssc.201403329","https://scholar.google.com/scholar?cites=13872901282334700994&as_sdt=2005&sciodt=0,5&hl=en",785,"2025-05-07 11:24:32","","10.1002/cssc.201403329","","",,,,,137,13.70,69,2,10,"Since the US Department of Energy (DOE) published a perspective article that described the potential of the top ten biomass‐derived platform chemicals as petroleum replacements for …","https://chemistry-europe.onlinelibrary.wiley.com/doi/pdfdirect/10.1002/cssc.201403329","https://scholar.google.com/scholar?q=related:wvWe6TZyhsAJ:scholar.google.com/&scioq=source:chemsuschem+oxidative+addition+dft&hl=en&as_sdt=0,5&as_vis=1"
