Cites,Authors,Title,Year,Source,Publisher,ArticleURL,CitesURL,GSRank,QueryDate,Type,DOI,ISSN,CitationURL,Volume,Issue,StartPage,EndPage,ECC,CitesPerYear,CitesPerAuthor,AuthorCount,Age,Abstract,FullTextURL,RelatedURL
1918,"EAB Kantchev, CJ O'Brien, ...","Palladium complexes of N‐heterocyclic carbenes as catalysts for cross‐coupling reactions—A synthetic chemist's perspective",2007,"Angewandte Chemie …","Wiley Online Library","https://onlinelibrary.wiley.com/doi/abs/10.1002/anie.200601663","https://scholar.google.com/scholar?cites=14124144468365728323&as_sdt=2005&sciodt=0,5&hl=en",144,"2025-04-26 13:02:21","","10.1002/anie.200601663","","",,,,,1918,106.56,639,3,18,"Palladium‐catalyzed CC and CN bond‐forming reactions are among the most versatile and powerful synthetic methods. For the last 15 years, N‐heterocyclic carbenes (NHCs) have …","https://onlinelibrary.wiley.com/doi/pdf/10.1002/anie.200601663","https://scholar.google.com/scholar?q=related:Q9o8oY8KA8QJ:scholar.google.com/&scioq=source:%22angewandte+chemie+international+edition%22+migratory+insertion+dft&hl=en&as_sdt=0,5&as_vis=1"
1,"P Luo, J Li, YH Deng, P Yu, Y Wang, ...","Switchable Chemo‐, Regio‐and Pseudo‐Stereodivergence in Palladium‐Catalyzed Cycloaddition of Allenes",2024,"Angewandte Chemie …","Wiley Online Library","https://onlinelibrary.wiley.com/doi/abs/10.1002/anie.202412179","https://scholar.google.com/scholar?cites=14494414645888213631&as_sdt=2005&sciodt=0,5&hl=en",145,"2025-04-26 13:02:21","","10.1002/anie.202412179","","",,,,,1,1.00,0,6,1,"… [4+2] cycloaddition, density functional theory (DFT) calculations were conducted … migratory insertion occurs, giving intermediate INT6C, which then undergoes alkene migratory insertion …","https://onlinelibrary.wiley.com/doi/pdf/10.1002/anie.202412179","https://scholar.google.com/scholar?q=related:f-JiY1OBJskJ:scholar.google.com/&scioq=source:%22angewandte+chemie+international+edition%22+migratory+insertion+dft&hl=en&as_sdt=0,5&as_vis=1"
2157,"D Kundu, E Talaie, V Duffort, ...","The emerging chemistry of sodium ion batteries for electrochemical energy storage",2015,"Angewandte Chemie …","Wiley Online Library","https://onlinelibrary.wiley.com/doi/abs/10.1002/anie.201410376","https://scholar.google.com/scholar?cites=7497435058319146751&as_sdt=2005&sciodt=0,5&hl=en",146,"2025-04-26 13:02:21","","10.1002/anie.201410376","","",,,,,2157,215.70,539,4,10,"… structure investigations based on DFT and Hartree–Fock methods, and methods based on interatomic potentials. DFT methods have been applied to oxide insertion materials. The …","https://onlinelibrary.wiley.com/doi/pdf/10.1002/anie.201410376","https://scholar.google.com/scholar?q=related:_z6sYXY9DGgJ:scholar.google.com/&scioq=source:%22angewandte+chemie+international+edition%22+migratory+insertion+dft&hl=en&as_sdt=0,5&as_vis=1"
4,"C Fan, U Dhawa, D Qian, D Sakic, ...","Regiodivergent and Enantioselective Synthesis of Cyclic Sulfones via Ligand‐Controlled Nickel‐Catalyzed Hydroalkylation",2024,"Angewandte Chemie …","Wiley Online Library","https://onlinelibrary.wiley.com/doi/abs/10.1002/anie.202406767","https://scholar.google.com/scholar?cites=11901607744979136125&as_sdt=2005&sciodt=0,5&hl=en",147,"2025-04-26 13:02:21","","10.1002/anie.202406767","","",,,,,4,4.00,1,5,1,"… Insertion of B into the alkene 1a gives a NiII-alkyl species (F). Both the enantioselectivity and regioselectivity are set at this migratory insertion … conducted density functional theory (DFT) …","https://onlinelibrary.wiley.com/doi/pdfdirect/10.1002/anie.202406767","https://scholar.google.com/scholar?q=related:fe6Exy8BK6UJ:scholar.google.com/&scioq=source:%22angewandte+chemie+international+edition%22+migratory+insertion+dft&hl=en&as_sdt=0,5&as_vis=1"
108,"QW Zhang, K An, LC Liu, S Guo, C Jiang, ...","Rhodium‐Catalyzed Intramolecular C− H Silylation by Silacyclobutanes",2016,"Angewandte Chemie …","Wiley Online Library","https://onlinelibrary.wiley.com/doi/abs/10.1002/anie.201602376","https://scholar.google.com/scholar?cites=7626646646454911246&as_sdt=2005&sciodt=0,5&hl=en",148,"2025-04-26 13:02:21","","10.1002/anie.201602376","","",,,,,108,12.00,18,6,9,"… insert into the SCB to form 5-membered silametallacycles. A signature reactivity of the resulting silametallacycles involves the migratory insertion … Although DFT calculations suggested …","https://onlinelibrary.wiley.com/doi/am-pdf/10.1002/ange.201602376","https://scholar.google.com/scholar?q=related:DoFenbdK12kJ:scholar.google.com/&scioq=source:%22angewandte+chemie+international+edition%22+migratory+insertion+dft&hl=en&as_sdt=0,5&as_vis=1"
481,"J Atzrodt, V Derdau, WJ Kerr, ...","C− H functionalisation for hydrogen isotope exchange",2018,"Angewandte Chemie …","Wiley Online Library","https://onlinelibrary.wiley.com/doi/abs/10.1002/anie.201708903","https://scholar.google.com/scholar?cites=4061172425449951324&as_sdt=2005&sciodt=0,5&hl=en",149,"2025-04-26 13:02:21","","10.1002/anie.201708903","","",,,,,481,68.71,120,4,7,"… migratory insertion across the Rh−D bond in one of two directions. Thermodynamic 1,2-insertion gives … This analysis was further corroborated by DFT-calculated energetics (Scheme 46, …","https://onlinelibrary.wiley.com/doi/pdfdirect/10.1002/anie.201708903","https://scholar.google.com/scholar?q=related:XFCOzs0uXDgJ:scholar.google.com/&scioq=source:%22angewandte+chemie+international+edition%22+migratory+insertion+dft&hl=en&as_sdt=0,5&as_vis=1"
583,"JA Milligan, JP Phelan, SO Badir, ...","Alkyl carbon–carbon bond formation by Nickel/Photoredox cross‐coupling",2019,"Angewandte Chemie …","Wiley Online Library","https://onlinelibrary.wiley.com/doi/abs/10.1002/anie.201809431","https://scholar.google.com/scholar?cites=17944021220391218580&as_sdt=2005&sciodt=0,5&hl=en",150,"2025-04-26 13:02:21","","10.1002/anie.201809431","","",,,,,583,97.17,146,4,6,"… Density functional theory (DFT) calculations suggest that … Furthermore, DFT calculations indicate that the … sequential β-hydride elimination and migratory insertion events to form a more …","https://pmc.ncbi.nlm.nih.gov/articles/PMC6551614/pdf/nihms-1027909.pdf","https://scholar.google.com/scholar?q=related:lG19ezr4BfkJ:scholar.google.com/&scioq=source:%22angewandte+chemie+international+edition%22+migratory+insertion+dft&hl=en&as_sdt=0,5&as_vis=1"
40,"C Wu, N Yoshikai","Cobalt‐Catalyzed Intramolecular Reactions between a Vinylcyclopropane and an Alkyne: Switchable [5+ 2] Cycloaddition and Homo‐Ene Pathways",2018,"Angewandte Chemie International Edition","Wiley Online Library","https://onlinelibrary.wiley.com/doi/abs/10.1002/anie.201803162","https://scholar.google.com/scholar?cites=8912340019790494458&as_sdt=2005&sciodt=0,5&hl=en",151,"2025-04-26 13:02:21","","10.1002/anie.201803162","","",,,,,40,5.71,20,2,7,"… C through β-carbon elimination and migratory insertion, respectively, and C−C reductive … of their divergence, we performed density functional theory (DFT) calculations on the reaction …","https://onlinelibrary.wiley.com/doi/pdf/10.1002/anie.201803162","https://scholar.google.com/scholar?q=related:-jocRQf-rnsJ:scholar.google.com/&scioq=source:%22angewandte+chemie+international+edition%22+migratory+insertion+dft&hl=en&as_sdt=0,5&as_vis=1"
626,"A Tortajada, F Juliá‐Hernández, ...","Transition‐metal‐catalyzed carboxylation reactions with carbon dioxide",2018,"Angewandte Chemie …","Wiley Online Library","https://onlinelibrary.wiley.com/doi/abs/10.1002/anie.201803186","https://scholar.google.com/scholar?cites=12666669402682824375&as_sdt=2005&sciodt=0,5&hl=en",152,"2025-04-26 13:02:21","","10.1002/anie.201803186","","",,,,,626,89.43,209,3,7,"… In 2014, a detailed DFT study suggested that the addition of MgCl 2 might accelerate CO 2 … elimination/migratory insertion sequence, thus setting the basis for a CO 2 insertion at distal …","https://onlinelibrary.wiley.com/doi/pdf/10.1002/anie.201803186","https://scholar.google.com/scholar?q=related:txY4-rUMya8J:scholar.google.com/&scioq=source:%22angewandte+chemie+international+edition%22+migratory+insertion+dft&hl=en&as_sdt=0,5&as_vis=1"
28,"AM Canfield, D Rodina, ...","Dienes as Versatile Substrates for Transition Metal‐Catalyzed Reactions",2024,"Angewandte Chemie …","Wiley Online Library","https://onlinelibrary.wiley.com/doi/abs/10.1002/anie.202401550","https://scholar.google.com/scholar?cites=3524328140104083013&as_sdt=2005&sciodt=0,5&hl=en",153,"2025-04-26 13:02:21","","10.1002/anie.202401550","","",,,,,28,28.00,9,3,1,"… CV experiments support migratory insertion of the diene into the Co–H bond to form a Co(III)–π-allyl species III, which can be reduced by the photocatalyst to generate a Co(II)–allyl …","https://onlinelibrary.wiley.com/doi/pdfdirect/10.1002/anie.202401550","https://scholar.google.com/scholar?q=related:RSbRTsXt6DAJ:scholar.google.com/&scioq=source:%22angewandte+chemie+international+edition%22+migratory+insertion+dft&hl=en&as_sdt=0,5&as_vis=1"
9,"N Jiang, PZ Liu, ZZ Pan, SQ Wang, ...","Asymmetric Synthesis of Trisubstituted Vicinal Diols through Copper (I)‐Catalyzed Diastereoselective and Enantioselective Allylation of Ketones with …",2024,"Angewandte Chemie …","Wiley Online Library","https://onlinelibrary.wiley.com/doi/abs/10.1002/anie.202402195","https://scholar.google.com/scholar?cites=7228367153804730522&as_sdt=2005&sciodt=0,5&hl=en",154,"2025-04-26 13:02:21","","10.1002/anie.202402195","","",,,,,9,9.00,2,5,1,"… In order to reveal stereocontrols of chiral ligands and siloxyl substituents, DFT calculations were … starts from the formation of the [CuH] species, followed by migratory insertion with 1a …","https://onlinelibrary.wiley.com/doi/pdf/10.1002/anie.202402195","https://scholar.google.com/scholar?q=related:muCh_KBRUGQJ:scholar.google.com/&scioq=source:%22angewandte+chemie+international+edition%22+migratory+insertion+dft&hl=en&as_sdt=0,5&as_vis=1"
107,"J Peng, B Zhang, W Hua, Y Liang, ...","A disordered Rubik's cube‐inspired framework for sodium‐ion batteries with ultralong cycle lifespan",2023,"Angewandte Chemie …","Wiley Online Library","https://onlinelibrary.wiley.com/doi/abs/10.1002/anie.202215865","https://scholar.google.com/scholar?cites=5399192083873690660&as_sdt=2005&sciodt=0,5&hl=en",155,"2025-04-26 13:02:21","","10.1002/anie.202215865","","",,,,,107,53.50,21,5,2,"… Its quasi‐zero‐strain reaction mechanism and high sodium diffusion coefficient have been measured and analyzed by multiple in situ techniques and density functional theory …","https://onlinelibrary.wiley.com/doi/pdf/10.1002/anie.202215865","https://scholar.google.com/scholar?q=related:JHRkGZjI7UoJ:scholar.google.com/&scioq=source:%22angewandte+chemie+international+edition%22+migratory+insertion+dft&hl=en&as_sdt=0,5&as_vis=1"
3,"M Mrozowicz, S Chatterjee, ...","Meta‐Dimethylation of Arenes via Catellani Reaction from Aryl Thianthrenium Salts",2025,"Angewandte Chemie …","Wiley Online Library","https://onlinelibrary.wiley.com/doi/abs/10.1002/anie.202419472","https://scholar.google.com/scholar?cites=1201502463989633533&as_sdt=2005&sciodt=0,5&hl=en",156,"2025-04-26 13:02:21","","10.1002/anie.202419472","","",,,,,3,3.00,1,3,1,"… (NBE) to reversibly engage in migratory insertion into arylpalladium species and serve as a … A DFT computational study on the crucial initial steps post oxidative addition to the aryl …","https://onlinelibrary.wiley.com/doi/pdf/10.1002/anie.202419472","https://scholar.google.com/scholar?q=related:_dHbCiCYrBAJ:scholar.google.com/&scioq=source:%22angewandte+chemie+international+edition%22+migratory+insertion+dft&hl=en&as_sdt=0,5&as_vis=1"
52,"S Sarkar, KPS Cheung, ...","Recent advances in visible light induced palladium catalysis",2024,"Angewandte Chemie …","Wiley Online Library","https://onlinelibrary.wiley.com/doi/abs/10.1002/anie.202311972","https://scholar.google.com/scholar?cites=5481509103496097023&as_sdt=2005&sciodt=0,5&hl=en",157,"2025-04-26 13:02:21","","10.1002/anie.202311972","","",,,,,52,52.00,17,3,1,"… 16), the authors proposed migratory insertion of the oxidative … formation of the photolabile migratory insertion complex B′ (… step, which was supported by the DFT studies. A nucleophilic …","https://onlinelibrary.wiley.com/doi/pdfdirect/10.1002/anie.202311972","https://scholar.google.com/scholar?q=related:_2z0wnw7EkwJ:scholar.google.com/&scioq=source:%22angewandte+chemie+international+edition%22+migratory+insertion+dft&hl=en&as_sdt=0,5&as_vis=1"
111,"YC Lee, K Kumar, H Waldmann","Ligand‐Directed Divergent Synthesis of Carbo‐and Heterocyclic Ring Systems",2018,"… Chemie International Edition","Wiley Online Library","https://onlinelibrary.wiley.com/doi/abs/10.1002/anie.201710247","https://scholar.google.com/scholar?cites=8143984041190565096&as_sdt=2005&sciodt=0,5&hl=en",158,"2025-04-26 13:02:21","","10.1002/anie.201710247","","",,,,,111,15.86,37,3,7,"… Acetylene insertion to 201 and 204, followed a similar alkyne migratory insertion and … As indicated by DFT calculations, the sterics of the ligand determined the reaction pathway …","https://onlinelibrary.wiley.com/doi/pdfdirect/10.1002/anie.201710247","https://scholar.google.com/scholar?q=related:6CSdN1Y-BXEJ:scholar.google.com/&scioq=source:%22angewandte+chemie+international+edition%22+migratory+insertion+dft&hl=en&as_sdt=0,5&as_vis=1"
173,"W Su, TJ Gong, X Lu, MY Xu, CG Yu, ...","Ligand‐Controlled Regiodivergent Copper‐Catalyzed Alkylboration of Alkenes",2015,"Angewandte Chemie …","Wiley Online Library","https://onlinelibrary.wiley.com/doi/abs/10.1002/anie.201506713","https://scholar.google.com/scholar?cites=3459817757481411999&as_sdt=2005&sciodt=0,5&hl=en",159,"2025-04-26 13:02:21","","10.1002/anie.201506713","","",,,,,173,17.30,29,6,10,"… are generated in situ by the migratory insertion of CuBpin complexes across alkenes; 12 … Indeed, DFT calculations of the relative Gibbs free energies of the alkene addition transition …","https://onlinelibrary.wiley.com/doi/pdf/10.1002/anie.201506713","https://scholar.google.com/scholar?q=related:n6VEZuu9AzAJ:scholar.google.com/&scioq=source:%22angewandte+chemie+international+edition%22+migratory+insertion+dft&hl=en&as_sdt=0,5&as_vis=1"
8,"Y Nikolova, B Fabri, P Moneva Lorente, ...","Chemo‐ and Regioselective Multiple C(sp2)−H Insertions of Malonate Metal Carbenes for Late‐Stage Functionalizations of Azahelicenes",2022,"Angewandte Chemie …","Wiley Online Library","https://onlinelibrary.wiley.com/doi/abs/10.1002/anie.202210798","https://scholar.google.com/scholar?cites=2858667007472035184&as_sdt=2005&sciodt=0,5&hl=en",160,"2025-04-26 13:02:21","","10.1002/anie.202210798","","",,,,,8,2.67,2,4,3,"… Density-functional theory elucidates the carbene insertion selectivity and clarifies the … Density-functional theory further elucidates the origin of the carbene insertion selectivity and also …","https://onlinelibrary.wiley.com/doi/pdf/10.1002/anie.202210798","https://scholar.google.com/scholar?q=related:cOV_V38GrCcJ:scholar.google.com/&scioq=source:%22angewandte+chemie+international+edition%22+migratory+insertion+dft&hl=en&as_sdt=0,5&as_vis=1"
31,"S Feng, F Mo, Y Xia, Z Liu, Z Liu, ...","Rhodium (I)‐Catalyzed C− C Bond Activation of Siloxyvinylcyclopropanes with Diazoesters",2016,"Angewandte Chemie …","Wiley Online Library","https://onlinelibrary.wiley.com/doi/abs/10.1002/anie.201609642","https://scholar.google.com/scholar?cites=10383113683882431191&as_sdt=2005&sciodt=0,5&hl=en",161,"2025-04-26 13:02:21","","10.1002/anie.201609642","","",,,,,31,3.44,5,6,9,"… DFT calculations suggest that rhodium(I)-… migratory insertion process has captured our attention. We have previously demonstrated a rhodium(I)-catalyzed formal carbene insertion into …","https://onlinelibrary.wiley.com/doi/pdf/10.1002/anie.201609642","https://scholar.google.com/scholar?q=related:11JPJuI6GJAJ:scholar.google.com/&scioq=source:%22angewandte+chemie+international+edition%22+migratory+insertion+dft&hl=en&as_sdt=0,5&as_vis=1"
75,"H Braunschweig, WC Ewing, ...","The Reactivities of Iminoboranes with Carbenes: BN Isosteres of Carbene–Alkyne Adducts",2015,"Angewandte Chemie …","Wiley Online Library","https://onlinelibrary.wiley.com/doi/abs/10.1002/anie.201409699","https://scholar.google.com/scholar?cites=9705011202793480954&as_sdt=2005&sciodt=0,5&hl=en",162,"2025-04-26 13:02:21","","10.1002/anie.201409699","","",,,,,75,7.50,25,3,10,"… stretching vibrations qualitatively agree with simulations based on DFT analysis (Table S1). … 5 as the product of insertion at the 4-position of IPr, generating an aminoborane. DFT/GIAO …","https://onlinelibrary.wiley.com/doi/pdf/10.1002/anie.201409699","https://scholar.google.com/scholar?q=related:-iKxA0Ugr4YJ:scholar.google.com/&scioq=source:%22angewandte+chemie+international+edition%22+migratory+insertion+dft&hl=en&as_sdt=0,5&as_vis=1"
29,"Y Bai, Z Wang, N Qin, D Ma, W Fu, ...","Two‐Step Redox in Polyimide: Witness by In Situ Electron Paramagnetic Resonance in Lithium‐ion Batteries",2023,"Angewandte Chemie …","Wiley Online Library","https://onlinelibrary.wiley.com/doi/abs/10.1002/anie.202303162","https://scholar.google.com/scholar?cites=1802955403021978833&as_sdt=2005&sciodt=0,5&hl=en",163,"2025-04-26 13:02:21","","10.1002/anie.202303162","","",,,,,29,14.50,5,6,2,"… For a profound understanding of this redox process, we employed density functional theory (DFT) calculations for the model molecule (PI), radical (Li + PI⋅ − ) and dianion fragment ([…","https://onlinelibrary.wiley.com/doi/pdf/10.1002/anie.202303162","https://scholar.google.com/scholar?q=related:0Qz_9mJiBRkJ:scholar.google.com/&scioq=source:%22angewandte+chemie+international+edition%22+migratory+insertion+dft&hl=en&as_sdt=0,5&as_vis=1"
135,"BM Trost, LC Czabaniuk","Structure and Reactivity of Late Transition Metal η3‐Benzyl Complexes",2014,"Angewandte Chemie International …","Wiley Online Library","https://onlinelibrary.wiley.com/doi/abs/10.1002/anie.201305972","https://scholar.google.com/scholar?cites=14301417182956315958&as_sdt=2005&sciodt=0,5&hl=en",164,"2025-04-26 13:02:21","","10.1002/anie.201305972","","",,,,,135,12.27,68,2,11,"… Under an atmosphere of carbon monoxide, migratory insertion to generate a cobalt acyl was observed. … DFT calculations support the proposed η 3 -benzyl-rhodium intermediate. …","https://onlinelibrary.wiley.com/doi/pdfdirect/10.1002/anie.201305972","https://scholar.google.com/scholar?q=related:NmXH3ifXeMYJ:scholar.google.com/&scioq=source:%22angewandte+chemie+international+edition%22+migratory+insertion+dft&hl=en&as_sdt=0,5&as_vis=1"
115,"C Niu, W Luo, C Dai, C Yu, Y Xu","High‐voltage‐tolerant covalent organic framework electrolyte with holistically oriented channels for solid‐state lithium metal batteries with nickel‐rich cathodes",2021,"… Chemie International Edition","Wiley Online Library","https://onlinelibrary.wiley.com/doi/abs/10.1002/anie.202107444","https://scholar.google.com/scholar?cites=7368545168395627246&as_sdt=2005&sciodt=0,5&hl=en",165,"2025-04-26 13:02:21","","10.1002/anie.202107444","","",,,,,115,28.75,23,5,4,"… COF SSE thin film with holistically oriented ion migration channels via two steps (Scheme 1). … The electrochemically stability of Q-COFs was revealed by density functional theory (DFT) …","https://onlinelibrary.wiley.com/doi/pdf/10.1002/anie.202107444","https://scholar.google.com/scholar?q=related:7mqkWcpUQmYJ:scholar.google.com/&scioq=source:%22angewandte+chemie+international+edition%22+migratory+insertion+dft&hl=en&as_sdt=0,5&as_vis=1"
65,"J Sietmann, JM Wahl","Enantioselective desymmetrization of cyclobutanones: a speedway to molecular complexity",2020,"Angewandte Chemie International …","Wiley Online Library","https://onlinelibrary.wiley.com/doi/abs/10.1002/anie.201910767","https://scholar.google.com/scholar?cites=3187611120216370336&as_sdt=2005&sciodt=0,5&hl=en",166,"2025-04-26 13:02:21","","10.1002/anie.201910767","","",,,,,65,13.00,33,2,5,"… by another migratory insertion through addition of a Michael … 64 undergoes migratory insertion to give bicyclic rhodacycle … 56a DFT calculations suggest an alternative mechanism in …","https://onlinelibrary.wiley.com/doi/pdfdirect/10.1002/anie.201910767","https://scholar.google.com/scholar?q=related:oOyU1myrPCwJ:scholar.google.com/&scioq=source:%22angewandte+chemie+international+edition%22+migratory+insertion+dft&hl=en&as_sdt=0,5&as_vis=1"
55,"SS Zhang, TJ Hu, MY Li, YK Song, ...","Asymmetric Alkenylation of Enones and Imines Enabled by A Highly Efficient Aryl to Vinyl 1, 4‐Rhodium Migration",2019,"Angewandte Chemie …","Wiley Online Library","https://onlinelibrary.wiley.com/doi/abs/10.1002/anie.201813585","https://scholar.google.com/scholar?cites=8664102842411193197&as_sdt=2005&sciodt=0,5&hl=en",167,"2025-04-26 13:02:21","","10.1002/anie.201813585","","",,,,,55,9.17,11,5,6,"… rhodium migration … DFT calculations revealed that the excellent migration efficiency is attributed to a kinetically favored process. Further application of this unique 1,4-rhodium migration …","https://onlinelibrary.wiley.com/doi/pdf/10.1002/anie.201813585","https://scholar.google.com/scholar?q=related:bRNfe6ETPXgJ:scholar.google.com/&scioq=source:%22angewandte+chemie+international+edition%22+migratory+insertion+dft&hl=en&as_sdt=0,5&as_vis=1"
2,"C Li, XW Chen, LL Liao, YY Gui, ...","Nickel‐Catalyzed Atroposelective Carbo‐Carboxylation of Alkynes with CO2: En Route to Axially Chiral Carboxylic Acids",2025,"Angewandte Chemie …","Wiley Online Library","https://onlinelibrary.wiley.com/doi/abs/10.1002/anie.202413305","https://scholar.google.com/scholar?cites=2071570870306321761&as_sdt=2005&sciodt=0,5&hl=en",168,"2025-04-26 13:02:21","","10.1002/anie.202413305","","",,,,,2,2.00,0,5,1,"… might be competitive to the migratory insertion of alkynes and … , we performed density functional theory (DFT) calculations to … -IN, which might undergo a direct insertion of alkyne to C−Ni(…","https://onlinelibrary.wiley.com/doi/pdf/10.1002/anie.202413305","https://scholar.google.com/scholar?q=related:YbWnG7uyvxwJ:scholar.google.com/&scioq=source:%22angewandte+chemie+international+edition%22+migratory+insertion+dft&hl=en&as_sdt=0,5&as_vis=1"
1,"JS Yang, XY Wang, YY Li, FM Zhang, ...","Catalytic Asymmetric 1, 4‐Hydrocarbonation of 1, 3‐Enynes via Photoredox/Cobalt/Chromium Triple Catalysis",2025,"Angewandte Chemie …","Wiley Online Library","https://onlinelibrary.wiley.com/doi/abs/10.1002/anie.202420563","https://scholar.google.com/scholar?cites=12902678473699917944&as_sdt=2005&sciodt=0,5&hl=en",169,"2025-04-26 13:02:21","","10.1002/anie.202420563","","",,,,,1,1.00,0,5,1,"… to be exploited owing to the canonical migratory insertion of metal hydride into olefin units … Furthermore, mechanistic studies and density functional theory (DFT) calculations revealed …","https://onlinelibrary.wiley.com/doi/pdf/10.1002/anie.202420563","https://scholar.google.com/scholar?q=related:eID247WFD7MJ:scholar.google.com/&scioq=source:%22angewandte+chemie+international+edition%22+migratory+insertion+dft&hl=en&as_sdt=0,5&as_vis=1"
1,"P Hu, W Xu, L Tian, H Zhu, F Li, X Qi, ...","Electrocatalytic Hydrogenation of Olefins",2025,"Angewandte Chemie …","Wiley Online Library","https://onlinelibrary.wiley.com/doi/abs/10.1002/anie.202501215","https://scholar.google.com/scholar?cites=15659131586007819351&as_sdt=2005&sciodt=0,5&hl=en",170,"2025-04-26 13:02:21","","10.1002/anie.202501215","","",,,,,1,1.00,0,7,1,"… In addition, density functional theory (DFT) calculations were … C=C double bonds, is used in DFT calculation. Four alkene … were located for the selective migratory alkene insertion into Pt-…","https://onlinelibrary.wiley.com/doi/pdf/10.1002/anie.202501215","https://scholar.google.com/scholar?q=related:V2QYOzZpUNkJ:scholar.google.com/&scioq=source:%22angewandte+chemie+international+edition%22+migratory+insertion+dft&hl=en&as_sdt=0,5&as_vis=1"
21,"F Della‐Felice, M Zanini, X Jie, E Tan, ...","Rhodium(III)‐Catalyzed Synthesis of Skipped Enynes via C(sp3)–H Alkynylation of Terminal Alkenes",2021,"Angewandte Chemie …","Wiley Online Library","https://onlinelibrary.wiley.com/doi/abs/10.1002/anie.202014877","https://scholar.google.com/scholar?cites=17744751209430695647&as_sdt=2005&sciodt=0,5&hl=en",171,"2025-04-26 13:02:21","","10.1002/anie.202014877","","",,,,,21,5.25,4,5,4,"… Density functional theory calculations25 where undertaken to better … α-Migratory insertion was as well calculated for 1 ee and proved to be kinetically disfavored compared to γ-migration …","https://onlinelibrary.wiley.com/doi/pdfdirect/10.1002/anie.202014877","https://scholar.google.com/scholar?q=related:377MkTUFQvYJ:scholar.google.com/&scioq=source:%22angewandte+chemie+international+edition%22+migratory+insertion+dft&hl=en&as_sdt=0,5&as_vis=1"
41,"MW Stanford, JI Schweizer, M Menche, ...","Intercepting the Disilene‐Silylsilylene Equilibrium",2019,"Angewandte Chemie …","Wiley Online Library","https://onlinelibrary.wiley.com/doi/abs/10.1002/anie.201810056","https://scholar.google.com/scholar?cites=7300933043689876685&as_sdt=2005&sciodt=0,5&hl=en",172,"2025-04-26 13:02:21","","10.1002/anie.201810056","","",,,,,41,6.83,10,4,6,"… of a trimethylsilyl group is preferred over hydrogen migration. A DFT study of the reaction … To evaluate the bonding in 3, we performed density functional theory (DFT) calculations. A …","https://onlinelibrary.wiley.com/doi/pdf/10.1002/anie.201810056","https://scholar.google.com/scholar?q=related:zewL1usfUmUJ:scholar.google.com/&scioq=source:%22angewandte+chemie+international+edition%22+migratory+insertion+dft&hl=en&as_sdt=0,5&as_vis=1"
