Cites,Authors,Title,Year,Source,Publisher,ArticleURL,CitesURL,GSRank,QueryDate,Type,DOI,ISSN,CitationURL,Volume,Issue,StartPage,EndPage,ECC,CitesPerYear,CitesPerAuthor,AuthorCount,Age,Abstract,FullTextURL,RelatedURL
321,"I Marek, A Masarwa, PO Delaye…","Selective carbon–carbon bond cleavage for the stereoselective synthesis of acyclic systems",2015,"Angewandte Chemie …","Wiley Online Library","https://onlinelibrary.wiley.com/doi/abs/10.1002/anie.201405067","https://scholar.google.com/scholar?cites=5974823891912716413&as_sdt=2005&sciodt=0,5&hl=en",116,"2025-05-07 02:25:16","","10.1002/anie.201405067","","",,,,,321,32.10,80,4,10,"… This system is very effective mainly for hydrogenation and … transformed either into a β-silyl ketone 19 through oxidation or into a … step was recently confirmed by DFT calculations (for the …","https://onlinelibrary.wiley.com/doi/pdf/10.1002/anie.201405067","https://scholar.google.com/scholar?q=related:fXD5eKzW6lIJ:scholar.google.com/&scioq=source:%22angewandte+chemie+international+edition%22+ketone+hydrogenation+dft&hl=en&as_sdt=0,5&as_vis=1"
88,"VA Pollard, MÁ Fuentes, AR Kennedy…","Comparing neutral (monometallic) and anionic (bimetallic) aluminum complexes in hydroboration catalysis: influences of lithium cooperation and ligand set",2018,"Angewandte Chemie …","Wiley Online Library","https://onlinelibrary.wiley.com/doi/abs/10.1002/anie.201806168","https://scholar.google.com/scholar?cites=9096187387160124702&as_sdt=2005&sciodt=0,5&hl=en",117,"2025-05-07 02:25:16","","10.1002/anie.201806168","","",,,,,88,12.57,22,4,7,"… hydrogenation using catalytic LiAlH 4 illuminates the important role of the alkali metal, via DFT … This study into hydroboration of aldehydes, ketones and imines reveals that anionic ate …","https://onlinelibrary.wiley.com/doi/pdf/10.1002/anie.201806168","https://scholar.google.com/scholar?q=related:Hl0RJjwmPH4J:scholar.google.com/&scioq=source:%22angewandte+chemie+international+edition%22+ketone+hydrogenation+dft&hl=en&as_sdt=0,5&as_vis=1"
26,"Y Gong, C Wang, F Zhou, K Liao…","Sulfonyl‐PYBOX ligands enable kinetic resolution of α‐tertiary azides by CuAAC",2023,"Angewandte Chemie …","Wiley Online Library","https://onlinelibrary.wiley.com/doi/abs/10.1002/anie.202301470","https://scholar.google.com/scholar?cites=12815394802159840018&as_sdt=2005&sciodt=0,5&hl=en",118,"2025-05-07 02:25:16","","10.1002/anie.202301470","","",,,,,26,13.00,5,5,2,"… is rationalized by DFT calculations. … -catalyzed hydrogenation, α-amino cyclopentenone 6 and cyclopentanone 7, respectively, were obtained. The borohydride reduction of both ketone …","https://onlinelibrary.wiley.com/doi/pdfdirect/10.1002/anie.202301470","https://scholar.google.com/scholar?q=related:Eusfd6xt2bEJ:scholar.google.com/&scioq=source:%22angewandte+chemie+international+edition%22+ketone+hydrogenation+dft&hl=en&as_sdt=0,5&as_vis=1"
42,"ASK Hashmi","Fire and ice: A gold (III) monohydride",2012,"Angewandte Chemie International Edition","Wiley Online Library","https://onlinelibrary.wiley.com/doi/abs/10.1002/anie.201208603","https://scholar.google.com/scholar?cites=11195840460786964847&as_sdt=2005&sciodt=0,5&hl=en",119,"2025-05-07 02:25:16","","10.1002/anie.201208603","","",,,,,42,3.23,42,1,13,"… ketones and imines, 11 , 13 the hydroboration of imines, 14 CH activation, 15 and the enantioselective hydrogenation … catalyzed hydrogenation reactions, a pathway supported by DFT …","https://onlinelibrary.wiley.com/doi/pdf/10.1002/anie.201208603","https://scholar.google.com/scholar?q=related:bxknu5SdX5sJ:scholar.google.com/&scioq=source:%22angewandte+chemie+international+edition%22+ketone+hydrogenation+dft&hl=en&as_sdt=0,5&as_vis=1"
79,"J Landmann, F Keppner, DB Hofmann…","Deprotonation of a hydridoborate anion",2017,"Angewandte Chemie …","Wiley Online Library","https://onlinelibrary.wiley.com/doi/abs/10.1002/anie.201611899","https://scholar.google.com/scholar?cites=2124243299260868861&as_sdt=2005&sciodt=0,5&hl=en",120,"2025-05-07 02:25:16","","10.1002/anie.201611899","","",,,,,79,9.88,20,4,8,"… Hydride®) 2 is a stronger hydrogenation and reducing agent than Na[… In contrast to the reaction of 6 with (Me 3 Si) 2 N − , DFT … Dianion 7 undergoes hydrolysis to give the ketone [PhC(O)…","https://onlinelibrary.wiley.com/doi/pdf/10.1002/anie.201611899","https://scholar.google.com/scholar?q=related:_ajypAbUeh0J:scholar.google.com/&scioq=source:%22angewandte+chemie+international+edition%22+ketone+hydrogenation+dft&hl=en&as_sdt=0,5&as_vis=1"
33,"Y Jiang, K Yang, Y Wei, Q Wang, SJ Li…","Catalytic Multicomponent Synthesis of C‐Acyl Glycosides by Consecutive Cross‐Electrophile Couplings",2022,"Angewandte Chemie …","Wiley Online Library","https://onlinelibrary.wiley.com/doi/abs/10.1002/anie.202211043","https://scholar.google.com/scholar?cites=10951698613222301993&as_sdt=2005&sciodt=0,5&hl=en",121,"2025-05-07 02:25:16","","10.1002/anie.202211043","","",,,,,33,11.00,6,6,3,"… homocoupling of 1 affording ketone 9 was not detected (<2 %), … Based on this deliberation, density functional theory (DFT) … The products could be subjected to hydrogenation to furnish …","https://onlinelibrary.wiley.com/doi/pdf/10.1002/anie.202211043","https://scholar.google.com/scholar?q=related:KeFAON0__JcJ:scholar.google.com/&scioq=source:%22angewandte+chemie+international+edition%22+ketone+hydrogenation+dft&hl=en&as_sdt=0,5&as_vis=1"
3878,"ASK Hashmi, GJ Hutchings","Gold catalysis",2006,"… Chemie International Edition","Wiley Online Library","https://onlinelibrary.wiley.com/doi/abs/10.1002/anie.200602454","https://scholar.google.com/scholar?cites=7058854572765738467&as_sdt=2005&sciodt=0,5&hl=en",122,"2025-05-07 02:25:16","","10.1002/anie.200602454","","",,,,,3878,204.11,1939,2,19,"… Gold-catalyzed hydrogenation is not only the oldest of the … the successful hydrosilylation of ketones and imines with PhMe … Lopez and Nørskov showed by using DFT calculations that the …","https://onlinelibrary.wiley.com/doi/pdfdirect/10.1002/anie.200602454","https://scholar.google.com/scholar?q=related:4_XXotUW9mEJ:scholar.google.com/&scioq=source:%22angewandte+chemie+international+edition%22+ketone+hydrogenation+dft&hl=en&as_sdt=0,5&as_vis=1"
9,"M Hu, H Ding, W DeSnoo, DJ Tantillo…","The construction of highly substituted piperidines via Dearomative Functionalization reaction",2023,"Angewandte Chemie …","Wiley Online Library","https://onlinelibrary.wiley.com/doi/abs/10.1002/anie.202315108","https://scholar.google.com/scholar?cites=3149061145177949487&as_sdt=2005&sciodt=0,5&hl=en",123,"2025-05-07 02:25:16","","10.1002/anie.202315108","","",,,,,9,4.50,2,5,2,"… Experimental studies and Density Functional Theory (DFT) … Even more challenging functional handles such as ketones (52)… Furthermore, the selective hydrogenation of the alkene within …","https://onlinelibrary.wiley.com/doi/pdfdirect/10.1002/anie.202315108","https://scholar.google.com/scholar?q=related:LwVRVm22sysJ:scholar.google.com/&scioq=source:%22angewandte+chemie+international+edition%22+ketone+hydrogenation+dft&hl=en&as_sdt=0,5&as_vis=1"
1039,"S Yu, S Ma","Allenes in catalytic asymmetric synthesis and natural product syntheses",2012,"Angewandte Chemie International Edition","Wiley Online Library","https://onlinelibrary.wiley.com/doi/abs/10.1002/anie.201101460","https://scholar.google.com/scholar?cites=8637649444882559479&as_sdt=2005&sciodt=0,5&hl=en",124,"2025-05-07 02:25:16","","10.1002/anie.201101460","","",,,,,1039,79.92,520,2,13,"… – 10 Allenyl vinyl ketone with an alkoxyl substituent was … Lindlar hydrogenation afforded the Z alkenes in high yields. … However, DFT calculations have suggested that the tertiary allyl …","https://onlinelibrary.wiley.com/doi/pdf/10.1002/anie.201101460","https://scholar.google.com/scholar?q=related:9zGT6GcY33cJ:scholar.google.com/&scioq=source:%22angewandte+chemie+international+edition%22+ketone+hydrogenation+dft&hl=en&as_sdt=0,5&as_vis=1"
60,"S Jana, VJ Mayerhofer…","Photo‐and Electrochemical Cobalt Catalysed Hydrogen Atom Transfer for the Hydrofunctionalisation of Alkenes",2023,"Angewandte Chemie …","Wiley Online Library","https://onlinelibrary.wiley.com/doi/abs/10.1002/anie.202304882","https://scholar.google.com/scholar?cites=12332228094597594717&as_sdt=2005&sciodt=0,5&hl=en",125,"2025-05-07 02:25:16","","10.1002/anie.202304882","","",,,,,60,30.00,20,3,2,"… was rationalised by DFT (density functional theory) studies … fluorides to form densely functionalised ketones in a mild and … This elegant example allows hydrogenation of a wide range …","https://onlinelibrary.wiley.com/doi/pdfdirect/10.1002/anie.202304882","https://scholar.google.com/scholar?q=related:Xf6U8xzgJKsJ:scholar.google.com/&scioq=source:%22angewandte+chemie+international+edition%22+ketone+hydrogenation+dft&hl=en&as_sdt=0,5&as_vis=1"
20,"CN Chen, WM Cheng, JK Wang…","Gold‐Catalyzed [3+ 2]‐Annulations of α‐Aryl Diazoketones with the Tetrasubstituted Alkenes of Cyclopentadienes: High Stereoselectivity and Enantioselectivity",2021,"Angewandte Chemie …","Wiley Online Library","https://onlinelibrary.wiley.com/doi/abs/10.1002/anie.202012611","https://scholar.google.com/scholar?cites=18396584597241022652&as_sdt=2005&sciodt=0,5&hl=en",126,"2025-05-07 02:25:16","","10.1002/anie.202012611","","",,,,,20,5.00,5,4,4,"… of α-diazo ketones with highly substituted cyclopentadienes, … Selective hydrogenation of compound 6 d in EtOH/DCM at 0 C … Our DFT calculations with simplified ligands and acids in …","https://onlinelibrary.wiley.com/doi/pdf/10.1002/anie.202012611","https://scholar.google.com/scholar?q=related:vEj5zjjMTf8J:scholar.google.com/&scioq=source:%22angewandte+chemie+international+edition%22+ketone+hydrogenation+dft&hl=en&as_sdt=0,5&as_vis=1"
967,"J Piera, JE Bäckvall","Catalytic oxidation of organic substrates by molecular oxygen and hydrogen peroxide by multistep electron transfer—a biomimetic approach",2008,"Angewandte Chemie International …","Wiley Online Library","https://onlinelibrary.wiley.com/doi/abs/10.1002/anie.200700604","https://scholar.google.com/scholar?cites=2920818558682721638&as_sdt=2005&sciodt=0,5&hl=en",127,"2025-05-07 02:25:16","","10.1002/anie.200700604","","",,,,,967,56.88,484,2,17,"… hydrogenation catalysts. More recently, the ruthenium-catalyzed dehydrogenation of alcohols to give H 2 and a ketone … -transfer cascades were rationalized by DFT calculations. It was …","https://onlinelibrary.wiley.com/doi/pdf/10.1002/anie.200700604","https://scholar.google.com/scholar?q=related:Zu2mAwHViCgJ:scholar.google.com/&scioq=source:%22angewandte+chemie+international+edition%22+ketone+hydrogenation+dft&hl=en&as_sdt=0,5&as_vis=1"
33,"HG Cheng, Z Yang, R Chen, L Cao…","A concise total synthesis of (−)‐Berkelic acid",2021,"Angewandte Chemie …","Wiley Online Library","https://onlinelibrary.wiley.com/doi/abs/10.1002/anie.202014660","https://scholar.google.com/scholar?cites=6285242041212515157&as_sdt=2005&sciodt=0,5&hl=en",128,"2025-05-07 02:25:16","","10.1002/anie.202014660","","",,,,,33,8.25,7,5,4,"… the direct synthesis of functionalized dialkyl ketones via a nickel-… group through catalytic hydrogenation and the acetonide … , we carried out density functional theory (DFT) calculations (…","https://onlinelibrary.wiley.com/doi/pdf/10.1002/anie.202014660","https://scholar.google.com/scholar?q=related:VbPS-VWqOVcJ:scholar.google.com/&scioq=source:%22angewandte+chemie+international+edition%22+ketone+hydrogenation+dft&hl=en&as_sdt=0,5&as_vis=1"
4,"C Fan, U Dhawa, D Qian, D Sakic…","Regiodivergent and Enantioselective Synthesis of Cyclic Sulfones via Ligand‐Controlled Nickel‐Catalyzed Hydroalkylation",2024,"Angewandte Chemie …","Wiley Online Library","https://onlinelibrary.wiley.com/doi/abs/10.1002/anie.202406767","https://scholar.google.com/scholar?cites=11901607744979136125&as_sdt=2005&sciodt=0,5&hl=en",129,"2025-05-07 02:25:16","","10.1002/anie.202406767","","",,,,,4,4.00,1,5,1,"… [2] Structurally, sulfones are regarded as bioisosteres of ketones and … Asymmetric hydrogenation, cyclization, or cycloaddition … , we conducted density functional theory (DFT) …","https://onlinelibrary.wiley.com/doi/pdfdirect/10.1002/anie.202406767","https://scholar.google.com/scholar?q=related:fe6Exy8BK6UJ:scholar.google.com/&scioq=source:%22angewandte+chemie+international+edition%22+ketone+hydrogenation+dft&hl=en&as_sdt=0,5&as_vis=1"
48,"M Strohmeier, K Leach, MA Zajac","Asymmetric conjugate addition of glycine derivatives under copper catalysis",2011,"… Chemie International Edition","researchgate.net","https://www.researchgate.net/profile/Matthew-Zajac/publication/51748916_ChemInform_Abstract_Asymmetric_Conjugate_Addition_of_Glycine_Derivatives_under_Copper_Catalysis/links/612e217e2b40ec7d8bd5e3c9/ChemInform-Abstract-Asymmetric-Conjugate-Addition-of-Glycine-Derivatives-under-Copper-Catalysis.pdf","https://scholar.google.com/scholar?cites=2616650937765654602&as_sdt=2005&sciodt=0,5&hl=en",130,"2025-05-07 02:25:16","PDF","","","",,,,,48,3.43,16,3,14,"… [3c] Alkyl- and arylvinyl ketones both proved to be viable … The resulting imine product was then hydrogenated with Pt/C … Density functional theory (DFT) full structure optimizations …","https://www.researchgate.net/profile/Matthew-Zajac/publication/51748916_ChemInform_Abstract_Asymmetric_Conjugate_Addition_of_Glycine_Derivatives_under_Copper_Catalysis/links/612e217e2b40ec7d8bd5e3c9/ChemInform-Abstract-Asymmetric-Conjugate-Addition-of-Glycine-Derivatives-under-Copper-Catalysis.pdf","https://scholar.google.com/scholar?q=related:SvC2Dio2UCQJ:scholar.google.com/&scioq=source:%22angewandte+chemie+international+edition%22+ketone+hydrogenation+dft&hl=en&as_sdt=0,5&as_vis=1"
482,"J Atzrodt, V Derdau, WJ Kerr…","C− H functionalisation for hydrogen isotope exchange",2018,"Angewandte Chemie …","Wiley Online Library","https://onlinelibrary.wiley.com/doi/abs/10.1002/anie.201708903","https://scholar.google.com/scholar?cites=4061172425449951324&as_sdt=2005&sciodt=0,5&hl=en",131,"2025-05-07 02:25:16","","10.1002/anie.201708903","","",,,,,482,68.86,121,4,7,"… More specifically, aliphatic secondary alcohols and ketones … This has been extensively studied in hydrogenation reactions of … This analysis was further corroborated by DFT-calculated …","https://onlinelibrary.wiley.com/doi/pdfdirect/10.1002/anie.201708903","https://scholar.google.com/scholar?q=related:XFCOzs0uXDgJ:scholar.google.com/&scioq=source:%22angewandte+chemie+international+edition%22+ketone+hydrogenation+dft&hl=en&as_sdt=0,5&as_vis=1"
0,"J Yang, BX Yao, HF Jiang, SF Ni…","Direct Access to Functional 2‐Azabicyclo[2.1.1]Hexanes via Hydrodearomative [2π + 2σ] Cycloaddition of Aza‐Arenes",2025,"Angewandte Chemie …","Wiley Online Library","https://onlinelibrary.wiley.com/doi/abs/10.1002/anie.202505060","",132,"2025-05-07 02:25:16","","10.1002/anie.202505060","","",,,,,0,0.00,0,5,1,"… extending to amide and ketone functionalities, which provided … To figure out the possible hydrogenation mode of the aza… obtained through density functional theory (DFT) calculations. …","https://onlinelibrary.wiley.com/doi/pdf/10.1002/anie.202505060","https://scholar.google.com/scholar?q=related:WHFzGa5xFCMJ:scholar.google.com/&scioq=source:%22angewandte+chemie+international+edition%22+ketone+hydrogenation+dft&hl=en&as_sdt=0,5&as_vis=1"
92,"Y Dai, P Ren, Y Li, D Lv, Y Shen, Y Li…","Solid Base Bi24O31Br10(OH)δ with Active Lattice Oxygen for the Efficient Photo‐Oxidation of Primary Alcohols to Aldehydes",2019,"Angewandte Chemie …","Wiley Online Library","https://onlinelibrary.wiley.com/doi/abs/10.1002/anie.201900773","https://scholar.google.com/scholar?cites=5481744354084228731&as_sdt=2005&sciodt=0,5&hl=en",133,"2025-05-07 02:25:16","","10.1002/anie.201900773","","",,,,,92,15.33,13,7,6,"… to their corresponding aldehydes and ketones under visible-light … , resulting in the hydrogenation of the photocatalyst during … further investigated by density functional theory (DFT; …","https://onlinelibrary.wiley.com/doi/pdf/10.1002/anie.201900773","https://scholar.google.com/scholar?q=related:e46xTnIRE0wJ:scholar.google.com/&scioq=source:%22angewandte+chemie+international+edition%22+ketone+hydrogenation+dft&hl=en&as_sdt=0,5&as_vis=1"
7,"C Xu, H Zhang, S Lan, J Liu, S Yang…","Copper‐Catalysed Rearrangement of Cyclic Ethynylethylene Carbonates: Synthetic Applications and Mechanistic Studies",2023,"Angewandte Chemie …","Wiley Online Library","https://onlinelibrary.wiley.com/doi/abs/10.1002/anie.202219064","https://scholar.google.com/scholar?cites=15389028541736682722&as_sdt=2005&sciodt=0,5&hl=en",134,"2025-05-07 02:25:16","","10.1002/anie.202219064","","",,,,,7,3.50,1,6,2,"… 9 e (Scheme 5c), and the hydrogenation of 8 j led to the ring-… , vinyl ylides, and cyclopropylidene ketones, we investigated the … mechanism, we conducted DFT calculations to …","https://onlinelibrary.wiley.com/doi/pdfdirect/10.1002/anie.202219064","https://scholar.google.com/scholar?q=related:4gSQlOzPkNUJ:scholar.google.com/&scioq=source:%22angewandte+chemie+international+edition%22+ketone+hydrogenation+dft&hl=en&as_sdt=0,5&as_vis=1"
3,"R Yang, Z Zhou, H Jiang, TS Kam…","Asymmetric Synthesis of Arboduridine",2024,"Angewandte Chemie …","Wiley Online Library","https://onlinelibrary.wiley.com/doi/abs/10.1002/anie.202316016","https://scholar.google.com/scholar?cites=928248448198767804&as_sdt=2005&sciodt=0,5&hl=en",135,"2025-05-07 02:25:16","","10.1002/anie.202316016","","",,,,,3,3.00,1,5,1,"… Pentacycle 5 could be accessed from 6 through hydrogenation… We surmised that α-amination of ketone 8 would occur in a … with density function theory (DFT) calculations, while its …","https://onlinelibrary.wiley.com/doi/pdfdirect/10.1002/anie.202316016","https://scholar.google.com/scholar?q=related:vPQxqgvN4QwJ:scholar.google.com/&scioq=source:%22angewandte+chemie+international+edition%22+ketone+hydrogenation+dft&hl=en&as_sdt=0,5&as_vis=1"
1,"T Ke, SH Hou, YP Wang, K Fang, JH Hu…","Divergent Total Syntheses of Six Crinipellin‐Type Diterpenoids through Tandem 4π‐Electrocyclization/Dicycloexpansion",2025,"Angewandte Chemie …","Wiley Online Library","https://onlinelibrary.wiley.com/doi/abs/10.1002/anie.202501008","https://scholar.google.com/scholar?cites=1845943565817177035&as_sdt=2005&sciodt=0,5&hl=en",136,"2025-05-07 02:25:16","","10.1002/anie.202501008","","",,,,,1,1.00,0,6,1,"… Density functional theory (DFT) calculations showed (Figure 2) that … ketone, and Eschenmoser methylenation.3d Crinipellin E (5) was obtained in a 68% yield through the hydrogenation …","https://onlinelibrary.wiley.com/doi/pdf/10.1002/anie.202501008","https://scholar.google.com/scholar?q=related:y2Pzk-QbnhkJ:scholar.google.com/&scioq=source:%22angewandte+chemie+international+edition%22+ketone+hydrogenation+dft&hl=en&as_sdt=0,5&as_vis=1"
3,"MY Xu, HY Tan, J Ouyang, FX Zhang…","Electrosynthesis of Organonitrogen Compounds via Hydroxylamine‐Mediated Cascade Reactions",2025,"Angewandte Chemie …","Wiley Online Library","https://onlinelibrary.wiley.com/doi/abs/10.1002/anie.202422637","https://scholar.google.com/scholar?cites=6185051501716547261&as_sdt=2005&sciodt=0,5&hl=en",137,"2025-05-07 02:25:16","","10.1002/anie.202422637","","",,,,,3,3.00,1,5,1,"… the development of density functional theory (DFT),[41] and … first and two hydrogenation step, the third hydrogenation can … carbonyl compounds such as aldehydes or ketones.[25, 28] To …","https://onlinelibrary.wiley.com/doi/pdfdirect/10.1002/anie.202422637","https://scholar.google.com/scholar?q=related:vaZPLZK31VUJ:scholar.google.com/&scioq=source:%22angewandte+chemie+international+edition%22+ketone+hydrogenation+dft&hl=en&as_sdt=0,5&as_vis=1"
295,"AR Chianese, SJ Lee, MR Gagné","Electrophilic activation of alkenes by platinum (II): so much more than a slow version of palladium (II)",2007,"Angewandte Chemie …","Wiley Online Library","https://onlinelibrary.wiley.com/doi/abs/10.1002/anie.200603954","https://scholar.google.com/scholar?cites=17032025400488143625&as_sdt=2005&sciodt=0,5&hl=en",138,"2025-05-07 02:25:16","","10.1002/anie.200603954","","",,,,,295,16.39,98,3,18,"… as hydrogenation and hydrosilylation, 7 are also not covered. … reported a DFT study of the full catalytic cycle of the … Although the Wacker oxidation of alkenes to ketones and aldehydes is …","https://onlinelibrary.wiley.com/doi/pdf/10.1002/anie.200603954","https://scholar.google.com/scholar?q=related:CauGudzoXewJ:scholar.google.com/&scioq=source:%22angewandte+chemie+international+edition%22+ketone+hydrogenation+dft&hl=en&as_sdt=0,5&as_vis=1"
367,"S Rej, N Chatani","Rhodium‐Catalyzed C(sp2)‐ or C(sp3)−H Bond Functionalization Assisted by Removable Directing Groups",2019,"Angewandte Chemie International Edition","Wiley Online Library","https://onlinelibrary.wiley.com/doi/abs/10.1002/anie.201808159","https://scholar.google.com/scholar?cites=5928316653997052518&as_sdt=2005&sciodt=0,5&hl=en",139,"2025-05-07 02:25:16","","10.1002/anie.201808159","","",,,,,367,61.17,184,2,6,"… H bond and a Rh center was confirmed by DFT calculations. … C−H functionalizations of aromatic ketones using a free … products 58, which were hydrogenated to afford the saturated …","https://onlinelibrary.wiley.com/doi/pdfdirect/10.1002/anie.201808159","https://scholar.google.com/scholar?q=related:ZtKGVZacRVIJ:scholar.google.com/&scioq=source:%22angewandte+chemie+international+edition%22+ketone+hydrogenation+dft&hl=en&as_sdt=0,5&as_vis=1"
23,"W Chen, P Cai, HC Zhou…","Bridging Homogeneous and Heterogeneous Catalysis: Phosphine‐Functionalized Metal‐Organic Frameworks",2024,"Angewandte Chemie …","Wiley Online Library","https://onlinelibrary.wiley.com/doi/abs/10.1002/anie.202315075","https://scholar.google.com/scholar?cites=8006437501133597125&as_sdt=2005&sciodt=0,5&hl=en",140,"2025-05-07 02:25:16","","10.1002/anie.202315075","","",,,,,23,23.00,6,4,1,"… catalyze reactions such as hydrogenation of alkenes, hydrosilylation of ketones and alkenes, … Density functional theory calculations revealed that the catalytic cycle starts from the four-…","https://onlinelibrary.wiley.com/doi/pdfdirect/10.1002/anie.202315075","https://scholar.google.com/scholar?q=related:xSlvw3yUHG8J:scholar.google.com/&scioq=source:%22angewandte+chemie+international+edition%22+ketone+hydrogenation+dft&hl=en&as_sdt=0,5&as_vis=1"
56,"C Liu, R Chen, Y Shen, Z Liang, Y Hua…","Total synthesis of aplydactone by a conformationally controlled C− H functionalization",2017,"Angewandte Chemie …","Wiley Online Library","https://onlinelibrary.wiley.com/doi/abs/10.1002/anie.201703803","https://scholar.google.com/scholar?cites=11207898559319816637&as_sdt=2005&sciodt=0,5&hl=en",141,"2025-05-07 02:25:16","","10.1002/anie.201703803","","",,,,,56,7.00,9,6,8,"… could arise from a stereoselective hydrogenation of the vinyl … Density functional theory (DFT) calculations 14 showed that … , 10 α and 10 β furnished the ketone 11, which was readily …","https://onlinelibrary.wiley.com/doi/pdf/10.1002/anie.201703803","https://scholar.google.com/scholar?q=related:vbneklt0ipsJ:scholar.google.com/&scioq=source:%22angewandte+chemie+international+edition%22+ketone+hydrogenation+dft&hl=en&as_sdt=0,5&as_vis=1"
1208,"M Beller, J Seayad, A Tillack…","Catalytic Markovnikov and anti‐Markovnikov functionalization of alkenes and alkynes: recent developments and trends",2004,"Angewandte Chemie …","Wiley Online Library","https://onlinelibrary.wiley.com/doi/abs/10.1002/anie.200300616","https://scholar.google.com/scholar?cites=17123894620661421553&as_sdt=2005&sciodt=0,5&hl=en",142,"2025-05-07 02:25:16","","10.1002/anie.200300616","","",,,,,1208,57.52,302,4,21,"… halogen adds itself to the less hydrogenated carbon atom, that is… For example, the latest density functional theory (DFT) … -1-yne follow Markovnikov's rule and yield ketones in up to 95 % …","https://onlinelibrary.wiley.com/doi/pdf/10.1002/anie.200300616","https://scholar.google.com/scholar?q=related:8RW_Y25LpO0J:scholar.google.com/&scioq=source:%22angewandte+chemie+international+edition%22+ketone+hydrogenation+dft&hl=en&as_sdt=0,5&as_vis=1"
1164,"TF Schneider, J Kaschel…","A new golden age for donor–acceptor cyclopropanes",2014,"Angewandte Chemie …","Wiley Online Library","https://onlinelibrary.wiley.com/doi/abs/10.1002/anie.201309886","https://scholar.google.com/scholar?cites=11994988834541636008&as_sdt=2005&sciodt=0,5&hl=en",143,"2025-05-07 02:25:16","","10.1002/anie.201309886","","",,,,,1164,105.82,388,3,11,"… Studies on the complete hydrogenation of the obtained azides 7 e … Cycloadditions of DA cyclopropanes with ketones or aldehydes … DFT studies support the assumption of a stepwise …","https://onlinelibrary.wiley.com/doi/pdf/10.1002/anie.201309886","https://scholar.google.com/scholar?q=related:qImh98rCdqYJ:scholar.google.com/&scioq=source:%22angewandte+chemie+international+edition%22+ketone+hydrogenation+dft&hl=en&as_sdt=0,5&as_vis=1"
