Cites,Authors,Title,Year,Source,Publisher,ArticleURL,CitesURL,GSRank,QueryDate,Type,DOI,ISSN,CitationURL,Volume,Issue,StartPage,EndPage,ECC,CitesPerYear,CitesPerAuthor,AuthorCount,Age,Abstract,FullTextURL,RelatedURL
11,"WY Xu, ZY Xu, ZK Zhang, TJ Gong…","Tunable Synthesis of Monofluoroalkenes and Gem‐Difluoroalkenes via Solvent‐Controlled Rhodium‐Catalyzed Arylation of 1‐Bromo‐2,2‐difluoroethylene",2023,"Angewandte Chemie …","Wiley Online Library","https://onlinelibrary.wiley.com/doi/abs/10.1002/anie.202310125","https://scholar.google.com/scholar?cites=8828493680448142363&as_sdt=2005&sciodt=0,5&hl=en",404,"2025-05-07 02:23:29","","10.1002/anie.202310125","","",,,,,11,5.50,2,5,2,"… mechanism, we performed DFT theoretical calculations on the … in two solvents through DFT theoretical calculations, and the … The subsequent cis-β-F or cis-β-Br elimination of the stable …","https://onlinelibrary.wiley.com/doi/pdfdirect/10.1002/anie.202310125","https://scholar.google.com/scholar?q=related:G3zkHDochXoJ:scholar.google.com/&scioq=source:%22angewandte+chemie+international+edition%22+beta+elimination+dft&hl=en&as_sdt=0,5&as_vis=1"
63,"PM Holstein, D Dailler, J Vantourout…","Synthesis of Strained γ‐Lactams by Palladium(0)‐Catalyzed C(sp3)−H Alkenylation and Application to Alkaloid Synthesis",2016,"Angewandte Chemie …","Wiley Online Library","https://onlinelibrary.wiley.com/doi/abs/10.1002/anie.201511457","https://scholar.google.com/scholar?cites=8464881101909842973&as_sdt=2005&sciodt=0,5&hl=en",405,"2025-05-07 02:23:29","","10.1002/anie.201511457","","",,,,,63,7.00,16,4,9,"… In contrast, the E isomer of 1 n (1 o) was found to undergo rapid base-promoted elimination to give the corresponding alkyne even in the absence of palladium catalyst, thereby …","https://onlinelibrary.wiley.com/doi/pdf/10.1002/anie.201511457","https://scholar.google.com/scholar?q=related:HdxAaYNMeXUJ:scholar.google.com/&scioq=source:%22angewandte+chemie+international+edition%22+beta+elimination+dft&hl=en&as_sdt=0,5&as_vis=1"
5,"CL Ji, YN Lu, S Xia, C Zhu, C Zhu…","Photoinduced Late‐Stage Radical Decarboxylative and Deoxygenative Coupling of Complex Carboxylic Acids and Their Derivatives",2025,"Angewandte Chemie …","Wiley Online Library","https://onlinelibrary.wiley.com/doi/abs/10.1002/anie.202423113","https://scholar.google.com/scholar?cites=15783703140900157157&as_sdt=2005&sciodt=0,5&hl=en",406,"2025-05-07 02:23:29","","10.1002/anie.202423113","","",,,,,5,5.00,1,6,1,"… intermediate (30.5), which undergoes reductive elimination to release the final nitrile product (30.3… DFT calculation indicated this transformation may proceed via a Ni0/NiII/NiIII pathway. …","https://onlinelibrary.wiley.com/doi/pdf/10.1002/anie.202423113","https://scholar.google.com/scholar?q=related:5TaSiWH6CtsJ:scholar.google.com/&scioq=source:%22angewandte+chemie+international+edition%22+beta+elimination+dft&hl=en&as_sdt=0,5&as_vis=1"
178,"S Park, S Chang","Catalytic Dearomatization of N‐Heteroarenes with Silicon and Boron Compounds",2017,"Angewandte Chemie International Edition","Wiley Online Library","https://onlinelibrary.wiley.com/doi/abs/10.1002/anie.201612140","https://scholar.google.com/scholar?cites=16575392093764293244&as_sdt=2005&sciodt=0,5&hl=en",407,"2025-05-07 02:23:29","","10.1002/anie.201612140","","",,,,,178,22.25,89,2,8,"… N-silyl product P through reductive elimination with the concomitant generation of Ir species 7 d… 1 H NMR spectroscopy and predicted by density functional theory (DFT) calculations. The …","https://onlinelibrary.wiley.com/doi/pdf/10.1002/anie.201612140","https://scholar.google.com/scholar?q=related:fJKjAUqfB-YJ:scholar.google.com/&scioq=source:%22angewandte+chemie+international+edition%22+beta+elimination+dft&hl=en&as_sdt=0,5&as_vis=1"
78,"A Vjunov, MY Hu, J Feng, DM Camaioni…","Following Solid‐Acid‐Catalyzed Reactions by MAS NMR Spectroscopy in Liquid Phase—Zeolite‐Catalyzed Conversion of Cyclohexanol in Water",2014,"Angewandte Chemie …","Wiley Online Library","https://onlinelibrary.wiley.com/doi/abs/10.1002/anie.201306673","https://scholar.google.com/scholar?cites=286898982814488843&as_sdt=2005&sciodt=0,5&hl=en",408,"2025-05-07 02:23:29","","10.1002/anie.201306673","","",,,,,78,7.09,16,5,11,"… A simplified kinetic model shows the E1-type elimination fully … Periodic density functional calculations (DFT) were … interaction between adsorbate and zeolite, DFT-D3 scheme 28 with an …","https://onlinelibrary.wiley.com/doi/pdf/10.1002/anie.201306673","https://scholar.google.com/scholar?q=related:CxkU1RpF-wMJ:scholar.google.com/&scioq=source:%22angewandte+chemie+international+edition%22+beta+elimination+dft&hl=en&as_sdt=0,5&as_vis=1"
248,"S Rohrbach, AJ Smith, JH Pang…","Concerted nucleophilic aromatic substitution reactions",2019,"Angewandte Chemie …","Wiley Online Library","https://onlinelibrary.wiley.com/doi/abs/10.1002/anie.201902216","https://scholar.google.com/scholar?cites=5646737020076635725&as_sdt=2005&sciodt=0,5&hl=en",409,"2025-05-07 02:23:29","","10.1002/anie.201902216","","",,,,,248,41.33,62,4,6,"… , on heating, gives the substituted pyridine 14 with elimination of LiH (Scheme 3). Generation … geometries were optimised with density functional theory (DFT) methods unless otherwise …","https://onlinelibrary.wiley.com/doi/pdf/10.1002/anie.201902216","https://scholar.google.com/scholar?q=related:TTa37WY9XU4J:scholar.google.com/&scioq=source:%22angewandte+chemie+international+edition%22+beta+elimination+dft&hl=en&as_sdt=0,5&as_vis=1"
1164,"TF Schneider, J Kaschel…","A new golden age for donor–acceptor cyclopropanes",2014,"Angewandte Chemie …","Wiley Online Library","https://onlinelibrary.wiley.com/doi/abs/10.1002/anie.201309886","https://scholar.google.com/scholar?cites=11994988834541636008&as_sdt=2005&sciodt=0,5&hl=en",410,"2025-05-07 02:23:29","","10.1002/anie.201309886","","",,,,,1164,105.82,388,3,11,"… DFT studies support the assumption of a stepwise mechanism, with the zwitterionic … Although the methoxy group, which acts as the donor in this compound, is already eliminated during …","https://onlinelibrary.wiley.com/doi/pdf/10.1002/anie.201309886","https://scholar.google.com/scholar?q=related:qImh98rCdqYJ:scholar.google.com/&scioq=source:%22angewandte+chemie+international+edition%22+beta+elimination+dft&hl=en&as_sdt=0,5&as_vis=1"
169,"H Hopf, MS Sherburn","Dendralenes branch out: cross‐conjugated oligoenes allow the rapid generation of molecular complexity",2012,"Angewandte Chemie International …","Wiley Online Library","https://onlinelibrary.wiley.com/doi/abs/10.1002/anie.201102987","https://scholar.google.com/scholar?cites=13080478568548865871&as_sdt=2005&sciodt=0,5&hl=en",411,"2025-05-07 02:23:29","","10.1002/anie.201102987","","",,,,,169,13.00,85,2,13,"… The successful approach involved the mild elimination of HBr from bromide 40, which is … preferred conformations of the dendralenes by using DFT. The two most stable conformations of […","https://onlinelibrary.wiley.com/doi/pdf/10.1002/anie.201102987","https://scholar.google.com/scholar?q=related:Txd3avQxh7UJ:scholar.google.com/&scioq=source:%22angewandte+chemie+international+edition%22+beta+elimination+dft&hl=en&as_sdt=0,5&as_vis=1"
19,"J Bresien, D Michalik, A Schulz…","Azadiphosphaindane‐1, 3‐diyls: A Class of Resonance‐Stabilized Biradicals",2021,"Angewandte Chemie …","Wiley Online Library","https://onlinelibrary.wiley.com/doi/abs/10.1002/anie.202011886","https://scholar.google.com/scholar?cites=17368673232126853306&as_sdt=2005&sciodt=0,5&hl=en",412,"2025-05-07 02:23:29","","10.1002/anie.202011886","","",,,,,19,4.75,5,4,4,"… To overcome the instability of B with respect to elimination of the CY moiety, we chose to … According to time-dependent density functional theory (TD-DFT) calculations, the main …","https://onlinelibrary.wiley.com/doi/pdfdirect/10.1002/anie.202011886","https://scholar.google.com/scholar?q=related:usDBDEjsCfEJ:scholar.google.com/&scioq=source:%22angewandte+chemie+international+edition%22+beta+elimination+dft&hl=en&as_sdt=0,5&as_vis=1"
358,"J Loup, U Dhawa, F Pesciaioli…","Enantioselective C− H activation with earth‐abundant 3d transition metals",2019,"Angewandte Chemie …","Wiley Online Library","https://onlinelibrary.wiley.com/doi/abs/10.1002/anie.201904214","https://scholar.google.com/scholar?cites=17455774916298503996&as_sdt=2005&sciodt=0,5&hl=en",413,"2025-05-07 02:23:29","","10.1002/anie.201904214","","",,,,,358,59.67,90,4,6,"… Experimental and computational mechanistic studies by DFT 11a suggested the reaction to occur by … Migratory insertion leads to 15, and reductive elimination releases lactam 10 and …","https://onlinelibrary.wiley.com/doi/pdf/10.1002/anie.201904214","https://scholar.google.com/scholar?q=related:PHclPc1eP_IJ:scholar.google.com/&scioq=source:%22angewandte+chemie+international+edition%22+beta+elimination+dft&hl=en&as_sdt=0,5&as_vis=1"
247,"LD de Almeida, H Wang, K Junge…","Recent advances in catalytic hydrosilylations: developments beyond traditional platinum catalysts",2021,"Angewandte Chemie …","Wiley Online Library","https://onlinelibrary.wiley.com/doi/abs/10.1002/anie.202008729","https://scholar.google.com/scholar?cites=14613304694218666777&as_sdt=2005&sciodt=0,5&hl=en",414,"2025-05-07 02:23:29","","10.1002/anie.202008729","","",,,,,247,61.75,62,4,4,"… Direct reductive elimination releases the vinylsilane as the major product with the observed … Kinetic isotope effect experiments and density functional theory (DFT) calculations suggest …","https://onlinelibrary.wiley.com/doi/pdf/10.1002/anie.202008729","https://scholar.google.com/scholar?q=related:GbNz3THjzMoJ:scholar.google.com/&scioq=source:%22angewandte+chemie+international+edition%22+beta+elimination+dft&hl=en&as_sdt=0,5&as_vis=1"
188,"M Soleilhavoup, G Bertrand","Borylenes: an emerging class of compounds",2017,"… Chemie International Edition","Wiley Online Library","https://onlinelibrary.wiley.com/doi/abs/10.1002/anie.201705153","https://scholar.google.com/scholar?cites=8810082237543969911&as_sdt=2005&sciodt=0,5&hl=en",415,"2025-05-07 02:23:29","","10.1002/anie.201705153","","",,,,,188,23.50,94,2,8,"… and, in the case of PhB, by elimination of nitrogen from diazidophenylborane. None of these … Furthermore, upon DFT calculations, we were not able to find a transition state for the …","https://onlinelibrary.wiley.com/doi/am-pdf/10.1002/anie.201705153","https://scholar.google.com/scholar?q=related:d3TJAh6zQ3oJ:scholar.google.com/&scioq=source:%22angewandte+chemie+international+edition%22+beta+elimination+dft&hl=en&as_sdt=0,5&as_vis=1"
64,"MA Rivero‐Crespo, M Mon…","Confined Pt11+ Water Clusters in a MOF Catalyze the Low‐Temperature Water–Gas Shift Reaction with both CO2 Oxygen Atoms Coming from Water",2018,"Angewandte Chemie …","Wiley Online Library","https://onlinelibrary.wiley.com/doi/abs/10.1002/anie.201810251","https://scholar.google.com/scholar?cites=6753601554689547303&as_sdt=2005&sciodt=0,5&hl=en",416,"2025-05-07 02:23:29","","10.1002/anie.201810251","","",,,,,64,9.14,21,3,7,"… DFT optimized structure of the Pt 1 1+ complex with seven water molecules. Pt 1 1+ gray-blue, O red, H white, C gray, Ni 2+ green, Cu 2+ violet. Figure 3 c shows the DFT … β-elimination, …","https://onlinelibrary.wiley.com/doi/pdf/10.1002/anie.201810251","https://scholar.google.com/scholar?q=related:J9zL9dScuV0J:scholar.google.com/&scioq=source:%22angewandte+chemie+international+edition%22+beta+elimination+dft&hl=en&as_sdt=0,5&as_vis=1"
42,"P Gütlich, KJ Range, C Felser…","The Valence States of Nickel, Tin, and Sulfur in the Ternary Chalcogenide Ni3Sn2S2—XPS, 61Ni and 119Sn Mössbauer Investigations, and Band Structure …",1999,"Angewandte Chemie …","Wiley Online Library","https://onlinelibrary.wiley.com/doi/abs/10.1002/(SICI)1521-3773(19990816)38:16%3C2381::AID-ANIE2381%3E3.0.CO;2-L","https://scholar.google.com/scholar?cites=4031227671387165012&as_sdt=2005&sciodt=0,5&hl=en",417,"2025-05-07 02:23:29","","10.1002/(SICI)1521-3773(19990816)38:16%3C2381::AID-ANIE2381%3E3.0.CO;2-L","","",,,,,42,1.62,11,4,26,"… lated within the framework of density functional theory[6] by … samarium diiodide to promote a β-elimination reaction in 1,1-… studies on diastereoselective 1,2elimination in O-acetylated 1…","https://onlinelibrary.wiley.com/doi/pdf/10.1002/%28SICI%291521-3773%2819990816%2938%3A16%3C2381%3A%3AAID-ANIE2381%3E3.0.CO%3B2-L","https://scholar.google.com/scholar?q=related:VNHBcTXM8TcJ:scholar.google.com/&scioq=source:%22angewandte+chemie+international+edition%22+beta+elimination+dft&hl=en&as_sdt=0,5&as_vis=1"
30,"Y Ye, T Takada, SL Buchwald","Palladium‐Catalyzed Fluorination of Cyclic Vinyl Triflates: Effect of TESCF3 as an Additive",2016,"… Chemie International Edition","Wiley Online Library","https://onlinelibrary.wiley.com/doi/abs/10.1002/anie.201608927","https://scholar.google.com/scholar?cites=3471956925662510759&as_sdt=2005&sciodt=0,5&hl=en",418,"2025-05-07 02:23:29","","10.1002/anie.201608927","","",,,,,30,3.33,10,3,9,"… for C−F reductive elimination from the respective palladium(II… through β-hydrogen elimination. Consistent with this … manuscript and for carrying out preliminary DFT calculations. …","https://onlinelibrary.wiley.com/doi/pdf/10.1002/anie.201608927","https://scholar.google.com/scholar?q=related:pz6SvW3eLjAJ:scholar.google.com/&scioq=source:%22angewandte+chemie+international+edition%22+beta+elimination+dft&hl=en&as_sdt=0,5&as_vis=1"
149,"K Zheng, Y Li, B Liu, F Jiang, Y Xu…","Ti‐doped CeO2 Stabilized Single‐Atom Rhodium Catalyst for Selective and Stable CO2 Hydrogenation to Ethanol",2022,"Angewandte Chemie …","Wiley Online Library","https://onlinelibrary.wiley.com/doi/abs/10.1002/anie.202210991","https://scholar.google.com/scholar?cites=17201274659162074043&as_sdt=2005&sciodt=0,5&hl=en",419,"2025-05-07 02:23:29","","10.1002/anie.202210991","","",,,,,149,49.67,25,6,3,"… an ideal process for the elimination of greenhouse gas along … x catalyst, we performed the DFT calculations in order to … species are also considered by DFT calculations (Figures S68–…","https://onlinelibrary.wiley.com/doi/pdf/10.1002/anie.202210991","https://scholar.google.com/scholar?q=related:u6tIjyo0t-4J:scholar.google.com/&scioq=source:%22angewandte+chemie+international+edition%22+beta+elimination+dft&hl=en&as_sdt=0,5&as_vis=1"
45,"A Köpfer, B Breit","Rhodium‐Catalyzed Hydroformylation of 1, 1‐Disubstituted Allenes Employing the Self‐Assembling 6‐DPPon System",2015,"Angewandte Chemie International Edition","Wiley Online Library","https://onlinelibrary.wiley.com/doi/abs/10.1002/anie.201502086","https://scholar.google.com/scholar?cites=9086744147173432991&as_sdt=2005&sciodt=0,5&hl=en",420,"2025-05-07 02:23:29","","10.1002/anie.201502086","","",,,,,45,4.50,23,2,10,"… 5a DFT calculations by Jiao, Beller, and co-workers suggested that coupling at the terminal … to facilitate reversible hydrometalation by β-H-elimination in the 16-valence-electron complex …","https://onlinelibrary.wiley.com/doi/pdf/10.1002/anie.201502086","https://scholar.google.com/scholar?q=related:n94hgaiZGn4J:scholar.google.com/&scioq=source:%22angewandte+chemie+international+edition%22+beta+elimination+dft&hl=en&as_sdt=0,5&as_vis=1"
122,"Z Liang, C Ban","Strategies to enable reversible magnesium electrochemistry: from electrolytes to artificial solid–electrolyte interphases",2021,"Angewandte Chemie International Edition","Wiley Online Library","https://onlinelibrary.wiley.com/doi/abs/10.1002/anie.202006472","https://scholar.google.com/scholar?cites=3192908331696798350&as_sdt=2005&sciodt=0,5&hl=en",421,"2025-05-07 02:23:29","","10.1002/anie.202006472","","",,,,,122,30.50,61,2,4,"… β-H elimination of EtAlCl 2 (Scheme 1). One strategy to prevent β-H elimination is to replace … Most importantly, results from their DFT calculation suggested that Mg 2+ ions can migrate …","https://onlinelibrary.wiley.com/doi/pdf/10.1002/anie.202006472","https://scholar.google.com/scholar?q=related:jjos_zV9TywJ:scholar.google.com/&scioq=source:%22angewandte+chemie+international+edition%22+beta+elimination+dft&hl=en&as_sdt=0,5&as_vis=1"
30,"Z Wang, J Wu, W Lamine, B Li…","C− Boron Enolates Enable Palladium Catalyzed Carboboration of Internal 1, 3‐Enynes",2021,"Angewandte Chemie …","Wiley Online Library","https://onlinelibrary.wiley.com/doi/abs/10.1002/anie.202108534","https://scholar.google.com/scholar?cites=12884463198193978122&as_sdt=2005&sciodt=0,5&hl=en",422,"2025-05-07 02:23:29","","10.1002/anie.202108534","","",,,,,30,7.50,6,5,4,"… that the rate-determining TMSCl elimination step is significantly more energetically unfavorable … DFT calculations also predict that the kinetically favored C−boron enolate product is also …","https://onlinelibrary.wiley.com/doi/pdf/10.1002/anie.202108534","https://scholar.google.com/scholar?q=related:CgvykQPPzrIJ:scholar.google.com/&scioq=source:%22angewandte+chemie+international+edition%22+beta+elimination+dft&hl=en&as_sdt=0,5&as_vis=1"
123,"AA Quintana, AM Sztapka…","Enabling sustainable chemistry with ionic liquids and deep eutectic solvents: a fad or the future?",2022,"Angewandte Chemie …","Wiley Online Library","https://onlinelibrary.wiley.com/doi/abs/10.1002/anie.202205609","https://scholar.google.com/scholar?cites=1231657027906614164&as_sdt=2005&sciodt=0,5&hl=en",423,"2025-05-07 02:23:29","","10.1002/anie.202205609","","",,,,,123,41.00,41,3,3,"… Density functional theory calculations suggest that environmental polarity influences the … In theory, ammonium, another precursor, can engage in S N 2 or Hoffmann elimination reaction, …","https://onlinelibrary.wiley.com/doi/pdfdirect/10.1002/anie.202205609","https://scholar.google.com/scholar?q=related:lLN8kYq5FxEJ:scholar.google.com/&scioq=source:%22angewandte+chemie+international+edition%22+beta+elimination+dft&hl=en&as_sdt=0,5&as_vis=1"
175,"X Wang, Y Sun, G Wang, J Li, X Li…","TADF‐type organic afterglow",2021,"Angewandte Chemie …","Wiley Online Library","https://onlinelibrary.wiley.com/doi/abs/10.1002/anie.202105628","https://scholar.google.com/scholar?cites=900024219706607224&as_sdt=2005&sciodt=0,5&hl=en",424,"2025-05-07 02:23:29","","10.1002/anie.202105628","","",,,,,175,43.75,29,6,4,"… TD-DFT calculations were performed on ORCA 4.2.1 program … state was obtained by a DFT calculation from its single … -0.2 % particles in eliminating strong fluorescence background by …","https://onlinelibrary.wiley.com/doi/pdf/10.1002/anie.202105628","https://scholar.google.com/scholar?q=related:eEbcYEKHfQwJ:scholar.google.com/&scioq=source:%22angewandte+chemie+international+edition%22+beta+elimination+dft&hl=en&as_sdt=0,5&as_vis=1"
1,"J Chen, H Wei, ID Gridnev…","Weak Attractive Non‐Covalent Interactions in Metal‐Catalyzed Asymmetric Hydrogenation",2025,"Angewandte Chemie …","Wiley Online Library","https://onlinelibrary.wiley.com/doi/abs/10.1002/anie.202425589","https://scholar.google.com/scholar?cites=3427816226240166530&as_sdt=2005&sciodt=0,5&hl=en",425,"2025-05-07 02:23:29","","10.1002/anie.202425589","","",,,,,1,1.00,0,4,1,"… been clearly validated by density functional theory (DFT) calculations, … of imine substrates, eliminating the need for tedious … DFT calculations of the stereodetermining transition states …","https://onlinelibrary.wiley.com/doi/pdf/10.1002/anie.202425589","https://scholar.google.com/scholar?q=related:gnpdSLIMki8J:scholar.google.com/&scioq=source:%22angewandte+chemie+international+edition%22+beta+elimination+dft&hl=en&as_sdt=0,5&as_vis=1"
59,"T Chidley, I Jameel, S Rizwan…","Blue LED Irradiation of Iodonium Ylides Gives Diradical Intermediates for Efficient Metal‐free Cyclopropanation with Alkenes",2019,"Angewandte Chemie …","Wiley Online Library","https://onlinelibrary.wiley.com/doi/abs/10.1002/anie.201908994","https://scholar.google.com/scholar?cites=5379586078418625514&as_sdt=2005&sciodt=0,5&hl=en",426,"2025-05-07 02:23:29","","10.1002/anie.201908994","","",,,,,59,9.83,15,4,6,"… ylides at the time-dependent (TD) DFT level of theory. First, a search … was employed for TD-DFT calculations of the ten lowest-… C, and reductive elimination of iodobenzene would furnish …","https://onlinelibrary.wiley.com/doi/pdf/10.1002/anie.201908994","https://scholar.google.com/scholar?q=related:6mPHOgkhqEoJ:scholar.google.com/&scioq=source:%22angewandte+chemie+international+edition%22+beta+elimination+dft&hl=en&as_sdt=0,5&as_vis=1"
5,"K Dilchert, M Schmidt, A Großjohann…","Solvation effects on the structure and stability of alkali metal carbenoids",2021,"Angewandte Chemie …","Wiley Online Library","https://onlinelibrary.wiley.com/doi/abs/10.1002/anie.202011278","https://scholar.google.com/scholar?cites=7309039209432779730&as_sdt=2005&sciodt=0,5&hl=en",427,"2025-05-07 02:23:29","","10.1002/anie.202011278","","",,,,,5,1.25,1,4,4,"… XRD analyses as well as DFT calculations on a sulfoximinoyl-… interactions which facilitate decomposition via α-elimination. … reactions via metal salt elimination often occur at low …","https://onlinelibrary.wiley.com/doi/pdf/10.1002/anie.202011278","https://scholar.google.com/scholar?q=related:0oukn2_sbmUJ:scholar.google.com/&scioq=source:%22angewandte+chemie+international+edition%22+beta+elimination+dft&hl=en&as_sdt=0,5&as_vis=1"
2291,"DS Surry, SL Buchwald","Biaryl phosphane ligands in palladium‐catalyzed amination",2008,"Angewandte Chemie International …","Wiley Online Library","https://onlinelibrary.wiley.com/doi/abs/10.1002/anie.200800497","https://scholar.google.com/scholar?cites=5925097986656054547&as_sdt=2005&sciodt=0,5&hl=en",428,"2025-05-07 02:23:29","","10.1002/anie.200800497","","",,,,,2291,134.76,1146,2,17,"… DFT calculations, however, have underlined the importance of the … elimination from such a complex is that the [L 1 Pd 0 ] complex is regenerated directly following reductive elimination …","https://onlinelibrary.wiley.com/doi/pdf/10.1002/anie.200800497","https://scholar.google.com/scholar?q=related:Ey0E8jktOlIJ:scholar.google.com/&scioq=source:%22angewandte+chemie+international+edition%22+beta+elimination+dft&hl=en&as_sdt=0,5&as_vis=1"
49,"A Breder, C Depken","Light‐Driven Single‐Electron Transfer Processes as an Enabling Principle in Sulfur and Selenium Multicatalysis",2019,"Angewandte Chemie International …","Wiley Online Library","https://onlinelibrary.wiley.com/doi/abs/10.1002/anie.201812486","https://scholar.google.com/scholar?cites=16544816571330101121&as_sdt=2005&sciodt=0,5&hl=en",429,"2025-05-07 02:23:29","","10.1002/anie.201812486","","",,,,,49,8.17,25,2,6,"… DFT calculations performed by the authors revealed that the hydrogen bonding between the … Scheme 11, bottom), led to β-hydride elimination followed by reductive elimination. Under …","https://onlinelibrary.wiley.com/doi/pdf/10.1002/anie.201812486","https://scholar.google.com/scholar?q=related:gX8gcAP_muUJ:scholar.google.com/&scioq=source:%22angewandte+chemie+international+edition%22+beta+elimination+dft&hl=en&as_sdt=0,5&as_vis=1"
39,"PW Antoni, C Golz…","Organic Four‐Electron Redox Systems Based on Bipyridine and Phenanthroline Carbene Architectures",2022,"Angewandte Chemie …","Wiley Online Library","https://onlinelibrary.wiley.com/doi/abs/10.1002/anie.202203064","https://scholar.google.com/scholar?cites=4642870470433806420&as_sdt=2005&sciodt=0,5&hl=en",430,"2025-05-07 02:23:29","","10.1002/anie.202203064","","",,,,,39,13.00,13,3,3,"… The absorption spectra also match very well with the predicted TD-DFT transitions (see Figures S133… As a result, we investigated a stepwise addition/elimination process. Addition of two …","https://onlinelibrary.wiley.com/doi/pdfdirect/10.1002/anie.202203064","https://scholar.google.com/scholar?q=related:VJhbCBjKbkAJ:scholar.google.com/&scioq=source:%22angewandte+chemie+international+edition%22+beta+elimination+dft&hl=en&as_sdt=0,5&as_vis=1"
0,"S Takahashi, A Rodríguez‐Álvarez…","An Isolable Base‐Stabilized Diazosilenyl Cation",2025,"Angewandte Chemie …","Wiley Online Library","https://onlinelibrary.wiley.com/doi/abs/10.1002/anie.202419491","",431,"2025-05-07 02:23:29","","10.1002/anie.202419491","","",,,,,0,0.00,0,3,1,"… To gain more insight into the electronic structure of cationic diazosilene 2, DFT calculations … of 2 to 11 and then the elimination of N2. The N2 elimination from 11 can readily takes place …","https://onlinelibrary.wiley.com/doi/pdf/10.1002/anie.202419491","https://scholar.google.com/scholar?q=related:E_uMPBss7RkJ:scholar.google.com/&scioq=source:%22angewandte+chemie+international+edition%22+beta+elimination+dft&hl=en&as_sdt=0,5&as_vis=1"
1,"L Wang, J Ke, Y Chai, G Wu…","Additive‐Free Ethylene Dimerization Over Well‐Defined Nickel‐Zeolite Catalysts",2025,"Angewandte Chemie …","Wiley Online Library","https://onlinelibrary.wiley.com/doi/abs/10.1002/anie.202502563","https://scholar.google.com/scholar?cites=3415290979145107819&as_sdt=2005&sciodt=0,5&hl=en",432,"2025-05-07 02:23:29","","10.1002/anie.202502563","","",,,,,1,1.00,0,5,1,"… the hydrogen transfer and β-hydride elimination.Since cocatalyst does participate in the … dimerization by density functional theory (DFT) calculations and microkinetic simulations. It …","https://onlinelibrary.wiley.com/doi/pdf/10.1002/anie.202502563","https://scholar.google.com/scholar?q=related:a0mK8AyNZS8J:scholar.google.com/&scioq=source:%22angewandte+chemie+international+edition%22+beta+elimination+dft&hl=en&as_sdt=0,5&as_vis=1"
