Cites,Authors,Title,Year,Source,Publisher,ArticleURL,CitesURL,GSRank,QueryDate,Type,DOI,ISSN,CitationURL,Volume,Issue,StartPage,EndPage,ECC,CitesPerYear,CitesPerAuthor,AuthorCount,Age,Abstract,FullTextURL,RelatedURL
257,"DS Su, G Wen, S Wu, F Peng…","Carbocatalysis in liquid‐phase reactions",2017,"Angewandte Chemie …","Wiley Online Library","https://onlinelibrary.wiley.com/doi/abs/10.1002/anie.201600906","https://scholar.google.com/scholar?cites=4054134559223528247&as_sdt=2005&sciodt=0,5&hl=en",607,"2025-05-07 02:23:29","","10.1002/anie.201600906","","",,,,,257,32.13,51,5,8,"… gas-phase reactions, thereby eliminating the need to vaporize the … Their DFT calculations showed that molecular hydrogen is … DFT calculations using periodic models from our research …","https://onlinelibrary.wiley.com/doi/pdf/10.1002/anie.201600906","https://scholar.google.com/scholar?q=related:Nzsn4uYtQzgJ:scholar.google.com/&scioq=source:%22angewandte+chemie+international+edition%22+beta+elimination+dft&hl=en&as_sdt=0,5&as_vis=1"
54,"A Boudhar, M Charpenay, G Blond…","Fenestranes in synthesis: unique and highly inspiring scaffolds",2013,"Angewandte Chemie …","Wiley Online Library","https://onlinelibrary.wiley.com/doi/abs/10.1002/anie.201304555","https://scholar.google.com/scholar?cites=7130170283659903655&as_sdt=2005&sciodt=0,5&hl=en",608,"2025-05-07 02:23:29","","10.1002/anie.201304555","","",,,,,54,4.50,14,4,12,"… DFT and MP2 calculations for the opposite bond angles α and β for a series of compounds, with the results for 41 being quite similar for both methods (DFT… and then elimination led to a …","https://onlinelibrary.wiley.com/doi/pdf/10.1002/anie.201304555","https://scholar.google.com/scholar?q=related:p0KYgRh082IJ:scholar.google.com/&scioq=source:%22angewandte+chemie+international+edition%22+beta+elimination+dft&hl=en&as_sdt=0,5&as_vis=1"
0,"LK Burt, AF Hill","The Interplay of Methylidyne and Carbido Species: Modeling a Fundamental Step in the Fischer–Tropsch Synthesis",2025,"Angewandte Chemie International Edition","Wiley Online Library","https://onlinelibrary.wiley.com/doi/abs/10.1002/anie.202424699","",609,"2025-05-07 02:23:29","","10.1002/anie.202424699","","",,,,,0,0.00,0,2,1,"… With a bimetallic cis-carbido-n-butyl complex now in hand, the question arises as to whether β-platinum hydride elimination or alternatively, direct migratory insertion to afford a μ-…","https://onlinelibrary.wiley.com/doi/pdf/10.1002%2Fanie.202424699","https://scholar.google.com/scholar?q=related:FrK8nDSA7JAJ:scholar.google.com/&scioq=source:%22angewandte+chemie+international+edition%22+beta+elimination+dft&hl=en&as_sdt=0,5&as_vis=1"
8,"MA Esteruelas, AM López, E Oñate…","Metathesis between E−C(spn) and H−C(sp3) σ‐Bonds (E=Si, Ge; n=2, 3) on an Osmium‐Polyhydride",2022,"Angewandte Chemie …","Wiley Online Library","https://onlinelibrary.wiley.com/doi/abs/10.1002/anie.202204081","https://scholar.google.com/scholar?cites=16789816807348998028&as_sdt=2005&sciodt=0,5&hl=en",610,"2025-05-07 02:23:29","","10.1002/anie.202204081","","",,,,,8,2.67,2,4,3,"… A successful access has been also the alkyl α-elimination on … 16a, 29b The DFT optimized structure corroborates a short Si… interaction, we also performed DFT calculations using the AIM …","https://onlinelibrary.wiley.com/doi/pdf/10.1002/anie.202204081","https://scholar.google.com/scholar?q=related:jI_rFW5pAekJ:scholar.google.com/&scioq=source:%22angewandte+chemie+international+edition%22+beta+elimination+dft&hl=en&as_sdt=0,5&as_vis=1"
34,"I Scheipers, C Mück‐Lichtenfeld…","Palladium‐Catalyzed Decarboxylative γ‐Arylation for the Synthesis of Tetrasubstituted Chiral Allenes",2019,"Angewandte Chemie …","Wiley Online Library","https://onlinelibrary.wiley.com/doi/abs/10.1002/anie.201901848","https://scholar.google.com/scholar?cites=12452107416837005456&as_sdt=2005&sciodt=0,5&hl=en",611,"2025-05-07 02:23:29","","10.1002/anie.201901848","","",,,,,34,5.67,11,3,6,"… CD spectra were computed with TD-DFT (LC-BLYP) for the three dominant conformations and with the … As the following reductive elimination step to give (P)-3 along with Pd 0 is also a …","https://onlinelibrary.wiley.com/doi/pdf/10.1002/anie.201901848","https://scholar.google.com/scholar?q=related:kKCTtbjFzqwJ:scholar.google.com/&scioq=source:%22angewandte+chemie+international+edition%22+beta+elimination+dft&hl=en&as_sdt=0,5&as_vis=1"
85,"LA Seaman, EA Pedrick, T Tsuchiya…","Comparison of the Reactivity of 2‐Li‐C6H4CH2NMe2 with MCl4 (M=Th, U): Isolation of a Thorium Aryl Complex or a Uranium Benzyne Complex",2013,"Angewandte Chemie …","Wiley Online Library","https://onlinelibrary.wiley.com/doi/abs/10.1002/anie.201303992","https://scholar.google.com/scholar?cites=12855026855696410982&as_sdt=2005&sciodt=0,5&hl=en",612,"2025-05-07 02:23:29","","10.1002/anie.201303992","","",,,,,85,7.08,21,4,12,"… A DFT analysis suggests that the formation of a benzyne complex with U but not with Th is a … In contrast, the thorium complex required heating to 100 C before benzene elimination was …","https://onlinelibrary.wiley.com/doi/pdf/10.1002/anie.201303992","https://scholar.google.com/scholar?q=related:Zink_9A6ZrIJ:scholar.google.com/&scioq=source:%22angewandte+chemie+international+edition%22+beta+elimination+dft&hl=en&as_sdt=0,5&as_vis=1"
211,"C Limberg","The Role of Radicals in Metal‐Assisted Oxygenation Reactions",2003,"Angewandte Chemie International Edition","Wiley Online Library","https://onlinelibrary.wiley.com/doi/abs/10.1002/anie.200300578","https://scholar.google.com/scholar?cites=20808463692595184&as_sdt=2005&sciodt=0,5&hl=en",613,"2025-05-07 02:23:29","","10.1002/anie.200300578","","",,,,,211,9.59,211,1,22,"… various organic oxidation products 6 (DFT studies involving chromyl chloride and methanol as … of the reduced catalyst with O 2 and elimination of water regenerates the starting situation. …","https://onlinelibrary.wiley.com/doi/pdf/10.1002/anie.200300578","https://scholar.google.com/scholar?q=related:8P-3_i_tSQAJ:scholar.google.com/&scioq=source:%22angewandte+chemie+international+edition%22+beta+elimination+dft&hl=en&as_sdt=0,5&as_vis=1"
40,"L Zhu, L Zhang, S Luo","Catalytic desymmetrizing dehydrogenation of 4‐substituted cyclohexanones through enamine oxidation",2018,"Angewandte Chemie International …","Wiley Online Library","https://onlinelibrary.wiley.com/doi/abs/10.1002/anie.201713327","https://scholar.google.com/scholar?cites=8568465150182162244&as_sdt=2005&sciodt=0,5&hl=en",614,"2025-05-07 02:23:29","","10.1002/anie.201713327","","",,,,,40,5.71,13,3,7,"… 3a, 14 On this basis, a plausible substitution–elimination catalytic cycle, similar to the … DFT calculations indicated that the S-configured enamine A1 is slightly favored over the R-…","https://onlinelibrary.wiley.com/doi/pdf/10.1002/anie.201713327","https://scholar.google.com/scholar?q=related:RP_rCqhN6XYJ:scholar.google.com/&scioq=source:%22angewandte+chemie+international+edition%22+beta+elimination+dft&hl=en&as_sdt=0,5&as_vis=1"
1689,"DW Stephan, G Erker","Frustrated Lewis pair chemistry: development and perspectives",2015,"Angewandte Chemie International …","Wiley Online Library","https://onlinelibrary.wiley.com/doi/abs/10.1002/anie.201409800","https://scholar.google.com/scholar?cites=10818732116332059111&as_sdt=2005&sciodt=0,5&hl=en",615,"2025-05-07 02:23:29","","10.1002/anie.201409800","","",,,,,1689,168.90,845,2,10,"… Early state of the art DFT studies already gave a strong indication that, for example, the t Bu 3 P/B(C 6 F 5 ) 3 pair reacts from an associated form (84) that is formed by non-covalent C 6 …","https://onlinelibrary.wiley.com/doi/pdf/10.1002/anie.201409800","https://scholar.google.com/scholar?q=related:5xkVKorbI5YJ:scholar.google.com/&scioq=source:%22angewandte+chemie+international+edition%22+beta+elimination+dft&hl=en&as_sdt=0,5&as_vis=1"
1370,"P Melchiorre, M Marigo, A Carlone…","Asymmetric aminocatalysis—gold rush in organic chemistry",2008,"Angewandte Chemie …","Wiley Online Library","https://onlinelibrary.wiley.com/doi/abs/10.1002/anie.200705523","https://scholar.google.com/scholar?cites=12474051023310636148&as_sdt=2005&sciodt=0,5&hl=en",616,"2025-05-07 02:23:29","","10.1002/anie.200705523","","",,,,,1370,80.59,343,4,17,"… This theory was corroborated by a series of experimental results and DFT calculations, although the key intermediate F could not be detected. Very recently, this mechanism was …","https://onlinelibrary.wiley.com/doi/pdf/10.1002/anie.200705523","https://scholar.google.com/scholar?q=related:dESHulC7HK0J:scholar.google.com/&scioq=source:%22angewandte+chemie+international+edition%22+beta+elimination+dft&hl=en&as_sdt=0,5&as_vis=1"
66,"AI Konovalov, J Benet‐Buchholz…","The Critical Effect of the Countercation in the Direct Cupration of Fluoroform with [Cu(OR)2]−.",2013,"… International Edition","search.ebscohost.com","https://search.ebscohost.com/login.aspx?direct=true&profile=ehost&scope=site&authtype=crawler&jrnl=14337851&AN=91535619&h=H%2B41BUlfHwSxuFOKTBm1OeSSXnG13aOy60Vx32bWx6nXwNn0dk%2B4287%2FQwg4FnRfxtXm6Bos8k9LC2BEPekNzA%3D%3D&crl=c","https://scholar.google.com/scholar?cites=5502371097373034525&as_sdt=2005&sciodt=0,5&hl=en",617,"2025-05-07 02:23:29","","10.1002/ange.201306272","","",,,,,66,5.50,22,3,12,"… F from the CF3 ligand on Cu (α-F-elimination) to give KF and a CuI carbene. Freshly prepared … Therefore, all calculations were performed at the DFT/B97D[19] level of theory with the …","https://onlinelibrary.wiley.com/doi/pdf/10.1002/ange.201306272","https://scholar.google.com/scholar?q=related:HchLOVxZXEwJ:scholar.google.com/&scioq=source:%22angewandte+chemie+international+edition%22+beta+elimination+dft&hl=en&as_sdt=0,5&as_vis=1"
288,"H Ito, K Ozaki, K Itami","Annulative π‐extension (APEX): rapid access to fused arenes, heteroarenes, and nanographenes",2017,"Angewandte Chemie International …","Wiley Online Library","https://onlinelibrary.wiley.com/doi/abs/10.1002/anie.201701058","https://scholar.google.com/scholar?cites=10200867127831181893&as_sdt=2005&sciodt=0,5&hl=en",618,"2025-05-07 02:23:29","","10.1002/anie.201701058","","",,,,,288,36.00,96,3,8,"… On the basis of mechanistic investigations by DFT calculations and experimental studies, o-… palladacycle, which then undergoes reductive elimination with release of the carbazole …","https://onlinelibrary.wiley.com/doi/pdf/10.1002/anie.201701058","https://scholar.google.com/scholar?q=related:RTpWM5vCkI0J:scholar.google.com/&scioq=source:%22angewandte+chemie+international+edition%22+beta+elimination+dft&hl=en&as_sdt=0,5&as_vis=1"
54,"Y Zhao, Y Wang, X Zhou, Z Xue…","Oxygen‐Triggered Switchable Polymerization for the One‐Pot Synthesis of CO2‐Based Block Copolymers from Monomer Mixtures",2019,"Angewandte Chemie …","Wiley Online Library","https://onlinelibrary.wiley.com/doi/abs/10.1002/anie.201906140","https://scholar.google.com/scholar?cites=11245871890633132892&as_sdt=2005&sciodt=0,5&hl=en",619,"2025-05-07 02:23:29","","10.1002/anie.201906140","","",,,,,54,9.00,11,5,6,"… To throw light on the above two points, we carried out a DFT investigation using the short alkyl group −CH(Me)OCOMe as a model for the PVAc chain (see the Supporting Information for …","https://onlinelibrary.wiley.com/doi/pdfdirect/10.1002/anie.201906140","https://scholar.google.com/scholar?q=related:XAu9vuZcEZwJ:scholar.google.com/&scioq=source:%22angewandte+chemie+international+edition%22+beta+elimination+dft&hl=en&as_sdt=0,5&as_vis=1"
59,"F Meng, S Bi, Z Sun, D Wu…","2, 4, 6‐Trimethylpyridine‐Derived Vinylene‐Linked Covalent Organic Frameworks for Confined Catalytic Esterification",2022,"Angewandte Chemie …","Wiley Online Library","https://onlinelibrary.wiley.com/doi/abs/10.1002/anie.202210447","https://scholar.google.com/scholar?cites=11311280389835583674&as_sdt=2005&sciodt=0,5&hl=en",620,"2025-05-07 02:23:29","","10.1002/anie.202210447","","",,,,,59,19.67,12,5,3,"… using a quenched solid density functional theory model (Figure … a quenched-solid density functional theory cylindrical pore … adduct might undergo a water elimination process to form a …","https://onlinelibrary.wiley.com/doi/pdf/10.1002/anie.202210447","https://scholar.google.com/scholar?q=related:uvD9tpW9-ZwJ:scholar.google.com/&scioq=source:%22angewandte+chemie+international+edition%22+beta+elimination+dft&hl=en&as_sdt=0,5&as_vis=1"
4167,"EA Meyer, RK Castellano…","Interactions with aromatic rings in chemical and biological recognition",2003,"Angewandte Chemie …","Wiley Online Library","https://onlinelibrary.wiley.com/doi/abs/10.1002/anie.200390319","https://scholar.google.com/scholar?cites=14451350961685524907&as_sdt=2005&sciodt=0,5&hl=en",621,"2025-05-07 02:23:29","","10.1002/anie.200390319","","",,,,,4167,189.41,1389,3,22,"… This computational study revealed that the key process which determines the difference in binding in the two solvents (ΔΔG o =7.1 kcal mol −1 ; Table 3) is the elimination of pyrene …","https://onlinelibrary.wiley.com/doi/pdfdirect/10.1002/anie.200390319","https://scholar.google.com/scholar?q=related:q_HDEyKDjcgJ:scholar.google.com/&scioq=source:%22angewandte+chemie+international+edition%22+beta+elimination+dft&hl=en&as_sdt=0,5&as_vis=1"
6,"J Kim, YE Kim, S Hong","Traceless Nucleophile Strategy for C5‐Selective C− H Sulfonylation of Pyridines",2024,"Angewandte Chemie International …","Wiley Online Library","https://onlinelibrary.wiley.com/doi/abs/10.1002/anie.202409561","https://scholar.google.com/scholar?cites=8144133235368517984&as_sdt=2005&sciodt=0,5&hl=en",622,"2025-05-07 02:23:29","","10.1002/anie.202409561","","",,,,,6,6.00,2,3,1,"… the C3 position, we employed density functional theory (DFT) calculations at the B3LYP-D3/… sulfonyl radical from sulfinates via SET, eliminating the need for external oxidizing agents. …","https://onlinelibrary.wiley.com/doi/pdfdirect/10.1002/anie.202409561","https://scholar.google.com/scholar?q=related:YOGXMQfGBXEJ:scholar.google.com/&scioq=source:%22angewandte+chemie+international+edition%22+beta+elimination+dft&hl=en&as_sdt=0,5&as_vis=1"
69,"K Okamoto, A Nanya, A Eguchi…","Asymmetric Synthesis of 2H‐Azirines with a Tetrasubstituted Stereocenter by Enantioselective Ring Contraction of Isoxazoles",2018,"Angewandte Chemie …","Wiley Online Library","https://onlinelibrary.wiley.com/doi/abs/10.1002/anie.201710920","https://scholar.google.com/scholar?cites=8591471362622564441&as_sdt=2005&sciodt=0,5&hl=en",623,"2025-05-07 02:23:29","","10.1002/anie.201710920","","",,,,,69,9.86,17,4,7,"… , base-mediated elimination reactions from aziridines with … Neber-type reactions involving base-catalyzed elimination … The catalytic cycle supported by DFT calculations includes a …","https://onlinelibrary.wiley.com/doi/pdf/10.1002/anie.201710920","https://scholar.google.com/scholar?q=related:WSgPS68JO3cJ:scholar.google.com/&scioq=source:%22angewandte+chemie+international+edition%22+beta+elimination+dft&hl=en&as_sdt=0,5&as_vis=1"
302,"K Strømgaard, K Nakanishi","Chemistry and Biology of Terpene Trilactones from Ginkgo Biloba",2004,"… Chemie International Edition","Wiley Online Library","https://onlinelibrary.wiley.com/doi/abs/10.1002/anie.200300601","https://scholar.google.com/scholar?cites=1146071108291195307&as_sdt=2005&sciodt=0,5&hl=en",624,"2025-05-07 02:23:29","","10.1002/anie.200300601","","",,,,,302,14.38,151,2,21,"… acid, which is then phosphorylated, followed by elimination of phosphate and CO 2 to give … Moreover, a density functional theory (DFT) calculation of the geometry of GB (2) confirmed …","https://onlinelibrary.wiley.com/doi/pdfdirect/10.1002/anie.200300601","https://scholar.google.com/scholar?q=related:q_EI0Zmp5w8J:scholar.google.com/&scioq=source:%22angewandte+chemie+international+edition%22+beta+elimination+dft&hl=en&as_sdt=0,5&as_vis=1"
1246,"C Copéret, M Chabanas…","Homogeneous and heterogeneous catalysis: bridging the gap through surface organometallic chemistry",2003,"Angewandte Chemie …","Wiley Online Library","https://onlinelibrary.wiley.com/doi/abs/10.1002/anie.200390072","https://scholar.google.com/scholar?cites=8892466519907670498&as_sdt=2005&sciodt=0,5&hl=en",625,"2025-05-07 02:23:29","","10.1002/anie.200390072","","",,,,,1246,56.64,415,3,22,"… The process of elimination of neopentane was clearly established as an α-H abstraction, and kinetic studies further confirmed this pathway in the case of 20 a (ΔH ≠ =11 kcal mol −1 , …","https://onlinelibrary.wiley.com/doi/full/10.1002/anie.200390072","https://scholar.google.com/scholar?q=related:4pkmgC9jaHsJ:scholar.google.com/&scioq=source:%22angewandte+chemie+international+edition%22+beta+elimination+dft&hl=en&as_sdt=0,5&as_vis=1"
298,"CW Landorf, MM Haley","Recent advances in metallabenzene chemistry",2006,"Angewandte Chemie International …","Wiley Online Library","https://onlinelibrary.wiley.com/doi/abs/10.1002/anie.200504358","https://scholar.google.com/scholar?cites=3550581904157967221&as_sdt=2005&sciodt=0,5&hl=en",626,"2025-05-07 02:23:29","","10.1002/anie.200504358","","",,,,,298,15.68,149,2,19,"… Recent studies have demonstrated that elimination to form cyclopentadienyl complexes is a … Recent DFT calculations reported by van der Boom, Martin, and co-workers, however, …","https://onlinelibrary.wiley.com/doi/pdf/10.1002/anie.200504358","https://scholar.google.com/scholar?q=related:dQNEF24zRjEJ:scholar.google.com/&scioq=source:%22angewandte+chemie+international+edition%22+beta+elimination+dft&hl=en&as_sdt=0,5&as_vis=1"
317,"X Zhou, Q Liu, C Jiang, B Ji, XL Ji…","Strategies towards low‐cost dual‐ion batteries with high performance",2020,"Angewandte Chemie …","Wiley Online Library","https://onlinelibrary.wiley.com/doi/abs/10.1002/anie.201814294","https://scholar.google.com/scholar?cites=5638630370372148074&as_sdt=2005&sciodt=0,5&hl=en",627,"2025-05-07 02:23:29","","10.1002/anie.201814294","","",,,,,317,63.40,53,6,5,"… It was indicated with first-principles DFT calculations that the pressure from the graphite layers resulted in the structural distortion of the intercalated tetrahedral AlCl 4 − anions, whose …","https://onlinelibrary.wiley.com/doi/pdf/10.1002/anie.201814294","https://scholar.google.com/scholar?q=related:atvCdXJwQE4J:scholar.google.com/&scioq=source:%22angewandte+chemie+international+edition%22+beta+elimination+dft&hl=en&as_sdt=0,5&as_vis=1"
5,"ZR Zhang, HY Sui, WX Shi, J Ren, S Yao…","Polyoxometalate‐Based Single‐Atom Catalyst with Precise Structure and Extremely Exposed Active Site for Efficient H2 Evolution",2025,"Angewandte Chemie …","Wiley Online Library","https://onlinelibrary.wiley.com/doi/abs/10.1002/anie.202416711","https://scholar.google.com/scholar?cites=5230603348224380776&as_sdt=2005&sciodt=0,5&hl=en",628,"2025-05-07 02:23:29","","10.1002/anie.202416711","","",,,,,5,5.00,1,6,1,"… simple and sustainable method for eliminating plastic waste and … of CdS NPs would be preferentially eliminated by lactic acid in … Moreover, DFT calculations were performed to check the …","https://onlinelibrary.wiley.com/doi/pdf/10.1002/anie.202416711","https://scholar.google.com/scholar?q=related:aA_iQwjWlkgJ:scholar.google.com/&scioq=source:%22angewandte+chemie+international+edition%22+beta+elimination+dft&hl=en&as_sdt=0,5&as_vis=1"
86,"X Wang, L Xie, K Lin, W Ma, T Zhao, X Ji…","Calix [4] pyrrole‐crosslinked porous polymeric networks for the removal of micropollutants from water",2021,"Angewandte Chemie …","Wiley Online Library","https://onlinelibrary.wiley.com/doi/abs/10.1002/anie.202016364","https://scholar.google.com/scholar?cites=12186988480111313296&as_sdt=2005&sciodt=0,5&hl=en",629,"2025-05-07 02:23:29","","10.1002/anie.202016364","","",,,,,86,21.50,12,7,4,"… this treatment promotes the elimination of isobutylene giving … non-local density functional theory calculations indicate the … 12 %) expected for the elimination of isobutylene from the side …","https://onlinelibrary.wiley.com/doi/pdf/10.1002/anie.202016364","https://scholar.google.com/scholar?q=related:kAHQBnThIKkJ:scholar.google.com/&scioq=source:%22angewandte+chemie+international+edition%22+beta+elimination+dft&hl=en&as_sdt=0,5&as_vis=1"
212,"J Liu, D Yang, Y Zhou, G Zhang, G Xing…","Tricycloquinazoline‐Based 2D Conductive Metal–Organic Frameworks as Promising Electrocatalysts for CO2 Reduction",2021,"Angewandte Chemie …","Wiley Online Library","https://onlinelibrary.wiley.com/doi/abs/10.1002/anie.202103398","https://scholar.google.com/scholar?cites=16083511358173768648&as_sdt=2005&sciodt=0,5&hl=en",630,"2025-05-07 02:23:29","","10.1002/anie.202103398","","",,,,,212,53.00,35,6,4,"… estimated through density functional theory (DFT) calculations. … DFT calculations were further performed to provide insights … occurs at an oxygen atom with eliminating a H 2 O molecule …","https://onlinelibrary.wiley.com/doi/pdf/10.1002/anie.202103398","https://scholar.google.com/scholar?q=related:yGvovF0cNN8J:scholar.google.com/&scioq=source:%22angewandte+chemie+international+edition%22+beta+elimination+dft&hl=en&as_sdt=0,5&as_vis=1"
0,"M Leng, TM Alturaifi, J Pearce, H Lin…","Resonance‐Assisted Self‐Doping in Robust Open‐Shell Ladder‐Type Oligoaniline Analogues",2024,"Angewandte Chemie …","Wiley Online Library","https://onlinelibrary.wiley.com/doi/abs/10.1002/anie.202409149","",631,"2025-05-07 02:23:29","","10.1002/anie.202409149","","",,,,,0,0.00,0,5,1,"… resulting doped materials, thanks to the elimination of physical mixing of an external dopant.[… doped species, we performed density functional theory (DFT) calculations on the uncharged …","https://onlinelibrary.wiley.com/doi/pdf/10.1002/anie.202409149","https://scholar.google.com/scholar?q=related:29KN0YfwucUJ:scholar.google.com/&scioq=source:%22angewandte+chemie+international+edition%22+beta+elimination+dft&hl=en&as_sdt=0,5&as_vis=1"
360,"A Schnepf, H Schnöckel","Metalloid aluminum and gallium clusters: element modifications on the molecular scale?",2002,"Angewandte Chemie International …","Wiley Online Library","https://onlinelibrary.wiley.com/doi/abs/10.1002/1521-3773(20021004)41:19%3C3532::AID-ANIE3532%3E3.0.CO;2-4","https://scholar.google.com/scholar?cites=2881057428964053191&as_sdt=2005&sciodt=0,5&hl=en",632,"2025-05-07 02:23:29","","10.1002/1521-3773(20021004)41:19%3C3532::AID-ANIE3532%3E3.0.CO;2-4","","",,,,,360,15.65,180,2,23,"… The square-antiprismic (SA) form actually observed could also be plausibly explained with the help of DFT calculations on the model compounds [Ga 8 H 8 ] 2− and [B 8 H 8 ] 2− (each …","https://onlinelibrary.wiley.com/doi/pdf/10.1002/1521-3773(20021004)41:19%3C3532::AID-ANIE3532%3E3.0.CO;2-4","https://scholar.google.com/scholar?q=related:xxDnlneS-ycJ:scholar.google.com/&scioq=source:%22angewandte+chemie+international+edition%22+beta+elimination+dft&hl=en&as_sdt=0,5&as_vis=1"
23,"J Krüger, C Wölper, S Schulz","From π‐Bonded Gallapnictenes to Nucleophilic, Redox‐Active Metal‐Coordinated Pnictanides",2021,"… Chemie International Edition","Wiley Online Library","https://onlinelibrary.wiley.com/doi/abs/10.1002/anie.202013618","https://scholar.google.com/scholar?cites=11777424444062930142&as_sdt=2005&sciodt=0,5&hl=en",633,"2025-05-07 02:23:29","","10.1002/anie.202013618","","",,,,,23,5.75,8,3,4,"… We therefore studied the electronic structures of 1 and 2 in more detail by DFT calculations. The optimized structural parameters of 1′ and 2′ (1′ and 2′=calculated geometry of …","https://onlinelibrary.wiley.com/doi/pdf/10.1002/anie.202013618","https://scholar.google.com/scholar?q=related:3pRf5SHRcaMJ:scholar.google.com/&scioq=source:%22angewandte+chemie+international+edition%22+beta+elimination+dft&hl=en&as_sdt=0,5&as_vis=1"
221,"H Wang, W Ye, B Yin, K Wang, MS Riaz…","Modulating cation migration and deposition with xylitol additive and oriented reconstruction of hydrogen bonds for stable zinc anodes",2023,"Angewandte Chemie …","Wiley Online Library","https://onlinelibrary.wiley.com/doi/abs/10.1002/anie.202218872","https://scholar.google.com/scholar?cites=8326159443979369863&as_sdt=2005&sciodt=0,5&hl=en",634,"2025-05-07 02:23:29","","10.1002/anie.202218872","","",,,,,221,110.50,37,6,2,"… Herein, density functional theory (DFT) computations were primarily utilized to analyze the … This again reveals that xylitol is capable of eliminating the possible parasitic reactions and …","https://onlinelibrary.wiley.com/doi/pdfdirect/10.1002/anie.202218872","https://scholar.google.com/scholar?q=related:h32ngeZ1jHMJ:scholar.google.com/&scioq=source:%22angewandte+chemie+international+edition%22+beta+elimination+dft&hl=en&as_sdt=0,5&as_vis=1"
33,"P Yang, Y Sun, K Fu, L Zhang, G Yang…","Enantioselective Synthesis of Chiral Carboxylic Acids from Alkynes and Formic Acid by Nickel‐Catalyzed Cascade Reactions: Facile Synthesis of Profens",2022,"Angewandte Chemie …","Wiley Online Library","https://onlinelibrary.wiley.com/doi/abs/10.1002/anie.202111778","https://scholar.google.com/scholar?cites=14286532720523534205&as_sdt=2005&sciodt=0,5&hl=en",635,"2025-05-07 02:23:29","","10.1002/anie.202111778","","",,,,,33,11.00,6,6,3,"… during hydrocarboxylation by protonation, as suggested in DFT calculations by Fu et al. 8e … species then undergoes CO insertion and reductive elimination with a formate ligand, which …","https://onlinelibrary.wiley.com/doi/pdfdirect/10.1002/anie.202111778","https://scholar.google.com/scholar?q=related:fd_M5tD1Q8YJ:scholar.google.com/&scioq=source:%22angewandte+chemie+international+edition%22+beta+elimination+dft&hl=en&as_sdt=0,5&as_vis=1"
