Cites,Authors,Title,Year,Source,Publisher,ArticleURL,CitesURL,GSRank,QueryDate,Type,DOI,ISSN,CitationURL,Volume,Issue,StartPage,EndPage,ECC,CitesPerYear,CitesPerAuthor,AuthorCount,Age,Abstract,FullTextURL,RelatedURL
607,"RY Zhu, ME Farmer, YQ Chen…","A simple and versatile amide directing group for C− H functionalizations",2016,"Angewandte Chemie …","Wiley Online Library","https://onlinelibrary.wiley.com/doi/abs/10.1002/anie.201600791","https://scholar.google.com/scholar?cites=8986755619361794342&as_sdt=2005&sciodt=0,5&hl=en",203,"2025-05-07 02:23:29","","10.1002/anie.201600791","","",,,,,607,67.44,152,4,9,"… With these insights and DFT calculations, a stepwise mechanism was proposed to account … , protonolysis, β-hydride elimination, or reductive elimination provide access to different …","https://onlinelibrary.wiley.com/doi/pdf/10.1002/anie.201600791","https://scholar.google.com/scholar?q=related:JilON59et3wJ:scholar.google.com/&scioq=source:%22angewandte+chemie+international+edition%22+beta+elimination+dft&hl=en&as_sdt=0,5&as_vis=1"
458,"W Scherer, GS McGrady","Agostic Interactions in d0 Metal Alkyl Complexes",2004,"Angewandte Chemie International …","Wiley Online Library","https://onlinelibrary.wiley.com/doi/abs/10.1002/anie.200200548","https://scholar.google.com/scholar?cites=16617652414175014058&as_sdt=2005&sciodt=0,5&hl=en",204,"2025-05-07 02:23:29","","10.1002/anie.200200548","","",,,,,458,21.81,229,2,21,"… However, the elimination product would be unstable “since … elimination in the chemistry of d 0 transition-metal alkyls. … geometry optimizations by density functional theory (DFT) and ab …","https://onlinelibrary.wiley.com/doi/pdf/10.1002/anie.200200548","https://scholar.google.com/scholar?q=related:qmzQm9PCneYJ:scholar.google.com/&scioq=source:%22angewandte+chemie+international+edition%22+beta+elimination+dft&hl=en&as_sdt=0,5&as_vis=1"
1120,"F Goettmann, A Fischer, M Antonietti…","Chemical synthesis of mesoporous carbon nitrides using hard templates and their use as a metal‐free catalyst for Friedel–Crafts reaction of benzene",2006,"Angewandte Chemie …","Wiley Online Library","https://onlinelibrary.wiley.com/doi/abs/10.1002/anie.200600412","https://scholar.google.com/scholar?cites=229560676670929842&as_sdt=2005&sciodt=0,5&hl=en",205,"2025-05-07 02:23:29","","10.1002/anie.200600412","","",,,,,1120,58.95,280,4,19,"… , or melamine accompanied by elimination of ammonia to generate mesoporous gC 3 N 4 … We performed DFT calculations using the Gaussian O3 package with the B3LYP functional …","https://onlinelibrary.wiley.com/doi/pdfdirect/10.1002/anie.200600412","https://scholar.google.com/scholar?q=related:snteGziQLwMJ:scholar.google.com/&scioq=source:%22angewandte+chemie+international+edition%22+beta+elimination+dft&hl=en&as_sdt=0,5&as_vis=1"
64,"F Mirabella, E Zaki, F Ivars‐Barceló, X Li…","Cooperative Formation of Long‐Range Ordering in Water Ad‐layers on Fe3O4(111) Surfaces",2018,"Angewandte Chemie …","Wiley Online Library","https://onlinelibrary.wiley.com/doi/abs/10.1002/anie.201711890","https://scholar.google.com/scholar?cites=17771061372976972094&as_sdt=2005&sciodt=0,5&hl=en",206,"2025-05-07 02:23:29","","10.1002/anie.201711890","","",,,,,64,9.14,13,5,7,"… with density functional theory (DFT) calculations. … On the basis of structural studies also corroborated by DFT … 5 seems to have eliminated such a discrepancy by employing DFT …","https://onlinelibrary.wiley.com/doi/pdf/10.1002/anie.201711890","https://scholar.google.com/scholar?q=related:PkH14Sl-n_YJ:scholar.google.com/&scioq=source:%22angewandte+chemie+international+edition%22+beta+elimination+dft&hl=en&as_sdt=0,5&as_vis=1"
17,"FD Cannavacciuolo, R Yadav, A Esper…","A High‐Throughput Approach to Repurposing Olefin Polymerization Catalysts for Polymer Upcycling",2022,"Angewandte Chemie …","Wiley Online Library","https://onlinelibrary.wiley.com/doi/abs/10.1002/anie.202202258","https://scholar.google.com/scholar?cites=17942185307783369616&as_sdt=2005&sciodt=0,5&hl=en",207,"2025-05-07 02:23:29","","10.1002/anie.202202258","","",,,,,17,5.67,4,4,3,"… thermally induced β-alkyl elimination 29 in the presence of a … determined from the DFT optimized precursor complex) and … a very low tendency for elimination events. The tetrahedral Cp* …","https://onlinelibrary.wiley.com/doi/pdf/10.1002/anie.202202258","https://scholar.google.com/scholar?q=related:kBOpxHly__gJ:scholar.google.com/&scioq=source:%22angewandte+chemie+international+edition%22+beta+elimination+dft&hl=en&as_sdt=0,5&as_vis=1"
47,"N Bhuma, L Lebedel, H Yamashita…","Insight into the Ferrier rearrangement by combining flash chemistry and superacids",2021,"Angewandte Chemie …","Wiley Online Library","https://onlinelibrary.wiley.com/doi/abs/10.1002/anie.202010175","https://scholar.google.com/scholar?cites=7554524800129339539&as_sdt=2005&sciodt=0,5&hl=en",208,"2025-05-07 02:23:29","","10.1002/anie.202010175","","",,,,,47,11.75,12,4,4,"… chemistry, NMR analysis, and DFT calculations and its use as … DFT calculations (see the Supporting Information) identified … Ia upon acid activation and subsequent elimination of the C-3 …","https://onlinelibrary.wiley.com/doi/pdf/10.1002/anie.202010175","https://scholar.google.com/scholar?q=related:k5CWtkcQ12gJ:scholar.google.com/&scioq=source:%22angewandte+chemie+international+edition%22+beta+elimination+dft&hl=en&as_sdt=0,5&as_vis=1"
124,"DL Pastoetter, S Xu, M Borrelli…","Synthesis of Vinylene‐Linked Two‐Dimensional Conjugated Polymers via the Horner–Wadsworth–Emmons Reaction",2020,"Angewandte Chemie …","Wiley Online Library","https://onlinelibrary.wiley.com/doi/abs/10.1002/anie.202010398","https://scholar.google.com/scholar?cites=15974168540372791920&as_sdt=2005&sciodt=0,5&hl=en",209,"2025-05-07 02:23:29","","10.1002/anie.202010398","","",,,,,124,24.80,31,4,5,"… the gas phase by using density functional theory (DFT) calculations (… elimination of PO(OEt) 2 OH from oxaphosphetane V provides trans-vinylene VI (E=−200 kJ mol −1 ). Thus, the DFT …","https://onlinelibrary.wiley.com/doi/pdf/10.1002/anie.202010398","https://scholar.google.com/scholar?q=related:cPIjF6elr90J:scholar.google.com/&scioq=source:%22angewandte+chemie+international+edition%22+beta+elimination+dft&hl=en&as_sdt=0,5&as_vis=1"
23,"K Sun, K Sagisaka, L Peng, H Watanabe…","Head‐to‐Tail Oligomerization by Silylene‐Tethered Sonogashira Coupling on Ag (111)",2021,"Angewandte Chemie …","Wiley Online Library","https://onlinelibrary.wiley.com/doi/abs/10.1002/anie.202102882","https://scholar.google.com/scholar?cites=12346163249676376896&as_sdt=2005&sciodt=0,5&hl=en",210,"2025-05-07 02:23:29","","10.1002/anie.202102882","","",,,,,23,5.75,5,5,4,"… (STM/AFM) and DFT calculations revealed that the oligomers were … at 130 C and subsequent elimination of the tethers at an … To rationalize this scenario, we conducted systematic DFT …","https://onlinelibrary.wiley.com/doi/pdf/10.1002/anie.202102882","https://scholar.google.com/scholar?q=related:QFvxExBiVqsJ:scholar.google.com/&scioq=source:%22angewandte+chemie+international+edition%22+beta+elimination+dft&hl=en&as_sdt=0,5&as_vis=1"
482,"J Atzrodt, V Derdau, WJ Kerr…","C− H functionalisation for hydrogen isotope exchange",2018,"Angewandte Chemie …","Wiley Online Library","https://onlinelibrary.wiley.com/doi/abs/10.1002/anie.201708903","https://scholar.google.com/scholar?cites=4061172425449951324&as_sdt=2005&sciodt=0,5&hl=en",211,"2025-05-07 02:23:29","","10.1002/anie.201708903","","",,,,,482,68.86,121,4,7,"… Subsequent β-hydride elimination produces enamine 105 and the hydrogenated form of the … This analysis was further corroborated by DFT-calculated energetics (Scheme 46, bottom). …","https://onlinelibrary.wiley.com/doi/pdfdirect/10.1002/anie.201708903","https://scholar.google.com/scholar?q=related:XFCOzs0uXDgJ:scholar.google.com/&scioq=source:%22angewandte+chemie+international+edition%22+beta+elimination+dft&hl=en&as_sdt=0,5&as_vis=1"
54,"C Thoms, C Marquardt, AY Timoshkin…","The oligomerization of phosphinoborane by titanium complexes.",2013,"… International Edition","search.ebscohost.com","https://search.ebscohost.com/login.aspx?direct=true&profile=ehost&scope=site&authtype=crawler&jrnl=14337851&AN=87549344&h=dnASRlvQPZzB6nb2CLztKhLMEGnvzGvTqCAC2SEveBygg4FGKpvdbWOehVSCdNEU43PNF35KnJD2Lpt9z%2FM78Q%3D%3D&crl=c","https://scholar.google.com/scholar?cites=3274236743787563403&as_sdt=2005&sciodt=0,5&hl=en",212,"2025-05-07 02:23:29","","10.1002/anie.201209703","","",,,,,54,4.50,14,4,12,"… )acetylene) for which a clean elimination of the acetylene is known.[… [24] To clarify the electronic structures, DFT calculations at the … DFT calculations predict that the difference in energy …","https://onlinelibrary.wiley.com/doi/pdf/10.1002/anie.201209703","https://scholar.google.com/scholar?q=related:i0n9h_hscC0J:scholar.google.com/&scioq=source:%22angewandte+chemie+international+edition%22+beta+elimination+dft&hl=en&as_sdt=0,5&as_vis=1"
8,"P Kumar Someswara Ashwathappa…","Metal‐Free Directed Site‐Selective Csp3‐H Borylation of Saturated Cyclic Amines",2023,"Angewandte Chemie …","Wiley Online Library","https://onlinelibrary.wiley.com/doi/abs/10.1002/anie.202309295","https://scholar.google.com/scholar?cites=15544224919761687750&as_sdt=2005&sciodt=0,5&hl=en",213,"2025-05-07 02:23:29","","10.1002/anie.202309295","","",,,,,8,4.00,4,2,2,"… spectroscopy, calorimetry experiments and density functional theory (DFT) computations. It … proceeds via a concerted pathway with H 2 elimination as a driving force. Recently, Chang …","https://onlinelibrary.wiley.com/doi/pdf/10.1002/anie.202309295","https://scholar.google.com/scholar?q=related:xpQrKzUuuNcJ:scholar.google.com/&scioq=source:%22angewandte+chemie+international+edition%22+beta+elimination+dft&hl=en&as_sdt=0,5&as_vis=1"
31,"J Skotnitzki, A Kremsmair, D Keefer…","Stereoselective Csp3−Csp2 Cross‐Couplings of Chiral Secondary Alkylzinc Reagents with Alkenyl and Aryl Halides",2020,"Angewandte Chemie …","Wiley Online Library","https://onlinelibrary.wiley.com/doi/abs/10.1002/anie.201910397","https://scholar.google.com/scholar?cites=361926788568980591&as_sdt=2005&sciodt=0,5&hl=en",214,"2025-05-07 02:23:29","","10.1002/anie.201910397","","",,,,,31,6.20,8,4,5,"… DFT calculations were performed to rationalize the overall retention in the catalytic cycle. … regarding β-hydride elimination and the formation of side products such as dimerization. …","https://onlinelibrary.wiley.com/doi/pdf/10.1002/anie.201910397","https://scholar.google.com/scholar?q=related:bxxaI3_SBQUJ:scholar.google.com/&scioq=source:%22angewandte+chemie+international+edition%22+beta+elimination+dft&hl=en&as_sdt=0,5&as_vis=1"
456,"AJJ Lennox, GC Lloyd‐Jones","Transmetalation in the Suzuki–Miyaura coupling: the fork in the trail",2013,"… Chemie International Edition","Wiley Online Library","https://onlinelibrary.wiley.com/doi/abs/10.1002/anie.201301737","https://scholar.google.com/scholar?cites=9622649994641989140&as_sdt=2005&sciodt=0,5&hl=en",215,"2025-05-07 02:23:29","","10.1002/anie.201301737","","",,,,,456,38.00,228,2,12,"… of the organic moiety and product-generating reductive elimination from 4. However, a more … in direct contrast to the high barriers predicted by DFT (Figure 1), 8 and transmetalation then …","https://onlinelibrary.wiley.com/doi/pdf/10.1002/anie.201301737","https://scholar.google.com/scholar?q=related:FN6M6C-FioUJ:scholar.google.com/&scioq=source:%22angewandte+chemie+international+edition%22+beta+elimination+dft&hl=en&as_sdt=0,5&as_vis=1"
341,"A de Meijere, H Schirmer…","Fischer Carbene Complexes as Chemical Multitalents: The Incredible Range of Products from Carbenepentacarbonylmetal α,β‐Unsaturated Complexes",2000,"Angewandte Chemie …","Wiley Online Library","https://onlinelibrary.wiley.com/doi/abs/10.1002/1521-3773(20001117)39:22%3C3964::AID-ANIE3964%3E3.0.CO;2-C","https://scholar.google.com/scholar?cites=12479027487961357866&as_sdt=2005&sciodt=0,5&hl=en",216,"2025-05-07 02:23:29","","10.1002/1521-3773(20001117)39:22%3C3964::AID-ANIE3964%3E3.0.CO;2-C","","",,,,,341,13.64,114,3,25,"… terminus from which the 1-metallacumulene 82 then results by elimination of ethanolate. Allenylidene complexes of the type 82 are also formed by elimination of ethanol from the β- …","https://www.uwindsor.ca/people/jgreen/sites/uwindsor.ca.people.jgreen/files/aciee-2000-39-3964-carbene-fischer.pdf","https://scholar.google.com/scholar?q=related:Kp5FMmJpLq0J:scholar.google.com/&scioq=source:%22angewandte+chemie+international+edition%22+beta+elimination+dft&hl=en&as_sdt=0,5&as_vis=1"
327,"J Pospech, I Fleischer, R Franke…","Alternative metals for homogeneous catalyzed hydroformylation reactions",2013,"Angewandte Chemie …","Wiley Online Library","https://onlinelibrary.wiley.com/doi/abs/10.1002/anie.201208330","https://scholar.google.com/scholar?cites=15225255437316096893&as_sdt=2005&sciodt=0,5&hl=en",217,"2025-05-07 02:23:29","","10.1002/anie.201208330","","",,,,,327,27.25,82,4,12,"… Density functional theory (DFT) calculations revealed that the … The DFT studies conducted also disclosed that the activation … Kinetic studies revealed that dihydride elimination proceeds …","https://onlinelibrary.wiley.com/doi/pdfdirect/10.1002/anie.201208330","https://scholar.google.com/scholar?q=related:fYPPQyf5StMJ:scholar.google.com/&scioq=source:%22angewandte+chemie+international+edition%22+beta+elimination+dft&hl=en&as_sdt=0,5&as_vis=1"
41,"XL Yang, JD Guo, H Xiao, K Feng…","Photoredox Catalysis of Aromatic β‐Ketoesters for in Situ Production of Transient and Persistent Radicals for Organic Transformation",2020,"Angewandte Chemie …","Wiley Online Library","https://onlinelibrary.wiley.com/doi/abs/10.1002/anie.201916423","https://scholar.google.com/scholar?cites=5128995264041509092&as_sdt=2005&sciodt=0,5&hl=en",218,"2025-05-07 02:23:29","","10.1002/anie.201916423","","",,,,,41,8.20,8,5,5,"… S4 supported by the results of the DFT calculation in the Supporting Information; Scheme 1). … form enables elimination of a proton to form the anion, and at the same time, the eliminated …","https://onlinelibrary.wiley.com/doi/pdf/10.1002/anie.201916423","https://scholar.google.com/scholar?q=related:5ODanwTaLUcJ:scholar.google.com/&scioq=source:%22angewandte+chemie+international+edition%22+beta+elimination+dft&hl=en&as_sdt=0,5&as_vis=1"
38,"WJ Kang, B Li, M Duan, G Pan, W Sun…","Discovery of a Thioxanthone–TfOH Complex as a Photoredox Catalyst for Hydrogenation of Alkenes Using p‐Xylene as both Electron and Hydrogen Sources",2022,"Angewandte Chemie …","Wiley Online Library","https://onlinelibrary.wiley.com/doi/abs/10.1002/anie.202211562","https://scholar.google.com/scholar?cites=11751984576439190913&as_sdt=2005&sciodt=0,5&hl=en",219,"2025-05-07 02:23:29","","10.1002/anie.202211562","","",,,,,38,12.67,6,6,3,"… Metal-hydride formation by β-hydride elimination from readily accessible hydrogen sources, … 19S with toluene was studied computationally using density functional theory (Figure 5c; for …","https://onlinelibrary.wiley.com/doi/pdfdirect/10.1002/anie.202211562","https://scholar.google.com/scholar?q=related:gQWHJLVvF6MJ:scholar.google.com/&scioq=source:%22angewandte+chemie+international+edition%22+beta+elimination+dft&hl=en&as_sdt=0,5&as_vis=1"
52,"DD Beattie, EG Bowes, MW Drover…","Oxidation State Dependent Coordination Modes: Accessing an Amidate‐Supported Nickel (I) δ‐bis (C− H) Agostic Complex",2016,"Angewandte Chemie …","Wiley Online Library","https://onlinelibrary.wiley.com/doi/abs/10.1002/anie.201607243","https://scholar.google.com/scholar?cites=1702755928965915181&as_sdt=2005&sciodt=0,5&hl=en",220,"2025-05-07 02:23:29","","10.1002/anie.201607243","","",,,,,52,5.78,13,4,9,"… These dual σ CH contacts have also been studied by density functional theory (DFT) using natural bond order (NBO) and Atoms in Molecules (AIM) analyses. Studying agostic …","https://onlinelibrary.wiley.com/doi/pdf/10.1002/anie.201607243","https://scholar.google.com/scholar?q=related:LSI07X5noRcJ:scholar.google.com/&scioq=source:%22angewandte+chemie+international+edition%22+beta+elimination+dft&hl=en&as_sdt=0,5&as_vis=1"
19,"R Kancherla, K Muralirajan, S Dutta…","Photoexcitation of Distinct Divalent Palladium Complexes in Cross‐Coupling Amination Under Air",2024,"Angewandte Chemie …","Wiley Online Library","https://onlinelibrary.wiley.com/doi/abs/10.1002/anie.202314508","https://scholar.google.com/scholar?cites=326457327662686988&as_sdt=2005&sciodt=0,5&hl=en",221,"2025-05-07 02:23:29","","10.1002/anie.202314508","","",,,,,19,19.00,5,4,1,"… shown to undergo direct reductive elimination from Pd II perhaps … Later, density functional theory (DFT) calculations were … TD-DFT calculations suggest an alternative pathway starting …","https://onlinelibrary.wiley.com/doi/pdf/10.1002/anie.202314508","https://scholar.google.com/scholar?q=related:DGOouTXPhwQJ:scholar.google.com/&scioq=source:%22angewandte+chemie+international+edition%22+beta+elimination+dft&hl=en&as_sdt=0,5&as_vis=1"
24,"DE Anderson, A Tortajada…","New frontiers in organosodium chemistry as sustainable alternatives to organolithium reagents",2024,"Angewandte Chemie …","Wiley Online Library","https://onlinelibrary.wiley.com/doi/abs/10.1002/anie.202313556","https://scholar.google.com/scholar?cites=4033754163170544362&as_sdt=2005&sciodt=0,5&hl=en",222,"2025-05-07 02:23:29","","10.1002/anie.202313556","","",,,,,24,24.00,8,3,1,"… 6 TREN)] allows for a subsequent Peterson elimination for the methylenation pathway to occur. … This reactivity study was supported by DFT calculations into the reaction pathways which …","https://onlinelibrary.wiley.com/doi/pdf/10.1002/anie.202313556","https://scholar.google.com/scholar?q=related:6ooIJwrG-jcJ:scholar.google.com/&scioq=source:%22angewandte+chemie+international+edition%22+beta+elimination+dft&hl=en&as_sdt=0,5&as_vis=1"
849,"A Rudolph, M Lautens","Secondary Alkyl Halides in Transition‐Metal‐Catalyzed Cross‐Coupling Reactions",2009,"Angewandte Chemie International …","Wiley Online Library","https://onlinelibrary.wiley.com/doi/abs/10.1002/anie.200803611","https://scholar.google.com/scholar?cites=4590053488499102510&as_sdt=2005&sciodt=0,5&hl=en",223,"2025-05-07 02:23:29","","10.1002/anie.200803611","","",,,,,849,53.06,425,2,16,"… elimination or hydrodehalogenation, which can outcompete both intermolecular transmetalation and reductive elimination (… Density functional theory calculations by Lin and Phillips 27 …","https://onlinelibrary.wiley.com/doi/pdf/10.1002/anie.200803611","https://scholar.google.com/scholar?q=related:LhMIIlQlsz8J:scholar.google.com/&scioq=source:%22angewandte+chemie+international+edition%22+beta+elimination+dft&hl=en&as_sdt=0,5&as_vis=1"
6,"K Wu, X Zhang, LL Wu, JS Huang…","A Convergent, Modular Approach to Trifluoromethyl‐Bearing 5‐Membered Rings via Catalytic C(sp3)−H Activation",2023,"Angewandte Chemie …","Wiley Online Library","https://onlinelibrary.wiley.com/doi/abs/10.1002/anie.202215891","https://scholar.google.com/scholar?cites=2124328359376960959&as_sdt=2005&sciodt=0,5&hl=en",224,"2025-05-07 02:23:29","","10.1002/anie.202215891","","",,,,,6,3.00,1,5,2,"… The origin of selectivity was investigated by DFT calculations. … Neither β-gem-difluoroalkene 12a, 12b nor fluoride elimination 12c was detected under the conditions employed in this …","https://onlinelibrary.wiley.com/doi/pdf/10.1002/anie.202215891","https://scholar.google.com/scholar?q=related:v73zPmMhex0J:scholar.google.com/&scioq=source:%22angewandte+chemie+international+edition%22+beta+elimination+dft&hl=en&as_sdt=0,5&as_vis=1"
3878,"ASK Hashmi, GJ Hutchings","Gold catalysis",2006,"… Chemie International Edition","Wiley Online Library","https://onlinelibrary.wiley.com/doi/abs/10.1002/anie.200602454","https://scholar.google.com/scholar?cites=7058854572765738467&as_sdt=2005&sciodt=0,5&hl=en",225,"2025-05-07 02:23:29","","10.1002/anie.200602454","","",,,,,3878,204.11,1939,2,19,"… no tendency to undergo a β-hydrogen elimination. A direct experimental example of that was … Lopez and Nørskov showed by using DFT calculations that the activation of CO was the …","https://onlinelibrary.wiley.com/doi/pdfdirect/10.1002/anie.200602454","https://scholar.google.com/scholar?q=related:4_XXotUW9mEJ:scholar.google.com/&scioq=source:%22angewandte+chemie+international+edition%22+beta+elimination+dft&hl=en&as_sdt=0,5&as_vis=1"
68,"G Zeng, S Maeda, T Taketsugu…","Catalytic Transfer Hydrogenation by a Trivalent Phosphorus Compound: Phosphorus‐Ligand Cooperation Pathway or PIII/PV Redox Pathway?",2014,"Angewandte Chemie …","Wiley Online Library","https://onlinelibrary.wiley.com/doi/abs/10.1002/anie.201311104","https://scholar.google.com/scholar?cites=15233384268796520015&as_sdt=2005&sciodt=0,5&hl=en",226,"2025-05-07 02:23:29","","10.1002/anie.201311104","","",,,,,68,6.18,17,4,11,"… Geometry optimizations were carried out by the DFT 8 method using the B3PW91 functional, … At last, the reductive elimination occurs to yield diphenylhydrazine (10) and regenerate 1 P …","https://onlinelibrary.wiley.com/doi/pdf/10.1002/anie.201311104","https://scholar.google.com/scholar?q=related:T-ajVEjaZ9MJ:scholar.google.com/&scioq=source:%22angewandte+chemie+international+edition%22+beta+elimination+dft&hl=en&as_sdt=0,5&as_vis=1"
64,"S Yao, Y Grossheim, A Kostenko…","Facile access to NaOC≡ As and its use as an arsenic source to form germylidenylarsinidene complexes",2017,"Angewandte Chemie …","Wiley Online Library","https://onlinelibrary.wiley.com/doi/abs/10.1002/anie.201703731","https://scholar.google.com/scholar?cites=5528120826355925773&as_sdt=2005&sciodt=0,5&hl=en",227,"2025-05-07 02:23:29","","10.1002/anie.201703731","","",,,,,64,8.00,16,4,8,"… Upon exposure to ambient light, 2 undergoes CO elimination to form the 1,3-digerma-2,4-… The formation of 2–5 and their electronic structures have been studied by DFT calculations. …","https://onlinelibrary.wiley.com/doi/pdf/10.1002/anie.201703731","https://scholar.google.com/scholar?q=related:DUNiMprUt0wJ:scholar.google.com/&scioq=source:%22angewandte+chemie+international+edition%22+beta+elimination+dft&hl=en&as_sdt=0,5&as_vis=1"
283,"BSL Collins, CM Wilson, EL Myers…","Asymmetric synthesis of secondary and tertiary boronic esters",2017,"Angewandte Chemie …","Wiley Online Library","https://onlinelibrary.wiley.com/doi/abs/10.1002/anie.201701963","https://scholar.google.com/scholar?cites=2773359085529472542&as_sdt=2005&sciodt=0,5&hl=en",228,"2025-05-07 02:23:29","","10.1002/anie.201701963","","",,,,,283,35.38,71,4,8,"… complex 6, from which reductive elimination provides the secondary alkyl boronic ester. They further … Extensive DFT studies suggested that the proximal polar group helps to stabilise the …","https://research-information.bris.ac.uk/files/151110899/SynthesisBoronicEsters_final_for_website.pdf","https://scholar.google.com/scholar?q=related:Hh6W92TzfCYJ:scholar.google.com/&scioq=source:%22angewandte+chemie+international+edition%22+beta+elimination+dft&hl=en&as_sdt=0,5&as_vis=1"
2,"BR Shao, WF Jiang, C Wang…","Pd‐Catalyzed Asymmetric Hydrogenolysis Rearrangement of Allylic Esters to Access Axially Chiral Olefins",2025,"Angewandte Chemie …","Wiley Online Library","https://onlinelibrary.wiley.com/doi/abs/10.1002/anie.202421287","https://scholar.google.com/scholar?cites=9184516430420669627&as_sdt=2005&sciodt=0,5&hl=en",229,"2025-05-07 02:23:29","","10.1002/anie.202421287","","",,,,,2,2.00,1,4,1,"… Density functional theory (DFT) calculations were then … regarding to hydrogenolysis and β-hydrogen elimination (Figure 1).[… The most favorable elimination pathway was found to be the …","https://onlinelibrary.wiley.com/doi/pdfdirect/10.1002/anie.202421287","https://scholar.google.com/scholar?q=related:u3T2JAj1dX8J:scholar.google.com/&scioq=source:%22angewandte+chemie+international+edition%22+beta+elimination+dft&hl=en&as_sdt=0,5&as_vis=1"
253,"P Chuentragool, D Kurandina…","Catalysis with palladium complexes photoexcited by visible light",2019,"Angewandte Chemie …","Wiley Online Library","https://onlinelibrary.wiley.com/doi/abs/10.1002/anie.201813523","https://scholar.google.com/scholar?cites=5630959365611728093&as_sdt=2005&sciodt=0,5&hl=en",230,"2025-05-07 02:23:29","","10.1002/anie.201813523","","",,,,,253,42.17,84,3,6,"… , after a subsequent β-H elimination. This novel method allows the … Pd-involved β-H-elimination event—which enabled the novel … Mechanistic studies and DFT calculations supported the …","https://onlinelibrary.wiley.com/doi/pdf/10.1002/anie.201813523","https://scholar.google.com/scholar?q=related:3Szye7UvJU4J:scholar.google.com/&scioq=source:%22angewandte+chemie+international+edition%22+beta+elimination+dft&hl=en&as_sdt=0,5&as_vis=1"
8,"F Guan, Y Qian, P Zhang, R Zhang…","Fast Isomerization Before Isomerization‐Hydroformylation: Probing the Neglected Period with A Novel Microfluidic Device",2023,"Angewandte Chemie …","Wiley Online Library","https://onlinelibrary.wiley.com/doi/abs/10.1002/anie.202302777","https://scholar.google.com/scholar?cites=959218004298039115&as_sdt=2005&sciodt=0,5&hl=en",231,"2025-05-07 02:23:29","","10.1002/anie.202302777","","",,,,,8,4.00,2,5,2,"… To probe the reaction mechanism, we conducted DFT calculation to compare the proposed … After a rotation of the alkyl group, the β-hydride elimination that has a barrier of 7.0 kcal mol −…","https://onlinelibrary.wiley.com/doi/pdf/10.1002/anie.202302777","https://scholar.google.com/scholar?q=related:S_9XWLHTTw0J:scholar.google.com/&scioq=source:%22angewandte+chemie+international+edition%22+beta+elimination+dft&hl=en&as_sdt=0,5&as_vis=1"
