Cites,Authors,Title,Year,Source,Publisher,ArticleURL,CitesURL,GSRank,QueryDate,Type,DOI,ISSN,CitationURL,Volume,Issue,StartPage,EndPage,ECC,CitesPerYear,CitesPerAuthor,AuthorCount,Age,Abstract,FullTextURL,RelatedURL
108,"AV Protchenko, P Vasko, DCH Do, ...","Reduction of carbon oxides by an acyclic silylene: reductive coupling of CO",2019,"Angewandte Chemie …","Wiley Online Library","https://onlinelibrary.wiley.com/doi/abs/10.1002/anie.201812675","https://scholar.google.com/scholar?cites=9095095845397731924&as_sdt=2005&sciodt=0,5&hl=en",285,"2025-04-26 13:02:21","","10.1002/anie.201812675","","",,,,,108,18.00,27,4,6,"… 19g In the case of 2, the thermodynamic basis for this rearrangement can readily be demonstrated by quantum chemical methods: DFT calculations carried out at the PBE1PBE/def-…","https://onlinelibrary.wiley.com/doi/pdf/10.1002/anie.201812675","https://scholar.google.com/scholar?q=related:VBoQx3tFOH4J:scholar.google.com/&scioq=source:%22angewandte+chemie+international+edition%22+migratory+insertion+dft&hl=en&as_sdt=0,5&as_vis=1"
14,"J Wang, X Zhang, Z Liu, J Yu, HG Wang, ...","Tuning Electron Delocalization of Redox‐Active Porous Aromatic Framework for Low‐Temperature Aqueous Zn− K Hybrid Batteries with Air Self‐Chargeability",2024,"Angewandte Chemie …","Wiley Online Library","https://onlinelibrary.wiley.com/doi/abs/10.1002/anie.202401559","https://scholar.google.com/scholar?cites=5430573070104222721&as_sdt=2005&sciodt=0,5&hl=en",286,"2025-04-26 13:02:21","","10.1002/anie.202401559","","",,,,,14,14.00,2,6,1,"… PAF-305 unit with different metals by DFT calculation. (c) Rate … inserted/extracted at the battery cathode, and Zn2+ ions are plated/stripped at the anode (Figure 3a). Furthermore, DFT …","https://onlinelibrary.wiley.com/doi/pdf/10.1002/anie.202401559","https://scholar.google.com/scholar?q=related:AVxdUm9FXUsJ:scholar.google.com/&scioq=source:%22angewandte+chemie+international+edition%22+migratory+insertion+dft&hl=en&as_sdt=0,5&as_vis=1"
38,"S Tong, S Zhao, Q He, Q Wang, ...","Fluorophores for Excited‐State Intramolecular Proton Transfer by an Yttrium Triflate Catalyzed Reaction of Isocyanides with Thiocarboxylic Acids",2017,"Angewandte Chemie …","Wiley Online Library","https://onlinelibrary.wiley.com/doi/abs/10.1002/anie.201702488","https://scholar.google.com/scholar?cites=5663547897973509352&as_sdt=2005&sciodt=0,5&hl=en",287,"2025-04-26 13:02:21","","10.1002/anie.201702488","","",,,,,38,4.75,8,5,8,"… Assuming that the reaction went through a migratory insertion mechanism, two complexes F … Simplified mechanistic view and the results of DFT calculations. For the sake of clarity, …","https://onlinelibrary.wiley.com/doi/pdf/10.1002/anie.201702488","https://scholar.google.com/scholar?q=related:6Awfc872mE4J:scholar.google.com/&scioq=source:%22angewandte+chemie+international+edition%22+migratory+insertion+dft&hl=en&as_sdt=0,5&as_vis=1"
75,"AF Eichhorn, S Fuchs, M Flock, ...","Reversible oxidative addition at carbon",2017,"Angewandte Chemie …","Wiley Online Library","https://onlinelibrary.wiley.com/doi/abs/10.1002/anie.201701679","https://scholar.google.com/scholar?cites=17804841168941528421&as_sdt=2005&sciodt=0,5&hl=en",288,"2025-04-26 13:02:21","","10.1002/anie.201701679","","",,,,,75,9.38,19,4,8,"… DFT calculations confirm that the reaction between cAAC Me and 4-Me-C 6 H 4 Bneop is an entropically driven equilibrium reaction (see the Supporting Information). Similar equilibria …","https://onlinelibrary.wiley.com/doi/pdf/10.1002/anie.201701679","https://scholar.google.com/scholar?q=related:ZbUChbWAF_cJ:scholar.google.com/&scioq=source:%22angewandte+chemie+international+edition%22+migratory+insertion+dft&hl=en&as_sdt=0,5&as_vis=1"
52,"M Yang, Y Wang, D Ma, J Zhu, H Mi, ...","Unlocking the Interfacial Adsorption‐Intercalation Pseudocapacitive Storage Limit to Enabling All‐Climate, High Energy/Power Density and Durable Zn‐Ion Batteries",2023,"Angewandte Chemie …","Wiley Online Library","https://onlinelibrary.wiley.com/doi/abs/10.1002/anie.202304400","https://scholar.google.com/scholar?cites=3725833863218011670&as_sdt=2005&sciodt=0,5&hl=en",289,"2025-04-26 13:02:21","","10.1002/anie.202304400","","",,,,,52,26.00,9,6,2,"… Density functional theory (DFT) calculation was carried out to reveal the synergistic effect of Se defect and H 2 O intercalation on boosting the Zn 2+ storage kinetics. Here, four kinds of …","https://onlinelibrary.wiley.com/doi/pdfdirect/10.1002/anie.202304400","https://scholar.google.com/scholar?q=related:Fh47hSjStDMJ:scholar.google.com/&scioq=source:%22angewandte+chemie+international+edition%22+migratory+insertion+dft&hl=en&as_sdt=0,5&as_vis=1"
1003,"Q Zhang, J Luan, Y Tang, X Ji, ...","Interfacial design of dendrite‐free zinc anodes for aqueous zinc‐ion batteries",2020,"Angewandte Chemie …","Wiley Online Library","https://onlinelibrary.wiley.com/doi/abs/10.1002/anie.202000162","https://scholar.google.com/scholar?cites=11242656327597030267&as_sdt=2005&sciodt=0,5&hl=en",290,"2025-04-26 13:02:21","","10.1002/anie.202000162","","",,,,,1003,200.60,201,5,5,"… Binding energy calculated by density functional theory (DFT) is suggested as the criterion to evaluate the strength of the interaction between zinc and host. According to our previous …","https://onlinelibrary.wiley.com/doi/full/10.1002/anie.202000162","https://scholar.google.com/scholar?q=related:e_s3Il3wBZwJ:scholar.google.com/&scioq=source:%22angewandte+chemie+international+edition%22+migratory+insertion+dft&hl=en&as_sdt=0,5&as_vis=1"
114,"H Fang, S Gao, M Ren, Y Huang, ...","Dual‐function presodiation with sodium diphenyl ketone towards ultra‐stable hard carbon anodes for sodium‐ion batteries",2023,"Angewandte Chemie …","Wiley Online Library","https://onlinelibrary.wiley.com/doi/abs/10.1002/anie.202214717","https://scholar.google.com/scholar?cites=14062582355867791519&as_sdt=2005&sciodt=0,5&hl=en",291,"2025-04-26 13:02:21","","10.1002/anie.202214717","","",,,,,114,57.00,23,5,2,"… orbital (HOMO) and lowest unoccupied molecular orbital (LOMO) energies of quasi-metallic Na, solvents, and solvates of electrolytes are calculated with density functional theory (DFT) …","https://onlinelibrary.wiley.com/doi/pdf/10.1002/anie.202214717","https://scholar.google.com/scholar?q=related:n_AsWiVUKMMJ:scholar.google.com/&scioq=source:%22angewandte+chemie+international+edition%22+migratory+insertion+dft&hl=en&as_sdt=0,5&as_vis=1"
30,"Y You, P Han, S Song, W Luo, S Zhao, ...","Distinct Selectivity Control in Solar‐Driven Bio‐Based α‐Hydroxyl Acid Conversion: A Comparison of Pt Nanoparticles and Atomically Dispersed Pt on CdS",2023,"Angewandte Chemie …","Wiley Online Library","https://onlinelibrary.wiley.com/doi/abs/10.1002/anie.202306452","https://scholar.google.com/scholar?cites=17885756754188023438&as_sdt=2005&sciodt=0,5&hl=en",292,"2025-04-26 13:02:21","","10.1002/anie.202306452","","",,,,,30,15.00,5,6,2,"… Further density functional theory (DFT) calculations were performed to elucidate the reaction … The DFT calculations indicate that the C−C coupling of ⋅C 3 H 5 O 3 to DMTA is more …","https://onlinelibrary.wiley.com/doi/pdf/10.1002/anie.202306452","https://scholar.google.com/scholar?q=related:jrZrUAH5NvgJ:scholar.google.com/&scioq=source:%22angewandte+chemie+international+edition%22+migratory+insertion+dft&hl=en&as_sdt=0,5&as_vis=1"
7,"R Bai, G He, J Li, L Li, T Zhang, X Wang, ...","Heteroatoms‐Stabilized Single Palladium Atoms on Amorphous Zeolites: Breaking the Tradeoff between Catalytic Activity and Selectivity for Alkyne …",2024,"Angewandte Chemie …","Wiley Online Library","https://onlinelibrary.wiley.com/doi/abs/10.1002/anie.202410017","https://scholar.google.com/scholar?cites=6843947249772921011&as_sdt=2005&sciodt=0,5&hl=en",293,"2025-04-26 13:02:21","","10.1002/anie.202410017","","",,,,,7,7.00,1,7,1,"… and theoretical density functional theory calculations confirm … atoms by controlling the electron migration from Pd but also … Our DFT calculation shows the second hydrogenation step is …","https://onlinelibrary.wiley.com/doi/pdf/10.1002/anie.202410017","https://scholar.google.com/scholar?q=related:swA6TMOV-l4J:scholar.google.com/&scioq=source:%22angewandte+chemie+international+edition%22+migratory+insertion+dft&hl=en&as_sdt=0,5&as_vis=1"
1706,"M Cokoja, C Bruckmeier, B Rieger, ...","Transformation of carbon dioxide with homogeneous transition‐metal catalysts: a molecular solution to a global challenge?",2011,"Angewandte Chemie …","Wiley Online Library","https://onlinelibrary.wiley.com/doi/abs/10.1002/anie.201102010","https://scholar.google.com/scholar?cites=974889403134368031&as_sdt=2005&sciodt=0,5&hl=en",294,"2025-04-26 13:02:21","","10.1002/anie.201102010","","",,,,,1706,121.86,427,4,14,"… DFT calculations by Schubert and Pápai revealed that a phosphine ligand dissociates from the nickel center in the first step. Subsequently, a CO 2 molecule occupies the vacant …","https://onlinelibrary.wiley.com/doi/pdf/10.1002/anie.201102010","https://scholar.google.com/scholar?q=related:H9kdOb-Ahw0J:scholar.google.com/&scioq=source:%22angewandte+chemie+international+edition%22+migratory+insertion+dft&hl=en&as_sdt=0,5&as_vis=1"
290,"X Gu, W Xiang, Q Tian, S Liu","Rational surface‐defect control via designed passivation for high‐efficiency inorganic perovskite solar cells",2021,"… Chemie International Edition","Wiley Online Library","https://onlinelibrary.wiley.com/doi/abs/10.1002/anie.202109724","https://scholar.google.com/scholar?cites=16481159762256690053&as_sdt=2005&sciodt=0,5&hl=en",295,"2025-04-26 13:02:21","","10.1002/anie.202109724","","",,,,,290,72.50,73,4,4,"… We first adopted density functional theory (DFT) calculations to gain information regarding the formation energies of the selected native defects located at the inorganic perovskite film …","https://onlinelibrary.wiley.com/doi/pdf/10.1002/anie.202109724","https://scholar.google.com/scholar?q=related:hXvFm3vXuOQJ:scholar.google.com/&scioq=source:%22angewandte+chemie+international+edition%22+migratory+insertion+dft&hl=en&as_sdt=0,5&as_vis=1"
187,"M Soleilhavoup, G Bertrand","Borylenes: an emerging class of compounds",2017,"… Chemie International Edition","Wiley Online Library","https://onlinelibrary.wiley.com/doi/abs/10.1002/anie.201705153","https://scholar.google.com/scholar?cites=8810082237543969911&as_sdt=2005&sciodt=0,5&hl=en",296,"2025-04-26 13:02:21","","10.1002/anie.201705153","","",,,,,187,23.38,94,2,8,"… Indeed, it has already been reported 46a, 48 that such CAAC–borohydride adducts can rearrange via 1,2-hydride migration. Furthermore, upon DFT calculations, we were not able to …","https://onlinelibrary.wiley.com/doi/am-pdf/10.1002/anie.201705153","https://scholar.google.com/scholar?q=related:d3TJAh6zQ3oJ:scholar.google.com/&scioq=source:%22angewandte+chemie+international+edition%22+migratory+insertion+dft&hl=en&as_sdt=0,5&as_vis=1"
89,"J Cao, H Wu, D Zhang, D Luo, L Zhang, ...","In‐Situ Ultrafast Construction of Zinc Tungstate Interface Layer for Highly Reversible Zinc Anodes",2024,"Angewandte Chemie …","Wiley Online Library","https://onlinelibrary.wiley.com/doi/abs/10.1002/anie.202319661","https://scholar.google.com/scholar?cites=2550547774377214970&as_sdt=2005&sciodt=0,5&hl=en",297,"2025-04-26 13:02:21","","10.1002/anie.202319661","","",,,,,89,89.00,15,6,1,"… The first-principles calculations based on the density functional theory (DFT) 2 method were first conducted to investigate the suppressing mechanism of zinc dendrites 3 and side …","https://onlinelibrary.wiley.com/doi/pdfdirect/10.1002/anie.202319661","https://scholar.google.com/scholar?q=related:-sNq-q9dZSMJ:scholar.google.com/&scioq=source:%22angewandte+chemie+international+edition%22+migratory+insertion+dft&hl=en&as_sdt=0,5&as_vis=1"
2,"YQ Xiao, KX Fang, Z Zhang, C Zhang, ...","Hyperconjugation‐Driven Isodesmic Reaction of Indoles and Anilines: Reaction Discovery, Mechanism Study, and Antitumor Application",2024,"Angewandte Chemie …","Wiley Online Library","https://onlinelibrary.wiley.com/doi/abs/10.1002/anie.202408426","https://scholar.google.com/scholar?cites=14977553155009870933&as_sdt=2005&sciodt=0,5&hl=en",298,"2025-04-26 13:02:21","","10.1002/anie.202408426","","",,,,,2,2.00,0,5,1,"… The driving force for the isodesmic reaction was investigated using density functional theory (DFT) calculations at the B3LYP-D3/SMD/Def2TZVP level of theory. As illustrated in Figure …","https://onlinelibrary.wiley.com/doi/pdf/10.1002/anie.202408426","https://scholar.google.com/scholar?q=related:VfzkcD312s8J:scholar.google.com/&scioq=source:%22angewandte+chemie+international+edition%22+migratory+insertion+dft&hl=en&as_sdt=0,5&as_vis=1"
111,"Y Yang, Z Chai, X Qin, Z Zhang, ...","Light‐Induced Redox Looping of a Rhodium/CexWO3 Photocatalyst for Highly Active and Robust Dry Reforming of Methane",2022,"Angewandte Chemie …","Wiley Online Library","https://onlinelibrary.wiley.com/doi/abs/10.1002/anie.202200567","https://scholar.google.com/scholar?cites=15730162092540137082&as_sdt=2005&sciodt=0,5&hl=en",299,"2025-04-26 13:02:21","","10.1002/anie.202200567","","",,,,,111,37.00,22,5,3,"… Therefore, we shed light on the ability of oxygen migration during the DRM process, {010} … for DFT calculation to clarify the effect of cerium metal on the oxygen migration process during …","https://onlinelibrary.wiley.com/doi/pdf/10.1002/anie.202200567","https://scholar.google.com/scholar?q=related:eo4ryRTDTNoJ:scholar.google.com/&scioq=source:%22angewandte+chemie+international+edition%22+migratory+insertion+dft&hl=en&as_sdt=0,5&as_vis=1"
85,"JN Harvey, J Jover, GC Lloyd‐Jones, ...","The Newman–Kwart Rearrangement of O‐Aryl Thiocarbamates: Substantial Reduction in Reaction Temperatures through Palladium Catalysis",2009,"Angewandte Chemie …","Wiley Online Library","https://onlinelibrary.wiley.com/doi/abs/10.1002/anie.200903908","https://scholar.google.com/scholar?cites=7458018046388419452&as_sdt=2005&sciodt=0,5&hl=en",300,"2025-04-26 13:02:21","","10.1002/anie.200903908","","",,,,,85,5.31,21,4,16,"Thermally induced OAr! SAr migration in aryl thiocarbamates (1! 2, Scheme 1)[1] is commonly referred to [2] as the Newman–Kwart rearrangement (“NKR”)[3] and belongs to a group of …","https://onlinelibrary.wiley.com/doi/pdfdirect/10.1002/anie.200903908","https://scholar.google.com/scholar?q=related:fDtvH-YzgGcJ:scholar.google.com/&scioq=source:%22angewandte+chemie+international+edition%22+migratory+insertion+dft&hl=en&as_sdt=0,5&as_vis=1"
1236,"LJ Gooßen, N Rodríguez, ...","Carboxylic acids as substrates in homogeneous catalysis",2008,"Angewandte Chemie …","Wiley Online Library","https://onlinelibrary.wiley.com/doi/abs/10.1002/anie.200704782","https://scholar.google.com/scholar?cites=11913955510800164340&as_sdt=2005&sciodt=0,5&hl=en",301,"2025-04-26 13:02:21","","10.1002/anie.200704782","","",,,,,1236,72.71,412,3,17,"… DFT calculations on this transformation correctly predicted the observed reactivity sequence of the substrates. The structure of the calculated transition states for the decarboxylation of o-…","https://onlinelibrary.wiley.com/doi/pdfdirect/10.1002/anie.200704782","https://scholar.google.com/scholar?q=related:9CUNC2rfVqUJ:scholar.google.com/&scioq=source:%22angewandte+chemie+international+edition%22+migratory+insertion+dft&hl=en&as_sdt=0,5&as_vis=1"
223,"MM Hansmann, M Rudolph, F Rominger, ...","Mechanistic Switch in Dual Gold Catalysis of Diynes: C(sp3)–H Activation through Bifurcation—Vinylidene versus Carbene Pathways",2013,"Angewandte Chemie …","Wiley Online Library","https://onlinelibrary.wiley.com/doi/abs/10.1002/anie.201208777","https://scholar.google.com/scholar?cites=11412621213868137541&as_sdt=2005&sciodt=0,5&hl=en",302,"2025-04-26 13:02:21","","10.1002/anie.201208777","","",,,,,223,18.58,56,4,12,"… In order to gain further inside and to support our outlined mechanism, we performed DFT … 1,2-Au migration to form carbene IV via an Au + –aryne-type transition state. CH insertion of IV …","https://onlinelibrary.wiley.com/doi/pdf/10.1002/anie.201208777","https://scholar.google.com/scholar?q=related:RZyyAIfGYZ4J:scholar.google.com/&scioq=source:%22angewandte+chemie+international+edition%22+migratory+insertion+dft&hl=en&as_sdt=0,5&as_vis=1"
4,"RK Mallick, M Žabka, J Clayden","Benzo‐fused Nitrogen Heterocycles by Asymmetric Ring Expansion and Stereochemically Retentive Re‐contraction of Cyclic Ureas",2024,"… Chemie International Edition","Wiley Online Library","https://onlinelibrary.wiley.com/doi/abs/10.1002/anie.202318417","https://scholar.google.com/scholar?cites=2060260491571246893&as_sdt=2005&sciodt=0,5&hl=en",303,"2025-04-26 13:02:21","","10.1002/anie.202318417","","",,,,,4,4.00,1,3,1,"… The reaction sequence starts with an asymmetric migratory ring expansion of indoline, … Deuteration, in situ IR, and DFT studies provide evidence for the mechanisms of the …","https://onlinelibrary.wiley.com/doi/pdfdirect/10.1002/anie.202318417","https://scholar.google.com/scholar?q=related:LTfgWACElxwJ:scholar.google.com/&scioq=source:%22angewandte+chemie+international+edition%22+migratory+insertion+dft&hl=en&as_sdt=0,5&as_vis=1"
33,"S Bennaamane, B Rialland, L Khrouz, ...","Ammonia Synthesis at Room Temperature and Atmospheric Pressure from N2: A Boron‐Radical Approach",2023,"Angewandte Chemie …","Wiley Online Library","https://onlinelibrary.wiley.com/doi/abs/10.1002/anie.202209102","https://scholar.google.com/scholar?cites=12789265960390298781&as_sdt=2005&sciodt=0,5&hl=en",304,"2025-04-26 13:02:21","","10.1002/anie.202209102","","",,,,,33,16.50,8,4,2,"… performed a computational study (using density functional theory, DFT) to identify radicals (R⋅… NMR and EPR spectroscopies and DFT calculations have unambiguously established the …","https://onlinelibrary.wiley.com/doi/pdf/10.1002/anie.202209102","https://scholar.google.com/scholar?q=related:nQwPa6GZfLEJ:scholar.google.com/&scioq=source:%22angewandte+chemie+international+edition%22+migratory+insertion+dft&hl=en&as_sdt=0,5&as_vis=1"
0,"W Li, H Wei, B Wang, X He, Y Jiang, ...","Selective Hydrodisulfuration of Alkenes with Dithiosulfonate",2025,"Angewandte Chemie …","Wiley Online Library","https://onlinelibrary.wiley.com/doi/abs/10.1002/anie.202424209","",305,"2025-04-26 13:02:21","","10.1002/anie.202424209","","",,,,,0,0.00,0,6,1,"In this study, we have discovered the versatility of the dithiosulfonate reagent (ArSO 2 ‐SSR) in transition metal catalyzed selective hydrodisulfuration of unactivated alkenes. The …","https://onlinelibrary.wiley.com/doi/pdf/10.1002/anie.202424209","https://scholar.google.com/scholar?q=related:sg3Fw6FqQ3YJ:scholar.google.com/&scioq=source:%22angewandte+chemie+international+edition%22+migratory+insertion+dft&hl=en&as_sdt=0,5&as_vis=1"
315,"R Poli","Relationship between One‐Electron Transition‐Metal Reactivity and Radical Polymerization Processes",2006,"Angewandte Chemie International Edition","Wiley Online Library","https://onlinelibrary.wiley.com/doi/abs/10.1002/anie.200503785","https://scholar.google.com/scholar?cites=9215260005554367731&as_sdt=2005&sciodt=0,5&hl=en",306,"2025-04-26 13:02:21","","10.1002/anie.200503785","","",,,,,315,16.58,315,1,19,"… processes, such as ligand exchange, migratory insertion, and oxidative addition, because of … DFT calculations on model complexes have shown that the bond-dissociation energy for M…","https://onlinelibrary.wiley.com/doi/pdfdirect/10.1002/anie.200503785","https://scholar.google.com/scholar?q=related:86zuhyYu438J:scholar.google.com/&scioq=source:%22angewandte+chemie+international+edition%22+migratory+insertion+dft&hl=en&as_sdt=0,5&as_vis=1"
58,"J Han, H Wang, Y Wang, H Zhang, J Li, ...","Lattice Oxygen Activation through Deep Oxidation of Co4N by Jahn–Teller–Active Dopants for Improved Electrocatalytic Oxygen Evolution",2024,"Angewandte Chemie …","Wiley Online Library","https://onlinelibrary.wiley.com/doi/abs/10.1002/anie.202405839","https://scholar.google.com/scholar?cites=5457392192870322382&as_sdt=2005&sciodt=0,5&hl=en",307,"2025-04-26 13:02:21","","10.1002/anie.202405839","","",,,,,58,58.00,10,6,1,"… To further understand role of J−T dopants in promoting phase transformation, we performed DFT simulations. The TDOS in Figure S12a and b shows that J−T dopants (Mn3+, Ni3+ and …","https://onlinelibrary.wiley.com/doi/pdf/10.1002/anie.202405839","https://scholar.google.com/scholar?q=related:zpAG8EiNvEsJ:scholar.google.com/&scioq=source:%22angewandte+chemie+international+edition%22+migratory+insertion+dft&hl=en&as_sdt=0,5&as_vis=1"
161,"Z Xing, Y Sun, X Xie, Y Tang, G Xu, ...","Zincophilic electrode interphase with appended proton reservoir ability stabilizes Zn metal anodes",2023,"Angewandte Chemie …","Wiley Online Library","https://onlinelibrary.wiley.com/doi/abs/10.1002/anie.202215324","https://scholar.google.com/scholar?cites=13529279066700903123&as_sdt=2005&sciodt=0,5&hl=en",308,"2025-04-26 13:02:21","","10.1002/anie.202215324","","",,,,,161,80.50,27,6,2,"… In addition, according to the calculation results by density functional theory (Figure 2d), the Zn tends to absorb at the oxygen-containing sites of PO 4 3− , where the adsorption energy is …","https://onlinelibrary.wiley.com/doi/pdf/10.1002/anie.202215324","https://scholar.google.com/scholar?q=related:0_LVRaGnwbsJ:scholar.google.com/&scioq=source:%22angewandte+chemie+international+edition%22+migratory+insertion+dft&hl=en&as_sdt=0,5&as_vis=1"
660,"F Mathey","Phospha‐organic chemistry: panorama and perspectives",2003,"Angewandte Chemie International Edition","Wiley Online Library","https://onlinelibrary.wiley.com/doi/abs/10.1002/anie.200200557","https://scholar.google.com/scholar?cites=7970466259244575213&as_sdt=2005&sciodt=0,5&hl=en",309,"2025-04-26 13:02:21","","10.1002/anie.200200557","","",,,,,660,30.00,660,1,22,"… This effect has been studied in some depth in a recent DFT analysis. As expected, the four-electron complexes show a shorter phosphorus–metal bond than their two-electron …","https://onlinelibrary.wiley.com/doi/pdf/10.1002/anie.200200557","https://scholar.google.com/scholar?q=related:7WmCXNXInG4J:scholar.google.com/&scioq=source:%22angewandte+chemie+international+edition%22+migratory+insertion+dft&hl=en&as_sdt=0,5&as_vis=1"
45,"J Daubignard, RJ Detz, ACH Jans, ...","Rational Optimization of Supramolecular Catalysts for the Rhodium‐Catalyzed Asymmetric Hydrogenation Reaction",2017,"Angewandte Chemie …","Wiley Online Library","https://onlinelibrary.wiley.com/doi/abs/10.1002/anie.201707670","https://scholar.google.com/scholar?cites=8953805415388077520&as_sdt=2005&sciodt=0,5&hl=en",310,"2025-04-26 13:02:21","","10.1002/anie.201707670","","",,,,,45,5.63,11,4,8,"… According to DFT calculations and experiments two hydrogen bonds between the catalyst and the substrate exist; increasing … We thank Vivek Sinha for his help on the DFT calculations. …","https://onlinelibrary.wiley.com/doi/pdfdirect/10.1002/anie.201707670","https://scholar.google.com/scholar?q=related:0N0sBJZOQnwJ:scholar.google.com/&scioq=source:%22angewandte+chemie+international+edition%22+migratory+insertion+dft&hl=en&as_sdt=0,5&as_vis=1"
25,"X Qi, H Dong, H Yan, B Hou, H Liu, ...","Hollow Core‐Shelled Na4Fe2.4Ni0.6(PO4)2P2O7 with Tiny‐Void Space Capable Fast‐Charge and Low‐Temperature Sodium Storage",2024,"Angewandte Chemie …","Wiley Online Library","https://onlinelibrary.wiley.com/doi/abs/10.1002/anie.202410590","https://scholar.google.com/scholar?cites=15941642758021803357&as_sdt=2005&sciodt=0,5&hl=en",311,"2025-04-26 13:02:21","","10.1002/anie.202410590","","",,,,,25,25.00,4,6,1,"… To further investigate the impact of Ni doping on tuning the intrinsic conductivity of electrons and ions in THoCS, density functional theory (DFT) calculations were employed. Firstly, the …","https://onlinelibrary.wiley.com/doi/pdf/10.1002/anie.202410590","https://scholar.google.com/scholar?q=related:XW0RQKAXPN0J:scholar.google.com/&scioq=source:%22angewandte+chemie+international+edition%22+migratory+insertion+dft&hl=en&as_sdt=0,5&as_vis=1"
19,"L Xie, K Xu, W Sun, Y Fan, J Zhang, ...","Localized Ligands Assist Ultrafast Multivalent‐Cation Intercalation Pseudocapacitance",2023,"Angewandte Chemie …","Wiley Online Library","https://onlinelibrary.wiley.com/doi/abs/10.1002/anie.202300372","https://scholar.google.com/scholar?cites=67533883941653719&as_sdt=2005&sciodt=0,5&hl=en",312,"2025-04-26 13:02:21","","10.1002/anie.202300372","","",,,,,19,9.50,3,6,2,"… In agreement with the XAS analysis, the density functional theory (DFT) calculations further confirmed the restructured Cl and H 2 O costabilized Zn species that are adsorbed to the near…","https://onlinelibrary.wiley.com/doi/pdf/10.1002/anie.202300372","https://scholar.google.com/scholar?q=related:1wylqrXt7wAJ:scholar.google.com/&scioq=source:%22angewandte+chemie+international+edition%22+migratory+insertion+dft&hl=en&as_sdt=0,5&as_vis=1"
