Cites,Authors,Title,Year,Source,Publisher,ArticleURL,CitesURL,GSRank,QueryDate,Type,DOI,ISSN,CitationURL,Volume,Issue,StartPage,EndPage,ECC,CitesPerYear,CitesPerAuthor,AuthorCount,Age,Abstract,FullTextURL,RelatedURL
97,"HH Zhang, TZ Li, SJ Liu, F Shi","Catalytic asymmetric synthesis of atropisomers bearing multiple chiral elements: an emerging field",2024,"… Chemie International Edition","Wiley Online Library","https://onlinelibrary.wiley.com/doi/abs/10.1002/anie.202311053","https://scholar.google.com/scholar?cites=17925439206169413180&as_sdt=2005&sciodt=0,5&hl=en",173,"2025-05-07 02:25:16","","10.1002/anie.202311053","","",,,,,97,97.00,24,4,1,"… Rh-catalyzed asymmetric hydrogenation of α-dehydroamino … DFT calculations supported a DKR process for this reaction, … asymmetric hydrosilylation of heterobiaryl ketones 172 via a …","https://onlinelibrary.wiley.com/doi/pdf/10.1002/anie.202311053","https://scholar.google.com/scholar?q=related:PIaWJvzzw_gJ:scholar.google.com/&scioq=source:%22angewandte+chemie+international+edition%22+ketone+hydrogenation+dft&hl=en&as_sdt=0,5&as_vis=1"
257,"DS Su, G Wen, S Wu, F Peng…","Carbocatalysis in liquid‐phase reactions",2017,"Angewandte Chemie …","Wiley Online Library","https://onlinelibrary.wiley.com/doi/abs/10.1002/anie.201600906","https://scholar.google.com/scholar?cites=4054134559223528247&as_sdt=2005&sciodt=0,5&hl=en",174,"2025-05-07 02:25:16","","10.1002/anie.201600906","","",,,,,257,32.13,51,5,8,"… , thereby leading to a high yield of ketones and alcohols. 72b … of carbocatalysts to hydrogenation reactions or reductions. This … DFT calculations using periodic models from our …","https://onlinelibrary.wiley.com/doi/pdf/10.1002/anie.201600906","https://scholar.google.com/scholar?q=related:Nzsn4uYtQzgJ:scholar.google.com/&scioq=source:%22angewandte+chemie+international+edition%22+ketone+hydrogenation+dft&hl=en&as_sdt=0,5&as_vis=1"
758,"JF Teichert, BL Feringa","Phosphoramidites: privileged ligands in asymmetric catalysis",2010,"Angewandte Chemie International …","Wiley Online Library","https://onlinelibrary.wiley.com/doi/abs/10.1002/anie.200904948","https://scholar.google.com/scholar?cites=11572770445296786776&as_sdt=2005&sciodt=0,5&hl=en",175,"2025-05-07 02:25:16","","10.1002/anie.200904948","","",,,,,758,50.53,379,2,15,"… particularly versatile in asymmetric hydrogenation, and the … for the lowest energy conformation by DFT calculations. 52b … allyl moieties can be introduced at the α position of a ketone. …","https://onlinelibrary.wiley.com/doi/pdf/10.1002/anie.200904948","https://scholar.google.com/scholar?q=related:WN0No2e9mqAJ:scholar.google.com/&scioq=source:%22angewandte+chemie+international+edition%22+ketone+hydrogenation+dft&hl=en&as_sdt=0,5&as_vis=1"
18,"Y Liu, A Agarwal, Y Kratish…","Single‐Site Carbon‐Supported Metal‐Oxo Complexes in Heterogeneous Catalysis: Structure, Reactivity, and Mechanism",2023,"Angewandte Chemie …","Wiley Online Library","https://onlinelibrary.wiley.com/doi/abs/10.1002/anie.202304221","https://scholar.google.com/scholar?cites=9955026472169784287&as_sdt=2005&sciodt=0,5&hl=en",176,"2025-05-07 02:25:16","","10.1002/anie.202304221","","",,,,,18,9.00,5,4,2,"… , 4 as well as for the hydrogenation of C−C unsaturation and … experimental EXAFS and computational DFT results, which show … and aromatic aldehydes and ketones were explored (…","https://onlinelibrary.wiley.com/doi/pdf/10.1002/anie.202304221","https://scholar.google.com/scholar?q=related:30NKG9VbJ4oJ:scholar.google.com/&scioq=source:%22angewandte+chemie+international+edition%22+ketone+hydrogenation+dft&hl=en&as_sdt=0,5&as_vis=1"
323,"LH Gade","Highly polar metal–metal bonds in “early–late” Heterodimetallic complexes",2000,"Angewandte Chemie International Edition","Wiley Online Library","https://onlinelibrary.wiley.com/doi/abs/10.1002/1521-3773(20000804)39:15%3C2658::AID-ANIE2658%3E3.0.CO;2-C","https://scholar.google.com/scholar?cites=3272569617670098108&as_sdt=2005&sciodt=0,5&hl=en",177,"2025-05-07 02:25:16","","10.1002/1521-3773(20000804)39:15%3C2658::AID-ANIE2658%3E3.0.CO;2-C","","",,,,,323,12.92,323,1,25,"… obtained by density functional theory (DFT) methods for the … of [{HC[SiMe2N(2,3,4-F3C6H2)]3}Zr¿FeCp(CO)2] with ketones … The rate of the hydrogenation of CO to form methane or other …","https://onlinelibrary.wiley.com/doi/pdf/10.1002/1521-3773(20000804)39:15%3C2658::AID-ANIE2658%3E3.0.CO;2-C","https://scholar.google.com/scholar?q=related:vEz2e7qAai0J:scholar.google.com/&scioq=source:%22angewandte+chemie+international+edition%22+ketone+hydrogenation+dft&hl=en&as_sdt=0,5&as_vis=1"
544,"C Bruneau, PH Dixneuf","Metal Vinylidenes and Allenylidenes in Catalysis: Applications in Anti‐Markovnikov Additions to Terminal Alkynes and Alkene Metathesis",2006,"Angewandte Chemie International …","Wiley Online Library","https://onlinelibrary.wiley.com/doi/abs/10.1002/anie.200501391","https://scholar.google.com/scholar?cites=12439315343641041951&as_sdt=2005&sciodt=0,5&hl=en",178,"2025-05-07 02:25:16","","10.1002/anie.200501391","","",,,,,544,28.63,272,2,19,"… ketones. – 91 The mechanism of this reconstitutive condensation involves the formation of an allyl acyl metal intermediate, which releases the unsaturated ketone … , and DFT calculations…","https://onlinelibrary.wiley.com/doi/pdf/10.1002/anie.200501391","https://scholar.google.com/scholar?q=related:H1zKEmZToawJ:scholar.google.com/&scioq=source:%22angewandte+chemie+international+edition%22+ketone+hydrogenation+dft&hl=en&as_sdt=0,5&as_vis=1"
187,"ER Welin, AA Warkentin, JC Conrad…","Enantioselective α‐alkylation of aldehydes by photoredox organocatalysis: rapid access to pharmacophore fragments from β‐cyanoaldehydes",2015,"Angewandte Chemie …","Wiley Online Library","https://onlinelibrary.wiley.com/doi/abs/10.1002/anie.201503789","https://scholar.google.com/scholar?cites=14983456086908824819&as_sdt=2005&sciodt=0,5&hl=en",179,"2025-05-07 02:25:16","","10.1002/anie.201503789","","",,,,,187,18.70,47,4,10,"… by the direct use of aldehydes or ketones in a variety of chiral … lowest-energy conformation of the enamine DFT-5 is found to … Intriguingly, we found that the nitrile could be hydrogenated …","https://onlinelibrary.wiley.com/doi/pdfdirect/10.1002/anie.201503789","https://scholar.google.com/scholar?q=related:82zd3-zt788J:scholar.google.com/&scioq=source:%22angewandte+chemie+international+edition%22+ketone+hydrogenation+dft&hl=en&as_sdt=0,5&as_vis=1"
662,"F Mathey","Phospha‐organic chemistry: panorama and perspectives",2003,"Angewandte Chemie International Edition","Wiley Online Library","https://onlinelibrary.wiley.com/doi/abs/10.1002/anie.200200557","https://scholar.google.com/scholar?cites=7970466259244575213&as_sdt=2005&sciodt=0,5&hl=en",180,"2025-05-07 02:25:16","","10.1002/anie.200200557","","",,,,,662,30.09,662,1,22,"… reaction does not work with ketones. This limitation can be … , such as catalytic hydrogenation 47 and epoxidation 48 can … This effect has been studied in some depth in a recent DFT …","https://onlinelibrary.wiley.com/doi/pdf/10.1002/anie.200200557","https://scholar.google.com/scholar?q=related:7WmCXNXInG4J:scholar.google.com/&scioq=source:%22angewandte+chemie+international+edition%22+ketone+hydrogenation+dft&hl=en&as_sdt=0,5&as_vis=1"
1010,"V Michelet, PY Toullec, JP Genêt","Cycloisomerization of 1,n‐Enynes: Challenging Metal‐Catalyzed Rearrangements and Mechanistic Insights",2008,"… Chemie International Edition","Wiley Online Library","https://onlinelibrary.wiley.com/doi/abs/10.1002/anie.200701589","https://scholar.google.com/scholar?cites=2858358747102760012&as_sdt=2005&sciodt=0,5&hl=en",181,"2025-05-07 02:25:16","","10.1002/anie.200701589","","",,,,,1010,59.41,337,3,17,"… 3 CN) 3 ]PF 6 to the enyne 174 bearing a ketone moiety. The formation of 1,5-diketone 175 was … The isolation of a set of minor by-products, as well as DFT calculations, led the research …","","https://scholar.google.com/scholar?q=related:TMyw4SLuqicJ:scholar.google.com/&scioq=source:%22angewandte+chemie+international+edition%22+ketone+hydrogenation+dft&hl=en&as_sdt=0,5&as_vis=1"
53,"D Kamakura, H Todoroki, D Urabe…","Total synthesis of talatisamine",2020,"Angewandte Chemie …","Wiley Online Library","https://onlinelibrary.wiley.com/doi/abs/10.1002/anie.201912737","https://scholar.google.com/scholar?cites=9061722512046816181&as_sdt=2005&sciodt=0,5&hl=en",182,"2025-05-07 02:25:16","","10.1002/anie.201912737","","",,,,,53,10.60,13,4,5,"… Subsequent hydrogenation by catalysis of Pd/C in MeOH … stereoselective reduction of C16-ketone 33 from the opposite … F-ring formation, we performed DFT calculations at the M06-2X/…","https://onlinelibrary.wiley.com/doi/pdfdirect/10.1002/anie.201912737","https://scholar.google.com/scholar?q=related:tfu1F520wX0J:scholar.google.com/&scioq=source:%22angewandte+chemie+international+edition%22+ketone+hydrogenation+dft&hl=en&as_sdt=0,5&as_vis=1"
29,"F Li, Q Tu, S Chen, L Zhu, Y Lan…","Bioinspired asymmetric synthesis of hispidanin A",2017,"Angewandte Chemie …","Wiley Online Library","https://onlinelibrary.wiley.com/doi/abs/10.1002/anie.201700838","https://scholar.google.com/scholar?cites=17041862220412857824&as_sdt=2005&sciodt=0,5&hl=en",183,"2025-05-07 02:25:16","","10.1002/anie.201700838","","",,,,,29,3.63,5,6,8,"… ketone then underwent a substrate-controlled stereoselective Pt-catalyzed hydrogenation … During the Pt-catalyzed hydrogenation, the chiral center at C15 in substrate 18 underwent …","https://onlinelibrary.wiley.com/doi/pdf/10.1002/anie.201700838","https://scholar.google.com/scholar?q=related:4K3b1mXbgOwJ:scholar.google.com/&scioq=source:%22angewandte+chemie+international+edition%22+ketone+hydrogenation+dft&hl=en&as_sdt=0,5&as_vis=1"
45,"A Köpfer, B Breit","Rhodium‐Catalyzed Hydroformylation of 1, 1‐Disubstituted Allenes Employing the Self‐Assembling 6‐DPPon System",2015,"Angewandte Chemie International Edition","Wiley Online Library","https://onlinelibrary.wiley.com/doi/abs/10.1002/anie.201502086","https://scholar.google.com/scholar?cites=9086744147173432991&as_sdt=2005&sciodt=0,5&hl=en",184,"2025-05-07 02:25:16","","10.1002/anie.201502086","","",,,,,45,4.50,23,2,10,"… By π-bond isomerization, alkene and/or aldehyde hydrogenation, … 5a DFT calculations by Jiao, Beller, and co-workers … -step synthesis starting from simple ketones. The hydroformylation …","https://onlinelibrary.wiley.com/doi/pdf/10.1002/anie.201502086","https://scholar.google.com/scholar?q=related:n94hgaiZGn4J:scholar.google.com/&scioq=source:%22angewandte+chemie+international+edition%22+ketone+hydrogenation+dft&hl=en&as_sdt=0,5&as_vis=1"
398,"C Bruneau","Electrophilic activation and cycloisomerization of enynes: A new route to functional cyclopropanes",2005,"Angewandte Chemie International Edition","Wiley Online Library","https://onlinelibrary.wiley.com/doi/abs/10.1002/anie.200462568","https://scholar.google.com/scholar?cites=14175831971725686194&as_sdt=2005&sciodt=0,5&hl=en",185,"2025-05-07 02:25:16","","10.1002/anie.200462568","","",,,,,398,19.90,398,1,20,"… DFT calculations based on PtCl 2 ⋅H 2 O/6-octen-1-yne … compound directly provides cyclic ketones. Terminal as well as … -metal-catalyzed enantioselective hydrogenation and allylic …","https://onlinelibrary.wiley.com/doi/pdfdirect/10.1002/anie.200462568","https://scholar.google.com/scholar?q=related:srVVThKsusQJ:scholar.google.com/&scioq=source:%22angewandte+chemie+international+edition%22+ketone+hydrogenation+dft&hl=en&as_sdt=0,5&as_vis=1"
15,"S Feng, PTT Nguyen, X Ma…","Photorefinery of biomass and plastics to renewable chemicals using heterogeneous catalysts",2024,"Angewandte Chemie …","Wiley Online Library","https://onlinelibrary.wiley.com/doi/abs/10.1002/anie.202408504","https://scholar.google.com/scholar?cites=15253565064823750327&as_sdt=2005&sciodt=0,5&hl=en",186,"2025-05-07 02:25:16","","10.1002/anie.202408504","","",,,,,15,15.00,4,4,1,"… According to in-situ characterizations and DFT calculations, … In recent studies, photocatalytic transfer hydrogenation has … It involves first oxidizing the Cα–OH to a ketone over the VB of a …","https://onlinelibrary.wiley.com/doi/pdfdirect/10.1002/anie.202408504","https://scholar.google.com/scholar?q=related:t74gD5yMr9MJ:scholar.google.com/&scioq=source:%22angewandte+chemie+international+edition%22+ketone+hydrogenation+dft&hl=en&as_sdt=0,5&as_vis=1"
135,"AM Haydl, B Breit, T Liang…","Alkynes as Electrophilic or Nucleophilic Allylmetal Precursors in Transition‐Metal Catalysis",2017,"Angewandte Chemie …","Wiley Online Library","https://onlinelibrary.wiley.com/doi/abs/10.1002/anie.201704248","https://scholar.google.com/scholar?cites=8846302745909929902&as_sdt=2005&sciodt=0,5&hl=en",187,"2025-05-07 02:25:16","","10.1002/anie.201704248","","",,,,,135,16.88,34,4,8,"… DFT calculations indicate a reisomerization from H to the π-… followed by alkene hydrogenation delivered indolizidine (−)-209D (10… process wherein unactivated ketones or aldehydes are …","https://onlinelibrary.wiley.com/doi/full/10.1002/anie.201704248","https://scholar.google.com/scholar?q=related:rieGSXphxHoJ:scholar.google.com/&scioq=source:%22angewandte+chemie+international+edition%22+ketone+hydrogenation+dft&hl=en&as_sdt=0,5&as_vis=1"
0,"W Zhang, S Kim, ML Sarazen, M He…","Advances and Challenges in Low‐Temperature Upcycling of Waste Polyolefins via Tandem Catalysis",2025,"Angewandte Chemie …","Wiley Online Library","https://onlinelibrary.wiley.com/doi/abs/10.1002/anie.202500559","",188,"2025-05-07 02:25:16","","10.1002/anie.202500559","","",,,,,0,0.00,0,5,1,"… hydrogenation ensures the entire alkane transformation, and by extension, polyethylene deconstruction, remains decidedly exergonic. Notably, DFT … Furthermore, ketonefunctionalized …","https://onlinelibrary.wiley.com/doi/pdf/10.1002/anie.202500559","https://scholar.google.com/scholar?q=related:MMojAYQCh6EJ:scholar.google.com/&scioq=source:%22angewandte+chemie+international+edition%22+ketone+hydrogenation+dft&hl=en&as_sdt=0,5&as_vis=1"
3111,"FE Hahn, MC Jahnke","Heterocyclic carbenes: synthesis and coordination chemistry",2008,"Angewandte Chemie International …","Wiley Online Library","https://onlinelibrary.wiley.com/doi/abs/10.1002/anie.200703883","https://scholar.google.com/scholar?cites=7057419648501408849&as_sdt=2005&sciodt=0,5&hl=en",189,"2025-05-07 02:25:16","","10.1002/anie.200703883","","",,,,,3111,183.00,1556,2,17,"… To avoid the racemate formation, ketimines derived from cyclic ketones … In addition, the use of different cyclic ketones for the … DFT calculations confirmed that the two heterocycles are …","https://onlinelibrary.wiley.com/doi/pdf/10.1002/anie.200703883","https://scholar.google.com/scholar?q=related:UeTJS8f98GEJ:scholar.google.com/&scioq=source:%22angewandte+chemie+international+edition%22+ketone+hydrogenation+dft&hl=en&as_sdt=0,5&as_vis=1"
48,"S Choi, J Park, E Yu, J Sim…","Electrosynthesis of Dihydropyrano[4,3‐b]indoles Based on a Double Oxidative [3+3] Cycloaddition",2020,"Angewandte Chemie …","Wiley Online Library","https://onlinelibrary.wiley.com/doi/abs/10.1002/anie.202003364","https://scholar.google.com/scholar?cites=6130813065015643842&as_sdt=2005&sciodt=0,5&hl=en",190,"2025-05-07 02:25:16","","10.1002/anie.202003364","","",,,,,48,9.60,10,5,5,"… Density functional theory (DFT) calculations were performed … 10 were synthesized by hydrogenation and epimerization of 3 … ethers derived from ketones 3 ao and 3 ao′ (Scheme 4 d). …","https://onlinelibrary.wiley.com/doi/pdf/10.1002/anie.202003364","https://scholar.google.com/scholar?q=related:ws6UDAAGFVUJ:scholar.google.com/&scioq=source:%22angewandte+chemie+international+edition%22+ketone+hydrogenation+dft&hl=en&as_sdt=0,5&as_vis=1"
1025,"L Zhang, ZJ Zhao, J Gong","Nanostructured Materials for Heterogeneous Electrocatalytic CO2 Reduction and their Related Reaction Mechanisms",2017,"Angewandte Chemie International …","Wiley Online Library","https://onlinelibrary.wiley.com/doi/abs/10.1002/anie.201612214","https://scholar.google.com/scholar?cites=3609423371200080169&as_sdt=2005&sciodt=0,5&hl=en",191,"2025-05-07 02:25:16","","10.1002/anie.201612214","","",,,,,1025,128.13,342,3,8,"… than the C=O bond in ketone structures. The shorter bonds in … barriers through density functional theory (DFT) calculations. … C 2 H 4 was the hydrogenation of the adsorbed CO to form …","https://onlinelibrary.wiley.com/doi/pdfdirect/10.1002/anie.201612214","https://scholar.google.com/scholar?q=related:KalfvG4_FzIJ:scholar.google.com/&scioq=source:%22angewandte+chemie+international+edition%22+ketone+hydrogenation+dft&hl=en&as_sdt=0,5&as_vis=1"
1,"Y Zheng, Y Chen, Y He, A Rizzo, Y Zhou…","Dearomative Intramolecular (4+ 3) Cycloadditions of Thiophenes",2024,"Angewandte Chemie …","Wiley Online Library","https://onlinelibrary.wiley.com/doi/abs/10.1002/anie.202407059","https://scholar.google.com/scholar?cites=841284346320423449&as_sdt=2005&sciodt=0,5&hl=en",192,"2025-05-07 02:25:16","","10.1002/anie.202407059","","",,,,,1,1.00,0,6,1,"… performed density functional theory (DFT) computations on a … enantiomeric purity of epoxy ketone, demonstrating that this … unfruitful and only alkene hydrogenation was observed in …","https://onlinelibrary.wiley.com/doi/pdf/10.1002/anie.202407059","https://scholar.google.com/scholar?q=related:GYqG2afXrAsJ:scholar.google.com/&scioq=source:%22angewandte+chemie+international+edition%22+ketone+hydrogenation+dft&hl=en&as_sdt=0,5&as_vis=1"
3,"X Wu, S Xie, D Vangestel, H Zhao…","Green Solvent γ‐Valerolactone (GVL) Facilitates Photocatalytic C− H Bond Activation",2024,"Angewandte Chemie …","Wiley Online Library","https://onlinelibrary.wiley.com/doi/abs/10.1002/anie.202409826","https://scholar.google.com/scholar?cites=10597876906848683872&as_sdt=2005&sciodt=0,5&hl=en",193,"2025-05-07 02:25:16","","10.1002/anie.202409826","","",,,,,3,3.00,1,5,1,"… rate of coupling products from dibenzyl ketone does not match the … Furthermore, DFT calculations showed that BDE of C−H … carbonyl hydrogenation of furfural and diazene double …","https://onlinelibrary.wiley.com/doi/pdf/10.1002/anie.202409826","https://scholar.google.com/scholar?q=related:YAcIluU4E5MJ:scholar.google.com/&scioq=source:%22angewandte+chemie+international+edition%22+ketone+hydrogenation+dft&hl=en&as_sdt=0,5&as_vis=1"
66,"P Villo, A Shatskiy, MD Kärkäs…","Electrosynthetic C− O bond activation in alcohols and alcohol derivatives",2023,"Angewandte Chemie …","Wiley Online Library","https://onlinelibrary.wiley.com/doi/abs/10.1002/anie.202211952","https://scholar.google.com/scholar?cites=2244060303589906333&as_sdt=2005&sciodt=0,5&hl=en",194,"2025-05-07 02:25:16","","10.1002/anie.202211952","","",,,,,66,33.00,17,4,2,"… Similarly, electrochemical hydrogenation of aryl alkyl ethers to … that decomposes to phenol and ketone upon a second electron … Recent DFT calculations suggested that the initial one-…","https://onlinelibrary.wiley.com/doi/pdfdirect/10.1002/anie.202211952","https://scholar.google.com/scholar?q=related:nRcI4vSAJB8J:scholar.google.com/&scioq=source:%22angewandte+chemie+international+edition%22+ketone+hydrogenation+dft&hl=en&as_sdt=0,5&as_vis=1"
71,"N Del Rio, M Lopez‐Reyes, A Baceiredo…","N,P‐Heterocyclic Germylene/B(C6F5)3 Adducts: A Lewis Pair with Multi‐reactive Sites",2017,"Angewandte Chemie …","Wiley Online Library","https://onlinelibrary.wiley.com/doi/abs/10.1002/anie.201610455","https://scholar.google.com/scholar?cites=12310996318102513058&as_sdt=2005&sciodt=0,5&hl=en",195,"2025-05-07 02:25:16","","10.1002/anie.201610455","","",,,,,71,8.88,18,4,8,"… and are active catalysts for hydrogenation reactions. For the last … These structural data are in good agreement with DFT … 2 and concomitant hydrosilylation of the ketone (Scheme 4). In …","https://onlinelibrary.wiley.com/doi/pdfdirect/10.1002/anie.201610455","https://scholar.google.com/scholar?q=related:omWkw-xx2aoJ:scholar.google.com/&scioq=source:%22angewandte+chemie+international+edition%22+ketone+hydrogenation+dft&hl=en&as_sdt=0,5&as_vis=1"
492,"MH Wang, KA Scheidt","Cooperative catalysis and activation with N‐heterocyclic carbenes",2016,"Angewandte Chemie International …","Wiley Online Library","https://onlinelibrary.wiley.com/doi/abs/10.1002/anie.201605319","https://scholar.google.com/scholar?cites=1711586763358934240&as_sdt=2005&sciodt=0,5&hl=en",196,"2025-05-07 02:25:16","","10.1002/anie.201605319","","",,,,,492,54.67,246,2,9,"… Normally, these activated ketones undergo 1,2-additions via … This transformation was studied in depth through DFT calculations by … to hydrogenated analogues and thiourea derivatives. …","https://onlinelibrary.wiley.com/doi/pdf/10.1002/anie.201605319","https://scholar.google.com/scholar?q=related:4BRFyBfHwBcJ:scholar.google.com/&scioq=source:%22angewandte+chemie+international+edition%22+ketone+hydrogenation+dft&hl=en&as_sdt=0,5&as_vis=1"
25,"Y Ji, B Hong, I Franzoni, M Wang…","Enantioselective total synthesis of hyperforin and pyrohyperforin",2022,"Angewandte Chemie …","Wiley Online Library","https://onlinelibrary.wiley.com/doi/abs/10.1002/anie.202116136","https://scholar.google.com/scholar?cites=18400082078113675595&as_sdt=2005&sciodt=0,5&hl=en",197,"2025-05-07 02:25:16","","10.1002/anie.202116136","","",,,,,25,8.33,5,5,3,"… intramolecular allylation of the C9 ketone to generate dienone 19 … formation, 24 we carried out DFT calculations at the SMD(… (1), we turned our attention to selective hydrogenation of 1,3-…","https://onlinelibrary.wiley.com/doi/pdf/10.1002/anie.202116136","https://scholar.google.com/scholar?q=related:Szn_hyk5Wv8J:scholar.google.com/&scioq=source:%22angewandte+chemie+international+edition%22+ketone+hydrogenation+dft&hl=en&as_sdt=0,5&as_vis=1"
16,"Z Yue, HC Lam, K Chen, I Siridechakorn…","Biomimetic synthesis of rhytidenone A and mode of action of cytotoxic rhytidenone F",2020,"Angewandte Chemie …","Wiley Online Library","https://onlinelibrary.wiley.com/doi/abs/10.1002/anie.201914257","https://scholar.google.com/scholar?cites=16755565453719149471&as_sdt=2005&sciodt=0,5&hl=en",198,"2025-05-07 02:25:16","","10.1002/anie.201914257","","",,,,,16,3.20,3,5,5,"… Similarly, selective hydrogenation of the Δ 6,7 -alkene of 2 could give rhytidenone B (7), … 4 could attack either side of the ketone. Our DFT calculations suggested 6 is thermodynamically …","https://onlinelibrary.wiley.com/doi/pdf/10.1002/anie.201914257","https://scholar.google.com/scholar?q=related:n5u8XwG6h-gJ:scholar.google.com/&scioq=source:%22angewandte+chemie+international+edition%22+ketone+hydrogenation+dft&hl=en&as_sdt=0,5&as_vis=1"
40,"C Chauvier, P Thuéry, T Cantat","Silyl formates as surrogates of hydrosilanes and their application in the transfer hydrosilylation of aldehydes",2016,"… Chemie International Edition","Wiley Online Library","https://onlinelibrary.wiley.com/doi/abs/10.1002/anie.201607201","https://scholar.google.com/scholar?cites=10448472575661749954&as_sdt=2005&sciodt=0,5&hl=en",199,"2025-05-07 02:25:16","","10.1002/anie.201607201","","",,,,,40,4.44,13,3,9,"… over ketones is … hydrogenation or transfer hydrogenation conditions. The mechanism of the transfer hydrosilylation of benzaldehyde was thus studied both experimentally and by DFT …","https://onlinelibrary.wiley.com/doi/pdf/10.1002/anie.201607201","https://scholar.google.com/scholar?q=related:wra6_XJuAJEJ:scholar.google.com/&scioq=source:%22angewandte+chemie+international+edition%22+ketone+hydrogenation+dft&hl=en&as_sdt=0,5&as_vis=1"
103,"GS Chen, SJ Chen, J Luo, XY Mao…","Tandem cross‐coupling/spirocyclization/Mannich‐type reactions of 3‐(2‐isocyanoethyl) indoles with diazo compounds toward polycyclic spiroindolines",2020,"Angewandte Chemie …","Wiley Online Library","https://onlinelibrary.wiley.com/doi/abs/10.1002/anie.201911614","https://scholar.google.com/scholar?cites=1685830703872659093&as_sdt=2005&sciodt=0,5&hl=en",200,"2025-05-07 02:25:16","","10.1002/anie.201911614","","",,,,,103,20.60,21,5,5,"… Besides α-diazoacetates, α-diazo ketones 2 t–2 v bearing … This was followed by a Pd/C-catalyzed hydrogenation and the … Density functional theory (DFT) calculations indicated that …","https://onlinelibrary.wiley.com/doi/pdf/10.1002/anie.201911614","https://scholar.google.com/scholar?q=related:lc7G3xdGZRcJ:scholar.google.com/&scioq=source:%22angewandte+chemie+international+edition%22+ketone+hydrogenation+dft&hl=en&as_sdt=0,5&as_vis=1"
445,"J Mahatthananchai, AM Dumas…","Catalytic selective synthesis",2012,"Angewandte Chemie …","Wiley Online Library","https://onlinelibrary.wiley.com/doi/abs/10.1002/anie.201201787","https://scholar.google.com/scholar?cites=8891794161746052677&as_sdt=2005&sciodt=0,5&hl=en",201,"2025-05-07 02:25:16","","10.1002/anie.201201787","","",,,,,445,34.23,148,3,13,"… Detailed kinetic and DFT studies revealed that … hydrogenation of a single alkene in a polyunsaturated substrate or the conversion of an amide into an amine in the presence of a ketone …","https://onlinelibrary.wiley.com/doi/pdf/10.1002/anie.201201787","https://scholar.google.com/scholar?q=related:RQbE6q3_ZXsJ:scholar.google.com/&scioq=source:%22angewandte+chemie+international+edition%22+ketone+hydrogenation+dft&hl=en&as_sdt=0,5&as_vis=1"
