Cites,Authors,Title,Year,Source,Publisher,ArticleURL,CitesURL,GSRank,QueryDate,Type,DOI,ISSN,CitationURL,Volume,Issue,StartPage,EndPage,ECC,CitesPerYear,CitesPerAuthor,AuthorCount,Age,Abstract,FullTextURL,RelatedURL
10,"C Matt, A Orthaber, J Streuff","Catalytic Asymmetric β‐Oxygen Elimination",2022,"… Chemie International Edition","Wiley Online Library","https://onlinelibrary.wiley.com/doi/abs/10.1002/anie.202114044","https://scholar.google.com/scholar?cites=17895454296315445297&as_sdt=2005&sciodt=0,5&hl=en",1,"2025-05-07 02:23:29","","10.1002/anie.202114044","","",,,,,10,3.33,3,3,3,"… β-O-elimination, the application in diol and amino alcohol synthesis, and a DFT-supported … A stereochemical analysis supported by DFT calculations reveals that a high selectivity in the …","https://onlinelibrary.wiley.com/doi/pdf/10.1002/anie.202114044","https://scholar.google.com/scholar?q=related:McAeSt5sWfgJ:scholar.google.com/&scioq=source:%22angewandte+chemie+international+edition%22+beta+elimination+dft&hl=en&as_sdt=0,5&as_vis=1"
448,"T Fujita, K Fuchibe, J Ichikawa","Transition‐Metal‐Mediated and‐Catalyzed C− F Bond Activation by Fluorine Elimination",2019,"… Chemie International Edition","Wiley Online Library","https://onlinelibrary.wiley.com/doi/abs/10.1002/anie.201805292","https://scholar.google.com/scholar?cites=10451939202283370686&as_sdt=2005&sciodt=0,5&hl=en",2,"2025-05-07 02:23:29","","10.1002/anie.201805292","","",,,,,448,74.67,149,3,6,"… intermediates, the DFT calculations revealed that the β-fluorine elimination pathway is more favorable (energy barrier: 7.9 kcal mol −1 for the β-fluorine elimination pathway, 46.5 kcal …","https://onlinelibrary.wiley.com/doi/pdfdirect/10.1002/anie.201805292","https://scholar.google.com/scholar?q=related:vngU5lO_DJEJ:scholar.google.com/&scioq=source:%22angewandte+chemie+international+edition%22+beta+elimination+dft&hl=en&as_sdt=0,5&as_vis=1"
30,"M Chen, Y Liang, T Dong, W Liang…","Z‐Selective α‐Arylation of α,β‐Unsaturated Nitriles via [3,3]‐Sigmatropic Rearrangement",2021,"Angewandte Chemie …","Wiley Online Library","https://onlinelibrary.wiley.com/doi/abs/10.1002/anie.202010740","https://scholar.google.com/scholar?cites=9051471885166333346&as_sdt=2005&sciodt=0,5&hl=en",3,"2025-05-07 02:23:29","","10.1002/anie.202010740","","",,,,,30,7.50,6,5,4,"… The control experiments and DFT calculations support a four-stage reaction … -elimination. Among these stages, the Lewis base addition is diastereoselective and E1cB-elimination is cis-…","https://onlinelibrary.wiley.com/doi/pdf/10.1002/anie.202010740","https://scholar.google.com/scholar?q=related:ok3GCblJnX0J:scholar.google.com/&scioq=source:%22angewandte+chemie+international+edition%22+beta+elimination+dft&hl=en&as_sdt=0,5&as_vis=1"
18,"X Chen, HC Gülen, J Wu, ZJ Zhang…","Close‐shell reductive elimination versus open‐shell radical coupling for site‐selective ruthenium‐catalyzed C− H activations by computation and experiments",2023,"Angewandte Chemie …","Wiley Online Library","https://onlinelibrary.wiley.com/doi/abs/10.1002/anie.202302021","https://scholar.google.com/scholar?cites=14322016408910507014&as_sdt=2005&sciodt=0,5&hl=en",4,"2025-05-07 02:23:29","","10.1002/anie.202302021","","",,,,,18,9.00,4,5,2,"… Spin density distribution analysis indicates that the majority of alpha and beta spins are … To this end, we performed systematic DFT calculations to unravel mechanistic details in the …","https://onlinelibrary.wiley.com/doi/pdfdirect/10.1002/anie.202302021","https://scholar.google.com/scholar?q=related:Bixt6AoGwsYJ:scholar.google.com/&scioq=source:%22angewandte+chemie+international+edition%22+beta+elimination+dft&hl=en&as_sdt=0,5&as_vis=1"
6,"JS Bestwick, DJ Jones, HE Jones…","Total Synthesis and Prediction of Ulodione Natural Products Guided by DFT Calculations",2022,"Angewandte Chemie …","Wiley Online Library","https://onlinelibrary.wiley.com/doi/abs/10.1002/anie.202207004","https://scholar.google.com/scholar?cites=13372317950080927280&as_sdt=2005&sciodt=0,5&hl=en",5,"2025-05-07 02:23:29","","10.1002/anie.202207004","","",,,,,6,2.00,2,4,3,"… conditions for the efficient elimination of AcOH from ulodione … 7 followed by syn-elimination and Diels–Alder dimerization to … be phosphorylated and undergo elimination and Diels–Alder …","https://onlinelibrary.wiley.com/doi/pdfdirect/10.1002/anie.202207004","https://scholar.google.com/scholar?q=related:MEYndlMElLkJ:scholar.google.com/&scioq=source:%22angewandte+chemie+international+edition%22+beta+elimination+dft&hl=en&as_sdt=0,5&as_vis=1"
9,"YY Zhang, Y Zhang, XS Xue…","Reversal of the Regioselectivity of Iron‐Promoted Hydrogenation and Hydrohalogenation of gem‐Difluoroalkenes",2024,"Angewandte Chemie …","Wiley Online Library","https://onlinelibrary.wiley.com/doi/abs/10.1002/anie.202406324","https://scholar.google.com/scholar?cites=18079406243823318230&as_sdt=2005&sciodt=0,5&hl=en",6,"2025-05-07 02:23:29","","10.1002/anie.202406324","","",,,,,9,9.00,2,4,1,"… β-fluorine elimination to give monofluorinated alkenes.[7,8] … , we employed density functional theory (DFT) calculations, … that are typically absent in DFT calculations. The optimization …","https://onlinelibrary.wiley.com/doi/pdf/10.1002/anie.202406324","https://scholar.google.com/scholar?q=related:1nQRoTD05voJ:scholar.google.com/&scioq=source:%22angewandte+chemie+international+edition%22+beta+elimination+dft&hl=en&as_sdt=0,5&as_vis=1"
16,"C Curti, G Rassu, M Lombardo…","Unlocking Access to Enantiopure Fused Uracils by Chemodivergent [4+ 2] Cross‐Cycloadditions: DFT‐Supported Homo‐Synergistic Organocatalytic Approach",2020,"Angewandte Chemie …","Wiley Online Library","https://onlinelibrary.wiley.com/doi/abs/10.1002/anie.202007509","https://scholar.google.com/scholar?cites=14182703754414452766&as_sdt=2005&sciodt=0,5&hl=en",7,"2025-05-07 02:23:29","","10.1002/anie.202007509","","",,,,,16,3.20,4,4,5,"… eliminated product 9 aa could be formed from this intermediate, we tried to model the elimination … Indeed, a possible elimination pathway was found from enamine I-2 a-EN-H + bearing …","https://onlinelibrary.wiley.com/doi/pdf/10.1002/anie.202007509","https://scholar.google.com/scholar?q=related:HvB45OsV08QJ:scholar.google.com/&scioq=source:%22angewandte+chemie+international+edition%22+beta+elimination+dft&hl=en&as_sdt=0,5&as_vis=1"
94,"SK Zhang, J Struwe, L Hu…","Nickela‐electrocatalyzed C− H Alkoxylation with Secondary Alcohols: Oxidation‐Induced Reductive Elimination at Nickel (III)",2020,"Angewandte Chemie …","Wiley Online Library","https://onlinelibrary.wiley.com/doi/abs/10.1002/anie.201913930","https://scholar.google.com/scholar?cites=7107752055877964246&as_sdt=2005&sciodt=0,5&hl=en",8,"2025-05-07 02:23:29","","10.1002/anie.201913930","","",,,,,94,18.80,24,4,5,"… , cyclovoltammetry, and density functional theory (DFT) calculations provided support for a process involving oxidation-induced reductive elimination. MQ=6-methylquinoline. …","https://onlinelibrary.wiley.com/doi/pdfdirect/10.1002/anie.201913930","https://scholar.google.com/scholar?q=related:1pEoGtbOo2IJ:scholar.google.com/&scioq=source:%22angewandte+chemie+international+edition%22+beta+elimination+dft&hl=en&as_sdt=0,5&as_vis=1"
53,"H Zhang, E Wang, S Geng, Z Liu, Y He…","Experimental and Computational Studies of the Iron‐Catalyzed Selective and Controllable Defluorosilylation of Unactivated Aliphatic gem‐Difluoroalkenes",2021,"Angewandte Chemie …","Wiley Online Library","https://onlinelibrary.wiley.com/doi/abs/10.1002/anie.202100049","https://scholar.google.com/scholar?cites=10207221734750772450&as_sdt=2005&sciodt=0,5&hl=en",9,"2025-05-07 02:23:29","","10.1002/anie.202100049","","",,,,,53,13.25,9,6,4,"… mechanistic studies and DFT calculations reveal that a nucleophilic addition and elimination of the … Due to an inherent DFT error for spin state calculation, we cannot fully exclude quintet …","https://onlinelibrary.wiley.com/doi/pdf/10.1002/anie.202100049","https://scholar.google.com/scholar?q=related:4lx3axZWp40J:scholar.google.com/&scioq=source:%22angewandte+chemie+international+edition%22+beta+elimination+dft&hl=en&as_sdt=0,5&as_vis=1"
24,"W Kong, Y Bao, L Lu, Z Han, Y Zhong…","Base‐Modulated 1, 3‐Regio‐and Stereoselective Carboboration of Cyclohexenes",2023,"Angewandte Chemie …","Wiley Online Library","https://onlinelibrary.wiley.com/doi/abs/10.1002/anie.202308041","https://scholar.google.com/scholar?cites=3064157366742114859&as_sdt=2005&sciodt=0,5&hl=en",10,"2025-05-07 02:23:29","","10.1002/anie.202308041","","",,,,,24,12.00,4,6,2,"… not β-H elimination. We next performed density functional theory (DFT) calculations to elucidate the regioselectivity. As shown in (Figure 2E), the β-H elimination in the intermediate V (…","https://onlinelibrary.wiley.com/doi/pdf/10.1002/anie.202308041","https://scholar.google.com/scholar?q=related:K2KP9OMShioJ:scholar.google.com/&scioq=source:%22angewandte+chemie+international+edition%22+beta+elimination+dft&hl=en&as_sdt=0,5&as_vis=1"
1,"K Manna, S Maji, A Sharma, N Kumar…","Pd‐Catalyzed Skeletal Rearrangement via C(sp3)−C(sp3) Activation to Access α,β‐Unsaturated δ/γ‐Lactone",2025,"Angewandte Chemie …","Wiley Online Library","https://onlinelibrary.wiley.com/doi/abs/10.1002/anie.202423175","https://scholar.google.com/scholar?cites=2102642759756051950&as_sdt=2005&sciodt=0,5&hl=en",11,"2025-05-07 02:23:29","","10.1002/anie.202423175","","",,,,,1,1.00,0,5,1,"… acid, we performed density functional theory (DFT) calculations. … , β -H elimination and CH reductive elimination occur via a … The CO reductive elimination transition state, TS2_LN1&P10…","https://onlinelibrary.wiley.com/doi/pdf/10.1002/anie.202423175","https://scholar.google.com/scholar?q=related:7nXOIHMWLh0J:scholar.google.com/&scioq=source:%22angewandte+chemie+international+edition%22+beta+elimination+dft&hl=en&as_sdt=0,5&as_vis=1"
1,"S Qiu, X Yu, H Guo, J Li, X Li…","Photocatalytic radical bis (trifluoromethyl) carbinolation of alkenes and heteroarenes",2025,"Angewandte Chemie …","Wiley Online Library","https://onlinelibrary.wiley.com/doi/abs/10.1002/anie.202424757","https://scholar.google.com/scholar?cites=13994856392434189302&as_sdt=2005&sciodt=0,5&hl=en",12,"2025-05-07 02:23:29","","10.1002/anie.202424757","","",,,,,1,1.00,0,6,1,"… Computational analysis using density functional theory (DFT) reveals a significant … Notably, the 4(trifluoromethyl)benzoyl group was effortlessly removed in situ, eliminating the need for …","https://onlinelibrary.wiley.com/doi/pdf/10.1002/anie.202424757","https://scholar.google.com/scholar?q=related:9gOlsb23N8IJ:scholar.google.com/&scioq=source:%22angewandte+chemie+international+edition%22+beta+elimination+dft&hl=en&as_sdt=0,5&as_vis=1"
71,"H Gao, S Lin, S Zhang, W Chen, X Liu…","gem‐Difluoromethylene Alkyne‐Enabled Diverse C−H Functionalization and Application to the on‐DNA Synthesis of Difluorinated Isocoumarins",2021,"Angewandte Chemie …","Wiley Online Library","https://onlinelibrary.wiley.com/doi/abs/10.1002/anie.202013052","https://scholar.google.com/scholar?cites=2318943564810368680&as_sdt=2005&sciodt=0,5&hl=en",13,"2025-05-07 02:23:29","","10.1002/anie.202013052","","",,,,,71,17.75,12,6,4,"… studies with density functional theory (DFT) calculations are … /β-H elimination/Rh-H reinsertion/β-F elimination processes … Alternatively, the C-Ir/O-Ir reductive elimination was more …","https://onlinelibrary.wiley.com/doi/pdf/10.1002/anie.202013052","https://scholar.google.com/scholar?q=related:qDazyuKKLiAJ:scholar.google.com/&scioq=source:%22angewandte+chemie+international+edition%22+beta+elimination+dft&hl=en&as_sdt=0,5&as_vis=1"
35,"RD Adams, V Rassolov…","Facile C H Bond Formation by Reductive Elimination at a Dinuclear Metal Site",2014,"Angewandte Chemie …","Wiley Online Library","https://onlinelibrary.wiley.com/doi/abs/10.1002/anie.201406219","https://scholar.google.com/scholar?cites=12509211934535862018&as_sdt=2005&sciodt=0,5&hl=en",14,"2025-05-07 02:23:29","","10.1002/anie.201406219","","",,,,,35,3.18,12,3,11,"… reductive elimination of the bridging phenyl ligand and the bridging hydrido ligand. The mechanism of this elimination has been investigated and ascertained by DFT computational …","https://onlinelibrary.wiley.com/doi/pdf/10.1002/anie.201406219","https://scholar.google.com/scholar?q=related:AkcWUvqlma0J:scholar.google.com/&scioq=source:%22angewandte+chemie+international+edition%22+beta+elimination+dft&hl=en&as_sdt=0,5&as_vis=1"
489,"M Gulías, JL Mascareñas","Metal‐Catalyzed Annulations through Activation and Cleavage of C− H Bonds",2016,"Angewandte Chemie International …","Wiley Online Library","https://onlinelibrary.wiley.com/doi/abs/10.1002/anie.201511567","https://scholar.google.com/scholar?cites=788348897766483383&as_sdt=2005&sciodt=0,5&hl=en",15,"2025-05-07 02:23:29","","10.1002/anie.201511567","","",,,,,489,54.33,245,2,9,"… undergo a reductive elimination with concomitant cleavage … as III (path b), recent DFT calculations support a mechanism … reductive elimination (Scheme 32), or by reductive elimination …","https://onlinelibrary.wiley.com/doi/pdf/10.1002/anie.201511567","https://scholar.google.com/scholar?q=related:tyVxSiXH8AoJ:scholar.google.com/&scioq=source:%22angewandte+chemie+international+edition%22+beta+elimination+dft&hl=en&as_sdt=0,5&as_vis=1"
39,"P Xu, EU Würthwein, CG Daniliuc…","Transition‐Metal‐Free Ring‐Opening Silylation of Indoles and Benzofurans with (Diphenyl‐tert‐butylsilyl)lithium",2017,"Angewandte Chemie …","Wiley Online Library","https://onlinelibrary.wiley.com/doi/abs/10.1002/anie.201707309","https://scholar.google.com/scholar?cites=2054295337021355994&as_sdt=2005&sciodt=0,5&hl=en",16,"2025-05-07 02:23:29","","10.1002/anie.201707309","","",,,,,39,4.88,10,4,8,"… Dearomatization of the heteroarene core proceeds in the absence of any transition-metal catalyst through addition of a silyl anion and a subsequent stereoselective β-elimination. DFT …","https://onlinelibrary.wiley.com/doi/pdf/10.1002/anie.201707309","https://scholar.google.com/scholar?q=related:2jfmkrlSghwJ:scholar.google.com/&scioq=source:%22angewandte+chemie+international+edition%22+beta+elimination+dft&hl=en&as_sdt=0,5&as_vis=1"
122,"H Wang, C Jing, A Noble…","Stereospecific 1, 2‐Migrations of Boronate Complexes Induced by Electrophiles",2020,"Angewandte Chemie …","Wiley Online Library","https://onlinelibrary.wiley.com/doi/abs/10.1002/anie.202008096","https://scholar.google.com/scholar?cites=7402056068225320230&as_sdt=2005&sciodt=0,5&hl=en",17,"2025-05-07 02:23:29","","10.1002/anie.202008096","","",,,,,122,24.40,31,4,5,"… underwent syn elimination to provide alkenes 44 in high stereoselectivity. DFT calculations … atom, therefore resulting in a syn elimination pathway. This selenium-mediated olefination …","https://onlinelibrary.wiley.com/doi/pdf/10.1002/anie.202008096","https://scholar.google.com/scholar?q=related:JkUYusZiuWYJ:scholar.google.com/&scioq=source:%22angewandte+chemie+international+edition%22+beta+elimination+dft&hl=en&as_sdt=0,5&as_vis=1"
0,"A Huang, Z Liu, R Wang, X Chang, M Feng…","Halogen‐Atom Transfer Enabled Z‐selective Styrene Synthesis via Dual Cobalt and Photocatalysis through Coupling of Unactivated Alkyl Iodides with Terminal …",,"Angewandte Chemie …","Wiley Online Library","https://onlinelibrary.wiley.com/doi/abs/10.1002/anie.202501630","",18,"2025-05-07 02:23:29","","10.1002/anie.202501630","","",,,,,0,0.00,0,6,,"… cobalt catalyst, followed by β-H elimination to form alkenes would result in low efficiency.[71–… investigated by both control experiment and density functional theory (DFT) calculations. E-…","","https://scholar.google.com/scholar?q=related:Wa73oSrPOV8J:scholar.google.com/&scioq=source:%22angewandte+chemie+international+edition%22+beta+elimination+dft&hl=en&as_sdt=0,5&as_vis=1"
33,"MC Holland, R Gilmour, KN Houk","Importance of intermolecular hydrogen bonding for the stereochemical control of allene–enone (3+ 2) annulations catalyzed by a bifunctional, amino acid derived …",2016,"… Chemie International Edition","Wiley Online Library","https://onlinelibrary.wiley.com/doi/abs/10.1002/anie.201508980","https://scholar.google.com/scholar?cites=15665545114765271971&as_sdt=2005&sciodt=0,5&hl=en",19,"2025-05-07 02:23:29","","10.1002/anie.201508980","","",,,,,33,3.67,11,3,9,"… the basis of dispersion-corrected density functional theory. An intermolecular hydrogen bond … catalyzed by trace amounts of water is likely to be responsible for elimination of the catalyst. …","https://onlinelibrary.wiley.com/doi/pdf/10.1002/anie.201508980","https://scholar.google.com/scholar?q=related:o6NwQkgyZ9kJ:scholar.google.com/&scioq=source:%22angewandte+chemie+international+edition%22+beta+elimination+dft&hl=en&as_sdt=0,5&as_vis=1"
126,"BN Bhawal, B Morandi","Catalytic isofunctional reactions—expanding the repertoire of shuttle and metathesis reactions",2019,"Angewandte Chemie International …","Wiley Online Library","https://onlinelibrary.wiley.com/doi/abs/10.1002/anie.201803797","https://scholar.google.com/scholar?cites=6804585758882572712&as_sdt=2005&sciodt=0,5&hl=en",20,"2025-05-07 02:23:29","","10.1002/anie.201803797","","",,,,,126,21.00,63,2,6,"… -hydride elimination to give 8, alkene ligand exchange, insertion across the new alkene ligand, and reductive elimination from … This mechanistic proposal was supported by DFT studies. …","https://onlinelibrary.wiley.com/doi/pdf/10.1002/anie.201803797","https://scholar.google.com/scholar?q=related:qKngCbK-bl4J:scholar.google.com/&scioq=source:%22angewandte+chemie+international+edition%22+beta+elimination+dft&hl=en&as_sdt=0,5&as_vis=1"
17,"Z Jiang, SL Niu, Q Zeng, Q Ouyang…","Selective Alkynylallylation of the C− C σ Bond of Cyclopropenes",2021,"Angewandte Chemie …","Wiley Online Library","https://onlinelibrary.wiley.com/doi/abs/10.1002/anie.202008886","https://scholar.google.com/scholar?cites=5278000311017838186&as_sdt=2005&sciodt=0,5&hl=en",21,"2025-05-07 02:23:29","","10.1002/anie.202008886","","",,,,,17,4.25,3,5,4,"… DFT calculations afford a rationale toward the formation of the products and indicate that the … elimination promoted by 1,4-palladium migration are critical for the success of the reaction. …","https://onlinelibrary.wiley.com/doi/pdf/10.1002/anie.202008886","https://scholar.google.com/scholar?q=related:apaenlE5P0kJ:scholar.google.com/&scioq=source:%22angewandte+chemie+international+edition%22+beta+elimination+dft&hl=en&as_sdt=0,5&as_vis=1"
298,"Y Li, D Wu, HG Cheng, G Yin","Difunctionalization of alkenes involving metal migration",2020,"… Chemie International Edition","Wiley Online Library","https://onlinelibrary.wiley.com/doi/abs/10.1002/anie.201913382","https://scholar.google.com/scholar?cites=4632919832982889916&as_sdt=2005&sciodt=0,5&hl=en",22,"2025-05-07 02:23:29","","10.1002/anie.201913382","","",,,,,298,59.60,75,4,5,"… experiments and DFT calculations, the authors proposed that the mechanism involves an alkylPd(II) intermediate (68) which undergoes regioselective β-hydride elimination and …","https://onlinelibrary.wiley.com/doi/pdf/10.1002/anie.201913382","https://scholar.google.com/scholar?q=related:vKXOtQpwS0AJ:scholar.google.com/&scioq=source:%22angewandte+chemie+international+edition%22+beta+elimination+dft&hl=en&as_sdt=0,5&as_vis=1"
67,"Z Lei, A Banerjee, E Kusevska, E Rizzo…","β‐Selective aroylation of activated alkenes by photoredox catalysis",2019,"Angewandte Chemie …","Wiley Online Library","https://onlinelibrary.wiley.com/doi/abs/10.1002/anie.201901874","https://scholar.google.com/scholar?cites=15273642170948788033&as_sdt=2005&sciodt=0,5&hl=en",23,"2025-05-07 02:23:29","","10.1002/anie.201901874","","",,,,,67,11.17,13,5,6,"… then would undergo HCl elimination upon workup to liberate α,β-… Detailed DFT calculations provided additional insights into … Notably, instead of undergoing HCl elimination to give the …","https://onlinelibrary.wiley.com/doi/pdf/10.1002/anie.201901874","https://scholar.google.com/scholar?q=related:QR_UmaHg9tMJ:scholar.google.com/&scioq=source:%22angewandte+chemie+international+edition%22+beta+elimination+dft&hl=en&as_sdt=0,5&as_vis=1"
0,"S Li, C Hu, L Leo Liu, L Wu","Selective Hydroboration of C− C Single Bonds without Transition‐Metal Catalysis",2024,"Angewandte Chemie International …","Wiley Online Library","https://onlinelibrary.wiley.com/doi/abs/10.1002/anie.202412368","",24,"2025-05-07 02:23:29","","10.1002/anie.202412368","","",,,,,0,0.00,0,4,1,"… , as typical oxidative addition or β-carbon elimination associated with metal centers are essential for … We then conducted density functional theory (DFT) computations to shed light on the …","https://onlinelibrary.wiley.com/doi/pdf/10.1002/anie.202412368","https://scholar.google.com/scholar?q=related:xV8EnCs-19gJ:scholar.google.com/&scioq=source:%22angewandte+chemie+international+edition%22+beta+elimination+dft&hl=en&as_sdt=0,5&as_vis=1"
13,"M Lemmerer, H Zhang, AJ Fernandes…","Synthesis of α‐Aryl Acrylamides via Lewis‐Base‐Mediated Aryl/Hydrogen Exchange",2022,"Angewandte Chemie …","Wiley Online Library","https://onlinelibrary.wiley.com/doi/abs/10.1002/anie.202207475","https://scholar.google.com/scholar?cites=6734447806654635155&as_sdt=2005&sciodt=0,5&hl=en",25,"2025-05-07 02:23:29","","10.1002/anie.202207475","","",,,,,13,4.33,3,4,3,"… Intrigued by the elimination selectivity of 2 r, we performed … were performed at the density functional theory (DFT) level (… The subsequent E1cb elimination involves the cleavage of the …","https://onlinelibrary.wiley.com/doi/pdf/10.1002/anie.202207475","https://scholar.google.com/scholar?q=related:k9wOepmQdV0J:scholar.google.com/&scioq=source:%22angewandte+chemie+international+edition%22+beta+elimination+dft&hl=en&as_sdt=0,5&as_vis=1"
5,"J Liu, Y Yang, W Shi, ZX Yu","Metalla‐Claisen Rearrangement in Gold‐Catalyzed [4+ 2] Reaction: A New Elementary Reaction Suggested for Future Reaction Design",2023,"… Chemie International Edition","Wiley Online Library","https://onlinelibrary.wiley.com/doi/abs/10.1002/anie.202217654","https://scholar.google.com/scholar?cites=8220341410887267943&as_sdt=2005&sciodt=0,5&hl=en",26,"2025-05-07 02:23:29","","10.1002/anie.202217654","","",,,,,5,2.50,1,4,2,"… In this work, we report our density functional theory (DFT) … DFT calculations showed that this [4+2] starts from Au-… Au-Claisen rearrangement and reductive elimination. The Au-Claisen …","https://onlinelibrary.wiley.com/doi/pdfdirect/10.1002/anie.202217654","https://scholar.google.com/scholar?q=related:Z3ZewPWEFHIJ:scholar.google.com/&scioq=source:%22angewandte+chemie+international+edition%22+beta+elimination+dft&hl=en&as_sdt=0,5&as_vis=1"
23,"EH Denton, YH Lee, S Roediger…","Catalytic Carbochlorocarbonylation of Unsaturated Hydrocarbons via C− COCl Bond Cleavage",2021,"Angewandte Chemie …","Wiley Online Library","https://onlinelibrary.wiley.com/doi/abs/10.1002/anie.202108818","https://scholar.google.com/scholar?cites=15822723724299522560&as_sdt=2005&sciodt=0,5&hl=en",27,"2025-05-07 02:23:29","","10.1002/anie.202108818","","",,,,,23,5.75,6,4,4,"… As sterically bulky ligands favour reductive elimination by relieving steric crowding of the … The obtained conformers were subjected to additional density functional theory (DFT) …","https://onlinelibrary.wiley.com/doi/pdf/10.1002/anie.202108818","https://scholar.google.com/scholar?q=related:ANIEFmWbldsJ:scholar.google.com/&scioq=source:%22angewandte+chemie+international+edition%22+beta+elimination+dft&hl=en&as_sdt=0,5&as_vis=1"
1,"S Cattani, NK Pandit, M Buccio…","Iron‐Catalyzed C− H Alkylation/Ring Opening with Vinylbenzofurans Enabled by Triazoles",2024,"Angewandte Chemie …","Wiley Online Library","https://onlinelibrary.wiley.com/doi/abs/10.1002/anie.202404319","https://scholar.google.com/scholar?cites=18155531987167971957&as_sdt=2005&sciodt=0,5&hl=en",28,"2025-05-07 02:23:29","","10.1002/anie.202404319","","",,,,,1,1.00,0,4,1,"… Detailed mechanistic studies supported by DFT calculations fully disclosed the manifold of … The β-O-elimination step was considered for this analysis, identifying it as the point of …","https://onlinelibrary.wiley.com/doi/pdf/10.1002/anie.202404319","https://scholar.google.com/scholar?q=related:dYpjcyZo9fsJ:scholar.google.com/&scioq=source:%22angewandte+chemie+international+edition%22+beta+elimination+dft&hl=en&as_sdt=0,5&as_vis=1"
13,"D Mandal, TI Demirer, T Sergeieva…","Evidence of AlII Radical Addition to Benzene",2023,"Angewandte Chemie …","Wiley Online Library","https://onlinelibrary.wiley.com/doi/abs/10.1002/anie.202217184","https://scholar.google.com/scholar?cites=6960201562315536770&as_sdt=2005&sciodt=0,5&hl=en",29,"2025-05-07 02:23:29","","10.1002/anie.202217184","","",,,,,13,6.50,3,4,2,"… reaction paths using density functional theory (DFT) at the … of compound 2, with the elimination of iodine in the form of KI … species which is prone to the elimination of iodine (ΔG=−11.4 …","https://onlinelibrary.wiley.com/doi/pdf/10.1002/anie.202217184","https://scholar.google.com/scholar?q=related:grnvtnGal2AJ:scholar.google.com/&scioq=source:%22angewandte+chemie+international+edition%22+beta+elimination+dft&hl=en&as_sdt=0,5&as_vis=1"
